,Sysnet
6320,u grčkoj mitologiji boginja plodnosti koja se kasnije povezuje sa Persefonom kao boginja podzemnog sveta i zaštitnica veštica
8344,namotati na kalem ili špulnu
10558,Neka od evroazijskih biljaka iz roda Helleborus.
16552,naziv pod kojim je poznata kakva geografska lokacija
16522,zvanični državni jezik Nepala
9179,Prostor koji je unutar nečega.
16671,socijalista koji je napisao Komunistički manifest sa Karlom Marksom 1848. godine (1820-1895)
6836,Bilja nana.
11109,postati namočen
2044,osnovna novčana jedinica na Bahamima
15819,poslovni objekat za zabavu
7839,"Morska riba sa velikom i širokom glavom, crvenkaste boje sa otrovnim štrim bodljama."
12138,Sekvancija od 8 bitova (dovoljna da se predstavi jedan alfanumerički karakter) koja se obrađuje kao jedna jedinica informacije.
10830,grana antropologije koja pruža naučni opis pojedinačnih ljudskih društava
14625,dodeliti kome akademsku diplomu
15400,Ljudi koji dele neke društvene odnose.
4809,Glodar rovaciz starog i novog sveta koji uništava useve
16356,"esej, članak (posebno onaj napisan kao zadatak)"
4646,Red biljaka iz podklase Asteridae koja uključuje: Campanulaceae; Lobeliaceae; Cucurbitaceae; Goodeniaceae; Compositae.
15925,jedan od dva dela igre koje deli pauza
14870,Pravougaoni blok od gline pečene na suncu ili u peći; koristi se za gradnju ili popločavanje.
5188,pribor za pisanje koji ima vrh sa koga kaplje mastilo.
6874,Koji pripada ili se odnosi na naciju ili državu
14804,Federacija sedam arapskih emirata na istočnom Arabijskom poluostrvu; stekla nezavisnost od Ujedinjenog Kraljevstva 1971. godine; bogata rezervama nafte.
12654,Hleb koji sadrži fino mleveni crni luk.
222,Koji nema ili ne obavlja funkciju.
1526,Osoba koja uzgaja ili čuva ovce.
3002,Plovne kožice su razvijene i prelaze preko vrhova prstiju; zadnje udove mogu da saviju pod trbuh; imaju male ušne školjke.
10882,čin kojim se neko iskorišćava ili maltretira
13571,"Metvulja, ?horsemint, ?beebalm"
2088,algonkinski jezik kojim govore Čejeni
5414,prevlaka na severoistoku Egipta koja povezuje Egipat i Afriku
3966,Zimzeleno drvo sa crvenim bobicama and pljosnatim igličastim lišćem.
868,zaliv Atlantskog okeana na jugozapadnoj strani Afrike
16926,Broj ili niska brojeva koja se koristi za identifikaciju.
6043,toalet kakav je nastao u engleskoj
729,Knjiga koju koristite da biste dobili verodostojne podatke.
16750,"arhipelag na zapadu Sredozemnog mora, kod istočne obale Španije"
8175,"grane matematike koje se bave izučavanjem fizičkog, biološkog ili sociološkog sveta"
60,"Koji ima veseo karkater, nije sklon brigama."
17134,Živi u rekama ili priobalnim područjima.
15135,redni broj elementa u Mendeljejevoj tablici elemenata; jednak je broju protona u jezgru ili broju elektrona u neutralnom stanju atoma
11404,kamen koji se koristi za označavanje groba
9150,"Muzički instrument s metalnim žicama, vrsta lire."
2191,"Radioaktivni gasoviti element koji nastaje dezintegracijom radijuma, najteži od inertnih gasova, ima ga u prirodi, smatra se štetnim za zdravlje."
6308,Biljka poreklom sa Mediterana sa dubokim korenom; ima plave cvetove i peraste listove; gaji se zbog dugačkog slatkog korena.
209,Lepota koja je privlačna čulima.
16490,otvoreni prostor na vrhu kuće tik ispod krova;
6304,Rod iz familije Alligatoridae.
6383,u anatomiji brazda ili kanal na telesnoj  strukturi ili delu tela.
6898,meso odraslog domaćeg govečeta
1075,"uređaj koji se sastoji od skupa tastera ili dirki na pisaćoj mašini, slovoslagaćoj mašini ili računaru"
16676,Otpočeti razgovor s nekim.
4941,čin koji teolozi smatraju kršenjem Božje volje
14957,pretvoriti u dramski oblik
2670,Drveni duvački instrument (iako je od lima) s jednim jezičkom; u obliku lule; s mehanizmom za pokrivanje rupica.
462,Ustanova koja uključuje zemljište i opremu za pružanje obrazovanja od zabavišta do srednje škole.
11393,severni ogranak germanskih jezika kojima se govori u Skandinaviji i na Islandu
197,Motor koji pretvara toplotnu energiju u mehanički rad.
4990,Motor sa spoljašnjim sagorevanjem u kome se toplota koristi da podigne paru koja zatim pokreće turbinu ili klipove u cilindru.
15567,u rimskoj mitologiji boginja poljoprivrede; u grčkoj mitologiji joj odgovara Demetra
15402,mašina za kopiranje koja šalje poruku putem telefona ili radio signala
9065,beskrajna traka od fleksibilnog materijala između dva rotirajuća uređaja
3747,Službena kuća neke važne osobe (kralj ili predsednik).
14833,Orhideja umerenih i tropskih krajeva koja ima klasove belo-žutog cveća.
3976,afiks koji se dodaje na početak reči
1231,bilo koja od mnogobrojnih biljaka roda Rosa
5907,Jednogodišnja biljka sa belim cvetom i jajastim listovima.
2299,Visoka evroazijska trava koja ima žute cvetove nalika na belu radu sa uskim laticama čiki rizomatski koren se koristi u medicini.
1552,O pogrebu ili koji se odnosi na pogreb.
7112,mravlji jež
6238,ukazivač kao na brojčaniku
4337,štampač koji štampa pojedinačne stranice odjednom
7263,Merni instrument koji određuje količinu toplote.
4973,mali pregradak u odeći za nošenje malih predmeta
11902,u grčkoj mitologiji Agamemnonova žena koja je naložila da se on ubije po povratku iz Trojanskog rata
14292,pustinjsko područje na severozapadu Australije severno od Gibsonove pustinje
4372,produžiti rok da se šta plati
14152,"Biljka koja rađa veliki mesnati plod, blagog ukusa, zvonastog oblika."
15643,"organ, žlezda ili mišić, koji postaje aktivan kao odgovor na nervni impuls"
3423,"Zimzelen ili listopadni grm koji rađa bobice: borovnice, američka kljukva."
17409,reč ili fraza kojom se dopunjuje neka gramatička konstrukcija
10275,"Izdan je prirodna nakupnina slobodne podzemne vode koja može da ""izdaje"" vodu tj. da hrani izvore, reke, bunare i druge prirodne i veštacke vodne objekte."
11990,Tipski rod porodice Dipsacaceae: češljuga.
8207,"Rod visokih, uspravnih ili razgranatih američkih godišnjih ili veižegodišnjih zeljastih biljaka sa upadljivim cvetovima: suncokret."
14575,Neko divlje cveće iz roda Leontodon; raset u umerenim područjima Evroazije i Mediterana.
7462,Muzički instrument kod koga zvuk proizvodi zatvorena stub vazduh koji se pokreće disanjem.
14017,Sud koji je obično pleten i ima ručke.
13135,"koji se tiče Nigera, njegovih ljudi i kulture"
9231,"solarni kalendar koji je uveo u Rimu Julije Cezar 46 godine p.n.e. a zatim neznatno modifikovao Avgust; utvrđuje se godina od 365 dana koja je podeljena u 12 meseci, pri čemu svaka četvrta godina ima 366 dana, a svi meseci imaju 30 ili 31 dana, osim februara"
17132,Peščana zona koja se spušta do vode mora ili jezera.
40,Gledati nekoga sa divljenjem.
13176,Jedinica mere za masu.
13208,Rod iz porodice Accipitridae.
16133,osnovna novčana jedinica Islanda
3836,Uglavnom male višegodišnje paprati - papratka; u nekim klasifikacijama smeštaju se u Polypodiaceae.
16652,ogromno istočno indijsko voće koje podseća na hlebno drvo; njegovo semenje se najčešće peče
1567,udruženj ekoje je osnovano i radi na dobrobit onih koji ga koriste
15432,"osobina nekih tela da u raznim smerovima imaju različita fizička svojstva, npr. elastičnost, indeks odbijanja svetlosti, magnetizacija, toplotna provodljivost i dr."
4618,uređaj čiji je list perforiran i kroz čije proreze mastilo ili boja prolaze da bi stvorili odštampani otisak
5373,mali deo koji može da se posmatra odvojeno od celine
7079,Drugo ime koje se u nekim klasifikacijama koristi za porodicu Mimosaceae.
54,svaka šteta proistekla iz povrede prava
6748,"Ptice koje plove, plivaju i rone bilo u slanoj ili slatkoj vodi."
4901,plodovi mora u Njuburg sosu posluženi na tostu ili pirinču
17291,Škola u kojoj ljude uče da upravljaju automobilom.
10603,Ispraznti nešto od tečnosti.
8650,dull-colored moth whose larvae have tufts of hair on the bodž and feed on the leaves of many deciduous trees
7456,grupa ljudi koja živi po pravilima vere
17222,"Porodica iz starog sveta iz roda Scilla koja ima usko lišće i ružičaste, plave ili bele cvetove."
32,ono što je ispod standarda i očekivanja u pogledu morala ili pristojnosti
6528,tražiti of nekog identifikaciju da bi se proverilo da li je dovoljno star da može konzumirati alkohol
12996,Osoba koja je šef džžave (u nekoliko zemalja).
6819,piće stvoreno pomoću magičnih moći; može da učini da onaj ko ga popije zavoli onoga ko mu ga je dao
10518,praksa kooperacije u kojoj se dvoje ili više ljudi udružuje radi međusobne pomoći ili sigurnosti
49,osnovna nočana jedinica u mnogim zemljama; vrednost joj je 100 centi
227,have or feel a dislike or distaste for
6258,Kost kod gležna koja pomera kosti noge oko gležnja.
7765,novčana jedinica Saudijske Arabije
14141,Staklena cev zatvorena na jednom kraju.
7465,Društveni ili samostalni opnokrilac koji obično ima tanko telo sa abdomenom koji je prikačen uskom batrljicom uočljivom otrovnom žokom.
10145,pomalo gorka biljka listova tamnije zelene boje i grupisanih pupoljaka
3396,Putovanje na sveto mesto.
275,veličina čija se vrednost ne menja
7717,"Trava upadljivo jakog mirisa koja pravi travni pokrivač, raste po evropskim pašnjcima, u živicama i pustopoljinama; lekovita biljka."
9821,"u računarstvu, arhitektura računara koja ima relativno mali broj instrukcija ugrađenih u čim CPU"
16920,(odnosi se na zvukove ili glasove); proizvodi visok ton
1106,koji se tiče unutrašnjih stvari nacije
1384,biti nepokretan.
6526,"Lasice, samur"
5212,Sivkasta grlica sa crnom trakom oko vrata; čest se čuva u kavezu.
5255,"u računarstvu, sibol koji se pojavljuje na na ekranu da ukaže da je računar spreman da primi komandu"
8517,Pstonica i najveći grad u Mađarskoj; smešten na reci Dunav u severno-centralnoj Mađarskoj.
7271,"plastična kartica koja sadrži mikroprocesor koji omogucćava vlasniku da obavi operacije koje zahtevaju podatke uskladištene u u mikroprocesoru, obično se koristi za obavljanje finansijskih transakcija"
15720,u grčkoj mitologiji Muza istorije
11728,amblem koji ukazuje na pravo neke osobe da nosi oružje
11557,korisnički interfejs u ​​kome se komande ukucavaju umesto da se biraju iz menija ili da se izabere ikona
4894,koji se odnosi na drevne Teutonce i njihov jezik
969,Porodica dvosupnica iz reda Urticales uključje rodove: Ulmus; Celtis; Planera; Trema.
4103,"dobro začinjene loptice od mleveni ribe, jaja i prezli prženih u šerpi"
12851,tortilja od brašna koja se u koju se uvija punjenje ili fil
15371,vodeni drozd
9744,Pravi se od vazdušastog (lisnatog) testa.
1707,tanka metalna pločica koja se koristi da razdvoji redove slova u štampi
861,deo grada u kome se vrši prodaja robe
2756,mali komad mikrofilma na koji se smešta mnogo stranica fotografsianog materijala; sistema za uvećavanje se koristi da bi se materijal pročitao
10194,Morske vidre.
2493,"Primarno suženje na hromozomu koje spaja sestrinske hromatide. Na centromeri se nalazi proteinska struktura, kinetohor, koja se formira na početku mitoze i ima ulogu da veže hromozom za deobno vreteno. Ona usmerava kretanje hromozoma za vreme deobe pošto se za nju vezuju konci deobnog vretena."
4720,pravni odnos koji postoji kada se jedno lice opravdano oslanja na drugo ili kada se traži zaštita po bilo kom osnovu
9357,donje rublje koje se sastoji od široke haljine koja je dizajnirana da je u krevetu nose žene
13715,tipski rod porodice Balaenicipitidae: beleniceps
4939,a plant of the genus Aquilegia having irregular showy spurred flowers; north temperate regions especially mountains
17057,hemijski element iz grupe zemnoalkalnih metala
161,Pristajanje uz ono što je opšte prihvaćeno.
1344,popis kojim se reklamira seme u komercijalne svrhe sa cenama
2054,dravidski jezik kojim se govori u južnom delu centralne Indije
2142,napraviti manje ili više otvorenu aluziju na nešto
16539,električni prekidač koji funkcioniše pritiskom na dugme
9665,Jedna vrsta: oleander.
14252,tkivo koje se formira u osnovi nokta
14164,Postati suv ili suvlji.
13685,šiber kojim se mere male razdaljine
8697,"najduža engleska reka, plovi na istok, kroz London ka Severnom moru"
7820,Povrće čiji cvet ima oblik leptira; obiyno se uključuje u porodicu Leguminosae.
7037,Ravna površina koja je pod pravima uglaovima u odnosu na okomitu liniju.
8340,Krupna penjačica koja se gaji zbog mesnatog narandžastog okruglog ploda sa čvrstom korom i brojnim semenkama.
17164,glavni izvor berilijuma; obojeni providni varijeteti su na ceni kao drago kamenje
9662,Samo jedna vrsta: brnistra.
3519,velika crna ptica neletač Australije i Nove Gvineje koja ima rožnatu krestu na glavi.
11495,Čin u kome nešto gori
12198,Poklapa se sa redom Pholidota.
1968,"Odnosi među živim organizmima, a posebno ljudima."
16167,Ptica koja se lovi iz starog i novog sveta iz familije ?; nastanjuje močvarna zemljistxa; nalikuje detliću?
15174,Jedna od četiri države koje čine Ujedinjeno Kraljevstvo Velike Britanije i Severne Irske; smeštena na severnom delu ostrva Velika Britanija; poznata po gajdama i kiltovima.
16751,"uglavnom morske aneldie, imaju oba pola..."
11622,pismo bazirano na alfabetskim karakterima
7887,Podvrgnuti pretrazi.
3147,"Sfinkter  bešike, sastavljen od zgusnutog mišićnog sloja bešike oko otvora uretre."
57,Nešto što nekoga zadržava.
13166,pretvoriti u krečnjak
10400,propisani broj
5307,Rod? koji pripada familiji Pteridaceae.
15884,"Biti u skladu, harmoniji."
750,Jedna od porodica u koje je porodica Polypodiaceae podeljena u nekim klasifikacijama; uključuje rodove: Blechnum; Doodia; Sadleria; Stenochlaena; Woodwardia.
2696,New World vipers with hollow fangs and a heat-sensitive pit on each side of the head
5126,"Čupava uspravna zeljasta biljka iz jugoistočne Azije, ali je rasprostranjena u svetu zbog velikog sjajnog i jestovog ploda koje se koristi kao povrće."
202,flamingosi
14422,Velike magmatske stene koje su nastale duboko u zemlji.
15258,koji se osnosi ili je karakterističan za Egipat ili njegove ljude i njihove jezike
8724,indijski prilog od jogurta i seckanih krastavaca i začina
15741,"Riba iz tropskog Tihog okeana, sa živim prugamaizduženim bodljikavima perajima."
5463,haljina koju nose prvenstveno žene u Indiji - sastoji se od nekoliko metara lakog materijala koji je obmotan oko tela
3707,"pravi se od bujona sa sočivima, lukom, šargarepom i celerom"
11767,irokeški jezik kojim govori narod Kajuga
15769,Vodena površina okružena zemljom.
10476,stoni digitalni računar za koji se obično smatra da je većih mogućnosti od mikroračunara
7356,Neko ko profesionalno radi fotografije.
11584,Kupina puzavica severnik umerenih područja sa žutim ili narandžastim bobicama.
11198,materija koja ima sposobnost ili tendenciju da adsorbuje drugu materiju (adsorbat)
16156,sistem koji se sastoji od mreže komunikacionih kanala koje se koriste u nekoj organizaciji
13851,"ubiti svakog desetog, kao pobunjenike u rimskim vojskama"
132,Koji se protivi pravilima ili usvojenoj praksi.
683,Veliki aligator sa jugoistoka Sjedinjenih država.
13125,Saviti ili poleći tako da jedan deo prekriva drugi.
12370,kome je jedna dimenzija značajnije veća od druge; značajnije duži nego širi
3603,Federacija u severoistočnoj Evropi i severnoj Aziji; ranije Sovjetska Rusija; od 1991. godine nezavisna država.
4913,"Republika u jugoistočnoj Aziji na arhipelagu sa više od 13,000 ostrva; stekla nezavisnost od Holandije 1945. godine; glavni proizvođač ulja na Dalekom istoku i u regionu Pacifika."
17069,Veliki ord dekorativnih biljaka sa? glavama cvetova; raširene po celom svetu.
14835,meko meso u predelu krsta sa obe strane kičmenog stuba
7081,priča o nekom ko istražuje zločin i dolazi do dokaza koji vode do rešenja
7993,preterano velik
6975,novčana jedinica Južne Afrike
756,Drvo tise; vrlo je cenjeno za fine stolarske radove i rezbariju.
6205,jabuka za jelo koja podseća na vrstu Mekintoš; koristi se i za jelo i za kuvanje
8195,"tajna (metoda, uređaj ili formula) koja proizvođaču daje prednost nad konkurencijom"
4303,Čovek koji voli mnogo žena i sa njima ima kratke seksualne odnose.
4957,Čvrsta? sa belim cvetovima koja raste u divljini u plitkim svežim vodama Sjedinjenih američkih država i Azije.
9839,koji se odnosi na utopiju ili liči na nju
15522,"Brašno koje se dobija mlevenjem celog zrna žita, uključujući i opnu."
13705,polica za držanje knjiga
10128,Kopneni glavonošci čije se telo sastoji od brojnih dvostrukih članaka od kojih svaki ima par nogu: stonoge.
5019,koji se koristi u obredu žrtvovanja ili je povezan sa njim
4519,(o kosi) koji ima talasastu kosu;
53,uređaj koji isporučuje električnu struju kao rezultat hemijske reakcije
797,Bilo koji lek koji uništava bakterije ili sprečava njihov rast.
2017,skoro izumrli kavkaski jezik kojim se govori samo u Turskoj
534,dozvola za ulazak ili izlazak iz vojne ustanove
12622,vlasnik novina
1788,a diacritical mark (an inverted circumflex) placed above certain letters (such as c) to indicate pronunciation
2414,olovka čiji je vrh za pisanje napravljen od filca
2571,Listopadno drvo ili žbun iz Severne Amerike.
1291,"ptica; barske ptice dugih nogu, tankog, dugačkog i na kraju zaobljenog kljuna, zemljaste boje perja i vrlo ukusonog mesa iz reda štakara"
7954,nilotski jezik
2411,glavni i najveći grad Gane
4433,Seme koje se uglavnom koristi kao začin.
3771,korateanski jezik naroda Karok
4622,porodica južnoameričkih indijanskih jezika kojima se govori na severoistoku Južne Amerike
10670,osnovna novčana jedinica Gvatemale
11238,Naziv koji označava plemstvo.
1026,"iznenadni, kratak (poput strujnog udara) nevoljni trzaj koji nastaje u centralnom (ređe perifernom) nervnom sistemu."
9678,novčana jedinica Gane
6603,Tipski rod porodice Odobenidae: morževi.
10188,"krsta kod četvoronožnih životinja, deo tela iznad zadnjih nogu"
7523,Biti u mogućnosti odreći se nečega ili ga pokloniti.
5575,član ruske većinske levičarske grupe koja je sledila Lenjina i iz koje je nastala Ruska komunistička partija
16870,jabuke koje se najčešće jedu nekuvane i nepečene
10449,Godišnje doba kada lišće opada sa drveća.
16556,indikator za opštu orijentaciju
12035,Mali rod godišnjih zeljastih biljaka: koljenika.
14127,stvarati muzičko delo
8732,Merni instrument konstruisan da meri snagu.
645,jedan od dva korena spinalnog nerva koji prolazi dorzalno u kičmenoj moždini i sastoji se od senzornih vlakana
13411,"Olabaviti, recimo nešto stegnuto."
16702,Mala fleksibilna cev koja se ubacuje u telo da bi se omogućilo oticanje ili ubrizgavanje tečnosti ili da bi prolaz ostao otvoren.
3708,glavni grad i najvažnija luka Mauricijusa
4069,Bilo koja gljiva iz familije Boletaceae.
7335,ulica u kojoj je vozilima dozvoljeno da se kreću samo jednim smerom
16703,Jedinjenje opisano u kategorijama centarlnog atoma za koji su drugi atomi vezani ili usklađeni.
12681,provodnik koji se koristi da ostvari kontakt se nekim delom kola
14984,"ogranak Sredozemnog mora izmađu Slovenije, Hrvatske, Crne Gore i Albanije na istoku i Italije na zapadu"
1473,Voće kuvano u šećernom sirupu obloženo kristalima šećera.
1163,piće slično pivu; napravljeno od fermentisanog soka manioke
14472,"Slatki varijetet šljive, zelen ili zeleno žut."
1287,Kretati se prema nekome ili nečemu.
14291,"Osoba koja pomaže identifikovanje, prevenciju ili lečenje bolesti ili nemoći."
13491,"onaj koji odgovara određenoj osobi, mestu, stanju i sl."
8144,Neki rod reptila.
13926,Jedna od raznih vrlo cenjenih jestivih podzemnih gljiva roda Tuber; raste u jugozapadnoj evropi.
6236,"Osoba određene vrste, koja obično ima puno ekscentričnosti."
5550,Drvo nekog drveta iz roda Cupressus.
834,loptasto ili ovalno južno voće sa debelom riđkastom koricom i sočnim žutim ili crvenim mesom
8065,utvrđeni sistem simbola koji se koristi za zapisivanje nečega
1161,Umetnik koji se pridržava klasicizma.
5545,prebacivanje nečega u formu romana
14110,Mali predmet koji deo kompleta koji se koristi za igre na tabli.
15657,akti koji se nešto čini optimalnim
14815,shrikes that impale their prey on thorns
88,Nešto određeno prema nečem drugom što ga sadrži.
7605,"Razred dikotiledona koji uključuje porodice Moraceae, Urticaceae i Ulmaceae."
16143,punč napravljen od zašećerenog mleka ili pavlake pomešan sa jajima i često alkoholnim pićem
2388,bilo koji period u toku koga je površina Zemlje bila prekrivena ledom
1615,turkijski jezik kojim govore Tatari koji žive između Volge i Urala
4849,Čin stanovanja na jednom mestu.
15322,u klasičnoj mitologiji bog muške plodnosti i zaštitnik bašti i vinograda
10981,stanovnik Jermenije ili poreklom iz nje
14065,rožnata ploča koja pokriva i štiti dorzalni deo prstiju
9434,"u računarstvu, mreža povezanih računara"
10928,Tipski rod porodice Scorpaenidae: škrpine.
7318,meso sitne živine koja se gaji za pečenje
6650,grupa koralnih ostrva u istočnoj Mikroneziji
6299,izumrla grana indoevropskih jezika koju neki smatraju srodnom sa jermenskim
1527,Novac koji se ulaže uz očekivani profit.
17171,Tipski rod porodice Moraceae: dud.
5042,mladi radikal koji podstiče reformu
10397,mali list papira
16694,Rod trava nalik na trsku čije klasje je načičkano u? prekriven sugačkim svilenkastim nitima.
157,Ućiniti da se neko oseti opuštenim.
2065,proces zatvaranja (kao u kapsulu)
6259,Ostrvska zemlja u Persijskom zalivu uz obalu Saudijske Arabije.
7397,licenca kojom se omogućava bavljenje određenom profesijom
8254,Čin konstruisanja ili građenja nečega.
9415,ljuta zelena ili crvena paprika iz jugozadapdnog dela SAD i Meksika
11989,Vojna jedinica koja je dovoljno velika da izdrži borbu.
4457,uglavnom tropske biljke: uključuje Dracenaceae (Dracaenaceae); uključuje bilje koje su u nekim klasifikacijama podeljene između Amaryllidaceae i Liliaceae
2560,odrezak od odrasle ovce
5692,Staviti ili ubaciti u nešto.
11616,sir koji sadrži plave plesni
16968,"Nešto što se ponovo događa, posebno u pravilnim intervalima."
8304,metod književne kritike kojim se analiziraju detalji teksta da bi se otkrili njegova struktura i značenje
15677,teorija koja objašnjava naučna posmatranja
955,Mali rod raznovrsnih penjačica iz Evroazije: grašak
1352,"Ogoliti zid od tapeta, na primer."
10312,kameni ili metalni obejkat koji predstavlja ostatak meteora pošto je udario u zemljinu površinu
6464,osoba sa svetlom kožom i kosom
10614,Ovce
10661,"Faza u psihoseksualnom razvoju kada je interes deteta  koncentrisana na analne regije; fiksacija u ovoj fazi je rekao dmože da  dovede do urednosti, zlobe, tvrdoglavosti, kompulzivnosti."
9518,Riba iz reda Crossopterygii; Većina je poznata samo kao fosili.
4898,tako sa pilećim punjenjem
3722,vrata koja predstavljaju zaštitu od insekata
14133,znak koji ukazuje na to da se naglasak nalazi na datom slogu
157,morska jestiva riba severnog Atlantika i severnpg Pacifika; najveća plosnatica i jedna od najvećih košljoriba
8988,Otvor tegle ili boce
4317,kopehanski jezik kojim govori narod Vintun
7699,podeljena suknja
4640,istočni romanski jezik kojim se govori u Rumuniji
9106,hard-shell clams
16385,"duhovit, satiričan stih koji obuhvata dve rimovane strofe i pominje poznate ličnosti"
17231,Ići gore ili napredovati.
3886,metal koji ima četiri alotropna oblika; koristi se u velikom broju legura
7016,Čin provođenja kontrolisanog testa ili istrage.
11290,staviti seme u ili na (zemlju)
9503,glavni grad Vijetnama smešten u Severnom Vijetnamu
6984,signal koji uključuje vizuelnu komunikaciju
16833,beli mekani kompaktni talkkoji se koristi za otklanjanje masnih fleka i za označavanje odeće
3795,"Nečista vrsta kvarca, poludragi kamen, koristi se u proizvodnji nakita i u tehnici."
8049,Period koji se provede u spavanju.
6456,broširana periodična publikacija kao fizički predmet
11066,Komercijalna aktivnost uključena u izgradnju građevina.
12723,Među muzičkim instrumentima onaj koji ima najniži zvuk.
13082,(računarstvo) operacija pristupa informacijama iz memorije računara
5767,napraviti sastavljanjem iz delova
11482,gusta kaša koja se pravi od kukuruznog brašna u proključaloj vodi
13133,koji se odnosi na padež kojim se izražava obraćanje
5258,Rastegnuti se kao od unutrašnjeg pritiska.
6953,stavka u budžetskom zakonu
4336,elektrostatički štampač koji koristi laserski zrak da prenese sliku na papir
7206,Republika u jugoistočnoj Evropi na jadranskoj obali Balkanskog poluostrva.
11531,osoba koja je zadužen za uredničke aspekte publikacija; osoba koja određuje konačan izgled teksta (posebno u novinama i časopisima)
7618,"vreme koje je potrebno da nešto padne na polovinu prvobitne vrednosti  (posebno, vreme potrebno da se polovina atoma radioaktive supstance dezintegriše)"
9140,Napitak koji se sastoji od primese mlevenih zrna kafe.
290,novinski pisci i fotografi
11234,grana zoologije koja proučava ribe
525,vršiti pomazanje ili miropomazanje (upražnjava se pri religijskoj ceremoniji blagosiljanja)
824,meteorologija klime i klimatskih fenomena
11798,Smanjenje ekonomskih aktivnosti što ima za rezultat pad cena.
4109,zemljišne bakterije koje pretvaraju nitrite u nitrate
9381,verovanje u jednog Boga
8204,američko amber-drvo
4251,"evropski labud, često pripitomljen"
12373,Neko ko pokušava da probrati druge u drugu veru ili dkotrinu.
6970,region u obliku polumeseca koji se nalazi uz donji rub nokta
8524,"Listopadno drvo sa glatkom korom, obično srebrnastosive boje; lipe."
5949,vrsta malog raka koji se obično kratko kuva
3839,magadi jezik kojim govore Bengalci; zvanični je jezik Bangladeša i Bengala
12739,koji je karakterističan za ili koji odražava takav oblik vlasti u kome je vlast podeljena između jedne centralne i nekoliko regionalnih uprava
2942,prirediti interlinearni prevod reči ili izraza
15995,pripada velikoj klasi siloksana koji su obično stabilni na različitim temperaturama
12114,povećanje gustine
1905,Zrikavci
