,Sysnet
257,nepravedan postupanje prema neki osoba ili grupa na osnova predrasuda . 
14670,vretenast bakterijski ćelija naročito proširen u centralni delo gde jesam endospore 
10319,majanski jezik koji govoriti narod Jukateka 
11718,ukloniti neželjen supstanca iz nešto . 
10533,"smanjiti se po veličina , opseg ili rastojanje . "
5956,prenositi nešto ili neki ; obično na velik udaljenost . 
5932,brazilski orah 
69,tražiti uz pomoć neki natprirodan znak 
15525,kremasti beo sos koji sadržati ren i senf 
2146,mali rod evroazijski žbunje sa žut cveće i plod poput mehur . 
3261,"stav zasnovati na činjenica , želja , mogućnost i sl . koji prenositi glagol ili klauza "
8082,vreme koji proći dok se odvijati neki događaj 
12147,koji se odnositi na particip ili koji jesam formirati od participa 
9962,osnovni novčan jedinica Uzbekistan 
665,Taksonomska grupa biljka koji odgovarati phylumu ( red ) ( u bilogiji ) . 
13428,Voćna štangla koji sadržati džem od kajsija . 
2250,rebroliki deo koji podupirati ili ojačavati životinja ili biljka 
10055,prednji deo ljudski noga između koleno i članak . 
5986,mašina koji sabirati broj 
10688,"Poljska stenica , prav stenica ; uključivati podred Heteroptera ( prav stenica ) i Homoptera ( cikada , cvrčak ) . "
4443,neki od mnogi tropski aromatičan biljka star svet ; godišnji ili višegodišnji trava iz rod Ocimum . 
4398,"medalja od bronza , ili koji izgledati kao da jesam od bronza , koji se obično davati neki ko jesam treći na neki takmičenje . "
17154,osnovni novčan jedinica Gan 
16935,narandžast koren ; važan jesam izvor karotena 
16564,medicinski postupak koji uključivati zasecanje upotreba instrument ; obavljati se da biti se popraviti oštećenje ili zaustaviti bolest živ organizam . 
13656,Višegodišnje močvaran biljka sa tvrd i sabljast list . 
3120,voden površina odvojen od velik površina peščan ili koralni sprud 
16471,snabdeti odeća ili odenuti 
5287,na ili blizu severni pol 
14509,danski autor poznati po svoj bajka ( @card@ ) . 
13618,"ukrasni dugačak uzak vrpca koji uglavnom samo muškarac nositi oko vrata , ispod kragna od košuje , i vezivati jesam u čvor . "
16235,istočni podgrupa malajsko-polinezijskih jezik 
8301,podrška za prikazivanje različit objekt 
7160,ravan ploča koji kontrolisati ili usmeravati protok fluid ili energija 
6254,tvrd i gladak mineral izgraditi od silicijum dioksid u kristalan rešetka . 
5746,"postati židak ili tečan ; o čvrst tvar , kada se zagrejati . "
14553,osoba nemački nacionalnost 
6262,obično punjen i pečen 
2162,Žičani instrument koji imati tipka . 
5076,dugačak i često iskriviti ljut crven paprika 
6689,"otrovan beo materija ( Pb [ CH3CO ] @card@ ) koji se koristiti za izbeljivanje pamuk , za pravljenje emajl i lak "
7320,ugao između upadan zraka i praviti koji jesam upravni na odbojan površ u tačka odbijanje 
14784,stanje telo ili telesni funkcija . 
2971,"pica sa paradajz , sir i feferon "
2412,rod iz familija Piperaceae : velik rod uglavnom biljka penjačica iz tropski predeo . 
2427,preobratiti od divalj 
16560,"pića napravravljeno od mešavina sastojak ( kao što jesam šljiva , grožđice , mleko i šećer ) koji moći biti fermentisani tako da proizvesti alkohol ; praviti jesam ga zatvorenik "
14445,"srebrnosiv metal , sastojak redak mineral ; koristiti se u legura magenezijuma i aluminijum "
9330,referisati se na nešto . 
13757,"u neki klasifikacija uključivati Viscaceae : parazit ili poluparaziti , malo drveće ili grmlje u tropski ili umeren predeo ; za domaćin se kačiti pomoću ? "
11987,"azijski reka , ulivati se u arapski mora , dugačak 3200km "
13398,čin koji se nešto smanjivati dužina 
11770,kontrolni karakter koji označavati pomeranje kursora ulevo 
1981,velik reka u severni Sibir ; ulivati se u Opski zaliv u Karskom mora 
14120,ukupno izbrojati veličina . 
15025,iseći i sakupiti deo šta 
1725,ukupnost prošli događaj . 
9077,kartica na koji se podatak beležiti uz pomoć ubušenja 
11556,ispit koji se polagati na kraj akademski godina ili polugođe . 
4782,stanovnik Koreja ili poreklo iz Koreja 
3758,"postati jedinstven celina , integrisati se "
2977,sup koji sadržati komadić testo u oblik slovo abeceda 
136,osoba koji se odmarati 
8232,list biti koji biljka iz porodica Lactuca sativa 
376,iznenadan konstrikcija šupalj organ ( kao sto jesam krvni sud ) . 
6766,neki od raznovrstan velik jestiv riba i riba za lov severni morati ; obično se slei iz slana u sladak voda kada polagati jaje . 
12783,motorni testera sa fin zubac i uzak sečivo za sečenje zaobljen oblik 
11105,koji se ticati Fidžijam negovih ljudi i kultura 
4582,novčan jedinica Honduras 
2133,"u računarstvo , @card@ karakter koji činiti ASCII kodni šema . "
9225,tkanina koji se praviti od pamučan vlakno 
2654,oblik reč koji se nalaziti na početak rečnički članak i alfabetizuje se u rečnik 
2804,"( knjiga ) povezati tako da jesam hrbat u jedan , a strana u drugi vrsta povez "
10983,"beo tvrditi metal iz grupa platinski element i veoma jesam redak u priroda ; dobijati se kao nusprodukt pri proizvodnja nikl , a koristiti se kao katalizator "
12501,digitalan računar srednji veličina 
5155,osoba iz vaš zemlja 
15074,Geološka svojstvo zemlja . 
2924,oprema za snimanje koji koristiti magnetan traka . 
14326,član politički partija desni usmerenje 
4520,asocijacija država stvoriti radi ekonomski i politički saradnja država jugoistočni Azija 
3683,jedinica za dužina koji iznositi jedan desetina metar 
5715,grupa ostrvo u Bizmarkovom arhipelag 
10224,trava ; šaš ; ? rushes . 
9215,program koji se koristiti u biblioteka 
9190,pustiti krv . 
16994,rod stomačni bakterija 
16946,zaštita za nečiji stopala 
16765,strog rimokatločki red koji jesam osnova Sveta Bruno @card@ 
5399,tikva 
16588,mesnat podzeman stabljika ili koren koji imati reproduktivan uloga i služiti kao spremište hrana . 
103,"koji se lako upravljati , koji ustupati . "
11786,član nomadski Berbera iz Sahara 
12952,mikser sa električni pogon koji vitlati sečivo koji mešati ili sipati ili rastvarati hrana 
12612,"svaki pisan simbol koji predstavljati glas , slog , morfema ili reč "
14282,štampan kola koji moći da se prikopčati na računar da biti on se uvećati mogućnost 
3301,dug vremenski period 
7807,biti koji baštenski biljka iz rod Alyssum koji imati grozdov mali žut i beo cvetić . 
6230,Sloboda pojedinac da koristiti svoj prava garantovati zakon država . 
5565,smanjenje cena namenjen poboljšanje platni balans 
7863,relativno dug i uzak komad nešto 
3516,drvo iz jugoistočni Azija koji imati jestiv ovalan plod sa tvrd podljikavom kožica . 
7384,vrsta crven jabuka 
1603,povezati ili spojiti dva ili više delovati . 
11979,vojni ustanova gde jesam stacioniran trupa 
8587,biljka iz rod Barbarea : evroazijski dragušac sa žut cvet koji se gajiti kao zimski salata . 
14424,glavni grad Kiribati 
7245,"velik rod čupav ili vunast trava ili žbunje , prostirati se uemrenim zona istočni hemisfera ( tropski Australija ) . "
10426,prekidač koji se koristiti za selektovanje između alternativa 
11256,u grčki mitologija mitski čudovište sa glava bik i telo čovek ; ubiti ga jesam Tezej 
7568,neki ko imati master sa kakav akademski institucija 
3950,marširati u znak protest ; učestvovati u demonstracija 
7826,rečni patak dug vrata koji imati izdužiti repni pero 
850,"mali zver sa crnm griva ; živiti u srednji Afrika ; danju spavati , a noću loviti . "
261,biti šta u sklad sa princip pravda 
48,Ići ili putovati sa neki . 
319,protivno zakon ili zakon zabraniti 
11170,"deo Sredozemnog morati , između severozapadni Italija i Korzika "
5576,jedinica dečak ili devojčica izviđač 
6928,u neki klasifikacija uključivati rod Bs ; bivo 
6290,"u računarstvo , unutrašnji memorija velik brzina koji se koristiti za privremen skladištenje preliminaran informacija "
825,materijal koji se koristiti za izgradnja zgrada . 
792,Kolač koji se sastojati od dva lagan kor između koji jesam žele smesa . 
802,test dati bez prethodan upozorenje 
8683,( mineralogija ) šestokraka zvezdast figura koji se viditi u neki kristalan struktura pod reflektovan ili prenet svetlo 
16923,"grupa silikatni mineral različit sastav i vrlo savršen kalavosti , izgrađivati mnogi stena "
16136,"jedan od poznat mehanizam odbrana koji se sastojati od težnja i sklonost osoba da svoj želja , impuls ili sadržaj podsvest koji jesam prihvatljiv za sopstven ego , projektovati na drugi osoba pripisivati ona sličan osobina "
5963,primeniti sila tako da se izazvati kretanje prema izvor kretanje 
13348,neformalan obrok koji se kuvati i jesti napolju 
2674,severozapadni deo crven mora koji se povezivati sa sredozemni more preko suecki kanal 
14395,"koji se ticati Irak , nexgovih ljudi i kulure "
219,listopadan ili zimzelen drveće ili žbunje : bekovina . 
2860,"rod godišnji zeljast biljka , vrlo dlakav ; od Mediteran do jugozapad Azija . "
5635,pređen put u jedinica vreme 
12763,učenje koji trebati da obezbediti opšti znanje i intelektualan veština a ne zanimanje i profesionalan veština 
14822,"neki od različit uređaj za regulisanje dotok tečnost ili gas , pritisak , temeperature , itd . "
14490,vrsta predjelo ; posoljen i dimljen losos 
13104,"Veća od dva visok ptica trkačica koji jesam sličan noj , ali imati tri prst ; živiti od Brazil do Patagonije . "
10403,mali alka kratak kljuna koji imati mnogo u arktički predeo 
9979,grupno odbijanje da se pribeći nasilje čak i u samoodbrana . 
6477,"vrsta ječam , divalj jeyam . "
11152,grana neuronauke koji izučavati mozak 
7733,osnovni kapacitet i oprema potreban da biti zemlja ili područje funkcionisati . 
9447,imati vrlo razviti kožan izraslinena nos u oblik potkovica i lista ; nemati ušni poklopac . 
1850,šupljina u lobanja u koji jesam smestiti očni jabučica 
1221,slatkovodni patak s pljosnat kljuna 
5246,verovanje ili raspoloženje zajednički većina ljudi : glas narod . 
4362,beo metal koji gora jarki svetlost ; peti element po zastupljenost u zemljin kora ; važan komponenta većina biljka i životinja 
9848,osnovni novčan jedinica Makao 
9817,koji se odnositi ili jesam izraziti pravopis 
14532,sistem koji uključivati sav organ koji učestvovati u reprodukcija i u nastanak i iybacivanju urin . 
167,lekar specijalista u medicinski dijagnostika . 
9451,koktel od tekile i tripl seka sa sok od limun i lajma 
10989,što nuditi osnovni podatak ili uputstvo 
8417,"trava poreklo iz južne Evropa ; gajiti se zbog jestiv stabljika , seme i krošnja . "
4884,u grčki mitologija ćerka Heli i majka Arijadnina 
336,zagovornik princip monarhija 
1159,knjiga ili sveščica koji sadržati zadatak i prazan prostor za unošenje rešenje 
13908,stanovnik Grčka ili poreklo iz Grčka 
7819,tkivo koji se neki mekušac prihvatati za stena . 
8742,staviti u vodoravan položaj . 
13423,"doživljavanje osećanje , fantazija , stav , nagon i odbrana prema osoba u sadašnjost koji jesam adekvatno u odnos na taj osoba već predstavljati ponavljanje reakcija prema značajan osoba iz ran detinjstvo , preneti na osoba u sadašnjost ; podrazumevati odnos između tri osoba , subjekt , osoba iz prošlost i osoba iz sadašnjost na koji se prenositi karakteristika osoba iz prošlost ; u terapijski situacija osoba na koji se vršiti prenos ( transfer ) jesam terapeut "
3282,"jedinica informacija koji iznositi otprilike jedan milion ( @card@ , @card@ , @card@ ) bajt ili @card@ kilobajt . "
7667,glavna kolni kartica računar 
9233,Veličina ili gabarit . 
1257,neki voden biljka mesožderka iz rod Utricularia ; lišće ime jesam pretvoriti u šupalj hvataljka za sitan račić . 
5499,jestiv grudni žlezda životinja 
13662,društven grupa ( obično pre pojava pisma ) 
12263,izazvati hidrataciju ; dodati voda ili ovlažiti 
6987,zaliha ili isporuka hrana . 
6450,"lagati popodnevan koji se sastojati obrok od čaj , sendvič ili kolač "
17138,neki od raznovrstan gljiva iz rod Erysiphe Koja proizvoditi praškast skrama na površina domaćin . 
8680,"osnova za poređenje , referentan vrednost u odnos na koji se račnaju drugi "
2282,mali glodavci : dikobrazi ; pacov ; miš ; veverica ; ? marmots ; ? beavers ; ? gophers ; ? voles ; ? hamsters ; zamorac ; ? agoutis . 
5558,rod mali orhideja severni hemisfera . 
9872,Dakiri bez alkohol 
9100,odnositi se na usmerenje libido na osoba . 
12066,osoba koji jesam član ministarski kabinet . 
7172,eliminisati urin 
1678,"Najveća tunarka , težiti i do @card@ funta ; hraniti se u polaran predeo a razmnožavati u tropi . "
9304,trava iz star svet : kokotac . 
3586,drvo agruma koji imati velik obliti jestiv plod sa debeo žut kor i sočan ponešto opor meso . 
1028,zglob koji se slobodno pokretati čiji jesam kosti tako namestiti da omogućavati pokretanje u jedan ravan 
215,stvoriti mišljenje o nešto ili preneti stav . 
2,nepokolebljiv verovanje u nešto bez potreba za dokaz ili nalaz 
2140,velik boa iz tropski Južne Amerika koji živiti na drveće . 
5466,"knjiga sastaviti od list papir na koji se moći crtati , skicirati "
17327,kompilacija poznat činjenica o neki ili nešto . 
8309,izbacivanje ili brisanje delovati reč ili rečenica 
16141,neki od mnogobrojan leptir bledeti boja koji imati tri para dobro razvijen noga . 
15874,Zeba iz star svet : kanarinac i ? 
11456,Draguxar koji proizvoditi nakit od zlato . 
16174,Predviđeni ishod koji se nameravati postignuti i koji voditi nečiji planirati ponašanje . 
10520,persijski prorok koji jesam učiti o borba bog dobra i bog zlo ( oko @card@ p.n.e. ) 
594,diferencijalna jednačina koji uključivati funkcija više promenljiv 
11935,"profesionalan odnos regulisati zakon , pravno regulisati ( između advokat i njegov klijent ) "
14444,glagolski oblik koji se izražavati radnja završiti u prošlost pre neki drugi radnja 
13819,"uređaj napraviti da provoditi struja , toplota , i sl . "
13034,originalan ( audio ) snimak sa koji se moći napraviti kopija 
8080,pohađati religijski služba 
3047,sat koji se nositi na zglob ruka 
5103,grana tai jezik 
3428,"korišćenje reč koji se odnositi na dva ili više reč , iako odgovarati samo jedan "
11209,"poluslatko stoni ili desertni vino zlatan boja , poreklo iz okolina Bordo u Francuska "
178,osobina onaj ko jesam prihvatiti i ne upućivati on se pohvaliti . 
15241,"livadski mirisan medonosan biljka iz porodica usnatica , koji se upotrebljavati u rad oko pčela , u medicina i u proizvodnja eteričan ulja . "
1543,jedan od dva vrsta ( tip ) ćelija ( eritrocit i leukociti ) a ponekad obuhvatati i krvni pločica ( trombocit ) . 
4480,Odeća za glava . 
14564,"centralni deo planuti zemlja , izgraditi od materijal velik gustina , u koji dominirati gvožđe i nikl . sastojati se od čvrst unutrašnji i tečan spoljašnji jezgra . "
14299,prenosiv ograda u koji se moći ostaviti beba da se igrati 
16900,Destilana u koji se variti piva . 
549,Čin združivanje stvar . 
6353,"u fizika , kratak događaj u tok koji dva ili tri telo doći u kontakt . "
17394,delo proizvesti predstavljanje oblik ili predmet na površina pomoću linija 
2381,zaštitni znak jedan moćan operativan sistema 
15608,velik krvožedan zver iz tropski Amerika sličan leopard ; u neki klasifikacija smatrati se član rod Felis . 
14894,"tradicionalan vrsta italijanski pasta mali okrugao ili kvadratni oblik , najčešće se pun fil od meso , sir i povrće "
1101,lingvistički element koji se pridodavati reč kako biti se stvoriti biti njen flektivni ili izveden oblik 
16664,vrsta plućni tkivo koji se sastojati od alveole a nalaziti se na kraj disajni put . taj jesam mehur vazduh gde se obavljati razmena gas . svaki alveole jesam okružen kapilarima koji dovoditi krv zasićen ugljen dioksid a odvod krv zasićen kiseonik . zid alveole i membrana kapilara jesam tanak tako da gas lako prelaziti iz krv i u krv čist difuzija . 
5039,Polemoniaceae ; Solanaceae ; Boraginaceae ; Labiatae ; Lentibulariaceae ; Pedaliaceae ; u neki klasifikacija uključivati red Scrophulariales 
17059,prethodan pojava ili uzrok ili događaj 
1639,Kratkorepi glodar iz star svet koji imati velik kesa na obraz i kopati jazbina . 
15538,rod carstvo Protoctista 
14862,dati nov ili drugačiji definicija koji reč 
5845,republika na jug Severne Amerika ; postati nezavisan od Španija @card@ 
8602,oznaka koji koristiti autor ili urednik kako biti naznačiti mesto gde nešto trebati uneti u tekst 
4552,testo za hleb 
14367,Koginitivni proces donošenje odluka . 
14434,razlikovni karakteristika ili atribut 
7403,u anatomija grupa delovati telo koji raditi zajedno i obavljati određenu funkcija . 
1243,učenje nemački teolog Martina Luter protestantski reformator iz XVI vek 
898,rod bodljikav žbunje tropski Amerika i Azija : čičimak . 
13952,digitalan računar u koji jesam ugrađen ideja o smeštanje program u isti memorijski lokacija u koji se smeštati i podatak a koji jesam opisati fon Nojman sa saradnik @ord@ 
12508,poruka koji se prenositi telegraf . 
14125,irokeški jezik koji govoriti narod Mohok 
14854,nesamopouzdanost u veza sa sopstven promovisanje 
4669,Egipat i Sirija napasti jesam Izrael oktobar @ord@ ( na praznik Jom Kipur ) ; Izrael jesam uzvratiti kontranapad i preći suecki kanal i ući u Egipat 
12025,običaj koji jesam dugo biti važan karakteristika neki grupa ili društvo 
6711,skandinavski jezik koji jesam zvaničan jezik Danska 
8446,bantu jezik koji se ponegde smatrati dijalekt zulu jezik 
15118,reč koji imati sopstven leksički značenje 
2,"koji stvarno postojati , gzistira . "
1091,poslovanje koji obezbeđivati usluga turista 
6219,čin pokretanje nešto po prvi put ; uvođenje nešto nov 
1009,zgrada u koji jesam smestiti konj i drugi stoka 
5437,pripadnik ljudi koji se živeti u severni ili Južnoj Amerika pre dolazak Evropljanin 
11148,spolja vidljiv hrskavičav struktura spoljašnji uvo 
5867,vremenski period koji jesam pod nečiji kontrola i koji ga smatrati dovoljan za postizanje nešto . 
3716,Čin pružanje odobravanje i podrška . 
16149,jastuk natopljen mastilo koji se koristiti da preneti mastilo na gumen pečat 
14386,fleksivni oblik koji se tipično izražavati gramatički odnos povezati s upotreba indirektan objekt 
544,struktura u koji životinja legnuti jaje i leći svoj mlad . 
1129,tpolitička i ekonosmka teorija Karla Marks i Fridrih Engels koji govoriti da jesam klasni borba neophodan da biti se ostvariti istorijski promena i da hteti kapitalizam na ktaju biti zamenjen komunizam 
13048,dunja . 
8058,rod familija Čnocephalidae . 
12314,jedan od viđe delovati koji se jedan s drugi slagati u celina . 
2242,koji jesam karakterističan ili osoben ljudi narod ili nacija . 
13860,compensation paid taj the family of a murdered person 
3979,"ozbiljan , često fatalan bolest imun sistema koji se prenositi preko krv , najčešće preko seksualan kontakt ili zaražen igla "
7094,koji se odnositi na glečer ili se izvoditi iz glečer 
5067,"Karakteristično stanje osećanje , uobičajen ili relativno privremeno . "
9297,republika na azijsom podkontinent u južnoj Azija ; drugi po naseljenost zemlja u svet ; steći nezavisnost od ujedinjen kraljevstvo @ord@ godina . 
6184,"meso školjka velik , dubok voda "
13949,Obični crn evropski drozd . 
145,koji dovoditi ( pričinjavati ) fizički neudobnost . 
15864,bantu jezik koji se govoriti u zapadni Kenija 
8576,organski jedinjenje koji sadržati samo ugljenik i vodonik 
8314,"jestiv seme , korenje , stabljika , lišće , pupoljak , gomolj ili voće koji jesam slatko neki od brojni zeljast biljka . "
88,ispuniti ili okarakterisati veselje 
1120,sistem versifikacija 
11846,svet komercijalan aktivnost gde se razmenjivati dobra i usluga . 
1232,tipski rod porodica Hymenophyllaceae : tankolist . 
4626,"zglob na ljudski noga koji spajati golenica i cevanica sa bedrenjxčom , a spreda ga štititi čašica . "
3117,medijum koji širiti pokretan slika . 
4210,latinski od vreme renesansa ; jezik jesam naučni terminologija 
90,ukazati poverenje koji . 
14305,velik rod visok divalj trava iz porodica Boraginaceae . 
1309,vreme koji jesam potrebno da se brod pripremiti za putovanje nazad 
4056,neki od mnogi ptica sa dug noga koji gacati po voditi u potraga za hrana . 
11832,novčan jedinica Bangladeš 
3881,tipski i jedini rod porodica Ephedraceae : tropski i suptropsko zimzelen žbunje ili puzavica poreklo iz suv i nepgodnih područje . 
1361,liker sa ukus jagoda 
17220,"pohađati akademski kurs , ne prihodovati bod "
4267,notacija koji koristiti @card@ različit simbol 
10633,ispupčen nabor na površina mozak 
5921,sirov grašak mali zrno 
15672,osnovni novčan jedinica na Barbados 
9951,"u grčki mitologija poslednji kralj Troja ; otac Hektor , Paris i Kasandra "
1894,reći ili izraziti nešto sasvim kratko 
4438,plovak sa obala severni mora 
13905,"reka u centralni Italija , proticati kroz Rim i ulivati u Tirensko mora "
6592,pasulj beo zrno ; obično se za ishrana koristiti suv 
15024,epski poema koji jesam napisati Dante 
16527,porodica biljka cvetnice iz razred Caryophyllales . 
3714,"Ovčarski pas sa svilenkast dlaka i izdužen glava , razviti u Škotska . "
7889,neki od mnogobrojan tropski i suptropskih američki biljka iz rod Verbana koji se uzgajati zbog uočljiv klas sa raznobojan cvet . 
16306,"jedan ili više audio zapis izdat zajedno ; na početak jesam taj biti na 12-to inčnoj ploča koji jesam imati atraktivan omot , a zatim na audio kaseta i kompakt disko . "
13071,predmet koji se udarati . 
6460,"dugačak , strm obronak ili stena ; obično rezultat erozija "
10132,Događaj koji se dešavati u kritičan trenutak . 
344,mali ćelija koji sadži malo citoplazme i koji se stvarati zajedno sa jajni ćelija a kasnije odbacivati 
2989,"lekovit močvaran biljka , imati sabljast lišće i aromatičan korenje . "
6291,suvozemni listopadan orhideja 
5542,"materijal koji omekšavati pri zagrevanje , a ponovo stvrdnjavati pri hlađenje "
102,biti neki prihvatljiv ili odgovarajući . 
16621,ugarski jezik ( blizak mađarski ) koji govoriti Ostjaci 
9089,beo sos pomešati sa izgnječen inćun 
14797,"mineral koji se sastojati od titanijum dioksid u kristalan oblik ; pojavljivati se u matamorfnim stena , granit , liskun škriljac "
11311,tipski rod porodica Saxifragaceae ; velik rod obično višegodišnji biljka arktički i hladan područje severni polulopta : kamenika . 
10490,"oprema ( komad nameštaj , aparat i drugi pokretan pribor koji uključivati zavesa i tepih ) koji činiti da se u kuća ili neki drugi porstoru moći živeti . "
2733,deo kontinentalan margina između kontinentalan šellfa i kontinentalan podnožje blag nagib ( @card@ stepen ) . 
13267,ugovor potpisati između dva ili više strana ( država ) koji jesam se sporazumeti da nešto učiniti ( da preduzeti neki radnja ) 
264,""" slaviti vrlina svoj deca "" "
12204,malo azijski listopadan drvo koji rađati velik crven ili naranjdžasti jestiv plod . 
10079,staviti nešto natrag na mesto koji pripadati 
197,koji s ne pokretati . 
6515,aspekt izgovor koji podrazumijeva združivanje artikulornih organ kako biti oblikovati zvuk govor 
3196,Čin eksplodiranje . 
15903,"Učiniti ravan ili ravan , na primer trljanje . "
2656,"tvrd aromatičan seme drvo oraščić , koristiti se kao začin mleti ili narendan . "
10206,jedinica za dužina koji iznositi jedan milioniti deo metar 
16614,"koji se ticati Etiopija , njen ljudi i kultura "
13415,dijalekt degihe koji govoriti narod Kvapau 
6141,MY 
12079,antineoplastik koji sprčava korišćenje metabolit 
7613,kretati se oko osovina ili centar . 
3878,"maslina koji se kiseliti zeleniti , a često se čistiti od koštica i pun paprika ili badem "
6963,osoba koji koristiti neki stvar ; neki ko koristiti ili upošljavati nešto . 
221,veoma odbojan 
12540,"azijski reka , ulivati se u Eufrat "
10871,preuzeti vođstvo ili inicijativa : učestvovati u razvoj nešto . 
10710,"velik ptica-ronilac sa ćuba , jesti riba , imati tanak izvijen kljun . "
6216,relativan brzina napredak ili promena . 
9914,"stanovnik Liberija , ili poreklo iz Liberija "
8895,jezik koji govoriti Eskim 
9539,kretati se na ljubak i ritmičan nayin . 
6220,kontraceptivan sredstvo u oblik pilula koji sadržati estrogen i prgeseron koji sprečavati ovulaciju i tako onemogućivati začetak 
6727,personalan računar koji moći lako da se prenositi i nositi u ruka 
9824,novčan jedinica Albanija 
9669,reptil koji imati par otvor u lobanja iza svaki oka 
13652,mesto u planinski lanac geološki formacija koji jesam nizak nego okolni brdo . 
237,merni instrument za merenje relativan vlažnost atmosfera . 
32,"kvalitet nešto što jesam isto po količina , mera , vrednost ili status "
13300,porodica koji jesam rasprostraniti po ceo svet : prav žaba . 
9199,svojstvo onaj što se lepiti za neki površina 
12069,"treći , unutrašnji opna očni jabučica koji primati svetlosni nadražaj "
14692,vrsta ptica grabljivic ekoja s ehrani riba 
12926,pripradnik ( budistički ) narod koji živiti oko reka Mekong u Laos i Tajland i govoriti laoški jezik 
13699,uzrokovati da se čuti . 
13416,alatka koji se koristiti za pripremanje hrana . 
12949,velik kornjača . 
15578,libido jesam opšti oznaka za psihički energija . taj jesam jedan od ključnih pojam psihoanaliza i odnositi se na energija seksualan nagon . zato jesam nagonski težnja uvek usmeriti ka traženje prijatnost i zadovoljstvo . 
4219,stanje zajednički život u pleme 
10075,neki od raznih merni instrument za merenje veličina . 
10917,planinski lanac na Balkanskom polusotrvu na jugoistok Evropa ; protezati se duž granica Grčka i Bugarska 
12499,organizacija vojni vazduhoplovstvo . 
386,"gaziran mineralan voda sa izvor u Viši , Francuska ili voda sličan ona "
13042,"boginja plodnost u drevan grčki mitologija ; žena Korna , Zevsova majka ; u rimski mitologija identifikovati se sa rimski Opom "
