,Sysnet
12169,Mešana hrana bilo složena na tanjiru ili promešana i poslužena sa prelivom; obično se sastoji od zeleniša ili ga sadrži.
13874,mali tanjir iz koga se jedu kolači
5266,"Tajni obred u kultu božanstava starih Grka ili Rimljana koj uključuje pevanje, igranje, napijanje i seksualnu aktivnost"
7426,Potez učinjen da se ostvari neki taktički cilj.
9180,Osoba koja kontaktira sa drugima.
17236,"u računarstvu, poruka ili fragment poruke"
8435,grana tai jezika
100,postupak kojim se neko stanje od faktičkog pretvara u pravno (zakonito)
13442,"vrsta retkog ali teškog psihičkog poremećaja koji se manifestuje tako što osoba redovno traži medicinsku negu i pažnju za nepostojeće simptome koje sama izmišlja, a neobjašnjiva želja da se preuzme uloga pacijenta objašnjava se kao pokušaj bega od svakodnevnog života i potrebe da se bude negovan i zaštićen"
4364,glavni grad Bahama
16832,Drveni duvački instrument s jednim jezičkom i ravnom cevi.
4661,proces koga određuju atomski i molekularni sastav i struktura uključenih materija
15602,trosložna metrička jedinica kod koje iy dva naglašena sloga sledi nenaglašeni
13358,o biološkoj nauci entomologiji ili koji se odnosi na biološku nauku entomologiju
1256,Porodica lišajeva.
11350,Biljka koja se gaji zbog cveta.
1856,grupa pravih bakterija
19416,kost koja se proteže od ramena do lakta
9315,"Teseralan mineral olovnosive boje, metalnog sjaj; sulfid olova, najvažnija olovna ruda."
17585,Osnivač porodice
13205,"Veoma lagan kolač koji se pravi od biljnog ulja, jaja, šećera, brašna, praška za pecivo itd."
4923,Koji se odnosi na kosti ili skelet.
2030,fizički fenomen koji je povezan sa svetlom ili ga uključuje
15676,Velika evropska pijavica iz svežih voda koja se ranijekorpistila za puštanje krvi pacijentima.
13976,jedan od dve rata: prvi je vođen kada su se Buri borili protiv Engleza da bi povratili nezavisnost koju su izgbili tražeći pomoć od Engleza u probi protiv Zulu plemena (1880-1881); drugi je vođen protiv Britanije (1899-1902)
12282,čin ubistva brata ili sestre
3470,uralski jezik kojim govore samojedski narodi severnog Sibira
12449,"titan je čest sastojak Zemljine kore (4.400 ppm), a pojavljuje se dvojako: u silikatima i u vidu oksida (ilmenit FeTiO3 i rutil TiO2); pošto su oksidni minerali Ti nerastvorni u vodi, to je njegova koncentracija u rečnoj i morskoj vodi prilično niska (1 ppb)."
13898,elektroda sa pozitivnim punjenjem preko koje elektroni napuštaju električni uređaj
17187,Malo mediteransko zimzeleno drvo sa malim crnkastim bobicama i sjajnim aromatičnim lišćem koje se koristi kao začin; u staroj Grčkoj se koristio za krunisanje pobednika.
5259,Posledica popularnosti jednog kandidata na izborima na glasove koje dobiju drugi članovi iste partije.
12878,delovi pesničkog dela
11798,Gljive koje proizvode po površini obično belu naslagu organske materije.
15859,"vrsta jake i krute pamučne tkanine, sa jarkim štampanim bojama, služi najčešće za draperije"
1160,"Neka od brojnih dvogodišnjih i višegodišnjih trava sa ljupkim ljubičastim, žutim i ponekad belim cvetnih glavica."
12845,učiniti da se gas ili para pretvore u tečnost
17454,iznenadan velik pad u poslovanju ili cenama akcija (posebno onaj koji uzrokuje dodatne probleme)
11080,Istočnoindijsko drvo sa debelim kožnatim lišćem i jestivim plodom.
17242,Porklom iz Afrike.
5438,Afrička hijena; poznata zbog tipičnog urlanja koje nalikuje na satanski smeh.
2232,francuski pisac koji slika kompleksnost francuskog društva XIX veka (1799-1850)
13890,"Mali gušter koji živi na drveću, ima kresu i može da trči na zadnjim nogama."
8155,"u anatomiji, struktura koja oblikom podseća na školjku"
7340,čekanje određenog praznika (npr. Uskrsa)
5471,Obznaniti nešto.
12159,"Težak vredan metal; sivo-bele boje, otporan na koroziju' javlja se u nekim rudama nikla i bakra."
2305,podiže ipremešta teške predmete; teret visi na poluzi koja se okreće oko vertikalne ose
18889,Aktivnost snabdevanja ili dotura nečega.
1585,grupa ostrva zapadnih Kariba
3645,Delikatna evropska zeljasta biljka sa sivkastim lišćem i klasijem purpurnih cvetova; nekad se koristila kao lekovita trava..
9525,Ljudi koji žive jedni blizu drugih.
7945,"Postati židak ili tečan; o čvrstoj tvari, kada se zagreje."
18541,kontraceptivni uređaj koji se sastoji od tanke gume ili lateksne prevlake koja se nosi preko penisa tokom seksa
13328,egipatski bog Sunca sa glavom jastreba
15736,Sastoji se od svih živih glavonožaca osim porodice Nautilidae: redovi Octopoda (hobotnice) i Decapoda (lignje)
3442,vrlodekorativna biljka penjačica iz Južne Amerike (Brazila9
619,u grčkoj mitologiji hromi bog vatre i kovačkog zanata; u rimskoj mitologiji mu odgovara Vulkan
3065,"komercijalni proces koji je na snazi u toku promocije, prodaje i distribucije kakvog proizvoda ili usluge"
6748,"kuvanje napolju, gde su glavno jelo pečene viršle"
13760,"onaj koji poseduje svojstvo lepljenja, priljubljivanja"
8206,konverzija analognih informacija u digitalne
16896,standardni protokol za komunikaciju između elektronskih muzičkih instrumenata i računara
14741,osnovna novčana jedinica Paragvaja
3531,"Mešavina koja se sastoji od dva ili više metalnih elemenata ili metalnog i nemetalnog elementa, koji se obično spajaju topljenje."
12270,moreuz koji povezuje Sredozemno more sa Crnim morem; odvaja Evropski od Azijskog dela Turske; važan pomorski put
1370,način sagledavanja situacija ili tema itd.
17302,koji pripada klasi imenica koje označavaju živa bića
19286,smatra se da izaziva dijareju kod ljudi
18918,o strukturi koja ima više nivoa
15688,Mala količina nečega
9330,Institucija koja je posvećena obrazovanju.
17972,Dovesti u stanje ravnoteže.
12487,grčki ep koji se pripisuje Homeru koji opisuje putovanje Odiseja posle pada Troje
7453,zgrada u kojoj se nalazi organizaciona jedinica neke grane javnog poslovanja
14653,"država na severu Evrope, čini je teritorija poluostrva Jitland i mnoga ostrva između Baltičkog mora i Severnog ledenog mora"
13552,Stisnuti nečiji vrat.
10864,skup svih fleksivnih oblika jedne reči
17787,pregovarati o uslovima razmene
16951,Neko ko nabavlja i održava zalihe dobara ya prodaju.
996,Uspravna zeljasta biljka ili penjačica severne hemisfere: dimnjača.
3653,bilo koji od jezika kojim govore Laponci; obično se smatraju uralskim jezicima
14317,"koštani lavirint okružuje unutrašnje uvo a u  njemu se nalazi membranozni lavirint, organ ektodermalnog porekle, u kome se završava akustični ili vestibularni deo osmog živca."
7984,modrozelene alge
17853,jezik kojim govori narod Gvarani u Paragvaju i Boliviji
4168,dodatak ili susedni anatomski delovi  nekom organu.
1638,popis studijskih grupa na fakultetu (koledžu; univerzitetu)
11733,Prodavati nešto ilegalno.
14012,Engleski pripovedač i pesnik (1840-1928).
19350,Učiniti da postane spojeno ili povezano.
1177,dodeliti početnu vrednost računarskom programu
9444,toranj sa svetiljkom koji upozorava prolazeće brodove na plićake
11,"""slaviti vrline svoje dece"""
17948,"koji je ili sa drugog mesta ili kraja sveta, ili koji je za drugo mesto ili kraj sveta karakterisatičan"
13774,velika bela čaplja
15051,Drvo koje rađa jestiv koštunjav plod.
262,mreža u koju se hvata riba i koja se potpom izvlači iz vode
3040,mali motocikl sa niskim ramom i malim točkovima i podignutim ručkama
1582,Pereca koja se pravi od testa.
5518,Stanje kognitivnih procesa neke osobe.
13935,grana tai jezika
2150,izazvati iznenadni strah u kome ili ispuniti koga iznenadnom panikom
11850,Pogoni ga dinamično delovanje vazduha po njegovim površinama.
17457,"Mali ili minijaturni arahnidi koji često zagađuju životinje, biljke ili hranu."
16495,majmuni kandžaši
18083,Pružanje privremene pomoći.
15286,dijalekat sotoa kojim govori narod Basoto; zvanični je jezik Lesotoa
16807,formalna toaleta koja se sastoji od kompletnog muškog večernjeg odela
11669,"Uobičajena evropska žaba, uglavnom suvozemna."
14804,Doktor koji je specijalizirao bolesti krvi.
6758,Sfinkter na pilorusu koji razdvaja želudac od dvanaestopalačnog creva.
3437,šuplja testenina ispunjena mesom ili sirom
7557,mala evropska grmuša koja snosi jaja u u močvarama gde ima trske a zimu provodi u Africi
18916,gramatički odnos koji stvara prelazan glagol
15115,Neko ko kreira odeću.
14144,biljka koja odbacuje zelenilo svake godine na kraju sezone
613,dijagram koji koristi krugove za predstavljanje skupova; pozicija i preklapanje krugova ukazuje na relacije između skupova
5918,"Veliki, manje-više primitivni glodari: veverica, mrmot, dabar, ird."
9072,rimokatlički fratar koji nosi crnu mantiju Dominikanskog reda
14113,Merni instrument koji ukazuje brzinu rotacije.
16409,koji se tiče ili koji uključuje srce i krvne sudove
5920,poslednjih 2 miliona godina
4615,jedinica za dužinu koja iznosi 10 metara
14057,Ispustiti ili osloboditi; posebno o tečnostima.
10235,grana antropologije koja proučava praistorijske ljude i njihovu kulturu
2450,nešto pre fermentisano nego destilovano
16707,Ukloniti.
17978,promena položaja nagore
12997,Brgljez.
13562,Tkivo mezodermalnog porekla koje se sastoji od kolagenskih vlakana i masnih ćelija; podržava organe i popunjava prostor između njih i formira ligamente i tetive.
12864,tikva koja ima žutu koru i žućkastu sredinu i obično izdužen vrat
750,poxvirus koji je veoma sličan virusu velikih boginja; izaziva benigne želatinozne tumore kod ljudi
8207,kristalna amino-kiselina koja sadrži sumpor; nalazi se u proteinima i važna je za ishranu
17316,"u računarstvu, korišćenje centralnog računara simultano od strane više korisnika"
13966,vrlo rasprostranjena ruda gvožđa; Fe2O3H2O
10676,Zajednica ljudi koji čine deo društva ili privrede.
4720,Bilo koje drvo ili žbun iz oda Ilex koje ima crvene bobice i sjajno zimzeleno lišće sa bockavim ivicama.
14248,testiranje ideje
3015,Slankasta tečnost koju luče suzne žlezde; podmazuje površinu očne jabučice.
5911,deo mesa sa gornjeg dela prednjih nogu
3357,MW
192,Koji nije u skladu sa metodama ili principima nauke.
14255,Advokat koji zastupa odbranu.
7219,sistem povezanih mera
1730,Žaba središnje i istočne Evrope; trbuh ima jasno crvene mrlje.
7967,Nizak zimzeleni žbun iz visokih umerenih područja koji rađa crvene jestive plodove.
15072,grupa semitskih jezika
5170,Neograničeno trodimenzionalno prostranstvo u kome je sve smešteno.
7447,"bavljenje ribolovom ne kao zanimanjem nego kao zabavom, sportom"
9156,"ostrvska država na ostrvima privetrine, stekla nezavisnost 1979"
7928,"pristalica monogamije, koji ima samo jednog supružnika u jednom trenutku"
11430,Advokat koji je specijalista za razvod i poništenje braka.
1301,Putovati železnicom.
18400,veštačka oprema koja kruži oko Zemlje ili Meseca
16082,Onaj koji se bavi ili zastupa umetnički minimalizam.
9536,uredan (često zadivljujući) raspored
18556,teleći jezik koji se koristi u ishrani
11818,"Uspravna žbunasta jednogodišnja biljka koja je puno gaji u Indiji, Indoneziji i SAD-u zbog lišća a posebno zbog jestivog semena koje se mnogo koristi u kineskoj kuhinji."
17184,Čin kojim se nešto melje u prah.
6685,proces povećavanja
16416,čin ili praksa kojom se odstupa od zadovoljenja želja
5750,U biologiji niz događaja koji dovodi do evolutivnog razvoja vrste ili taksonomatske grupe organizama
17867,električno kolo koje je tako napravljeno da uvede proračunato kašnjenje u prenos signala
49,"Lukovičasta biljka koja ima uspravno pravo lišće i bele ili šute cvetove, samostalne ili grupisane."
8326,Više od polovine glasova na izborima.
2018,Dobroutemeljeno objašnjenje nekog aspekta pirodnog sveta; organizovani sistem priznatog znanja koji se može primeniti u različitim okolnostima da bi se objasnio specifični skup fenomena.
5988,Biti smetnja ili prepreka nečemu.
5502,"mala kneževina u centralnoj Evropi u Alpima, između Austrije i Švajcerske"
8712,generator koji dobija energiju od vetra
14935,kiselo mleko sa zaslađenim borovnicama ili sa džemom od borovnica
10851,Kupina puzavica severnik umerenih područja sa žutim ili narandžastim bobicama.
8108,"testo od kukuruza i kukuruzne kaše punjeno sa mešavinom od mesa, umotano u kukuruzovinu i kuvano na pari"
14324,novčana jedinica Sijera Leonea
3641,Škola u kojoj ljude uče da upravljaju automobilom.
18360,Biljke čije je seme zatvoreno u ovarijumu
10871,koristi se za proizvodnju fruktoze
18585,jestive grudne žlezde životinja
18394,objaviti sudsku presudu (nekome)
12265,algonkinski jezik naroda Mikmak
7834,AF
12472,zapisan ili odštampan pored i ispod nekog drugog karaktera
9407,koji se odnosi na uvo ili njegovu okolinu
1431,najveći pingvin s Antarktika
11525,božja ovčica
13983,selekcija slučajnog uzorka; svaki element populacije ima podjednake šanse da bude selektovan
15212,"jastozi, potočni rak, rak, kozice, skampi."
9439,"hemijski element srodan sumporu i selenu, srebrnastobeo, metalnog sjaja, krt, slab provodnik elektriciteta; upotrebljava se u fotografiji., keramici, medicini"
1387,Kameleni iz starog sveta; u nekim klasifikacijama Rhiptogossa se smatra superfamilijom Sauria.
13278,"grožđe koje se uzgaja radi vina ali i kao stono grožđe, postoji u mnogim varijetetima"
1453,reka i sve njene pritoke
3646,"gazirano, bezalkoholno piće sa ukusom đumbira"
7841,koji se odnosi na ili se bavi arheologijom
57,pileća džigerica koja se koristi u ishrani
11981,"Gmizavac relativno dugog tela, obično sa dva para nogu i repom."
10519,rad koji se obavlja rukama
5334,"Voćka s glatkim listom i belim cvetovima, plodovi su slatki i sočni sa karakterističnim tvrdim zrncima."
8825,Horizontalna komponenta vektora celokupnog kretanja.
16060,"pisati, sastavljati stihove"
14389,američki dugorepi ?blackbird sa sjajnim crnim perjem
9400,krajevi rebara između rebara i ravnog dela
9813,Jedna apstraktna mentalna lokacija.
16355,pavpav
8252,Članovi društvene organizacije koji imaju vlast.
11456,Nešto što se dogodi.
206,smanjenje u veličini organa usled bolesti ili nekorišćenja.
2672,Izolovana činjenica koja se posmatra odvojeno od celine.
10225,čin obrađivanja korišćenih ili odbačenih materijala za upotrebu u stvaranju novih proizvoda
15982,"koji se tiče Sirije, njenih ljudi i kulture"
6889,komad nakita koji je pričvršćen na odeću nosioca
8575,struktura dodata spoljnoj strani kuće koja često obrazuje natkriveni ulaz
15614,Carski rez je operativni porođajni zahvat kod koga se porodilji otvara abdomen i materica a zatim se kroz taj rez vadi beba.
8662,tibetsko-burmanski jezik kojim se govori u junanskoj oblasti Dali
6934,odeća (posebno za žene) koja se proteže od ramena do struka ili bokova
283,ono što je ispod standarda i očekivanja u pogledu morala ili pristojnosti
1998,"Trava od koje se kao začin koriste listovi, ponekad i seme."
7971,spomenik koji se sastoji od veoma velikog kamena koji čini deo praistorijske strukture (posebno u zapadnoj Evropi)
291,Onesposobiti kretanje nekom tako što se smesti unutar nekih granica.
9941,blago kiselo crveno ili žuto mekano voće koje se jede kao povrće
12677,Žabe.
12248,Velika porodica dikotiledonskih biljki iz reda Rosales; imaju naizmenično poređane neparno poređane listove.
14360,Neka od paprati iz roda Blechnum.
14832,"najvažnija bitka u torku Rata za špansko nasleđe, snage Velike alijanse su odnele pobedu nad Francuskom 1704."
9365,"asocijacija država zapadne hemisfere stvorena 1948 da promoviše vojnu, ekonomsku i kulturnu saradnju"
11384,Tipski rod porodice Caricaceae; tropsko američko drveće; papaja.
5650,kukac riličar iz reda Heteroptera sa zakržljalim krilima.
3786,imitatorsko ponašanje
18025,modul koji je tako napravljen da može da se umetne u veći deo opreme
8545,"Neko ko pravi modele (za šivenje, stolarske radove i sl.)"
14524,grana elementarne matematike; nauka o računanju pomoću brojeva izraženih ciframa
10137,"karbonat aluminijuma; koristi se u proizvodnji mirišljavih soli, praška za pecivo"
16686,"Ishod događaja, posebno u odnosu na neku osobu."
13436,Koji ima ciklus koji traje dve sezone.
8815,Nuđenje dobara i usluga na prodaju.
13457,Deo okeana ili velikog prostranstva slane vode koji je delimično zatvoren kopnom
17244,neko ko pozajmljuje novac ili daje kredit u poslovnim stvarima
13455,pravi se mešanjem umućenih jaja sa supom
17283,Tropska penjačica iz starog sveta.
46,nesposoban da deluje: bez pomoći
10479,vazdušasta zrna pšenice
13409,hirurška intervencija na oku
9778,Godina računata od 1. januara do 31. decembra po Gregorijanskom kalendaru.
1254,losos očuvan dimljenjem ili u dimljenoj salamuri
7272,Postati napet ili napetiji.
17398,Mala fleksibilna cev koja se ubacuje u telo da bi se omogućilo oticanje ili ubrizgavanje tečnosti ili da bi prolaz ostao otvoren.
8709,polarni krug koji označava najseverniju tačku u kojoj se sunce vidi u vreme najduže noći zimi
12234,stena nastala pod uticajem pritiska i toplote
7197,dunje.
18280,"koji se tiče Benina, njegovih ljudi i kulture"
16563,"Evropska višegodišnja zeljasta biljka jakog mirisa, lišće joj je sivozeleno i gorkog ukusa."
345,tanak završetak vrata
18033,Divlji magarci iz Azije i severne Afrike.
11720,bantu jezik od velikog književnog značaja u jugoistočnoj Africi
6144,Oblik veoma tanke zlatne folije.
13707,prepolovljeno tvrdo kuvano jaje sa žumancem pomešanim sa majonezom i začinima i vraćenim u belance
5466,zvanični jezik Estonije; pripada balto-finskoj jezičkoj porodici
4861,Veliki odeljak gljiva heterogenog oblika za koje nije poznat stadijum polnog oplođavanja.
9822,novčana jedinica Ukrajine
3208,reč ili grupa reči koji funkcionišu kao prilog
13799,Ispričati ili dati detaljne podatke o.
8538,ubiti nekoga pucanjem
1806,memorija za međurezultate koji se moraju čuvati tokom rada
17275,penjači
17639,proizvesti definiciju za značenje koje reči
11546,"Tropska američka biljka koja rađa veliki ,mesnati, jestivi plodkoji se završava tvrdim lišćem; u tropskim krajevima se gaji."
11930,minimalna gramatička jedinica koja se može upotrebiti kao reč
5328,"Nezreli samostalni oblik većine beskičmenjaka, vodozemaca i riba koji se posle izleganja iz jajeta suštinski razlikuje od roditelja i mora da prođe metamorfozu."
8077,Mali rod evroazijskih vodenih višegodišnjih biljaka; vragolić.
15026,iznenadna promena unutar rečenice iz jedne sintaksičke strukture u drugu
2036,Kolač u čiji sastav ili glazuru ulazi mleveni kokosov orah.
18303,koji se odnosi na genealogiju
13324,Instrumentarijum izumljen za naku određenu namenu.
8871,militantna organizacija irskih nacionalista koji su koristili teror i gerilsko ratovanje
17255,Rasprsnuti se iznenada.
2319,Lociran na ili u blizini Zemljinog pola.
1017,Dati nekome hranu.
679,crna kobasica koja sadrži svinjsku krv i druge sastojke
13708,stih u kome određena slova kao prvo u svakom redu daju reč ili poruku
8853,jedtivi plod bundeve; jede se kao povrće
16661,"teći, proticati, isticati ili se gubiti"
8297,ćilibarsko zeleno muskadin grožđe sa jugoistoka Sjedinjenih država
8827,stanovnik Portugala ili poreklom iz Portugala
18430,oivezan lancima
14466,"uređaj za prikazivanje ulaznih signala kao slova na ekranu, obično ima tastaturu"
13776,koji se bavi proučavanjem životinja i njihovom klasifikaciom i osobinama
8865,Velika evropska topola.
18795,Novoizmišljena reč ili fraza.
6339,"Izazvati promenu, transformaciju; učiniti različitim."
2651,biti nasuprot nečem drugom.
16179,"Prestonica, najveći grad i ekonomski i kulturni centar Portugalije; glavna luka zapadne Portugalije."
8669,Uciniti debelim ili punačkim.
4979,deo mesa sa gornjeg dela zadnjih nogu
7892,Meso ribe iz mora koje se koristi kao hrana.
4825,Mali pojedinačni element slike ili projekcije na katodnoj cevi (u računarstvu).
15930,"Vizuelno predstavljanje, recimo fotografijom ili slikom."
18590,koji se odnosi na vojno osoblje koje služi na moru
3496,Ljudi zaokupljeni naročitim zanimanjem.
10797,veliko tropsko voće sa korom poput kože i mekom pulpom; u srodstvu sa krem jabukama
4217,Oslići.
4492,sve što služi tome da šta razdvojenim zadrži ometanjem vida ili pristupa
9790,Predavač na nekim univerzitetima čija se predavanja sastoje u čitanju i obradi pročitanog (obično za podučavanje stranih jeyika).
4448,presavijeni papir koji može da se koristi za neprekinuto štampanje koje kontroliše računar
11520,okeanijski jezik kojim se govori na Tahitiju
9049,opaziti slušajući
18062,stanovnik Čilea ili poreklom iz njega
13554,"u matematici, greška u računa do koje dolazi zbog skraćivanja numeričkog izračunavanja pre nego što je račun završen"
2278,novčana jedinica Jordana
1850,reprodukovati uz pomoć fotokopir mašine
16898,"uzročnik marsejske groznice kao i svih ""tifusa koje prenose krpelji"" je Rickettia conorii koju kod nas na čoveka obično prenese krpelj psa Rhipicephalus sanguineus; ređe, čovek može biti inficiran utrljavanjem zaraženog sadržaja zdrobljenog krpelja u oči, nosnu sluznicu ili oštećenu kožu; mediteranska pegava groznica se javlja na evropskim, afričkim i azijskim obalama Mediterana i na obalama Crnog mora"
18244,Knjiga koju koristite da biste dobili verodostojne podatke.
19472,novčana jedinica Japana
14433,poticati (iz)
13439,Spojiti radi zajedničkog cilja ili u zajedničku akciju.
6885,pripadnik grupe Jevreja koji su u vreme ranog hrišćanstva prihvatili Hrista kao mesiju
3932,poluostrvo između Crvenog mora i Persijskog zaliva
9582,mala evropska zeba koja lepo i veselo peva dok pravi gnezdo
9948,Republika na Filipinskim ostrvima; stekla nezavisnost od Sjedinjenih Država 1946. godine.
227,mleko dobijeno od koze
2409,Ceni se zbog lepog cveća u raznovrsnim lepim i svetlim bojama.
18598,karakter koji služi da označi unakrsnu referencu ili fusnotu
10950,u grčkoj mitologiji kralj koji je napravio statuu žene i zaljubio se u nju; Afrodita ju je oživela kao Galateju
15604,japansko alkoholno piće napravljeno od fermentisanog pirinča; obično se služi vruće
9816,"jedna od većih francuskih reka, uliva se u Sredozemlje kod Marseja"
11043,Čin veslanja kao sport.
7635,Biti sličan nečemu.
1158,o botulinusu ili koji se odnosi na botulinus ili koga proizvodi botulinus
8809,novčana jedinica Etiopije
12791,Prihvatati.
2200,spuštanje glasa na kraju solo dela u pevanju
16742,(Grčka mitologija) retka tečnost za koju se govorilo da teče venama bogova
8036,"u računarstvu, proces u toku koga računar izvršava instrukcije"
3796,učena profesija koja zahteva izučavanje dogme neke religije i koja se obično izučava na univerzitetu ili na seminaru
236,Široko gajena ribizla koja rađa crne aromatične bobice.
15742,Veza između jezičkih oblika ili elelmenata.
12801,štampač koji štampa pojedinačne stranice odjednom
9371,mala masna riba koja se nalazi u vodama Evrope; obično se dimi ili konzervira kao sardina
5469,BD
100,ono što je u suprotnosti sa principima pravde ili zakona
3570,Praksa obrade zemlje ili gajenja stoke.
17821,Tekući plan akcije u timskim sportovima.
9594,šetati se
14363,vreme kad se nešto desilo
8908,Pokrivač koji služi da ga čovek nosi na svom telu.
5964,neprozirni prozorski zakrivač koji može zakriti ili otkriti prozor
5785,Jednogodišnja evroazijska biljka sa mekim bodljikavim lišćem i zrakastim žutim glavama cvetova.
8147,Drvo limuna čiji plod ima bezukusno slatko meso.
7224,"Mali ljupki jelen evroazijskih šuma, ima male viljuškaste rogove."
7209,reptilsko stvorenje za koje se misli da živi u vatri
1631,mali neformalni društveni skup
5541,Imovina koja je iznajmljena ili pred iznajmljivanjem.
19406,osnovna novčana jedinica Libije
3067,Rod bodljikavog žbunja tropske Amerike i Azije: čičimak.
2389,koji je od početka postojao; u najranijem ili izvornom stanju
2206,Materija koja je čvrsta na sobnoj temeperaturi i pritisku.
16008,"nalik sosu holandez; pravi se od belog vina, estragona i vlašca"
16320,Lak mekan srebrnobeli element iz grupe alkalnih metala; brzo oksidira na vazduhu i reaguje burno s vodom; ima ga u prirodi u velikim količinama u mešavinama u morskoj vodi i ???
11584,koji se odnosi na Rajnu i okolnu teritoriju
1114,Povrće čiji cvet ima oblik leptira; obiyno se uključuje u porodicu Leguminosae.
15007,Posetilac kome domaćin iskazuje gostoprimstvo.
16504,Stajni ekstremitet donjeg uda kod kičmenjaka.
91,"onaj kojem se može ukazati poverenje, u kojeg se možemo pouzdati"
2161,"Rimska katolička služba obožavanja Device Marije, slična ali kraća u odnosu na božansku službu"
12537,švajcerski matematičar (1707-1783)
6227,pomešan škotski viski i soda
19107,čin dobrovoljnog davanja za neki zajednički cilj
6572,formalni dokument kojim se (javni) funkcioner tereti za zloupotrebu službenog položaja
11188,radioaktivni element koji se dobija bombardovanjem plutonijuma neutronima
17018,koji se odnosi ili je u vezi ili je sastavljen od reči uopšte
17261,koji ima posebno usmerenje
18375,palica koja se koristi kao oružje
6987,cev kroz koju se odvodi tečnost
1469,odnos između jedinica kojim se izražava suprotnost njihovih značenja
11924,Zapis serije događaja koji čine život neke osobe.
6468,Sistematsko ispitivanje da bi se utvrdile činjenice.
12068,čin odlaska
17278,"Celokupna psihička aktivnost određena je principom zadovoljstva. Po psihoanalizi, jedan od najvažnijih pojmova, koji označava subjektivno snažan i kratkotrajan afekt uživanja, praćen rasterećenjem tenzije nagona i postizanje zadovoljenja. Zadovoljstvo je prijatno osećanje koje varira od osećanja blage ugodnosti, preko uživanja sve do ekstaze."
208,"Biti lažljiv, neiskrene prema nekome."
4744,Tipski rod porodice Recurvirostridae: sabljokljunke.
8966,Iskaz posmatran kao objekat.
616,"u računarstvu, datoteka koja sadrži transparentne podatke o nekom zadatku obrade podataka"
13603,Rod porodice Hirundinidae.
