,Sysnet
11462,"Mali tanki afrički majmun, ima dugačke zadnje udove i dugu kosu oko lica."
13617,"Osoba koja se bavi izdavanjem knjiga, serijskih publikacija ili muzičkog materijala."
16688,veliki ovalni stadion sa redovima mesta za sedenje; nekada arena u kojoj su se odvijale predstave i takmičenja
755,Udisati vazduh u pluća i izdisati ga.
15087,dati na razmatranje
12506,vrsta školjki čije je telo jestivo; postoji više stotina vrsta ostriga od kojih su neke zaštićene vrste
14571,strepnja u iščekivanju šta će se dogoditi
12601,novčana jedinica Estonije
3260,(čin) terapije lekovima
9856,Glodar iz porodice Geomyidae koji kopa; ima velike spoljašnje bage na obrazima; iz Centralne Amerike i jugozapadne Severne Amerike.having large external cheek pouches; of Central America and southwestern North America
17261,tradicionalni francuski paprikaš od povrća i govedine
3057,"Vrsta pasiflore veličine jabuke koja raste na Karibima, centralnoj i južnoj Americi"
1554,rad kojim se nešto nanosi
1390,ručno kolo koje se koristi za upravljanje
14773,wring the neck of
116,"Koga karakeriše ili koji pokazuje odbijanje, poricanje ili suprotstavljanje; koji nema pozitivna svojstva."
16856,računarsko kolo sa više ulaza ali samo jednim izlazom koje se aktivira određenom kombinacijom ulaza
7325,u ranoj fazi u razvoju kojeg jezika ili književnosti
801,raspodela opaženih frekvencija pojavljivanja vrednosti promenljive
9157,Godišnje i višegodišnje zeljasto bilje i žbunje.
10667,"anatomska struktura koja se koristi kao polazna tačka u lociranju drugih anatomskih struktura, kao u hirurgiji ili tačka na kojoj mogu da se izvrše merenja"
8180,supstanca koja zaustavlja ili usporava neku aktivnost
7938,koji se odnosi na geologiju ili se zasniva na geologiji.
17109,Pozicija ili ustrojstvo tela i njegovih udova.
3285,"tečnost u kojoj su krčkani meso i povrće, koja se npr. koristi kao osnova za supe i sosove"
11656,deblji odrezak sečen od goveđe pečenice
9305,osnovna novčana jedinica Tanzanije
6695,zaključiti rezonovanjem
8989,pretvarati se u pogledu određenih osobina ili stavova
10168,emitovati fine čestice gara
11591,"Imovina koja pripada nekoj osobi ili grupi, ona koju su oni uložili ili koja im po pravu pripada."
3567,komunicirati (sa kime) pismenim putem
6955,"Mali otvoreni kontejenr koji se koristi za piće, obično sa drškom."
255,obrada podataka koju obavlja računar
1844,Vreme koje pokazuje časovnik.
4058,"koji se tiče Čada, njegovih ljudi i kulture"
10456,Tipski i jedini rod porodica Tytonidae.
660,Prebaciti u svoju svojinu.
5908,osnovna novčana jedinica Rumunije
1648,važna riba severnih mora (posebno Atlantika) koja se lovi i koristi ca ishranu
9424,koktel od ruma i soka od limuna ili lajma sa šećerom i ponekad gorkim listom
8286,"slatkovodna, mala riba iz porodice Centrarchidae, nemasnog mesa"
8810,zgusnuto mleko dobijeno isparavanjem
16338,Udaraljka koja se sastoji od trapeza sa mnogo žica po kojima se udara drvenim batićima umotanim u kožu.
15900,južnokavkaski jezik koji ima 3 miliona govornika i dugu književnu tradiciju
14089,Grupa koja kontroliše aktivnosti političke partije.
3791,Travnata zeljasta biljka uglavnom iz Severne Amerike.
7973,Polagati mrest.
16491,"Zglob koji spaja stopalo i potkoleničnu kost, tarsus."
17032,(često množina) grana elektrotehnike koja se bavi tehnologijom elektronske komunikacije na daljinu
13254,Hrana koja sadrži puno šećera.
8174,Biljka iz roda Corydalis sa lepim lišćem i ?? cvetovima.
4677,Prolaz (tunel ili cev) kroz koji prolazi voda ili električne žice.
6715,morske ptice ronilice severnih mora: morski papagaj
15020,Rod vrlo rasprostranjenih višegodišnjih zeljastih biljaka i nekog žubnja.
1882,stanovnik Sejšela ili poreklom sa Sejšela
11316,položaj sudije
9864,"složeni oblik deobe ćelija životinjskih i biljnih organizama, najčešće višećelijskih, pri kojoj se u jedru pojavljuju končaste tvorevinehromosomes"
14600,Jato ptica u leto.
709,Red koji se poklapa sa porodicom Plantaginaceae.
461,Roditelj vašeg oca ili majke.
4818,"hartija koja upija višak tečnosti, na primer mastilo"
11727,Broj koji se oduzima od umanjenika.
307,"Onaj koji proživljava tugu, žalost ili nezadovoljtvo ili označen njima ili ih izaziva."
201,"onaj kojeg vredi imati, tražiti ili dostići"
11661,Rod ptica iz reda Casuariiformes.
1481,nefinitni oblik glagola koji se u nekim jezicima ponaša kao njegov osnovni oblik
7399,skup nastavnika i administratora u školi
11002,kopno koje spaja Severnu i Južnu Ameriku
16600,jedan od dva osnovna konstituenta rečenice; predikat se sastoji od glagola i njegovih dopuna
7757,Sisar kopitar koji živi na planinama Evroazije; ima uzdignute rogove sa unazad zakrivljenim vrhovima.
318,Koji ne postoji u stvarnosti.
3111,izgubiti svaku nadu
16311,odlučujuće uticati
16,"Onak koji je produktivan, svež, neobičan; nešto što je prvi put smišljeno."
13835,skup oznaka i pravila za njihovo korišćenje (u skladu sa SGML-om) u razvoju hipertekstualnih dokumenata
12414,stanje do koga dolazi zbog uticaja majčinog alkoholizma na plod tokom njegovog embrionalnog (prva 3 meseca ) i fetalnog razvoja (od 3 meseca do kraja trudnoće); pretpostavlja se da je nedostatak enzima alkoholne dehidrogeneze razlog nepravilnog i poremećenog metabolizma alkohola u embrionalnoj i fetalnoj jetri ploda
267,tuga izražena plakanjem
268,dati slobodu; osloboditi od kazne (kazne zatvora)
11125,"Porodica malih, obično šarenih leptirova; mužjaci imaju kratke prednje noge."
6885,"glavni grad Mjanmara, treći po veličini"
10958,"nauka koja se bavi prikupljanjem, rukovanjem, skladištenjem, pronalaženjem i klasifikovanjem zapisanih informacija"
11921,u grčkoj mitologiji Ahilov prijatelj koji je ubijen u Trojanskom ratu; to je nateralo Ahila da se varati da se bori posle svađe sa Agamemnonom
14435,Senzacija do koje dolazi kada receptori ukusa na jeziku i u ždrelu prenesu informaciju o hemijskom sastavu rastvorljivog stimulusa.
12837,Učiniti da opet bude sveže.
8454,rastojanj između centra i svak atčke na kružnici ili sferi
16875,koji se odnosi ili uključuje više nacija ili država
12259,žuto-crvena velika jabuka koja kasno zri
5337,"Ukrasni ali otrovni žbun koji ima usko zimzeleno lišće i grupe mirisnih belih, ružičastih ili crvenih cvetova; poreklom iz istočne Indije ali se gaji svuda u toplim krajevima."
4960,božanstvo koje se obožavali u drevnom Rimu
4603,koji se odnosi ili je oboleo od hemofilije
1470,endoskopski pregled abdomena kroz zid stomaka.
960,elipsoidne bakterije zemljišta
3305,Tražiti nešto što vam pripada ili je vaše vlasništvo; tvrditi da je to vaše pravo.
10451,Vrlo rasprostranjeno žbunje i drveće.
1848,Ravna ploča od metala ili stakla na kojoj se beleže fotografske slike.
575,Uljasto organsko jedinjenje koje se ne rastvara u vodi već u organskim rastvaračima; suštinska komponenta živih čelija (zajedno sa proteinima i ugljenohidratima).
1577,Limeni muzički instrument koji ima briljantan ton; ima usku trubu i zvono; svira se uz pomoć ventila.
3499,"Trava sa širokim pljosnatim lišćem koja se gaji u Evropi i Americi za ispašu, seno i za leje."
13663,administrativna jedinica u kojoj je sedište savezne vlade
2502,"Jednogodišnja, dvogodišnja ili višegodišnja trava: ljutić, žbljaka."
317,"bakterijska infekcija ograničena na određeni organ ili region, posebno onaj koji uzrokuje simptome na drugim mestima"
1219,vulkan na jugoistoku Italije na obali Sredozemnog mora; erupcija iz 79 god. p.n.e. je unišitla Pompeju i ubila Plinija Starijeg; poslednja erupcija 1944
149,Koji je pred erupcijom ili izbacuje lavu (o vulkanima)
8427,Hleb sa aromom cimeta;često sadrži suvo grožđe.
16025,Koginitivni proces koji pretpostavlja da je znanje na raspolaganju i koji ga koristi.
12426,bantu jezik blisko povezan sa jezikom zulu
9408,grupa ostrva zapadno od Nove Gvineje u jugozapadnom Tihom okeanu
15906,Lekar koji je stručna za bolesti digestivnog trakta.
10373,"U nekim klasifikacijama smatra se podporodicom (Sylviinae) porodice Muscicapidae: maslinica, ??"
5741,Tipski i jedini rod porodice Tarsiidae.
6223,"drvo od jove, jalše; koristi se za gradnju mostova"
13795,hrišćanse veroisipovesti koje su se u XVI veku odvojile od katolicizma
259,prijateljska narav
12532,"mali zdepasti buldog, glatke dlake i četvrtaste glave; najslađi od svih pasa"
8218,koji se tiče Rima i njegovih ljudi
8186,konverzija iz jednog načina kodiranja u drugi
14755,jestivi ptičji organ
4271,Biljka koja segaji zbog jestivih mladih izdanaka i sočnog lišća.
9209,Velike ptice gacalice iz starog sveta koje obično imaju belo-crno perje.
2315,Neka organizacija koja se smatra delom veće društvene grupe.
284,"Mlada ptica, posebno živine."
5388,"Mleti luk u avanu, na primer."
11489,ponoviti odlomak iz nečega
240,Postati ljut.
12197,prilika za posebna veselja da obeleži neki srećan događaj
9471,zemlja kojom upravlja car ili carica
1373,meso sa vrata životinje
1718,onaj koji odbacuje zelenilo na kraju sezone (o biljkama)
3465,Odsustvo veze nečega prema nectem drugom.
8063,Evroazijski orah koji se ceni zbog jestivog koštunjičavog ploda i tvrdog drveta; široko je rasprostranjeno.
8516,Tačka ili širina u prostoru.
10923,deo južnog Tihog okeana prema Antarktiku
2490,osoba stručna za simboličku logiku
10807,jedan lolojski jezik
136,intenzivna ojađenost
16878,stanovnik Zaira ili poreklom iz Zaira
776,relative large gnawing animals; distinguished from rodents by having two pairs of upper incisors specialized for gnawing
4798,Od nekoga nešto tražiti ili zahtevati.
1265,"Hemijska supstanca koja može da se širi municijom i drugim sredstvima i da izazove smrt i obolevanje ljudi, životinja i biljaka."
17005,izraziti čestitke
7721,bantu jezik
9544,vojna jedinica u kojoj su strani dobrovoljci koji služe državi
7612,zeleno kiselo voće vrste limun
431,"Obično aromatično žbunje i trabe severnih umerenih predela, Južne Afrike i zapadne Južne Amerike: ????"
14362,Događaj kada se istovremeno dešavaju dve ili više stvari.
16010,muzički događaj koji izvode svirači ili pevači koji ne uključuje pozorišno prikazivanje
17106,čin kojim nešto postaje šire
11871,lider koji u političkoj partiji kontroliše glasanje i diktira imenovanja
17382,mek srebrnobeo tokisčan metal koji se koristi u legurama gvožđa; javlja se u veiše slo\enih minerala među kojima su patronit i vandanit
11857,bučna zabava
1261,prekursor leukocita koji se obično pojavljuje u koštanoj srži
4718,uobičajena evropska krastava žaba.
6647,koga odobrava ustav ili je u saglasnosti s ustavom ili funkcioniše u okvirima ustava
494,porodica severnoameričkih indijanskih jezika kojima se govori na jugozapadu SAD
5761,koji se odnosi na biologiju ili na život i živa bića
13583,Gornja odeća koja pokriva telo od ramena nadole i nosi se napolju.
2876,"Vod koji se sastoji od šupljeg, obično cilindričnog, objekta koji se koristi da drži i provodi tečnosti i gasove."
9166,osnovna novčana jedinica Turske
4578,Prostor za jedan štampani red širok kao i stubac a dubok 1/14 inča; koristi se kod reklamiranja.
6578,Privremeno prekinuti aktivnost pre nego što se nastavi.
3633,ukazati na neophodnost kakvog zahvata (u medicini)
14708,"Vodozemci samo sa jednim, prednjim parom nogu. Spoljašnje škrge zadrxavaju kao i protej celog života; nemaju očne kapke; majušne oči se provide kroz kožicu koja ih pokriva."
1350,vrsta jakog likera destilovana iz fermentisanog palminog vina ili fermentisane melase
6913,"tčin dovođenja nečega do najvećemoguće tačke, vrednosti ili pozicije"
9711,Izazvati da bude u radnom stanju.
11463,izumrli osko-umbrijski jezik drevne Italije na kome je sačuvano samo par zapisa
12697,bilo koji od dva znaka interpunkcije ({ ili }) koji služe da zagrade deo teksta
2906,isti izgovor za reči različitog porijekla
375,struktura sačinjena od ili koja sadrži krvne sudove
9970,glavni i najveći grad Šri Lanke
3745,spiny-finned food fishes of warm waters having well-developed teeth
638,rod evroazijskih trava kod kojih se smenjuje lišće i cvasti upadljivih zvončića.
4043,Tipski rod porodice Tragulidae.
10268,"žičani instrumenti koji su prethodili violini, koristili su se do 18. veka"
1576,"ponovljen pokret udovima i telom pri plivanju, veslanju i sl."
3669,koji je korenskog tipa; koji je povezan sa lingvističkim korenom ili koji čini isti
11607,Linija na karti koja povezuje tačke koje imaju istu brojčanu vrednost neke promenljive
5325,strmi visoki obronak ili stena
3663,HN
5243,transmisija koja će pokrenuti kao odgovor transmisiju od transpondera
1052,neko ko piše romane
334,Svetlozeleno deciduous senovito drvo južne Evrope.
8085,otpočeti poduhvat
6910,koji se odnosi ili je karakterističan za Istočnu Nemačku
2835,Godišnja biljka od Mediterana do Portugala; ima bodljikave čašične listiće.
3482,Objekat koji je stvorio čovek uzet kao celina.
6938,Uglavnom tropski višegodišnji žbun koji rađa plodove s mnogo semena: slatke i ljute paprike.
15815,"naziv cifre 3, znak koji obeležava broj tri"
12762,novčana jedinica Gvineje Bisao
9894,čin odvajanja ili povlačenja
7970,prostor oko tela koje zrači u kome njegove elektromagnetne oscilacije mogu da deluju na slično telo koje s njim nije u kontaktu
288,grana računarstva koja se bavi pisanjem računarskih programa koji mogu da rešavaju probleme kreativnocreatively
12673,Britanski pisac (rođen u Irskoj) (1856-1950).
13199,oštri alat za obeležavanje površina ili za probijanje malih rupa
12715,mesto stanovanja vojnog osoblja
13184,Telo luxdi koji se bave nekom učenom profesijom.
12362,ženske ovce
13821,Bilo koji skup tačaka koje zadovoljavaju niz postulata neke vrste.
2236,"duboko izbrazdano žućkasto braonkasto tropsko voće; koristi se sirovo kao povrće, u salati ili kad je potpuno zrelo kao dezert"
4779,Skakavac sa kratkim antenama.
11957,period velikih društvenih i političkih promena u Narodnoj Republici Kini od 1966. do 1976. godine
16860,"reč, sintagma ili klauza koji čine deo veće gramatičke konstrukcije"
201,"Neki mali insekt, posebno ušenci, koji sisaju sokove iz biljaka."
9254,Vodene bixke mesožderke; rodovi Utricularia; Pinguicula; Genlisea.
15628,imaju na leđima kožni nabor koji liči na peraje; trbuh im je brazdast; žive u svim morima.
7020,glavni grad Eritreje
4948,u obliku čuna
14295,serija pesama koje povezuje ista tema
16816,figura u ravni koju čine dva poluprečnika kružnice i pripadajući luk
6315,Izazvati da se pokrene udarcem.
9333,glavni i najveći grad Mongolije
16497,Neka od više uglavnom tropskih udava sa ?vestigal zadnjim udovima.
13455,"bibliotečki katalog u obliku listića, kartica složenih u poseban ormar"
4226,koji se odnosi na filozofsku doktrinu relativizma
16078,električno kolo koje je tako napravljeno da uvede proračunato kašnjenje u prenos signala
16824,"Pita koja se pravi od pasirane bundeve, mleka, jaja i šećera."
1127,pržen i mlevan koren biljke cikorije koji se koristi da zameni kafu
4886,Doći u novu zemlju i promeniti stalni boravak.
15419,"koji odgovara književnosti, pre nego svakodnevnom govoru ili pisanju"
1732,osnovna novčana jedinica u Sao Tome i Principe
16116,javna plesna dvorana gde se pleše uz snimljenu muziku
14061,jezik Persije (Irana) u bilo kom od svojih drevnih oblika
11567,Jedan od delova u koje je nešto podeljeno i koji zajedno čine celinu.
351,o ćelijama ili koji se odnosi na ćelije u sporangijama gde se razvijaju spore
4368,deo tela kod čoveka ili životinje ispod struka a iznad butine
693,Specijalista za onkologiju.
5213,novčana jedinica Gruzije
12287,Neka od mnogobrojnih korenskih biljaka iz roda Chenopodium koje imaju male zelenkaste cvetove.
12573,Evropski kozodoj
6917,"država u centralnoj Africi, setkla nezavisnost 1960"
1153,"republika u Centralnoj Americi, postala nezavisna od Španije 1821."
4747,podešavanje koje dovodi do toga da se nešto dešava ili ponavlja usaglašeno
5610,večernja služba za mrtve u Rimskoj katoličkoj crkvi
11982,potopljeni (ili delimično potopljeni) greben u reci ili duž obale
12626,pustinjska oblast na zapadu Australije
14414,politička doktrina Makijavelija: bilo koja sredstva (ma kako beskrupulozna) vladar može da koristiti vladar u cilju uspostavljanja i očuvanja svoje autokratske vlade
9887,Pokretno parče tkiva koje je delimično povezano s telom.
12849,Prestonica Hrvatske.
10311,Biljka iz roda Montia koja imaja jestivo ukusno lišće.
3643,Postati napet ili napetiji.
9496,"kompakt disk koji se koristi sa računarom (a ne sa audio sistemom) ; može se pohraniti velika količina digitalnih informacija i može im se pristupiti, ali ih korisnik ne može menjati"
16127,Red riba koji pripada nadredu Malacopterygii i uključuje somove.
5584,uzrokovati da nešto visi
12659,glavni grad Gabona
6285,Merna jedinica za temperaturu.
11905,"Postaviti znakove, kao duž ceste."
3873,Hermafroditska suvozemna ili vodena glista čije su bodljike raspoređene duž tela.
12146,Gljive koje proizvode po površini obično belu naslagu organske materije.
15210,malo bobičasto voće
13552,antivirusni protein koji proizvode ćelije koje su napali virusi; sprečava razmnožavanje virusa
2549,Događaj koji se ponavlja u određenim intervalima.
13846,savezna vlada Sjedinjenih Država
7825,deo skupa opisa operacija koji specifikuje operacije koje će se izvršiti; skup operacija računara
8289,Kamila sa dve grbe iz hladih pustinja centralne Azije.
8306,koji se odnosi na muzikologiju
1284,uređaj za nanošenje supstance
1734,Žena-domaćin.
7626,cifra od 0 do 7 u oktalnoj notaciji
11120,(o stihovima) koji ima oblik zasnovan na broju slogova a ne na ritmičkom uređenju bez naglašavanja ili brojanja
68,"U skolastici, jedna od četiri vrline koje dolaze od prirode."
8188,sve balkanske države zajedno
8135,"Korovska biljka jakog mirisa iz starog sveta; čine je biljka koje se ponekad uključuju u druge rodove: Tanacetum, Tripleurospermum"
11188,Muškarac koji je aristokrata.
12599,"pasulj krupnog zrna, tamno-crvene boje"
8291,mek srebrnkast metal; redak u zemlji
7793,pismeni ispit
13239,"intenzivno učiti, kao pre ispita"
7958,"živina punjena, kuvana i prekrivena aspikom; servira se hladno"
15684,Zeljasta povrtarska biljka zadebljanog korena koji se upotrebljava za jelo.
4318,Tipski rod porodice Castoridae: dabrovi.
7484,izlistati u indeksu
8185,Drška biča.
12090,krater u kome je prikupljen kosmički materijal koji je pao na zemlju
6501,Neotrovni člankonožac sa valjkastim telom i 20 do 100 ili više članaka od kojih skoro svaki ima po par nogu.
10291,tipski rod porodice Pandionidae
242,Koji nije potreban.
3862,beli glinasti mineral
16500,"Nezreli samostalni oblik većine beskičmenjaka, vodozemaca i riba koji se posle izleganja iz jajeta suštinski razlikuje od roditelja i mora da prođe metamorfozu."
402,"Azijski bivo, često domaća životinja, koristi se za vuču."
6930,Radio-aparat kod koga se stanica bira pritiskom na dugme.
263,"ono što je dobro, vredno ili korisno"
10453,Pokretna pregrada nalik vratima u zidu ili ogradi.
10260,Zgrada namenjena sveštenstvu.
11884,naredba da se neko pojavi lično na određenom mestu u određeno vreme
5183,Broj koji se deli nekim drugim brojem.
13361,grana fiziologije koja izučava mehaniku i anatomiju u vezi s ljudskim kretanje
16050,Vladina zgrada u kojoj je rezidencija i kacelarija predsednika SAD-a.
7432,staviti u redosled za sudski postupak
12307,Govoriti tiho ili nejasno.
11942,Trčati ili kretati se veoma brzo ili užurbano.
9552,(računarstvo) oblast ekrana u grafičkim korisničkim interfejsima na kojoj se pojavljuju ikonice i prozori
9080,indijski gramatičar čija je gramatika sanskrita prvi poznati primer deskriptivne lingvistike (oko 400. godine stare ere)
15346,Jednogodišnja biljka rodom iz Južne Amerike koja ima podzemnu jestivu stabljiku; rasprostranjena baštenska biljka; loza je otrovna.
9521,emitovati preko radio ili televizijskih talasa
13354,u nekim klasifikacijama se definiše kao carstvo
6217,Porodica lišajeva.
13443,program koji ispituje druge računarske programe da li su sintaksički ispravni
6817,"prave veverice, mrmoti, leteće veverice"
6051,novčana jedinica Zambije
16584,povezani su sa parazitima malarije i imaju fazu u razvoju koja se odvija u visceralnim (unutrašnjim) organima ptica
2908,koji je karakterističan za dete
4911,Mali kukci sa jednim parom dlakavih krila; razvijaju se u mahovini i u vlažnom povrću.
16993,Boja bledo ili umereno sivo ljubičasta.
2106,nezrela životinjska ili biljna ćelija koja se razvija u gamet u mejozi
262,komad otvorenog zemljišta za rekreacijsku upotrebu u gradskoj zoni
9220,bilo koja štapičasta baterija
6075,mehanizam koji prenosi magnetnu traku preko glava za čitanje i pisanje uređaja za slušanje s magnetne traka ili za pisanje na nju
12961,"majonez sa renom, rendanim crnim lukom i čili sosom ili kečapom; ponekad sa dodatkom kavijara"
421,grana tai jezika
1324,Ptica plivačica samrežastim stopalima.
1479,Krupna morska i rečna riba hrskavičava kostura.
12927,rat između SAD-a i Španije 1898
10015,mesto gde se stupa nogom dok se silazi niza stubište
229,razgnevxlen nečim nepravednim ili pogrešnim
1371,"Potpuno razvija osoba, od doba zrelosti nadalje."
8322,"Najduže jezero na svetu, u centralnoj Africi, između Tanzanije i Konga"
16070,Neko govedo posebno iz roda Bos ili blisko povezano sa Bibos
3820,džin napravljen u Holandiji
5346,čovek koga su odgojili majmuni; junak serije romana od Edgara Rice Burroughs
5685,Ljudi uključeni u određenu vrstu komercijalnog posla.
17042,Francuski pesnik (1821-1867).
1349,Kompleksna kompozicija znanja kao elemenata i njihovih kombinacija.
15928,odrediti zbir čega
17015,delovi pesničkog dela
5796,dijalekat sotoa kojim govori narod Basoto; zvanični je jezik Lesotoa
6105,"u računarstvu, sićušan elektromagnetni kalem i metalna šipka koji se koriste za čitanje i pisanje magnetnih obarazaca na disk"
6485,"zajednički naziv za grupu malih, jestivih školjki koje imaju okruglu ljusku sa sjajnim rebrima"
1,kuhinjska sprava za ceđenje soka iz voća
3259,"postati kristal, pretvoriti se u kristal"
16366,Koji sadrži fosfor ili ima karakteristike fosfora.
12290,teorija grupa primenjena na rešavanje algebarskih jednačina
8893,bilo koja od nekoliko označenih zona na terenu gde su smešteni udarač ili hvatač ili treneri
255,Proceniti da je nešto dobro; misliti pozitivno o nečemu.
2653,zamenjivanje opštijeg termina manje opštim ili obrnuto
1915,"Noseća struktura ramena koja se sastoji od mišića i tetiva koji pričvršćuju  ruku za rameni zglob i koja omogućava ruci da se pokreće. Predstavlja snop tetiva četiri mišića rotatora ramena (supraspinatus, infraspinatus, teres minor i subscapularis), koji obavijaju glavu nadlakatne kosti (humerusa)."
4253,Rezati pilom.
2201,od očevog imena
747,veliki pingvini
174,Postati stabilan ili stabilniji.
5064,"majonez sa estragonom ili mirođijom, seckanom potočarkom i spanaćem ili krastavcem"
5350,subvencija dodeljena sudskom odlukom
11619,Specifikovana mera za količinu.
2776,proučavanje pravila za formiranje mogućih reči u jednom jeziku
10051,Vitak majmun sa dugim i kitnjastim repom iz Azije.
8116,vozač motornog voza
17198,skup pravila ili propisanih standarda na osnovu kojih se donose odluke
11617,tkivo koje provodi vodu i hranljive materije kroz telo biljke kod viših biljaka
12749,koji se odnosi na fotografiju ili je dobijen korišćenjem fotografije
7509,Rod vodozemaca koji uključuje ceciliju.
8040,"Rođen ili stanovnik Severne, Centralne ili Južne Amerike."
13565,muški valdar imperije
13769,grana tai jezika
2965,"Red glodara koji uključuje: činčile, morsko prase, dikobraze."
11914,Neka od raznovrsnih biljaka iz roda Campanula koja ima plave ili bele cvetove u obliku zvonceta.
10205,Velika zmijuljica koja živi u svime evropskim morima osin u Crnom moru.
2518,Čin izvođenja nečega po dogovorenom redu.
2671,jestiv kvrgav koren različitih jam biljaka iz roda Dioscorea koji se gaje u tropskim predelima
5147,Domaća svinja.
843,pravougaoni komad tkanine koji se koristi za slanje signala
129,koji oseća ili pokazuje ljubav i naklonost
10335,koji se tiče grada Singapura
13753,Višegodišnja zeljasta biljka čiji rizom miriše slično kao đumbir
7366,"Retki torbar mesožder, liči na vuka; živi na Tasmaniji; noćna životinja; danas verovatno istrebljen."
12561,koji ima ili se sastoji od deset slogova
15546,bolest koja je stalno prisutna u većoj ili manjoj meri u određenoj populaciji ljudi ili kod ljudi koji žive na određenom području
1057,farma na kojoj se proizvode mlečni proizvodi
2731,slatkovodna cilijata sa ovalnim telom i i veoma dubokim usnim žljebom
8262,osnovna novčana jedinica Kiribatija
936,veliki fagocit; neki su fiksirani a drugi cirkulišu u krvnom toku (krvi)
14915,Deo Ujedinjenog Kraljevstva smešten na severnom delu ostrva Irska.
6585,fino istkano laneno platno
17184,Vrlo rasprostranjena familija biljaka koje se odlikuju ?circinate cvetovima i plodu nalik na orah.
3583,"u matematici, relacija između parova celih brojeva: ako su oba cela broja parna, ili su oba neprana, onda ta dva broja imaju isti paritet"
1398,Neko ko predaje matematiku
11948,obuća za plivanje; prednji deo poput ploče pomaže pri plivanju posebno pod vodom
9828,imenica koja se izvodi iz glagola (npr. u engleskom dodavanjem sufiksa '-ing')
4281,elektrohemijska ćelija koja generiše elektromotornu snagu pomoću ireverzibilne konverzije hemijske u električnu energiju; ne može da se puni
16611,"Identifikovati, na primer, kao u botanici ili biologiji."
580,Poredak sličnih stvari koje su smeštene ili se dešavaju u poretku jedna za drugom.
11319,teritorija kojom upravlja knez
4097,"nastati, početi postojati"
4288,velika tikva oblika turbana obično sa zaobljenim centralnim delom koji viri od kraja cvetanja
