,Sysnet
7657,"koji se ticati Ruanda , njen ljudi i kultura "
49,koji jesam u sklad sa metoda ili princip nauka . 
13740,neki ko upravljati lutka u pozorište . 
4034,stanarica i skitač koji se vrlo retko sesti 
5227,dva ime za podred tipičan ptica pevačica . 
4776,stanovnik Egipat ili poreklo iz Egipat 
12787,velik poluostrvo u jugoistočni Evropa na koji se nalaziti venac balkanski planina . 
15773,hemijski entitet koji primati elektron koji jesam na on preneti iz neki drugi spoj 
16430,rod porodica Vespertilionidae . 
9810,jumanski jezik narod Javapai 
9224,"visok žbun-penjalica sa mirisan beo , žut ili crven cvet , koristiti se za parfem i u čaj . "
17110,matrica koji se dobijati kada se razmena vrsta i kolona dat matrica 
11697,repa beo koren 
13985,crn bordo vino iz oblast Medoc na jugozapad Francuska 
113,"vertikalan dimenzija , udaljenost od osnova do vrh nešto . "
6235,žena - stanovnik Engleska ili poreklo iz Engleska 
2316,neki od mali elegantan jastrebov iz porodica Accipitridae sa dug šiljast krilo koji se hraniti insekt i manjiti pticamaed wings and feeding on insects and small animals 
1070,bivši osnovni novčan jedinica Surinam 
2247,ulaz u biti koji telesni šupljina 
47,"Ući u nešto ili kroz nešto , često savaladavajući otpor . "
302,"označavati povlačenje libido , kada se već dostignut zreo stupanj razvoj vraćati na ranije cilj i objekt , odnosno , na već prevaziđen i nezreo oblik ponašanje i zadovoljavanje ; javljati se kao reakcija na frustracija ili na traumatski doživljaj ; do regresija dolaziti kada se na put zreo način zadovoljenje naići na prepreka , a osoba jesam u stanje da pronaći odgovarajući rešenje "
13491,"onaj koji odgovarati određenoj osoba , mesto , stanje i sl . "
13056,vreme se približavati 
385,kritički upoređivati tekst 
8375,polovina jedan sat 
12866,promeniti se iz gasovit u tečan stanje 
13908,stanovnik Grčka ili poreklo iz Grčka 
10421,dvoje ljudi koji jesam u brak jedan s drugi . 
7271,"plastičan kartica koji sadržati mikroprocesor koji omogucćava vlasnik da obaviti operacija koji zahtevati podatak uskladištiti u u mikroprocesoru , obično se koristiti za obavljanje finansijski transakcija "
14729,"sav odeća , uključivati i dodatak ( obuća , nakit , šešir , itd . ) "
15682,polje nauka koji obrada komunikacija i kontrola 
155,na visok nivo po rang ili značaj 
515,boginja plodnost i zaštitnica brak u drevan mitologija ; u rimski mitologija ona odgovarati Cerera 
14875,neki žbun ili drvo iz rod Tamarix koji imati malo igličast lišće i perast ? mali beo i ryžičastih cvet ; rasti u priobalan kraj na slan zemljište . 
9796,alpski višegodišnji biljka poreklo iz Evropa čiji jesam lišće prekriti beličast dlačica a beo cvet jesam u oblik zvezda . 
3240,"velik dimljen kobasica gladak tekstura od govedina , teletina i svinjetina "
2754,Žlezda koji izlučivati spolja kroz ? 
173,Čista nezaslađen čokolada koji se koristiti za kuvanje ( za pravljenje kolač ) . 
259,"koji karakterisati ili koji pokazivati prihvatanje , slaganje ili uverenost . "
9165,postati čvrst . 
13323,"Pet seksualan i socijalan faza u razvoj ličnost koji se javljati tokom adolescencija , interes se fokusirati na seksualan aktivnost . libido se ponovno pokretati i manifestovati se kao sklonost prema suprotan spol . kada čovek usmeriti pažnja prema jedan osoba za koji se opredeliti , prema Fojdu , tada jesam postignuti sav pun razvoj . "
13264,Učiniti toplim ili topao . 
16167,ptica koji se loviti iz star i nov svet iz familija ? ; nastanjivati močvaran zemljistxa ; nalikovati detlić ? 
7947,osnovni novčan jedinica Ukrajina 
6431,poklapati se sa red Apterygiformes . 
11859,"mineral koji se sastojati od litijum-aluminijumovog silikat , izvor litijum "
830,suvozemni crv koji dupsti zemlja i pomagati ulaženje vazduh u ona ; često pokrivati zemlja posle kiša ; ribolovac jesam koristiti kao mamac . 
10666,kozica 
4025,verovanje plemenski društvo 
4746,neki od brojni morski sisara koji dolaziti na obala da se para ; nastanjivati uglavnom hladan područje . 
11,pojava promeniti nagore . 
269,objaviti sudski presuda ( neki ) 
11069,Štitasta vaš . 
16674,pripitomljen zelen papagaj sa crveno-crnim repa i beo lice ; poreklo iz ekvatorijalan Afrika . 
13671,posuda za kuvanje od emajliran čelik 
14735,koji se ticati seoski stvar 
10083,neki od mnogi penjačica iz rod Convolvulus i Calystegia koji se uvijati . 
6767,mlazni ili raktni motor ili raketa koji se zasnivati na vrsta aerodniamičkog pogon kod koji voziti emitovati strujanje velik brzina 
10084,poželeti dobrodošlica koji ; pozdraviti koji na dolazak 
12524,"ljudski tvorevina koji se dobijati tkanje , štrikanje ili kukičanje od prirodan ili veštački vlakno . "
10930,Ušati perajar južne hemisfera ; loviti se zbog skupocen krzno koji jesam poznati pod ime silskin . 
6122,"upotreba određenih znak radi pojašnjenje značenje pisan materijal grupisanje reč gramatički u rečenica , klauzula i fraza "
11678,"u računarstvo , bezbednosni sistem koji se sastojati od kombinacija hardver i softver i koji ograničavati izloženost računar ili računarski mreža napad haker ; najčešće se koristiti za lokalan mreža koji jesam povezati sa internet "
2768,mreža lokalan produčja koji koristiti visokofrekventan radio signal za transmisija i primanje podatak na kratak razdaljina ; koristiti ethernet protokol 
650,čin bezbolan ubijanje neki ( posebno neki ko patiti od neizlečiv bolest ) 
11080,"Najmanja od sav ptica , šaren perje i velik kljuna . "
16260,upravljati vozilo ili ga kontrolisati 
10199,"velik ulazni dvorana ili prijemni sob , odnosno prostor "
15852,"koji se odnositi na monogamija , koji imati samo jedan supružnik "
5914,menta čiji stabljika imati ukus jabuka ; iz južne i istočni Evropa . 
3881,tipski i jedini rod porodica Ephedraceae : tropski i suptropsko zimzelen žbunje ili puzavica poreklo iz suv i nepgodnih područje . 
5415,priča o mitski ili natprirodan biće ili događaj 
7855,grbica koji se koristiti u zimski dan kao salata 
12196,osnovni novčan jedinica Sejšeli 
8255,sresti se 
16000,dvokrilan morski školjka koji živiti u pesak ili blato . 
14971,Čin koji se neki ili nešto remetiti ; pokretati nešto . 
15312,uvučen ili udubljen prostor 
2794,u grčki mitologija Jokastin brat i Antigonin ujak koji jesam postati kralj Teba posle Edipov pad 
13158,evropski metvica koji se primiti u SAD-u . 
1752,velik i raznovrstan porodica zimzelen i listopadan drveće ; ponekad uključivati i porodica Hydrangeaceae . 
8619,Škotski dramski pisac i romanopisac koji jesam stvoriti lik Petar Pan ( @card@ ) 
748,strana koji se viditi ili koji prvi dolaziti . 
1189,čin koji se opisivati pojedinačan događaj ili tok događaj 
14581,glavni lik u literaran delo 
10623,"razbiti u deo ili komponenta , izgubiti kohezija ili jedinstvo . "
14134,neki od mali ptica s kratak repa i oštar kljuna koji puziti uz drveće i hraniti se mali orah i insekt . 
8342,"tanak , ravan kolač bez kvasac koji sadržati ovseno brašno . "
12681,provodnik koji se koristiti da ostvariti kontakt se neki delom kolati 
14852,period vreme koji iznositi @card@ / @card@ dan 
667,mesto na koji se prizauju film 
4989,Nešto što se koristiti za ulepšavanje . 
16098,"o tragikomedija , koji se odnositi na tragikomedija ili jesam karakterističan za tragikomedija "
11943,crn odora koji dosegnuti do članak koji nositi sveštenik . 
1138,postaviti . 
10772,velik morski ptica koji jesti riba ; imati četiri prst na mrežast stopala . 
15987,hleb u oblik tanak palačinka ; pripremati se u tiganj . 
14211,morski kokot 
15996,bivši osnovni novčan jedinica obala Slonovače 
7290,jedinica za dužina koji iznositi @card@ metar 
2350,sposobnost da se vispren procena situacija ili okolnost i da se izvući čvrst zaključak . 
905,deo ili odeljak putovanje 
15137,živiti na istok Severne Amerika 
5012,javan tužilac jesti država . 
16282,putovati ili transportovati se prevozni sredstvo . 
994,Životinja koji jesam uvežbati i koji se koristiti za težak rad . 
10607,jedan od dva kraj nešto što imati dužina . 
14746,hrskav taman crven jabuka 
4243,disciplina koji se baviti princip vođenje rat . 
15846,"Duvački instrument od pečen glina ili porculan , dužina do 15cm ; na jajast kljuna nalaziti se izvući pisak za duvanje u vida kljuna , a duž svirala nekoliko rupica za prst . "
6951,pripadnik narod južne Afrika koji živa u Svazilend i okolni teritorija 
4898,tako sa pileći punjenje 
14992,porodica jezik koji se govoriti u južnoj i jugoistočni Azija 
14176,"lipov drvo , kao građa i gorivo "
16886,novčan jedinica Portugal 
15219,objašnjenje čovekov poznavanje maternji jezik 
4074,evropski biljka iz porodica žbljarki s modar cvet . 
6062,red ptica trkačica : nojev i izumro vrsta . 
10828,kolekcija knjiga sačinjen ubrzo posle Hristov smrt ; drugi polovina hrišćanski Biblija 
14762,nalog apelacioni sud koji se zahtevati od sud koji posedovati pisan ( trajno zabeležen ) postupak da navesti dokumentacija sa ( taj ) suđenje 
235,rečni rak 
4846,"osoba koji zamenjivati dete prirodan roditelj , ali koji ga jesam zvanično usvojiti . "
9359,Lovački pas trenirati da pronalaziti ustreljen ptica . 
11442,mnogi uobičajen buva koji napadati čovek i domaći životinja . 
8685,"Učiniti prazniti , osloboditi sadržaj . "
5451,porodica uglavnom drvenast cvetnica-dikotiledona sa jednopolan cvet koji se često rađati u ? catkins . 
2973,glavni grad Maldivi 
13335,velik škamp dinstati na ulja ili puter i beo luka 
5715,grupa ostrvo u Bizmarkovom arhipelag 
8448,suprug nečiji roditelj u sledeći brak . 
11841,"francuski koji se govoriti u Kvebeku , Kanada "
145,"govoriti nerazgovetno , obično tih glas . "
9503,glavni grad Vijetnam smešten u Severnom Vijetnam 
16663,secretary birds 
8171,naučni izučavanje jezik 
3096,objekt u pasivan konstrukcija 
174,u rimski mitologija boginja sreća i sretan slučajnost ; u grčki mitologija ona odgovarati nTiha 
16963,svaki racionalan ili iracionalan broj 
13248,koji se ticati Moldavija i njen ljudi 
16181,tezga na koji se moći dobiti hrana ili pića 
16862,sistem pravosudni organ koji predstavljati sudski vlast 
9033,majanski jezik koji govoriti narod Kakčikel 
8679,"Australija , Novi Zeland i susedna ostrvo Južnog Pacifik "
11546,koji strogo ograničavati referencija modifikovan reč ili sintagma 
9230,davanje religiozan instrukcija 
6099,zaliv u Sredozemnom mora na jugozapad Turska 
13836,vojni jedinica koji jesam deo kopnen vojska . 
12147,koji se odnositi na particip ili koji jesam formirati od participa 
12097,punč napraviti od vino klaret i brendi sa sok od limun i šećer i ponekad višnja ili Kurasaom i svež voće 
16432,o sociobiologiji ili koji se odnositi na sociobiologiju 
5592,"zid u Jeruselimu , svetinja Jevrejin i mesto za molitva ; verovati se da jesam načiniti od ostatak Solomonov hram "
9558,skandinavski liker obično začiniti semeni kim 
12309,gostionica koji se sastojati od bara i trpezarija gde se služiti lak jela . 
8483,"glavni grad demokratski republika Kongo , ne reći Kongo , preko put Brazavil "
8005,pravnik koji za država i u njen ime podizati optužnica 
13843,osoba uključiti u trgovački ili industrijski posao 
5969,školjka u sos od beo vino koji se služiti u ljuska 
89,stanje zatočenosti ( obično za kratak vreme ) 
15924,sluznica retikuluma ( ili drugi želudca ) preživar koji se koristiti u ishrana 
14858,"koji jesam služiti da predstvalja nešto , kao tipičan primerak nešto "
194,"u računarstvo , tehnika koji jedan mašina postignuti isti rezultat kao drugi "
1689,Polivalentni nemetalni element iz porodica azot koji se obično javljati u neorganski fosfatnim stena i kao organski fosfati u živ ćelija ; visoko jesam reaktivan i javljati se u nekoliko alotropskih oblik . 
6811,čokolada visok kvalitet koji sadržati najmanje @card@ procent kakao-putera 
10273,pridat značenje nešto . 
10795,knjiga koji sadržati kalendar i prazan prostor za beleženje termin sastanak 
16640,osnovni novčan jedinica Poljska 
160,Oosba koji pokušavati da se dopasti ili da zabaviti . 
15879,neki od mnogi morski gastropoda sa spiralno uvejenom kućica . 
5519,praviti antilopa ; ? cattle ; bik ; ovca ; koza . 
1313,biti koji od vrsta reč tradicionalan gramatika 
9464,mutacija koji se dešavati usled intramolekularne reorganizacija gen 
12426,bantu jezik blizak povezati sa jezik zulu 
5411,program koji se koristiti za pregled HTML dokument 
4983,konstrukcija motorni vozilo koji činiti čelični okvir na feder koji držati telo automobil i motor 
16772,tipski rod porodica Apterygidae : kivi . 
351,o ćelija ili koji se odnositi na ćelija u sporangijama gde se razvijati spor 
11352,posao u neki organizacija . 
5963,primeniti sila tako da se izazvati kretanje prema izvor kretanje 
5479,familija biljka iz red Campanulales ; U neki klasifikacija uključivati Lobeliaceae . 
13293,kuhinjski pribor ( daska ili ručak ) sa žica za sečenje sir . 
10799,pevati treperav glas . 
1051,Žbun koji cvet i rađati bobica ; poreklo sa severni hemisfera . 
5951,grupa ostrvo koji pripadati Karibi 
13341,mera za kapacitet komponenta strujni kola u koji jesam naelektrisanje 
10833,neki od različit svetlo koji se koristiti u pozorište 
10636,koji se odnositi na materijalan stvar i prirodan zakon ( a ne na živ biće ) 
10702,vrhunski pokretač koji predodređivati tok događaj ( često se personifikovati kao žena ) . 
15892,deo Tihog okean kod istočni obala Azija 
11854,Višeodišnja aromatičan trava koji često formirati pokrivač ; iz severni umeren područje ; stolistak 
11890,odbacivanje čin zabrana 
15145,obrada podatak kod koji se određivati koji hteti se operacija izvršavati preko sistema prioritet 
793,pustinja u centralni Azija 
427,čin uključivanje rasan ili verski grupa u zajednica 
3107,koji se odnositi na ili se baviti filologija 
3995,aktivnost koji se tekstualan poruka pretvarati u kodiran 
8068,"velik pustinja na svet , na sever Afrika "
17406,mali odrezak meso koji uključivati deo rebro 
12750,literatura u metrički forma 
9669,reptil koji imati par otvor u lobanja iza svaki oka 
3572,stanovnik Burundi ili poreklo iz Burundi 
12901,"torbarski kuna , mravojed , vuk . "
10535,rat između Francuska i pruski koji jesam okončati druga carstvo u Francuska i uspostaviti Nemačka država ; @card@ 
2243,ostrvo u Atlantskom okean koji pripadati Portugalija 
237,merni instrument za merenje relativan vlažnost atmosfera . 
9711,izazvati da biti u radnom stanje . 
11874,inćun 
10431,koji jesam ili se dešavati u neki poodmakao vremenski perioda ili posle očekivan vreme . 
7310,beo hranjiva tečnost koji lučiti sisara i koristiti se za hrana ljudski biće . 
189,koji ne pokazivati dovoljno pijetet prema bog . 
1342,instrument za izrada koji se koristiti za crtanje ili merenje ugao 
202,"kvalitet koji činiti daa jesam nešto poželjan , vredan ili korisno . "
12834,vrlo velik albatros ; beo sa širok crn krilo . 
16553,sistem ili procedura za identifikacija osoba 
2837,mandast tokom koji se držati odrediti pozicija 
16373,utvrđen broj stih koji formirati jedinica pesma 
10691,dugačak riba koji ličiti na šaran ; pronalaziti se u severni Amerika 
5035,dokument koji moći da se uviti ( kao za čvanje ) 
1953,matematički proces pronalaženje makimuma funkcijenction 
256,"zaprljati , onečistiti . "
11289,pričvrstiti pomoću dugmad 
12245,proces u koji jedan ili više supstanca delovati jedan na drugi stvarati nov supstanca 
2896,partija osnovati u Nemačka @card@ koji jesam doći na vlast sa Hitler @card@ 
2959,matrica koji imati isti broj vrsta i kolona 
13579,u regularan korak bez prekid 
3651,grana fizički antropologija koji se baviti izučavanje i merenje lobanja iz koji jesam isključiti mek deo 
14350,čorba od junetina 
4035,muzičar koji svirati neki udaraljke 
2769,Žbunje ili trava . 
11713,red velik ptica koji ne letiti : emu i kazuar 
4551,stanovnik Novog Zeland ili poreklo sa Novog Zeland 
5736,neki od raznovrstan dnevni ptica grabljivica koji imati gol glava i slab kanđe a hraniti se uglavnom crkotina . 
9964,"ljubičast tropski voće koji rasti u Brazil , oblik grožđe sa debeo kor "
12495,profesor koji posećivati drugi koledž ili univerzitet i tamo predavati neki ograničen vreme . 
17404,neki od više ukrasni žbun sa sjajan uglavnom zimzelen lišće i kitica sitan cvet u oblik zvonce . 
10754,divalj mačka srednji veličina iz centralni i Južne Amerika koji imati taman prugast krzno . 
2068,organski pojava koji razlikovati živ organizam od neživ . 
150,"neki vodozemac , morski ili suvozemni , čiji jesam telo zaštićen oklop , a ud jesam kao peraja , prilagoditi za plivanje . "
922,štampač koji postavljati tekstualan materijal u mašinski red 
6684,"asocijacija država zapadni hemisfera stvoriti @card@ da promovisati vojni , ekonomski i kulturan saradnja "
194,koji zasluživati najviše poštovanje i divljenje 
12525,izumro jezik semitski narod koji jesam okupirati Kanan pre izraelski osvajanje 
7408,velik žut plod blago kiseliti sočan pulpa ; obično se posluživati polovina 
5564,Aromatično drvo zapadni Indija ojesti rađati bobica najgvirca . 
8932,tanak šunka dimiti na orahovina ; taman crven meso 
15317,"Sočan , začinjen kolač sa pire od jabuka . "
7982,broj predstaviti u notacija sa pokretan zarez . 
2545,lampa koji raditi na struja . 
6575,težak gvozden alat sa drven ručak i zakrivljen glava koji jesam usmeriti na oba kraj 
214,Osećaj koji se doživljavati u očekivanje neki određenog bol ili opsasnosti i obično ga pratiti želja da se pobeći . 
10867,novac dati kao zalog za artikl zakupljen na odrediti vreme . 
13062,specijalista geologija 
11982,potopiti ( ili delimično potopiti ) grepsti u reka ili duž obala 
765,"sistem simbolički logika koji predstavljati individua , predikat i kvantifikaotre nad individua ( kao i relacija između iskaz ) "
2599,simbol koji se koristiti za predstavljanje broj . 
5565,smanjenje cena namenjen poboljšanje platni balans 
11496,"Pričvrstiti nešto , kao sa konopac . "
5645,varijantni fonološki reprezentacija morfema 
7647,stanovnik Gvineja ili poreklo iz Gvineja 
16850,novčan jedinica Kostarika 
15569,"nastaviti postojati na neki mesto , položaj ili situacija "
10423,grupa predstavnik ili delegat . 
16915,jezik koji govoriti narod Čipeva 
5259,prav vrabac ; ptica iz star svet koji jesam nekad smatrati ? weaverbirds . 
1989,rečnik koji jesam posebno prirediti za onaj koji učiti stran jezik 
4258,"neki od mnogobrojan nizak biljka iz rod Crocus koji imati tanko lišće nalik na trava i beo , žut ili ružičast cvet ; poticati sa Mediteran , "
14618,bod koji se praviti tako što se obmotati konac više puta oko igla pre nego što se ubosti u tkanina 
3597,film na koji se fotografisati materijal u veoma smanjen veličina ; koristan za skladištenje ; sistema za uvećavanje se koristiti da biti se materijal pročitati 
8940,viljuška s koji se služiti za sto pri jela 
6665,rod iz porodica Gentianaceae ; rasprostraniti rod biljka na nizak temperatura ; u neki klasifikacija uključivati i rod Gentianopsis i Gentianella . 
1965,divalj koza planinski predeo Evroazija i severni Afrika koji imati velik zakrivljen rog . 
3130,Češki autor roman i kratak priča ( @card@ ) 
3775,okeanijski jezik koji se govoriti na Fidži 
11345,"tip otpornik čiji se električni otpor menjati sa promena temperatura ; zbog taj osobina , nalaziti primena kao senzor temperaturni promena "
8680,"osnova za poređenje , referentan vrednost u odnos na koji se račnaju drugi "
16331,stanje biti zaposliti ili imati posati . 
7138,komad jagnjetina 
8173,želatin napraviti od piletina 
11169,"struktura skelet kod kičmenjak koji podrzava donji ud kod ljudi , a zadnji noga kod ostalih kičmenjak "
6191,"hemijski supstancija , koji se dodavati reakcionom sistema da biti ubrzati reakcija "
1836,čin prerađivanje nešto 
2234,neki od mnogi jestiv seme iz porodica Leguminosae . 
3656,zajednica glasač koji imati isti interes . 
16123,nacrtati ili napisati skica ili nacrt 
13320,sredstvo komunikacija ili pristup . 
13461,algonkinski jezik koji govoriti narod kriti 
16307,jezik istočno-centralnog afrički narod Tonga ( Zambija i Rodezija ) 
15041,preslica ; poklapati se sa porodica Equisetaceae . 
13968,glas nevidljiv komentator u film ili televizijski program 
11320,"u matematika , suma konačan ili beskonačan sekvencija izraz "
11568,"deo Tihog okean , severoistočno od Australija "
6150,republika u severni delo centralni Evropa na Severnom mora ; osnovati @ord@ godina od zona Nemačka koji jesam okupirati britanski i francuski i američki snaga posle nemački poraz ; ponovo ujediniti sa Istočnom Nemačka @ord@ godina . 
5460,"odeća za gornji deo telo , kakav nositi žena "
1607,forma stih pogodan za obrada junački ili uzvišen tema ; daktilni heksametar ili jampski pentametar 
7381,bezalkoholan pića ; obično gaziran 
195,koji jesam kreativan . 
13066,prestonica Švajcarska ; smestiti u zapadni Švajcarska . 
16403,protagonista koji nemati osobina koji biti ga činiti junak ( ili junakinja ) 
9910,jak zaslađen kafa koji se služiti preko led sa šlag 
10968,nilo-saharski jezik koji govoriti narod Songaj u Mali i Niger 
9677,gljivice koji stvarati površinski sloj na raznim vrsta vlažan ili raspadajuće organski materija . 
7508,embrion lista kod biljka koji rađati seme . 
7769,"Obrad podatak kod koji jesam rezultat potpuno specifikovan pravilo , posebno obrada koji jesam rezultat jedan instrukcija ( u računarstvo ) . "
8278,uređivanje koji podrazumevati da se nešto ponovo napisati 
4695,rod biljka dikotiledona . 
2184,šesto slovo grčki alfabet 
10588,"himalajski jezik koji se govoriti u dolina Katmandu , Nepal "
918,"u grčki mitologija bog morati , Posejdonov sin "
10255,porodica koji činiti sisara . 
1891,"lednik razviti u visok planina , koji urezivati dolina i povećavati raščlanjenost reljef . "
10608,"Reč , na primer zamenica , koji se koristiti da biti se izbegnuti ponavljanje . referent anafora jesam odrediti njen prethodnik . "
5071,apstrakcija koji pripadati neki entitet ili ga karakterisati . 
15991,biti koji od nekoliko srodan jezik Kelt u Irska i Škotska 
15990,biljka sa olovnoplavim cvet . 
2975,nešto što se dodavati jela ( kao peršun ) radi lep ukus ili izgled 
8905,koji se odnositi na ljudski biće . 
12341,operacija koji određivati da li jedan ili više predmet u skup imati odrediti svojstvo 
7602,heljda ; u neki se klasifikacija uključivati u rod Polygonum . 
9266,"visok planinski vrh na Alpi , na granica između Italija i Francusko , južno od Ženeva ; visok @card@ metar "
3225,poluostrvo u centralni Amerika koji ići od Meksičkog zaliv 
7173,Cilindrični kontejenr koji primati tečnost . 
6669,"koji se ticati Filipna , njegov ljudi ili kutlure "
1952,Uobičajeni karakter alfabet koji se koristiti za predstavljanje govor . 
14836,amfiteatralan udubljenje na koji se formirati dolinski lednik . Dekametarskih do kilometarski veličina . 
11535,Ljiljan istočni Mediteran i Balkan sa širok beo cvet u oblik ? 
16689,"kuhinjski sredstvo koji se sastojati od paralelan metalan šipka , koristiti se za pečenje riba i meso "
4277,minimalan distinktivan jedinica u gramatika ; minimalan jedinica koji imati značenje i koji ne moći biti podeliti na manje značenjski jedinica 
3218,proučavanje mit 
2856,tropski ptica iz Južne Amerika ; mužjak imati sjajno crven ili narandžast perje i uzdignut kresta . 
16457,"meso koji jesam mleti , začiniti i spremiti kao pljeskavica ili iskoristiti za fil za kobasica "
1099,glavni i velik grad Burundi 
6013,sijuski jezik koji govoriti narod Dakota 
3367,mali evropski zmijolik gušter bez noga ; popularno se verovati da jesam slep . 
4901,plod morati u Njuburg sos poslužiti na tost ili pirinač 
2892,Vazdušasto slatko punjen pecivo . 
10161,rod iz familija Zeidae . 
1506,zaslađen masa koji se moći duže vreme da se žvakati 
7324,"vrlo rasprostraniti soko , koristiti se u lov "
497,"Neznna uvijuša iz Severne Afrika sa svetlozelen pljosnat stabljika i sjajan lišće , gajiti se kao ukrasni bilje . "
16557,osnovni novčan jedinica u Liberija 
1291,"ptica ; barski ptica dug noga , tanak , dugačak i na kraj zaobljen kljuna , zemljast boja perjati i vrlo ukusonog meso iz red štakara "
7988,u grčki mitologija hrom bog vatra i kovački zanat ; u rimski mitologija on odgovarati vulkan 
10632,"iz grčki mitologija , tragičan kralj Teba koji jesam neynajući ubiti svoj otac i oženiti se majka Jokasta ; tema Sofoklov drama "" Kralj Edip "" "
3451,o tečnost ; teći u sav pravac . 
5530,oblik komunizam koji jesam u Kina uvesti Mao Cetung 
13937,držati šta naciljan i u domet kakav vatren oružje 
12154,"Ograđen prostor za životinja , živina ili stoka . "
2003,morski pacov i izumro vrsta . 
804,"rasti , napredovati ili evoluirati kroz proces evolucija , prirodan rast ili diferencijacija . "
5555,predstavnik radnički zajednica 
120,onaj što jesam u suprotnost sa princip pravda ili zakon 
4251,"evropski labud , često pripitomljen "
8317,konstrukcija kvadrat koji imati isti površina kao neki drugi figura 
173,osobina onaj ko jesam prihvatiti i ne upućivati on se pohvaliti . 
3522,ptica dugačak krilo 
13641,republika na Sejšelskim ostrvo ; steći nezavisnost od ujedinjen kraljevstvo @ord@ godina . 
4005,aparat koji grejati zgrada 
10031,mesnat deo zadnjica ; iza slabina i iznad obao delo 
7943,na-dene jezik narod Haida 
13722,"red insekt koji uključivati pčela , osa , mrav ; itd . "
8954,staza koji se sastojati od popločan površina za pešak - obično pored ulica ili kolovoz 
3314,porodica severnoamerički indijanski jezik jako raširen na srednji zapad među kada narod 
880,redak paprikaš od meso i povrće 
8575,neograničen dvodimenzionalan oblik 
