,Sysnet
19364,Zeljasta dugogodišnja biljka iz porodice troskota koja se upotrebljava i kao ukrasna biljka i u lekarstvu.
4587,američko amber-drvo
2838,"uzročnik marsejske groznice kao i svih ""tifusa koje prenose krpelji"" je Rickettia conorii koju kod nas na čoveka obično prenese krpelj psa Rhipicephalus sanguineus; ređe, čovek može biti inficiran utrljavanjem zaraženog sadržaja zdrobljenog krpelja u oči, nosnu sluznicu ili oštećenu kožu; mediteranska pegava groznica se javlja na evropskim, afričkim i azijskim obalama Mediterana i na obalama Crnog mora"
16363,semantički odnos koji se nalazi između dela i celine
14974,moreuz između Egejskog i Mramornog mora koji odvaja evropski od azijskog dela Turske
13353,"Gudački žičani instrument, razvio se iz viole; ima četiri žice, šuplji korpus i hvataljku bez prečnica za odredženi ton; svira se uz pomoć gudala."
19128,Visoka višegodišnja biljka sa lisnatom stabljikom i belim cvetovima; široko rasporstranjena.
12059,"Tvrd i težak tamni mineral koji je glavni izvor kalijuma; dioksid kalaja, SnO2."
7587,vrsta danskog plavog sira
11924,infinitiv sa prilogom između 'to' i glagola u engleskom (n. pr. 'to boldly go')
88,koji oseća ili ispoljava bol ili žalost zbog greha ili uvreda
205,U kome nema života.
11953,procedura kojom se neki objekti čiste od bakterija i drugih mikroorganizama (obično toplotom ili hemijskim sredstvima)
9555,o biologizmu ili koji se odnosi na biologizam
9168,smanjenje vrednosti stvari usled činjenja ili nečinjenja
2457,dugačka testenina punjena seckanim mesom ili slabim sirom pečena u sosu od paradajza
5775,Azijski dud čiji plod ima boju od bele do bledocrvene; lišćem se hrane svilene bube.
5647,Razdvojiti ili biti razdvojen silom.
5944,prekrivači za krevet
16620,Krajnji spoljašnji ili najudaljeniji region ili tačka.
178,"Ono što nije lako, zahteva veliki fizički ili mentalni napor da bi se ostvarilo. razumelo ili izdržalo."
15685,odrednica u rečniku koja daje objašnjenje reči
18258,bilo koja materija (kao hemijski element ili neorgansko jedinjenje) koje zelena biljka može da uzme i koristi u organskoj sintezi
7290,"bog vina, plodnosti i drame; grčko ime za rimskog boga Bahusa"
4662,Dobavljač (posebno narkotika).
14669,Tvrdo žuto (šareno) drvo masline; koristi se u stolarstvu.
775,izumrla vrsta velikih guštera koji su živeli u vodama
18074,koji je karakterističan za ili koji odražava takav oblik vlasti u kome je vlast podeljena između jedne centralne i nekoliko regionalnih uprava
10851,"Prevozno sredstvo namenjeno kretanju po vodi, kroz vazduh ili svemir."
1889,električni uređaj koji se sastoji od izoliranog panela sa prekidačima i brojčanicama i brojilima za kontrolu drugih električnih uređaja
6952,rod porodice Scolopacidae
9386,Krvni sud koji odvodi krv iz srca u telo.
19195,"Odvezati i osloboditi, kao od šarke."
6701,zbog štete koje je nanosio u poxlima već je istrebljen
15854,Mirođija.
333,Veliki rod suvozemnih paprati tropskih i suptropskih predela; ponekad se smešta u porodicu Polypodiaceae.
6025,sudski dokument kojim se lice poziva na sud da odgovori na optužnicu (optužbu)
16625,oda koju peva hor u klasičnoj grčkoj drami
5608,"Plava riba slična srdeli i skuši, usta uzvinutih prema gore."
19010,epska poema koju je napisao Dante
5786,"Simbol u staroj rimskoj notaciji; I,V,X,L,C,D,M predstavljaju brojeve 1,5,10,50,100,500,1000 u arapskoj notaciji."
5558,Tipski rod porodice Suidae.
18032,"glavni grad Maroka, na Atlantskoj obali"
17758,Kontinualno uvećavati deonice korišćenjem planiranog profita kao osnove za kupovinu novih iznosa.
11167,"meki, punomasni kravlji sir svetlo-žute boje sa tankom i belom koricom"
8286,Kim.
3751,nosač samo zvučnog zapisa
3709,Napraviti rupu u nečemu.
4948,jedan zahtev
2500,Poklapa se sa redom Podicipitiformes.
14052,Nešto što se daje za pobedu ili nadmoć na takmičenju ili borbi.
8798,Koji se odnosi na ostrvo ili ima karakteristike ostrva.
10395,alpska kokoš
6546,površ koju čine dva poluprečnika kružnice pod pravim uglom ipripadajući luk
12094,"u računarstvu, bezbednosni sistem koji se sastoji od kombinacije hardvera i softvera i koji ograničava izloženost računara ili računarskih mreža napadima hakera; najčešće se koristi za lokalne mreže koje su povezane sa Internetom"
11076,"onaj koji poseduje svojstvo lepljenja, priljubljivanja"
8485,"Domaće govedo Južne Amerike, tropske Afrike i Madagaskara s grbom od masnog tkiva"
6107,avion koga pokreće jedan ili više mlaznih motora
1212,grampozitivne štapičaste bakterije koje proizvode mlečnu kiselinu naročito u mleku
5372,višegodišnja biljka istočne Severne Amerike i Azije koja ima aromatičan gomuljast koren: ginseng
4864,"obezbeđuju pristup, ulaz nećemu"
3822,Ukloniti u malim komadima.
13655,"Posmatrati, proveriti i pregledati pažljivo."
65,osoba koja ne prihvata nove ideje
10293,Dovesti stvari ili mesto u red.
2666,Leva strana broda ili letelice u odnosu na nekoga ko je nasuprot pramca ili nosa.
12313,institucija (zavod) u kojoj su zatvorena lica u cilju njihovog kažnjavanja i kako bi se javnost od njih zaštitila
17143,mali pljosnati kvadratni pravougaoni komad stakla na kojem se mogu montirati uzorci za mikroskopsko istraživanje
14550,"čadski jezik kojim se govori u severnoj Nigeriji, blizak jeziku hausa"
16641,"(šahovska figura koja može da se pomera za više polja, paralelno sa stranama šahovske table"
4808,Ženka konja.
8153,Manifestovati nešto ili izneti na videlo.
523,Čin iznošenja predloga.
4203,malo tamno ljubičasto voće koje se najčešće koristi za džemove i pite
15280,Telo koje služi u administrativnom svojstvu.
15311,utvrđeno brdovito područje između južnog Libana i južne Sirije
17248,kuvanje napolju gde je glavno jelo pržena riba
9087,bitan rani obrok koji uključuje i čaj
3189,"običan labud starog sveta, poznat po zvonkom i prijatnom glasu"
4206,osnovna nočana jedinica u mnogim zemljama; vrednost joj je 100 centi
12196,"Beskorisna aktivnost; koristiti, rasipati ili trošiti bez razmišljana i neodgovorno."
90,razvijati se u pozitivnom smeru
5154,Siser nalik mački koji luči cibet koji se koristi u parfemima.
10016,Sistematsko sredstvo komunikacije koje koristi zvuke ili konvencionalne simbole.
1681,Obični crni evropski drozd.
1630,proučavanje pravila za formiranje mogućih reči u jednom jeziku
12592,Visoki lonac u kome se kuva kafa.
122,Osoba koja kontaktira sa drugima.
9160,nedešifrovano pismo koriščeno na Kritu u 17. veku pre nove ere
4367,Čin kojim se nešto stavlja u pokret.
13020,"šesti od sedam kanonskih časova molitve, pada predveče, danas je to javna služba nedeljom"
3098,planinski lanac na istoku Kalifornije
15348,"u računarstvu, sibol koji se pojavljuje na na ekranu da ukaže da je računar spreman da primi komandu"
4067,"cenjkati se (oko cijene, uslova ugovora, itd)"
15596,vrsta malih riba sltakih ili slanih voda (posebno haringe); obično se kuvaju cele
4957,Priobalska sredina koja je i za vreme oseke pod vodom.
15750,Proizvoljni pisani ili štampani znak koji je primio konvencionalno značenje.
18288,"Ljiljak dugih ušiju, izlazi u lov dockan uveče."
5336,bakalar koji se prvo usoli pa se onda suši; koristi se za tortu od bakalara
10991,odeljenje u zatvoru (koja se obično sastoji od nekoliko ćelija)
5999,koji se odnosi na afričke narode koji govore bantoidnim jezicima ili na njihovu kulturu
10479,bela arktička strnadica
17946,Noćna divlja mačka iz centralne i južne Amerike koja ima svetložuto i smeđe krzno sa tamnim pegama.
14548,"planinski lanac u centralnoj Evropi koji se proteže od Slovačke, južne Poljske na jugoistok do zapadne Ukrajine i severoistične Rumunije"
14547,Sredstvo za čišćenje napravljeno od soli biljnih ili životinjskih masti.
941,"Tipski rod porodice Nepidae: tipični vodeni škorpioni, telo im je izduženo ovalno."
7980,čin organizovanja poslovne aktivnosti ili aktivnosti koja je s poslom u vezi
3307,za kineska jela: pravi se od zrelih šljiva i čatnija
2543,Poreklom sa pacifičkih ostrva; ima jestiv plod čije tkivo nalikuje na hleb.
14063,sok od grožđa
13732,Otvor tegle ili boce
2227,beli mineral koji se sastoji od magnezijum sulfata i kalijum hlorida; izvor kalijumovih soli
16825,sposobnost onoga što je stabilno i na sigurnom i nepomično fiksirano na jednom mestu
7786,koji se odnosi na predlog ili koji je formiran od predloga
9603,"Ruski pisac, 'Doktor Živago' (1890-1960)."
6854,pas srednjeg rasta specijalno uzgajan za potrebe lova na lisice
3637,Tropsko američko drvo koje rađa kakaova zrna.
14597,Rod trava ili žbunja penjačica ili puzačica:ladolež.
6200,"Mala riba vretenastog oblika; na gornjoj strani, pred lexnom perajom strše tri ili više bodlji; trbušne peraje nalikuju bodljama."
4607,U nekim klasifikacijama smatra se posebnom porodicom.
2434,operacija koja priprema novi karakter za štampanje ili prikazuje sledeći red
14336,snabdeti odećom ili odenuti
1574,Koji pripada ili je ograničen na blizinu.
8966,vojna jedinica manja od divizije
16543,oprema koja se sastoji od skupa predmeta ili alata za određenu svrhu
6046,"Neka biljka iz roda Corchorus od čijih se vlakana prave vreće, sagovi, pojasi i slično."
9651,Čin ili način na koji se nečega oslobađa.
14341,kontraceptivno sredstvo u obliku pilule koja sadrži estrogen i prgeseron koji sprečavaju ovulaciju i tako onemogućuju začeče
3092,tvrd zeleni mineral koji se sastoji od natrijum aluminijum silikata u monokliničnoj kristalnoj formi; izvor žada; prvenstveno se nalazi u Burmi
7887,Evropska zeljasta biljka koja miriše na beli luk.
17163,Čin isporučivanja ili raspodele nečega (kao što su dobra ili pošta).
14365,(računar) utičnica na mikroračunaru koja prihvata štampanu ploču
16170,Novac napravljen od zlata.
6142,Tačka u kojoj se tri površi sreću ili presecaju.
18308,"grana medicine, koja proučava promene na bolesnim organima, način nastajanja tih promena i kako se te promjene odražavaju na čitav organizam."
95,"Uklanjanje prepreka, ograničenja."
12729,mleveno meso oblikovano u loptu i prženo ili kuvano u čorbi
2330,ukazivač kao na brojčaniku
12973,"Veliki rod čupavih ili vunastih trava ili žbunja, prostire se uemrenim zonama istočne hemisfere (tropska Australija)."
7138,"uobličavanje, formiranje organa kao faza u embrionalnom razvojuanism)"
6658,Praviti društvo nekome; izlaziti s nekim.
16294,italijanski omlet sa seckanim povrćem i mesom; prxzi se sa jedne starne pa se okreće u drugi tiganj i prži sa druge
19356,Čin odvajanja ili razdruživanja.
14363,Zbirka predmeta naredanih na jedno vlakno.
3072,mali brzi ratni brod snabdeven torpedima za priobalne napade
10427,koji se odnosi na procedure
12303,koji se može prebrojati
16291,konstanta u jednačini krive koja može da varira da bi se dobila porodica sličnih krivih
9947,Neven
13155,koji se odnosi na ljude koji vode saveznu vladu
8470,najsnažniji članovi društva
583,informacija koja podržava statistiku procenu budućih događaja
4519,"Male, veoma tanke palačinke."
12719,koji se odnosi na ili je u vezi sa starijim osobama
16606,Oštar prolazan talas u normalnom električnom stanju (ili nizu takvih prolaznih) (elektronika).
3184,"Glasanje u kome nije poznato kako je glasao ni jedan pojedinac, ali ukupni rezultati glasanja su javni."
8510,duboka i relativno uska vodena površina (recimo u reci ili luci ili moreuz) koji dozvoljava prolaz plovećim objektima
4790,aromatični gomoljasti plod koji se koristi u ishrani ali i sveži listovi u salatama
13002,bantu jezik kojim se govori u Kamerunu
15689,Smeđa evropska eja.
7703,Biljka iz roda Valerianella.
12834,"Trag životinje, posebno jelena."
10364,bakterije (neke od njih su patogene za ljude i životinje) koje pripadaju redu Actinomycetales
10228,dugotrajno bombardovanje britanskih gradova od strane nemačke avijacije u Drugom svetskom ratu i bitke u vazduhu koje su to pratile
7662,debeli zeleni koren biljke vasabi koju Japanci koriste u kuvanju koa ima ukus kao jak ren; u obliku praha ili namaza često se jede uz sirovu ribu
3403,Rod široko rasprostranjenih gljiva koja imaju bele spore i skoro sve su otrovne.
17628,Porodica koju čine sisari.
3247,meso riba iz slatkih voda koje se koriste u ishrani
2714,skoro izumrli kavkaski jezik kojim se govori samo u Turskoj
17851,alat koji se koristi za brijanje
11054,Veštačka kruna koja se stavlja na slomljeni ili pokvareni zub.
14153,o bakteriofazima ili koji se odnosi na bakteriofage
9863,deo zuba koji je ugrađen u vilicu i služi kao potpora.
6063,afiks koji se dodaje na početak reči
15089,"zajednički naziv za veoma raznorodan (teorijski i tehnički) skup savremenih psihoterapija koje se, nasuprot individualnoj terapiji, odvijaju u grupama, sačinjenim od pojedinaca sa sličnim problemima (npr. alkoholičari, narkomani, opsesivni neurotičari, psihosomatičari i sl.) i terapeuta koji vodi grupu"
18234,"grupa vulkanskih ostrva u južnom delu središnjeg Tihog okeana, deo Francuske Polinezije"
340,poluproodnik kod koga se protok struje uglavnom svodi na kretanje elektrona
18024,šerpa sa knveksnim dnom za pripremanje kineske hrane
63,"Onaj ko ima nežnu, pažljivu i obzirnu prirodu; koristi se za osobe i njihovo ponašanje."
7819,potopljeni (ili delimično potopljeni) greben u reci ili duž obale
19006,Struktura koja služi da nešto podrži.
1211,pešadinac koji je naoružan musketom
282,Menta čija stabljika ima ukus jabuke; iz južne i istočne Evrope.
1824,jezik koji se koristi u figurativnom ili neknjiževnom smislu
18006,"presavijeni deo, kao na koži ili mišićima"
50,kakav ritam opetovanim udarcima proizvoditi
2066,Budnost nad mrtvim telom noć pre sahrane.
12754,komad otvorenog zemljišta za rekreacijsku upotrebu u gradskoj zoni
13969,čega lokaciju otkriti; čega mesto odrediti; pretraživanjem ili ispitivanjem otkriti
4850,deo tankog creva između dvanaestopalačnog creva i ileuma
7935,grupa RNK virusa koja obuhvata one koje izazivaju grip (influencu) i zauške
12723,"Unutrašnji organ, između želuca i anusa."
3066,stanovnik Holandije ili poreklom iz Holandije
19273,pasaž koji spaja glavne teme sa onima koje slede
2779,metrička jedinica mere za zapreminu koja iznosi 100l
11974,Republika koja uključuje 26 od 32 okruga koji čine Irsko ostrvo; stekla nezavisnost od Ujedinjenog Kraljevstva 1921. godine.
18550,Akcija ili reakcija nečega pod određenim okolnostima.
5718,Neko ko pravi muška odela.
14170,"član elitne, intelektualne ili kulturne grupe"
10167,Grupa mačaka.
16587,Kolač koji se obično služi uz kafu.
13402,"koji se odnosi ili se sastoji od nekog dodatka, priveska naročito na"
12502,"Suva materija za bojenje, posebno nerastvorljiv prah koji se meša sa tećnošću da bi se proizvela boja."
5144,kurzivna forma egipatskih hijeroglifa koju je koristilo pre svega sveštenstvo
6507,učiniti da šta oseća; učiniti osetljivim
13140,duga traka od tkanine koja se koristi kao ukras ili za oglašavanje
600,amfioks
7035,10 grama.
6549,država na ostrvima u Indijskom okeanu u Mozambičkom kanalu
4156,sudski nalog kojim se nalaže održavanje (raspisivanje) izbora
16547,nešto što je zapamćeno
12147,visok i graciozan hrt sa dugom svilenom dlakom
1415,":osta nekih određenih stvari, kao pozorišni proram ili jelovnik."
7115,Godišnja ili dvogodišnja trava koja ima uspravno cvetno klasje i svetlosmeđe zrno.
18822,"Ukupnost ili opseg onoga što se opaža, otkriva ili uči."
12776,tražiti of nekog identifikaciju da bi se proverilo da li je dovoljno star da može konzumirati alkohol
6326,akt koji čini da prethodni akt ostane bez učinka (kao da nije ni učinjen)
4134,Porodica ptica koja se poklapa sa redom Rheiformes.
8772,Izvršni funkcioner firme ili korporacije.
18759,Ljudi koji potiču od istog pretka.
8324,"u računarstvu, datoteka koja se održava u mašinski čitljivom obliku"
5212,kanal kroz koji protiče (ili je proticao) rečni tok
2702,oružje koje ispaljuje projektil posebno iz metalne cevi
17411,Veliki lešinar visokih Anda koji ima crno perje i beli okovratnik.
2018,Osoba koja pravi bakrorez.
6327,Biljka puzavica sa crvenim plodovima.
783,element sa većim atomskim brojem od uranijuma
10332,Sedište za jahača na konju.
17031,"Čin nadmetanja, npr. za profit ili nagradu."
16755,korekcioni kod koji je zapisan na svakom sektoru magnetnog diska i koristi se da uhvati greške u podacima
4518,koji se odnosi na indoevropsku jezičku porodicu
1997,deo probavnog trakta koje počinje od slepog creva a završava se sa nusom.
15864,dozvoljava ljudima ili vozilima da pređu prepreku kao što je reka ili kanal ili pruga itd.
12767,Žena koja je crna
12344,funkcionalna reč koja može da zameni imenicu ili imeničku sintagmu
17426,Azijska rasa.
17958,"Negodovati, kao protiv politike; takođe i metaforički."
12689,more između Evrope i Azije
6021,Neko listopadno drvo iz roda Tilia sa srcolikim lišćem i visećim grozdovima mirisnih cvetova; neke vrste se koriste za drvnu građu.
7548,Drška biča.
13760,rameni deo svinje često dimljen
784,Patljasti miševi iz starog sveta.
18603,prikupljeno delo nekog autora (obično se koristi u množini)
9233,"krokodili, aligatori, kajmani, gavijali"
2887,Pelikani; ?frigate birds; ?gannets; ?cormorants.
6996,"ukradena imovina (posed, svojina)"
9125,žbun ili malo drvo iz roda Gardenia; imaju velike mirišljave bele ili žute cvetove
7202,Specijalna situacija.
15081,"Jaki slatkiš napravljen od šećera kome su dodati miris i ukus, često u kombinaciji sa voćem ili orasima."
14886,Sastoji se od svih živih glavonožaca osim porodice Nautilidae: redovi Octopoda (hobotnice) i Decapoda (lignje)
29,Grupa ljudi koji zajedno žive u kampu.
10654,odnosi se na glagole koji izražavaju radnju ('trčati')
6235,neka od četiri poslednje planeta Sunčevog sistema koje su mnogo veče od sunca i po prirodi gasovite
17919,Izgovoriti sa roljajući; o fonemi /r/
7076,"Slatki varijetet šljive, zelen ili zeleno žut."
17552,izvijena bakterija (naročito neke koje su štapičastog ili razgranatog oblika u nodulima korena kod biljaka koje su azotofiksatori)
521,knjiga koja sadrži kalendar i prazan prostor za beleženje termina sastanaka
16731,liker sa ukusom jagode
2393,praviti se važan
18567,"udica na kojoj su pričvršćeni kanap, plovak, visak i kuka"
6545,Organizacija nastala spajanjem nekoliko grupa ili partija.
13619,država u jugoistočnoj Aziji koja je postojala od 1954 do 1975 kada je pobedila u Vijetnamskom ratu i priključila Južni Vijetnam
4747,riba masnog crvenog mesa koja se nalazi u priobalnom Pacifiku i rekama
100,lišiti slobode; držati u zatvoru
7898,koji se tiče ili uključuje svetlo ili optiku
17320,Neka od nauka koje se bave Zemljom ili njenim delovima.
15976,kratko pozorišno izvođenje koje je deo dužeg programa
3586,bela čaplja koja ima dugačko perje u vreme parenja
17931,obećati svečano i formalno
8152,Neko ko reklamira ili razmenjuje robu ili usluge za novac.
11755,jedan od jestivih ljuskara desetonožaca
7807,Tvrd i gladak mineral izgrađen od silicijum dioksida u kristalnoj rešeci.
988,šta ponovo pogledati; šta ponovo ispitati
8222,Ograđeni prostor za živu stoku.
2547,Grupa organizama koja formira podgrupu ili širu kategoriju.
19433,zatvroska ustanova u kojoj obično pod teškim uslovima borave politički ili ratni zarobljenici
563,Mali rod višegodišnjih biljaka koje imaju smrtonosno otrovan gomoljast koren.
5033,Rečna i morska riba koja ima telo slično zmiji.
8682,prvi obrok u toku dana (uglavnom jutarnji)
15886,Čvorci iz starog sveta.
11715,Ceremonija na kojoj se mrtva osoba pokopava ili spaljuje.
10913,"Vrsta tambure, trouglastog oblika; ruski narodni instrument."
10691,Ožiljak gde je bila privezana pupčana vrpca.
6647,javna isprava koju država izdaje svom državljaninu za putovanje u inostranstvo i povratak u domovinu
11946,moreuz koji odvaja Južnu Ameriku od Ognjene zemlje i drugih ostrva južno od kopna; otkrio ih je Ferdinand Magelan 1520; važna put oko Južne Amerike pre nego što je Panamski kanal izgrađen
6260,a pravna isprava koja pruža informacije koje se traže kod zaposlenja određenih lica u pojedinim državama
9777,"Gasovi, tečnosti i čvrste tvari su tri uobičajena agregatna stanja."
17104,"Umreti zbog potapanja u vodu, usled čega voda ulzai u ploća i dolazi do gušenja."
14609,veoma jako zrelo pivo koje se tradicionalno pravi u jesen i čuva se preko zime kako bi se pilo na proleće
16114,napraviti odštampanu kopiju
11728,"Razmenjivati misli, pričati sa nekim."
7847,Neka od mnogobrojnih ptica pevačica sa kratkim i jakim kljunom koji je prilagođen za razbijanje semena.
6490,sudski nalog kojim se nalaže administrativnom činovniku (šerifu) da pozove porotnike (članove porote)
10339,"Pružiti pomoć, biti na usluzi."
18467,Referisati se na nešto.
1106,Vojna jedinica koja je deo kopnene vojske.
16817,Količina za koju nešto raste.
15266,"Događaj, ili tok događaja, koji će se neizostavno desiti u budućnosti."
4963,planinski lanac koji se prostire duž istočne obale Australije
101,Mala ptica koja jede insekte.
3188,"Otkazati, bukvalno ili preneseno."
18851,Muva čije larve žive kao paraziti na gusenicama i drugim insektima.
8270,Organizacija izvođača i pridruženog osoblja (posebno pozorišnih).
14571,koji se odnosi na leksikografiju
2236,Jedna od raznih vrlo cenjenih jestivih podzemnih gljiva roda Tuber; raste u jugozapadnoj evropi.
136,Stanje biti nezaposlen ili nemati posao.
15032,Zeljasta planinska biljka iz porodice žabljaka sa žutim cvetovima.
2834,roze ili belo meso dugačkog pacifičkog lososa
18241,osnovna novčana jedinica Paname
17777,Rod većina sevrnoameričkih geranijuma; zdravac.
12074,odlučujući momenat u romanu ili drami
14720,"međusobno inkorporiranje materija, upijanje materija jednu uz drugu"
17888,Čin ukrašavanja nečega (u nadi da će od toga privlačnije izgledati).
10475,"smear with blood, as in a hunting initiation rite, where the face of a person is smeared with the blood of the kill"
11146,Uzgaja se zbog zadebljalog jestivog aromatičnog korena.
3552,uniformno kretanje bez rotacije
7440,engleski grad koji je izborna jedinica za jednog poslanika
12903,postojanje zvuka pošto je izvor prestao sa emitovanjem
377,formalno postavljenje na neku funkciju
17637,"puding napravljen od kukuruza, pavlake i jaja"
9658,Biti uključen u borbu.
17761,elektroda u tranzistoru preko koje primarni tok nosača napusta područje između elektroda
8621,kamarupski jezici kojima se govori u zapadnoj Burmi i Bangladešu i na krajnjem istoku Indije
15274,"učiniti disjunktnim, odvojenim ili nepovezanim"
5735,Biljka iz roda Trifolium.
18742,"učiniti da neko prihvati određeni stav, verovanje ili pravac delovanja"
7487,Ukrašeno zimzeleno drvo koje se koristi kao Božićni i Novogodišnji ukras.
5559,osnovna novčana jedinica Rusije
1936,"država razbacana po ostrvima Federalne države Mikronezije, tesno povezana sa SAD-om, stekla nezavisnost 1986"
9379,Stanje u kme je nešto prisutno.
17407,čin lišavanja hrane ili izlaganja gladi
7628,grana inženjerstva koja se bavi projektovanjem i realizacijom javnih radova kao što su brane ili mostovi
10885,novčana jedinica Irana
14479,dodatak na đonu sportske obuće koji se sastoji od trvdog šiljka
4481,"država na zapadu centralne Afrike, stekla nezavisnost 1960"
19363,"ponavljanje krajeva dve ili više uzastopnih rečenica, stihova itd."
19318,"Tkanina sa obojenom mustrom koja je na njoj odštampana, obično pomoću izgraviranih valjaka."
13657,Čija je pozicija ili položaj uspravan.
17816,koji ima četiri strane
8199,u rimskoj mitologiji boginja noći; u grčkoj mitologiji joj odgovara Njukta
16565,sedmo slovo grčkog alfabeta
17429,Tapir koji živi u močvarama i vlažnim šumama južnog i istočnog dela Južne Amerike.
19307,Malo drvo rasprostranjeno u Evropi koje rađa jestive lešnike.
14266,Izvođač koji se pretvara da guta vatru.
6346,Iskustvo življenja; tok ljudskih događaja i aktivnosti.
4321,refleks koji brzo otvara i zatvara očni kapak
18651,geološko svojstvo koje je ostatak ranije postojeće formacije nakon nestanka drugih delova
27,osobina da se radi ono što je ispravno i da se izbegava ono što nije
584,Biljka iz roda Hottonia.
14130,Tipična američka rovka.
16253,Čin upravljanja ili kontrolisanja nečega.
4916,O hormonima ili koji se odnosi na hormone.
710,sistem koji održava vazduh hladnim i suvim
12945,Zrno kafe koje se prži i melje za sparvljanje napitka.
16808,obožavanje vatre
13341,prekinuti ili izbaciti
19306,Istrajati ili uspevati.
8693,benigni tumor sačinjen od mišićnog tkiva
18114,visoko cenjena riba crvenog mesa koja se nalazi u Meksi;kom zalivu i jugoistočnom delu Atlantskog okeana
16034,francuski pisac i kritičar; poznat i kao branilac Drajfusa (1840-1902)
16254,koji se odnosi na magmatsku stenu koja je očvrsla ispod zemljine površine; granit ili diorit ili gabro
2945,arapska država na poluostrvu Katar
11774,obični tupik severnog Atlantika
12737,Mašina koja obrađuje materijal melvenjem ili razbijanjem.
5393,posuđe za kuvanje
142,amorfni oblik silicijum dioksida SiO2 koji ima veoma poroznu strukturu
16056,"Biljke koje su se prilagodile da privlače, hvataju i vare uglavnom insekte ali i druge male životinje."
11228,"Stanje povezanosti među ljudima, posebno emocionalne prirode,"
5167,masno roze meso ribe iz Severnog Atlantika; obično se prodaje svež
10687,korišćenje zamenice ili druge zamenske reči umesto ponavljanja reči
18761,"koji se odnosi na aluvijum, rečni nanos"
12967,kuhinjski aparat koji služi za kuvanje hrane
2281,koji se odnosi na naučnu antropologiju
15654,"Nešto što se ponovo događa, posebno u pravilnim intervalima."
12317,Široko se gaji u tropskim i suptropskim područjima zbog mirisnog cvetta i voćki živih boja.
18965,"koji se odnosi na Škotsku, njene ljude i kulturu"
17200,Mafin koji se pravi od kukuruznog brašna.
