,Sysnet
8737,deo organizam koji se sastojati od skup ćelija koji imati sličan strkturu i funkcija . 
210,"koji jesam u sklad sa fiksiran redosled , procedura ili princip . "
481,Skoljka morski organizam . 
12550,Predložiti iznos isplata . 
45,velik ( glavobolja ) . 
13763,tropski gušter ; noćni suvozemni žvotinje koji se hraniti insekt ; imati nepokretan očni kapak ; potpuno bezopasan . 
12320,prav muharice star svet 
3294,jedan od dva zvaničan jezik Norveška ; blizak jesam danski 
15772,krov u oblik kupola 
11333,familija biljka iz red Polemoniales . 
16998,"Drveće i žbunje , od Madagaskar do Australija . "
7742,arterija koji se granati iz aorta i snabdevati srce krv 
16479,ćelija koji jesam nastati spajanje jajni ćelija i spermatozoid ( uključivati organizam koji se razvijati iz taj ćelija ) 
17117,Italija jesam podeliti u @card@ oblast iz administrativan razlog 
12415,majmun koji živiti na drveće tropski Amerika ; imati tanak noga i dugačak rep 
14355,tipski rod porodica Pipidae . 
10120,vežbanje za neki javan nastup 
10318,biti šta što pripadati skup ili klasa . 
4949,skica rezime koji sadržati glavne tačka neki teroije ili ideja 
15586,promeniti se iz tečan u čvrst stanje kada jesam hladno 
1152,Otić s neki mesto . 
13001,"o vlada i vladin službenik , onaj ko imati položaj ( ko jesam na dužnost ) imati vlast . "
1916,"velik rod tropski drveće , žbunje i penjačica koji uključivati drvo smokva . "
102,preteran ili nekontrolisan strah 
10123,"biti koji od raznih sićušan bešćelijskih ili jednoćelijski organizam , obično nefotosintetičkih "
17021,finski jezik koji govoriti Vepsi 
3917,deo meso ( naročito ovca ili jagnje ) koji sadržati deo kičma i oba slabina 
12272,uglavnom višegodišnji biljka i žbunje severni hemisfera : prstac . 
1113,turkijski jezik koji govoriti Karakalpaci 
14417,"muški odevni predmet bez rukav , nositi ispod kaput "
17243,otvor kroz koji se uzimati hrana i stvarati glas . 
14311,Unutrašnji pasaž ili hodnik ka koji se sob otvarati . 
225,velik tuga uzrokovati gubitak voljen osoba ( posebno smrt ) . 
4796,vodozemac koji ličiti na gušter . 
9611,izazvati iznenadan strah u koji ili ispuniti koji iznenadan panika 
17389,mesto za sakupljanje i prikazivanje predmet koji imati naučni ili istorijski ili umetnički vrednost . 
12394,proklom iz Indija ili stanovnik Indija 
1694,metamorfizam koji se javljati duboko ispod zemljin površina ; menjati jednostavan mineral u složen mineral 
3745,spiny-finned food fishes of warm waters having well-developed teeth 
1066,stvoriti mišljenje o nešto ili preneti stav . 
1573,ovlašćenje ( dozvola ) za sklapanje brak ( venčanje ) između muškarac i žena 
10621,dug veštački kameni ili zemljan hum izgraditi da biti se zadržati voda ili kao podrška put . 
12543,dehidriran obran mleko 
476,ukupnost uslov u nepsorednom okruženje . 
2027,drvo iz tropski Azija sa aromatičan žućkasto-smeđom kor od koji se praviti začin cimet . 
5051,sistem delovati telo koji zajedno služiti za neki određenu svrha . 
16496,Najčešće se prodavati samleti kao prah svetlonarandžaste boja ; imati jak misris i ukus ; dodavati se jela na vrh nož ; najčešće se koristiti za pirinač . 
17098,oklopnik ; američki mravojed ; lenjivac . 
3784,neki ko praviti ili popravljati nakit od srebro . 
10814,tibetsko-burmanski jezik koji se govoriti u junanskoj oblast Dali 
15980,"grana matematika koji se baviti granični vrendostima , izvod i integral funkcija "
7414,tropski drvo poreklo iz Azija koji rađati mesnat plod . 
3863,"grmolik biljka s lep grozdast mirisan cvet , obično plav ili beo boja . "
14432,the fruit Or seed of any of various bean Or pea plants consisting of a two-valved case that splits along both sides when ripiti and having the seeds attached taj onaj edge of the valves 
7193,tipski rod porodica Musaceae : banana . 
118,nesposobnost osoba da se setiti ili uraditi onaj što obično moći ; često uzrokovati emoionalnom napetost . 
14732,velik voden daždevnjak : ? hellbenders ; golem štur 
8834,biti koji struktura koji stvarati skelet organizam . 
16917,"izraziti broj , mera ili veličina . "
13933,"neki od mnogi žbun iz rod Čtisus , Genista ili Spartium koji imati dug tanak grana i grozdov žut cveće . "
9242,stanovnik Irak ili poreklo iz Irak 
11809,"iz Afrika , Arabija ili Azija ; imati rep koji se ne moći uhvatiti i blizu ostaviti nozdrva . "
8492,čin bušenje rupa ( naročito niza rupa radi lak razdvajanje ) . 
8876,neki ko kreirati nov ples . 
103,koji osećati ili izazivati radost 
15631,praviti društvo neki ; izlaziti s neki . 
11418,( računarstvo ) štampan ploča ili čip koji prevoditi komanda u forma koji moći kontrolisati Hard disk 
16819,"tanak , poluslatki kolač ili keks koji se obično služiti uz čaj . "
7160,ravan ploča koji kontrolisati ili usmeravati protok fluid ili energija 
8422,Južnoafričko mešan pića od sladoled i viski 
4326,ptica kreštalica južnoafrički i južnoazijskih predeo 
6164,"malo drvo iz Kina i Vijetnam koji rađati zvezdast plod s miris anis , koji se koristiti u prehrana i u medicina . "
11347,boginja podzeman svet ; u grčki mitologija ona odgovarati Persefona 
16958,olovka napraviti od ptičiji pero 
8945,Način vršenje radnja . 
10291,tipski rod porodica Pandionidae 
6608,republika u istočni delo Balkanskog poluostrvo u jugoistočni Evropa . 
7554,"kugara koji živiti na sever Evropa , hraniti se raznim bobica "
5253,uzrokovati da nešto biti mokar 
15804,"skup koji jesam prazan , koji nem element "
15623,osnovni novčan jedinica Litvanija 
16825,onaj koji jesam u stanje san 
10637,put ka ulaz ili izlaz 
15738,keltski jezik koji se ranije govoriti u Kornvol 
7214,riba koji se nalaziti u Atlantik u sad 
14457,"neki od brojni dvogodišnji i višegodišnji trava sa ljubak ljubičast , žut i ponekad beo cvetan glavica . "
5590,merni instrument koji imati niz oznaka u pravilan razmak ; koristiti se za merenje . 
17333,novčan jedinica Peru 
3134,Učiniti da biti čvrsto prikačiti . 
15979,izjava usmeriti na buđenje poverenje . 
4036,gambuzija 
9226,obezbediti ustav u država . 
11901,revolucija protiv carski vlast koji jesam dovesti do abdikacija car Nikolaj II i do stvaranje provremene vlada mart @card@ 
13454,sav naslediti svojstvo 
6313,Veštački izvor svetlost . 
6824,koji se ticati Katar 
663,red iz podklasa Acnidosporidia 
15322,u klasičan mitologija bog muški plodnost i zaštitnik bašta i vinograd 
9726,"velik ovalan plod sa tvrd dlakav ljuska , koji sadržati debeo beo meso unutar koji jesam šupljina koji jesam popuniti tečnost , odnosno mleko . "
12758,tekst koji jesam u forma koji računar moći da sačuvati i prikazati na ekran 
16341,izumro gmizavac koji uključivati : dinosaurus ; ? plesiosaurs ; ? pterosaurs ; ? ichthyosaurs ; thecodonts 
6372,koji se odnositi na evolutivan razvoj organizam 
7533,grana fizika koji proučavati struktura atom . 
6904,novčan jedinica Iran 
946,"deo kostur čovekov stopala , između prst i peta "
14365,Učiniti nešto da nešto biti prilagoditi socijalistički ideja i filozofija . 
9830,stanje imovina da jesam u ruka primalac . 
10308,ples kao deo društven okupljanje . 
17212,so mlečan laktične kiselina 
12977,"koji se ticati Kamerun , njegov ljudi i kultura "
11286,hrskavičav riba 
5575,član ruski većinski levičarski grupa koji jesam slediti Lenjin i iz koji jesam nastati Ruski komunistički partija 
15324,Prača zemlja na koji nem drveće i koji jesam obično ograditi . 
6939,na 
11742,čin podvrgavanje nešto eksperimentalan test kako biti se utvrditi koliko dobro nešto funkcionisati 
1809,postepeno se smanjivati ali ne nestajati potpuno . 
9537,bivši osnovni novčan jedinica Irska 
4803,"koji se ticati Finska , njen ljudi i kultura "
6585,fino istkati lanen platno 
12930,lantanoide - srebrnobeli feromagnetni trivalentan metal 
13159,deo severni leden okean između labrador i južnog Grenland 
12676,smanjenje vrednost stvar usled činjenje ili nečinjenje 
1759,izazvati da postati opšte poznat . 
7580,"plodonosan deo žitan biljka , posebno kukuruz . "
17298,vezivni ćelija nervni tkivo koji učestvovati u metabolizam . 
12295,predmet koji se istresati prašina iz tepih . 
17011,postaviti iznova 
4617,"smeđaksto-crn mineral , glavni izvor hrom "
798,"učenje steći nesvestan način reagovanje na različit frustracija ; na taj način ličnost pokušavati da sačuvati samopoštovanje , razrešiti tenzija i obezbediti prihvatljiv ponašanje u svoj sredina "
11095,legura gvožđe sa mali udeo ugljenik i mangan ; često se koristiti u građevinarstvo ; njegov mehanički svojstvo moći da se menjati u širok dijapazon . 
530,"kretati se brzo sopstven noga , tako da jesam jedan stopala uvek uvek podignuti sa zemlja . "
1946,"linearan sekvencija reč , izgovoriti ili napisati . "
13712,vlakno u vida niti koji činiti micelijum gljiva 
11813,koji se ticati ili koji proizvoditi ili koji jesam izazvati statički elektricitet 
8465,beo so ( CaSO4 ) . 
7609,koji raditi uz minimalan intervencija čovek ; nezavistan od spoljašnji kontrola 
14398,tačka kompas koji jesam za jedan tačka južnije od pravac prema zapad 
1656,ministar u vlada koji jesam zadužiti za odnse sa spoljni svet . 
7042,delikatan evropski zeljast biljka sa sivkast lišće i klasijem purpuran cvet ; nekad se koristiti kao lekovit trava . . 
9510,"glavni grad svet Vinsent i Grenadinija , na ostrvo Sveta Vinsent "
9890,"deo biljka ili životinja koji nalikovati na rebro ( kao glavna žila kod lista , ili očvrsnuti vena u krilo insekt ) "
10783,slovo alfabet koji odgovarati suglasnički fonema 
2702,uglavnom primorski evroazijski zeljast biljka : koleničica . 
8651,neki od mnogi biljka iz rod Tagetes koji se gajiti zbog njihov uapdljivog žut ili narandžast cveće . 
2199,stanovnik Italija ili poreklo iz Italija 
9909,hrskav pšenični pahuljica 
5823,čin velik razaranje i gubitak život 
12000,politički teorija koji se zalagati za autoritaran hijerarhijski vladanje ( suprotno od demokratija ) 
15976,koji se ticati Nikaragva i njen ljudi 
591,divalj koza iz Iran i susednih predeo . 
2422,svaki organ koji jesam uključiti u disanje . 
5521,u neki klasifikacija se ograničavati na kokot i deliti se u podporodice Triglinae i Peristediinae . 
2331,osnovni novčan jedinica u Belize 
9291,"pipeta koji se sastojati od mali cev sa vakuumiran sfera na jedan kraj za vučenje tečnost i , istovremeno , oslobađanje kapa "
7073,Oštri kraj . 
849,"tanak muva sa dug noga ; potsećati na komarac , ali ne ujedati . "
1589,engleski pesnik i dramaturg koji se smatrati jedan od velik engleski pisac ( @card@ ) . 
13993,evropski aromatičan višegodišnji biljka . 
14531,napraviti fonetski transkripcija 
17067,tipski rod porodica Sarcoptidae : crvić koji izazivati svrab . 
14063,obučavanje vojnik u vojnički veština 
15014,"Drveće i žbunje iz porodica Ebenaceae , Sapotaceae , Styracaceae , Symplocaceae . "
13106,koji se odnositi na varenje ili koji moći da izazvati varenje . 
10141,lovlje riba kao zanimanje 
2742,Kritičar književan ( literaran ) delo . 
6766,neki od raznovrstan velik jestiv riba i riba za lov severni morati ; obično se slei iz slana u sladak voda kada polagati jaje . 
13251,sladoled koji ne sadržati mleko već se uglavnom praviti od kašast voćni sok 
10983,"beo tvrditi metal iz grupa platinski element i veoma jesam redak u priroda ; dobijati se kao nusprodukt pri proizvodnja nikl , a koristiti se kao katalizator "
3055,izraz bez reč 
12303,hrana za lak obrok ili koji se jesti između obrok . 
3604,osoba koji jesam posebno obrazovati za rad u biblioteka . 
17045,sakupljati se . 
718,planinski republika u centralni Evropa ; ranije deo Habzburške monarhija i Jugoslavija ; steći nezavisnost @ord@ 
16298,praviti suv puckavi zvuk ; o svila i lišće . 
2846,biti koji struktura koji se granati iz centralni delo 
10674,čin nasilan oduzimanje imevine od vlasnik 
16861,"neki od više trava iz rod Doronicum , uzgajati se zbog dug stabljika sa žut cvet . "
15227,"Dan koji uključivati sadašnji trenutak , nasuprot onaj što jesam biti juče i što hteti biti sutra . "
10555,neki od jestiv grm ili drveće iz rod Corylus koji rađati jestiv plod zatvoren u lisnat ljuska . 
679,"katolički crkva čiji jesam sedište u Vatikan , koji voditi papa i hijerarhija episkop "
479,"u grčki mitologija vrhunski bog dok ga Zevs jesam zbaciti ; sin Uran i Gej , odgovarati on rimski bog Saturn "
3181,"neki od brojni morski ? percoid riba , naročito ali ne isključivo iz familija Sparidae . "
15294,glista čiji jesam cilindričan telo izdeliti i spolja i iznutra . 
6338,tropski žbunje i trava od koji se praviti krotonovo ulja 
16947,koristiti se u neki klasifikacioni sistem ; Passeriformes koji imati relativno jedostavan vokalan organ i ne moći dobro da pevati : vikačice . 
9372,cevast organ u voden životinja ( posebno kod mekušac ) kroz koji voda moći da se uzeti ili izbaciti i kroz izlaz voda se nesvaren deo hrana i štetan materija . 
878,"Širok i otvoriti prostor , kao što jesam površina , zemlja ili mora . "
9397,naspraman stranica knjiga ili neki drugi publikacija 
16448,"neki rasa pas iz severni područje koji imati špicast njuška , usparvne uši i uvijen dlakav rep. "
248,Čin oštećivanje nešto ili neki . 
4477,kiselina koji sadržati bro i kiseonik 
17247,poliedar omeđati sa dvanaest strana . 
14528,"Ravni prenosni površina , obično pravougaon , smisliti za igra na tabla . "
2711,"koji uzrokovati množenje , širenje , npr . kalamljenjem "
2668,površina koji jesam uspravan 
11794,irski gelski od @ord@ do @ord@ godina 
15781,specijalan šerpa za pečenje 
14691,osnovni novčan jedinica na Novom Zeland 
2034,Mehanički muzičk instrument koji proizvoditi muzika rotacija cilindar koji jesam obložiti kočić . 
725,pomerati ili ljuljati napred-nazad . 
4919,nefinitna forma glagol od koji se moći graditi složen vreme ( kao u engleski ) ili koji se moći upotrebljavati pridevski 
9667,koji se odnositi na geografija kao nauka . 
6079,genus of mora Or less advanced dicotyledonous herbs and som trees and shrubs 
2458,biti koji biljka iz rod Cannabis ; jednogodišnji čupav žbun sa palmolikim lišće i kitica mali zelen cvet ; davati čvrst vlakno i narkotički droga . 
3774,"zeljast bilje , žbunje i mali drveće : pamuk "
16777,osoba koji zagovarati politički filozofija progres i reforma i zaštita građanski sloboda 
3960,"orhideja penjačica koji s ne geaji kao ukrasni biljka , rađati plod nalik mahuna . "
10964,"Voćka s gladak lista i beo cvet , plod jesam sladak i sočan sa karakterističan tvrd zrnce . "
8469,evropski riba . 
12797,mali biftek seći od prednji delo goveđi slabina 
4771,tkivo sastavljno od neurona 
7636,alga čiji jesam hlorofil maskirati smeđ i žut pigment 
13868,modulacija frekvencija nosač radio talas 
10447,insekt koji u zreo doba inaju četiri krilo koji jesam manje ili više pokriti sa mali krljušt . 
7884,put koji jesam slobodan za svaki da se on kretati 
16108,Društveno držanje . 
16924,o svadba ili koji se odnositi na svadba . 
16334,glavni grad Mauritanija 
40,gledati neki sa divljenje . 
3816,neki od ukrasni biljka iz rod Plectranthus . 
10587,koale 
490,"plod vrsta zimski dinja , velik zelen dinja sa narandžast meso "
12655,kakav zakrivač koji služiti za zaštita privatnost ili da zadržati svetlost 
2260,Polužbun sa snažnm vretenast koren ; imati ružičast ili beo cvet i kožnat cvet koji mirisati na timjan . 
9819,osnovni novčan jedinica Egipat 
15494,saviti tako da podsećati na krst . 
17027,"bantu jezik koji govoriti narod Kongo koji živiti u tropski šuma Zair , Kongo i Angola "
6595,"Drvće , žbunje ili drvenast loz koji imati plod koji podsećati na tikva ili čaura ; ponekad se smeštati u red Scrophulariales . "
9576,Neograničeno trodimenzionalan prostranstvo u koji jesam sav smestiti . 
16350,Uobičejeni ronac Evropa i Severne Amerika . 
6889,velik rod ukrasnik biljka cvetnice ; uključujeneke biljka koji se često smeštati u rod Coleus . 
489,( geologija ) raspoređivanje sloj u stena u oblik list 
9047,rashladiti hrana 
15221,metrički jedinica mera za zapremina koji iznositi 100l 
6090,ulaz ( prostor u zid ) kroz kojise ulaziti u ili izlaziti iz sob ili zgrada ; prostor koji vrata moći zatvoriti 
3012,red protocista 
13046,Izvršiti operacija na neki . 
13480,uzrokovati da se nešto pretvoriti u otopina 
14194,pisac scenario 
15984,osnovni SI jedinica za merenje električni struja 
2063,koji imati oblik parabola 
3493,osoba koji vladati ili koamnduje . 
15755,list taman zelen boja koji moći da se kuvati ili se jesti sirov u salata 
1629,promena sa jedan mesto ili stanje ili stepen u drugi . 
16469,bivši osnovni novčan jedinica Togo 
12612,"svaki pisan simbol koji predstavljati glas , slog , morfema ili reč "
3013,zamišljen linija na Zemljinoj provršini koji seći sav meridijan pod isti ugao ; putanja koji se kretati brod ili avion koji održavati isti pravac na komapsuaintains a constant compass direction 
14511,mera za površina koji iznositi @card@ ar - površina kvadrat čiji jesam stranica dužina @card@ metar 
5870,"u računarstvo , ram koji se ostavljati kao specijalizovati bafer čiji se sadržaj stalno menjati ; koristiti se da optimizuje transfer podatak između element sistema sa različit karakteristika "
970,uvući vazduh 
4419,Uključuje spanać i repa . 
1135,koji postojati od sam rođenje 
6102,majak 
9524,Višegodišnja južnoevropski trava sa uzak lišće i pojedinačan žut cvetan glavica i dugačak jestiv koren koji imati crn kor i oblik šargarepa . 
15388,tipski rod porodica Globigerinidae 
7482,oblast unutar heliopauze koji sadržati sunce i solarni sistem 
2167,rabarbara 
374,"sisar vitak telo , i suvezeni i voden , delimično opnast stopala ; cena se zbog krzno . "
1286,"ruski jela koji se praviti od pljeskavica od mleven meso ( pomešan sa luka , hleb i mleko ) i serviranane sa sos od kiseo pavlaka "
6768,bogomoljka 
2283,gajiti se za ispaša ovca u višim predeo . 
5583,meso biti koji od raznih žečeva ili kunić . 
3791,travnat zeljast biljka uglavnom iz Severne Amerika . 
3477,proizvodnja izvestan obim . 
2795,rod žbun iz star svet : oman . 
7758,jedinica koji određivati cena plaćanje 
5309,novčan jedinica Svazilend 
3056,kristal natrijum hlorid koji se javljati u priroda 
14500,Žena u vreme rađanje dete i kratak vreme nakon taj . 
6903,funkcija ugao koji se izražavati kao odnos stranica pravougli trougao koji sadržati taj ugao 
7458,"bistar sup sa ukus paradajz , često se služiti rashladiti "
15448,bolan stalan grč mišić za žvakanje ; ran simptom tetanus . 
2902,penjač 
9903,koji se odnositi na limnologiju 
290,novinski pisac i fotograf 
3380,"spis koji obezbeđivati neki informacija , obično služben priroda . "
9384,elastičan traka koji držati pantalone ( obično u množina ) 
12905,štampač koji koristiti električni naboj za nanošenje toner na papir 
5310,odrediti vrednost nešto . 
47,pozitivan ili negativan kvalitet nešto što ga činiti poželjan ili vredan . 
14590,"mali , jestiv plod nalik paradajz od žut jesam do ljubičast boja sakriti u karakterističan ljuska "
6286,mekan plavkasto-beli toksičan metal ; javljati se u ruda cink 
8491,rezak mesnat jestiv koren . 
8069,mali ptica močvarica sa tanak kljuna ; odazivati se piskutav . 
16172,nevaljao dečak iz roman Mark Tvena 
16898,rod nizak drveće i žbunje iz porodica Staphylaceae . 
10567,rod porodica Lophiidae . 
4250,sloj snežan pahuljica ( beo kristal zamrznut voda ) koji pokrivati zemlja 
1305,Urođeni kapacitet za nastanak nešto . 
649,predati neki ili nešto drugi . 
257,biti šta u sklad sa princip pravda 
17315,"koristiti za slikovan prikaz ultrazvučni talas visok frekvencija ( @card@ — @card@ KHz ) ; ako se odašiljati prema tkivo telo , onda se od tkivo različit sastav različito reflektovati . reflektovan zvučan talas se hvatati i mera - na osnova vremenski razlika između emitovan i primljen impuls računar konačno generisati ultrazvučni slika . "
67,"neposredno pre ili posle , kao u lanac uzrok i posledica "
5680,napasti izneneda . 
12178,uralski jezik koji govoriti Nganasani 
13687,koji se odnositi na svet Dominika ili Dominikanski red 
9187,"tipski rod porodica Rheidae ; velik i visok ptica trkačica Južne Amerika , sličan noj ali manje od ona . "
8323,društven klasa koji jesam nizak u društven hijerarhija 
4052,leđa i bok svinja usoliti i sušiti ili dimiti ; obično tanko seći i pržiti 
10428,"mali rod zeljast biljka iz star svet , obično uključivati i rod Brassica . "
15901,evroazijski javor sa bledosiv kor koji se ljuštiti ; lišće imati ? i žut ujesen . 
7853,koji pripadati ili jesam ograničiti na blizina . 
10427,boja između rozikast i svetlonarandžaste 
12559,dijagram niz operacija koji trebati da obaviti računarski program 
6984,signal koji uključivati vizuelan komunikacija 
10821,neki ko jesam obučiti u šumarstvo . 
9706,koji imati posebno usmerenje 
3035,drozd iz star svet . 
12907,nešto što spajati ili povezivati 
11630,burnica 
10883,funkcija šef država sjedinjen Američkih Država 
7985,sijuski jezik koji govoriti narod Katauba 
10263,poklapati se sa podklasa Prototheria . 
3132,koji se odnositi na rekurziju 
1037,Najveći kontinent sa @card@ % populacija na zemlja ; spojiti jesam sa Evropa na zapad tako da graditi Evroazija ; sedište jesam nekih od ran svetski civilizacija . 
9240,slovenski jezik koji se govoriti u Slovačka 
7981,mera za površina koji odgovarati kvadrat čiji jesam stranica jedan stopa 
7514,stanovnik Švajcarska ili poreklo iz Švajcarska 
8715,jedinica za dužina koji iznositi jedan stotinu metar 
12027,Godišnje ili višegodišnji sočan trava toplih predeo . 
16517,luk blag ukus koji imati crvenkast ljuska ; koristiti se kao garnirug u hamburger i salata 
5112,fenički dijalekt drevan Kartagina 
11632,kukuruzar 
569,"sos začiniti seckan peršun , vlašac , estragon , vlašac i kapar "
1019,"velik i ekonomski važan familija trava , žunja i drveće koji jesam često jako mirisan , a nekda jesam i narkotik i otrovan ; uključivati rod Solanum ; Atropa ; Brugmansia ; Capsicum ; Datura ; Hyosčamus ; Lycopersicon ; Nicotiana ; Petunia ; Physalis ; Solandra . "
1441,povećati telesni težina 
14336,oklopnik 
10803,velik ostrvo u Bizmarkovom arhipelag ; deo Papue nov Gvineja 
320,koji koristiti naziv delo nešto za ceo ili nazivati ceo za deo ; ili specijalan za uopšten ili uopšten za specijalan ; ili materijal za stvar napraviti od taj 
17354,penutski jezik koji govoriti narod Kusan 
11654,vešalica koji jesam oblikovati kao rame osoba i koristiti se za kačenje odeća 
12541,"u grčki mitologija bog podzeman svet , Zevsov brat , Persefonin muž "
14797,"mineral koji se sastojati od titanijum dioksid u kristalan oblik ; pojavljivati se u matamorfnim stena , granit , liskun škriljac "
4811,proces u koji se primenjivati psihoanalitički teorija . 
4558,rod biljka cvetnice koji imati dva kotiledon u seme koji se obično pojavljivati pri kljijanju . 
7517,Hipotetička snaga koji se nakd pripisivati funkcija i kvalitet svojstven živ biće . 
6600,"nalikovati repa , moći biti različit dužina i obavljati za mnogi životinja vrlo korisne funkcija poput održavanje ravnoteža ili pomoć pri penjanje ili skakanje "
15391,pročišćen puter koristiti u indijanski kuhinja 
3575,svaki mali kolač ili keks koji se često služiti uz čaj . 
134,koji pokazivati ili izazivati veselje i zadovoljstvo 
7515,preneti ili izraziti u pisan oblik . 
4319,"velik familija obično višegodišnji zeljast biljka sa ? , ? ili lukovica . "
3087,jaje ( kajgana ili na oko ) polsužena sa šunka 
12572,kontinuum iskustvo u koji događaj prelaziti iz budućnost kroz sadašnjost u prošlost . 
14463,oblikovati materijal ( kao što jesam kamen ili drvo ) rezbarenjem nož . 
4085,Šolja iz koji se piti čaj . 
5235,"kod binarni operacija nezavisnost od redosled , npr . "" a x b = b x a "" "
8987,grčki jezik od @ord@ do @ord@ godina nov era 
2647,komad koji predstavljati Hristov stradanje 
325,predstavljanje reč drugi osoba u govor 
8233,običan čigra Evropa i Azija koji imati siv i crn perje 
505,"idealizovan slika neki ličnost , obično roditelj koji se formirati u detinjstvo . "
13448,"koji se ticati Urugvaj , njegov ljudi i kultura "
12312,piletina sa pirinač serviran sa nudlama 
7106,planinski lanac na sever Afrika između Sredozemlje i Sahara ; širiti se od jugozapadni Maroko do severni Tunis 
8313,Rozikasto-smeđi pupavac sa crno-belim krilo . 
11317,Izdužena glava krskavih vlat nalik celer i svetlo zelen lišće . 
393,osoba koji u kockarnica rukovoditi hazardan igra 
12223,"hemijski element srodan sumpor i selen , srebrnastobeo , metalan sjaj , krt , slab provodnik elektricitet ; upotrebljavati se u fotografija . , keramika , medicina "
13978,"Većinom dnevni ptica mesožder koji imaku zakrivljen kljun i ? : orlov , jastrebov , sokolov , ? , ? i lešinar . having hooked beaks and Long talons with opposable hind toe : falcons ; hawks ; eagles ; ospreys ; caracaras ; vultures "
15632,novčan jedinica Čile 
12448,"gladak i mekan životinjski koža , nastati uklanjanje dlaka i štavljenje . "
5778,"Ruski pesnik , umreti u zatvor ( @card@ ) . "
13434,zapadnoafrički jezik koji govoriti narod Volof u Senegal ; srodan jesam jezik ful 
16444,sok od brusnica koji jesam uvek razblažiti i zasladiti 
5125,evroazijski aromatičan trava sa mnogo žutozelen cvet ; lekovit biljka ; naturalizovati u severni Amerika . 
7033,koji se odnositi ili jesam karakterističan za Argentina i njen stanovnik 
253,"koji se ticati Tajland , njegov ljudi i kultura "
9764,Novčani račun koji dugovati kreditor ; obično nastajati pri prodaja roba ili usluga . 
11721,blok materijal koji se koristiti pri konstrukcija . 
15521,planinski lanac između Španija i Francuska 
