,Sysnet
6233,jastog sa velik klješta . 
9686,Mesec koji dolaziti posle septembar a pre novembar u kalendar . 
12499,organizacija vojni vazduhoplovstvo . 
11786,član nomadski Berbera iz Sahara 
12138,Sekvancija od @card@ bit ( dovoljan da se predstaviti jedan alfanumerički karakter ) koji se obrađivati kao jedan jedinica informacija . 
9732,pitati koji sadržati tikva . 
10268,"žičan instrument koji jesam prethoditi violina , koristiti jesam se do @ord@ vek "
170,kada nem jednakost 
1961,"Uključuje lišaj koji rasti u simbioza sa alga ; ponekad se posmatrati kao nezavisan grupa , manje li više povezati sa Algae i Fungi . "
7107,koji se odnositi ili koji se koristiti u hirurgija 
2571,listopadan drvo ili žbun iz Severne Amerika . 
6323,Reč ili izraz koji se koristiti za neki određenu stvar . 
13932,"cevast struktura na kraj abdomen za nošenje I odlaganje jaje u podloga , kod mnogi ženski insekt i neki riba . kod osa i pčela legalica jesam izmeniti u žaoka koji služiti za napad i odbrana ( izgubiti jesam svojstvo polaganje jaje ) . "
1508,italijanski liker od badem 
13817,lagan zemlja koji se sastojati od ostatak silikatni dijatoma i često se koristiti kao materijal za filtriranje 
9938,Udaraljka ; obično se sastojati od šupalj cilindar na koji jesam oba kraj prevučen koža . 
3149,prirodan izvor voditi iz zemlja . 
12884,"vrsta lignit ili forma kameni ugalj ; široko se koristiti u ukrasni svrha , za izrada nakit i modni detalj "
14275,ne spavati . 
5302,dobro izučiti biljni virus koji izazivati mozaik duvan ; on jesam biti prvi otkriven virus ( @card@ ) 
7615,čin koji se nešto smanjivati sečenje kraj 
1902,"političar koji pripadati mali družinoi koji privatan partija kontrolisati zarad privatan , a ne javan dobit "
7265,deo orkestar koji sadržati sav instrument isti klasa . 
16809,biljka iz rod Filago koji imati grozdov mali vunast cvetan glavica . 
11492,"neki od više aromatičan trava koji imati jestiv seme , lišće i stabljika . "
9004,Osušeno i preparirati na dim od drvo ( obično se koristiti za meso i riba ) . 
16902,rzčni kontroler koji se sastojati od vertikalan ručica koji se slobodno pokretati u dva smer ; koristiti se kao ulazni uređaj računar ili drugi uređaj koji kontrolisati računar 
7315,morski riba vrlo ukusan meso sa dva zlatan pruga iznad jedan oka . 
1265,"hemijski supstanca koji moći da se širiti municija i drugi sredstvo i da izazov smrt i obolevanje ljudi , životinja i biljka . "
789,poljoprivredni zgrada u koji jesam smestiti pernat živina 
5158,koka kola jesam komercijalan marka pića kola 
8221,merni instrument koji se sastojati od uzak traka od metal ili tkanina na koji jesam označiti inči ili centimetar i služiti za merenje dužina . 
8172,pisma koji jesam zapisati staropersijski jezik ( avestijski / avestanski ) 
6364,tipski rod porodica Anguillidae : jegulja . 
14198,knjiga sa tekst koji pomagati u savladavanje gradivo 
13354,u neki klasifikacija se definisati kao carstvo 
11879,"razgrnuti , omekšati ili ukloniti zemlja . "
10370,grupa muzičar koji svirati ili pevati zajedno . 
6722,krvni sud koji sprovoditi krv iz kapilara ka srce ; sav vena osim plućni sprovoditi krv nezasićen ugljen-dioksidom . 
2686,Nezvanična asocijacija ljudi ili grupa . 
8687,Očistiti pomoću ritual ; politički čišćenje zvaničnik prethodan režim . 
3726,ispitati dodir 
1084,neki obučiti u sastavljanje bibliografija 
2865,stanovnik latinski Amerika 
9919,osećaj koji se dobijati dodir površina ili tkanina 
14139,glavni i velik grad Mozambik 
57,Čin nanošenje rana . 
681,biljka iz rod Berberis koji imati bodljikav stabljika i žut cveće iza koji dolaziti crven bobica . 
2226,biti ispred ( drugi ) u vreme ili prostor 
4459,"koji se ticati Grenada , njen ljudi i kultura "
8783,osnovni novčan jedinica Burundi 
6433,polivalentan metal koji ličiti na hrom i tungsten po svojstvo ; koristiti se ojačavanje čelik 
6079,genus of mora Or less advanced dicotyledonous herbs and som trees and shrubs 
5690,sonet sačiniti od tri katrena i završan kuplet u jampski pentametru sa shema rima abab cdcd efef gg 
11347,boginja podzeman svet ; u grčki mitologija ona odgovarati Persefona 
325,koji ne postojati u stvarnost . 
8219,zvaničan državni jezik Kašmir 
1715,"sluzav telo jesam obao osim repa koji jesam spljošten ; u nepravilan usta jesam sitan zub , a i jezik jesam prekriven zub ; hraniti se drugi riba tako što ona izbušiti rupa u telo . "
257,postojan u naklonost ili odanost 
13587,tr 
10282,Načiniti neki besniti . 
10436,pregovarati o uslov razmena 
5529,Široki otvor cevast predmet . 
7626,cifra od @card@ do @card@ u oktalnoj notacija 
6439,kubanski socijalistički vođ koji jesam zbaciti diktator s vlast @ord@ godina u ustanoviti marskističku socijalistički država na Kuba ( roditi In @card@ ) 
6143,"rod porodica Canidae : domaći i divalj pas , vuk i šakal . "
14373,Čin koji se neki prati ( ili prati neki drugi ) . 
7841,vremenski period u godina kada škola raditi i ljudi učiti . 
401,lemur jugoistočni Azija 
12509,kretati se na točak ili kao na ona ili na vozilo sa točak . 
16131,jedan od tri rat koji jesam voditi između Kartagina i Rimske republika što jesam dovesti da uništenje Kartagina i njen pripajanje Rim 
14056,stanovnik Madagaskar ili poreklo sa Madagaskar 
9738,mali zemljotres 
10543,više zakonodavno telo vlada SAD-a 
10077,umetnost pisanje i produkcija komad . 
1904,glavni grad i važan luka Paragvaj 
17353,rastati se od posed ili prava . 
13585,naoblačiti se 
16079,"hidratisan karbonat bakar , CuCO3Cu ( OH ) @card@ , jasnozelen mineral tvrdoća @card@ ; javljati se u agregat bubrežast , grozdast i staklast ; bakaran ruda sekundaran poreklo . "
10768,rod mekušac . 
4626,"zglob na ljudski noga koji spajati golenica i cevanica sa bedrenjxčom , a spreda ga štititi čašica . "
16768,o praistorija ili koji se odnositi na vreme pre pisan istorija . 
1117,Preduzeće povezati sa trgovina . 
14162,lek koji uništavati virus 
13392,"sadržati pileći , drugi meso ili sir pored povrće i zeleniš "
1168,"u računarstvo , stanje datoteka u koji jesam ona razbiti i uskladištiti na mnogi različit lokaicje na magnetan disko "
15798,Čin koji se nešto posvećivati tako što se kroz neki crkven obred izdvajati kao posvetiti bog . 
2844,biljka koji se gajiti zbog krupan stabljika sa mali zelen glavica koji podsećati na kupuščiće . 
11206,meso američki iverak ; posebno jesam važan zima 
6412,biti koji mesto ostaviti za neki namena . 
672,biljka iz rod trap koji rađati plod nalik orah . 
10212,novčan jedinica Vijetnam 
15359,"praviti se od ovčiji ili teleći iznutrica pomešan sa ovsenoom kaša , loj i luka kuvan u stomak životinja "
6004,gornji površina sob 
15413,koji se ticati Indonezija njen ljudi i kultura 
17029,jela ili hrana koji moći biti brzo i lako pripremljen zagrevanje ili otapanje 
9966,"pravni dokument potpisati , overiti i uručiti u cilj ostvarenje prenos imovina i kao dokaz zakonit prava vlasništvo ( prava svojina ) "
15487,ne izvrći koleno kad raditi ovaj vežba 
10605,neki od sistema jedinica za merenje elektricitet i magnetizam 
3342,kobasica ili mesna vekna od naseckanih parčić meso glava i ponekad papak i jezik tele ili svinja 
125,onaj što jesam u suprotnost sa princip pravda ili zakon 
544,struktura u koji životinja legnuti jaje i leći svoj mlad . 
42,ratobornost izazvati stvaran ili pretpostavljen nepravda ( predstaviti kao jedan od smrtan greh ) 
10990,klasa glagol isti fleksivnih oblik 
4694,ukloniti nešto rezanje . 
4613,tipski rod porodica Polemoniaceae . 
6082,izazvan bakterija iz rod Vibrio 
8202,mediteranski drvo koji davati terpentin . 
6454,pripadnik jedan od porodica mali buba koji se hraniti biljka i njihov plod ; posebno jesam poznat žitan žižak . 
6222,biti koji od mali šumski božanstvo koji jesam biti saputnik Dionis ( sličan satir ) 
6318,mali glodar sa mekan biserno-sivim krzno ; poreklo sa anda ali se galiti i drugde zbog skupocen krzno . 
16153,Korovska trava iz rod Agropyron . 
1515,knjiga sa uputstvo za upotreba ili rad neki delo oprema 
3868,ekipa koji učestvovati u pravni postupak 
1055,velik ptica grabljivica naizgled sličan lešinar iz star svet . 
12061,nearomatični zasićen ugljeni hidrat sa opšti formula CnH ( 2n+2 ) 
17034,"mali , skoro izumro grana indoevropski jezik koji se govoriti duž dalmatinski obala "
1346,"Drveće , žbunje i trava široko rasprostraniti na oba hemisfera . "
12314,jedan od viđe delovati koji se jedan s drugi slagati u celina . 
82,Čin koji se nešto posvećivati tako što se kroz neki crkven obred izdvajati kao posvetiti bog . 
6881,Kalandar koji jesam uvesti s reforma papa Gregori XIII godina @ord@ 
8469,evropski riba . 
14294,Najjužnija tačka Zemljine osa . 
10122,indonezijski jezik koji se govoriti na mali Sundskim ostrvo 
6357,staviti semenka ili mladica u zemlja . 
14821,pisan verzija pozorišni komad ili drugi dramski sastav ; koristiti se za priprema za izvođenje 
9570,"drvo koji rasti na severni polulopta i koji imati svetlo i mek drvo , a cvasti u oblik resa . "
9621,kolekcija pisan svitak ( sadržati skoro ceo Stari zavet ) pronađen u pećina blizu Mrtvog morati pred kraj @ord@ 
4187,filozofski teorija kritika ( obično književnost ili film ) koji pokušavati da izložiti duboko ukoreniti kontradikcija u koji delo analiza koji grebati ispod površinski značenje taj delo 
4057,gelski jezik koji se govoriti u Škotska 
5880,koji jesam specijalizovati ili ograničiti na jedan klasa stvar 
15702,izazvati da postati otkačiti ili odvojiti . 
13051,stanovnik Butan ili poreklo iz on 
17138,neki od raznovrstan gljiva iz rod Erysiphe Koja proizvoditi praškast skrama na površina domaćin . 
16703,jedinjenje opisati u kategorija centarlnog atom za koji jesam drugi atom vezati ili uskladiti . 
4304,način koji se izražavati želja ili nada ( javljati se u grčki i sanskrit ) ; u engleski se ovaj značenje izražavati modalan glagol 
9994,a thin membrana lining the closed cavities of the body ; Has two layers with a space between that is filled with serous fluid 
5472,evroazijski baštenski biljka 
3688,skočimiši star svet . 
8437,grana matematika koji izučavati i razvijati matematički princip sam po sebe 
5043,neki ko podučavati učenik da svirati klavir . 
1205,koji se pojavljivati na početak 
13146,pokazivati odrediti očitavanje ; o kazaljka i merni instrument . 
1162,ljubičast varijanta rubinskog spinela 
11615,novčan jedinica Moldavija 
8690,"zamagljen mesto na rožnjači , dovoditi do nejasan vida "
13106,koji se odnositi na varenje ili koji moći da izazvati varenje . 
4318,tipski rod porodica Castoridae : dabar . 
2041,sportski oprema koji se sastojati od mesto ka koji igrač nastojati da usmeriti lopta ili pak da biti ostvariti pogodk . 
186,osećanje zaplašenost 
14733,proizvoditi literaran delo . 
10082,instrukcija koji prekid program koji se izvršavati i predavati kontrola supervizor 
15941,fabrički mešavina za pravljenje limunada 
4485,napraviti ravan ili ravan . 
16814,"zimzelen biljka penjačica ; rađati crn plod , nalik na bobica . "
6800,ukloniti testis musške životinja . 
1787,službenik koji upravljati neki aparat ili mašina 
15166,Piperaceae ; Saururaceae ; Chloranthaceae . 
5271,beo figura ( za razlika od crn figura u šah ) . 
7583,ruda kadmijum ; redak žućkast mineral koji se sastojati od kadmijum sulfid u kristalan oblik 
15825,rod bakterija 
9628,"arhipelag od oko @card@ ostrvo u Botničkom zaliv , pripadati Finska "
1719,tipski rod porodica Polyangiaceae : miksobakterije sa okrugao telašce sa sporoforama ( miksosporama ) koji okruživati membrana 
5354,Višegodišnja trava iz porodica ljiljan čiji e koriti vrlo gorak i otrovan . 
491,"biti negde , obično neuporebljen . "
5658,organizovan telo povezan informacija . 
3157,bivši osnovni novčan jedinica Kamerun 
13492,čekanje određenog praznik ( npr . Uskrs ) 
12146,gljiva koji proizvoditi po površina obično beo naslaga organski materija . 
814,ptica koji nastanjivati priobalan voda i otvoren okean : galeb ; pelikan ; ? gannets ; kormoran ; albatros ; ? petrels ; etc. 
12522,koji jesam nastati ukrštanje sorta ili vrsta ( biljka ili životinja ) 
8384,"visok deo leđa na dan vrata raznih životinja , posebno tegleći životinja . "
3374,ljubičast stoni grožđe sa gladak kor sa severoistok sjedinjen država 
8036,mitski grčki ratnik koji jesam biti predvodnik na trojanski strana trojanski rat ; junak Eneida 
13580,osnovni novčan jedinica Češka 
1626,"stanovnik Tadžikistan i okolni područje u Uzbekistan , Avganistan i Kina "
12682,oprema koji snimati informacija o ponašanje avion u tok leto . 
17153,komunicirati jezik znak . 
14651,predmet koji se koristiti da se u on stavljati stvar 
15786,rod kaktus puzavica koji cvetati noću 
7002,aromatičan kiselkast voće kruškast oblik koji se koristiti za zimnica ( slatko ) 
1053,fakultet i student u kakav obrazovni ustanova 
9045,novčan jedinica Tadžikistan 
3528,zbir pojedinac čiji rad pomagati očuvanje zdravlje njihov klijent 
2653,zamenjivanje opšti termin manje opšti ili obrnut 
2736,merni instrument koji ukazivati brzina rotacija . 
2112,kratak deo ( reći između radijski ili televizijski program ) koji se često koristiti za reklamiranje 
15927,dravidski jezik koji govoriti narod kota 
4271,biljka koji segaji zbog jestiv mlad izdanak i sočan lišće . 
9659,"zeljast biljka iz Evropa , Severne Amerika i Azija : makovica "
13673,novčan jedinica bivši Jugoslavija 
7606,beo sova koji živiti po ambar ; važan za kontrola glodar . 
13687,koji se odnositi na svet Dominika ili Dominikanski red 
14115,tabla od metal ili drvo ili staklo ili plastika 
11323,zabraniti zakon ili zvanično usvojen pravilo 
3103,spajanje ili vezivanje šav 
992,grupa od mnogo insekt . 
5385,Grčko alkoholni pića sa ukus anis . 
1451,Velka i rasprostranjen porodica biljka iz red Myrtales . 
17113,vlada uspostaviti na ostrvo @card@ ( Čan Kai Šek ) posle osavajanja Kina od strana komunista I Mao Ce Tunga 
14837,"neki od drveće iz rod Platanus koji imati bled kor klja se ljuštiti u mali pločica , psrtaste list i loptati glava plod . "
1761,književan stil moderan grčki koji imati obeležje pozajmiti iz koine 
12230,voljan čin izvrtanje činjenica 
1417,evroazijski rod višegodišnji trava i žbun . 
7703,mrav 
34,koji slediti prihvaćen običaj i pristojnost . 
3834,jedinica težina @card@ kilogram 
13334,"klasa zglavkar koji uključivati jastog , kraba , škamp , itd . "
6434,nešto što pokrivati ceo stranica 
16603,kanal koji povezivati pankreas i dvanaestopalačni crevo . 
13178,lešnjikare 
10410,jednačina u koji se jevlja eksponencijalan funkcija promenljiv 
8996,vršiti emisija ( npr . zraka ) 
2415,osnovni novčan jedinica Nigerija 
3973,mišić između rebro ; oni se kontrahovati u tok izdisaj 
5382,"lanac od @card@ ostrvo u zapadni delo Tihof okean , kod Japan ( sad ona vratiti Japan @card@ ) "
14939,finski jezik koji govoriti Ingri 
6817,"prav veverica , mrmoti , leteći veverica "
382,meso repa jastog 
6960,rod crvati . 
11404,kamen koji se koristiti za označavanje grob 
16194,onaj koji imati boja između zelen i narandžast u spektar boja ; podsećati na boja žumance 
1305,Urođeni kapacitet za nastanak nešto . 
11130,riba sa spljošten telo : raža . 
300,prouzrokovati kretanje ili okretanje 
6934,ili koji se odnositi na narod Sijuksa ili na njihov jezik i kultura 
5996,radnja u koji se prodavati ženski odeća i nakit . 
11535,Ljiljan istočni Mediteran i Balkan sa širok beo cvet u oblik ? 
9820,o botulinusu ili koji se odnositi na botulinus ili koji proizvoditi botulinus 
13609,ćilibarski zeleno muskadin grožđe sa jugoistok sjedinjen država 
3661,naučnik koji se baviti metematikom 
17198,skup pravilo ili propisan standard na osnova koji se donositi odluka 
2312,( hipotetički ) grupa jezik koji sadržati mnogi jezik poreklo iz Rusija ( ne uključivati ruski ) 
4658,čin usporavanje ili zaostajanje 
5273,obezbediti sklonište . 
409,ukuvati zgnječiti voće . 
12982,osoba koji ne raditi . 
6833,prdavac 
1521,biti prenositi kroz vazduh . 
3601,tropski azijski biljka od koji se praviti krotonovo ulja 
10492,dokument ( dozvola ) koji se odobravati izgradnja zgrada određenog tip na određenom zemljište 
5220,rez za zatvaranje vrata ili kapija ; šipak koji moći da se spustiti ili kliznuti u žleb 
15543,meso star domaći ovca 
6900,osoba koji jesam ekspert u korišćenj luka i strela 
2034,Mehanički muzičk instrument koji proizvoditi muzika rotacija cilindar koji jesam obložiti kočić . 
1071,oksid koji imati dva atom kiseonik u molekul 
1890,vrsta novinarstvo koji dešavanje predstavljati uglavnom fotografija 
4159,biti koji nebeski telo ( osim kometa ili satelit ) koji se okretati oko sunce u sunčev sistema 
5200,jedan od element koji kolektivno činiti brojni sistem 
366,neki ko pisati pozorišni komad 
11722,from @card@ million taj @card@ million years aga ; first air-breathing animals 
10733,tačka sabiranje svetlost ( ili drugi isijavanje ) ili tačka iz koji se rasipati 
10239,beo roba u koji se hrana moći čuvati na nizak temperatura 
13897,"azijski reka , izviriti na Himalaji i teći na istok ka Bengalskom zlaivu "
12140,"mlad osoba , posebno mlad čovek ili dečak . "
13039,stanovnik Island ili poreklo sa Island 
1200,ruzmarin . 
8823,osobina onaj što jesam permeabilno ( npr . u proces osmoza ) 
3034,morski utva 
4893,proučavanje upravni sistema u država i drugi politički jedinica 
5907,Jednogodišnja biljka sa beo cvet i jajast list . 
16460,jezik koji govoriti narod Marako 
1254,koji opisivati neki stvar pomću reč koji uobičajiti označavati nešto drugi 
11280,"zeljast biljka koji rasti u useklinama ; imati dugačak , uzak lišće i mali ružičast cvet . "
8586,"odrediti mera neki ili nešto , uzeti mera "
28,kvalitet neki ili nectega što jesam važan ili vredan pažnja . 
1289,kineski svilen buba . 
16093,"težak , krt trivalentan metal , po hemijski svojstvo sličan arsen i antimon ; obično se pornalazi u ruda drugi metal "
15840,velik crven paradajz čvrst mesnat sadržaj 
1428,istraživanje sastavni delovati neki celina i kakav jesam njihov međusoban veza 
10058,zaposliti koji obavljati fizički posati ili raditi u fabrika 
16660,"Bobičav plod crven ili crn boja , opor ukus , koristiti se uglavnom za dzemove i žele . "
6690,savremen dijagnostički slikovan metoda . osnovni prednost metoda jesam velik mogućnost razlikovanje različit tkivo organizam čovek i njihov prikazati u različit ton siv skala . 
11729,pustinjski gušter koji se hraniti mrav . 
10381,vojni jedinica koji se obično sastojati od dva ili više divizija . 
8146,odnos izmedju jedinica koji se izražavati dodatan karakter njihov značenje 
9120,dravidski jezik koji se govoriti u južnom delo centralni Indija 
5580,pojam u propozicija koji jesam povezati sa referent propozicija 
958,"sladak jestiv tamno-plave bobica , nisko rastući ili visoko rastući biljka borovnica "
1658,vrsta engleski plav sir 
5198,"plav mineral magnezijum , gvožđe , aluminijum , silikona i kiseonik ; često se koristiti kao drag kamen "
15751,posuda iz koji se piti . 
12775,merač koji mera potencijalan razlika između dva tačka 
13478,pustinja na Sinajskom poluostrvo na sever Egipat 
9474,promeniti redosled nešto 
3883,tipski rod porodica Menyanthaceae ; jedan vrsta grčica 
13333,čvrsto i prilično suv meso ( obično govedina ili teletina ) 
11066,komercijalan aktivnost uključiti u izgradnja građevina . 
13212,abnormalan ili fiziološki neuravnotežen stanje telo . 
7805,napisati ili prenositi u oblik pismo ili dopis 
3898,guščiji džigerica koji se koristiti u ishrana 
5050,proizvoditi snažan buk ( prilikom grmljavina ) 
7341,ženski donji rublja bez rukav 
16375,vitak tropski penjačica sa Himalaji . 
12751,neki od brojni rak sa vrlo dug noga i mali trouglast telo . 
13345,kratak mešan pića 
10936,neki ( posebno dete ) ko učiti od nastavnik . 
1100,nešto ponoviti iyraditi unositi izmena 
9573,testenina u oblik tanak cev ; suv testenina napraviti od durum pšenica 
2542,sirovina za boja i lakmus . 
323,opovrgavanje ili povlačenje prethodan tvrdnja . 
11513,malo azijski drvo koji rađati jestiv žut ili crven plod . 
8511,"sakupiti , na primer , dokaz . "
11559,Obično se uključivati u mongoloidan rasa . 
6106,mali rod južnoamerički drvo koji davati mlečan sok - kaučuk . 
7588,"osoba koji jesam steći diploma neki škola ( srednji škola , koledž ili fakultet ) "
15247,bunar koji davati ili jesam davati prirodan gas 
12330,dugačak šiljak na koji se držati meso u položaj za pečenje 
16587,stopala životinja sa kandža ( posebno četvoronožac ) 
973,dete nečiji sin ili kćer . 
8286,"slatkovodni , mali riba iz porodica Centrarchidae , nemastan meso "
14822,"neki od različit uređaj za regulisanje dotok tečnost ili gas , pritisak , temeperature , itd . "
1123,familija biljka dikotiledona iz red Myrtales . 
5378,unos sa lista osoba koji jesam doprineti film ili pisan rad 
12008,Čvorci iz star svet . 
16250,stanovnik Norveška ili poreklo iz Norveška 
3456,"uobličavanje , formiranje organ kao faza u embrionalan razvojuanism ) "
14135,bog podzeman svet ; u grčki mitologija on ogovarati Pluton 
1456,Čvrsta hrana koji se pripremati od presovan mlečan skuta . 
14157,patuljast aromatičan žbun mediteranski područje . 
306,sastavljati od komponenta ili delovati . 
1763,postati odvojiti 
17068,proizvođač igran film 
14601,broj @card@ i svaki drugi broj koji se dobijati ponovljen sabiranje sa @ord@ 
187,"Očistiti nečiji telo , reći pranje . "
15704,Pepsi jesam komercijalan marka pića kola 
1866,osoba koji graditi brod . 
192,Učiniti čistiti uklanjanje prljavština ili neželjen supstanca . 
7275,"glavni grad Maroko , na atlantski obala "
4341,od pre @card@ milion do @card@ milion godina ; povećanje površina zemljište ; primitivan amoniti ; krilat insekt 
11521,čin ili postupak raspoređivanje ljudi u klasa ili društven sloj 
10084,poželeti dobrodošlica koji ; pozdraviti koji na dolazak 
4542,goveđi odrezak od pečenica 
17327,kompilacija poznat činjenica o neki ili nešto . 
10378,"belančevinasta materija , supstanca od koji se sastojati rožnat deo telo "
13699,uzrokovati da se čuti . 
12074,Ženka labud 
4933,nizak drvenast višegodišnji biljka koji obično imati nekoliko glavnih grana . 
11976,"tikva sa čvrst kor i izdužen , kriv vrat "
8388,"vremenski period koji jesam potreban planeta ( npr , zemlja ili Mars ) da napraviti potpun revolucija oko sunce . "
7198,objekt iz koji vojni sila započinjati operacija . 
4717,polovina Zemljine loptiti . 
43,stanje biti zaposliti ili imati posati . 
6165,ćelija sličan limfocit koji se razvijati iz B limfocit u reakcija sa specifičan antigen ; nalaziti se u koštan srž a ponekad i u krv 
6515,aspekt izgovor koji podrazumijeva združivanje artikulornih organ kako biti oblikovati zvuk govor 
8337,"koji se odnositi na Hrvatska , njen ljudi i jezik "
10930,Ušati perajar južne hemisfera ; loviti se zbog skupocen krzno koji jesam poznati pod ime silskin . 
7394,pokrenuti učitavanje ( operativan sistema ) i započeti inicijalan proces 
3758,"postati jedinstven celina , integrisati se "
7604,Nepenušavo sladak vino koji se obično služiti sa kolačim aili posle jela . 
15639,"gas , tečnost i čvrst tvar jesam tri uobičajen agregatni stanje . "
11849,sisara čiji ženka imati torba koji sadržati sisa i gde se mladunac hraniti i nositi . 
15287,porodica ptica koji se poklapati sa red Rheiformes . 
1581,onaj koji raditi za neki ( osoba ili organizacija ) 
7338,republika na istočni kraj Afrika na Mozambičkom kanal 
24,posvetiti iznova nakon oskvrnjenja 
4286,snabdeti indeks 
11470,"vegetativan telo gljiva ( u zemlja ili na drugi podloga ) , razviti iz spor , sastavljen iz gust splet niti , hifa "
12707,učenje po koji se sav pojaviti u priroda i društvo svoditi na mehanički kretanje materija 
10006,zob . 
3432,severni grupa ostrvo u mali Antili 
1804,bitak u koji jesam @card@ p.n.e. Atinjanin i njihov saveznik pobediti Persijanac 
10600,biti podvrgnuti promena ili razvoj 
10891,otpadni cev koji odvoditi kanalizacijski ili površinski voda 
3040,osoba koji pisati reč pesma za pevanje 
9133,objaviti svoj prisustvo 
8043,označavati da jesam subjekt rečenica ' primalac ' ili ' cilj ' radnja označen glagol 
1814,novčan jedinica Švedska 
969,porodica dvosupnica iz red Urticales uključje rod : Ulmus ; Celtis ; planer ; trema . 
13466,slavuj . 
12526,eksplozivan naprava koji eksplodirati pri kontakt ; napraviti da uništavati voyila ili brod 
10610,praktičan metod ili veština primenjen na neki specifičan zadatak 
7447,vojni jedinica koji se obično sastojati od pet četa . 
8789,deo gramatika koji se baviti kombinovanje prost reč u složen 
6151,paprikaš od riba 
11731,"geranijum iz Svrope , Južne Amerika i Australija , posebno planinski područje . "
12611,sladak krompir 
16634,"u računarstvo , instrukcija koji povezivati jedan deo program ili jedan element u lista s drugi program ili lista "
6481,"država u severni Evropa , na zapadni strana Skandinavskog poluostrvo "
7025,odbaciti neki svoj . 
6520,parazitski sporozoe koji formirati sporiti koji sadržati jedan ili više infektivan sporozoa 
14432,the fruit Or seed of any of various bean Or pea plants consisting of a two-valved case that splits along both sides when ripiti and having the seeds attached taj onaj edge of the valves 
12273,sendvič sa tanko sečen šunka 
9389,osoba koji posedovati mnogo materijalan dobro i novac 
4070,utvrditi brdovit područje između južnog Liban i južne Sirija 
9199,svojstvo onaj što se lepiti za neki površina 
10375,sočivo koji uzrokovati rasjevanje paralelan snop svetlosni zraka kada kroz on proći 
5490,sudski poziv za strana ( stranka ) u spor 
