,Sysnet
4855,"država na severu Evrope, čini je teritorija poluostrva Jitland i mnoga ostrva između Baltičkog mora i Severnog ledenog mora"
9701,tkivo koje čini spoljašnji omotač nekog organa ili sistema kod biljaka ili životinja
190,neka trepljasta protozoa u obliku trube koja je član roda Stentor
9157,Godišnje i višegodišnje zeljasto bilje i žbunje.
476,Ukupnost uslova u nepsorednom okruženju.
12,Ladolež; ?bindweed; ?sweet potato; Biljke koje imaju cvet u obliku trube i penju se i uvijaju.
12501,digitalni računar srednje veličine
2341,"deo Severnog ledenog okeana, severno od Islanda"
1555,Poklapa se sa redom Psittaciformes.
11144,Svaka od velikih kornjača kod koje su udovi pretvoreni u peraja.
10651,drveni ili metalni štap na koji se stavlja uzica i mamac i koji služi za pecanje
12164,"Srediti nešto, recimo dug."
148,Koga se tič principi dobra i zla; koji se uklapa u standarde ponašanja i karaktera koji su zasnovani na ovim principima.
2507,električni provodnik koji predstavlja zajedničku vezu među više kola
10061,vladar i njegovi savetnici koji predstavljaju vladajuću klasu u državi
15553,zabeležiti pokrete u plesu pomoću sistema znakova
5751,"Kancelarija u kojoj se obrađuju vesti za novine, novinsku agenciju, televiziju ili radio stanicu."
12535,Bizamko goveče
10570,Industrijska biljka penjačica čiji se osušeni plodovi upoterbljavaju u pivarstvu.
2108,rat u koji su uključene sve veće svetske sile
16214,vreme koje je potrebno da Zemlja napravi jedan krug oko Sunca; meri se izmeđe dve prolećne ravnodnevice
11785,stanovnik Malija ili poreklom s Malija
14351,svetlo žuto grožđe bez semena koje se koristi za grožđice i vino
14891,prirodni otac ili majka
10725,odrezak bez koske od goveđe pečenice
2520,"opšti naziv za piva koja su dobijena sa vrha pri fermentaciji pšenice; obično su veoma svetla, mutna i penušava"
9038,Bilo koje jedinjenje ugljenika i nekog drugog elementa ili radikala.
12100,"Puževi, puž balavac i njihovi srodnici."
11578,Polučvrsta masa koagulisanaih crvenih i belih krvnih zrnaca.
10799,Pevati treperavim glasom.
11890,odbacivanje činom zabrane
11145,Najstariji poznati gmizavci&amp;gt; kornjače i izumrle vrste.
923,izumrli istočnonemački jezik starih Gota; jedini sačvani zapis je prevod biblije biskupa Vulfile iz 4. veka
15547,Dovesti do izvršenja.
748,Strana koja se vidi ili koja prva dolazi.
11836,dodatak na đonu sportske obuće koji se sastoji od trvdog šiljka
4994,Uzvratna grupna akcija.
16006,južnomaeričko piće nalik čaju od južnoameričke biljke
1152,Otići s nekog mesta.
17046,Samo pasja riba.
13231,jelo od mlevenog mesa prekrivenog pire krompirom
1912,Svi toplokrvni kičmenjaci čija je koža manje-više pokrivena dlakom; mladunci se rađaju živi (izuzev male klase monotrema) i hrane se mlekom.
14427,"pica sa paradajzom, sirom i inćunima"
10147,Manipulisati vozilom unutar prostora za parking.
229,Deo pantalona koji pokriva nogu.
15077,zvonari
13306,piletina krčkana u čorbi sa lukom i paprikama i potom pomešana sa kiselom pavlakom
15404,onaj koji odbija da govori ili komunicira kada se to od njega očekuje;
5425,Zapis serije događaja koji čine život neke osobe.
14673,pustinja na jugu Izraelu
8956,Uciniti debelim ili punačkim.
4105,"lpromatranje, ispitivanje trbušne duplje radi ispitivanja uzroka bolesti"
8716,"španski pisac koji je ostao upamćen po delu ""Don Kihot"" u kome na satiričan način govori o viteštvu; ovo delo je značajno uticalo na razvoj romana (1547-1616)"
6438,"kremasti sos sa sirom sa dodatkom crnog luka, žumanaca i rendanog sira"
11813,koji se tiče ili koji proizvodi ili koji je izazvan statičkim elektricitetom
5883,Napraviti zapis; predstaviti u stalnom obliku.
10859,Broj jednak ili veći od bilo kojeg drugog broja u datom skupu (matematika).
9647,"Organ u najranijoj fazi razvoja, osnov za dalji razvoj."
4596,koktel koji se pravi od vodke i soka od pomorandže
5705,koji se odnosi ili je sadržan u arhivu
9070,tamni rum iz Gvajane
15200,Slojevita struktura.
6513,Štuka severne hemisfere.
11353,kratak kritički prikaz
15164,tanak oštri instrument koji se koristi za uzimanje
14803,Krevetac za bebu u obliku kutije s drškama u kome beba može da spava dok se nosi.
6660,Neko ko predaje francuski jezik.
7042,Delikatna evropska zeljasta biljka sa sivkastim lišćem i klasijem purpurnih cvetova; nekad se koristila kao lekovita trava..
399,"smatra se osnovnom odbranom, pri kojoj se ispoljavaju suprotna osećanja ili impulsi od onih prvobitnih; osećanja i reakcije koje proizilaze iz reaktivne formacije često su prekomerne, uporne, nesrazmerne situaciji i okolnosti; osoba se ponaša potpuno suprotno od onoga kako bi zaista želela, a da toga nije ni svesna"
10553,tesna ženska odeća
11002,kopno koje spaja Severnu i Južnu Ameriku
6320,u grčkoj mitologiji boginja plodnosti koja se kasnije povezuje sa Persefonom kao boginja podzemnog sveta i zaštitnica veštica
8275,Gomila u pokretu.
4439,Nema smene generacija; faza meduze je potpuno preskočena; korali i morske anemone.
13396,"prekinuti emitovanje, npr. o radio-stanicama"
9200,Glavni grad nacije.
4434,Krajnji spoljašnji ili najudaljeniji region ili tačka.
7082,"Bivalentni nemetal bez boje, ukusa i mirisa, ne gori; u vazduhu ga ima 12 procenat."
16823,jezik na koji se prevodi tekst napisan na drugom jeziku
9632,Radnik koji zauzima ili mu je na raspolaganju kancelarija.
15264,srednji region tela  artropoda odnosno zglavkara  između glave i trbuha
314,Proces promene u niže stanje.
14967,"Veći žičani instrument, manji od kontrabasa; drži se između kolena; ton mu odgovara čovečjem glasu; solistički instrument."
5604,od pre 500 miliona do 425 miliona godina; konodonti i ostracodi i alge i morske trave
4808,vinova loza belog slatkog grožđa
1120,sistem versifikacije
16235,istočna podgrupa malajsko-polinezijskih jezika
2546,stanovnik Ekvadora ili poreklom iz Ekvadora
6663,zaliv između Kalifornijskog poluostrva i Meksika
3808,Kamila sa jednom grbom iz vrućih pustinja severne Afrike u jugozapadne Azije.
14813,mreža u koju se hvata riba i koja se potpom izvlači iz vode
256,Koji nije nezavisan.
10856,Mali poluvodeni daždevnjak.
6478,Posada broda koja uključuje oficire.
13628,Veliki rod uglavnom afričkih i australijskih zeljastih biljaka i žbunja; smilje; u nekim klasifikacijama uključuje rod Ozothamnus.
1059,"Žena kojoj je povereno čuvanje deteta, posebno u privatnoj kući."
12239,Institucija oformljena da bi se bavila poslovima.
4301,u srednjovekovnoj legendi nevesta kralja Kornvala koja se zaljubila u kraljevog nećaka Tristana pošto su greškom popili ljubavni napitak i ostali večno zaljubljeni
15201,Udariti nogom
9692,jesetra kašikara
11328,Vrsta organskog jedinjenja.
10613,"velika heterogena grupa RNK virusa koja je podeljena u grupe na osnovu vrste viriona; otkriveni (izolovani) iz artropoda (zglavkara), slepih miševa i glodara; većina ih se razmnožava unutar ćelija artropoda; oni su povezani sa epidemiološkim konceptom transmisije između vertebrata (kičmenjaka) kao domaćina i artropoda(zglavkara) kao vektora (prenosioca) (komarci, krlja (pregalja), mušica peskara, mušica itd.) i hrane se krvlju; oni mogi izazvati blage groznice, hepatitis, hemoragičnu groznicu, i encephalitis."
9853,tekuća traka koja u fabrici prenosi robu i delove
5023,objekat uveden predlogom
10416,Koji se odnosi na parlament ili ima prirodu parlamenta.
5097,"Dati novac, obično u zamenu za robu ili usluge."
5655,šastanski jezik kojim govori narod Šasta
675,učenik koji živi u školi u toku celog semestra
2096,Uključuje familije lišaja.
11327,dehitratizirana kafa od koje se napitak sprema dodavanjem vrele vode
8483,"glavni grad Demokratske Republike Kongo, ne reci Kongo, preko puta Brazavila"
12383,ritmička grupa od šest stihova u strofi
17370,Informacije poznate samo posebnoj grupi.
2551,providni ljubičasti varijetet kvarca;poludragi kamen
3312,Igra koja se igra sa kartama.
5622,koji je u vezi sa glagolom ili koji je formiran od glagola
1927,neko ko veruje da kakva elitna grupa treba da prisvoji vlast
2382,Bela hranljiva tečnost koju proizvode sisari a koja se koristi u ishrani ljudi.
14058,Veliko neprekinuto parče kopna.
12512,"koristilo se u ranijim klasifikacijama: sastoji se od raznovrsnog skupa organizama koji ne cvetaju i nemaju seme: alge, bakterije, glixve, lišajevi."
61,osećaj spontano dobrog rapoloženja
4637,Aparat koji obavlja neki kućni posao.
12257,pretvoriti se u žele
14816,srednjovekovni komad koji predstavlja epizode iz života svetaca ili mućenika
11984,Neko ko pravi ili popravlja odeću.
13842,krvna grupa čija crvena krvna zrnca nose antigen B.
3442,Divlji magarac iz Afrike.
14687,deo uva koji se vidi spolja
1756,energija koja se dobija od vetra (npr. od vetrenjača)
17196,Provodni kanal ili cev prekriven epitelnim ćelijama koji prenosi izlučevine i druge supstance.
702,beli ili sivi mineral koji se sastoji od litijum-aluminumovog fosfata; izvor litijuma
8420,stanovnik Nigera ili poreklom iz Nigera
11379,"Dimenzija koja ide kroz presek objekta, nasuprot dužini i širini."
2208,Optički instrument koji se sastoji od para sočiva koji služe za korekciju vida.
813,Pisani akt kojim se nalaže da se zatvorenik dovede pred sud.
5332,"desiti se, dešavati se, događati se"
13481,metoda za analiziranje ili predstavljanje statističkih podataka
3396,Putovanje na sveto mesto.
13883,"Koristiti um ili nečiju sposobnost da rezonuje da bi se zaključivalo, odlučivalo, ili dolazilo da rešenja i sudova."
1446,osnovna novčana jedinica Svazilenda
6782,deo južnog Atlantika oko Antarktika
10412,rod tuplia
15301,"metal sličan gvožđu, sivobele boje, tvrd i krt"
4619,četvrtast komad platna koji se koristi za brisanje očiju ili nosa ili kao dodatak kompletu
4069,Bilo koja gljiva iz familije Boletaceae.
15412,Voće koje je očuvano kuvanjem sa sećerom.
12886,koji odgovara ili operiše sa frekvencijama širokog pojasa
4824,vrsta reči koja ima funkciju predikata rečenice
5585,sloj mijelina koji omotava živčano tkivo
16041,Uhvatiti; i metaforički.
5741,Tipski i jedini rod porodice Tarsiidae.
14438,anatolski jezik
5590,Merni instrument koji ima niz oznaka u pravilnim razmacima; koristi se za merenje.
10760,neučestvovanje u sporu ili ratu
13014,"u računarstvu, računar koji je povezan na računarsku mrežu"
14105,"u matematici, broj koji jednak ili manji od svakog broja iz datog skupa"
2630,žaba primalja
6936,"Gledati, tumačiti i izgovarati naglas nešto što je napisano ili odštampano."
16624,raketa koja predviđena da iz vazduha (aviona) gađa drugi avion
2867,Balkanska republika u jugoistočnoj Evropi.
4466,Rod gljiva sa crnim tačkama kod kojih se klobuk raspada u mastivalju tečnost pri sazrevanju; ponekad se svrstava u sopstvenu porodicu Coprinaceae.
13666,"u računarstvu, sistem koji postavlja granice izmeđe računarskih mreža"
11625,"oblik zamenice ili glagola kojim se ne označavaju ni govornik ni adresant, već neka treća osoba posredno uključena u interakciju"
1220,"komentar ili instrukcija, obično dodtai uz nešto"
457,Godišnja ili višegodišnja zeljasta biljka: broćika.
9094,Zimzeleno drvo.
4313,Obično mali hleb okruglog oblika koji se moze otvoriti poput džepa.
13515,tuja
2809,manja uloga u umetničkom delu
11663,pustinjsko područje u centralnoj Australiji
7587,jedtivi plod bundeve; jede se kao povrće
11109,postati namočen
8014,rod jastrebova koji uključuje eje
4799,obožavanje svetaca
9739,rod bičarskin protocista
581,Neki žbun ili zeljasta biljka iz rod Artemisia sa aromatičnom zelenom ili sivkastom krošnjom.
2198,Neka od mnogih višegodišnjih zeljastih biljaka sa upadljivim svetnima glavicama živih boja; iz rodova Chrysanthemum; Argyranthemum; Dendranthema; Tanacetum; široko rasprostranjena.
288,"smear with blood, as in a hunting initiation rite, where the face of a person is smeared with the blood of the kill"
2819,Posteljični sisar koji ima kopita sa parnim brojem funkcionalnih prstiju na svakoj nozi.
6807,koštani izraštaj razvijen blizu gornjeg kraja femura za koji su zakačeni mišići
11458,"Velika debela postava napunjena elastičnim materijalom, često sadrži federe; koristi se kao krevet, ili deo kreveta."
7804,Mali soko iz starog sveta koji kruži u vazduhu nasuprot vetra.
208,"koji ne traži, ne iziskuje specijalne nutricione potrebe"
15681,"Za životinje, potpuno razvijen."
174,not standard; not accepted as a model of excellence
7087,imati kretanje creva
1970,Čin dodavanja spoljašnjih ukrasa na nešto.
2505,nežni i sočni unutrašnji deo cveta artičoke koja nije potpuno zrela
8509,Uobičajena jarebica u Evropi.
3536,Pljosnati crv koji parazitira u jetri i ?bile ducts domaćih životinja i ljudi.
13044,"Severnoamerička godišnja biljka, obično sa žutim ili narandžastim cvetovima; raste pretežno na vlažnom, kiselom zemljištu."
5072,ručni alat za ušrafljivanje vijaka (ima vrh koji se uklapa u glavu vijka)
17258,Biljka koja se upotrebljava u narodnoj medicini.
6386,koji je samo jedne boje
7892,"kratke pantalone do kolena, obično živih boja"
14404,žutosmeđ mineral koji je izvor retkih elemenata
8205,neko od velikih orlova koji se hrane ribom
14270,Mahunarka iz roda Pisum sa malim belim cvetovima i dugačkim zelenim mahunama koje sadrže jestiva zrna.
3470,oprema koja se koristi za igranje golfa
15244,odnos između jedinica kojim se izražava disjunktnost njihovih značenja
3678,Potez kao u fudbalu
16622,Zmije.
16234,biti takav koji se na određeni način ponaša kada se njime rukuje
13167,oblik zamenice ili glagola kojim se označava osoba kojoj se obraća (adresant) u datom diskursu
5074,Bilo koja riba iz klase Osteichthyes.
505,"Idealizovana slika neke ličnosti, obično roditelja koja se formira u detinjstvu."
10579,Bilo koja supstancija koju organizm prerađuje da bi dobio energiju i gradio telesno tkivo.
220,"onaj kojem se može ukazati poverenje, u kojeg se možemo pouzdati"
1139,Tipski rod porodice Ceratodontidae: izumrli rod dvodihalica.
5226,disfemizam za pivo (pogotovo vrste koje dosta pene)
223,mala srebrna riba hladnih voda; migrira između slanih i slatkih voda
959,engleski pesnik koji je napisao alegoričnu romansu koja veliča Elizabetu I (1552-1599)
2289,nešto sto je napisano ponovo
16936,Evropska vrba sa sjajnim kožastim lišćem.
8642,Čin promene količine ili veličine nečega.
2418,proizvoditi buku
9729,koji služi ili je namenjen istražiavnju ili otkrivanju
15682,polje nauke koje obradom komunikacija i kontrolom
10574,ločina
13347,"rastvor u kome se nalaze čestice neke tvrde materije, koji se ne rastvara u drugoj tečnosti"
10821,Neko ko je obučen u šumarstvu.
14376,Osoba koja je rođena na nekom određenom mestu; osoba kojoj je to mesto zavičaj.
42,elektronski tekst koji je sačuvan i koristi se u obliku digitalne slike
1294,parazitski bičari u probavnom (gastrointestinalnom) ili urogenitalnom traktu kičmenjaka i beskičmenjaka kao i kod ljudi
2024,Dati nečemu politički karakter.
12849,Prestonica Hrvatske.
11140,"Bilo koja od raznovrsnih, uglavnom hladnokrvnih vodenih kičmenjaka, koji imaju krljušti i dišu na škrge."
10255,Porodica koju čine sisari.
7008,učiniti nesrećnim
1076,Provoditi vreme u zatvoru ili radnom logoru.
67,sklonost obavljanju dobrovoljnih ili dobrotvornih poslova
12462,Plod voćka sa košticom.
7632,supa sa von ton knedlama
8775,"Veliki rod gljiva sa čvrstom stabljikom i belim sporama; klobuk može biti raznih boja; namaju mlečnog soka, po tome se razlikuju od roda Lactarius."
15971,stanovnik Slovačke ili poreklom iz Slovačke
16645,"reka u Italiji, uliva se u Jadransko more"
3298,Posetilac kome domaćin iskazuje gostoprimstvo.
57,Oosba koja ima i bavi se nekim specijalnim zanimanjem.
1916,"Veliki rod tropskog drveća, žbunja i penjačica koji uključuje drvo smokve."
6232,ispupčenje koje se koristi za ojačavanje ili za pričvršćivanje za drugi objekat
13249,električni uređaj koji može da prekine strujno kolo ako je preopterećeno
12467,skup vrednosti nezavisne promenljive za koje je funkcija definisana
11777,Vojno lice koje je po rangu niže od oficira.
472,Donja površina pećine ili jezera itd.
9771,Grupa umetnika koja se slaže o nekim opštim principima.
759,proces koji ima veze sa ljudskim jezikom
7909,"čin smišljanja nečega, npr. pravljenje skice, nacrta ili plana"
8332,"glavni grad Sudana, na ušću Belog i Plavog Nila"
12436,Drvo iz starog sveta srednje veličine sa glatkom sivom korom i lišćem nalik? koje postaje žuto narandžasto ujesen.
3092,"meso jestivog kopnenog puža, obično se servira u ljusci, s umakom od rastopljenog maslaca i belog luka"
13426,profesija koja se izučava na medicinskom fakultetu ili sličnim ustanovama a u cilju lečenja i sprečavanja bolesti
2457,deo tela insekata koji nosi krila i noge.
657,dobričica
1487,Kim.
13434,zapadnoafrički jezik kojim govori narod Volof u Senegalu; srodan je jeziku fula
8019,jednostavan objektno orijentisani programski jezik nezavisan od platforme koji se koristi za pisanje apleta koje klijent preuzima sa veba i koji se izvršavaju na klijentovoj mašini
1429,nešto što obezbeđuje pristup
6142,fermentisano i često penušavo piće koje se pravi od soka krušaka; po ukusu sličan jakom cideru
4539,"Evroazijski drozd srednje veličine, viđa se uglavnom zimi."
13377,Bilo koja pokretna imovina (posebno odevni predmeti).
3117,Medijum koji širi pokretne slike.
11677,koji se odnosi na judi koji govore romanskim jezicima
8307,Sukneni moljci.
14001,Mafin koji sadrži mekinje.
243,"osobina onoga na šta se može osloniti, što je pouzdano"
3999,Klateća ili klizajuća pregrada koja zatvara ulaz u sobu ili zgradu.
12926,pripradnik (budističkog) naroda koji živi oko reke Mekong u Laosu i Tajlandu i govori laoški jezik
5207,Unutrašnja donja horizontalna površina sobe ili hodnika.
4590,Sprava koja se kači na nešto da bi ga držala na mestu.
3234,Istočnoindijske godišnje trave; izvor semena sezama ili ulja.
14161,Najduži deo kanala za varenje u kome se zavšava varenje.
6234,malo primitivno sklonište koje se koristi za život
7075,injekcija koja se ubrizgava u (pod) kožu
14048,element koji ima atomski broj veći od 92 (što je atomski broj uranijuma); svi su radioaktivni
125,"Mlada kobila, žensko ždrebe."
13471,Rod uglavnom zeljastih biljaka koje imaju karakterističan ?fetid miris.
749,Neko ko dekoriše.
3943,rod porodice Bothidae
4675,obožavanje ribe
10390,turkijski jezik kojim govore Turci
10471,"Zgrada sa staklenim zidovima i krovom, za uzgoj i pokazivanje biljaka pod kontrolisanim uslovima."
6713,Oštar prolazan talas u normalnom električnom stanju (ili nizu takvih prolaznih) (elektronika).
6260,obična evropska šumska muharica sa sivo-smeđim perjem
4,osećanje seksualne ljubavi
3418,štuke; ??
6218,"Raste na Mediteranu, pldovoi su veliki i naborani, miris i ukus podsećaju na limun, ali ima malo soka, zato mu se kora koristi za kandiranje."
865,izlistak programa ili tehnički priručnici koji opisuju rad i korišćenje programa
8397,Koliko je nečega na raspolaganju.
4374,Povlačenje iz aktivnosti grupe.
5096,"Noćni sisar jugoistočne Azije i Filipina koji živi na drvetu; nalikuje lemuru, ima kožne nabore na obe strane od vrata do repa koji se koriste za duge skokove."
14750,sušeno mesto na način severnoameričkih Indijanaca
15724,izričito odobravanje čega
15803,bantu jezik naroda Čeva koji živi u istočnoj centralnoj Africi
11583,"biljka prvobitno uzgajana, ali sada divlja"
7351,"Dodavati detalje uz neki izveštaj ili ideju; pojašnjavati značenje nečega na učen način, obično u pisanom obliku."
4623,Pribor za kuvanje koji se sastoji od široke metalne posude.
719,"koji predstavlja ili odražava izvornik, po kom su ostale slične stvari oblikovane"
5185,"rafinisani beli šećer oblikovan u kocke, pogodan za služenje"
13683,gavke
2297,koji se odnosi ili je karakterističan za granu protestanske crkve koja se drži učenja Martina Lutera
5125,Evroazijska aromatična trava sa mnogo žutozelenih cvetova; lekovita biljka; naturalizovana u Severnoj Americi.
207,Čin kojim se čini neko dobro delo.
10066,Neki od više torbara travojeda Australije i Nove Gvineje koji ima velike i snažne zadnje noge i dugačak i debeo rep.
771,Sredstva za ubeđivanje ili argumentaciju.
8909,"elektronski uređaj koji se sastoji od rotirajuće loptice u kućĚištu, koristi se za postavljanje kursora i pomeranje slike na ekranu računara"
12826,Grupa krupne stoke ili ovaca ili neke druge domaće životinje (sisata) iste vrste koje čuvaju ljudi.
938,u grčkoj mitologiji nimfa koja se pretvorila u lovorovo drvo da bi pobegla od zaljubljenog Apolona
5287,na ili blizu Severnog pola
7656,Dobiti ili povratiti sa uređaja za skladištenje; o informacijama u računaru.
3724,osnovna novčana jedinica Saudijske Arabije
7684,Višegodišnje zeljaste biljke sa gomoljastim korenom i lepim cvetovima; u severnim i južnim umerenim područjima.
9639,pronalazač iz SAD-a koji je izumeo sistem za zapis alfanumeričkih podataka na bušene karitce (1869-1929)
8576,organsko jedinjenje koje sadrži samo ugljenik i vodonik
4443,Neka od mnogih tropskih aromatičnih biljaka starog sveta; godišnje ili višegodišnje trave iz roda Ocimum.
16918,Uspravna biljka koja se gaji zbog velikog pljosnatog zrna koje se koristi u ljudskoj i stočnoj ishrani.
501,"dodavati nastavak ili stvarati oblik koji će ukazivati na određene gramatičke kategorije (vreme, lice, broj, rod, vid, način)"
17333,novčana jedinica Perua
867,"u računarstvu, broj piksela po kvadratnom inču na računarski generisanom prikazu; što je veća rezolucija i slika je sve bolja"
10896,Gljiva iz roda Lepiota.
12198,Poklapa se sa redom Pholidota.
16469,bivša osnovna novčana jedinica Togoa
3635,algonkinski jezik kojim govore Mohikanci
11045,"burbon, šećer i menta preko mrvljenog leda"
8407,itorijski period koji prethodi srednjem veku u Evropi
4244,u grčkoj mitologiji Muza tragedije
552,o ćeliji ili organizmu koji ima veći broj garnitura hromozoma od diploidnog broja hromozoma
6793,novčana jedinica Irske
2332,imenica koja je izvedena iz glagola
10124,novčana jedinica Holandije
17199,jesti obrok; uzimati obrok
8698,Položaj na koji se po dužnosti raspoređuju brod ili flota (mornarica).
160,Jačati u snazi.
9448,"država na severoistoku Afrike, nalazi se na mestu drevne civilizacije čiji je procvat bio od 2600 do 30 p.n.e"
16986,luka na atlantskoj obali
5869,Jelen lopatar.
3802,"zamenica (kao 'koji' ili 'čiji') kojom se odnosna rečenica uvodi u imeničku sintagmu, pri čemu upućuje na centar te sintagme"
17110,matrica koja se dobija kada se razmene vrste i kolone date matrice
8822,jedna od tri membrane koje obavijaju mozak i moždinu
10383,bilo koja od velikih klasa sredstava za čišćenje
5830,Velika paprat sa dubokim korenom i usparavnim perastim lišćem.
8273,graditeljstvo koje služi kao sklonište za psa
9522,žblja trava
14240,"oksidni mineral gvižđa, hemijska formula α-Fe2О3, najstabilniji je i najrasprostranjeniji od svih oksida gvožđa"
9561,bilo koje jedinjenje rastopivo u vodi koje može da postane lakmus plavo i koje raeguje na kiselinu i stvara so i vodu
7485,prenosiv parafinski kuhinjski aparat koji koriste kamperi
11526,Materija kao staklo ili porculan koja ima neznantnu električnu ili toplotnu provodljivost.
8995,Ženski predak.
6158,stanovnik Sudana ili poreklom iz Sudana
6472,Drvo iz roda Malus koje rađa čvrste okrugle i jestive plodove.
4457,uglavnom tropske biljke: uključuje Dracenaceae (Dracaenaceae); uključuje bilje koje su u nekim klasifikacijama podeljene između Amaryllidaceae i Liliaceae
4276,Nosorozi.
206,"kvalitet da čovek ne stavlja sebe prvo, već da je spreman da svoje vreme, novac ili trud posveti drugima"
2559,Pitati naokolo.
8989,pretvarati se u pogledu određenih osobina ili stavova
7673,Javni tužilac za jednu oblast.
17052,transduktor koji konvertuje električnu energiju u akustičnu i obrnuto
7471,duga traka natopljena mastilom koja omogućava da se pravi otisak slova na papiru pisaćom mašinom
12458,Iskustvo življenja; tok ljudskih događaja i aktivnosti.
9624,potpodela neke vrste stvari
17332,Voćka iz umerenih područja koja rađa plod od tamnožute do ružičaste boje.
2891,zapaliti se
11428,"Anksioznost kao rezultat stvarnih ili izmišljenih pretnji sopstvenoj seksualoj funkciji, prvobitno primenjen samo na muškarce , ali se u principu odnosi i na žene."
3674,Kasava koja ima dučak gomoljast koren i meke krhko stablo; koristi se za spravljanje opjnog pića i tapioke.
11664,jumanski jezik kojim govore narodi Marikopa i Halkidoma
15967,Evroazijska biljka koja se gaji zbog jestivog pljosnatog semena koje se kuva kao grašak.
11653,meso jako dugačke štuke koja se nalazi samo u Severnoj Americi i Kanadi
7539,Divlji magarci iz Azije i severne Afrike.
8546,štap koji se sastoji od čelične šipke sa oštrim vrhom i koji se koristi za razbijanje blokova leda
10682,Koji se primenjuje na sve ili većinu članova kategorije ili grupe.
2680,sledbenik luteranstva
3888,formalno postavljenje na neku funkciju
12896,"Uobičajeno ime za osobu, obično skraćena verzija njegovog ličnog imena."
15525,kremasti beli sos koji sadrži ren i senf
8675,Mali evropski smeđi ljiljak.
6603,Tipski rod porodice Odobenidae: morževi.
7999,"uređaj sa eksplozivom koji izgara malom brzinom plamenom u boji, može se koristiti za osvetljavanje kakvog područja ili za slanje signala itd."
324,Jedna od četiri glavne strane sveta.
2184,šesto slovo grčkog alfabeta
13198,o apostrofi ili koji je karakteristika apostrofe
3557,bilo koji sir originalno oblikovan rukama
3262,koji se odnosi na bilo koju grupu jezika sotho
7344,koji se odnosi na praksu pomaganja memorisanja ili uključuje takvu praksu
8606,"Biljke čije se glave sastoje od mnogo ?: kaloper,?"
10914,tungovo dvo
172,Koji je u životu.
