,Sysnet
2645,glavni i najveći grad Republike Koreje
14973,"Poreklom iz Egipta, i široko rasprostranjena zbog aromatičnog semena i ulja koji se koriste u medicini i u kuvanju."
7004,smrznuti se( kao voda)
7090,"Biljožder dug 3 metra, gole kože, živi u Južnoj i Srednjoj Americi; ima ukusno meso zbog koga se lovi."
8158,korišćenje statističke korelacije da bise izračunala jačina veze između promenljivih
3668,"Listopadni žbun iz jugoistočne Azije, izvor indigo boje."
9550,kost u ruci
13293,Kuhinjski pribor (daska ili ručka) sa žicom za sečenje sira.
15539,Obratiti posebnu pažnju.
4352,tanki sloj na nečemu
1264,pisati nove podatke preko postojećih podataka što će ih izbrisati
557,konfiguracija mrežne topologije
15286,"tekstualna datoteka koja sadrži samo ASCII karaktere (ili karaktere drugog kodnog skupa), bez naznaka formatiranja"
13064,zamenica koja izražava razlike u licu
13691,Rod porodice žabljaka.
9011,Evroazijska biljka čije lišće miriše na jabuku; ima beli zrakasti cvet i perasto lišće; koristi se u lekovite svrhe; u nekim klasifikacijama smešta se u rod Anthemis.
1516,prednja i zadnja korica knjige
1600,UY
11308,Drveni duvački instrument s duplom trskom; služi kao bas u grupi drvenih duvačkih instumenata.
7778,jednostavan stohastički proces u kome distribucija budućih stanja zavisi samo od trenutnog stanja a ne i od toga kako se stiglo u trenutno stanje
1632,Mali rod guste godišnje zeljaste biljke.
14057,obožavanje vatre
15475,"kratka magnetna traka pričvršćena na kreditnu karticu ili debitnu karticu; magnetna traka sadrži podatke koji govore uređaju za čitanje ko ste i koji je vaš broj računa, itd."
4285,"Tuski sultanat koji je obuhvatao jugozapadnu Aziju, severnoistočnu Afriku i jugoistočnu Evropu; osnovali su ga otomanski Turci u XIII veku a trajalo je od Prvog svetskog rata"
10848,Evropska ptica pevačica poznata po melodičnom noćnom pevanju.
17214,celokupan biljni svet u nekoj regiji
11955,Tropsko američko drvo koje rađa veliki mesnati zeleni plod.
2239,(18th century) a watch with a balance wheel having a fake pendulum attached to it
9503,glavni grad Vijetnama smešten u Severnom Vijetnamu
3391,komad slanine sa boka
571,svež sir glatke teksture koji se pravi od pasterizovanog mleka i sirišta
2938,supstanca koja ima svojstvo ili sklonost da apsorbuje drugu supstancu
10761,"planinski masiv koji razdvaja Indjski podkontinent od Tibeta, na njemu najviši planinski vrh na svetu"
6080,koji se odnosi na glagolski vid
13569,sivo-belo meso list ribe
9350,Niske zeljaste biljke sa sitnim svetlozelenim lišćem.
10747,"škripne, ???"
12584,"Broj u obliku a+bi, gde su a i b realni brojevi a i je kvadratni koren od -1."
188,Koji je otrovan ili proizvodi otrov.
621,Vidljiva suspenzija u vazduhu čestica neke supstance.
1626,"stanovnik Tadžikistana i okolnih područja u Uzbekistanu, Avganistanu i Kini"
10709,zamenica koja izdvaja određenu stavku ili stavke od drugih članova iste klase
14179,osnovna novčana jedinica Norveške
1123,Familija biljaka dikotiledona iz reda Myrtales.
4993,turkijski jezik kojim govore Azerbejdžanci
16344,Društveni odnosi koji zahtevaju vlast ili moć.
1760,are
9188,Misirski bog Sunca; brat i muž Izide; otac boga Hora
16838,Pretraživati (recimo dno vode) tražeći nešto vredno ili izgubljeno.
11798,Smanjenje ekonomskih aktivnosti što ima za rezultat pad cena.
14222,japansko alkoholno piće napravljeno od fermentisanog pirinča; obično se služi vruće
10477,jabuka koja se primarno koristi u kuvanju
9804,podiže ipremešta teške predmete; teret visi na poluzi koja se okreće oko vertikalne ose
15652,dijalekat antičkog grčkog kojim se govorilo i pisalo na Atici i u Atini
11509,Rod drveća iz porodice Salicaceae koje raste na severnoj hemisferi; jablan.
5918,Francuski ili italijanski hleb isečen na delove i posut puterom sa aromom belog luka a potom osušen u rerni.
13796,kognitivni proces uključen u proizvodnju i razumevanje lingvističke komunikacije
8135,"Korovska biljka jakog mirisa iz starog sveta; čine je biljka koje se ponekad uključuju u druge rodove: Tanacetum, Tripleurospermum"
5371,Jjedan od prirodnih perioda na koje se godina deli po ekvinocijima i solsticijima ili atmosferskim uslovima.
9746,osoba koja pozajmljuej novac u zamenu za ličnu svojinu koja se ostavlja kao depozit
3444,prenosiva pravougaona putna torba za nošenje odeće
28,jedan konkretan slučaj putovanja avionom
12856,koji se tiče ili je karakteritičan za Južnu Afriku ili njene ljude
14702,crteži i fotografije u okviru knjige
2039,novčana jedinica u Sao Tome i Principe
287,Koji narušava principe dobra i zla.
6500,"velika šuplja drvena figura konja u kojoj su bili sakriveni grčki vojnici, koju su Grci ostavili ispred Troje u Trojanskom ratu"
17356,Jevrejski praznik (tradicionalno traje 8 dana) kojim se proslavlja egzodus Jevreja iz Egipta
2377,goveđi odrezak sa plećke
16256,matematička progresija u kojoj se svaki član množi konstantnom vrednošću da bi se dobio naredni član
7371,Zabava ili dokolica.
3338,osnovna novčana jedinica u Gvajani
15704,Pepsi je komercijalna marka pića kola
2948,Mala biljka sa belim cvetovima rasprostranjena od zapadne Evrope do Japana.
9632,Radnik koji zauzima ili mu je na raspolaganju kancelarija.
2575,o streptokokama ili koji se odnosi na streptokoke ili je izazivan streptokokama
3971,Dodati na sam kraj.
7521,pojačati električnu struju tako što deo izlazne snage deluje na ulazno kolo
14673,pustinja na jugu Izraelu
16337,Vrlo velika morska jestiva riba iz roda Thunnus; uglavnom živi u toplim moria.
15444,Ćurke i neke izumrle vrste.
2169,Bilo koji rod vodozemaca.
718,Planinska republika u centralnoj Evropi; ranije deo Habzburške monarhije i Jugoslavije; stekla nezavisnost 1991.
3176,jaje koje se sprema posebno u pavlaci ili puteru u maloj posudi za pečenje
12782,"zapadnoafrička republika u Gvinejskom zalivu, nezavisna od 1960"
14072,Stavljanje jedne stvari ili osobe na mesto druge.
13737,jagnjeći odrezak koji uključuje grudnu kost i povezane mišiće (meso)
10875,salata od voća
7681,Blitva
16440,Istorijsko područje u centralnoj i severnoj (velikoj) Jugoslaviji; Srbi nastanjuju ovo područje u VI i VII veku.
6603,Tipski rod porodice Odobenidae: morževi.
15265,Mešavina u kojoj su fine čestice umešane u fluid u kome ih podržava plutanje.
15594,lagani obrok
5104,porodica ptica iz podreda Oscines
10492,dokument (dozvola) kojim se odobrava izgradnja zgrade određenog tipa na određenom zemljištu
4664,Javno ispoljavanje grupnih osećanja (obično političke prirode).
6920,"Izvor za hašiš, a isto tako i za vlakna."
2115,Pisac romana i kratkih priča iz Sjedinjenih Američkih Država (1819-1891)
10553,tesna ženska odeća
11766,"stanje ravnoteže masa, blokova Zemljine kore, u odnosu na potkorne fluidalne mase po kojima pluta"
9358,kreker posut solju pre pečenja
12717,Red pravih bakterija; gram-pozitivne sferne ili štapičaste bakterije; u nekim klasifikacijama smatra se redom razreda Schizomycetes.
13844,bilo koja od različitih vrsta vozila na točkovima koje vuku konj ili traktor
11258,koji se odnosi na naučnu antropologiju
10845,Slikar koji radi murale.
11168,"meso malde kokoške srednje veličine, pogodno za prženje"
14652,"lantanoid - zastupljen u zemljinoj kori u količini od 0,48 ppm."
6017,zbirka odlomaka iz književnog dela
8780,"iznenadno električno pražnjenje između oblaka, ili između oblaka i zemlje koga prati snažna svetlost"
2860,"Rod godišnjih zeljastih biljaka, vrlo dlakavih; od Mediterana do jugozapad Azije."
5587,Zadebljali jestivi aromatični koren biljke celer.
7503,Aromatična baštenska višegodišnja biljka sa zapadnog Mediterana; koristi se kao začin i u narodnoj medicini.
13665,Saxš iz roda Eriophorum;
30,Koji nije savršen; defektan ili neadekvatan.
554,"Ptica hladnog, posebno arktičkog, područja koja ne leti ali vešto pliva, ima kratke noge, krila su modifikovana u peraje."
1929,Akademski odnos između nastavnika i njihovih studenata.
11157,grana biotehnologije koja koristi biološke procese za prevazilaženje problema zagađenja okoline
5810,kreativno pisanje cenjeno zbog estetske sadržine
8984,Široko se gaji u tropskim i suptropskim područjima zbog mirisnog cvetta i voćki živih boja.
5296,Rod iz porodice Cruciferae.
8957,velika ptica nalik na rodu koja živi po nepristupačnim močvarama Belog Nila sa širokim kljunom koji liči na klompu
1371,"Potpuno razvija osoba, od doba zrelosti nadalje."
12853,biftek od stražnjeg dela
6629,atabaskanski jezik kojim govori narod Hupa
12944,Ponavljati naglas iz sećanja.
13169,naučni instrument koji se sastoji od električnog kola koja dozvoljava da kroz njega prođu samo impulsi unapred utvrđene visine napona
9460,"u računarstvu, datoteći server koji može da se koristi samo za tu funkciju"
16834,proces uzimanja kiseonika iz vazduha i ispuštanja ugljen-dioksida
15254,Jednostavna mašina kojom se postiže mehaničko pomeranje kada ima oslonac.
1571,"Ptica sa velikom glavom, kratkim repom i dugim oštrim kljunom; obično ima krestu i u živim bojama je; hrani se uglavnom ribom."
7642,Mali i tanki vodozemac bez udova koji kopa kao crv iz roda Gymnophiona; nastanjuje vlažno tlo tropskih predela.
11584,Kupina puzavica severnik umerenih područja sa žutim ili narandžastim bobicama.
13263,Sunce i nebeska tela koja se oko njega okrueću u njegovom gravitacionom polju.
1448,Obaveza da se isplati novac drugoj strani.
1515,knjiga sa uputstvom za upotrebu ili rad nekog dela opreme
349,Vrednost koordinate na vertikalnoj osi.
3439,u rimskoj mitologiji Jupiterov glasnik i bog trgovine; u grčkoj mitologiji mu odgovara Hermes
6264,"u računarstvu, arhitektura računara koja ima veliki broj instrukcija ugrađenih u čim CPU"
15009,Rešiti se nečega.
4043,Tipski rod porodice Tragulidae.
390,Dobroutemeljeno objašnjenje nekog aspekta pirodnog sveta; organizovani sistem priznatog znanja koji se može primeniti u različitim okolnostima da bi se objasnio specifični skup fenomena.
11325,porodica južnoameričkih indijanskih jezika
12108,ispečena smeša od iseckane govedine
14589,"u grčkoj mitologiji jedna od 50 Nereida, majka Ahila (sa Pelejem)"
11858,"rat za kontrolu nad vodenim putevima između Iraka i Irina, izbio kao otvoren sukob 1980. i trajao do 1988, kada je prihvaćena prekid vatre UN rezolucijom"
8172,pismo kojim je zapisan staropersijski jezik (avestijski/avestanski)
4674,osnovna novčana jedinica Malavija
4348,"Oblikovati, formirati ili unaprediti nešto."
2942,prirediti interlinearni prevod reči ili izraza
9372,Cevasti organ u vodenoj životinje (posebno kod mekušaca) kroz koji voda može da se uzme ili izbaci i kroz izlazi voda se nesvarenim delovima hrane i štetnim materijama.
11366,trovalentan metalni element retke zemljane grupe
2959,matrica koja ima isti broj vrsta i kolona
9863,"grčki bog svetla; bog poezije, muzike, medicine i proricanja; sin Zevsa i Lete, a brat blizanac Artemide"
12075,Mungos iz severne Afrike; nekada se smatralo da se hrani krokodilskim jajima.
8218,koji se tiče Rima i njegovih ljudi
8799,zagasito ljubičasto grožđe sa juga Sjedinjenih država
3696,"Gudački žičani instrument, razvio se iz viole; ima četiri žice, šuplji korpus i hvataljku bez prečnica za odredženi ton; svira se uz pomoć gudala."
3825,Konj sa zapada SAD-a.
8914,bivša osnovna novčana jedinica Gabona
8348,baštenski alat za košenje trave na travnjacima
2342,any of numerous shrubs or herbs or vines of the genus Solanum; most are poisonous though many bear edible fruit
17384,Mala riba sa konjskom glavom koja je nagnuta napred i uvijenim repom; pliva u uspravnom položaju.
10119,"značka koja se nosi na rukavu i u obliku je slova V, a označava vojni čin i uslugu"
11861,"Grana geologije koja se bavi poreklom, sastavom i strukturom, kao  i procesima raspadanja magmatskih, metamorfnih i sedimentnih stena."
6893,"prelaz (u književnom, pozorišnom ili filmskom delu) na raniji događaj ili scenu koji prekida normalno hronološko razvijanje priče"
7753,virus koji proizvodi kržljavost i požutelost lišća kod biljaka krompira
1988,"u grčkoj mitologiji bog mora i zemljotresa; brat Zevsa, Hada i Here; u rimskoj mitologiji mu odgovara Neptun"
12865,Obični ljudi kao celina.
9361,država na zapadnoj obali Afrike u Gvinejskom zalivu
1547,Norveški kompozitor čiji je rad često inspirisan norveškom narodnom muzikom (1843-1907).
8444,osnovna novčana jedinica Belorusije
10076,Posuda u toaletu koja se ispire vodom.
17407,zaštitni oblog za povređeno oko
6735,godišnje ili višegodišnje trave toplih predela
6706,Mali rod vodenih ili poluvodenih biljaka.
6720,Događaj koga se pribojavamo.
6813,električni uređaj kojim se izmenjiva struja prevodi iz jednog napona u drugi
3022,najstariji bog; predstavlja beskonačnost prostora koji je prethodio nastanku sveta
13312,u grčkoj mitologiji personifikacija smrti; Njuktin sin
10887,dvogodišnji evroazijski beli čupavi čkalj
12651,Odenuti se.
5141,čovek koji veruje u okutizam i koji verziran u okultne postupke
15019,ceremonija koja se održava u sinagogi (obično za vreme Pedesetnice) kojom se priznaju za odrasle članove Jevrejske zajednice mladići i devojke koji su uspešno završili kurs Judaizma
9376,anti-inflamatorni lek koji ne sadrži steroide
2193,koji se odnosi na afričke narode koji govore bantoidnim jezicima ili na njihovu kulturu
9992,osoba čija je svetost izuzetna
5147,Domaća svinja.
4734,ukloniti primenom vode ili druge tečnosti i sapuna ili nekog drugog sredstva za čišćenje
11077,politički sistem kojim upravljaju bogati ljudi
8948,hokan jezik kojim govori narod Čimariko
13296,karakter koji služi da označi unakrsnu referencu ili fusnotu
6183,Kretati se u velikom broju.
90,koji je karakterističan za neformalni govorni jezik ili govor
5711,osnovna novčana jedinica Kine
3192,rezonovati i zaključivati dedukcijom
16387,"Travnata ili? biljka koja raste na vlažnim mestima; ima čvrstu stabljiku, usko travnato lišće i ?spikelets neupadljivog cveća."
9082,od neprelaznog glagola napraviti prelazni
795,koji se odnosi na ćelije
15556,velika grupa bakterija koja poseduje čvrste ćelijske zidove; pokretni sojevi imaju bič
13871,skup različitih bolesti respiratornog sistema
15194,Specijalna grupa koja je delegirana da razmotri neku stvar.
15670,oprema koja podrazumeva usmeren provod elektrona (posebno kroz gas ili vakuum ili poluprovodnik)
10507,osoba čije političke pozicije odgovaraju političkom centru
11632,kukuruzar
10208,ogranak nerva butne kosti koji inerviše potkožni deo sve do  unutrašnjih delova  noge i stopala.
40,Osećanje averzije ili antipatije.
14829,"skladište, npr. prostor na ratnom brodu, gde se čuvaju oružje i municija"
12205,vozilo sa točkovima koje vuku konji
10676,Ljudi koji žive jedni blizu drugih.
11896,medijum koji širi informacije putem telekomunikacija
4137,Kaktus čiji plod je nakd jestiv.
7210,Deo Zemljine površine prekriven vodom.
11028,imaju raspravu o kakvom pitanju
15515,strukture tela kojoj oblik daje hrskavica
13333,čvrsto i prilično suvo meso (obično govedina ili teletina)
8528,"reka na jugoistoku Francuske, uliva se u Ronu"
3937,skup elemenata koji su zajednički za dva skupa
14061,jezik Persije (Irana) u bilo kom od svojih drevnih oblika
6263,"Tipski rod porodice Dugongidae, čini je samo dugong (morska krava)."
4298,"Zaslađeno i rashlađeno piće koje se pravi od vina ili likera i voća, služi se u visokoj čaši"
2659,dodeliti početnu vrednost računarskom programu
646,glavni i najveći grad Ruande
5760,Bodljivac Starog sveta živi na zemlji ili pod zemljom.
17200,"u grčkoj mitologiji ženski Titan, boginja pamćenja i sećanja, majka Muza"
1045,hladnokrvni kičmenjaci koji obično žive na kopnu ali se množe u vodi; vodene larve prolaze kroz promenu u oblik odraslih
8155,o bakteriofazima ili koji se odnosi na bakteriofage
996,"Događaj, ili tok događaja, koji će se neizostavno desiti u budućnosti."
584,pravni dokument u kome se izlažu čovekove želje u pogledu raspodele njegove svojine kada umre
3279,generator koji se sastoji od navoja koji rotira između polova elektromagneta što stvara struju
1996,"Biti na velikoj udaljenosti u vremenu, prostoru."
13739,Mehaizam za prenos kretanja pomoću zupčanika za specijalne namene (kao upravljački mehanizam vozila).
179,"imati poželjne ili pozitivne kvalitete, posebno one koji su pogodni za određenu stvar"
4669,Egipat i Sirija napali su Izrael oktobra 1973. (na praznik Jom Kipur); Izrael je uzvratio kontranapadom i prešao Suecki kanal i ušao u Egipat
6590,Ljoskavac
6627,doktrina da su sva saznanja prvobitno izvedena iz božanskih otkrivenja i da su prenošena tradicijom
4478,"u telekomunikacijama, dvostruka maksimalna frekvencija koja se javlja u transmitovanom signalu"
8953,"saopštenje o nečijoj smrti, nekad uključuje i kratku biografiju"
11405,federacija plemena (posebno američkih urođeničkih plemena)
374,"Sisar vitkog tela, i suvezeni i vodeni, delimično opnasta stopala; ceni se zbog krzna."
6077,rameni deo svinje često dimljen
15275,Grabljivi crnobeli kit sa zubima sa velikim leđnim perajem; živi u hladnim vodama.
15965,Jedna od tri Dekartove koordinate koje određuju poziciju u prostoru.
3014,"tanko, filovano testo koje je urolano i pečeno"
2960,tibetsko-burmanski jezik kojim se govori u severnoj Burmi i u Junanu
591,Divlja koza iz Irana i susednih predela.
84,"peti i najviši element nakon vazduha, zemlje, vatre i vode; veruje se da je tvar od koje se sastoje nebeske tela"
13690,"standardno vreme u 5. vremenskoj zoni zapadno od Griniča, računato na 75. meridijanu; koristi se u istočnim Sjedinjenim Državama"
4472,Insekti; čine pet šestina svih poznatih životinjskih vrtsa.
7393,"U biologiji relativna sposobnost ka sjedinjavanju, realkciji ili interaciji (npr. sa antigenima ili biološkim sustratima)."
12744,koji se odnosi na brojni sistem s osnovom 16
2104,švajcerski matematičar (1707-1783)
16028,"u anatomiji mala struktura nalik malom korenu, fibrili nerva"
7120,do away with
1270,tajmer koji može da se pokrene i zaustavi u tačno označeno vreme
16113,tvrdi sloj zemljine kore za koju se veruje da lagano plovi
8059,"Kriva, na primer kružnica, koja nema krajnje tačke."
9453,"Koji se odnosi na nauke koje se bave materijom i energijom, posebno na fiziku."
6291,Suvozemna listopadna orhideja
109,nedolično ili nemoralno ponašanje
7957,Bilo koja legura čija glavna komponenta je bakar.
10200,računarska mreža koju čini svetska mreža računarskih mreža koje koriste TCP/IP mrežne protokole za omogućavanje prenosa i razmene podataka
10387,svetlosni mikroskop koji se sastoji od jednog konveksnog sočiva koji se koristi za proizvodnju uvećane slike
4019,burito punjen goveđim mesom
10283,infuzija od sušenog ili svežeg cveća ili lišća biljaka; za razliku od čaja biljke stoje dugo u hladnoj vodi
7565,čin kojim se neko sprečava da učestvuje jer se utvrđuje da nije kvalifikovan
5499,jestive grudne žlezde životinja
11309,"tekstil koji se koristi u domaćinstvu, obično bele boje"
4960,božanstvo koje se obožavali u drevnom Rimu
4229,Prolaz kroz koji vazduh ulazi u telo i izlazi iz njega.
11963,Mesec koji dolazi posle januara a pre marta u kalendaru.
14065,rožnata ploča koja pokriva i štiti dorzalni deo prstiju
16896,imenica koja iznačava konkretnu stvar i obično se zapisuje velikim slovom
16584,povezani su sa parazitima malarije i imaju fazu u razvoju koja se odvija u visceralnim (unutrašnjim) organima ptica
2020,bilo koje drvo iz odeljka Gymnospermophyta.
10895,Priznanje sebi (svesno ili nesvesno) da ste utvrdili osobine druge osobe (ili grupe osoba).
9795,Prekriti nešto bojom.
16673,Utvrditi identitet nekoga ili nečega.
7601,Učiniti da se raširi.
14394,Aktivnost podržavanja ili održavanja pomoću snabdevanja novcem ili potrepštinama.
8149,novina malog formata (400x300 mm)
6623,Jedno od para peraja koje je smešteno odmah iza glave kod riba i pomaže im da kontrolišu pravac kretanja.
7297,"Vrsta tambure, trouglastog oblika; ruski narodni instrument."
17009,Zakačiti etiketu ili obeležje.
10667,"anatomska struktura koja se koristi kao polazna tačka u lociranju drugih anatomskih struktura, kao u hirurgiji ili tačka na kojoj mogu da se izvrše merenja"
12963,Organizacija osnovana za specijalne potrebe.
8421,Praviti određenu buku ili zvuk.
8262,osnovna novčana jedinica Kiribatija
10306,struktura u šupljem organu (na primer srcu) koja sa preklopom osigurava jednosmerni protok fluida kroz nju
15627,končast produžetak nervne ćelije
1239,Otporna evropska godišnja biljka koja ima cvasti žutih cvetova.
16336,"fina obično bela glina koja služi kao vatrostalna, lončarska, ciglarska i porculanska glina i u medicini kao adsorbens"
165,"odbojno, vrlo neprijateljsko ponašanje"
7092,je kanal u Indijskom okeanu između Madagaskara i jugoistočne Afrike
9199,svojstvo onoga što se lepi za neku površinu
9204,pisani pravni dokument kojim se imovina prenosi na staratelja a koji se često koristi da bi se obezbedila obaveza poput hipoteke ili menice kojom se priznaje dug
667,mesto na kome se prizauju filmovi
10785,pisana evaluacija akademskog uspeha i ponašanja studenta
213,"(politika) obezbeđivati usluge, ugovore i pozicije u zamjenu za političku podršku"
15388,tipski rod porodice Globigerinidae
8224,adrenal-korteks hormon
15904,"Morske ribe s velikom glavom, uključuje grdobine."
1896,loptasti meki organ smešten u očnoj koštanoj duplji
2392,politička teorija koja zagovara državno vlasništvo nad industrijom
11515,Odštampana ili napisana kartica koja se predaje kao znak posete.
6866,"Grupa pretežno drvenastih biljaka koje se smatraju najprimitivnijim angiospermima; cvetovi su obično dvopolni i razmnožavaju se vetrom; sadrži 23 porodice, a među njima su Betulaceae, Fagaceae (koja uključuje i Amentiferae); ponekad se klasifikuje kao superred."
13451,Neka od raznovrsnih rečnih patki Evrope i Amerike sa kratkim vratom.
9781,u paleografiji spajanje dva ili više slova u jedno
1738,Vojna jednica koja je deo ratnog vazduhoplovstva.
3309,Moć ili autoritet da se komanduje.
12002,zrela jalapeno čili paprika osušena za potrebe kuvanja
13133,koji se odnosi na padež kojim se izražava obraćanje
4007,pronaći nečiju lokaciju
12514,osnovna novčana jedinica Danske
7599,Lišiti hrane.
1024,trivalentan metal grupe retke zemlje; obični se javlja u zajedno sa itrijumom
167,Osećati tugu.
14489,uređaj koji pomoću dva mikrofona šalje signal dvama zvučnicima da bi se dobio trodimenzionalni zvučni efekat
6564,Nešto što štrči iz oblika
16350,Uobičejeni ronac Evrope i Severne Amerike.
203,oblik aramejskog kojim se govorilo u Palestini u vreme Novog Zaveta
5311,Učestvovati u kovanju zavere.
8579,torbarski pacovi
6724,Vezati ili pričvrstiti u čvor.
16473,crtanje figure koja zadovoljava određene uslove kao deo rešavanja problema ili dokazivanja teoreme
13246,Dodatna komponenta mašine ili nekog drugog aparata.
9712,čin ubijanja (životinje ili osobe) kako bi se umilostivilo božanstvo
16086,jedan od para nerava koji potiču iz lumbalnih nerava i  inervišu mišiće i kožu prednjeg dela butine.
12346,Količina novca.
3847,grupa afričkih jezika iz niger-kongoanske porodice kojima se govori od istoka Obale Slonovače do Nigerije
10149,Koji se odnosi na specifično polje akademskog izučavanja.
12603,rod porodice Pteroclididae
13086,neukoričen rukopis nekog drevnog klasika (nasuprot svitku)
800,Kaput napavljen od krzna.
1426,virus tumora koji prenosi insekt koji usisava sokove biljaka Empoasca fabae
8922,u grčkoj mitologiji boginja pobede; u grčkoj mitologiji odgovara joj Nika
209,brojčana vrednost koja kada se sabere sa bilo kojim drugim drojem daje kao rezultat taj isti broj
2731,slatkovodna cilijata sa ovalnim telom i i veoma dubokim usnim žljebom
1407,zapisan ili odštampan pored i ispod nekog drugog karaktera
5633,Crvići ili krpelji.
3932,jedna od dve grane ugro-finske grupe jezika; govori se u Mađarskoj i u severozapadnom Sibiru
7062,porodica altajskih jezika kojima se govori u Mongoliju i susednim oblastima
493,Neko ko reklamira ili razmenjuje robu ili usluge za novac.
11999,rovke
10481,Piće koje se dobija pasiranjem i ceđenjem voća.
7294,osnovna novčana jedinica Ugande
5872,Čin počinjanja nečega.
111,koji može ponovo da se koristi
12469,"Trave iz starog sveta: mrtva kopriva, ?henbits."
14811,"Prave se od rendanog krompira, jaja i sa malo brašna."
5743,odnos nalegle i naspramne stranice u pravouglom trouglu
14886,"skup odevnih predmeta za nošenje na otvorenom, iste tkanine i boje"
1443,Napraviti rupu u nečemu.
8026,Markovljev proces kod koga su parametar diskretne vremenske vrednosti
13968,glas nevidljivog komentatora u filmu ili televizijskom programu
3169,koristiti računarskog miša za pomeranje ikonica na ekranu i biranje komandi iz menija
11510,američki novčić koji vredi jedan dolar
11621,Proces koji se događa u živim organizmima.
3708,glavni grad i najvažnija luka Mauricijusa
7939,Rod iz porodice Cicadidae: cvrčak.
17215,Neka od mnogih riba koje se love i jedu sa izduženim telom bodljikavim dorsalnim perajima.
4941,čin koji teolozi smatraju kršenjem Božje volje
3992,svojstvo onogo što ima jednu dimenziju
8394,Višegodišnja biljka koja ima debele aromatične razgranate korene i lisnate stabljike nalik na trsku.
2761,stabilni zupčanik koji se sastoji od postavljanja kožnih traka postavljenih na životinjsko vratilo tako da se može pričvrstiti i povući kolica
1129,tpolitička i ekonosmka teorija Karla Marksa i Fridriha Engelsa koja govori da je klasna borba neophodna da bi se ostvarile istorijske promene i da će kapitalizam na ktaju biti zamenjen komunizmom
3645,računarski hardver koji sortira podatke ili programe u predodređenu sekvenciju
6085,Kancelarija koja služi kao administrativni centar preduzeća.
