,Sysnet
2055,"poluostrvo na severoistoku Egipta, na severnom kraju Crvenog mora"
11822,Uobičajen ili karakterističan mentalni stav koji određuje kako će neko da interpretira neku situaciju i da odgovori na nju.
5912,osnovna novčana jedinica Čilea
552,Matematička vrednost ka kojoj funkcija teži kada nezavisna promenljiva teži beskonačnosti.
3764,iskrivljeno parče drveta koje kada se baci kako treba vrati bacaču
7532,"koji se tiče Sri Lanke (ranije Cejlona), njeni ljudi i kulture"
3438,Osoba koja je šef džžave (u nekoliko zemalja).
1090,mehanički ili električni eksplozivni uređaj ili mala količina eksploziva ; može se koristiti za iniciranje reakcije razornog eksploziva
14470,Prestonica i najveći grad Francuske; međunarodni centar kulture i trgovine.
9029,Jevreji kolektivno.
10948,koktel napravljen od džina (ili vodke) sa suvim vermutom
16181,protozoa sa jajolikim omotačem sa cementiranim peskovitim zrnima
19039,Ujediniti na federativnoj osnovi.
13054,fondi napravljen od sira topljenog u vinu za umakanje hlaba i ponekad voća
1879,"dominantni i zvanični jezik Etiopije; semitski jezik na koji je kušitski, sa kojim je narod Amhara bio u bliskom kontaktu, izvršio veliki uticaj"
1306,srednji region tela  artropoda odnosno zglavkara  između glave i trbuha
10242,"Vertikalna struktura koja samostalno stoji i ništa ne podržava, kao spomenik."
10160,"Pričvrstiti konopcem, uzicom."
6223,stanovnik Nauruana ili poreklom sa Nauruana
6085,koji se odnosi na Lihtenštajn i njegove stanovnike
12073,glagol koji zahteva direktni objekat
1356,koji se odnosi na ili je karakterističan za katalanske jezike
995,aerobne bakterije sa bičevima koje imaju spirano izvijenu končastu formu
10006,interval u toku koga se ponavlja sekvencija događaja
10454,"koji se odnosi na cigane, na njihov jezik ili na njihovu kulturu"
17041,slatka tamno ljubičasta šljiva
16974,Biljka poreklom sa Mediterana sa dubokim korenom; ima plave cvetove i peraste listove; gaji se zbog dugačkog slatkog korena.
19398,kontrolni sistem s povratnom petljom koja je aktivna
6681,čin kojim se sprečava
11746,koji ima tu funkciju da izvršava planove ili naređenja
12503,Okolnosti pod kojima su osobine stanja relativno stalne čak i ako je samo stanje dinamično.
4686,Malo zimzeleno drvo poreklom iz Azije i Severne Afrike; ima lepe ružičaste cvetove i vrlo cenjen koštunjavi plod.
10712,osnovna novčana jedinica Tonga
16863,očistiti sapunom i vodom
9304,grampozitivne štapičaste bakterije koje proizvode mlečnu kiselinu naročito u mleku
1848,Čin kada se pritiska.
8531,Tamni deo dnevnog ciklusa shvaćen kao vremenska jedinica.
452,zvanično vreme u lokalnom području (prilagođeno lokaciji širom Zemlje); utvrđeno zakonom ili običajima
15362,kost u ruci
12490,Višegodišnja evropska biljka koja ima grozdove malih mirisnih cvetova (obično belih); gaji se po baštama.
18697,moruzge
18438,Zrela krvna ćelija koja sadrži hemoglobin koji prenosi koseonik do telesnog tkiva; bikonkavan disk koji nema nukleus.
17441,stabilan vodeni tok na površini mora u određenom pravcu
3563,Neki od mnogih vrsta kupusa.
10767,Količina za koju nešto raste.
2104,"u radiologiji, bilo koji aktivan izotop koji se ubacuje u telo kako bi se ispitao metabolizam ili neki drugi biološki pocesi u organizmu."
5578,"iranski jezik kojim se govori u Turskoj, Iranu, Iraku, Siriji i Rusiji"
3372,(lingvistika) gramatički odnos (aktivni ili pasivni) gramatičkog subjekta prema radnji izraženoj glagolom
9938,Proizvesti zvuk duvanjem ili na sličan način.
10858,"rod trajnih zelenih biljaka, raste na pretplaninskim travnjacima"
11249,istočnoindijska voćka čiji je plod sličan rambutanu ali slađi
7582,stanje koje traje ograničeno vreme
1653,uređaj za podizanje teških ili kabastih predmeta
15535,Evroazijsko drvo koje je gaji u mnogim varijetetima zbog čvrstog okruglog jestivog ploda.
17421,redovi stepeništa postavljeni u takvu strukturu (često napravljenu od drveta) gde ljudi mogu da sede da kakav događaj (igru ili paradu) posmatraju
18285,"Koreni rogova su mu korasto ispucali, zadebljali i prošireni; ugrožena vrsta u Africi."
11939,"u računarstvu, tehnika predstavljanja realnog sveta računarskim programom"
1615,izazvano lekrevim rečima ili terapijom (koristi se posebno za komplikacije koje nastaju kao posledica lečenja)
929,"amblem (mali komad plastike, tkanine ili metala) koji označava vaš status (čin, članstvo ili pripadnost itd)"
14110,održati predavanje ili besedu
16792,Rod familije Čnocephalidae.
2186,struktura koja se koristi za odbranu
4516,stručna osoba ovlašscena da se bavi pravom; vodi pravne procese ili daje pravne savete
1548,Hitnuti kroz vazduh.
4984,ostvlje na severozapadu Okeanije
4724,Uglavnom ?monoecious i obično vodena trava.
14068,Začin koji se pravi od osušenog mesnatog dela kapsule muskatnog oraha.
144,Odnos koji postoji kada osoba zahteva i dobija profesionalnu pomoć iz kvalifikovanog izvora.
18502,"koji se odnosi na Kostariku, njene ljude i kulturu"
3061,Rana faza rasta ili razvoja.
9688,obrada podataka dovoljno brza da ide u korak sa spoljnim procesom
10474,"korišćenje reči koja se odnosi na dve ili više reči, iako odgovara samo jednoj"
170,"Onaj koji uživa ili pokazuje radost, zadovoljstvo ili srešu."
2162,pesma sastavljena od 3 strofe i anvoa
1332,gazirano piće koje sadrži ekstrate bilja
16429,"ćelija u germinalnom sloju kože (stratum spinosum, sloj bodljikavih ćelija) ima mnogo bodlji i zrakaste (radijacione) procese"
674,oružje sa ručkom i sečivom sa oštrim vrhom
9785,"amid ugljene kiseline,azotni proizvod razlaganja belančevina u organizmu (CO(NH2)2)"
10593,"poslastica koja se sprema od karamelizovanog šećera, jaja i mleka, a peče se u rerni"
1897,(računarstvo) datoteka koja sadrži podatke koji služe kao ulaz u uređaj ili program
16020,Vodene škorpije.
3771,Korovska biljka često napast u žitnim poljima.
15434,mašina za umnožavanje koja kopira grafički materijal delovanjem svetlosti na izolovanu površinu koja propušta svetlost i koja služi za stvaranje slike pomoću tonera
5801,Jedan od malih mišića oka koji služe za rotiranje očne jabučice.
11820,grana računarstva koja se bavi pisanjem računarskih programa koji mogu da rešavaju probleme kreativnocreatively
18310,a grain of barley
6666,"lantanoid - zastupljen u zemljinoj kori u količini od 0,48 ppm."
16758,krompir koji se peče i služi sa ljuskom
5934,Gas koji izaziva suzenje očiju ali ih ne oštećuje; koristi se u borbi protiv semonstranata.
7396,"u računarstvu, aplikacija koja se koristi za stvaranje, pregledanje i uređivanje tekstualnih datoteka"
6974,Učiniti nestabilnim.
5085,smanjenje cena namenjenih poboljšanju platnog balansa
2827,prst na ruci na kome se obično nosi prsten
11420,"Hrana koja se pravi od testa umešenog od finog ili integralnog brašna koje se obično diže kvascem ili praškom za pecivo, a onda peče."
1193,Ukupnost konstrukcija u kojima žive ljudi.
16911,Postati opšte poznat i prenositi se dalje.
9189,"u računarstvu, datoteka koja se koristi kao verodostojna za dati posao i relativno trajne vrednosti"
15818,koji sadrži aforizme ili maksime
57,Imati sposobnost ili moć kreativnosti.
10232,Uski komad zemlje koji prodire u vodenu masu.
13058,sok od grožđa
554,most koji je namenjen pešacima
8016,neka od mirisnih aromatičnih supstanci koje se koriste da poboljšaju ukus hrane
9734,"teleća kolenica ili cevanica pripremana sa maslinovim uljem, vinom i paradajzom, i servirana sa pirinčem i povrćem"
11253,potomak jednog crnog i jednog belog roditelja
15500,"pivo boje ćilibara sa svetlim sladom; slično gorkom pivu, ali suvlje i slabije"
15119,"Vreme posle zalaska sunca a pre njegovog izlaska, dok je napolju još mračno."
17633,"Vodene zmije, rasprostranjene po celom svetu."
15708,treće slovo grčkog alfabeta
7706,"Dovesti u saglasnost sa pravilima, principima ili korišćenjem; nametnuti pravila."
11063,lirorepe i ?scrubbirds
7172,prava linija koja spaja dve tačke na krivoj
14220,kratka čvrsta palica koju uglavnom koriste policajci
18461,nezakonito destilovan irski viski
11617,Pljosnati pravougaoni papirni omot za papire.
1564,"dozvoliti ulaz, dati ulaz u nešto"
2398,zemljouz koji povezuje Centralnu i Južnu Ameriku
14392,bilo koji od nekoliko srodnih jezika Kelta u Irskoj i Škotskoj
11148,"Ptice koje plove, plivaju i rone bilo u slanoj ili slatkoj vodi."
141,o ćeliji ili organizmu koji ima veći broj garnitura hromozoma od diploidnog broja hromozoma
2994,osnovna novčana jedinica Ruande
14629,Bilo šta što se poseduje.
12708,koščato meso ribe koja liči na haringu; obično se hvata tokom migracije u slatke vode radi mrešćenja
10359,Zaraditi kao neto profit.
16599,reč koja je nastala iz dve ili više reči izostavljanjem ili kombinovanjem nekih zvukova
1081,Kretati se prema nekome ili nečemu.
8637,Vreme koje je proteklo.
19075,talas koji podiže površinu vode ili zemlje
16001,mala površina obrađenog zemljišta
2532,jezik Hetita i glavni jezik u anatolskoj jezičkoj grupi; dešifrovan je iz klinastih zapisa
8567,rezonovati i zaključivati dedukcijom
18833,grafikon kod koga su dužine stubića proporcionalne veličinama
18888,Vrlo veliki razred dikotiledonskih bixlaka iz podklase Dilleniidae.
7365,Neka pasmina obično malih lovačkih pasa koji su trenirani da love životinje koje žive pod zemljom.
195,Mala savijača punjena mesom ili voćem koja se peče ili prži.
4495,oborina koju čine komadići leda
13521,"Lavovi, leopardi, jaguari, tigrovi, ??"
7556,"niz konlikata (1618-1648) između protestanata i kataloika koji je počeo u Nemačkoj a dalje se širio sve dok Fracuska, Danska i Švedska nisu ustale protiv Svetog Rimskog Carstva i Španije"
13347,"Medalja od zlata, ili koja izgleda kao da je od zlata, koja se obično daje nekome ko je prvi na nekom takmičenju."
3999,obilno krvarenje kao posledica povrede krvnog suda
2500,epska pesna na latinskom koju je napisao Virgilije; opisuje avanture Eneja posle Trojanskog rata; pruža vrlo upečatljivu sliku za nastanak Rimskog carstva
215,preuveličano osećanje blagostanja ili ushićenja
15111,osnovna novčana jedinica Mijanmara
11123,bantu jezik
1812,Malo jezgro sa tvrdom korom iz Severne Amerike.
2691,"hartija koja upija višak tečnosti, na primer mastilo"
12200,Prednji deo ljudske noge između kolena i članka.
4305,Poprimiti drugayiji oblik ili formu.
15794,dopuštena razlika - dozvoljavanje određene slobode kretanja unutar granica
8598,Broj koji identifikuje poziciju relativno u odnosu na osu.
9726,"grupa ostrva u Atlantskom okeanu, britanska prekomorska teritorija"
435,sintaksička niska reči koje čine deo neke veće syntaksičke celine
16984,Vrhunski pokretač koji predodređuje tok događaja (često se personifikuje kao žena).
13765,Veoma mali argentinski oklopnik sa bledom svilenom dlakom i ružičastim pločama na glavi i vratu.
3260,Biti na pravom mestu ili situaciji.
2535,Kuvati u kipućoj vodi.
10162,"dugačak arhipelag od više od 500 ostrva u Mikroneziji, istočno od Filipina"
12809,"način rađanja deteta  u kućnim uslovima, bez korišćenja metoda savremene medicine."
8491,koji se odnosi na izolacionizam
11725,"Insekt koji živi na zemlji, ima snažne zadnje noge pomoću kojih može daleko da skoči, hrani se biljkama i često je velika štetovyina."
14341,malo ovalno citrusno voće s tankom slatkom korom i vrlo kiselom pulpom
16926,prostorija opremljena za spremanje jela
1348,mekan sivi mineral; glavna ruda antimona
13757,"sos koji sadrži majonez začinjen biljem, senfom i kaprom; služi se npr. uz salatu i hladno meso"
7793,Uzica načinjena od upletenih vlakana ili žica.
2260,dezinfikovati s hlorom
4801,Supstanca koja je u tečnom stanju na sobnoj temperaturi i pritisku.
16716,koji se odnosi ili je izražen pravopisom
9458,Čin kojim se nešto posvećuje tako što se kroz neki crkveni obred izdvaja kao posvećeno Bogu.
6871,svakodnevni govor ljudi (različit od književnog jezika)
10135,Biljka iz roda Tofieldia koja ima pravo lišće i male cvetove.
16943,autokratija u kojoj vlada monarh koji nasleđuje vlast
18571,"krokodili, aligatori, kajmani, gavijali"
16119,Veliko neprekinuto parče kopna.
10900,Žena koja je zadužena za negu i lečenje u medicinskoj ustanovi.
1648,"Mala vojna jedinica, obično sastavljena od dva-tri voda."
26,velika porodica endoparazitskih ameba koja napada digestivni trakt
15926,udarati čekićem ili kao čekićem
10284,period velikih društvenih i političkih promena u Narodnoj Republici Kini od 1966. do 1976. godine
4948,Boksersko nadmetanje.
19372,Nauka o materiji; grana prirodnih nauka koje se bave sastavom supstanci i njihovim svojstvima i reakcijama.
11496,promeniti se (u pogledu fizičkih karakteristika i atributa)
4527,veliki planinski masiv u centralnoj i južnoj Evropi
14875,izgovoriti sa trilerom (foneme `r`)
17789,ptica ronilica sevrnih mora s plovnom kožicom na nogama crno-belim perjem i kratkim vratom
4565,"koji se tiče Spanije, njenih ljudi i kulture"
15445,"uskladišten u centralnom računaru, kontrolisan od njega ili u direktnoj komunikaciji sa njim"
16236,"Veliki majmun koji živi na zemlji i ide četvoronoške, ima njušku kao pas."
16673,o protozoama ili koji se odnosi na protozoe
9854,Postati tvrd ili tvrđi.
14830,Čin uzburkavanja nečega; uzrok njegovog okretanja (obično snažno).
9652,Fleksibilna cev kojom se sprovodi tečnost ili gas.
15173,Učiniti prvi korak ili korake u sprovođenju neke akcije.
9716,Imitacija ili reprodukcija originala.
16515,glavni i najveći grad na Kubi
1027,zbir vrednosti podeljenih brojem vrednosti
11717,"GXivasti korali, gljivač."
2341,Američki orah sa istoka SAD-a koji podseća na ?? ali sa mnogo većim jezgrom.
9129,biljka iz roda Silene
12329,Duvački instrument; svirač uduvava vazduh u mešinu a izduvava ga kroz duvaljke.
15665,Mediteranska biljka čiji se nerascvetali pupoljci upotrebljavaju kao začin.
253,Kultivisana evropska ribizla koja nosi male jestive crvene bobice.
15501,naspramne stranice knjige ili neke druge publikacije
4903,naučni instrument koji se sastoji od ekrana i ulaznog uređaja koji operator koristi da nadgleda i kontroliše sistem (posebno računarski sistem)
11048,Okretanje u suprotnom smeru.
8738,koji se tiče Namibije njenih ljudi i kulture
8128,Putovati ili transportovati se prevoznim sredstvom.
13223,"koji se tiče Vijetnama, njegovih ljudi i kulture"
13422,"Listovi imaju aromu limuna, dodaju se salatama, jelima od povrća i divljači."
2752,bantu jezik
16873,Mala evropska sova.
13681,Zgrada gde se obavljaju poslovi vladinog ministarstva.
16430,javni put koji obično ima trotoare i koja prolazi kroz naseljeno mesto
2984,algonkinski jazik kojim govori narod Arapaho
11467,Ometanje nečijeg puta.
4430,"vrsta jestive morske školjke, živi u grupama na morskom dnu, blizu podmorskih izvora"
3435,Uskratiti kiseonik i sprečiti disanje.
15652,jestive ljubičaste ili crvene bobice
8681,stanovnik Pariza
5265,odnos broja opažanja u statističkoj kategoriji premaukupnom broju opažanja
2476,odbijanje pohađanja službi u Crkvi Engleske od strane katolika (u prošlosti)
16819,"osmodnevni jevrejski praznik kojim se obeležava ponovno posvećenje hrama u Jerusalimu, 165. godine pre Hrista"
8047,Treća planeta od Sunca; planeta na kojoj mi živimo.
16979,predmeti za upotrebu za stolom
13566,obala jezera
2414,meko meso u predelu krsta sa obe strane kičmenog stuba
17154,Rod porodice Phalangeridae.
4,koji oseća ili ispoljava kajanje zbog nedela
8771,tipski rod porodice Alcidae koga čini samo njorka
17665,Čine je samo manati
18398,meso (naročito ovčetina) dinstano sa krompirom i lukom
7804,Era od 251do 65.5 m.g.
1131,"italijanska poslastica, spravljena od žumanjaca, šećera i slatkog vina, služi se uz keks i voće, obično hladna"
15350,Ne izvrći koleno kad radiš ovu vežbu
1886,Čin koji se odustaje i napušta broba ili zadatak.
16120,tunguski jezik naroda Evenki iz istočnog Sibira
11132,(šahovska figura koja može da pomera dijagonalno po pljima iste boje
278,kazna za prekoračenje odnosno zbog prekoračenja brzine
2465,Rod iz familije Pročonidae: rakuni.
70,osnovna novčana jedinica Tanzanije
12381,Neki od raznovrsnih leptira iz porodice Lycaenidae koji ima krila bakrene boje.
7294,veliki komad kupastog oblika koncentrovanog rafinisanog šećera
9665,Specijalista interne medicine.
114,"U ekologiji, grupa međusobno zavisnih organizama koji nastanjuju istu oblast i utiču jedan na drugog."
10967,slovenski jezik kojim se govori u Republici Makedoniji
6907,Nedostatak darežljivosti; nesklonost da se da novac.
9749,Mužjak srne
9742,Vrisak
14877,Razlika između prihoda i rashoda u datom vremenskom periodu.
11284,staklasti mineral koji se sastoji od natrijum aluminijum silikata i natrijum hlorida u kristalnom obliku; javlja se u mamgmatskim stenama
19149,nalog (varant) kojim sud ovlašćuje policiju da traži predmete ili lica koji su uključeni u izvršenje zločina i da ih izvedu pred sud ;nalog opisuje lokacije na kojima policija može vršiti pretres
11997,"promeniti u pogledu prirode, svrhe ili funkcije, naročito podvrgavanjem hemijskoj promeni"
8219,od pre 345 miliona do 280 miliona godina
3262,U nekim klasifikacijama smatra se posebnom porodicom.
3114,Veliko zimzeleno drvo toplih područja iz čijeg se aromatičnog stabla dobija kamfor.
12275,sendvič u kome su svi sastojci uvijeni u meku tortilju
18082,Pobeći iz zatočeništva.
15016,Raniji period u nečijem životu (posebno neki za koji ima razloga da krije).
96,Koji koristi intelekt ili je privlačan intelektu.
15720,čin ili postupak raspoređivanja ljude u klase ili društvene slojeve
18938,Projektili koje treba ispaliti iz oružja.
7299,koji se odnosi na ljude koji vode saveznu vladu
16034,Osnovni ili suštinski atribut koji dele svi članovi klase.
4910,ograničiti opseg nečega
4981,zaključiti rezonovanjem
13522,Grupa zvezdanih sistema.
16470,jestivo grimizno voće oblika šljive koje raste u Južnoj Africi
3306,koji se tiče Litvanije i njenih ljudi
17744,Vreme između zalaska sunca i ponoći.
6916,Vodena biljka iz roda Ceratophyllum; formira podvodne mase u barama i sporim potocima.
7259,Razmeštaj mlečnih zuba.
6436,rast cene ili vrednosti
19356,Urezati brazdu u stub
13408,glavni i najveći grad Ruande
12111,"o Bibliji, koji se tiče Biblije, koje je sadržan u Biblji, ili koji je u skladu sa Biblijom"
5371,suvo grožđe sa semenom
12908,grupa picornavirusa koja inficira gastrointestinalni trakt a može se proširiti i na druge delove (naročito nervni sistem)
17823,"Primitivni morski kičmenjaci bez vilice: morske i rečne zmijuljice, inger."
7490,"Napoleon je porazio Ruse u rovovskoj bici kod Borodina 1812, ali je nepopravljivo oslabio svoju armiju"
18720,Predmet kojim se istresa prašina iz tepiha.
2362,odnos srodstva između majke i njenog potomstva
18115,plastična masa sintetičkog parafina
10763,Poklapa se sa redom Pholidota.
16039,u klasičnoj mitologiji bog muške plodnosti i zaštitnik bašti i vinograda
11305,sok od grejpfruta
15596,Porcija koja je odsečena od većeg dela.
10244,Vod koji poseća na most ali prenosi vodu preko ravnice.
17169,"u računarstvu, kružni put na magnetnom disku po kose se upisuju podaci"
17524,kost koja povezuje scapulu i sternum
18429,Podela grupe u suprotstavljene frakcije.
9843,deo govedine koji uključuje kost u obliku slova H kod kuka
1445,Dovesti do kraja ili zaustaviti.
1794,čin kontrole tako što se neko ili nešto ograničava
15833,najveći planinski lanac u Bugarskoj i na Balkanskom poluostrvu
19186,osnovna novčana jedinica Uzbekistana
11072,"odeća za gornji deo tela, kakvu nose žene"
6620,porodica mozanskih jezika kojima se govori na severozapadu SAD i u zapadnoj Kanadi
19268,meso starije domaće ovce
16,koji je oslobođen stresa ili pogoduje mentalnoj opuštenosti; koji ima ili pruža duševni mir
9608,Evropski ?dory.
16947,Sveta tajna kojom se krštenoj osobi daje potpuno uključenje u crkvu
1826,"Poruka kojom se daje obećanje, pruzima da izvrši."
16666,mleveno povrće i meso umotano u palačinku i prženo
6387,Alge zelene boje ili bezbojne; slobodno se kroću u morskoj ili slatkoj vodi.
8790,grana biologije koja proučava strukturu i aktivnost makromolekula koji su ključni za život (i naročito njihovu genetsku ulogu)
10916,satnovnik Gruzije ili poreklom iz Gruzije
4965,"najviši planinski vrh zapadne hemisferem nalazi se u Andima u zapadnoj Argentini, visina 6960m"
16252,Prostorija opremljena mogućnostima za pranje ruku i vršenje nužde
15309,Vremenski period u godini kada škole rade i ljudi uče.
7918,odnos uzajamne zavisnosti ili delovanja ili uticaja
13432,Osoba ili firma koja sklapa ugovor za izgradnju nečega.
2046,"Poljske stenice, prave stenice; uključuje podred Heteroptera (prave stenice) i Homoptera (cikada, cvrčak)."
6342,koji se može izračunati ili proceniti
19144,Porodica koja je rasprostranjena po celom svetu: prave žabe.
7486,Neki od brojnih morskih sisara koji dolaze na obalu da se pare; nastanjuje uglavnom hladna područja.
12810,Čin predaje (pod dogovorenim uslovima).
3626,dijagonalna matrica kod koje se svi elementi na dijagonali jednaki
7423,popustljivost i saosećanje koje prema počiniocima kakvog krivičnog dela pokazuju lica ili agencije zadužene za sprovođenje pravde
4136,pridržavati se čega
17700,nešto što ima vrednost
17377,Mala kuća na jedan sprat.
11648,Osnovna ritmička jedinicaâ u muzičkom delu.
5412,"koji se tiče Zimbabveja, njegovih ljudi i kulture"
5597,glavni grad Eritreje
18514,koji sintaktički uspostavlja odnos suprotnosti između rečenica ili rečeničnih elemenata
8627,"Koji nije tanak; određene debljine ili relativno velikog prostiranja od jedne do suprotne površine, obično po najmanjoj od tri dimenzije."
1928,određivanje matrica koja kada se pomnoži s datom matricom daje jediničnu matricu
6013,"Izlaziti, o nebeskim telima."
168,O metalima.
6186,Heljda; u nekim se klasifikacijama uključuje u rod Polygonum.
9162,stoni pribor koji služi da se seče i jede hrana
4042,Oblik zabave koji predstavlja neku priču nizom slika koje stvaraju iluziju kontinuiranog kretanja.
13962,najmanji moguć
15242,Neko telesno svojstvo.
17361,koji je pisan kurzivnom formom staroegipatskog pisma
189,koji oseća ili ispoljava bol ili žalost zbog greha ili uvreda
18437,bakterije zemljišta koje oksidišu amonijak u nitrite
17549,Koji se odnosi na komunikaciju.
67,rod podporodice Sterninae
981,proces u kome tečnost prolazi kroz neki filter
13838,"Grupa ljudi, životinja ili vozila koja se kreće u mae ili više pravilnoj formaciji."
11540,osluškivati sa namerom
13939,Bobičavo voće koje se koristi za dzemove i želee.
7445,Specijalista iz ginekologije.
1557,sočivo koji uzrokuje fokusiranje paralelnog snopa svetlosnih zraka kada kroz njega prođu
14957,strog rimokatločki red koga je osnovo Sveti Bruno 1084
6570,dravidski jezik kojim se govori u jugoistočnoj Indiji
4384,Ovalno rasplodno telo ptice (posebno ženske) koje se koristi kao hrana.
4443,koji ima ili uključuje ili se sastoji od više delova ili entiteta
12536,kratak spis o predmetu interesovanja objavljen u obliku brošure
4705,izvući iz kakve zamršenosti
8376,novčana jedinica Azerbejdžana
891,Koji se odnosi na praktičan predmet koji je organizovan po naučnim principima.
4820,kuvanje suvom toplotom u pećnici
12468,"meso manjeg pileta čija težina ne prelazi 2 1/2 kg, pogodno za pečenje"
17327,Jedna od četiri glavne strane sveta.
8006,Poruka koja se prenosi telegrafom.
7671,glavni grad Ekvatorijalne Gvineje
17916,povezivanje slogova i reči pomoću crtica
13053,odlučiti sa autoritetom
5643,zlatovrana
4194,"skup odevnih predmeta za nošenje na otvorenom, iste tkanine i boje"
16883,epska pesma pisana na srednjem visokonemačkom koja se zasniva na legendama o Zigfridu i tevtonskim kraljevima
189,onaj koji ima visoku vrednost ili cenu;
9755,Kalandar koji je uveden s reformom pape Gregorija XIII godine 1582.
11017,Kakaovac
13763,gust sos napravljen od paradajza sa mnogim začinima
17161,"Neka od mnogih pretežno mediteranskih biljaka iz rodova Asphodeline i Asphodelus koje imaju pravo lišće i grozdaste cvati belik, ružičastih ili žutih cvetova."
7130,novčana jedinica Kolumbije
5662,Veliki rod usnatica iz starog sveta: timjan.
4868,kvadratna matrica čija determinanta je nula
16462,bilo koji dan kada škola radi
8641,supstanca ili jedinjenje koje se dodaje da bi se izazvala hemijska reakcija
1745,čvrsto zgrabiti
4716,u grčkoj mitologiji bog zapadnog vetra
17044,čin bušenja rupe (naročito niza rupa radi lakšeg razdvajanja).
7677,"Mediteranska biljka koja se gaji kao kućna biljka zbog upadljivog tamnozelenog lišća sa srebrnim odsjajem i visećim belim, ružičastim ili crvenim cvetovima."
2897,povrće i morska hrana umočeni u puter i prženi u dubokom ulju
6108,fini mleveni mineral koji se sastoji od magnezijum silikata; koristi se u raznim kozmetičkim i medicinskim puderima
157,stanje degeneracije mentalnih ili moralnih kvaliteta
11953,koji postoji od samog rođenja
16582,"Stanje kada deo srčane muskulature treperi umesto da izvodi, kao normalno, kontrakcije. Može se lokalizovati u pretkomorama ili u komorama."
9152,"Pretvarati iz čvrstog u tečno stanje, obicno zagrevanjem."
8991,(o kosi) koji ima sitne čvrste uvojke
1632,"Osoba, ne mora biti supružnik, sa kojom neko živi i duže vreme ima seksualne odnose."
17265,"U anatomiji, bilo koja šuplja cilindrična telesna struktura."
2192,irski gelski od 1100. do 1500. godine
15204,"Jedna od dve paralele na oko 23,5 stepeni južno i severno od ekvatora koje predtsvljaju najdalje tačke na kojima sunce može da sija direktno iznad glave."
6377,avokado
324,Ples kao deo društvenog okupljanja.
8221,najmanji ceo broj ili znak koji obeležava taj broj
8766,"sočno tropsko voće sa debelom korom, veličine narandže"
