,Sysnet
13363,tri boginje usuda; u rimskoj mitologiji im odgovaraju Parke
9745,osnovna novčana jedinica Šri Lanke
445,Drveni duvački instrument s jednim jezičkom i ravnom cevi.
12930,Lemur vitkog tela iz južne Indije i Šri Lanke.
12818,prirodni žuti ili purpurno crveni pigment koji se javlja u biljnom ili životinjskom svetu
19464,Pribor za kuvanje sa ravnim fleksibilnim delom i dugom drškom; koristi se za okretanje i serviranje hrane.
15210,Kretati se na točkovima ili kao na njima ili na vozilu sa točkovima.
975,Galete koje se često služe uz sladoled ili voćni krem.
10578,Vodeni sloj na zemljinoj površini koji uključuje i vodenu paru.
2305,Jedini rod porodice Sparganiaceae; barske i vodene trave umerenih područja.
9553,Republika na zapadnom Balkanu u južnoj Evropi na istočnoj obali Jadranskog mora; ranije deo Habzburške monarhije i Jugoslavije; postala nezavisna 1991.
19399,grčki geometričar iz III veka p.n.e.
7716,fotomehanički štamparski proces koji koristi staklenu ploču sa želatinskom površinom koja nosi sliku koju treba reprodukovati; može da koristi jednu ili više boja
491,vreme koje je potrebno da se brod pripremi za putovanje nazad
15436,"bogata, penasta krema koja se pravi od ulupanih belanaca i neke bogatog i gustog krema"
13779,Aromatična trava umerenih područja Evroazije i Severne Afrike koja ima gorak ukus i koristi se za pravljenje likera.
13134,zatvoreno more na severu Kanade
9986,Evroazijsko drvo koje je gaji u mnogim varijetetima zbog čvrstog okruglog jestivog ploda.
9820,kritički procieniti
376,Liturgijski pokrivač za glavu koji nose biskupi u zvaničnim prilikama.
13625,"onaj koji ima geosinhronizovanu orbitu, tako da je njegov položaj u orbiti fiksiran u odnosu na zemlju"
2516,koji se odnosi na reči
9241,ER
18830,uobičajen beo ili bezbojan mineral - kalcijum sulfat dihidrat - koji se koristi za proizvodnju cenementa
3921,Sačuvati u konzervi ili limenci.
18676,"Rod penjačica iz umerenih područja: graholika, divlji pasulj."
4517,Kičmenjak koji živi stalno ili uglavnom u vodi.
12825,ljudi iz Irske ili poreklom iz Irske
552,Malo mediteransko zimzeleno drvo sa malim crnkastim bobicama i sjajnim aromatičnim lišćem koje se koristi kao začin; u staroj Grčkoj se koristio za krunisanje pobednika.
19081,pripadnik ljudi koji se živeli u Severnoj ili Južnoj Americi pre dolaska Evropljana
4198,Grupa ljudi koja je privremeno udružena u neku aktivnost.
12981,"o rastvorima, ima isti ili jednaki osmotski pritisak"
12065,smanjen promer kanala ili prolaza.
8323,Sistem delova tela koji zajedno služe za neku određenu svrhu.
2701,Sakupljati se.
2289,reč koja označava radnju ili stanje
15681,Rod visokog azijskog drveća iz porodice Bombacaceae.
3599,neko ko piše novi zakon ili plan
8858,oblik salmonele koji izaziva tifusnu groznicu
8989,koji se odnosi na brojni sistem s osnovom 8
10586,redak glumca koji kakvoj radnji ili besedi neposredno prethodi i služi kao podsetnik za nju
17503,Spoljašnji ili vidljivi aspekt osobe ili stvari.
14961,Postati ukočen ili krut.
11903,Familija koja se sastoji samo od orda Trapa; u nekim se klasifikacijama smatra podfamilijom familije Onagraceae.
5589,"Ukrasni ali otrovni žbun koji ima usko zimzeleno lišće i grupe mirisnih belih, ružičastih ili crvenih cvetova; poreklom iz istočne Indije ali se gaji svuda u toplim krajevima."
12003,Mali rod iz zapadne Afrike; zimzeleno drvo ili žbun koji rađa mesnat plod sa tri semena koji se jede kada nije ni nedozreo ni prezreo.
8372,Institucija (javna ili privatna) koja skuplja sredstva (iz javnih ili drugih institucija) i ulaže ih u finansijsku aktivu.
13159,pretvoriti kod u uobičajen jezik
5019,"Bilo koja čvrsta supstanca, nasuprot tečnosti, koja može biti izvor ishrane."
6080,Načiniti trudnom.
18784,uređaj koji se sastoji od ručke sa slobodnim štapićem na kraju i koji se koristi u ručnom trešenju
15053,Kopnena masa koju grade kontinenti Evrope i Azije.
2144,ALGOrithmic Language; programski jezik koji se koristio za zapisivanje algoritama kao računarskih programa
12575,kratka cevčica koja se ubavuje u cevovod a koristi se da izmeri količinu tečnosti koja protiče kroz cevovod
10128,malo bobičasto voće
10517,stanje kada je čovek prognan ili ostrakiziran (isključen iz društva sveopštom odlukom)
4333,Rod široko rapsrostranjenih zeljastih biljaka.
9361,očistiti sapunom i vodom
5943,analiza periodičnih funkcija u sume prostih sinusoidnih komponenata
12433,Napraviti prekid u nečemu.
18611,truba u ušnoj duplji
7214,"U grčkoj mitologiji div sa 100 očiju, čuvar Zevsove ljubavnice"
7631,grupa ostrva u Bizmarkovom arhipelagu
4385,koji se odnosi na Arabiju i njene ljude
14797,Testo koje se koristi za pravljenje pita (između kora se nalazi fil).
19472,"Grupa ljudi, občno privremena koja ima zajednički cilj."
16153,šošonski jezik kojim govore Hopi
14817,guava
1268,Učiniti nečistim.
18311,istočni romanski jezik kojim se govori u Rumuniji
4107,Malo listopadno evroazijsko drvo koje se gaji zbog smeđih plodova.
16383,metal koji ima četiri alotropna oblika; koristi se u velikom broju legura
15786,Govorni čin kojim se nešto prigovara.
14450,Neki iz male familije guštera koji su široko rasprostranjeni u tomplim područjima; svi su bezopasni a korisni jer uništavaju npr. insekte.
16685,reka u Španiji koja se uliva u Mediteran
3979,Okretanje u suprotnom pravcu.
17571,"upoznati nešto ili postati nečega svestan, obično slučajno"
15795,porođaj u kom porodilja aktivno učestvuje i sarađuje sa lekarima.
14951,Direktni naslednici neke osobe.
2316,"Mačke, lavovi, tigrovi, pantere, psi, vukovi, šakali. medvedi, rakuni, ?; svi su članovi podreda Punnipedia."
7642,TJ
4235,Jedini poznati otrovni gušter.
17748,"u grčkoj mitologiji boginja noći, ćerka Haosa; u rimskoj mitlogiji joj odgovara Noks"
3047,alfabetska lista imena i adresa
13317,glavni i najveći grad Irana
1284,Informacija se  prenosi kroz specijalizovane međućelijske veze komunikacijskog tipa u obliku akcionog potencijala  sa jedne na drugu nervnu ćeliju ili sa nervne na mišićnu ćeliju.
17799,objekat uveden predlogom
1608,paleontologija mikrofosila
9724,Koristiti tarife za podsticanje domać privrede.
12427,Ren
4401,Tipski rod porodice Scorpaenidae: škrpine.
12790,Čin otkrivanja nečega.
16700,Krstašica iz roda Raphanus sa zadebljalim jestivim korenom.
18652,ženske ovce
17461,Proces očvršćavanja magmatskih rastopa.
17310,objekat na koji neposredno utiče radnja glagola
19138,analitična ili interpretativna književna kompozicija
1818,Ponovo steći nekoga ili nešto što je izgledalo izgubljeno.
3121,Zvuk zvona u koje je udareno.
835,"ogranak Sredozemnog mora između Grčke i Turske; glavni trgovački put starih civilazija Krita, Grčke, Persije i Rima"
15253,koji se odnosi na ili potiče od ili je karakterističan za koje drugo mesto ili deo sveta
1056,skraćeno rečničko izdanje pogodno za držanje u ruci
5179,uvijuša
1695,dehidrirano obrano mleko
11406,"Prokariotski organizmi koji se ponekad smatraju klasom, kolom ili podkraljevstvom; poklapaju se sa porodicom Čanophyceae"
8044,stavka u listi ili sekvenciji
8161,stepenište čiji se stepenici pokreću neprekidno na kružnoj traci
13087,Vreme između zalaska sunca i ponoći.
13586,Određena složena anatomska struktura.
2794,žirafe
13966,Ići gore ili napredovati.
5881,puzavci
13157,mitski grčki junak koji se borio protiv Troje u Ilijadi
6104,Grupa ljudi koji su spremni da se povinuju naređenjima.
15605,Životinja koja je uvežbana i koja se koristi za teški rad.
8433,Nauka (ili grupa srodnih nauka) koja se bavi logikom količine i oblika i poretka.
7295,brzo se i nasilno kretati
17387,rečnik džepnog formata
3964,"opirati se, pogotovo na zbunjujuć način"
4468,izraz kojim se vrši predikacija
12633,"Obrada podataka kod koje je rezultat potpuno specifikovan pravilom, posebno obrada koje je rezultat jedne instrukcije (u računarstvu)."
17138,jezik istočno-centralnog afričkog naroda Tonga (Zambija i Rodezija)
10547,"Bor srednje veličine čije bodlje imaju dve iglice, iz južne Evrope; ima široku krunu; gaji se zbog slatkog semena čiji ukus podseća na badem."
1766,aktivnost kojom se krši moralna ili pravna norma
15882,Elektroinženjer i pronalazač iz SAD (srpskog porekla iz Hratske) koji je otkrio principe naizmenične struje i razvio prvi indukcioni motor koji koristi naizmeničnu struju i više vrsta oscilatora (1856-1943).
10444,stanovnik Severne Amerike ili poreklom iz nje
13123,meso od slabine govečeta
2557,Ono što se prišiva na suknje i kapute itd. da prođe kroz rupice.
18415,Ometanje nečijeg puta.
3608,"Karakteristično stanje osećanja, uobičajeno ili relativno privremeno."
9773,Stvaralačko ili kreativno pisanje.
9028,odnos izmedju jedinica kojim se izražava dodatni karakter njihovih značenja
5806,Svi stanovnici Zemlje.
9483,kameni ili metalni obejkat koji predstavlja ostatak meteora pošto je udario u zemljinu površinu
11008,"Ćelijska protoplazma, bez jedra."
2145,jevrsjske knedle napravljene od brašna koje se koristi za matzo jevrejski hleb; obično se služi u supi
4499,Najsevernija tačka Zemljine ose.
14710,Insekti koji u zrelom dobu inaju četiri krila koja su manje ili više pokrivena sa malim krljuštima.
2218,Tipski rod porodice Bufonidae; obične krastače iz novog i starog sveta.
17599,evroazijska sadža sa crnom flekom na stomaku
8793,"naučnik sa nekog srednjovekovnog univerziteta, vičan sholasticizmu"
435,"programske instrukcije zapisane kao ASCII tekstualna datoteka: one moraju da se prevedu (kompilatorom, interpretatorom ili asemblerom) u objektni kod za konkretan tip računara pre izvršavanja"
14921,Delovati saglasno ili ujediniti u zajedničkom cilju ili verovanju.
14108,Velika prostorija za okupljanja i zabavu.
15628,"Poluotrvo na jugositoku Azije na kome u delovi Malezije, Tajlanda i Mijanmara."
15040,koristi se za tekstove koji su sažeti ili prepisani u skraćenom obliku
1565,ceo broj ili količnik dva cela broja
1013,"Insekti koji imaju kožnata prednja krila, opnasta zadnja krila i organe za žvakanje u ustima."
6842,Kamila sa dve grbe iz hladih pustinja centralne Azije.
12537,Voditi izveštaj o nečemu.
1400,duga traka natopljena mastilom koja omogućava da se pravi otisak slova na papiru pisaćom mašinom
12157,koji formira ili čini jednu celinu
19001,Organizovana struktura za uređivanje i klasifikovanje.
8403,Neka od više ptica iz starog sveta sa krestom i tankim?
14976,Oblikovati duvanjem.
14689,Neko ko pravi staklo.
15207,"iz grčke mitologije, tragični kralj Tebe koji je neynajući ubio svog oca i oženio se majkom Jokastom; tema Sofoklove drame ""Kralj Edip"""
7941,dodatak testamentu; testamentarni dokument koji ima za cilj da izmeni već izvršeni testament
9345,Neko ko podučava muzičko obrazovanje.
19044,Komad nameštaja sa otvorenim policama za izlaganje malih ukrasnih predmeta.
8092,meni koji se pojavljuje kada korisnik drži kursor na jenoj stavci glavnog menija
9919,Vreme koje je potrebno nekoj planeti (npr. Marsu) da načini kompletnu rotaciju oko svoje ose.
5464,označiti zvezdicom
18718,svilena tkanina koja se preliva u više nijansi
50,odbaciti (dokument) kao nevažeci
9888,felcana kapa (obično crvena) za čoveka ; oblikovan kao kupa sa ravnim vrhom i sa kićankom koja visi od krune
10728,mala ćelija koja sadži malo citoplazme i koja se stvara zajedno sa jajnom ćelijom a kasnije odbacuje
14056,"u logici,"
14941,"Po spoljašnjosti liči na ovna; koreni rogoca su mu široki i pokrivau skoro celo čelo; ima gusto, dugačko i rutavo runo."
5527,sigurnosna oprema u automobilu; vreća se naduvava u slučaju sudara i time sprečava vozača ili putnika da se naglo pomere unapred
1347,naučno proučavanje nervnog sistema
1523,bilo koji neprekidni odsečak vremena koji uključuje i trenutak govora
15720,Odsustvo veze nečega prema nectem drugom.
19358,bilo koji uređaj koji služi kao izvor osvjetljenja
483,"region na severozapadu Afrike koga ;ine planine Atlas i obala Maroka, Tunisa i Alžira"
10178,grejač i spremnik za snabdevanje toplom vodom
2639,Neka od brojnih biljaka iz roda Euphorbia; obično proizvode mlečni cesto i otrovni sok.
9742,problemski orijentisan jezik koji se koristi za opisivanje zahteva koje posao postavlja operativnom sistemu
18402,mineral koji se sastoji od stroncijum karbonata
17266,Preneti ili izraziti u pisanom obliku.
1859,meso američkog iverka sa žutim repom
16681,Neka geografska zona podeljena neodređeno prema klimi i širini.
7670,na ili blizu Severnog pola
11382,Neko ko predaje likovno obrazovanje.
10739,providni ljubičasti varijetet kvarca;poludragi kamen
5510,biljka koja se gaji zbog krupnih stabljika sa malim zelenim glavicama koje podsećaju na kupuščiće.
1263,jedinica govornog jezika veća od foneme
2045,"Biti negde, obično neuporebljen."
11242,šastanski jezik kojim govori narod Šasta
17059,morski medvedi
2373,"uzajamni transfer ekvivalentnih suma novca, posebno valuta različitih zemalja"
4630,Dete koje je izgubilo oba roditelja.
7831,Kretnja rukama ili telom koja izražava ili pomaže da se izrazi misao.
4207,Ukupnost prošlih događaja.
12774,"biti prevodljiv, ili biti prevodljiv na određeni način"
17460,Učiniti nešto većim ili da nečega bude više.
14337,koji se odnosi na geografiju kao nauku.
16039,Putnički autobus sa električnim motorom koji dobija napajanje iz žica postavljenih iznad vozila.
13485,mirovni sporazum kojim je okončan Tridesetogodišnji rat 1648
15805,neka od malih elegantnih jastrebova iz porodice Accipitridae sa dugim šiljastim krilima koji se hrani insektima i manjim pticamaed wings and feeding on insects and small animals
3718,emisija na radiju ili televiziji
1006,"Azijska biljka slična spanaću, gaji se kao povrće."
18007,Godišnja zeljasta biljka čiji cvet ima samo jednu laticu.
3100,Telo učenika koje zajedno podučavaju.
19005,"Oblikovati, formirati ili unaprediti nešto."
12916,dodatak koji produžuje glavnu zgradu
13038,Voditi ljubav.
2621,Čiji je životni ciklus ne traje duže od jedne godine.
5860,"provocirati odgovore, kao prigovore, kritiku, aplauz itd."
18173,"u računarstvu, RAM koji se ostavlja kao specijalizovani bafer čiji se sadržaj stalno menja; koristi se da optimizuje transfer podataka između elemenata sistema sa različitim karakteristikama"
17696,glavni grad Bahama
18117,iznenada se sručiti; upadljivo opadati
3553,"novi obraćenik, posebno u jevrejsku veru"
12372,rod iz familije Mustelidae:nerc i lasice.
114,Okružuje točkove automobila.
10388,električni uređaj koji se koristi da uvede vremensku konstantu u kolo
5280,šumeće piće (obično alkoholno)
1245,Pokretna stolica postavljena na velike točkove; koriste je invalidi i oni koji ne mogu da hodaju; često je pokreću sami korisnici.
2699,"u računarstvu, računar koji je povezan na računarsku mrežu"
1008,"okluzivni konstant artikulisan oslobađanjem pritiska na glotisu, kao pri iznenadnom početku vokala"
14618,Tajni agent koga unajmljuje država da bi prikupio (vojne) informacije o njenim neprijateljima ili kompanija da bi prikupio industrijske tajne od konkurenata.
6277,otpadna cev koja odvodi kanalizacijske ili površinske vode
3420,Usprana evropska borovnica koja ima usamljene cvetove i plavo-crne bobice.
2766,krst čiji su kraci u obliku trougla ili strelica koje pokazuju ka centru
2193,prozor koji ima dva krila koja klize gore i dole
9123,Rod ekonomski važne tropske biljke: tapioka.
972,jezička porodica koja sadrži većinu jezika kojima se govori južno od Sahare; to su mahom tonalni jezici mada ima nekoliko značajnih izuzetaka (n. pr. svahili ili fula)
17499,Stara rasa snažnog psa glatke dlake koji se obično koristi kao čuvar.
15933,Serijski štampač zakačen za telegraf koji funkcioniše kao pisača mašina.
4328,Jednogodišnja biljka sa belim cvetom i jajastim listovima.
5345,o botulinusu ili koji se odnosi na botulinus ili koga proizvodi botulinus
11814,Neka od raznovrsnih biljaka iz roda Salvia; rasprostranjena trava.
10147,draguljima optočen ukras za glavu koji označava vlast
2352,"U ekologiji, grupa međusobno zavisnih organizama koji nastanjuju istu oblast i utiču jedan na drugog."
11444,indoevropski jezik kojim se govori uglavnom u Jermeniji
17045,koji se odnosi na ili je karakterističan za Arape
7481,Čin donošenja zakona.
18140,raditi ili funkcionisati
341,"Čvrsto istkana tkanina, koristi se za stolice, jedra, šatore)."
1801,"file ribe, najčešće iverka"
8305,"otrovna bela materija (Pb[CH3CO]2) koja se koristi za izbeljivanje pamuka, za pravljenje emajla i lakova"
9883,"Tapir koji živi po barovitim, močvarnim i vodom bogatim šumama Sumatre i Indokine."
5133,Shvatati neki jezik.
7809,Neka od mnogih godišnjih puzačica sa hvataljkama iz roda Cucurbita koje se gaje zbog mesnatih jestivih plodova.
14740,"fleksija imenica, prideva i zamenica u indoevropskim jezicima"
2121,savremeni grčki varijetet
16006,pododeljak pisanog dela; obično numerisan i naslovljen
8867,Raste u krajevima uz more; u proleće cveta žuto.
10852,"interfejs koji se sastoji od standardne priključnice između računara i njegovih perifernih uređaja, a koji se koristi na nekim računarima"
15489,koji se odnosi na gerund ili koji je poput gerunda (glagolske imenice)
18253,Prestonica Narodne Republike Kine; drugi po veličini grad u Kini.
15625,"ukuvano crno vino sa crnim lukom, peršunom, majčinom dušicom i puterom"
1525,Supstanca koja može da gori da bi obezbedila toplotu ili snagu.
19088,potpuna izborna pobeda
14128,Neka informacija o okolnostima koje postoje ili događajima koji su se desili.
1273,grana medicine koja se bavi lečenjem beba i dece
13329,Pružanje privremene pomoći.
8792,Rezultat utakmice ili takmičenja.
4976,Meso divljih životinja koje se koristi za ishranu.
11799,student starogrčkog i latinskog jezika
10345,Bisagaš travnatih ravnica centralne Severne Amerike.
8357,delimično skuvana glavica kupusa izvađena i punjena smesom od npr. seckane govedine ili šunke i zapečena; servira se sa sosom od sira ili paradajza
16747,u grčkoj mitologiji kralj koji je napravio statuu žene i zaljubio se u nju; Afrodita ju je oživela kao Galateju
2058,snabdeti indeksom
12540,pozicioni brojni sistem koji koristi 10 cifara i osnovu 10
13097,"pripadnik semitske grupe naroda poreklom sa Arapskog poluostrvai okolnih teritorija, govore arapski, ali su se proširili i na Bliski istok i sever Afrike"
11710,Bogatstvo koje je nasleđeno a ne zarađeno.
4748,stanovnik Islanda ili poreklom sa Islanda
15209,koštani izraštaj razvijen blizu gornjeg kraja femura za koji su zakačeni mišići
410,"morfema koja se ne može upotrebiti samostalno, već se javlja samo kao deo reči"
68,stanje bez oštećenja ili propadanja
44,osobina ljudi da veruju u poštenje i pouzdanost drugih
7107,Prestonica Moldavije.
97,Lepota koja je privlačna čulima.
8115,plod nekoliko tropskih američkih billjaka roda Annona sa sočnom jestivom pulpom
1255,Ptica otvorenih mora.
8528,razbiti se na komade
13311,gusti koncentrovani sok od paradajza
16484,Stanje stalnog živahnog delovanja koje karakteriše neku aktivnost
12674,Dati neke osobine nečemu.
17004,"povrediti ili ubiti gaženjem, na primer, automobilom"
18305,rod porodice Strigidae.
8302,oborina koju čine komadići leda
12453,hrana za doručak pripremljena od žita
6161,"Obraćanje religiozne prirode, obično za vreme verske službe."
6340,Težak srebrnobeli metal; u čistom obliku se koristi uglavnom za električne primene; nalazi se u više ruda uključujući volframit.
7603,odnos srodstva između oca i njegovog potomstva
16382,"meso ili riba pržena sa povrćem (npr., celer, luk, paprike ili boranija) začinjeno sa đumbirom, belim lukom i soja sosom; servira se sa pirinčem; napravljeno u Sjedinjenim državama i često se servira u kineskim restoranima tamo"
17875,Mineral koji se sastoji od sulfida bakra i gvožđa u naslagama bakra; šarena ruda metalnog sjaja.
6121,Osoba koju poznajete.
18187,"glavni deo drame, baleta ili opere"
4988,Organski proces koji se odigrava u telu.
11165,Neko ko je obučen u šumarstvu.
7838,koji se odnosi na asocijaciju (pridruživanje)
16209,lista reči ili fraze koje objašnjavaju simbole ili skraćenice
9943,osnovna novčana jedinica Ruande
10772,"Čempres, smreke i kedar."
18753,poznati univerzitet u Konektikatu
1759,poluostrvo na jugozapadu Evrope
3375,Sud kroz koji cirkuliše krv.
13582,Veza između suprotnih entiteta.
10988,"uređaj napravljen da provodi struju, toplotu, i sl."
2086,"Govorni čin raspravljanja, pregovaranja."
2839,Grafički ili živ verbalni opis.
18973,"Pojmiti mentalno, kao ideju."
4222,Fosilno gorivo u gasovtom stanju; koristi se ya kuvanje i grejanje domaćinstava.
15425,padež kojim se označava obraćanje
12052,Veliki gušter biljojed koji živi na drveću; ima bodljikavu krestu duž leđa; koristi se kao hrana u Srednjoj i Južnoj Americi.
23,"kruto voće koje podseća na bananu; jede se uvek kuvano, kao sortirano povrće u tropskim predelima"
827,"Jedina komponenta ličnosti koja je prisutna od rođenja. Ovaj aspekt ličnosti lišen je svake logike, potpuno je nesvestan i obuhvata instinktivno i primitivno ponašanje. Id je apsolutno iracionalan i funkcioniše u skladu sa principima zadovoljstva i bola, zahtevajući trenutno, neposredno zadovoljenje, kad god to okolnosti dozvoljavaju. Ako se ove potrebe ne zadovolje odmah, rezultat je stanje anksioznosti ili napetosti."
3916,Pokretno parče tkiva koje je delimično povezano s telom.
14469,pileća krilca spremana sa roštiljskim sosem
12211,Dan posvećen verskom svetkovanju.
8416,Transportovati ili poslati iz jednog mesta u drugo.
17798,havajsko jelo od korena biljke taro pretvorenog u pastu i često puštenog da fermentira
16751,istraživanje sastavnih delova neke celine i kakva je njihova međusobna veza
18461,Naučnik koji se bavi fizikom.
18254,boginja podzemnog sveta; u grčkoj mitologiji joj odgovara Persefona
15900,Utvrditi konačno ili merodavno.
13933,Bilo koje svojstvo koje se može detektovati člom mirisa.
9962,Manja kratkotrajna bitka.
5694,"Vrsta evropske trave, kiseljaka."
19383,najamni radnik koji radi poljske radove
5550,"alat koji se sastoji od nekoliko kukica za hvatanje i držanje, često bačenih konopcem"
2414,Tipski rod porodice Muridae: domaći miš; gornji sekutići imaju kvadratni vrh.
10946,koji se tiče Malezije ili je karakteristično za Maleziju
17199,količina dobijena sabiranjem
9959,ceremonija koja se održava u sinagogi (obično za vreme Pedesetnice) kojom se priznaju za odrasle članove Jevrejske zajednice mladići i devojke koji su uspešno završili kurs Judaizma
12543,Široko gajena ribizla koja rađa crne aromatične bobice.
5536,stanovnik Atine
17709,Voćka iz umerenih područja koja rađa plod od tamnožute do ružičaste boje.
8743,Mišićno tkivo se sastoji od ćelija (mišićnih vlakana) koje imaju sposobnost kontrakcije. Ta se sposobnost zasniva na prisustvu kontraktilnih vlakana (miofibrila) koja su izgrađena od proteina aktina imiozina. Mišić se kontrahuje kao odgovor na nadražaj koji je do njega dospeo određenim nervom. U svaku mišićnu ćeliju ulazi jedno nervno vlakno i mesto njihovog povezivanja naziva se motorna ploča (periferna sinapsa).
13367,odnos naspramne i nalegle stranice u pravouglom trouglu
2800,"rafinisani beli šećer oblikovan u kocke, pogodan za služenje"
1984,Mogućnost i želja da se kupuju dobra i usluge.
13416,insekt košenil
2293,Neki od raznovrsnih primata sa kratkim repom ili bez repa.
19,naučno istraživanje pećina
14691,Kondori; ?turkey buzzards; ?king vultures.
18796,redak tvrd žutozeleni mineral koji se sastoji od berilijum aluminata u kristalnom obliku; koristi se kao dragulj
15346,Dekorativno ili umetničko delo.
2536,Pomalo zakrivljen komad gipkog drveta sa zategnutom strunom od konjske dlake; koristi se za sviranje na nekim instrumentima.
9335,"oksidni mineral gvižđa, hemijska formula α-Fe2О3, najstabilniji je i najrasprostranjeniji od svih oksida gvožđa"
16093,uznemiriti i izazvati gađenje
11516,"Golubovi, gugutke, ???; izumrli dodo."
13438,o litijumu ili koji sadrži litijum
12111,"koji se odnosi ili je karakterističan za Italiju, njene ljude, kulturu i jezik"
3808,sistem simboličke logike koji je uveo Džordž Bul; koristi se u izradi računara i u računarstvu
2661,bolni stalni grč mišića za žvakanje; rani simptom tetanusa.
19373,zemljouz koji povezuje Centralnu i Južnu Ameriku
5507,slatko mesnato tropsko voće sa debelom ljuskavom korom i sjajnim crnim semenkama
10527,Novac u obliku banknota ili kovanica.
2842,utvrđenje dugačko 1500 milja izgrađeno preko severnog dela Kine u III veku pre nove ere
279,ukloniti iz tela
3174,grana tai jezika
2379,Sveži listovi biljke komorač se koriste kao začin.
16746,"Ofanziva protiv neprijatelja, korišćenjem oružja."
2740,Glasačko mesto gde glasači idu da daju svoj glas na izborima.
17970,Sport koji obavezno uključuje kontakt između suprotstavljenih igrača.
14588,grupa ostrva u južnim Karibimal južni deo Malih Antila
692,Svešteno lice u hršćanskim crkvama koje ima odobrenje da obavlja različite raligijske obrede.
15337,Neka od raznovrsnih trava iz roda Marrubium.
12568,Americzko stono grožđe sa crvenkastom glatkom kožom
4755,mandarina sa crvenom bojom pomorandže i malo semenki
19082,kraljica olipjskih bogova u grčkoj mitologiji; Zevsova sestra i žena; ljubomorna na mnoge smrtnice u koje se Zevs zaljubio; u rimskoj mitologiji joj odgovara boginja Junona
2372,Okeanski bucanj.
4115,Učinak jedne stvari (ili osobe) na drugu.
10910,mera za površinu koja iznosi 100 metara kvadratnih - površina kvadrata čija je stranica dužine 10 metara
8224,a grain of barley
8378,uređaj koji može da se koristi za unos podataka u računar ili drugi uređaj
15792,oprema u motornom vozilu koji hladi motor
