,Sysnet
12833,"Tvrda kineska penjačica koja se gaji kao ukrasna biljka zbog sjajnog lišća koje miriše na cimet, a u tropskim krajevima i zbog jestivog korena."
4051,predstavljanje apstraktne osobine ili ideje kao osobe ili bića
669,preinačiti nešto koristeći manje tehničku terminologiju
603,deo uva koji se vidi spolja
127,Osoba čiji kreativan rad pokazuje senzitivnost i maštu.
7765,luka u kojoj su smešteni carinici da bi nadgledali ulaz i izlaz putnika i robe
6270,(pravo) bilo koja svojina koja se po pravu ili običajima smatra neodvojivom od nasledstva i nasleđuje se sa tim nasledstvom
811,Pirinač.
12327,Drugo ime koje se u nekim klasifikacijama koristi za porodicu Mimosaceae.
6492,moć ili pravo da se kakav nameravani ili predlagani čin zabrani ili odbije (posebno moć izvršnog poglavara da odbije zakon koji donese zakonodavna grana)
1504,osnovna novčana jedinica Džibutija
2586,koji se tiče ostrva Tongo i njegovih ljudi
5090,porodica mekušaca.
11077,koji se odnosi na padež kojim se izražava obraćanje
15440,grupa afričkih jezika iz niger-kongoanske porodice kojima se govori od istoka Obale Slonovače do Nigerije
16054,minimalna gramatička jedinica koja se može upotrebiti kao reč
7522,Sadržaj neposrednog posmatranja ili učešća u događaju.
17071,mali digitalni račnar zasnovan na mikroporcesorima konstrisan tako da može da ga nosi samo jedna osoba
14472,Deo nameštaja koji je namenjen sedenju.
9670,organsko jedinjenje koje sadrži samo ugljenik i vodonik
10766,Koristi se u nekim klasifikacionim sistemima; Passeriformes koje imaju relativno jedostavan vokalni organ i ne mogu dobro da pevaju: vikačice.
10532,"Neki od mnogih žbunova iz rodova Čtisus, Genista ili Spartium koji ima duge tanke grane i grozdove žutog cveća."
1485,"čestica za koju važi Boze-Ajnštajnova statistika, ali za koje na važi Paulijeva princip isključenja"
14049,"Klasa zglavkara koja uključuje jastoge, krabe, škampe, itd."
128,na čijem se licu očitava zadovoljstvo
18368,Sposobnost da se zadovolje obligacije kako dospevaju.
7614,neko ko piše romane
16423,bantu jezik kojim se govori u zapadnoj Keniji
4411,Velikii rod sočnih tropskih biljaka koje se široko gaje
8212,koji se odnosi na kamen ili je od njega sastavljen
12586,"Široko rasprostranjena društvena ptica prodornog glasa, gnezdi se u visokom drveću u gradskim parkovima."
9740,knjiga koja se smatra merodavnom u tom polju
8560,podeljen ili organizovan u govorne segmente ili govorne zvuke koji se mogu izolovati 
8394,ulješure
13037,Govorni čin kojim se nešto traži.
12714,Ono što je upotrebljeno.
7845,nešto što pokriva celu stranicu
5556,Zeljasta biljka sa opuštenim lišćem i malim ružičastim ili belim cvetovima od koje se dobija resko ulje koje se koristi kao dodatak jelima.
6678,Neka biljka iz porodice Araceae; ima male cvetiće
1763,"najviši planinski vrh zapadne hemisferem nalazi se u Andima u zapadnoj Argentini, visina 6960m"
7485,natapati; pustiti kroz cediljku
11450,Karakteristično oglašavanje životinje.
3147,opšte mesto; tipiziran motiv u književnom delu
5753,"Koji nije tanak; određene debljine ili relativno velikog prostiranja od jedne do suprotne površine, obično po najmanjoj od tri dimenzije."
3795,Republika u jugoistočnoj Evropi na jadranskoj obali Balkanskog poluostrva.
10048,Ribe sa spljoštenim telom: raže.
7272,Blok koji se sastoji od debelog sloja nečega.
2742,Carski rez je operativni porođajni zahvat kod koga se porodilji otvara abdomen i materica a zatim se kroz taj rez vadi beba.
12657,galaksija koja sadrži Sunčev sistem (sastoji se od miliona zvezda koje se mogu posmatrati kao difuzna traka svetlosti koja se proteže preko noćnog neba)
19238,u klasičnoj mitologiji bog muške plodnosti i zaštitnik bašti i vinograda
16163,čin transformacije da bi se uzdiglo ili slavilo
10302,vodom natopljeno tlo; mekana vlažna zemlja
5329,pronalazač iz SAD-a koji je izumeo sistem za zapis alfanumeričkih podataka na bušene karitce (1869-1929)
16399,Čin primene sile da bi se nešto pomerilo.
13694,bilo koji algonkinski jezik kojim govori narod Blekfut
18108,algonkinski jezik kojim govore Mohikanci
9937,notacija koja koristi 16 različitih simbola
10316,podgrupa altajskih jezika
14004,Evropska ptica pevačica poznata po melodičnom noćnom pevanju.
1027,Godišnja baštenska biljka sa crvenim ili žutim cvetovima ukupljenim u svasti koje nalikuju perima.
5376,postupati prema nekome drugačije zbog njegovog pola ili rase
170,moralno iskvariti
1116,(Rimokatolička crkva) osoba koja se pokajala zbog svojih greha (rimokatolik čini pokoru prema uputstvima ispovednika)
2584,Vidljivi simbol koji predstavlja neku apstraktnu ideju.
12022,Uglavnom višegodišnje biljke i žbunje severne hemisfere: prstac.
2524,Veoma velika kornjača sa ostrva Galapagos i Sejšelskih ostrva.
13872,Tipski rod porodice Alaudidae: ševe.
17466,levkasti oblik rečnog toka kada se približi ušću u more u kome se mešaju morska i slatka voda
6572,Neka od više žbunova iz starog sveta sa bodljikavim lišćem; ima mlečni sok i žuto cveće; široko rasprostranjena; korov na kultivisanom zemljištu.
11036,pri hodu klati repom kao pliska
2952,dve bitke koje su se odigrale u toku Američkog građanskog rata (1861. i 1862) u kojima su snage Konferederacije pobedile savezničke snage
7257,Pisani simbol koji se koristi za predstavljanje govora.
11254,"Živa stvar koja ima, ili koja može da razvije, sposobnost da nastupa ili funkcioniše nezavisno."
13348,Zaseban 3-dimenzionalni obajekat koji ima masu i razlikuje se od drugih objekata.
13605,"Poseban crtež ili vidljivi predmet koji predstavlja osobinu, tip, grupu itd."
11950,Vrlo velika morska jestiva riba iz roda Thunnus; uglavnom živi u toplim moria.
9510,fino istkano laneno platno
18960,Muzički instrument u kome su zategnute žice izvor zvuka.
19200,tiganj od tučenog gvožđa
1686,Tipski rod porodice Crassulaceae; zeljaste biljke i nisko žbunje sa drvenastom stabljikom i sočnim antenskim delovima.
13747,Keks sa đumbirom u obliku čovečuljka.
15845,zujare
12244,Biserka
13728,hibrid dobijen ukrštanjem Prunus domestica i Prunus armeniaca
2225,matematička tehnika koja se koristi u ekonomiji; pronalazi maksimum i minimum linearne funkcije mnogo promenljivih koje su pod ograničenjima
11363,Tustica: veliki rod biljki mesožderke skoro bez stabljike.
13513,"Cevasta struktura na kraju abdomena za nošenje I odlaganje jaja u podlogu, kod mnogih ženskih insekata i nekih riba. Kod osa i pčela legalica je izmenjena u žaoku  koja služi za napad i odbranu (izgubila je svojstvo polaganja jaja)."
8436,Tvrdo jako i trajno žutosmeđe drvo tika; otporno na insekte i krivljenje; koristi se za izradu nameštaja i u brodogradnji.
19397,gomilast oblak
12705,Evroazijska višegodišnja biljka sa belim cvetovima koji ispuštaju zapaljia isparenja po toplom vremenu.
351,filozofska teorija znanja
5116,Proizvoditi zvukove lomljenja.
9633,Koji se odnosi ili koji je komponovan za orkestar.
8076,gramatička kategorija glagola kojom se izražavaju distinkcije u vremenu
17239,Neka lukovičasta biljka iz familije Iridaceae.
13454,Živa osoba.
15694,Malo radno mesto na kome se izrađuju rukotvorine i manufaktura.
13312,Brzinsko takmičenje između konja.
3339,"uglavnom morske aneldie, imaju oba pola..."
17081,Divlja ili pripitomljena ptica sa teškim telom i kratkim nogama.
12124,koji koristi ili sadrži previše reči
3836,pozorišni izvođač
2444,Neotrovni člankonožac sa valjkastim telom i 20 do 100 ili više članaka od kojih skoro svaki ima po par nogu.
5509,"odvojiva brava koja ima šarnir sa šarkama koji se može provući kroz alke u lancu, posle čega se zatvara"
18399,Crvići ili krpelji.
9294,Snabdeti nečim ili dobaviti nešto.
13188,Uglavnom male višegodišnje paprati - papratka; u nekim klasifikacijama smeštaju se u Polypodiaceae.
15503,pivo točeno iz bureta
4610,osnovna novčana jedinica u Hongkongu
15615,koji se nalazi ili se dešava između rebara
4021,patuljasti moškavci
15906,o eozinofilu ili koji se odnosi na eozinofil
16786,"društveni sistem koji se razvio u Еvropi u VIII veku, prema kome je gospodar štitio vazale koji su zauzvrat morali da služe u ratu"
6100,Ruske palacinke koje se prave od heljdinog brašna i kvasca; obično se služe sa kavijarom i kiselom pavlakom.
2409,"(računarstvo) programska aplikacija koja se može sastojati od nekoliko koraka, ali predstavlja jedinstvenu logičku celinu"
1647,pravilo sintakse koje omogućava stvaranje gramatičnih iskaza
889,čin kačenja nečega jedno za drugo
8842,Čin užurbanog kretanja na nepažljiv način.
10933,glavni i najveći grad Kolumbije
5062,Udaljenost koju pokrije jedan koračaj.
12280,"lanac od 55 ostrva u zapadnom delu Tihof okeana, kod Japana (SAD ih vratio Japanu 1972)"
11401,biti ispred (drugih) u vremenu ili prostoru
4084,u nekim evropskim zemljama: jedinica težine ekvivalentna 50 kilograma
19335,Veza koja uključuje vreme.
17072,"pikantno kreolsko jelo od pirinča, šunke, piletine ili školjki sa krompirom, paprikom, lukom i celerom"
5604,Široko rasprostranjena porodica trava i žbunja iz reda Genitanales; svilenica.
15526,injekcija koja se ubrizgava u venu
13950,osnovna novčana jedinica Zapadne Samoe
7595,gramatički odnos koji stvara prelazan glagol
8896,ići indirektnom rutom ili bez podešenog tempa
10216,govorni čin odgovaranja na pitanje
6727,Stanje u kome nešto nje povezano.
9692,skup instrukcija koje su tako kodirane da računar može direktno da ih koristi bez prevođenja
17822,Ispoljiti želju
4475,Čin vođenja.
16371,obožavalac Francuske i svga francuskog
13143,užina u toku pauze na poslu
13865,"Sanduk sa ručkom za nošenje papira, knjiga ili dokumenata."
3759,u grčkoj mitologiji bog beskonačnih i dubokih voda
12019,Vrsta jelena bez rogova centralne Azije; mužjak luči vrednu mirišljavu supstancu u kesi na donjem delu trbuha.
13563,Neka od raznovrsnih penjačica iz roda Piper.
6738,nesamopouzdanost u vezi sa sopstvenim promovisanjem
423,Imovina koju nečiji poverilac može da tržži u slučaju da ne ispunite obavezu.
5749,"glavni grad Svazilenda, na severozapadu zemlje"
11120,Prirodni fenomen koji uključuje fiziku tvari i energije.
19184,glavni i najveći grad Zambije
3045,"široko rasprostranjeni mineral, sastoji se od kristala kalcijum karbonata"
17494,"u rimskoj mitologiji boginja zemlje, zaštitnica braka i plodnosti; poistovećuje se sa grčkom boginjom Gejom"
10973,pronaći nečiju lokaciju
15992,"Visoka višegodišnja evropsa šikara, gaji se zbog lišća i tankog klasja plavih cvetova; ponekad se koristi u medicini."
11720,Neki pas obično duge dlake koji je oučen za čuvanje pasa.
16223,U nekim klasifikacijama ne uključuje Leguminosae.
14849,svinjski obor
2368,Keks koji sadrži deliće čokolade.
18522,Male ptice koje žive blizu zemlje; na nnogama imaju četiri prsta koja su tako nameštena da dozvoljavaju hvatanje za prečku; mladi su bespomoćni.
14051,"Aktivnost obezbeđivanja dobara i usluga koja uključuje dinansijski, komercijalni i industrijski aspekt."
11900,liska kratkog kljuna iz starog sveta
14261,priča o vilama; priča se da zabavi decu
305,muskogijski jezik kojim govori narod Seminola
9721,ime osobe po kojoj je nešto navodno nazvano
11879,muškarac - stanovnik Engleske ili poreklom iz Engleske
14281,iznenadna promena vlasti obično uz upotrebu sile
15204,zbirka srodnih stvari namenjenih da se koriste zajedno
2688,"Sestra nečijeg oca ili majke; žena nečijeg ujaka, strica ili teče."
17219,krilato čudovište sa glavom orla i telom lava
12071,"plod iz loze muskatnih dinja, vrsta slatke dinje u srodstvu sa krastavcima"
10180,džigerica životinja koja se koristi u ishrani
11001,"amid ugljene kiseline,azotni proizvod razlaganja belančevina u organizmu (CO(NH2)2)"
13911,pododeljak čina u komadu
13749,sistematsko istraživanje pitanja od javnog interesa
10371,Osoba koja je šef džžave (u nekoliko zemalja).
17214,kolo između dve ili više lokacija s ciljem transmisije i prijema podataka
15217,Dugi uski čamac sa ravnim dnom a pokreće se veslanjem; tradicionalno se koristi po kanalima Venecije.
17421,"nastalo od MOdulate i DEModulate, elektronska oprema koja se sastoji od uređaja za povezivanje računara na telefonsku liniju"
1286,osnovna novčana jedinica Češke
4768,pustiti ili uzrokovati da šta kaplje
12459,najrasprostranjeniji bantu jezik; zvanični jezik Kenije i Tanzanije; funkcioniše kao lingva franka u istočnoj i centralnoj Africi
6640,uzimanje iz ruku vlasnika (posebno uzimanje imovine od strane javnih vlasti)
15470,"Lišiti se, okaniti se čega, odbaciti."
4781,neko ko ima master sa kakve akademske institucije
3589,Veliki rod drveća i žbunja sa jagodastim plodom.
12148,Objekat koji se sastoji od konkretnih postrojenja i opreme za rastur informacija.
17831,rod bakterija
14981,Neka od mnogih biljaka iz roda Begonia koje se gaje zbog atraktivnog sjajnog asimetričnog lišća ili raznobojnog cveća.
5211,monarhija na čijem je čelu gralj ili kraljica
8312,MW
12970,tanak komad mesa obmotan oko punjenja i kuvan
7222,O celini koja se radvaja u delove.
5980,Učiniti ponovo.
6972,lagano kremasto jelo napravljeno od ribe ili mesa i učvršćeno želatinom
15559,Ženka rađa žive mlade od 2-3cm koji odmah živahno plivaju.
3641,podeliti u komponente ili sastojke
15358,ostvarenje cilja
18800,učenje po kome se sve pojave u prirodi i društvu svode na mehaničko kretanje materije
9760,u grčkoj mitlogiji titanka koja je bila boginja pravde
2717,nedostatak pažnje (prema deci ili bespomoćnim ljudima)
7024,bakterije koje formiraju kolonije u sluzi (mulju) koji sama proizvodi; nastanjuje vlažna zemljišta ili biljne materije koje se razlažu ili ostatke životinja
13965,voda koja se služi sa ledom
799,Drvo isečeno i pripremljeno za korišćenje kao građevinski materijal.
16380,"Ono što su agame za Stari svet to su legvani za Novi svet (Madagaskar, pacifička ostrva); ima više od 50 rodova i preko 300 vrsta; imaju dugačak rep (dve trećine celokupne dužine).lizards of the New World and Madagascar and some Pacific islands; typically having a long tail and bright throat patch in males"
16647,gazirano piće sa ukusom korena sarsaparile ili sa uljem breze ili lovora
7714,kuhinjski pribor koji se koristi za kuvanje na pari
18691,obična siva divlja evropska guska; predak mnogih domaćih sorti
265,porodica altajskih jezika kojima se govori u Mongoliji
13692,Mehaizam za prenos kretanja pomoću zupčanika za specijalne namene (kao upravljački mehanizam vozila).
13338,Radnja u kojoj se muškarci šišaju.
4551,Učiniti da se nešto odvoji ili rastavi
15423,dijalekat srednjeengleskog koji je zamenio zapadnosaksonski kao književni jezik i koji se razvio u moderni engleski
8750,imitatorsko ponašanje
4487,"Obraćanje koje označava status ili funkciju, npr. Gospođa ili General."
426,Parnoprstaš bez rogova; u obe vilice ima po dva sekutića i dva očnjaka; na stopalu imaju žuljevite obloge.
11656,Merni instrument za težinu; pokazuje veličinu mase.
5341,deo stene koja se pojavljuje iznad površine okolnog zemljišta
13537,velika bakterija koja živi u kolonijama i koja se uglavnom nalazi na otvorenom moru; značajne za fiksaciju ugljenika i azota
3187,Nedostatak darežljivosti; nesklonost da se da novac.
6671,Četvrtasti šal koji se presavije u trougao i nosi na glavi ili oko vrata.
17870,Kretati se na nekontrolisan način.
10568,"(klasična mitologija) mitsko biće koje je pola čoveka, a pola konja"
9410,meso mladog bakalara ili poloka ili neke druge ribe belog mesa podeljeno i očišćeno; obično se bari
18944,Vlasnik ili upravnik pivare.
10985,luka na atlantskoj obali
10708,Muzički instrument sa žicama; na korpusu kruškastog oblika; ima manje žica od laute (4-6 pari).
11559,francuski socijalista koji je zastupao ideju da je vlasništvo krađa (1809-1865)
18470,Dnevni događaj zalaska sunca za horizont.
4928,Morski puž iz podreda Nudibranchia bez kućice i često sa telom lepe boje.
5495,Koji se odnosi na ljudsko biće.
1296,losovi
1236,Čin prodiranja ili otvaranja nečega pomoću oštrice.
18488,jestivo belo meso kokosa; često se koristi izmrvljen za kolače i peciva
16116,zamišljena linija koja spaja tačke u kojima se nešto dogodilo u isto vreme
1653,usoljena masnoća s leđa i obe strane trbuha svinje
8642,pismeni ispit
18849,Neka od evroazijskih biljaka iz roda Helleborus.
10255,tvar koja trpi brzu hemijsku promenu (uz proizvodnju gasa) kada se zagreje ili udari
12258,Rakuni; ?coatis; ?cacomistles; ?kinkajous; i ponekad pande.
2205,arhipelag od oko 100 sotrva u Severnom Atlantiku kod severne obale Škotske
14639,Žuti evropski vučak koji se gaji za ispašu.
13673,privremeni most za ulazak na i izlazak sa plovila na doku
11578,svetlo žuto grožđe bez semena koje se koristi za grožđice i vino
12288,Zebe iz starog sveta: kanarinci i?
14636,Republika u južnoj Evropi na Apeninskom poluostrvu; bila je jezgro Rimske republike i Rimskog carstva između 4. veka pre nove ere i nove ere.
4053,Vrsta glodara koja živi na drvetu i ima dugačak čupavi rep.
12382,ručni alat sa teškom krutom glavom i ručkom koji se koristi da sprovede silu udaranjem
13113,"kitovi zubani: delfini, narvali; pliskavice, glavata uljarka."
14411,Vodena ptica koja živi u slatkim vodama.
19417,argus fazan
18949,koji se sastoji od dva imena ili termina
10821,meso sa slabine jagnjeta
5705,Niska drvenasta višegodišnja biljka koja obično ima nekoliko glavnih grana.
5521,otrovni pauk Novog sveta; ženka je crna sa glavom u obliku peščanog sata i crvenim belegom na donjoj strani trbuha
4859,mešana salata sa prelivom
9000,molekulska tezina izražena u gramima
4555,božur; zeljasta biljka ili žbun sa upadljivim cvetovima.
18405,o svetim islamskim tekstovima ili koji je povezan sa njima
3935,Oštar alat sa teškom oštrom glavom koja je postavljena na ručku.
8881,"Postajati prazan, ispražnjen."
7611,formalni čin oslobađanja nekoga
13688,Učiniti ili izazvati da nešto postane.
7842,"Rod gomoljastih povijuša iz porodice Dioscoreaceae; ima stabljike koje se uvijaju, srcoliko lišće i grozdaste cvati."
6093,radiografija koja koristi X-zrake da proizvede rentgenogram
5269,koji je od stenskog materijala utisnutog u tečnom stanju u pukotine između slojeva druge stene
1434,tabinje
19093,biti sveden na pepeo
2974,povezani su sa parazitima malarije i imaju fazu u razvoju koja se odvija u visceralnim (unutrašnjim) organima ptica
18933,"Divlja mačka sa kratkim repom, obično sa šiljatim ušima; ceni se zbog krzna."
1612,Porodica drveća i žbunja iz razreda Parietales.
5575,jato gusaka
3687,koktel od džina i slatkog vermuta
10734,dravidski jezik kojim govore Gondi u južnom delu centralne Indije
2269,čadski jezik kojim se govori u Mandara planinama u Kamerunu; ima samo dva vokala
16962,pikantni dresinzi za salatu; postoje dve vrste dresinga: francuski ili sirćetni i kremasti
3158,"radioktivni transuranski element dobijen bombardovanjem ajnštajnijuma alfa česticama (sada mu je simbol Md, dok je ranije bio Mv)"
15825,Propust da se učestvuje.
3159,Javna zgrada u kojoj se igraju različite kockarske igre (funkcioniše kao biznis).
358,unositi zarazne klice ili njihove produkte u živo tkivo radi dijagnoze ili posticanja imuniteta
277,Sovjetski pesnik; lider ruskog futurizma (1893-1930).
14345,Delovati protiv nečega.
16070,kajsije koje se čuvaju tako što se osuše
5973,stan koji se nalazi na najvišem spratu zgrade
1939,indijski jezik kojim govore stanovnici Gudžarata u zapadnoj Indiji
13751,"zaslađena mešavina mleka i jaja pečena, kuvana ili zamrznuta"
9628,Mašine ili mašinski sistemi uzeti zbirno.
9501,Vojna jednica koja je deo ratnog vazduhoplovstva.
14397,Biljka koja se gaji zbog cvetova čiji je miris jači noću.
8757,Pomerati ili izazvati pomeranje brzo tamo-amo.
17698,koji sadrži aforizme ili maksime
7383,"deo zapadnog Tihog okeana, između Australije i Nove Gvineje"
5784,imati sastanak da bi se o nečemu razgovaralo
7070,ona koji ima visoku robnu ili novčanu vrednost za korišćenje ili razmenu
15339,muzički događaj koji izvode svirači ili pevači koji ne uključuje pozorišno prikazivanje
1370,bilo koji od različitih antibiotika dobijenih od penicilijumskih kalupa (ili proizvedenih sintetički) koji se koriste u lečenju različitih infekcija i bolesti
13357,oštar vrh na bodljikavoj žici
13262,"uređaj sa eksplozivom koji izgara malom brzinom plamenom u boji, može se koristiti za osvetljavanje kakvog područja ili za slanje signala itd."
17279,VE
8374,Prisiliti ili obavezati nekoga da uradi nešto.
19061,Višećelijski organizmi ćije su ćelije manje specijalizovane nego kod Metazoa; sastoji se od samo jednog kola: Porifera.
16375,Osoba koja proizvodi prehrambene proizvode.
15639,Napraviti mogućnost ili obezbediti mogućnost za nešto; dozvoliti da se dostigne ili izazvati da ostane.
909,Mala providna riba koja ima običaj da se zarije u pesak; primitivni prethodnik kičmenjaka.
13344,salata koja se sastoji od više vrsta testenine
16619,"Srediti nešto, recimo dug."
1419,jastuk za podršku glave osobe koja spava
7681,"koji se odnosi na Estoniju, njene ljude i kulturu"
619,velika grupa ostrva (preko 1000) u istočnom delu Okeanije
6702,Rod evroazijskih višegodišnjih gomoljastih trava: divokozjak.
9085,Krupna morska i rečna riba hrskavičava kostura.
5947,Arapsko kraljevstvo u Aziji na severozapadnoj obali Persijskog zaliva; najveći izvor nafte.
5549,elektromagnetsko zračenje koje može da proizvede fotohemijske reakcije
6499,Novčana pomoć savezne države republičkim i lokalnim i vladama za podršku socijalnim programima.
13071,Broj elemenata u matematičkom skupu; određuje veličinu ali ne i redosled.
3545,neko ko upravlja vladinom agencijom ili odeljenjem
13613,naterati nekog da napusti službu
14780,Ukupnost novčića.
140,sistem koji kontroliše rad drugog sistema
6099,originalni (audio) snimak sa koga se mogu napraviti kopije
8238,penutski jezik kojim govori narod Takelma
32,bolan osećaj koji proizlazi iz svesti o nedovoljnosti ili krivici
4676,"marinirano povrće, meso ili riba; služi se sa pirinčem"
13824,onaj koji voli i brani svoju zemlju
8336,dodatak jelu za poboljšanje ukusa
7077,glavni grad Ujedinjenih Arapskih Emirata i jedan od emirata
4224,Napisani ili odštampani simbol.
241,Rod porodice Vespertilionidae.
18136,stanovnik Jermenije ili poreklom iz nje
10801,jak liker s ukusom bobica kleke
12743,Uzica o koju je obešen metalni teg koji pokazuje direktno na centar zemljine teže.
7125,novčana jedinica Meksika
15544,pre-mikenova civilizacija na kikladskim ostrvima u južnom Еgejskom moru
16821,dravidski jezik kojim se govori pretežno u istočnoj Indiji
4470,"crvenkasti olovni oksdi (Pb3O4) koji se koristi kao pigment za boje, u proizvodnji stakla i keramike"
7354,pečeno jelo koje se sastoji od slojeva kora za lazanje sa sosom od sira i mesa ili povrća
18003,pročitati naglas da biste proverili šta fali ili ko je odsutan
10798,lagana šetnja (obično na nekom javnom mestu)
14432,osoba koja je umrla i proglašena za sveca procesom kanonizacije
19147,Ima dva točka; pokreću ga nožne pedale.
16309,trem na spoljnoj strani zgrade (ponekad delimično zatvoren)
5418,distribucija stvari u klase ili kategorije istog tipa
14502,Najhladnije godišnje doba.
10378,meso ribe nalik lososu ili pastrmki koja se nalazi u hladnim jezerima severne hemisfere
3180,(Grčka mitologija) Titan kog je Zevs prisilio da nosi nebo na ramenima
18307,prst na stopalu
6561,knjiga sa uputstvom za upotrebu ili rad nekog dela opreme
7347,"Uspravna godišnja trava sa ovalnim lišćem i ružičastim cvetovimal koristi se kao začin za meso, supe i salate; poreklom iz jugositočne Evrope."
5709,Zmije-otrovnice iz starog sveta.
7958,"Mediteranska biljka koja se gaji kao kućna biljka zbog upadljivog tamnozelenog lišća sa srebrnim odsjajem i visećim belim, ružičastim ili crvenim cvetovima."
12113,mala mediteranska biljka; sadrži ulje koje se nekada koristilo protiv zubobolje
5362,Sveže voće i povrće koje se uzgaja za pijacu.
2431,Žena-domaćin.
11500,"zaobljena posuda otvorena na vrhu, obično služi da serviranje hrane i voća."
4242,"najvažnija bitka u torku Rata za špansko nasleđe, snage Velike alijanse su odnele pobedu nad Francuskom 1704."
16754,verski praznik koji pada u razne dane u različitim godinama
9397,Vitka evropska sova koja živi u evropskim četinarskim šumama; ima duge ušne rese.
4213,Stočar koji uzgaja goveda.
16055,podloga koja se sastoji od horizontalne površine za držanje predmeta
11787,4. slovo grčkog alfabeta
14163,Kolekcija ili zaliha lekova.
6378,"Akumulirano bogatsvo u obliku noca, nakita, sil."
18893,"evropski labud, često pripitomljen"
7930,"koji se tiče Kenije, njenih ljudi ili kulture"
3372,Štampač koji štampa karakter po karakter.
6178,žut ili narandžastocrven pigment koji proizvode biljke
1836,zelenkasto sivi ili crni silikat od gvožđa i aluminijuma
301,atabaskanski jezik kojim govori narod Navaho
173,protein koji daje samo amino kiseline pri hidrolizi
8289,tačka sabiranja svetlosti (ili drugog isijavanja) ili tačka iz koje se rasipa
13691,Udubljenje u površini nastalo pritiskom.
6306,reči koje su na usputan način govorile sa svesnim umanjivanjem njihove važnosti
6096,"Stanovnik Rumunije, koji je u njoj i rođen."
13773,Razdeliti na male komade.
53,the organic process of synthesizing and releasing some substance
7231,Neodređena količina nečega koja ima određenu vrednost.
10047,Strana nekog predmeta koja je nasuprot prednjoj strani.
15939,slovenski jezik kojim se govori u Republici Makedoniji
18915,"Staviti u nešto, kao u kutiju."
5539,ispitati dodirom
6907,neki projekat koji instruktor dodeljuje
11230,zapaliti se uz jak plamen
1151,o homologim hromozomima koji su spojeni u paru u sinapsi
