,Sysnet
9305,osnovna novčana jedinica Tanzanije
12828,YE
13939,zamišljena linija koja povezuje tačke koje imaju istu temperaturu u datom trenutku
8104,koji se odnosi ili se dešava pre podneva.
15633,Bodljikava rečna riba za jelo i ribolov.
12431,Politička organizacija u okviru Demokratske partije u Njujorku krajem 19. i početkom 20. veka.
11489,ponoviti odlomak iz nečega
61,"Ćelijska protoplazma, bez jedra."
3973,mišić između rebara; oni se kontrahuju u toku izdisaja
15122,rod bakterija
14109,Mužjak dobija u trećoj godini iznad nosa kožasti deo koji može da napuni vazduhom i onda liči na kapu.
8688,kupasti akustični uređaj držan do usta kako bi se intenzivirao i usmerio ljudski glas
11158,Govoriti redom brojeve.
544,Struktura u kojoj životinje ležu jaja i legu svoje mlade.
154,stanje degeneracije mentalnih ili moralnih kvaliteta
5271,Bela figura (za razliku od crne figure u šahu).
3489,grupa semitskih jezika
11212,koneski komunistički vođa (1893-1976)
15321,Raspoloživi radnici.
13282,operativno ukloniti deo strukture ili organa.
844,Toplotni motor u kome se paljenje dešava izvan prostora (cilinrda ili turbine) u kome se toplota pretvara u mehaničku energiju.
6612,the basic unit of money in Niger
10150,Formalna javna izjava.
1562,osinica
5906,finski jezik kojim govori narod Votjaka
13565,muški valdar imperije
5531,onaj ko veruje u imperijalizam
415,Šolja iz koje se pije kafa.
8208,arhipelag sastavljen od jednog većeg i sedamdesetak manjih ostrva u severnom Atlantiku i Severnom moru kod severne obale Škotske
10191,sakupiti na jednom mestu
13062,specijalista geologije
14358,"koji se odnosi ili primenjuje na administraciju grada, opštine ili okruga a ne na neku širu zonu"
2516,prekidanje usred rečenice (kao kod pisaca realnih razgovora)
11074,su ugljene kiseline (sadrži grupu CO3)
7960,Dati opis nečega.
4,osećanje seksualne ljubavi
7348,"grana čiste matematike koja se bavi tačkama, pravim, krivim i površima"
12093,"Luka u Finskom zalivu, prestonica i najveći grad Estonije."
15754,Aromatična evropska biljka poreklom sa Mediterana i iz Turske; nije rasprostranjena u Evropi.
12978,mehuraste foke
3118,u grčkoj mitologiji Odisejeva žena i simbol odanosti i vernosti; tokom deset godina dok se Odisej borio u Trojanskom ratu ona je odolevala mnogim proscima sve dok se (posle još 10 godina) Odisej nije vratio i sve ih ubio
11497,"pokrivač za glavu konja; uključuje oglav, žvale i uzde koje jahaču ili vozaču daju kontrolu"
6009,Svojstvo mentalnog života živog organizma.
785,Akt učestvovanja u Euharistiji
11263,reći nešto unapred; praviti pretpostavke o nećemu
11289,pričvrstiti pomoću dugmadi
13603,Uvredljiv izraz za običaje i rituale Rimske katoličke crkve
6241,koji se širi ili zauzima prostor više kontinenata
17403,tamna bitumenska supstanca koje se javlja u prirodnim ležištima i kao ostatak pri destilaciji nafte; sastoji se uglavnom od ugljovodonika
16281,skinkovi
8357,deo ljudske noge između kolena i skočnog zgloba
7509,Rod vodozemaca koji uključuje ceciliju.
10749,Drveni duvački instrument koji ima jedan jezičak od trske.
4047,"obrok sačinjen od sendviča, sira i salate"
10044,"sladak, zelen ili beli liker sa ukusom mente"
1901,klišnjaci
11781,bantu jezik kojim se govori u priobalnom području istočne Kenije
16779,kontraceptivno sredstvo
2857,država na Skandinavijskom poluostrvu
5069,"testo od kukuruza i kukuruzne kaše punjeno sa mešavinom od mesa, umotano u kukuruzovinu i kuvano na pari"
3492,skup čiji elementi su elementi drugog skupa; skup koji je sadržan u drugom skupu
11016,hipotetički organizam za koji se ranije mislilo da je posrednik između majmuna i ljudskih bića
13527,kamarupski jezici kojima se govori u državi Asam u severoistočnoj Indiji
4095,dijagram koji pokazuje veze između komponenata sistema (posebno eletronskih sistema)
1627,slatkovodna riba koja ima leđa maslinaste do tamnozelene boje
10188,"krsta kod četvoronožnih životinja, deo tela iznad zadnjih nogu"
5109,građanin koji ima zakonsko pravo glasa
9811,Hokej koji se igra na igralištu; dva suportstavljena tima koriste izvijene štapove da bi uputili lopticu u protivnikovu mrežu.
2310,zamenica koja upućuje na neki antecedent
2356,glavni grad i luka Omana
3581,jezik koji je najpre usvojen u detinjstvu ili onaj kome se daje prednost u višejezičnoj situaciji
12373,Neko ko pokušava da probrati druge u drugu veru ili dkotrinu.
15649,Vreme između zore i podneva.
2113,Stanje kognitivnih procesa neke osobe.
14207,"Pričvrstiti konopcem, uzicom."
17190,Snabdeti potrepštinama i podrškom.
10871,Preuzeti vođstvo ili inicijativu: učestvovati u razvoju nečega.
11264,Završetak ili uništenje unije.
6229,Muški rođak.
8994,dodati kao novi element ili deo
9420,ugovor o konstituisanju (stavljanju) hipoteke
15455,"Neka od više vrsta obično velikih pasa koje se uzgajaju za rad, nošenje tovara, čuvari i vodiči."
15496,sos za špagete ili drugu vrstu testenine
1,Koji obezbeđuje ili oseća fizičku udbnost ili opuštanje.
16845,Poslednji deo dana (period smanjene dnevne svetlosti od kasnog popodneva do noći).
11507,deo zabave koja je dodeljena posebnim izvođačima ili izvođenjima
3954,Oblik upravljanja društvenom organizcijom.
2,nepokolebljivo verovanje u nešto bez potrebe za dokazima ili nalazima
14649,jedrenjak sa dva jarbola
8132,Morski prilepak.
6794,"lanac ostrva koji uključuje Boreno, Sulavesi, Javu i Sumatru"
49,osećanje izazvano nečim čudnim i iznenađujućim
9597,okomita galerija sa sedištima za gledaoce (kao u operacionoj sali ili pozorištu)
15935,Šimpanze; bliže su sa Australopithecus nego sa ostalima pongidama.
5436,"Osoba koja pravi, popravlja i prodaje opremu za konje."
1179,cvetni aranžmen koji je napravljen od cveća povezanog u krug
9058,Koji se odnosi na list.
26,"Koji privremeno nije aktivan, o vulkanima"
3929,Proizvod napravljen od životinjskog materijala.
129,Neka od brojnih uglavnom jednogodišnjih travnatih biljaka iz roda Calendula koje se gaje zbog žutog ili narandžastog cveta; često se koristi za medicinske ili kulinarske svrhe.
12561,koji ima ili se sastoji od deset slogova
4110,Oslonac koji je deo svake strukture ili zgrade.
16885,"deo Tihog okeana na jugu Japana, okruženo ostrvima Honšu, Šikoku i Kiušu a povezano s Japanskim morem uskim kanalom"
16502,Događanje koje se izdvaja serijom povezanih događaja.
15086,jedan od dve rata: prvi je vođen kada su se Buri borili protiv Engleza da bi povratili nezavisnost koju su izgbili tražeći pomoć od Engleza u probi protiv Zulu plemena (1880-1881); drugi je vođen protiv Britanije (1899-1902)
11790,lanac ostrva koji čini jednu Indonežansku provinciju istočno od Jave; uključuje Bali i Timor
3787,poslovno odelo koje se sastoji od odgovarajuće jakne i suknje ili pantalona
303,"koji izaziva iznenađenje, čuđenje ili zadivljenost"
5558,Rod malih orhideja severne hemisfere.
17323,Neko ko uzgaja vinovu lozu.
5294,Organizacija vojnih kopnenih snaga.
15293,ševe
14337,"dozvoliti ulaz, dati ulaz u nešto"
3749,jezik (negermanskih) Prusa izumro nakon 1700. godine; smatra se da je pripadao baltskoj grani indoevropskih jezika
8512,Čin kojim se nešto reprezentuje; zastupati nekoga ili neku grupu i govoriti u njihovo ime s odobrenje.
8942,vakašanski jezik kojim govori narod Nutka
88,"Završiti pre kraja, kao računarski proces, misiju itd."
14418,obavljati dužnost ili držati položaj; služiti u posebnoj funkciji
16015,ceo broj koji deli drugi ceo broj bez ostatka
10148,Smanjiti po opsegu zadržavajući suštinske elemente.
274,koji se odnosi na leksikografiju
2768,mreža lokalnog produčja koja koristi visokofrekventne radio signale za transmisiju i primanje podataka na kratkim razdaljinama; koristi ethernet protokol
10099,krofna čije se testo mesi sa kvascem
11249,"koji se tiče Kipra, njegovih ljudi i kulture"
2831,Skupoceno plovilo koje pokreću jedra ili motori i koristi se za krstarenje ili trke.
16703,Jedinjenje opisano u kategorijama centarlnog atoma za koji su drugi atomi vezani ili usklađeni.
370,automatsko prilagođavanje fokusne dužine sočiva oka
1195,unutrašnji ugao koji obrazuju dva susedna zida
13354,u nekim klasifikacijama se definiše kao carstvo
10926,Životinje koje hrane mladunce mlekom.
2770,Cena zaračunata za neki artikal ili uslugu.
14819,proces kojim su obuhvaćena ljudska bića
3108,osnovna novčana jedinica Bocvane
7243,Osoba koja ispoljava pobožnost.
16517,luk blagog ukusa koji ima crvenkastu ljusku; koristi se kao garnirug u hamburgerima i salatama
14142,"Glavičasta biljka iz porodice glavočika (Compositae), uključuje maslačke."
2549,Događaj koji se ponavlja u određenim intervalima.
11202,Zatvorena posuda u kojoj se voda pretvara u paru.
10455,"ostrige premazane buterom, spanaćem i začinima koje se peku u jednoj polovini ljuske"
7894,koji se tiče ili koji pripada sadašnjem vremenu
3449,Krasuljak
10247,Neki grm iz roda Rubus koji rađa jestiv plod.
6378,u pozadini čega biti
4856,mural uradjen tehnikom akvarela na vlažnom malteru
106,Stanje zrelosti; puni razvoj.
37,"Nemogućnost da se odmori, opusti ili bude miran."
12390,"pripadnik semitske grupe naroda poreklom sa Arapskog poluostrvai okolnih teritorija, govore arapski, ali su se proširili i na Bliski istok i sever Afrike"
1296,bilo koja od raznih gljiva iz porodice Lycoperdaceae čije okruglo plodonsono telo oslobađa oblak spora kada sazre
7883,"u elektronici, sistem međusobno povezanih elektronskih komponenti ili kola"
14540,Univerzalan začin koji se koristi u gotovo svim jelima; bobice biljke biber iz Istočne Indije; upotrebljavaju se cele ili samlevene.
7484,izlistati u indeksu
13741,odecća koja se nosi u formalnim prilikama u večernjim satima
10558,Neka od evroazijskih biljaka iz roda Helleborus.
16290,MA
54,svaka šteta proistekla iz povrede prava
78,izuzetno ponosan i veseo; dobrog raspoloženja
12074,Ženka labuda
15737,pravni dokument kojim se ovlašćuje lice da može zastupati onoga koji mu je to ovlašćenje dao
1469,koji se tiče Papue i njenih ljudi
441,Rod mediteranskih zeljastih biljkaka i žbunja.
8519,Kalifornijsko drvo (ima dve vrste) koje može da dostigne visinu od 300 stopa; nekad se smešta u porodicu Taxodiaceae.
145,Koji dovodi (pričinjava) fizičku neudobnost.
14091,Taikmičenje sa pravilima koja određuju pobednika.
6700,prostor na disku koji je odvojen za virtuelnu memoriju
12260,"koji se odnosi ili pogađa samo deo, ne celinu"
7182,Postavljen ili ustanovljen naredbom ili nalogom.
314,U kome nema života.
14029,Trešnjevo drvo (građa).
747,veliki pingvini
7552,100 grama
3819,"raširen, razbacan ili podeljen"
247,osećanje intezivne nesreće
10184,determinator koji određuje specifičnost referencije imeničke sintagme
7033,koji se odnosi ili je karakteristično za Argentinu i njene stanovnike
1928,punč napravljen od voćnih sokova pomešanih sa vodom ili mineralnom vodom (sa ili bez alkohola)
11220,"Vrsta luka koji proizvodi male grozdove glavica blagog ukusa, koristi se kao dodatak jelu."
12692,deo pribora za jelo koji ima nekoliko zubaca (obično 4) i služi za serviranje hrane ili za jelo
10714,"Rod izSeverne Amerike, višegodišnje biljke, svilenica."
17352,"Bučno slaviti, uključiti se u bučne proslave."
13046,Izvršiti operaciju na nekome.
12225,any of various reptiles of the suborder Sauria which includes lizards; in former classifications included also the crocodiles and dinosaurs
1955,sigurnosna oprema u automobilu; vreća se naduvava u slučaju sudara i time sprečava vozača ili putnika da se naglo pomere unapred
2465,naglo zaokrenuti; iznenada promeniti smer
4301,u srednjovekovnoj legendi nevesta kralja Kornvala koja se zaljubila u kraljevog nećaka Tristana pošto su greškom popili ljubavni napitak i ostali večno zaljubljeni
14728,put kojim se mogu prenositi signali
14567,"interfejs koji se obično koristi za modeme, miševe i neke štampavye koji dozvoljava transmisiju bit po bit"
3110,Gušteri iz starog sveta.
2921,"Prepreka, obično metalna, koja se stavlja na vrh gola."
885,čin uključivanja
8854,političko usmerenje naroda ili vlade sa ciljem da održi snažnu vojnu silu i da bude spremna da ga agresivno koristi da brani ili promoviše nacionalne interese
6348,jabuka koja se primarno koristi za kuvanje
8361,Svaranje slika uz pomoć boja
10394,koji se tiče Tajvana i njegovih stanovnika
498,make larger
17193,protozoa sa mikroskopskim izraštajima koji se šire od površine ćelije
9467,skup reči koje ispoljavaju ista svojstva u pogledu fleksivnih oblika i distribucije
14618,bod koji se pravi tako što se obmota konac više puta oko igle pre nego što se ubode u tkaninu
1676,Trud pun napora za postizanje cilja.
6010,Ponašati se neprirodno i izafektirano.
11542,1910-1911
7603,vrsta zebe iz Evrope ili Amerike sa velikim i snažnim kljunom
5543,"raketa koja prevozi putnike, instrumente ili bojeve glave"
7841,Vremenski period u godini kada škole rade i ljudi uče.
9245,algonkinski jezik kojim govori narod Delaver
5901,Deo nameštaja koji je namenjen sedenju.
8317,konstrukcija kvadrata koji ima istu površinu kao neka druga figura
14580,Ušati perajar severnog Pacifika; sličan sa morskim medvedom ali nema dragoceno krzno.
8606,"Biljke čije se glave sastoje od mnogo ?: kaloper,?"
1805,glavni grad i luka Santa Lucije
17332,Voćka iz umerenih područja koja rađa plod od tamnožute do ružičaste boje.
15795,uspravna žbunasta slezna biljka ili malo drvo koje donosi čaure sa semenkama koje imaju mnogo dugačkih dlakavih vlakana
5663,Veliki rod suvozemnih paprati tropskih i suptropskih predela; ponekad se smešta u porodicu Polypodiaceae.
460,"Pretvarati iz čvrstog u tečno stanje, obicno zagrevanjem."
7676,Društveni čin okupljanja u određenu svrhu
6146,"komad nakita koji se satoji od tračice ili lanca na kojima obično vise dragulji, a nosi se kao ukras oko vrata"
2692,jestivi listovi maslačka koji raste u divljini; koristi se za pravljenje salata i vina
269,koji nije veseo niti izaziva veselje
3893,Igrati rolu ili ulogu.
4258,"Neka od mnogobrojnih niskih biljaka iz roda Crocus koje imaju tanko lišće nalik na travu i bele, žute ili ružičaste cvetove; potiče sa Mediterana,"
6976,"u računarstvu, računarska datoteka uskladištena na magnetni disk koja se može na jedinstven način identifikovati"
10066,Neki od više torbara travojeda Australije i Nove Gvineje koji ima velike i snažne zadnje noge i dugačak i debeo rep.
14350,čorba od junetine
3730,"grupa koralnih ostrva u Mikroneziji, jugozapadno od Havaja"
8490,vidljiv znak napravljen an površini
11130,Ribe sa spljoštenim telom: raže.
19,osećanje misaone tuge
661,Tipski rod porodice Cercopithecidae: zamorac zeleni
6553,zgrada u kojoj se nalazi organizaciona jedinica neke grane javnog poslovanja
172,not standard; not accepted as a model of excellence
1524,"francuska škola u umetnosti i arhitekturi popularna u 90. godinama XIX veka; krakaterišu je stilizovani prirodni oblici, kao što je lišće, loza i cveće"
16823,jezik na koji se prevodi tekst napisan na drugom jeziku
11668,"zvanična rezidencija koju je crkva priuštila svom parohu, vikaru ili rektoru"
10433,potpora koja liči na nožni ekstremitet
10224,Trave; šaš; ?rushes.
5368,uska depresija (na primer na zemlji ili između okeanskih talasa ili na dnu okeana)
2981,sposobnost za spontano i nezavisno kretanje
15154,Pripitomljena mačka iz roda Felis.
7040,koji sadrži azot
8895,jezik kojim govore Eskimi
17143,dlakava braon voćka u obliku jajeta blago kiselog zelenog mesa
14650,Španski gitarista koji je klasičnu gitaru učinio koncertnim instrumentom (1893-1987).
10182,Učiniti da postane suvu usled izlaganja toploti.
111,bilo koji od brojnih dlakavih insekata uključujući i društvene i osamljene vrste
2391,korekcija napravljena brisanjem
15825,rod bakterija
5110,čvrsta šešir od slame sa ravnim obodom
5813,kratka čvrsta palica koju uglavnom koriste policajci
17411,Republika u centralnoj Evropi; podeljena na Istočnu i Zapadnu Nemačku posle Drugog svetskog rata i ponovo ujedinjena 1990. godine.
82,torbar mravojed
5932,brazilski orah
15747,dfuzija molekula kroz semipermeabilnu membranu iz mesta više koncentracije do mesta niže koncentracije sve dok se koncentracija na obe strane ne izjednači
8489,povećanje gustine nečega
15483,Azijska republika na istočnom kraju Mediterana.
10112,mala smeđe-siva
665,Taksonomska grupa biljaka koja odgovara phylumu (redu) (u bilogiji).
11269,osluškivati sa namerom
2160,vijoglavke
227,početni uvodni deo statuta ili zakona (obično objašnjava njegovu svrhu)
8331,biolog koji se specijalizovao u izučavanju biljaka
4884,u grčkoj mitologiji ćerka Helija i majka Arijadnina
2895,Učiniti poznatim oglašavanjem.
7895,(računarstvo) pokretna slika koja se pojavljuje na ekranu računara kada u određenom vremenskom periodu nije bilo ulaza
6824,koji se tiče Katara
12229,Red rasprostranjen po celoj zemlji zemaljskih ptica koje imaju malu glavu i kratke noge sa četiri prsta bez opni.
5970,Neki pas obično duge dlake koji je oučen za čuvanje pasa.
6956,"Pisac iz Sjedinjenih Država, pisao romane zasnovane na iskustvu iz Klondajk zlatne groznice (1876-1916)."
4679,klasa biljnih sekundarnih metabolita; neka od velikih klasa biljnih pigmenata koji imaju hemijsku strukturu zasnovanu na ili sličnu sa flavonom
14794,vrsta trave
14628,političko ili teološko usmerenje koja zagovara očuvanje najboljih u društvu i suprotstavljanje radikalnim promenama
16496,Najčešće se prodaje samleven kao prah svetlonarandžaste boje; ima jak misris i ukus; dodaje se jelu na vrhu noža; najčešće se koristi za pirinač.
4143,Podzemno stablo; služi kao reproduktivna struktura.
3509,"koji se tiče Belorusije, njenih ljudi ili kulture"
16620,koristi se za hranu za bebe
16204,Biti nečiji pratilac.
16557,osnovna novčana jedinica u Liberiji
237,Staviti na kocku u nadi za povoljnim ishodom.
12814,jabuke koje se uglavnom uzgajaju u Šenadoh dolini
7436,Obuhvatasve skorije članove reda Hyracoidea.
6346,francuski pisac i kritičar; poznat i kao branilac Drajfusa (1840-1902)
5052,parčići mesa marinirani i pečeni na ražnju obično sa povrćem
3350,nauka koja izučava ljudska društva
16865,Vrsta malog sisara crne dlake koji živipod zemljom i ima prednje noge i rilo prilagođene za kopanje.
16172,nevaljali dečak iz romana Mark Tvena
9975,Sastoji se samo od aye-aye.
4732,"koji se tiče Tunisa, njegovih ljudi i kulture"
2605,mesto za koje se tvrdi da postoji u verskim ili književnim spisima
362,Neko telesno svojstvo.
13583,Gornja odeća koja pokriva telo od ramena nadole i nosi se napolju.
4160,katalog koji u alfabetskom poretku sadrži popis pretplatnika i njihove telefonske brojeve
6678,koji se odnosi na kamen ili je od njega sastavljen
6853,Neven
14951,Višegodišnja biljka iz jugoistočne Azije sa aromatičnim korenom.
4645,"Pokrenuti krivom putanjom, obično s namerom da se nešto udari."
3296,koji se tiče Saudijske Arabije i njenih ljudi
6852,Čin stavljanja jedne stvari u drugu.
9241,Neki od velikih čovekolikih majumuna iz familije Pongidae.
65,Koji može da čini po slobodnoj volji; koji nije sputan ograničenjima.
16548,Uglavnom tropsko drveće i žbunje sa gorkom korom koje imaju suvu voće sa jednim semenom.
10252,parazitska protozoa iz roda Plasmodium koja izaziva malariju kod ljudi
12730,Oprema za snimanje na magnetni medijum.
17167,Veliko zimzeleno drvo toplih područja iz čijeg se aromatičnog stabla dobija kamfor.
14926,Čovek koji je crn.
10016,osnovna novčana jedinica Južne Afrike
7721,bantu jezik
2130,grčki bog rata; sin Zevsa i Here; u rimskoj mitologiju mu odgovara bog Mars
13697,trgovina na malo gde se prodaju lekovi i drugi artikli
16947,Koristi se u nekim klasifikacionim sistemima; Passeriformes koje imaju relativno jedostavan vokalni organ i ne mogu dobro da pevaju: vikačice.
6959,blok zemaljine kore koji je ograničen rasedima i pomeren tako da formira vrhove planinskog područja
16033,"Oblikovati u glini, vosku, itd."
8274,trosložna metrička stopa u kojoj je samo prvi slog naglašen
5537,Bezrepi majmun iz porodica Pongidae i Hylobatidae.
14850,kratak uvodni članak koji prethodi tekstu knjige
16969,"Porodica reda Sirenia, ukxlučuje dugong (morska krava)."
3228,"Muzika koja se peva, nasuprot onoj koja se svira."
13078,platforma koja je isturena iz zida zgrade i okružena balustradom ili ogradom ili zidom
4372,produžiti rok da se šta plati
3272,Neka biljka iz roda Delphinium koja ima palmasto lišće i upadljivi klasje cvetova različitih boja; neke sadrže veoma otrovne supstance.
7672,halofile u slanim sredinama kao što je Mrtvo more ili slana zemljišta
15989,grana inženjerstva koja se bavi projektovanjem i realizacijom javnih radova kao što su brane ili mostovi
16286,Mešinka: veliki rod vodenih biljaka mesoždera; široko rasprostranjene.
11812,"ogranak Sredozemnog mora između Grčke i Turske; glavni trgovački put starih civilazija Krita, Grčke, Persije i Rima"
7059,Sveta tajna kojom se krštenoj osobi daje potpuno uključenje u crkvu
10233,Riba otvorenih mora.
17088,veštački jezik koji se koristi za trgovinu između govornika različitih jezika
4823,Familija biljaka dikotiledona.
6733,Okrenuti lice u određenom smeru
10473,"uzorak :3, mustra :1 mali deo neÄega koji se shvata kao predstavnik celine"
16334,glavni grad Mauritanije
4959,stići na vreme
5349,Rana hrišćanska crkva konstruisana kao rimska basilika; ili rimokatolička crkva ili katedrala koja ima određene privilegije.
8849,Severnoamerički rakun.
8723,Prestonica Moldavije.
15436,jaje prženo na ulju ili puteru; nekad prženo sa obe strane
16891,Specijalista interne medicine.
992,Grupa od mnogo insekata.
13662,društvena grupa (obično pre pojave pisma)
4549,glagolski oblik kojim se izražava završena radnja
6030,bog severnog vetra i severne strane sveta
2554,Penjačica sa belim cvetovima; ima debeo koren i rađa smale crne bobice; od Evrope do Irana.
4466,Rod gljiva sa crnim tačkama kod kojih se klobuk raspada u mastivalju tečnost pri sazrevanju; ponekad se svrstava u sopstvenu porodicu Coprinaceae.
9319,Učiniti slabim.
8676,fiktivno ime koje se koristi kada osoba igra određenu društvenu ulogu
13926,Jedna od raznih vrlo cenjenih jestivih podzemnih gljiva roda Tuber; raste u jugozapadnoj evropi.
13324,parazit zglavkara i riba koji napada i uništava ćelije domaćina
1011,Alge zelene boje ili bezbojne; slobodno se kroću u morskoj ili slatkoj vodi.
6485,"zajednički naziv za grupu malih, jestivih školjki koje imaju okruglu ljusku sa sjajnim rebrima"
13237,herpes virus koji inficira kožu i nervni sistem
17158,čest mineral koji je bledo žute boje
2531,"u računarstvu, jedno izvršavanje skupa instrukcija koje se ponavljaju"
3795,"Nečista vrsta kvarca, poludragi kamen, koristi se u proizvodnji nakita i u tehnici."
4524,uređaj koji se koristi za smeštanje stopala u cipelu
16724,elektronska oprema za beleženje i reprodukovanje zvuka
3568,"Vrba sa dugim visećim granama i tankim lišćem, poreklom iz Kine; gaji se kao ukrasna biljka."
5736,Neka od raznovrsnih dnevnih ptica grabljivica koja ima golu glavu i slabe kanđe a hrani se uglavnom crkotinama.
17406,mali odrezak mesa koji uključuje deo rebra
11415,koji se odnosi na ontologiju
3126,Sporazumevati se ćutke i neverbalno; sporazumevati se jezikom znakova
9527,"sos braon boje sa paradajzom, karamelizovanom mešavinom seckane šargarepe, crnog luka i celera začinjen vinom madera"
15807,Zaseban 3-dimenzionalni obajekat koji ima masu i razlikuje se od drugih objekata.
7441,U psihoanalizi postoji i tumačenje da roditeljske figure ( i njihove vrednosti ) se projektuju na dete. Glas savesti je obično glas  jednog od roditelja.
35,Čin prljanja nečega.
15290,Grlica
5862,uže koje se provlači kroz rupice ili oko kvačica da bi se neke dve stvari držale zajedno (npr. kod cipela ili odeće)
10999,osoba koja ima opštu vlast nad drugima
7691,Pomeriti s upotrebom sile.
286,Patiti od nečega; bolovati od nečega.
16607,ulica po kojoj se vozila kreću u oba smera
8238,"glavni grad Kuvajta, luka u Persijskom zalivu"
10126,"Visoka trska Severne Amerike koja ima relativno široko lišće i velike ?panikles; široko rasprostranjena u vlažnim predelimal koristi se za prostirke, zastore i strele."
4117,Izolovana činjenica koja se posmatra odvojeno od celine.
16023,gramatička kategorija zamenica i glagola čija je funkcija upućivanje na neposredne i posredne učesnike u govornoj situaciji
6913,"tčin dovođenja nečega do najvećemoguće tačke, vrednosti ili pozicije"
5649,peć na drva (nekad ugalj) koja služi za kuvanje
11152,grana neuronauke koja izučava mozak
14104,stanovnik Togoa ili poreklom iz Togoa
16754,korišćenje izgovorenih zvukova u slušnoj komunikaciji
16690,učini silom; primeniti silu
17351,Neki izraziti stil u muzici.
7810,(lingvistika) bilo koji od raznih akustički različitih oblika iste foneme
7366,"Retki torbar mesožder, liči na vuka; živi na Tasmaniji; noćna životinja; danas verovatno istrebljen."
14371,Velik po stepenu ili intenzitetu ili broju ili količini.
5049,"o rastvorima, ima isti ili jednaki osmotski pritisak"
225,Emocionalna poremećenost; osnovno osećanje koje ljudi pokušavaju da izbegnu.
12535,Bizamko goveče
4401,Keks kome ukus daju začini.
16057,Mediteranskazeljasta biljka s mesnatim cvetnim glavama koje se jedu kao povrće.
3734,kockice goveđeg mesa pržene u vrelom ulju i potom umočene u neki sos
13276,akumulirana zemlja i kamenje koje donose glečeri
7155,Čin kažnjavanja.
10413,Zgrada snabdevena posebnom opremom i osobljem za određene namene.
14327,mineral koji se sastoji od stroncijum karbonata
10098,Utvrđena linija za putovanje ili pristup.
16814,"Zimzelena biljka penjačica; rađa crni plod, nalik na bobice."
15938,Mesto gde neko živi.
6286,mekan plavkasto-beli toksični metal; javlja se u rudama cinka
