,Sysnet
1939,mala mediteranska biljka; sadrži ulje koje se nekada koristilo protiv zubobolje
12109,dodatak predstavljati
16173,finski jezik kojim govore Mordvini
17817,velika crna ptica neletač Australije i Nove Gvineje koja ima rožnatu krestu na glavi.
9551,Žlezda endokrinongsistema koja izlučuje horomone direktno u krvni sistem.
10433,blato ili glina ili sitan kamen koje talože reka ili jezero
15891,struktura u obliku zvezde formirana u citoplazmi ćelije koja ima vlakna poput zraka koji okružuju centrozom u toku mitoze
9625,"jedan od niza proreza  kod ždrela, farinksa  riba i vodenih vodozemaca kroz koje prolazi voda"
16489,"Skandinavski punč napravljen od Klareta i akvavita sa začinima, grožđicama, pomorandžinom korom i šećerom"
4422,Sedalo na klozetsko šolji pričvršćeno šarkama.
15862,koji se odnosi na morfologiju biljaka i životinja
294,"koji izaziva neprijatnost; na primer, neprijatna istina"
1735,operacija koja se vrši istovremeno (ili u određenom intervalu) sa još jednom ili više operacija 
28,koji nije zadovoljan; koji doživljava ili ispoljava nezadovoljstvo
3193,"Male ptice koje se penju i pužu uz drvo i stene, poreklom sa sverne hemisfere."
16927,bakterije koje uglavnom žive u zemljištu i izmetu
5179,područje u zapadnom Atlantiku gde su navodno mnogi brodovi misteriozno nestali
8490,Koji se sastoji ili odnosi na jezik (kao govor)
18464,farma vinove loze gde se proizvodi grožđe
13628,proizvesti delove (npr. zgrade) u fabrici tako da se mogu lako transportovati i brzo spojiti na mestu gradnje
9320,Samohodna mašina koja se koristi da vuče vozove po železničkim šinama.
1028,Film kod koga su slike sinhronizovane s govorom i pevanjem.
7192,odbacivanje činom zabrane
16126,Široko gajena vrsta banane koja rađa kompaktne visećxe grozdove žutog voća koje je komercijalno vrlo značajno.
6388,Rezak rizom koji se koristi posebno u orijentalnoj kuhinji.
12647,Prestonica i najveći grad Češke Republike u zapadnom delu zemlje; kulturni i trgovački centar od 14. veka.
8362,"Prebivalište koja je mesto verskog povlačenja, npr. manastir."
19084,"nezakonito uplitanje u čiji tuđi posed (lična imovina kao i nekretnine), ili postupak pokrenut za povraćaj štete"
18657,u grčkoj mitologiji Muza epske poezije
2613,tipski i jedni rod porodice Menuridae
9656,Proizvoditi zvukove lomljenja.
13590,deo pečenice koji je najbliži kuku
17433,tvrdo drvo hrasta
2053,čin dodeljivanja subvencije
10716,novčana jedinica Meksika
6078,Kretati se žurno.
11836,porez koji se sakuplja tako što se zahteva kupovina markice koja se lepi na dokument
23,Čin pravljenja fotografija.
8008,Deo? koji je obično jarke boje.
8579,namestiti na određenu poziciju ili podesiti da ispravno radi
3228,Podvrgnuti nedobronamernom smehu.
15022,oblik komunizma za koji se zalagao Lav Trocki; zalaže se za svetsku revoluciju proleterijata
17551,koji pripada arhiepiskopiji ili je u vezi sa njom
18651,grupa čadskih jezika kojima se govori u graničnoj oblasti između Kameruna i Nigerije južno od jezera Čad
9269,dravidski jezik kojim govore Kolami u centralnoj Indiji
15634,Bilo šta sa okruglim ili ovalnim oblikom (koji čini konopac ili gajtan itd.) što je zatvoreno ili gotovo zatvoreno.
5636,Azijska zeljasta biljka koja se gaji zbog kratkih mahuna sa jednim ili dva jestiva semena.
7054,viski napravljen od raži ili raži i slada
107,Rod familije Boletaceae; rod mekih gljiva koja brzo propadaju; neke su otrovne a neke jestive.
13397,"mlečna žlezda kod govečeta (krave, ovce i koze)"
8535,"Pričvrstiti nešto, kao sa konopcem."
4273,stanovnik Kipra ili poreklom sa Kipra
999,"Jednogodišnja ili dvogodišnja zeljasta biljka sa belim cveovima, rađa trouglaste mahune."
607,istočna podgrupa malajsko-polinezijskih jezika
19252,palma penjačica iz Šri Lanke i južne Indije
13811,Poluga koja se pokreće nogom.
7568,Abnormalno stanje krvi
6789,stanovnik Norveške ili poreklom iz Norveške
6771,ukazati na neophodnost kakvog zahvata (u medicini)
9540,Dekorativno ili umetničko delo.
1571,Dati verbalni ili drugi izraz svojih osećanja.
17903,Učiniti slabim.
11845,sredstvo (instrument) dizajnirano i korišćeno za oduzimanje života osuđenoj osobi(primer:električna stolica)
7109,Godišnje ili višegodišnje zeljaste biljke.
11552,čin prisiljavanja silom ili autoritetom
12484,"Mačke, lavovi, tigrovi, pantere, psi, vukovi, šakali. medvedi, rakuni, ?; svi su članovi podreda Punnipedia."
9944,grupa mozanskih jezika kojima se govori u Vašingtonu
13669,Povlačenje iz aktivnosti grupe.
1503,"akronim za ""light amplification by stimulated emission of radiation""; optički uređaj koji proizvodi intenzivni monohromatski zrak koherentnog svetla"
2662,Mala radnja na vašaru za prodaju robe ili zabave.
16663,okeanijski jezik kojim govore Maori na Novom Zelandu
15824,kareta
4775,kontinentalna ustavna monarhija u južnoj Africi
11675,staviti u vodu
19077,Skarabeje.
11436,predškolska ustanova za decu od 4 do 6 godina da ih pripremi za osnovnu školu
3637,"Mali rod zeljastih biljaka iz starog sveta, obično uključuje i rod Brassica."
5872,država zapadno-centralne Afrike; GQ
11212,porodica galebova i porodice ???
11369,koji se odnosi na Kašmir njegove ljude i kulturu
5119,grupa jezika kojima se govori u krajnjem zapadnom delu zapadne Afrike
5516,smanjen promer kanala ili prolaza.
13011,Broj koji množi drugi broj.
10598,sistem zglobova u telu
96,Ići u procesiji.
13008,grana zoologije koja proučava gmizavce i vodozemce
7204,Prestonica i najveći grad Litvanije.
4314,"sistem filozofije dominantan u srednjovekovnoj Еvropi, a zasnovan na Aristotelu i crkvenim ocima"
11413,Gorki listovi se preporčuju kao dodatak masnim jelima radi lakšeg varenja.
18153,Koji ima neravnomernu boju.
6110,zagovornik principa humanizma
8622,Ima glatku crepasto poređanu krljuš; noge su im slabo razvijene; živi u tropskim predelima.
10107,ispupčenje koje se koristi za ojačavanje ili za pričvršćivanje za drugi objekat
17530,Vodena zeljasta biljka
6891,pretvoriti u karamel
8673,tibetsko-burmanski jezik kojim se govori u severnoj Burmi i u Junanu
3011,Mrtvo telo ljudskog bića.
7472,oklopnik miš
9575,udeo u profitu
18224,Uspravna biljka koja se gaji zbog velikog pljosnatog zrna koje se koristi u ljudskoj i stočnoj ishrani.
16850,Skoro bezlisni pustinjski žbun koji ima svedeno lišće (nalik krljušti) i crveno mesnato seme.
13026,"Vrsta tankog hleba koja se pravi od kukuruznog ili pšeničnog brašna, bez kvasca."
13674,zaliv u Tihom okeanu između Aljaskog polusotrva i arhipelaga Aleksandar
1389,bizamski pacovi
17629,revolucija koju je predovdio Fidel Kastro i njegova gerila protiv korpumpiranog diktatora (1956-1959)
10714,Prestonica Narodne Republike Kine; drugi po veličini grad u Kini.
1722,mali komadić papira koji treba da otpadne kada se izbuši rupa na kartici ili papirnoj traci
6870,mesto bogosluženja koje se povezuje s nekom svetom stvari li nekim svetim čovekom
7114,"Bilo koja od brojnih niskih biljaka koje prave jastučiće iz roda Draba, imaju lišće u obliku rozete, male cvetove i lisnate stabljike."
8341,Osoba u srodstvu sa drugima.
10373,delimično razgrađena organska materija; organska komponenta tla
15788,od pre 500 miliona do 425 miliona godina; konodonti i ostracodi i alge i morske trave
3236,kukuruzar
8463,Prirodni objekat koji se vidi na nebu.
16272,Jestiva emulzija zrnaca masti dobijena od bućkanja mleka ili kajmaka; za jelo i kuvanje.
97,javno obaveštenje o nečemu što se dogodilo ili će se dogoditi
6491,naučna oblast koja proučava magnetizam
111,Stvoriti mišljenje o nečemu ili preneti stav.
11783,koji se odnosi na Damask i njegove stanovnike
6302,glagolski oblik koji označava trajnu radnju
1678,dijalekat engleskog kojim se govori u Škotskim nizijama
13233,Velika američka mačka koja podseća na lava.
12850,Zanimanje za koje je neko plaćen.
3467,čin prihvatanja i odobravanja; povoljan prijem
3320,Koji podvrgava (nekog ili nešto) uticaju ili kontroli.
6584,Familija gljiva čiji ???
8617,Uspravna jednogodišnja evroazijska zeljasta biljka.
17393,Mišič pomoću koga se odmiče kost.
18867,"zajednički naziv za razne mentalne poremećaje kod kojih je prisutno bolesno osećanje straha, napetosti i nesigurnosti"
13047,Jedinjenje koje se dobija tako što se vodonik u kiselini zameni metalom ili radikalom koji se ponaša kao metal.
1859,Igra koja uključuje kockanje.
2939,Ljuskar koji obično ima 5 pari lokomotornih dodataka od kojih je svaki spojen sa delom toraksa.
16228,izvršiti ceremoniju braka
15575,"Membrana, kakva je ćelijska membrana, koja dozvoljava da neki molekuli kroz nju prolaze, ali ne svi."
7100,uređaj koji proizvodi paru ili gas
18936,Podatak o nekom fizičkom stanju koji se korisniku prezentira na metru ili nekom sličnom instrumentu.
3487,Tvrd i gladak mineral izgrađen od silicijum dioksida u kristalnoj rešeci.
4927,Red vodenih insekata maljavih krila i dugih pipaka.
8589,kratak opis nekih vesti
8651,Obrazovanje koje se prenosi kroz seriju časova.
5686,Muva čije larve žive kao paraziti na gusenicama i drugim insektima.
7631,koji se odnosi na vaše mišljenje o društvenim odnosima koji uključuju vlast ili moć
9360,pokrivač napravljen od tkanine
6812,čin kojim se nešto primenjuje
9803,rameni deo svinje često dimljen
19317,mehanizam odbrane koji se sastoji u usredsređenosti osobe isključivo na intelektualni aspekt problema da bi se blokirao emicionalni stres I konflikt
18213,"U fizici, termodinaička veličina koja koja je jednaka kapacitetu fizičkog sistema da vrši rad; jedinice za energiju su džul i erg"
143,Ud kod čoveka; obično se koristi za celi donji ud.
10401,tekst sa osnovnim elementima (koji polako približava temu čitaocu)
2868,"Listopadno drvo sa glatkom korom, obično srebrnastosive boje; lipe."
4501,jedna od gusto pakovanih ćelija koje formiraju epitel
17914,Komunikacija izgovorenim rečima.
15324,uski kanal koji povezuje dve veće vodene površine (obično mora)
14322,piće koje se pije pre jela za otvaranje apetita
1278,Ne pristati na prihvatanje ili priznanje nečega.
13476,jedan besplatni pregledač
15176,"(jidiš) Hrskava zemička sa glazurom, okruglog oblika sa rupom u sredini u čijoj pripremi se koristi kvasac."
17525,"rat na Krimu između Rusije s jedne strane i Engleske, Francuske, Turske i Sardinije s druge strane; 1853-1856"
17861,grana geologije koja izučava oblik zemlje i određuje tačne pozicije geografskih tačaka
16757,Diskusija čija namera je da dovede do sporazuma.
16086,"Identifikovati, na primer, kao u botanici ili biologiji."
8032,Izraziti rečima.
11131,relativna pozicija ili stepen vrednosti u ocenjivanoj grupi
5710,dijagnostička procedura kojom se X zracima otkrivaju promene lii tumori na grudima.
4228,"dugačka, masna haringa malo usoljena i kratko dimljena"
9543,Islamska republika na Bliskom istoku u zapadnoj Aziji; Iran je bio centar aničke imperije poznate kao Persija do 1935. godine; bogat naftom.
2339,rat u kome su Atinjani i njihovi saveznici poraženi od Sparte; 431-404 pre nove ere
17109,preneti ili izraziti značenje
13851,zaslađeno isušeno mleko
7443,"prelaz (u književnom, pozorišnom ili filmskom delu) na raniji događaj ili scenu koji prekida normalno hronološko razvijanje priče"
16333,Mali kružni otvor između želuca i dvanaestopalačnog creva.
4178,Trave ili grmlje.
4762,proučavanje efekata ekonomske geografije na moć države
2591,Neki mali kukac koji grize: ?midges; ?biting midges; black flies; papadaći.
17151,dodatak testamentu; testamentarni dokument koji ima za cilj da izmeni već izvršeni testament
18617,Organi i tkiva koja su uključena u cirkulaciju krvi i limfe kroz telo.
2874,jedna od država koje čine Australiju
12695,deo ili odeljak putovanja
18890,Jedno od para peraja koje je smešteno odmah iza glave kod riba i pomaže im da kontrolišu pravac kretanja.
19114,font kod koga različiti karakteri imaju različite širine
6422,izaziva npr. evropske i azijske povratne groznice
18147,"Široko rasprostranjen? južne Evrope koji ima ?racames koji se ne granaju; cvetovi su plavi, nekad purpurni ili ružičasti; ponekad se smešta u rod Delphinum."
5394,koji uključuje ili je karakterističan za kritiku ili kritičare
18504,"U nekim klasifikacijama uključuje Viscaceae: paraziti ili poluparaziti, malo drveće ili grmlje u tropskim ili umerenim predelima; za domaćina se kači pomoću?"
12577,mešavina alkohola jačine 60 stepeni Farenhajta
12895,meteorologija ukupnog opsega atmosfere - posebno gornjeg sloja
1746,ispuniti ili anulirati dug
13961,osoba koja profesionalno komponuje ili izvodi muziku
2083,Neko ko profesionalno radi fotografije.
5757,"Godišnja ili višegodišnja biljka sa više ili manje sočnim stabljikama; široko rasprostranjena, nema je samo u Južnoj Americi, Australiji i na Novom Zelandu."
18634,novčana jedinica Libije
6530,Hrana koja sadrži puno šećera.
15702,Dikotiledoni rod biljaka koje pripadaju prodici Bignoniaceae; imaju velike cvetove u dugačke? plodove.
71,Emocionalna poremećenost; osnovno osećanje koje ljudi pokušavaju da izbegnu.
18793,zapadnogermanski jezik kojim se govori u Holandiji
11694,Patuljasta mediteranska jednogodišnja biljka koja se odavno gaji zbog aromatičnog semena.
10144,pisati pomoću tastature sa tasterima (dirkama)
12959,provodnik koji prenosi električne ili optičke signale
9218,putovati unazad
7726,"u grčkoj mitologiji nimfa jezera, izvora, reka i fontana"
13384,korak pri hodanju ili trčanju
13731,"grupa od tri japanska ostrva u severozapadnom Tihom okeanu, severno od Marinaskih ostrva"
14790,Govoriti tiho ili nejasno.
8851,Začinjeni preliv koji se služi kao dodatak uz jelo.
9081,Specijalna grupa koja je delegirana da razmotri neku stvar.
5076,"Uglavnom bezopasne zmije, žive u umerenim ili tropskim predelima."
19468,Proces očvršćavanja magmatskih rastopa.
17618,"spajanje, kombinovanje dveju ili više samostalnih melodija u jednu harmonijsku celinu"
10226,Višegodišnja lukovičasta zeljasta biljka iz starog sveta.
12404,(filozofija) doktrina prema kojoj se značenje kakvog predloga sastoji od operacija uključenih u dokazivanje ili primenu tog predloga
3358,student starogrčkog i latinskog jezika
5691,Konj riđe dlake.
13703,Lagan dodir rukom.
15987,Prestonica Moldavije.
13124,spisak zaposlenih sa njihovim zaradama
13829,Neka severnoevropska orhideja iz roda Ophrys.
16047,"brat blizanac Romula, osnivača Rima"
17200,"lek koji kontroliše ili ubija neoplastične ćelije, koristi se u hemoterapiji za ubijanje kancerogenih ćelija, svi imaju nepoželjne nus-efekteat may include nausea and vomiting and hair loss and suppression of bone marrow function"
5338,samleveno goveđe meso
18340,Neki cilje koji se želi neposredno postići.
14051,modrozelene alge
15205,stanovnik ili poreklom iz Alžira
8516,Mali rod višegodišnjih cvornatih biljaka iz tropske Azije: taro
5681,stanovnik Tunisa ili poreklom iz Tunisa
9296,kuvati (povrće) kratko u vodi
15183,pecanje sa kukom i udicom (i obicno drškom)
3648,Potpuno izdiderencirana strukturna ili funkcionalna jedinica kod životinja koja je specijalizovana za neku određenu funkciju.
19366,Beskičmenjaci koji imaju člankovito telo i hitinski oklop.
4723,Gostionica koja se sastoji od bara i trpezarije gde se služe laka jela.
9884,Smesa za palačinke koja se peče u posebnoj posudi koja napolitankama daje karakterističan izgled (utisnute četvrtaste šare na površini).
10493,bilo koji uglavnom vodeni artropod koji obično ima segmentirano telo i hitinsku ljušturu
4239,"Posebna sekcija zakonskog dokumenta, kakvi su statuti, ugovori ili testamenti."
9633,Obratiti posebnu pažnju.
1315,nemasno meso nekoliko vrsta riba koje se nalaze u toplim Atlantskim vodama
6191,Osoba koja vlada ili koamnduje.
513,sudski nalog izdat na zahtev jedne strane u postupku kojim se nalaže svedoku da podnese sudu (pod zakletvom) svu relevantnu dokumentaciju koju poseduje a koja se tiče svedočenja
3810,uređaj koji je veoma koristan za određeni posao
14378,prouzrokovati genetičku rekombinaciju
56,osoba ili firma koja zapošljava radnike
1288,koji se odnosi na brojni sistem s osnovom 16
14071,Najformalnija haljina koja se nosi na balu.
9500,Čin povlačenja; primena sile da privučete nešto sebi ili sa sobom.
11688,"desiti se, dešavati se, događati se"
4766,Višegodišnja biljka iz starog sveta koja se gaji zbog upadljivih cvetova.
14886,Instrumentalisi ne uključujući gudače.
11421,biće koje je delimično smrtno delimično božansko
9200,salata obično napravljena od jabuka i celera sa orasima ili suvim grožđem prelivena majonezom
17134,Dosta se gaji u umerenim područjima zbog jestivog zrna.
8260,Porodica Artropoda iz reda Hymenoptera koja uključuje ose i?
18723,koji odstupa od opšteg ili uobičajenog poretka ili vrste
4379,Kako dugo nešto postoji.
7527,Mesto za sakupljanje i prikazivanje predmeta koji imaju naučnu ili istorijsku ili umetničku vrednost.
10207,"rashlađeno piće koje se najčešće pravi od džina i voćnog soka, služi se u visokoj čaši"
7855,grupa čadskih jezika kojima se govori u Čadu
486,deo tela insekata koji nosi krila i noge.
11297,state of being torn or burst open
10077,u grčkoj mitologiji Muza komedije i pastoralnog pevanja
17577,"Red glodara koji uključuje: činčile, morsko prase, dikobraze."
6945,"u računarstvu, baza podataka kojoj se može pristupiti putem računara"
468,ime koje se daje proizvodu ili usluzi
5046,Rod trava iz porodice Gramineae.
17843,čovek koji učestvuje u igrama na sreću i u to ulaže novac
8647,ubistvo rivala
6995,Siser nalik mački koji luči cibet koji se koristi u parfemima.
7489,serija ratova koji su se neprekidno vodili između Francuske i Engleske; 1337-1453
12385,Rod porodice Pinaceae: veliki rod pravih borova.
3854,Osoba koja krši morlne ili zakonske norme.
11990,stanovnik Argentine ili poreklom iz Argentine
13467,Mlada ovca.
6079,Abnormalna nova masa tkiva koja nema nikakvu ulogu.
12336,Društvena ptica čije perje ima tamnu metalnu boju; gnezda gradi oko naseljenih mesta; široko je rsprostranjena.
13261,Zimzeleno drvo ili žbun koji rađa uljast plod koji ima jednu košticu.
12529,Planinska republika u južnoj Evropi; ranije deo Otomanskog carstva i deo Jugoslavije; stekla nezavisnost
1363,Koji se odnosi na specifično polje akademskog izučavanja.
5336,Zgrada gde ljudi jedu.
787,Poreklom verovatno iz južne Kine; rasprostranjena u celom svetu kao voće za jelo i za spravljanje sokova.
16585,delo literarne proze koje priča o sledu povezanih događaja
8046,Podvrgnuti pretrazi.
6435,"koji se tiče Nepala, njegovih ljudi i kulture"
16699,Cvrčci.
14032,aromatični gomoljasti plod koji se koristi u ishrani ali i sveži listovi u salatama
19282,jedinica za učestalost; jedan herc ima periodu ponavljanja od jedne sekunde
5318,pesma čiji stihovi počinju slovima alfabeta u pravilnom redosledu
11258,Visoka evroazijska trava koja ima žute cvetove nalika na belu radu sa uskim laticama čiki rizomatski koren se koristi u medicini.
5862,bolest koja je stalno prisutna u većoj ili manjoj meri u određenoj populaciji ljudi ili kod ljudi koji žive na određenom području
17165,"postatio zreo, dostići puni razvoj"
172,zamena za benzin koja se sastoji od 90% benzina i 10% žitarskog alkohola od kukuruza
7871,oklopnici; američki mravojed; lenjivci.
13600,čorba od junetine
15513,anatolski jezik
1783,tanke pileće šnicle punjene sirom i šunkom i potom kratko dinstane
4803,biber koji se dobija mlevenjem oljuštenih zrna bibera
8359,osloboditi od instrukcija ili podataka
4006,"u lingvistici, reč koja je izvedena iz druge reči"
17981,krupnozrna metamorfna stena sa slabo izraženom ili diskontinuiranom folijacijom
444,Tačka gde vodeni tok utiče u veću vodenu površinu.
693,Učiniti da se nešto podeli ili odvoji.
17100,listovi tamno zelene boje koji mogu da se kuvaju ili se jedu sirovi u salatama
13570,"Neka zeljasta bilja koja se gaji zbog jestivog ploda, korena, lista, semena ili pupoljaka."
4431,"francuski kojim se govori u Kvebeku, Kanada"
2415,"za tehničke uređaje ili procese, koji ima dva dela"
12941,prst na ruci između kažiprsta i prsta na kome se noci prsten
6,Lepota koja je privlačna čulima.
4977,Nezavisna država Britanskog Komonvelta; stekla nezavisnost od Ujedinjenog Kraljevstva 1907. godine; poznata known po ovcama i veličanstvenom krajoliku.
905,Koji se tiče tela ili je karakterističan za telo nasuprot duhu.
10971,tanak oštri instrument koji se koristi za uzimanje
16352,"Domaći šupljorogi preživar; životinje kao grupa, bez obzira na pol i starost."
5300,"žuti mineral (As2S3) koji se javlja zajednoi sa realgarom, ruda arsena"
2755,hemijska reakcija u kojoj se hidroksilna grupa (OH-) i vodonik vezuju za dva atoma ugljenika koji su kovalentno vezani dvostrukom vezom; obično ireverzibilno
16421,tržišta vrijednosnih papira uzeta u celosti
17497,najveća reka u severnom Sibiru; uliva se u Opski zaliv u Karskom moru
13253,Niska evropska trava sa malim žutim cvetovima.
752,"kontinentalna država na severozapadu Afrike, stekla nezavisnost 1960"
110,Osećaj koji se doživljava u očekivanju nekog određenog bola ili opsasnosti i obično ga prati želja da se pobegne.
16303,Koginitivni proces donošenja odluke.
18856,potomak roditelja različitih rasa (naročito belih i indijskih roditelja)
6170,mesnato tkivo koje okružuje usta
3242,meso američkog bizona
15940,"interfejs koji se sastoji od standardne priključnice između računara i njegovih perifernih uređaja, a koji se koristi na nekim računarima"
457,porodica severnoameričkih indijanskih jezika jako raširena na srednjem zapadu među Kado narodima
8992,koji je u takvoj pozocji da su vrh i dno obrnuti (ili unutrašnjost i spoljasnjost)
11907,Tipski rod porodice Myxinidae (inger)
7013,prvi deo nekog saopštenja
10368,Porodica koju čine sisari.
12094,Biljka-puzačica koja sporo raste; ima polu-zimzeleno lišće na uzdignutim žičastim stabljikama; koristi se za pokrivanje zemljišta.
1542,pročišćen puter bojen lagano i začinjen sokom od limuna i peršunom
7488,signal koji uključuje vizuelnu komunikaciju
18078,Rod familije Verbenaceae.
1844,osnovna novčana jedinica Indije
223,bez nade ili skoro bez nade
2826,(za grupu ljudi) koji često putuju i menjaju stana
14857,"opirati se, pogotovo na zbunjujuć način"
14968,Neka od brojnih ptica pevačica koje jedu semenke; poreklom iz Evrope ili Severne Amerike.
4380,administrativna jedinica u kojoj je sedište savezne vlade
16572,uzrokovanje da se nešto stalno pomera sa jedne na drugu stranu
9545,porodica južnoameričkih indijanskih jezika kojima se govori na severoistoku Južne Amerike
6272,put kojim se mogu prenositi signali
252,Stanje bolje od ranijeg.
12288,energija koja se dobija od vetra (npr. od vetrenjača)
4687,Velika otvorena posuda za vodu.
12237,Razmisliti duboko o nekoj temi.
15420,kvalitet da je šta opšte ili široko rasprostranjeno ili da ima opštu primenljivost
4323,"Jedinica informacije koje sadrži otprilike jednu milijardu (1,073,741,824) bajtova ili 1024 megabajtova."
16606,Porodica Capromyidae.
433,odbijanje grupe ljudi da poštuje zakon jer smatra da je zakon nemoralan (npr. u znak protesta protiv diskriminacije)
3903,Ljudi koji dele neke društvene odnose.
19459,Omiljeno stecište na kome se xudi okupljaju.
1172,"Slatkovodna riba mekih kostiju, sa bezubum čeljustima."
662,Drvenaste loze koje imaju kraj hvataljke u obliku diska.
10030,Članak u kome se saopštavaju vesti.
18958,"sos začinjen seckanim peršunom, vlašcem, estragonom, vlašcem i kaprom"
8323,glavni i najveći grad Malezije
11831,"koji se tiče Tunisa, njegovih ljudi i kulture"
15541,"koji se tiče Holandije, njenih ljudi i kulture"
5806,računarski program koji prevodi instrkcije višeg programskog jezika u mašinski jezik
17388,porodica lišajeva koja uključuje rodove Usnea; Evernia; Ramalina; Alectoria
3986,Rod niskog drveća i žbunja iz porodice Staphylaceae.
11124,Formalna organizacija ljudi.
870,Oruđe koje čini izduženo drvo.
1641,morska ptica severnih mora koja ima kratak vrat i trouglasti kljun živih boja
751,simptom koji se pojavljuje i postaje vidljiv
14987,Dva imena za podred tipičnih ptica pevačica.
6185,jestivo meso različitih vrsta kraba
3684,Lišće duvanske biljke osušeno i pripremljeno za pušenje ili žvakanje.
17330,jedrilica sa jednim jarbolom koji je postavljan više unazad nego kod obične jedrilice
7418,sistem ili oblik kojim se upravlja društvom ili drugim političkim jedinicama
11668,slatka jabukovača zagrejana sa začinima i citrusima
9998,"Tipski rod porodice Oxalidaceae; veliki rod biljaka čije lišće podseća na detelinu, cveće može biti raznih boja, obično je u grozdovima."
6821,koštani izraštaj razvijen blizu gornjeg kraja femura za koji su zakačeni mišići
8084,"rano prolećno cveće; mirišljavo, žute ili ružičaste boje"
5588,o alografima ili koji se odnosi na alografe
179,"učiniti da se (tečnost) rasprska, naročito upotrebom velike sile"
1650,Polemoniaceae; Solanaceae; Boraginaceae; Labiatae; Lentibulariaceae; Pedaliaceae; u nekim klasifikacijama uključuje red Scrophulariales
248,Korisna ili vredna osobina
5635,"koji se tiče Svazilenda, njegovih ljudi i kulture"
6537,Bilo koja komunikacija kojom se kodira poruka.
3898,"Rod penjačica iz umerenih područja: graholika, divlji pasulj."
2797,"elektromagnet, npr. n magnetofonu, koji konvertuje električne varijacije u magnetne koje se mogu uskladištiti na neku površinu i kasnije pronaći"
11112,figura u ravni koju čine dva poluprečnika kružnice i pripadajući luk
16075,"Vrlo rasprostranjena porodica uglavnom tropskog drveća, žbunja i trava; uključuje kafu, kininovac, gardeniju i broć."
10897,osoba koja zagovara političku filozofiju progresa i reformi i zaštitu građanskih sloboda
9301,Neka od mnogih ptica sa dugim nogama koje gacaju po vodi u potrazi za hranom.
