,Sysnet
93,federalni republika u unutrašnjost centralni Evropa . 
8876,neki ko kreirati nov ples . 
704,notacija koji se koristiti u matematika 
3040,osoba koji pisati reč pesma za pevanje 
13404,specifikacija princip dizajniranje koji uključivati format podatak i procedura za kreiranje mrežni konfiguracija za obrada podatak 
10281,Teško raditi . 
7991,porodica indoevropski jezik koji uključivati slovenski i baltske jezik 
14277,žbun ili mali drvo iz rod Gardenia ; imati velik mirišljav beo ili žut cvet 
13815,Sličan kuna zlatica ; nekada živoe u Sibir ; imati gusto tamnosmeđ krzno koji se veoma cena . 
7942,koji se odnositi ili jesam karakterističan za Danska ili Danac 
12605,Čin ubeđivanje ( ili pokušati ubeđivanje ) . 
14461,tapir i izumro vrsta . 
5230,Doći do odluka . 
105,proizvesti smeh . 
2746,pokušavati da se sprečiti otkrivanje ( posebno od strana policija ) 
3832,velik evropski puh 
9482,napraviti ili napisati napomenuti o nešto . 
10998,koji se ticati glavnog grad sjedinjen Američkih Država 
11833,liska 
7630,( prava ) prava i ovlašćenje za tumačenje i primena zakon 
438,porodica Artropoda iz red Hymenoptera koji uključivati osa i ? 
4814,biljka iz rod Thymus 
15081,biti koji proces koji uticati na proizvodnja i razvoj i upravljanje materijalan bogatstvo 
4331,o hormon ili koji se odnositi na hormon . 
15233,Čin pribavljanje nešto . 
2677,kratak strofa koji se završavati odrediti oblik pesnički delo 
15209,Država na ostrvo Kipar ; @card@ % stanovništvo jesam grčki poreklo a @card@ % turski poreklo . 
10363,ugašen vulkan na ostrvo Honšu 
6260,običan evropski šumski muharica sa sivo-smeđim perje 
11423,karakter koji služiti da označiti unakrstan referenca ili fusnota 
9938,Udaraljka ; obično se sastojati od šupalj cilindar na koji jesam oba kraj prevučen koža . 
13010,arapski prork koji jesam osnova islamski vera ( @card@ ) 
3069,kardinal . 
6932,novčan jedinica Malezija 
6816,stanovnik Kazahstan ili poreklo iz Kazahstan 
12417,znak interpunkcija ( - ) koji se koristiti između delovati složenica ili između slog reč kada jesam reč podeliti na kraj redak 
11561,posmatrati kao oka 
13936,"dug , neprekinut traka koji se obično pružati horizontalno . "
2300,mali digitalan račnar zasnovati na mikroporcesorima konstrisan tako da moći da ga nositi samo jedan osoba 
9807,rasa mali nežan konj koji obično nizak od pet stopa . 
16455,uređaj koji uklanjati nešto iz nećega što kroz on prolaziti 
4708,ukloniti posvećenost sa osoba ili objekt . 
3874,Surlaš sa pet nožni prst . 
5360,odrasti muški osoba ( nasuprot žena ) . 
13051,stanovnik Butan ili poreklo iz on 
14965,kukac kratkokrilac koji se obično ponašati grabljiv ili strvinarski . 
16672,potpun grupa sličan stvar . 
13394,"mali australijski torbar sa duguljast i šiljat njuška , dugačak jezik i kitnjast repa ; hraniti se mrav ; živiti u južnoj i zapadni Australija ; skoro jesam istrebiti . "
2735,sredstvo ili naprava čiji jesam zadatak da sprečiti začetak 
14324,Nešto što ostajati na površina tečnost . 
7535,Tačka na površina zemlja . 
16865,vrsta mali sisara crn dlaka koji živipod zemlja i imati prednji noga i riti prilagoditi za kopanje . 
13260,otvor koji ličiti na usta ( kao otvor pećina ili klisura ) 
11569,elektronski oprema koji jesam u direktan komunikacija ( ili pod kontrola ) centralni procesor 
16273,Dan na koji se ne raditi po običaj ili zakon . 
559,raditi zajedno sa drugi . 
6870,porodica tonski jezik koji se govoriti u istočni Azija 
2147,upotreba termografije za detekcija tumor gruda . 
7734,onaj koji oblik podsećati na kvadrat 
2861,"prestonica i velik grad Srbija , Srbija i crn Gor i bivši Jugoslavija . "
16178,kratak objašnjenje uz ilustracija 
10106,kontraceptivan sredstvo koji se smeštati u materica žena 
1212,koji podvrgavati ( neki ili nešto ) uticaj ili kontrola . 
2417,"zadnji jesam on noga duže od prednji ; ušni školjka jesam on mali . , a rep kratak ; živiti u manjiti zajednica i par . "
15250,grupa međusobno povezan država na sever Evropa ; ponekad se i Finska i Island ubrajati u Skandinavija 
8441,rod porodica Perdicidae 
6320,u grčki mitologija boginja plodnost koji se kasnije povezivati sa Persefona kao boginja podzeman svet i zaštitnica veštica 
8344,namotati na kalem ili špulnu 
10558,neki od evroazijski biljka iz rod Helleborus . 
16552,naziv pod koji jesam poznati kakav geografski lokacija 
16522,zvaničan državni jezik Nepal 
9179,prostor koji jesam unutar nešto . 
16671,socijalista koji jesam napisati Komunistički manifest sa Karla Marks @ord@ godina ( @card@ ) 
6836,Bilja nanati . 
11109,postati namočiti 
2044,osnovni novčan jedinica na Bahami 
15819,poslovan objekt za zabava 
7839,"morski riba sa velik i širok glava , crvenkast boja sa otrovan štrim bodlja . "
12138,Sekvancija od @card@ bit ( dovoljan da se predstaviti jedan alfanumerički karakter ) koji se obrađivati kao jedan jedinica informacija . 
10830,grana antropologija koji pružati naučni opis pojedinačan ljudski društvo 
14625,dodeliti koji akademski diploma 
15400,ljudi koji deliti neki društven odnos . 
4809,glodar rovaciz star i nov svet koji uništavati usev 
16356,"esej , članak ( posebno onaj napisati kao zadatak ) "
4646,red biljka iz podklasa Asteridae koji uključivati : Campanulaceae ; Lobeliaceae ; Cucurbitaceae ; Goodeniaceae ; Compositae . 
15925,jedan od dva delo igra koji deliti pauza 
14870,pravougaon blok od glina pečen na sunce ili u peć ; koristiti se za gradnja ili popločavanje . 
5188,pribor za pisanje koji imati vrh sa koji kapati mastilo . 
6874,koji pripadati ili se odnositi na nacija ili država 
14804,federacija sedam arapski emirat na istočni arabijski poluostrvo ; steći nezavisnost od ujedinjen kraljevstvo @ord@ godina ; bogat rezerva nafta . 
12654,hleb koji sadržati fino mleti crn luk . 
222,koji nemati ili ne obavljati funkcija . 
1526,osoba koji uzgajati ili čuvati ovca . 
3002,plovan kožica jesam razviti i prelaziti preko vrh prst ; zadnji ud moći da saviti pod trbuh ; imati mali ušni školjka . 
10882,čin koji se neki iskorišćavati ili maltretirati 
13571,"Metvulja , ? horsemint , ? beebalm "
2088,algonkinski jezik koji govoriti Čejeni 
5414,prevlaka na severoistok Egipat koji povezivati Egipat i Afrika 
3966,zimzelen drvo sa crven bobica and pljosnat igličast lišće . 
868,zaliv atlantski okean na jugozapadni stran Afrika 
16926,broj ili nizak broj koji se koristiti za identifikacija . 
6043,toalet kakav jesam nastati u engleski 
729,knjiga koji koristiti da biti dobiti verodostojan podatak . 
16750,"arhipelag na zapad Sredozemnog morati , kod istočni obala Španija "
8175,"grana matematika koji se baviti izučavanje fizički , biološki ili sociološki svet "
60,"koji imati veseo karkater , jesam sklon briga . "
17134,Živa u reka ili priobalan područje . 
15135,redni broj element u Mendeljejevoj tablica element ; jednak jesam broj proton u jezgra ili broj elektron u neutralan stanje atom 
11404,kamen koji se koristiti za označavanje grob 
9150,"Muzički instrument s metalan žica , vrsta lira . "
2191,"radioaktivan gasovit element koji nastajati dezintegracija radijum , težak od inertan gas , imati ga u priroda , smatrati se štetan za zdravlje . "
6308,biljka poreklo sa Mediteran sa dubok koren ; imati plav cvet i perast list ; gajiti se zbog dugačak sladak koren . 
209,lepota koji jesam privlačan čulo . 
16490,otvoren prostor na vrh kuća tik ispod krov ; 
6304,rod iz familija Alligatoridae . 
6383,u anatomija brazda ili kanal na telesni struktura ili delo telo . 
6898,meso odrastao domaći goveče 
1075,"uređaj koji se sastojati od skup taster ili dirka na pisaći mašina , slovoslagaćoj mašina ili računar "
16676,Otpočeti razgovor s neki . 
4941,čin koji teolog smatrati kršenje Božje volja 
14957,pretvoriti u dramski oblik 
2670,drven duvački instrument ( iako jesam od lim ) s jedan jezičak ; u oblik lula ; s mehanizam za pokrivanje rupica . 
462,ustanova koji uključivati zemljište i oprema za pružanje obrazovanje od zabavište do srednji škola . 
11393,severni ogranak germanski jezik koji se govoriti u Skandinavija i na Island 
197,motor koji pretvarati toplotni energija u mehanički rad . 
4990,motor sa spoljašnji sagorevanje u koji se toplota koristiti da podignuti para koji zatim pokretati turbina ili klip u cilindar . 
15567,u rimski mitologija boginja poljoprivreda ; u grčki mitologija ona odgovarati Demetar 
15402,mašina za kopiranje koji slati poruka putem telefon ili radio signal 
9065,beskrajan traka od fleksibilan materijal između dva rotirajući uređaj 
3747,Službena kuća neki važan osoba ( kralj ili predsednik ) . 
14833,orhideja umeren i tropski kraj koji imati klas belo-žutog cveće . 
3976,afiks koji se dodavati na početak reč 
1231,biti koji od mnogobrojan biljka rod Rosa 
5907,Jednogodišnja biljka sa beo cvet i jajast list . 
2299,visok evroazijski trava koji imati žut cvet nalika na beo rad sa uzak latica čika rizomatski koren se koristiti u medicina . 
1552,o pogreb ili koji se odnositi na pogreb . 
7112,mravlji jež 
6238,ukazivač kao na brojčanik 
4337,štampač koji štampati pojedinačan stranica odjednom 
7263,merni instrument koji određivati količina toplota . 
4973,mali pregradak u odeća za nošenje mali predmet 
11902,u grčki mitologija Agamemnonova žena koji jesam naložiti da se on ubiti po povratak iz trojanski rat 
14292,pustinjski područje na severozapad Australija severni od Gibsonove pustinja 
4372,produžiti rok da se šta platiti 
14152,"biljka koji rađati velik mesnat plod , blag ukus , zvonast oblik . "
15643,"organ , žlezda ili mišić , koji postajati aktivan kao odgovor na nervni impuls "
3423,"zimzelen ili listopadan grm koji rađati bobica : borovnica , američki kljukva . "
17409,reč ili fraza koji se dopunjivati neki gramatički konstrukcija 
10275,"izdan jesam prirodan nakupnina slobodan podzeman voda koji moći da "" izdavati "" voda tj . da hrana izvor , reka , bunar i drugi prirodan i veštacke vodan objekt . "
11990,tipski rod porodica Dipsacaceae : češljuga . 
8207,"rod visok , uspravan ili razgranat američki godišnji ili veižegodišnjih zeljast biljka sa upadljiv cvet : suncokret . "
14575,neki divalj cveće iz rod Leontodon ; raset u umeren područje Evroazija i Mediteran . 
7462,Muzički instrument kod koji zvuk proizvoditi zatvoren stub vazduh koji se pokretati disanje . 
14017,sud koji jesam obično plesti i imati ručak . 
13135,"koji se ticati Niger , njegov ljudi i kultura "
9231,"solarni kalendar koji jesam uvesti u Rim Julija Cezar @card@ godina p.n.e. a zatim neznatan modifikovati Avgust ; utvrđivati se godina od @card@ dan koji jesam podeliti u @card@ mesec , pri šta svaki četvrti godina imati @card@ dan , a sav mesec imati @card@ ili @card@ dan , osim februar "
17132,Peščana zona koji se spuštati do voda morati ili jezero . 
40,gledati neki sa divljenje . 
13176,jedinica mera za masa . 
13208,rod iz porodica Accipitridae . 
16133,osnovni novčan jedinica Island 
3836,uglavnom mali višegodišnji paprat - papratka ; u neki klasifikacija smeštati se u Polypodiaceae . 
16652,ogroman istočno indijski voće koji podsećati na hlebni drvo ; njegov semenje se najčešće peći 
1567,udruženj ekoje jesam osnovano i raditi na dobrobit onaj koji ga koristiti 
15432,"osobina neki telo da u raznim smer imati različit fizički svojstvo , npr . elastičnost , indeks odbijanje svetlost , magnetizacija , toplotni provodljivost i dr. "
4618,uređaj čiji jesam list perforirati i kroz čiji prorez mastilo ili boja prolaziti da biti stvoriti odštampan otisak 
5373,mali deo koji moći da se posmatrati odvojeno od celina 
7079,drugi ime koji se u neki klasifikacija koristiti za porodica Mimosaceae . 
54,svaki šteta proisteći iz povreda prava 
6748,"ptica koji plov , plivati i roniti biti u slan ili sladak voditi . "
4901,plod morati u Njuburg sos poslužiti na tost ili pirinač 
17291,Škola u koji ljudi učiti da upravljati automobil . 
10603,Ispraznti nešto od tečnost . 
8650,dull-colored moth whose larvae Hava tufts of hair on the bodž and feed on the leaves of many deciduous trees 
7456,grupa ljudi koji živiti po pravilo vera 
17222,"porodica iz star svet iz rod Scilla koji imati uzak lišće i ružičast , plav ili beo cvet . "
32,onaj što jesam ispod standard i očekivanje u pogled moral ili pristojnost 
6528,tražiti of neki identifikacija da biti se proveriti da li jesam dovoljno star da moći konzumirati alkohol 
12996,osoba koji jesam šef džžave ( u nekoliko zemlja ) . 
6819,pića stvoren pomoću magičan moć ; moći da učiniti da onaj ko ga popiti zavoliti onaj ko on ga jesam dati 
10518,praksa kooperacija u koji se dvoje ili više ljudi udruživati radi međusoban pomoć ili sigurnost 
49,osnovni nočana jedinica u mnogi zemlja ; vrednost ona jesam @card@ centa 
227,Hava Or feel a dislike Or distaste for 
6258,kost kod gležna koji pomerati kosti noga oko gležanj . 
7765,novčan jedinica Saudijske Arabija 
14141,staklen cev zatvoriti na jedan kraj . 
7465,Društveni ili samostalan opnokrilac koji obično imati tanko telo sa abdomen koji jesam prikačiti uzak batrljicom uočljiv otrovan žokom . 
10145,pomalo gorak biljka list taman zelen boja i grupisan pupoljka 
3396,putovanje na svet mesto . 
275,veličina čiji se vrednost ne menjati 
7717,"trava upadljiv jak miris koji praviti travni pokrivač , rasti po evropski pašnjcima , u živica i pustopoljina ; lekovit biljka . "
9821,"u računarstvo , arhitektura računar koji imati relativno mali broj instrukcija ugrađen u šta CPU "
16920,( odnositi se na zvuk ili glas ) ; proizvoditi visok ton 
1106,koji se ticati unutrašnji stvar nacija 
1384,biti nepokretan . 
6526,"Lasica , samur "
5212,sivkast grlica sa crn traka oko vrata ; čest se čuvati u kavez . 
5255,"u računarstvo , sibol koji se pojavljivati na na ekran da ukazati da jesam računar spremati da primiti komanda "
8517,Pstonica i velik grad u Mađarska ; smešten na reka Dunav u severno-centralnoj Mađarska . 
7271,"plastičan kartica koji sadržati mikroprocesor koji omogucćava vlasnik da obaviti operacija koji zahtevati podatak uskladištiti u u mikroprocesoru , obično se koristiti za obavljanje finansijski transakcija "
15720,u grčki mitologija Muza istorija 
11728,amblem koji ukazivati na prava neki osoba da nositi oružje 
11557,korisnički interfejs u ​​kome se komanda ukucavati umesto da se birati iz meni ili da se izabrati ikona 
4894,koji se odnositi na drevan Teutonce i njihov jezik 
969,porodica dvosupnica iz red Urticales uključje rod : Ulmus ; Celtis ; planer ; trema . 
4103,"dobro začiniti loptica od mleven riba , jaje i prezla pržen u šerpa "
12851,tortilja od brašno koji se u koji se uvijati punjenje ili fil 
15371,voden drozd 
9744,praviti se od vazdušast ( lisnat ) testo . 
1707,tanak metalan pločica koji se koristiti da razdvojiti red slovo u štampa 
861,deo grad u koji se vršiti prodaja roba 
2756,mali komad mikrofilm na koji se smeštati mnogo stranica fotografsianog materijal ; sistema za uvećavanje se koristiti da biti se materijal pročitati 
10194,morski vidra . 
2493,"primaran suženje na hromozom koji spajati sestrinski hromatide . na centromeri se nalaziti proteinski struktura , kinetohor , koji se formirati na početak mitoze i imati uloga da vezati hromozom za deobni vreteno . ona usmeravati kretanje hromozom za vreme deoba pošto se za ona vezivati konac deobni vreteno . "
4720,pravni odnos koji postojati kada se jedan lice opravdano oslanjati na drugi ili kada se tražiti zaštita po biti koji osnova 
9357,donji rublja koji se sastojati od širok haljina koji jesam dizajnirati da jesam u krevet nositi žena 
13715,tipski rod porodica Balaenicipitidae : beleniceps 
4939,a Plant of the genus Aquilegia having irregular showy spurred flowers ; north temperate regions especially mountains 
17057,hemijski element iz grupa zemnoalkalnih metal 
161,pristajanje uz onaj što jesam opšte prihvaćen . 
1344,popis koji se reklamirati seme u komercijalan svrha sa cena 
2054,dravidski jezik koji se govoriti u južnom delo centralni Indija 
2142,napraviti manje ili više otvoren aluzija na nešto 
16539,električni prekidač koji funkcionisati pritisak na dugme 
9665,jedan vrsta : oleander . 
14252,tkivo koji se formirati u osnova nokat 
14164,postati suv ili suv . 
13685,šiber koji se mera mali razdaljina 
8697,"dug engleski reka , ploviti na istok , kroz London ka Severnom mora "
7820,Povrće čiji cvet imati oblik leptir ; obiyno se uključivati u porodica Leguminosae . 
7037,ravan površina koji jesam pod pravo uglaovima u odnos na okomit linija . 
8340,krupan penjačica koji se gajiti zbog mesnat narandžast okrugao plod sa čvrst kor i brojni semenka . 
17164,glavni izvor berilijum ; obojiti providan varijetet jesam na cena kao drago kamenje 
9662,samo jedan vrsta : brnistra . 
3519,velik crn ptica neletač Australija i nov Gvineja koji imati rožnat kresta na glava . 
11495,Čin u koji nešto gora 
12198,poklapati se sa red Pholidota . 
1968,"odnositi među živ organizam , a posebno ljudi . "
16167,ptica koji se loviti iz star i nov svet iz familija ? ; nastanjivati močvaran zemljistxa ; nalikovati detlić ? 
15174,jedan od četiri država koji činiti Ujedinjeno kraljevstvo Velika Britanija i Severne Irska ; smestiti na severni delo ostrvo Velika Britanija ; poznati po gajde i kilt . 
16751,"uglavnom morski aneldie , imati oba pola ... "
11622,pisma bazirati na alfabetski karakter 
7887,podvrgnuti pretraga . 
3147,"sfinkter bešika , sastaviti od zgusnut mišićni sloj bešika oko otvor ureter . "
57,Nešto što neki zadržavati . 
13166,pretvoriti u krečnjak 
10400,propisan broj 
5307,rod ? koji pripadati familija Pteridaceae . 
15884,"biti u sklad , harmonija . "
750,jedan od porodica u koji jesam porodica Polypodiaceae podeliti u neki klasifikacija ; uključivati rod : Blechnum ; Doodia ; Sadleria ; Stenochlaena ; Woodwardia . 
2696,New World vipers with hollow fangs and a heat-sensitive pit on each sida of the head 
5126,"Čupava uspravan zeljast biljka iz jugoistočni Azija , ali jesam rasprostraniti u svet zbog velik sjajan i jestovog plod koji se koristiti kao povrtati . "
202,flamingo 
14422,velik magmatski stena koji jesam nastati duboko u zemlja . 
15258,koji se osnosi ili jesam karakterističan za Egipat ili njegov ljudi i njihov jezik 
8724,indijski prilog od jogurt i seckan krastavac i začin 
15741,"riba iz tropski Tihog okean , sa živ prugamaizduženim bodljikav peraje . "
5463,haljina koji nositi prvenstveno žena u Indija - sastojati se od nekoliko metar lak materijal koji jesam obmotati oko telo 
3707,"praviti se od bujon sa sočivo , luka , šargarepa i celer "
11767,irokeški jezik koji govoriti narod Kajuga 
15769,voden površina okružen zemlja . 
10476,stoni digitalan računar za koji se obično smatrati da jesam velik mogućnost od mikroračunara 
7356,neki ko profesionalan radi fotografija . 
11584,Kupina puzavica severnik umeren područje sa žut ili narandžast bobica . 
11198,materija koji imati sposobnost ili tendencija da adsorbuje drugi materija ( adsorbat ) 
16156,sistem koji se sastojati od mreža komunikacioni kanal koji se koristiti u neki organizacija 
13851,"ubiti svaki deseti , kao pobunjenik u rimski vojska "
132,koji se protiviti pravilo ili usvojen praksa . 
683,velik aligator sa jugoistok sjedinjen država . 
13125,saviti ili poletati tako da jedan deo prekrivati drugi . 
12370,koji jesam jedan dimenzija značajan veće od drugi ; značajan dug nego širok 
3603,federacija u severoistočni Evropa i severni Azija ; ranije Sovjetska Rusija ; od @ord@ godina nezavisan država . 
4913,"republika u jugoistočni Azija na arhipelag sa više od @card@ , @card@ ostrvo ; steći nezavisnost od Holandija @ord@ godina ; glavni proizvođač ulja na Dalekom istok i u region Pacifik . "
17069,velik ord dekorativan biljka sa ? glava cvet ; raširiti po ceo svet . 
14835,mek meso u predeo krsta sa oba strana kičmeni stub 
7081,priča o neki ko istraživati zločin i dolaziti do dokaz koji voditi do rešenje 
7993,preterano velik 
6975,novčan jedinica Južne Afrika 
756,drvo tisa ; vrlo jesam ceniti za fin stolarski rad i rezbarija . 
6205,jabuka za jela koji podsećati na vrsta Mekintoš ; koristiti se i za jela i za kuvanje 
8195,"tajna ( metoda , uređaj ili formula ) koji proizvođač davati prednost nad konkurencija "
4303,Čovek koji voliti mnogo žena i sa ona imati kratak seksualan odnos . 
4957,Čvrsta ? sa beo cvet koji rasti u divljina u plitak svež voda sjedinjen američki država i Azija . 
9839,koji se odnositi na utopija ili ličiti na ona 
15522,"Brašno koji se dobijati mlevenje ceo zrno žito , uključivati i opna . "
13705,polica za držanje knjiga 
10128,kopnen glavonožac čiji se telo sastojati od brojni dvostruk članak od koji svaki imati par noga : stonoga . 
5019,koji se koristiti u obred žrtvovanje ili jesam povezati sa on 
4519,( o kosa ) koji imati talasast kosa ; 
53,uređaj koji isporučivati električni struja kao rezultat hemijski reakcija 
797,biti koji lek koji uništavati bakterija ili sprečavati njihov rast . 
2017,skoro izumreti kavkaski jezik koji se govoriti samo u Turska 
534,dozvola za ulazak ili izlazak iz vojni ustanova 
12622,vlasnik novina 
1788,a diacritical Mark ( an inverted circumflex ) placed above certain letters ( such as c ) taj indicate pronunciation 
2414,olovka čiji jesam vrh za pisanje napravljen od filc 
2571,listopadan drvo ili žbun iz Severne Amerika . 
1291,"ptica ; barski ptica dug noga , tanak , dugačak i na kraj zaobljen kljuna , zemljast boja perjati i vrlo ukusonog meso iz red štakara "
7954,nilotski jezik 
2411,glavni i velik grad Gan 
4433,Sem koji se uglavnom koristiti kao začin . 
3771,korateanski jezik narod Karok 
4622,porodica južnoamerički indijanski jezik koji se govoriti na severoistok Južne Amerika 
10670,osnovni novčan jedinica Gvatemala 
11238,naziv koji označavati plemstvo . 
1026,"iznenadan , kratak ( poput strujni udar ) nevoljan trzaj koji nastajati u centralni ( ređe periferan ) nervni sistema . "
9678,novčan jedinica Gan 
6603,tipski rod porodica Odobenidae : morž . 
10188,"krsta kod četvoronožni životinja , deo telo iznad zadnji noga "
7523,biti u mogućnost odreći se nešto ili ga pokloniti . 
5575,član ruski većinski levičarski grupa koji jesam slediti Lenjin i iz koji jesam nastati Ruski komunistički partija 
16870,jabuka koji se najčešće jesti nekuvan i nepečene 
10449,Godišnje doba kada lišće opadati sa drveće . 
16556,indikator za opšti orijentacija 
12035,mali rod godišnji zeljast biljka : koljenika . 
14127,stvarati muzički delo 
8732,merni instrument konstruisati da mera snaga . 
645,jedan od dva koren spinalnog nerv koji prolaziti dorzalno u kičmeni moždina i sastojati se od senzornih vlakno 
13411,"olabaviti , reći nešto stegnuti . "
16702,mali fleksibilan cev koji se ubacivati u telo da biti se omogućiti oticanje ili ubrizgavanje tečnost ili da biti prolaz ostati otvoriti . 
3708,glavni grad i važan luka Mauricijus 
4069,biti koji gljiva iz familija Boletaceae . 
7335,ulica u koji jesam vozilo dozvoliti da se kretati samo jedan smer 
16703,jedinjenje opisati u kategorija centarlnog atom za koji jesam drugi atom vezati ili uskladiti . 
12681,provodnik koji se koristiti da ostvariti kontakt se neki delom kolati 
14984,"ogranak Sredozemnog morati izmađu Slovenija , Hrvatska , crn Gor i Albanija na istok i Italija na zapad "
1473,Voće kuvati u šećeran sirup obložen kristal šećer . 
1163,pića sličan piva ; napraviti od fermentisanog sok manioke 
14472,"sladak varijetet šljiva , zelen ili zeleno žut . "
1287,kretati se prema neki ili nešto . 
14291,"osoba koji pomagati identifikovanje , prevencija ili lečenje bolest ili nemoća . "
13491,"onaj koji odgovarati određenoj osoba , mesto , stanje i sl . "
8144,neki rod reptil . 
13926,jedan od raznih vrlo cenjen jestiv podzeman gljiva rod Tuber ; rasti u jugozapadni Evropa . 
6236,"osoba odrediti vrsta , koji obično imati pun ekscentričnost . "
5550,drvo neki drvo iz rod Cupressus . 
834,loptast ili ovalan južno voće sa debeo riđkast korica i sočan žut ili crven meso 
8065,utvrđen sistem simbol koji se koristiti za zapisivanje nešto 
1161,umetnik koji se pridržavati klasicizam . 
5545,prebacivanje nešto u forma roman 
14110,mali predmet koji deo komplet koji se koristiti za igra na tabla . 
15657,akt koji se nešto činiti optimalan 
14815,shrikes that impale their prey on thorns 
88,Nešto odrediti prema nešto drugi što ga sadržati . 
7605,"razred dikotiledona koji uključivati porodica Moraceae , Urticaceae i Ulmaceae . "
16143,punč napraviti od zašećeren mleko ili pavlaka pomešati sa jaje i često alkoholni piće 
2388,biti koji period u tok koji jesam površina zemlja biti prekriven led 
1615,turkijski jezik koji govoriti Tatari koji živa između Volga i Ural 
4849,Čin stanovanje na jedan mesto . 
15322,u klasičan mitologija bog muški plodnost i zaštitnik bašta i vinograd 
10981,stanovnik Jermenija ili poreklo iz ona 
14065,rožnat ploča koji pokrivati i štititi dorzalni deo prst 
9434,"u računarstvo , mreža povezan računar "
10928,tipski rod porodica Scorpaenidae : škrpine . 
7318,meso sitan živina koji se gajiti za pečenje 
6650,grupa koralni ostrvo u istočni Mikronezija 
6299,izumro grana indoevropski jezik koji neki smatrati srodan sa jermenski 
1527,novac koji se ulagati uz očekivan profit . 
17171,tipski rod porodica Moraceae : dud . 
5042,mlad radikal koji podsticati reforma 
10397,mali list papir 
16694,rod trava nalik na trska čiji klasje jesam načičkati u ? prekriven sugačkim svilenkast nit . 
157,Ućiniti da se neki osetiti opušten . 
2065,proces zatvaranje ( kao u kapsula ) 
