,Sysnet
8719,Granica površine.
8191,stanje koje prethodi povraćanju
18381,turkijski jezik kojim govore Turkmeni
86,Pogodan trenutak.
18148,Ćelija koja se sastoji od masnoće.
17822,odnosi se na glagole koji izražavaju stanje ('biti' ili 'posedovati')
15162,Sređeno grupisanje stvari ili osoba posmatrano kao celina; rezultat uređivanja.
9203,"Anturium, filodendron,??"
3442,"u matematici, izračunavanje vrednosti funkcije izvan opsega poznatih vrednosti"
1467,trvdro aromatično drvo od drveta kedra;posebno se koristi drvo crvene boje za nameštaj
19043,gorušica; kupus; karfiol; repa; brokola itd.
15256,Jedna od četiri glavne strane sveta.
9263,"jedna od brojnih malih ravnih, jestivih riba Atlantskog okeana sa glatkom kožom"
13323,Hleb čije testo ne sadrži kvasac.
17157,izraziti zahvalnost ili pokazati poštovanje
7312,zvanični jezik Mađarske (govori se i u Rumuniji); pripada ugarskoj jezičkoj porodici
1739,komad zemlje gde se uzgajaju biljke
3069,Članovi društvene organizacije koji imaju vlast.
11835,Rod široko rapsrostranjenih zeljastih biljaka.
12043,zapaljiv bezbojni gasoviti alken; dobija iz petrola i prirodnog gasa i koristi se za paroizvođnju mnogih hemikalija; nekad se koristio i kao anestetik
12295,Sadži jednu vrstu: alpska azalea.
2279,pripremiti (nekoga) za buduću ulogu ili dužnost
2434,mineral koji se sastoji od aluminijum silikata; glavni izvor kaolina
3905,Anti-komunističke zemlje.
7304,O pogrebu ili koji se odnosi na pogreb.
8846,Uzdignuti se.
16850,pesma sa pričom ikoja potiče iz naroda
11378,tonski jezik koji se ne koristi kliznim tonovima
8474,"Doći nazad na mesto gde se ranije već bilo, ili se vratiti prethodnoj aktivnosti."
16435,"malo nebesko telo koje se satoji od stena i metala koji se kreću oko Sunca, uglavnom između Marsa i Jupitera"
15245,"skup koji je prazan, koji nema elemenata"
7339,Manić
5164,Zajednica ljudi manja od grada.
14748,"trexi po veličini okean; graniči se na zapadu s Afrikom, na severu s Azijom, Australijom na istoku, a meša se s Antarktikom na jugu"
16642,Geometrijsko telo omeđano sa dvanaest podudranih pravilnih petougaonka.
5868,parazit zglavkara i riba koji napada i uništava ćelije domaćina
267,osećanje seksualne ljubavi
3520,Sredstva za ubeđivanje ili argumentaciju.
4807,Izvršiti operaciju sabiranja.
15922,velika porodica srodnih jezika kojima se govori u Aziji i Africi
16981,"Osoba, ne mora biti supružnik, sa kojom neko živi i duže vreme ima seksualne odnose."
17957,nešto što je zapamćeno
1528,pomeriti glatko duž neke površine
19261,Vrlo veliki fazan-neletač jugoistočne Azije koji se često gaji kao ukrasna ptica.
1744,postati manji
16025,Suptropska penjačica koja se gaji u više varijeteta zbog velikog i slatkog gomoljastog korena koji ima narandžasto meso.
17811,Grbica koja se gaji za salatu i prilog.
8934,"hirurški nožić zašiljen na oba kraja; koristi za male rezove, npr. kod uzimanja krvi"
9561,Čin isplaćivanja novca.
15603,Bilo koja komunikacija kojom se kodira poruka.
10440,"drečavo jestivo voće sa pitaja kaktusa, ima svetlo crveno sok; često veličine breskve"
9270,uređaj koji se koristi za smeštanje stopala u cipelu
13104,hormon koji izlučuje pinealna žlezda
7222,"Porodica iz starog sveta iz roda Scilla koja ima usko lišće i ružičaste, plave ili bele cvetove."
10635,Azijski slon čiji mužjaci imaju manje uši i surlu.
6769,red u podklasi Telosporidia
706,"Očev ili majčin brat, tetkin muž."
16964,Neka biljka cvetnica iz mediteranskog područja koja se gaji zbog upadljivog cveća.
19420,započeti događaj koji je impliciran i ograničen prirodom ili inherentnom funkcijom direktnog objekta
9257,revolucija Američkih kolonija protiv Velike Britanije 1775-1783
14726,"uskladišten u centralnom računaru, kontrolisan od njega ili u direktnoj komunikaciji sa njim"
14004,Svojstvo posedovanja materijalne vrednosti: obično se iskazuje novčanim iznosom koji bi nešto donelo da se proda.
17883,Navlaka koja prerušava ili štiti lice.
1608,neko obučen u sastavljanju bibliografija
14427,grana filozofije koja analizira principe i procedure neophodne za vršenje istraživanja u određenoj disciplini
2684,deo osnovne novčane jedinice u više zemalja
9719,any of various beetles of the family (or subfamily) Melolonthidae
15864,soba u kojoj se drži zatvorenik
5359,druga po veličini država Južne Amerike
19193,stepen na nekoj skali
12964,Neka od brojnih široko rasprostranjenih malih ptica gacalica iz porodice Rallidae koje imaju kratka krila i vrlo dugačke prste na nogama za trčanje po mekom blatu.
13839,"zadnji, posteriorni deo konja."
10504,korišćenje statističke korelacije da bise izračunala jačina veze između promenljivih
1369,Dovoljno velik da bi se video golim okom.
313,Čin obavljanja nečega uspešno koristeći znanje.
4550,Čin kojim se nešto melje u prah.
14514,Rod iz porodice Cornaceae uključuje dren: višegodišne listopadno drveće i žbunje umerenih područja severne hemisfere.
13930,Morski beskičmenjaci sa šupljim stopalima i petorodelnim radijalno simetričnim telom prekrivenim kalcitom.
11315,Beloruki gibon
13266,Pripadnik policijskih snaga.
11722,grana molekularne biologije koja proučava korišćenje mikroorganizma za obavljanje specifičnih industrijskih procesa
10383,planinski lanac između Španije i Francuske
18618,prirodni otac ili majka
3786,koji je samo jedne boje
5104,Bolest koja se prenosi sa čoveka na čoveka.
220,stil plivanja koji liči na kraul samo što je plivač okrenut na leđa
222,Koji se ne povinuje prihvaćenim pravilima i standardima.
11064,natprirodne sile i događaji uzeti skupa
15858,Afrička hijena; poznata zbog tipičnog urlanja koje nalikuje na satanski smeh.
12396,javna srednja škola koja obično uključuje razrede od 9. do 12.
9371,kaiš koji zadržava ili ograničava slobodu (naročito nešto što se koristi za vezivanje ili zadržavanje zatvorenika)
3555,izbijati upadljivo iz nečega
15925,"Koji ima boju koja podseća na boju krvi, trešanja, paradajza ili rubina."
6815,Relativni položaj u stepenovanom nizu.
12546,Kriva koju stvara presek ravni i kružne kupe.
10815,Imati određenu cenu.
19007,prikupljeno delo nekog autora (obično se koristi u množini)
7876,beli ili crvenkast mineral koji se sastoji od hlorida potsijuma i magnezijuma
4371,Biljka koja raste iz lukovice ili ?corm ili ?rhizome ili ?tuber.
12477,gramatička kategorija zamenica i glagola čija je funkcija upućivanje na neposredne i posredne učesnike u govornoj situaciji
1265,o daktili ili koji je sačinjen od daktila
14511,onaj koji ima teksturu grubu na dodir ili se sastoji od relativno krupnih čestica;
12835,uzak izdužen otvor između dva simetrična dela
19027,tražiti ili tragati
27,Spojen ili vezan.
8122,Jestiva slatkovodna riba sa spljoštenim telom i sjajnom krljušti.
1788,Tropskigušter iz Novog sveta sa dugim repom i velikim pravougaonim krljuštima na stomaku i dugačkom repu.
1204,meso (naročito ovčetina) dinstano sa krompirom i lukom
6925,"koji se tiče Burundija, njegovih ljudi i kulture"
1853,dijalekat degihe kojim govori narod Kvapau
12521,Neko ko pravi muška odela.
15935,tipski rod porodice Astacidae; rečni rakovi Starog sveta
17316,oblik komunizma koji je u Kini uveo Mao Cetung
3644,dug vremenski period
2621,neko ko prevodi pisanu poruku s jednog jezika na drugi
12874,tranzitivni glagol koji zahteva i direktni i indirektni objekat
17052,Lekovita biljka s perjastim lišćem i plavim cvetovima.
4547,Fotograf koji rukuje filmskom kamerom.
7371,stanovnik Haitija ili poreklom sa Haitija
6287,Imperatorska dinastija Kine od 1368. do 1644. godine.
14285,slovni lik kod koga su slova nakrivljena udesno
10439,vakuumska cev kod koje zagrejana katoda emituje zrak elektrona koji prolazi kroz anodu pod visokim naponom i koji se fokusiraju pre nego što udare fosforom presvučen ekran
12557,Svi stanovnici Zemlje.
14742,zamišljena kružna linija na površini Zemlje koja spaja sevrni i južni pol sekući ekvator pod pravim uglom
3488,"ukradena imovina (posed, svojina)"
9344,slika osobe ili prizora u štampanom ili providnom obliku; snimljena kamerom na fotoosetljivom materijalu
13975,revolucija koju je predovdio Fidel Kastro i njegova gerila protiv korpumpiranog diktatora (1956-1959)
17367,"označiti za brisanje, obrisati ili izbrisati"
5753,utvrditi autentičnost čega
67,Koji nema neke izrazite kvalitete ili karakteristike.
14657,informacije koje se prenesu u novinama ili časopisu
3178,glavni i najveći grad Obale Slonovače
16352,u psihijatriji mehaničko i besmisleno ponavljanje reči druge osobe (kao kod šizofrenije).
3984,"podesan za dugotrajno korišćenje, nošenje i trošenje"
10435,meso je ispečeno pre dinstanja
17393,"država na severoistoku Južne Amerike, postala nezavisna 1966."
16612,veličina i opšti izgled publikacije
11614,Jedinica mere za masu.
8843,Rožnate ploče kojima je telo pokriveno imaju oblik krupnih zrna i poređane su u poprečne redove.
15289,ponoviti odlomak iz nečega
4567,stići na vreme
2967,album za fotografije
7825,otrovna biljka sa fibroznim korenom
4714,plodovi mora u Njuburg sosu posluženi na tostu ili pirinču
17114,Meriti vreme ili trajanje događaja ili radnje.
15122,Sa čime nešto počinje.
8784,alat koji se koristi da bi se nešto kuda uglavilo ili silom nateralo
16854,stanovnik Namibije ili poreklom iz Namibije
10623,Porodica noćnih ptica iz reda Strigiformes.
14084,loptasto ili ovalno južno voće sa debelom riđkastom koricom i sočnim žutim ili crvenim mesom
9005,Izraziti hvalu za nešto
9968,Mali rod višegodišnjih biljaka koje imaju smrtonosno otrovan gomoljast koren.
5223,Davati nešto kao proizvod.
18756,"Potpuno razvija osoba, od doba zrelosti nadalje."
9483,obuća za plivanje; prednji deo poput ploče pomaže pri plivanju posebno pod vodom
3614,"Većina ljiljaka spada u ovaj podred, osim voćnih ljiljaka."
15611,koji se tiče Indonezije njenih ljudi i kulture
12397,protozoa sa jajolikim omotačem sa cementiranim peskovitim zrnima
18344,"glavni i najveći grad Iraka, na reci Tigar"
11985,čadski jezik kojim se govori u Čadu
7116,Uglavnom lišajevi koji rastu na morskim stenama.
14103,koji se tiče Libije i njenih ljudi
2060,Učinak jedne stvari (ili osobe) na drugu.
752,jevrejski obred obrezivanja koji se izvodi na dečacima osmog dana po rođenju
18553,Hrskava kifla u obliku štapa; često se služi uz supu.
298,"ravna, asfaltirana staza sa koje avioni poleću sa zemlje i na koju sleću"
6374,Čin otkrivanja nečega.
223,Snabdeti potrepštinama i podrškom.
6071,koji teče zajedno
16166,"Jedan od dva priznata reda pravih bakterija; gramnegativne spiralne, loptaste ili štapičaste bakerije koje se obično pokreću omoću flagele."
16030,Dvoredac
7662,Proces donošenja na svet potomaka.
13268,Uređaj koji emituje radio ili TV signale.
16797,energija koju oslobađa protok električnog naboja kroz provodnik
11652,Crvenosmeđi mesožder nalik rakunu iz starog sveta; u nekim klasifikacijama nema nikakve veze sa džinvskom pandom.
3632,Imati egzistanciju.
1631,Ustanova u kojoj se izražava verovanje u božanske moći.
10602,koji se tiče grada Kuvajta i njegovih stanovnika
5847,Prepoznati ili uočiti razlike.
198,veličina čija se vrednost ne menja
8707,u grčkoj mitologiji Ahilov prijatelj koji je ubijen u Trojanskom ratu; to je nateralo Ahila da se varati da se bori posle svađe sa Agamemnonom
8907,(filozofija) filozofska teorija o funkcijama znakova i simbola
11786,Tipski i jedini rod porodice Trichechidae.
10356,Od nekoga nešto tražiti ili zahtevati.
4996,irokeški jezik kojim govori narod Mohok
72,"Lednik razvijen u visokim planinama, koji urezuje doline i povećava raščlanjenost reljefa."
12427,Mungos iz severne Afrike; nekada se smatralo da se hrani krokodilskim jajima.
18214,Ženka domaćeg goveda.
7182,Čin kojim se nešto povećava.
192,"Koji privremeno nije aktivan, o vulkanima"
9093,Mali skladišni prostor.
19380,Istrajati ili uspevati.
2767,otrovni pauk Novog sveta; ženka je crna sa glavom u obliku peščanog sata i crvenim belegom na donjoj strani trbuha
2116,forma apatita u kojoj fluor dominira nad hlorom
19188,"Opnokrilci s društevnim načinom života u zajednicama koj broje više stotina hiljada članova i sastojie se od plodnih ženki (matica), mužjaka i radilica bez krila s otrovnim sekretom a ponekad i otrovnom žokom."
7830,Drveni duvački instrument koji ima dva jezička od trske
3362,Abnormalno ili fiziološki neuravnoteženo stanje tela.
7032,u rimskoj mitologiji Jupiterov glasnik i bog trgovine; u grčkoj mitologiji mu odgovara Hermes
17170,Višegodišnja evropska biljka penaxačica sa belim i ružičastim cvetovima; korov.
13446,jednodelna odeća za žene; ima suknju i bluzu
13704,Član umetničkog pokreta koji je izražavao ideje indirektno preko simbola.
17941,"pretvoriti u digitalni oblik, za korišćenje pomoću računara"
2925,"Period od 251 do 199.6 m.g; dinosaurusi, morski reptili, vulkanske aktivnosti"
16473,spomenik koji se sastoji od veoma velikog kamena koji čini deo praistorijske strukture (posebno u zapadnoj Evropi)
16038,imaju raspravu o kakvom pitanju
10040,Baza podataka koja se sastoji od uređenog niza stavki (imena ili tema).
7794,osnovna novčana jedinica Kolumbije
12752,Tropsko zimzeleno drvo iz familije mirti poreklom iz istočne Indije ali se gaji i na drugim mestima.
9109,čin promene ili obrtanja pravca (smera) putanje
74,programski jezik čiji izrazi su okupljeni u više dimenzija
18026,Vrsta grozdaste cvasti - cvetovi na nerazgranatoj osi.
18225,Učiniti dužim razvlačenjem ili rastezanjem.
11149,"Očistiti sredstvom za čišćenje, kao što su sapun ili voda."
1019,centrali deo goveđe pečenice dvostruke debljine
17073,"obrtanje normalnog reda dve reči ili rečenica npr. (kao u ""odgajan i rođen"")"
5089,a commercial mix for making a cake
12050,deo zemlje na kome se biljke uzgajaju
1100,složiti po grupama
564,elektornski tekst koji je sačuvan kao niska karaktera i koji može da se prikaže u različitim formatima
14873,Popraviti ili snabdeti zakrpom.
7903,rod evroazijskih trava iy porodice Compositae sa bodljikavim lišćem i ružičastim cvećem
6035,utvrđeno tako da rezultat nije više sumnjiv ni upitan; definitivno poznat
3866,Tropsko drveće i žbunje sa aromatičnim lišćem i često vrednim tvrdim drvetom.
12549,Krpelji.
4167,Vežba sa namerom da poboljša izvođenje ili osveži pamćenje.
3650,Iznenada se ponašati se hladno i zvanično.
7229,"u računarstvu, računarska datoteka uskladištena na magnetni disk koja se može na jedinstven način identifikovati"
9135,Tvar koja ostane kada se nešto ukloni.
1682,postići dupli poen; osvojiti dve baze jednim udarcem (u bejzbolu)
5705,Obično cilindrična posuda sa širokim otvorom i ručkama.
10266,slovenski jezik kojim se govori u Bugarskoj
4814,Familija biljaka iz reda Geraniales.
5607,sneg oblikovan u loptu za bacanje (igre radi)
6473,Službenik koji predsedava sastankom neke organizacije.
1473,celokupni doprinos pisca ili umetnika (ili suštinski deo toga)
3853,odeća koja se nosi na nogama
14,Čin uljudnog odlaska.
4698,ruda koja je glavni izvor cinka; sastoji se od cink sulfida u kristalnom obliku
14583,"Gasovi, tečnosti i čvrste tvari su tri uobičajena agregatna stanja."
12021,uspešan udarac u atletskom takmičenju (posebno u bejzbolu)
19397,"Posuda približno cilinričnog oblika, otvorena na vrhu."
1218,Poruka koja opisuje kako nešto treba da bude urađeno
17492,"Poluotrvo na jugositoku Azije na kome u delovi Malezije, Tajlanda i Mijanmara."
3302,Dobra ili usluge kupljene iz strane zemlje.
17596,koji se tiče grada Singapura
12457,Neki od raznih mernih instrumenata za merenje veličine.
7085,mala kašika kojom se mešaju čaj ili kafa
10587,Riba sa dugačkom cevastom njuškom i tankim telom prekrivenim ljušturama.
7727,sendvič u kome su svi sastojci uvijeni u meku tortilju
1719,novčana jedinica Mongolije
739,koji se odnosi na Atinu i njene stanovnike
16538,sistematsko istraživanje pitanja od javnog interesa
15391,"Prokariotski organizmi koji se ponekad smatraju klasom, kolom ili podkraljevstvom; poklapaju se sa porodicom Čanophyceae"
4198,Nauka (ili grupa srodnih nauka) koja se bavi logikom količine i oblika i poretka.
11074,žirafe
13897,termin za jabukovač (cider) koji se koristi u SAD i nekim delovima Kanade
548,Neka od brojnih višegodišnjih lukovičastih biljaka.
15714,"Veliki pododeljak Eumycota koji uključuje Hemiascomycetes, Plectomycetes, Pyrenomycetes, Discomycetes; ?sac gljive; u nekim klasifikacijama uključuje kraljevstvo Fungi."
17791,U nekim klasifikacijama ne uključuje Leguminosae.
13602,bilo koje od malih šumskih božanstava koja su bila saputnici Dionisa (slično satirima)
2136,pokušavati saznati čije mišljenje i namere
3476,"Emisija rastopljenog stenskog materijala, pepela i gasova na različite načine, ali pretežno eksplozivnom aktivnošću."
13317,rukopis za film koji uključuje dijaloge i opise likova i scenografije
6305,Rod iz familije Equidae: jedini preživeli rod iz familije Equidae
33,Kvalitet onoga ko je brižljiv i pažljiv.
4518,predosećanje o nečemu što će se dogoditi
1373,ptica iz starog sveta koja se okreće u letu
13726,koji se sastoji od silabičkih karaktera ili koji se koristi takvim karakterima
12817,koristiti točkić za izbor broja telefona
7983,unos sa listom osoba koje su doprinele filmu ili pisanom radu
9807,Plan s kojim se nešto aktivno čini.
6759,proći poput urina
9497,pripadnik ljudi koji se živeli u Severnoj ili Južnoj Americi pre dolaska Evropljana
1060,arhipelag dugačak 130 milji severozapadno od Škotske
15623,tastatura koja je ulazni uređaj za računare; raspored tastera je sličan kao na tastaturi pisaće mašine
12809,"rano prolećno cveće; mirišljavo, žute ili ružičaste boje"
569,Azijsko voće slično ličiju
119,"Supstanca sa specijalnom funkcijom koju luči ćelija ili žlezda, posebno ona koja nije otpad."
18160,ljubičasto crveno stono grožđe
6592,u rimskoj mitologiji vrhunski bog Rimljana; u grčkoj mitologiji mu odgovara Zevs
13760,"ptica čije je perje živih boja, hrani se uglavnom pčelama"
1600,koji se tiče Nikaragve i njenih ljudi
18392,jezik Persije (Irana) u bilo kom od svojih drevnih oblika
17288,Dugi uski čamac sa ravnim dnom a pokreće se veslanjem; tradicionalno se koristi po kanalima Venecije.
2708,reći ili izraziti nešto sasvim kratko
9870,Mesec koji je između maja i jula.
17199,Potpun kompleks stavova i ubeđenja.
8903,Jedna apstraktna mentalna lokacija.
15071,general najvišeg ranga
6618,Načinjen od zemlje ili pečene gline.
17486,redak paprikaš od mesa i povrća
6714,izraziti čestitke
15812,Rakuni; ?coatis; ?cacomistles; ?kinkajous; i ponekad pande.
6213,izjava koja objašnjava
14088,kao diktator vladati
16472,učtivo šta naručiti; izrazite želju za čime
15110,"Rod krupnih zeljastih biljaka i malog žbunja, uglavnom sa vunastim lišćem."
18118,Mala loptasta posuda otvorena na vrhu u koju se smešta duvan.
5853,u grčkoj mitologiji ćerka Zevsa i Demetre; po drvenoj mitologiji Pluton ju je učinio kraljicom podzemnog sveta; u Rimskoj mitologiji joj odgovara Prozerpina
17405,Ubiti ispaljivanjem projektila.
176,Osećanje velike sreće.
8116,"Normalno stanje napetosti mišića, arterija , itd koji olakšavaju odgovor na stimulanse. Može biti pojačan (hipertonija) ili oslabljen (hipotonija)."
3320,javna isprava koju država izdaje svom državljaninu za putovanje u inostranstvo i povratak u domovinu
5385,nalog za izvršenje smrtne kazne
16564,grana zoologije koja proučava gmizavce i vodozemce
15632,"Ideja koja se podrazumeva, ili koja je izražena ili se podrazumeva."
14938,glavni i najveći grad Čilea
9625,nameniti neko delo književnosti u manje formalnom stilu
17630,Utvrditi konačno ili merodavno.
3253,"odvajanje u obliku listića izvesnih delova kostiju, žila i dr. koje su u zapaljenju; ljušćenje kože"
2937,sivi mineral koji se sastoji od kobaltnog arsenida i nikla; važna ruda kobalta i nikla
4707,Jasika iz starog sveta sa širokom razgranatom krunom.
12984,sportsku opremu koja se sastoji od predmeta postavljenog za strelca ili revolveraša da na njega cilja
16831,novčana jedinica koja se koristi u Kirgistanu
18856,prst na stopalu
2667,salata od mesa ili povrća u želatinu
14671,"Razbiti u delove ili komponente, izgubiti koheziju ili jedinstvo."
16871,Vrlo rasprostranjen arktički dragušac za koga se veruje da veči ili sprečava skorbut; izvor koncentrovanog vitamina C.
13260,Neko ko kreira nove plesove.
12678,Majmuni drekavci.
2792,Tipski rod porodice Cuculidae.
9411,posuda za kuvanje koja se sastoji od ravnog pravouganog metala koji se koristi za pečenje kolača
2474,Rimski filozof i pesnik; u dugoj didaktičkoj poemi pokušao je da da naučno objašnjenje e a scientific univerzuma (96-55 BC).
6047,Neko voće iz roda Citrus koje ima tvrdu koru i sočno meso; raste u toplim krajevima.
1148,Čin postavljanja i držanja kursa.
5320,"Sastoji se od gljiva koje imaju spore na bazidijumu; sastoji se od Gasteromycetes (?puffballs) i Tiliomycetes uključujući redove Ustilaginales (?smuts) i Uredinales (?rusts) i Hymenomycetes (šampinjoni, ?toadstools, ?agarics i ?bracket fungi); u nekim klasifikacijama smatra se odeljkom kraljevstva Fungi."
17356,slatkovodna riba koja je u naše krajeve stigla sa severnoameričkog kontinenta
16676,rod bakterija
2336,povezivanje simbola u niz jedan za drugim
16708,"koji se tiče Nemačke, njenih ljudi ili kulture"
5096,postati svetlije
19222,slučajno biti
1616,Podela grupe u suprotstavljene frakcije.
8430,(čin) terapije lekovima
16184,Istorijsko područje u centralnoj i severnoj (velikoj) Jugoslaviji; Srbi nastanjuju ovo područje u VI i VII veku.
5700,porodica severnoameričkih indijanskih jezika kojima se govori u jugoistočnom delu SAD
1485,čin odstranjivanja sadržaja iz nečega
4806,organsko jedinjenje koje sadrži samo ugljenik i vodonik
3830,naučna oblast koja proučava magnetizam
14148,Predmet koji je stvoren ili sastavljen pomoću igle i konca.
13429,grčki bog posle svrgavanja Titana
12193,Uzimati male komade jela.
10929,"Riba koja živi u dubokima vodama, ima glatku kožu, protegljasto telo i dugačak nitast rep."
7197,original kako promeniti
4960,Francuski pesnik (1821-1867).
14976,Posetilac kome domaćin iskazuje gostoprimstvo.
3211,Otac vašeg oca ili majke.
19254,označava generacije ili niz generacija koje slede roditeljsku generaciju
3284,Čin napada na neprijatelja.
17088,Oslići.
773,Životni princip ili pokretačka snaga unutar živih stvari.
14151,Suvozemna paprat: tankolist.
5433,Deo sveopšteg javnog mnenja koji se zanima za izvor informacija ili zabave.
107,neprijatno ili razočaravajuće iznenađenje
44,blagonaklona procena
3038,"najduže reka u SAD-u; izvire u Montani, teče na jug i uliva se u Misisipikod Sent Luisa"
9805,ispitivanje i disekcija umrlog da bi se utvrdio uzrok smrti ili promene koje je izazvala bolest
15747,tražiti od nekoga da uradi nešto
10487,"klasa žarnjaka kod kojih se javljaju oba morfološka oblika, polipi i meduze"
12419,slaganje u rodu između reči koje pripadaju istoj gramatičkoj konstrukciji
11762,"Izduženi slatkovodni bakalar iz severne Evrope, azije i Severne Amerike; oko ustiju ima ?; grabljivica."
17774,"softver koji može koristiti grupa ljudi koji rade na istim podacima, ali koji mogu biti distribuirani u prostoru"
5066,odnosi se na glagolski način kojim se izražava naredba
19036,"naručiti, pozvati ili tražiti određenu dužnost ili aktivnost, posao, ulogu"
16641,drevni iranski jezik
18016,Neko ko predaje matematiku
3584,linearna merna jedinica (jednaka 6 stopa) za dubinu vode
9119,Izdužena glava krskavih vlati nalik celeru i svetlo zelenog lišća.
4035,proces u kome jedna ili više supstanci deluju jedne na druge stvarajući novu supstancu
15231,označiti crvenom bojom
10645,Čin kojim se nešto posvećuje tako što se kroz neki crkveni obred izdvaja kao posvećeno Bogu.
9543,"u elektronici, sistem međusobno povezanih elektronskih komponenti ili kola"
17287,Igra koja se igra na posebno izrađenoj tabli.
5598,Nuklearno oružje kod koga se ogromna energija oslobađa nuklearnom fisijom.
3524,zapadnogermanski jezik kojim se govori u Holandiji
15674,u fazi u razvoju jezika ili književnosti koja se nalazi između ranijih i kasnijih faza
10342,Više ili manje zaobljeni deo tela na stopalu ili vrhu palca.
18431,Osoba ili stvar koju neko izabere.
8138,Nauka o sistematskoj klasifikaciji
4545,tačka gde nešto zastaje ili pravi predah
5134,"država na nekoliko Ostrva zavetrine Malih Antila, istočno od Portorika, stekla nezavisnost 1983"
12146,Ukupni opseg frekvencije elektromagnetnih talasa.
19335,"mali zdepasti buldog, glatke dlake i četvrtaste glave; najslađi od svih pasa"
100,metrička jedinica za zapreminu koja iznosi jednu stotinu litra
11230,"Neka biljka iz porodice Amaranthus, ima guste rese zelenih ili crvenih cvetova; često se gaji za hranu."
18359,čin podele na kvante ili izražavanje na način kvantne teorije
5235,Bilo šta sa okruglim ili ovalnim oblikom (koji čini konopac ili gajtan itd.) što je zatvoreno ili gotovo zatvoreno.
598,Pokretna stolica postavljena na velike točkove; koriste je invalidi i oni koji ne mogu da hodaju; često je pokreću sami korisnici.
10562,"filozofski pojam koji označava najprostije, nedeljivo jedinstvo, različito određivan kod različitih filozofa"
900,Neka od mnogih biljaka iz roda Galium.
8209,Posebno solistično izvođenje muzike ili plesa.
16619,geološka struktura pri kojoj je središnji stenski blok uzdignut između dvaju ili više paralelnih raseda
8689,Zeljasta biljka iz roda Cardamine.
11981,prirodna pojava koja se tiče strukture ili sastava zemlje
11983,Imati uvek uza sebe.
12231,"dugačak, beli turovet"
48,"Onaj koji proživljava tugu, žalost ili nezadovoljtvo ili označen njima ili ih izaziva."
17136,Tvrd spoljašnji omotač oko nečega.
