,Sysnet
13064,francuski pisac koji je zastupao jansenizam; pisao je uglavnom tragedije koje je zasnivao na grčkim i rimskim temama (1639-1699)
3100,keks sa đumbirom sa ukusom konjaka
13610,ugovor potpisan između dve ili više strana (država) koje su se sporazumele da nešto učine (da preduzmu neku radnju)
2296,"Učiniti jednakim, ravnomernim, odgovarajućim ili saglasnim."
12716,"Izvor za hašiš, a isto tako i za vlakna."
976,program koji se koristi za pregled HTML dokumenata
14477,Rod porodice Scolopacidae.
2742,Životinja koja proizvodi ženske polne ćelije koje mogu da oplode muške polne ćelije.
14923,Planirati pažljivo i razumno.
163,Ublažavanje patnje; pokazivanje velike dobrote prema izmučenima.
2229,konstanta u jednačini krive koja može da varira da bi se dobila porodica sličnih krivih
14851,raditi kao vozač
12592,osnovna novčana jedinica Bangladeša
10660,"komentar ili instrukcija, obično dodtai uz nešto"
17440,grupa amerindijanskih jezika (naziv je skovao američki lingvista Edvard Sapir)
523,u grčkoj mitologiji vrhunski bog; sin Reje i Korna koga je svrgao; muž i brat Herin; brat Posejdona i Hada; otac mnogih bogova; u rimskoj mitologiji mu odgovara Jupiter
8961,dijalekat antičkog grčkog kojim se govorilo i pisalo na Atici i u Atini
18636,"Veoma ljuta papričica, šiljastog oblika."
13808,koji se odnosi na parametre
2020,porodica red Heterosomata
2170,u grčkoj mitologiji Helijev sin; poginuo kada je vozio očeve kočije i došao suviš eblizu zemlji
6307,Serijsko uređivanje po kome stvari slede logički redosled ili obrazac koji se ponavlja.
8561,štampač koji predstavlja svaki karakter pomoću šare tačaka izabrane iz matrice tačaka
15226,Dvodihalice koje na zubima imaju rožnata zadebljanja.
675,svojstvo čvrstog tela da na svojoj površini vezuje gas ili tečnost
16282,Preneti nekome svoj stav ili mišljenje
3886,čelični ručni alat koji ima male oštre zubiće na nekom delu svoje površine i služi za glačanje drveta ili metala
9490,lagana šetnja (obično na nekom javnom mestu)
1314,"koji raste postepeno, u regularnim veličinama"
5251,"klizanje velikih masa snega, leda i blata niz planinu"
4318,neutralan alfabetski karakter (nekada su bili u donjem delu slovoslagačevog sanduka sa slovima)
4293,grupa koja zadovoljava komutativni zakon
9960,religiozna osoba koja veruje da je Isus Hrist i koji je član neke hrišćanske denominacije
16423,putovanje preko (kopnene ili morske površi) avionom
12978,Bilo koji element standardnog koda za predstavljanje karaktera sa 7 binarnih cifara.
10709,Tip porodice Cinclidae.
3483,Geranijum sa okruglim mirisnim listovima i malim belim cvetovima.
17702,Delimično ugljenisana biljna materija zasićena vodom; koristi se kao gorivo kada se osuši.
8913,Oruđe za praktičnu upotrebu (posebno u domaćinstvu).
19038,Dijagnostička procedura koja prati rad srca. Eletrokardiografijom se korišćenjem aparata elektrokardiograma prate električni impulsi srca i dobija crtež elektrokardiograf  - EKG.
74,Vrlo rasprostranjena američka biljka koja se gaji u tropskim i toplim predelima; ima upadljive žute cvetove na klasovima koji se savijaju do zemlje tako da semene mahune sazrevaju ispod zemlje.
5435,Događaj koji se ponavlja u određenim intervalima.
6473,Prostor koji ima mrežu železničkih šina i krnjih koloseka za čuvanje i održavanje vagona i mašina.
13668,paprikaš koji se pravi sa usoljenom govedinom
6024,"republika u Centralnoj Americi, postala nezavisna od Španije 1821."
8795,Oživljavanje starih grčkih igara koje se održavaju svake četvrte godine u izabranoj zemlji.
1362,Kategorija stvari koje se izdvajaju nekim zajedničkim karakteristikama ili kvalitetom.
2677,obično punjene i pečene
5012,Čin upisivanja.
14124,Insekt dvokrilac jakog dlakavog tela čije larve žive kao paraziti na ljudima i drugim sisarima. whose larvae are parasites on humans and other mammals
539,Žarnjak kod koga je tipična smena generacija: hidre.
4945,do away with
9953,Konfiguracija zvezda kako se vide sa Zemlje.
7014,Neka od mnogih slatkovodnih riba familije Čprinidae.
1161,Vozilo sa točkovima koje može samo sebe da pokreće.
6525,osoba koja veruje u jednakost svih ljudi
13158,sudski nalog kojim se nalaže zaplena lične svojine dužnika za namirenje dugovanja
9965,Budnost nad mrtvim telom noć pre sahrane.
9874,odnos između matematičkih izraza (kao jednakost ili nejednakost)
2983,zatvoreni prolaz na koji se sobe obično otvaraju
14808,jarko crvena slatka jabuka za jelo; najčešće uzgajana jabuka širom sveta
14492,U nekim klasifikacionim sistemima smešta se u porodicu Polypodiaceae.
17713,Paprat iz roda Hymenophyllum koja raste u tropskim vlažnim predelima ima skoro prozirno lišće.
6130,zgrada vlade u kojoj su smeštene administrativne kancelarije gradske vlade
1771,rod bakterija
683,kretati se unazad i od čega se udaljavati
1300,"Mali crv koji inficira čovekova creva i rektum, posebno kod dece."
8798,Ukloniti četkom ili kao četkom.
6194,Arktički kit sa velikim ustima.
1150,Vitak majmun sa dugim i kitnjastim repom iz Azije.
11434,šećer koji se proizvodi od šećerne trske i služi kao zaslađivač
3566,Imati ili uspostaviti odnos sa nekim.
11547,koji pripada srednjoj klasi
12842,dolaziti ili biti na kraju
2014,neko ko beleži poslovne transakcije
8161,Imovina koja ima ekonomsku upotrebljivost: novčana ili razmenjiva vrednost.
12872,Majka nečijeg dede ili babe.
4514,"način kojim se radnja ili stanje predstavljaju ne kao činjenice, već kao nešto neizvesno ili moguće"
200,promeniti odeću; obući drugu odeću
3304,brzo se i nasilno kretati
6785,osnovna novyana jedinica mnogih zemalja; 1 franak je jednak 100 santima
16726,uspravna površina građevine ili litice
13239,zastareli nazivi za Čanophyceae
11154,Nastavljati da traje.
10910,Stanje deteta između ranog detinjstva i adolescencije.
12048,švajcarski sir sa velikim rupama
16566,Vazdušast hleb koji se tradicionalno peče u tepsiji sa mesom (govedinom).
10250,Neka od više zeljastih biljaka čije seme se kači za odeću.
12347,"lak večernji obrok, služi se u ranim večernjim satima i kasno, pred spavanje"
17295,Engleski pisac čiji su romani prikazali i kritikovali društvenu nepravdu (1812-1870).
8874,"Unutrašnji organ, između želuca i anusa."
713,emitovati fine čestice gara
7808,"Voćka mala ili srednj veličine, okrugla ili ovalna, s glatkom korom i jednom košticom."
10768,Bela hranljiva tečnost koju proizvode sisari a koja se koristi u ishrani ljudi.
12821,Plaćati nečije troškove.
601,čin dovođenja dve stvari u dodir
2517,"koji se tiče konkretnih problema ili podataka a ne fundamntalnih principa, nasuprot teoretskom"
5844,mali komadići obojenog papira koji se razbacuje na sve strane prilikom raznih svečanosti
1044,spasilačka oprema koja se sastoji od uređaja koji se ispunjava vazduhom i ublažava pad
168,koji donosi dobar profit
13203,čin prinošenja hleba i vina prilikom pričesti
19357,Osoba koja se tajno bavi špijunažom za vladu.
12973,glavni grad i luka Gvajane
7851,medicinski uređaj koji beleži električni potencijal  mišića.
19147,"kuhinjski aparat sa sečivima koja se mogu menjati; služi za sečenje, mešanje, gnječenje  hrane"
7649,prebaciti datoteku ili program s jednog računara na neki drugi
13,osetljivost na povrede ili napada
9612,mali biftek sečen od kraćeg dela slabine sa koskom u obliku slova T i malog parčeta pečenice
10628,peto slovo grčkog alfabeta
8493,knjiga štampana u velikom tiražu koja se brzo prodaje
16728,jedinica za zapreminu u metričkom sistemu
14193,kratko objašnjenje uz ilustraciju
10009,"fermentisano meksičko piće koje se pravi od soka raznih vrsta agave, naročito magej"
3290,"korpus pravila, regulative, naloga i odluka koje donose administrativne agencije vlade"
10815,dijalekat malajskog koji je u upotrebi kao nacionalni jezik Republike Indonezije t.j. Malezije
289,Iznenadni napad koji uključuje namernu upotrebu nasilja prema civilima da bi se postigli politički ili religiozni ciljevi.
15310,osoba koja falsifikuje
13954,U predelu sekundarnog suženja akrocentričnih hromozoma nalaze se geni za rRNK čijom transkripcijom se omogućava obrazovanje nukleolusa na tim delovima.
15633,Višegodišnje ili godišnje vodene ili močvarne biljke.
12442,Mala divlja ili polupomaća evropska šljiva sa loptastim sitnim plodom.
225,prihvatiti dokument kao valjan
1313,ukrasiti bojama
722,"Jedan od dva priznata reda pravih bakterija; gramnegativne spiralne, loptaste ili štapičaste bakerije koje se obično pokreću omoću flagele."
8834,mleveno meso oblikovano u loptu i prženo ili kuvano u čorbi
10624,rashladiti hranu
19045,"Postati veći, širi, napredniji."
10052,Samostalno središno peraje na leđima riba i drugih vodenih kičmenjaka koje pomaže da se održi ravnoteža.
339,Grupa manjih ostrva na velikoj vodenoj površini.
7497,"mekan, nezreo sir koji se pravi od slatkog mleka i pavlake"
6229,Sistematsko sredstvo komunikacije koje koristi zvuke ili konvencionalne simbole.
3560,Štampane stvari u obliku novina ili časopisa.
17093,pravilo sintakse koje omogućava stvaranje gramatičnih iskaza
17547,Služiti kao hrana za nekoga.
6007,osma planeta sunčevog sistema; ogromna planeta sa prstenom od ledenih čestica
3726,biti percipiran ili primećen na određeni način
10120,Red teksta koji ukazuje o čemu se radi u tekstu koji sledi.
9149,koji se odnosi na relacije
13975,an angle formed by two straight lines (in the same plane)
5937,"bog svetla, sin Ereba, boga večne tame i Njukte, boginje noći"
9876,pregovarač koji služi kao veza između parničnih strana
219,"Bilo kakva oštetočina na telu izazvana nasiljem, nezgodom ili prelomom."
5733,komadi bifteka kratko dinstani sa zelenim biberomi lukom
8554,Legura bakra i cinka.
1058,"Osnovna socijalna grupa, koju čine roditelji i deca."
9890,"papir koji ne propušta masnoću, koristi se u kuvanju"
2,Osećanje pomanjkanja brige.
10347,Odabrati pažljivo iz grupe.
3264,"o autoru, koji je tipičan za autora, ili koje je stvorio autor"
3214,"Neka od brojnih morskih ?percoid riba, naročito ali ne isključivo iz familije Sparidae."
3121,Rod evroazijskih višegodišnjih gomoljastih trava: divokozjak.
14448,pražnjenje nečega odvođenjem tečnosti koja se tu nakupila
9895,"hladna poslastica koja sadrži slatku pavlaku, voće i šećer"
1944,jestiva podzemna gljiva snažnog i specifičnog ukusa iz roda Tuber
417,Grupa ljudi koja je privremeno udružena u neku aktivnost.
13308,rod porodice lasta Hirundinidae
317,Kvalitet nekog ili nečega što ima slabiju ili manje poželjnu poziciju.
16845,turkijski jezik kojim govore Jakuti
2247,Dalmatinska gorka divlja trešnja koja rađa plod od čijeg soka se pravi poznati liker maraskino.
2523,dardski jezik kojim govore Kafiri u severoistočnom Avganistanu
3700,čadski jezik kojim se govori u Čadu
3809,Jedna karta iz špila karata koje se koriste za kartaške igre.
16944,Reci nečeg što je napisano.
2484,bantu jezik koji se ponegde smatra dijalektom zulu jezika
8968,Lekar koji je specijalizirao psihijatriju.
3402,Javno prikazivanje svečane zakletve ili svečana ceremonija sa prigodnim ritualom.
19342,Vazdušasto slatko punjeno pecivo.
13019,Pepsi je komercijalna marka pića kola
16148,"arhipelag u Južnom Tihom okeanu, sastoji se od Južnog i Severnog ostrva i manjih ostrva"
14587,Evropska ptica pevačica poznata po melodičnom noćnom pevanju.
17442,Kombinovati zajedno ili s nečim drugim.
11050,Tipski rod porodice Laridae.
15902,"kontinentalna država na zapadu Afrike, stekla nezavisnost 1960; najveći deo teritorije je u Sahari"
3829,Antički atinski filozof; učitelj Platonov i Ksenofonov (470-399 BC).
361,Supstanca koja izaziva neki efekat ili vrši neki uticaj.
234,"Nezgoda, posebno ona koja prouzrokuje povredu ili smrt."
30,Nalaziti da je nešto zabavno ili prijatno.
11573,gimnastička sprava koja se sastoji od dve drvene letve koje pridržavaju nosači.
4826,"materija od koje se sastoji rog, oklop kornjače, isl."
272,Koji izražava ili propoveda obožavanje božanstva.
5699,uobičajena evropska krastava žaba.
10110,"biljka prvobitno uzgajana, ali sada divlja"
17933,u grčkoj mitologiji Zevsov sin koji je postao kralj Likije; borio se na strani Trojanaca u Trojanskom ratu a ubio ga je Patroklo
6726,Tipski rod porodice Pipidae.
13906,doručak koji se obično sastoji od peciva i kafe ili čaja
10770,dno okeana ili mora
12949,preliminarna verzija pisanog dela
14240,"Zelena biljka koja ima vaskularni sistem: paprati, gimnospermi i angiospermi."
1206,Neka od mnogobrojnih ptica pevačica sa kratkim i jakim kljunom koji je prilagođen za razbijanje semena.
17532,Učiniti poravnatim.
3102,Arhitektonska pregrada čija visina i dužina su veći od širine; koristi se da podeli ili zatvori neki prostor ili da podrži drugu strukturu.
6997,Prestonica Jermenije.
15139,Bilo koji organ koji je uključen u seksualnu reprodukciju.
12483,Čin ispuštanja nečega.
16358,jezik kojim govori narod Tupi u Brazilu i Paragvaju
3013,rod bakterija
6045,nečiji bračni drug
7590,svečani čin valdaočevog ustoličenja
19025,Srediti ili ispraviti; o teškoćama ili problemima
3697,Grupa mačaka.
12644,Izvršiti matematičko izračunavanje.
9094,Čin odvajanja ili razdruživanja.
1674,koji se odnosi na ili koji naseljava božansko nebo
15114,"Emisija rastopljenog stenskog materijala, pepela i gasova na različite načine, ali pretežno eksplozivnom aktivnošću."
6213,Prostorno svojstvo nekog mesta koje govori gde ili na koji način je nešto smešteno.
12207,pozorišni izvođač
15489,uzrokovati da se nešto kreće pomoću vuče
537,neko ko veruje u postojanje stvarnost izva ljudskog poimanja
1790,neko ko je primljen među članove kakvog naučnog polja
1618,Mesto gde je neko rođen.
10594,engleski od 1450. godine
3694,Velika evropska bukva
9903,termoplastika dobijena polimerizacijom iz jedinjenja koja sadrže vinilsku grupu
14771,znak interpunkcije (/) koji služi za razdvajanje povezanih informacija
8778,u patologiji izraslina ili proširenje dela tela.
892,čin utvrđivanja osobina nečega
10516,"Familija obično sočnih zeljastih biljaka; rasprostranjena po svetu, a posebno u Americi."
11895,Načiniti nešto suvim.
8237,proći poput urina
8434,benigni tumor sačinjen od mišićnog tkiva
8937,u grčkoj mitologiji princeza Kolhida koja je pomogla Jasonu da otme Zlatno runo od njenog oca
2432,dravidski jezik kojim se govori u južnom delu centralne Indije
6514,Lekar koji pružea prvu pomoć bolesniku.
12685,determinator koji određuje specifičnost referencije imeničke sintagme
10355,"sočni, jestivi plod biljke koji ima oblik repe"
19230,antineoplastik koji sprčava korišćenje metabolita
18827,ime koje je uzeto na privremeno korišćenje
17572,stići gde na vreme
191,Prekinuti nečije zaposlenje.
14227,"grad u Češkoj republici, mesto čuvene bitke iy 1805"
9046,"tikva sa čvrstom korom i izduženim, krivim vratom"
5886,učiniti normalnim ili izazvati da bude usklađen sa normom ili standardom
7769,koji se odnosi na foneme određenog jezika
1234,disfemizam za pivo (pogotovo vrste koje dosta pene)
167,Tipski rod porodice Hymenophyllaceae: tankolist.
18114,"Kolač od tankih kora koje se filuju kremom od jaja, mleka i šećera."
3715,Razbacana kolekcija.
17833,Najduži deo kanala za varenje u kome se zavšava varenje.
7904,"Odevni predmet koji se nosi na glavi ili oko vrata i ramena, kao ukras ili da greje."
16214,prva odlučujuća bitka u Stogodišnjem ratu; 1346 Engleska je pod vođstvo Edvarda III porazila Francusku pod vođstvom Filipa VI Valoa
9391,obična čigra Evrope i Azije koja ima sivo i crno perje
17615,Metalni ili papirni medijum za razmenu koji je u tekućoj upotrebi.
9113,Ispit kojim se određuje kandidatova spremnost za neke studije.
3927,"italijanski desert koji se sastoji od slojeva biskvita potpoljenog u  kafu, brendi ili liker, sira maskarpone i čokoladnih mrvica na vrhu"
9718,Čin povećavanja bogatstva ili prestiža ili snage ili obima nečega.
3223,kozice
237,biti jako tužan
17057,čorba sa školjkama
18048,Veliki plantigrade mesožder ili svaštojed sa dugim krznom i snažnim kandžama.
6156,Bilo koja supstancija koju organizm prerađuje da bi dobio energiju i gradio telesno tkivo.
18366,"Ući u nešto ili kroz nešto, često savaladavajući otpor."
9650,Java aplikacija; aplikativni program koji koristi veb pregledač klijenta da obezbedi korisnički interfejs
3845,metoda koja podešava krivu tačkama podataka tako da minimizuju sumu kvadrata rastojanja tačaka od krive
14041,Neka od više tropski i suptropskih drvolikih trava uz roda Musa koja na kraju ima krunu od velikih celih listova i koja obično rađa grozdove izduženih plodova.
6094,unositi zarazne klice ili njihove produkte u živo tkivo radi dijagnoze ili posticanja imuniteta
7507,osnovna novčana jedinica Kolumbije
9533,učiniti da šta unazad krene
3041,most koji se sastoji od više lukova koje nose stubovi i služi da provuče železničku prugu ili put preko doline
6300,Socijalno okupljanje gostiju ili drugara.
4756,Grana geologije koja se bavi proučavanjem fizičkih i hemijskih svojstava minerala.
16171,majanski jezik kojim govori narod Kekči
7337,glavni i najveći grad Kongo Brazavila
12848,Rod biljaka koje veoma podsećaju na biljke iz roda Silene.
138,Ukloniti posvećenost sa osobe ili objekta.
5620,Obezbediti ili sačuvati za moguće buduće korišćenje ili primenu.
17133,"grupa koralnih ostrva u Mikroneziji, jugozapadno od Havaja"
8210,meksički insekt sa crvenom krljušti od koje se pravi crvena boja
8711,vizuelni efekat osvetljavanja na predmetima ili scenama kao što se prikazuje na slikama
1341,naklonjenost prema nečemu
10556,zamišljena linija koja povezuje tačke koje imaju istu temperaturu u datom trenutku
15809,sistem u kome se za utvrđivanje položaja koriste koordinate
2694,koji se tiče ili koji pripada sadašnjem vremenu
212,grupa čadskih jezika kojima se govori u severnoj Nigeriji; hausa je njen najznačajniji član
13635,Svako drvo ili žbun iz roda Betula kojeima tanku koru koja se ljušti.
12092,pozorište u kome se izvode opere
14758,Učestvovati u kovanju zavere.
4665,Ukloniti testise musške životinje.
2971,Godišnja biljka od Mediterana do Portugala; ima bodljikave čašične listiće.
9864,"Prestonica i najveći grad Engleske; smešten na Temzi u jugoistočnoj Engleskoj; finansijski, industrijski i kulturni centar."
16759,Zimzeleno drvo umerene veličine sa potpuno simetričnim crvenim cvetovima koje se puno gaju u tropskim predelima zbog pupoljaka od kojih se pravi začin.
5717,"vrh (na primer, flaše)"
8416,mašina za kopiranje koja šalje poruku putem telefona ili radio signala
9073,"Neka od više vrsta obično velikih pasa koje se uzgajaju za rad, nošenje tovara, čuvari i vodiči."
11934,"Poreklom iz Egipta, i široko rasprostranjena zbog aromatičnog semena i ulja koji se koriste u medicini i u kuvanju."
11289,meso mladog bakalara ili poloka ili neke druge ribe belog mesa podeljeno i očišćeno; obično se bari
14925,tanka serozna membrana oko pluća i unutrašnjeg zida grudi
18047,Transportovati robu.
18524,zvanični jezik Republike Južne Afrike; srodan je sa holandskim i flamanskim
32,osobina da se radi ono što je ispravno i da se izbegava ono što nije
10358,Napustiti fizički život i izgubiti sve telesne funkcije i atribute koji se neophodni da bi se održao život.
9838,Morski beskičmenjaci koji podsećaju na mekušće.
2727,komplet od 52 karte
9127,gepardi
6370,deo svinjskih rebara sa dosta mesa
6910,urednik koji priprema tekst za izdavanje
21,"koji se odnosi na Belgiju, njene ljude i kulturu"
3094,spajanje ili vezivanje šavovima
373,(lingvistika) naglasak ili promena u naglasku koja služi za razlikovanje reči u tonalnim jezicima
10224,neka beseda
11395,jezička porodica koja je u širokoj upotrebi na južnoj polovini afričkog kontinenta
7369,metrička jedinica mere za zapreminu koja iznosi 100l
9434,"Donja odeća koja se nosi do kože, ispod druge odeće."
12144,štalska oprema koja se sastoji od bilo kojeg dela opreme koji se stavlja oko glave konja
19396,"Opremiti uvezom, kao kod knjiga."
17793,Kretati se na skijama.
13536,"ceo hleb, kako je ispečen"
8009,bog medicine i lečenja
4427,Količina koja može da stane u šolju.
8962,poslovanje koje se tiče štapmanja
2637,loptasto ili ovalno južno voće sa debelom riđkastom koricom i sočnim žutim ili crvenim mesom
8896,Tipski rod porodice Dipodidae; tipični skočimiši sa tri prsta na svakoj zadnjoj nozi.
7242,drevno carstvo koje je zauzimalo prostor oko reke Nil i kojim su vladali faraoni of Israel; centered on the Nile River and ruled by a Pharaoh; figured in many events described in the Old Testament
17309,"u vezi sa humanitarnom pomoći, uslugama itd."
1525,Prava paprat (leptosporangiate).
4285,Glavni javni predstavnik neke zemlje koji može da bude i šef vlade.
403,"Najveći živac čovečjeg tela koji nastaje iz korenova (L4, L5, S1, S2, S3) krsnog spleta (lat. plexus lumbosacralis - pars sacralis) lumbosakralnog (slabinskokrsnog) dela kičmene moždine i koji se sastoji od motornih i senzornih neurona koji učestvuju u inervaciji delova tela od lumbosakralne (slabinskokrstne) oblasti pa sve sve do završnih delova donjih udova. Išijadični živac, kao glavni nastavak krsnog (sakralnog) pleksusa u svom daljem toku se račva u dve glavne grane: golenjački (lat. n. tibialis) i lišnjački nerv (lat. n.peronei)."
3473,Rod zeljastih biljka koje liče na detelinu.
18282,Formirati ili biti sastav nečega.
2940,"u računarstvu, istres sadržaja glavnih registara CPU"
17022,oštar pad rečnog toka
2328,Dati rečima izveštaj ili predstavu o nečemu.
3058,Kopneni glavonošci čije se telo sastoji od brojnih dvostrukih članaka od kojih svaki ima par nogu: stonoge.
6711,osnovna novčana jedinica Bahreina
11035,"sprečiti nekoga da uđe, i sl."
10933,porodica sino-tibetskih jezika kojima se govori u jugoistočnoj Aziji
10389,"Iznos (novca, roba ili usluga) koji se smatra ekvivalentom nečega drugog."
6477,najpoznatija vrsta testenine u obliku dugačkih tankih niti; testenina cilindričnog oblika italijanskog i sicilijanskog porekla
3698,izazvati ili odvratiti ili pretiti
7093,Oblik upravljanja društvenom organizcijom.
10499,pridržavati se praznika ili obreda
17317,mitski grčki junak koji se borio protiv Troje u Ilijadi
9473,Neko bestelesno biće za koje se veruje da ima moći da utiče na tok ljudskih dešavanja.
15838,Glasačko mesto gde glasači idu da daju svoj glas na izborima.
9088,Koji se odnosi na koštunice.
16399,Zemlja koja je u vlasništvu u feudalnom sistemu.
8606,Biti i ostajati u određenom stanju ili uslovu.
14724,biljka iz porodice trava; raste na obalama reka i u jarkovima
11295,Neki od plodova biljaka iz porodice Solanaceae; posebno iz rodova Solanum; Capsicum; Lycopersicon.
2659,"Kardinali, krstokljuni, strnadice, štiglići, ??"
15557,Jak plemeniti konj - rasa je uzgojena u ergeli Lipica u Sloveniji.
6057,Zimzeleno vrtno ili plantažnpo drvotoplih krajeva koje rađ kiseo ili gorak plod narandžaste boje.
17385,Veliki rod kaktusa poreklom iz Amerike: bodljikave kruške.
13749,Poreklom iz Evrope.
17701,Insekti duguljastog tela sa dugim i tankim pipcima.
10867,Porodica gljiva iz reda Lycoperdales; obuhvata gljivu puharu.
3430,Sezona rasta.
13176,koji se odnosi na judi koji govore romanskim jezicima
7487,Pita koja sadrži goveđe odreske i prethodno propržene bubrege koji su zatim zajedno sa crnim lukom kuvani u vinu i konjaku.
394,Palačinka koja se pravi od heljdinog brašna.
268,Točak na vagonu.
16635,ćelije koje čine epidermis
3662,izgubiti toplotu
16653,"Neka od biljaka iz roda Helianthus sa glavičastom cvasti, koja se okreće za suncem, iz čijih se semenki dobija ulje."
18313,prirodno i periodićno stanje odmora tokom koga se gubi svest o svetu
7419,Glodar iz porodice Geomyidae koji kopa; ima velike spoljašnje bage na obrazima; iz Centralne Amerike i jugozapadne Severne Amerike.having large external cheek pouches; of Central America and southwestern North America
11373,Proslava evharistije (u Katoličkoj crkvi i nekim protestantskim).
1776,relativno dug i uzak komad nečega
18647,Struktura kod životinja koja je slična ljudskoj nozi i koristi se za kretanje.
14385,stvaranje muzičkog dela.
17033,Pregrada koja može da pokreće da bi obezbedila prolaz.
19006,govorni čin odgovaranja na pitanje
9733,NA
8884,Barska biljka Evrope i Severne Amerike koja ima svetlo žute cvetove nalik na zlaticu.
160,Izjaviti za nekoga da nije kriv po krivičnim optužbama.
14622,Telo učenika koje zajedno podučavaju.
10484,"bivš država u jugoistočnoj Aziji, postojala od 1954. do 1975. kada je priključena Severnom Vijetnamu"
14788,film na koji se fotografiše materijal u veoma smanjenoj veličini; koristan za skladištenje; sistema za uvećavanje se koristi da bi se materijal pročitao
11071,ostrva u Atlantskom okeanu koja pripadaju Portugaliji
7159,hemikalija koja uništava napasti kao što su insekti i glodari
145,odsustvo osećanja
2679,"Promeniti orijentaciju ili smer, takođe i u apstraktnom smislu."
13191,Napravljen od drveta ili koji se sastoji uglavnom od drveta.
2830,"glagol (poput ""biti"" ili ""postati"") koji povezuje subjekat s rečeničnom dopunom"
13374,Obećati da će se nešto preduzeti ili dati.
3330,Neki grm iz roda Rubus koji rađa jestiv plod.
7260,Morski krinovi
4552,Čine red Opuntiales.
12748,električna železnica koja ide ispod zemlje
15651,Umotano pakovanje.
10233,truba u ušnoj duplji
3220,uniformno kretanje bez rotacije
3354,dijalekat čivere jezika kojim govori narod Ajova
14922,fakultet i studenti na univerzitetu
10893,glavni i najveći grad Alžira
18020,Cev sa poluloptastim proširenjem na jednom kraju; služi za pušenje duvana.
1694,"Biti vlasnik, posednik (stanje)."
1202,"Učiniti stabilnim, dovesti u ravnotežu, sprečiti kolebanje."
