,Sysnet
17400,Lemuridae; Lorisidae; Daubentoniidae; Indriidae; u nekim klasifikacijama koristi se umesto Prosimii; u drugima se smatra pododeljkom Prosimii.
5842,Plavi morski pas.
5369,UY
6393,Staviti na nešto prekrivač; pokriti površinu nečega.
13092,Jedna vrsta.
12598,Cev sa poluloptastim proširenjem na jednom kraju; služi za pušenje duvana.
3705,preći ili pokriti hodanjem
5256,tibetsko-burmanski jezik kojim se govori u Sičuanu
17739,bela roba u kojoj se hrana može čuvati na niskim temperaturama
15969,"Anksioznost kao rezultat stvarnih ili izmišljenih pretnji sopstvenoj seksualoj funkciji, prvobitno primenjen samo na muškarce , ali se u principu odnosi i na žene."
663,crteži i fotografije u okviru knjige
7577,karakteri koji imaju oblik velikih slova ali čija je visina ista kao kod malih slova
14272,Staviti u pogon.
7054,Metrička jedinica za težinu jednaka hiljaditom delu kilograma.
5665,Vozilo sa točkovima koje jedna osoba može da gura; može da ima dva ili četiri točka.
15479,Pozicija na kojoj neko ili nešto (kao stražar ili čuvar) stoji ili mu je određeno da stane.
210,"Stvoriti mentalno i apstraktno, a ne ručno."
17465,jedna jedinica za dužinu koja iznosi jedan milijarditi deo metra
16424,struktura koja je deo nervnog sistema
12027,čin kojim se nečemu smanjuje dužina
13885,Neka od više ptica iz starog sveta sa krestom i tankim?
13119,običan fazan čije je perje živih boja a oko vrata ima beli prsten
15108,povećanje u širinu
15365,cipela koja se sastoji od đona vezanog kaiševima do stopala
16213,politička teorija koja se zalaže za neograničen autoritet jedne osobe
18581,koji se tiče Atlantskog okeana
12458,bar koji obično nije skup
3850,glavni i najveći grad San Salvadora
13825,Organizacija izvođača i pridruženog osoblja (posebno pozorišnih).
13561,sitne muške spore koje učestvuju u razmnožavanju nižih biljaka
4395,tradicionalna priča usvojena kao istorija; služi da objasni svetonazor ljudi
17167,supa sa von ton knedlama
423,slatko aromatično grožđe koje se koristi za grožđice i vino
17051,oblik aramejskog kojim se govorilo u Palestini u vreme Novog Zaveta
14104,romanski jezik kojim se govori u najvećem delu Španije i u zemljama koje su bile Španske kolonije
10542,Izdvojiti nešto kao važno.
11681,"stanovnik Nepala, ili poreklom iz Nepala"
9020,štampač koji koristi električni naboj za nanošenje tonera na papir
17489,UZ
12371,"Nešto, kao uže ili konopac, što je dugačko, tanko i fleksibilno."
12048,Proizvoditi zvuk kao sat ili štoperica.
13830,Kim.
16688,Biljke koje imaju cveće koji nalikuje ?larkspur ali se od njega razlikuje u rasporedu latica; ponekad se uključuje u rod Delphinium.
3398,noćne čaplje starog sveta
17968,"skladište, npr. prostor na ratnom brodu, gde se čuvaju oružje i municija"
19086,u grčkoj mitologiji Agamemnonova žena koja je naložila da se on ubije po povratku iz Trojanskog rata
11058,Uska postavljena ploča na preklopnim osloncima; koristi se za peglanje odeće.
3875,dinstane trake govedine ili junetine s šampinjonima u kiselom kremu i njokama
4504,ruda iz koje se vadi gvožđe
636,Neko ko pokušava da probrati druge u drugu veru ili dkotrinu.
15345,čaša napravljena od papira za jednokratnu upotrebu
12906,gramatička kategorija svih promenljivih reči kojom se izražava kontrast jednina/množina/dual u zavisnosti od broja entiteta o kojima je reč
15677,nagnuta masa slobodnih stena u podnožju litice
6308,Republika u centralnoj Evropi; invazijom Nemačke na Poljsku 1939. godine počeo je Drugi svetski rat.
14656,Sposobnost da se vispreno procene situacije ili okolnosti i da se izvuku čvrsti zaključci.
651,oduzeti
12811,kari napravljen sa jagnjetinom
16415,Višak rashoda nad prihodima (obično tokom nekog perioda).
7036,Zvanično takmičenje u kome se nadmeće dve ili više osoba ili timova.
28,Zgrada u kojoj se vrši likvidacija životinja radi proizvodnje mesa
6721,proces erozije kojim se formira ravna površina
10845,Voljena osoba; koristi se u izrazima od milja.
1453,"Uobičajena evropska žaba, uglavnom suvozemna."
6154,funkcionalna reč koja može da zameni imenicu ili imeničku sintagmu
14789,Čin opažanja nekog mirisa.
16922,"francuski specijalitet, krema ili puding od mlijeka i jaja koji se peće u pećnici"
35,"Koji ima ili ukazuje na dobro zdravlje tela ili duha, kod koga nema upale ili bolesti."
8318,Hranljiva riba evropskih atlantskih voda.
1375,mala količina tečnosti
1114,Familija cvetnica koje imaju jedan kotiledon (jednu klicu) u semenu.
13865,Jedna od prirodnih jedinica u koje se može analizirati jezička poruka.
9189,stanje u kojem se zemljina površina troši usled dejstva vode i vetra
7757,injekcija koja se ubrizgava u venu
6083,"Nekada se smatralo da je to jedan od četiri elementa od kojih se sastoji svemir (po Empedoklu, arhaično)."
1769,"Grmlje, zeljaste biljke i povijuše toplih predela: vranemil."
953,Velik rod zeljastih biljaka od severnih umerenih područja do Arktika.
12784,negativno naelektrisan jon
9720,"Vrsta pasiflore veličine jabuke koja raste na Karibima, centralnoj i južnoj Americi"
17352,"u računarstvu, sibol koji se pojavljuje na na ekranu da ukaže da je računar spreman da primi komandu"
353,zupčanici koji prenose snagu iz automobilskog motora preko pogonskog vratila do žive osovine
8242,PY
12876,"koji se tiče Švedske, njenih ljudi i kulture"
14007,Pozno doba života.
18152,koji može da odgovori na fizički stimulans
4074,registar geografskih pojmova kao na poleđini atlasa
14291,osoba sa svetlom kožom i kosom
138,"u računarstvu, proces u toku koga računar izvršava instrukcije"
6046,any of several trees having seedpods as fruits
12868,mala plitka posuda u kojoj stoji šolja na stolu
11405,meso piletine (ili druge živine) prepolovljeno po dužini i pečeno na roštilju (često odmah posle klanja)
7406,opseg u okviru koga nešto radi ili deluje ili ima kontrolu
10742,stanovnik današnjeg Rima
1951,napraviti nered u nečemu
15724,malo vozilo na četiri točka u kome se voze bebe
10254,"muški odevni predmet bez rukava, nošen ispod kaputa"
218,malo primitivno sklonište koje se koristi za život
11425,Češki autor romana i kratkih priča (1883-1923)
8042,Horizontalna komponenta vektora celokupnog kretanja.
2479,Ono što jeste ili je povezano sa brojnijim od dva dela.
13205,"Zdepast glodar koji ima grubo krzno i kratak čupav rep, kopa jazbine i rasporstranjen je po celoj severnoj hemisferi; hibernira se u toku zime."
9467,beli mineral; ruda cinka
854,Vrsta grmolike biljke.
8519,zagovornik principa humanizma
699,u rimskoj mitologiji kraljica olimpijskih bogova i zaštitnica braka; Jupiterova žena i sestra;; u grčkoj mitologiji joj odgovara Hera
19418,uspostaviti ili proveriti upotrebu čega
90,"Rod krupnih jednogodišnjih biljaka poreklomiz Azije, široko rasprostranjenje u umerenim područjima; u nekim klasifikacijama se uključuje u porodicu Moraceae."
7426,položaj studenta
14385,Vitka evropska sova koja živi u evropskim četinarskim šumama; ima duge ušne rese.
18294,"ćelija u germinalnom sloju kože (stratum spinosum, sloj bodljikavih ćelija) ima mnogo bodlji i zrakaste (radijacione) procese"
12540,mladunče konja
7332,obično tanka ravna masa punjenja
5165,Instrument koji koriste oni koji nadgledaju.
15789,Dan posvećen verskom svetkovanju.
15160,"Patuljasta evropska zova, lek kod ujeda zmije."
16902,znak koji se stavlja iza broj da označi da je koji deo celine je u pitanju
1698,maziti ili nežno milovati
3744,Sadržaj neposrednog posmatranja ili učešća u događaju.
1687,"obična vodarica, gore smeđa, dole bela; široko rasprostranjena u centralnoj Evropi i Aziji"
10982,tumačiti nešto na određeni način; preneti određeno značenje ili utisak
1894,nešto što spaja ili povezuje
12583,kratak deo (recimo između radijskog ili televizijskog programa) koji se često koristi za reklamiranje
3294,drugi po veličini okean na Zemlji; razdvaja Svernu i Južnu Ameriku na zapadu od Evrope i Afrike na istoku
13095,Dati kao poklon.
9065,plenor
2513,porez koji se sakuplja tako što se zahteva kupovina markice koja se lepi na dokument
17377,bivša osnovna novčana jedinica Holandije
13365,Krilo insekta.
3011,politički sistem kojim rukovodi nekoliko ljudi
17851,ostaci od pravljenja butera od sirovog kiselog mleka; ili pasterozovani mleko koje se kiseli dodavanjem kulture
19146,Neka biljka iz roda Eryngium.
12174,Prestonica i najveći grad Luksemburga.
17804,Bilo koja životinja koja proizvodi polne ćelije (spermatozoide) koji mogu da oplode žense polne ćelije (jaja).
4101,penutski jezik kojim govori narod Takelma
1663,proces kada se čovek čega priseća (posebno proces povraćaja informacija mentalnim naporom)
2670,bakalar koji se prvo usoli pa se onda suši; koristi se za tortu od bakalara
9740,Mala haringa koja se obrađuje kao sardela.
8723,izumrla grana indoevropske jezičke porodice poznata iz zapisa i značajna za rekonstrukciju praindoevropskog
1868,Vitak morski pas rasprostranjen po svetu; plavo telo prelazi u belu boju na stomaku; opasna naročito za vreme katastrofa na moru.
11196,Okružiti nekoga tako da se primora na predaju.
3283,Spermatozoid ili jaje.
13800,a grain of barley
12372,deo gramatike koji se bavi izvođenjem (derivacijom) reči
227,"Koji privremeno nije aktivan, o vulkanima"
13717,glagolski oblik koji označava trajnu radnju
17487,pesma čiji stihovi počinju slovima alfabeta u pravilnom redosledu
4367,Pomerati ili izazvati pomeranje brzo tamo-amo.
12635,(pravo) propuštanje izvršavanja obaveza
6076,Fotografije ili drugi vizuenli materijal u štampanim publikacijama.
5315,gavke
11332,Znak koji nešto čini očiglednim.
4279,doći na površinu
18498,skup na kome se služi burgo paprikaš
271,Proizvesti smeh.
8799,"U arhitekturi, visoki valjkasti objekat, vertikalno postavljen koji podupire neku strukturu."
8518,"u računarstvu, datoteći server koji može da se koristi samo za tu funkciju"
187,Tipski rod porodica Scincidae.
8501,(računarstvo) datoteka koja sadrži podatke koji služe kao ulaz u uređaj ili program
12646,odeća dizajnirana za nošenje u krevetu
14560,Neki od raznovrsnih nepripitomljenih sisara iz porodice Canidae koji liče na domaće pse za razliku od šakala ili vukova.
11748,grčki departman u centralnom Peloponezu
10813,tteorija i praksa navigacije kroz vazduh ili prostor
15689,"u računarstvu, bit koji se koristi u proceduri za detekciju greške u kojoj se dodaje 0 ili 1 svakoj grupi bitova tako da one sve zajedno imaju ili neparan ili paran broj jedinica, tj. ako se koristi neparni paritet, svaka grupa dolaznih bitova koja ima paran broj jedinica sigurno sadrži grešku"
16889,Dete koje je muško.
6994,Poljski miševi iz starog sveta.
17444,Slučaj promene; brzina ili veličina promene.
7309,koji se odnosi na pravu; koji ima jednu dimenziju
3965,na šta prava zadržati
18,Stanje u kome je neko tužan.
8731,Neka? biljka iz roda Phlox; uglavnom iz Severne Amerke; gaji se zbog cvetnih grozdova.
7388,Ukupnost novčića.
2918,Kolač koji sadrži crnu čokoladu.
105,Radnik koji je najamljen da obavi posao.
12502,Mali rod veoma otrovnih dvogodišnjih biljaka: kukut.
10520,Koji se odnosi na grudni koš ili toraks.
2653,Bosiljak.
9861,filozofska teorija znanja
3679,liker sa ukusom anisa i sladića
3430,vreme koje prtekne od stimulansa do dogovora na njega
12996,"pica sa paradajzom, sirom i inćunima"
12405,kvalitet da je šta opšte ili široko rasprostranjeno ili da ima opštu primenljivost
1980,novčana jedinica Letonije
2996,Biti u mogućnosti odreći se nečega ili ga pokloniti.
18957,Drveće poreklom iz tropske Amerike i Afrike sa mlečnim sokom i velikim palmolikim lišćem.
17472,"Bilo koja od raznovrsnih, uglavnom hladnokrvnih vodenih kičmenjaka, koji imaju krljušti i dišu na škrge."
17158,Uspostaviti odnos.
11735,Severnoamerički rakun.
2435,Proizvesti zvuk duvanjem ili na sličan način.
17709,ćelije sunđera koje poseduju bič (flagellum) a oko njega imaju ogrlicu citoplazme; one održavaju protok vode kroz telo
11611,"jezik Laponaca, nomadskog naroda severne Skandinavije i poluostva Kola"
18711,Nauka koja proučava žive organizme.
9845,Jedno od para peraja koje je smešteno odmah iza glave kod riba i pomaže im da kontrolišu pravac kretanja.
4154,Familija mesnatih gljiva čije se spore lako odvajaju od klobuka a često i jedna od druge.
16912,Višegodišnje močvarne biljke sa tvrdim i sabljastim listovima.
16331,u grčkoj mitologiji jedna od 50 morskih nimfi koje su bile kćeri morskog boga Nereja
3309,Igrati karte za novac.
16675,modulacija amplitude (radio) signala nosača
15738,stubičast grafikon koji predstavlja distribuciju frekvencija; visine tsubića predstavljaju uočene frekvencije
7018,Glista čije je cilindrično telo izdeljeno i spolja i iznutra.
1143,osoba koja je prešla iz jedne vere u drugu
591,Jedan od viđe delova koji se jedan s drugim slažu u celinu.
6830,Sivi delfin sa spljoštenim nosom; čest u severnim morima.
1692,koji se odnosi na lingvistički afiks
13376,Porodica dvosupnica iz reda Sapindales koja se javlja uglavnom u severnim umerenim područjima.
13468,Morska školjka koja ima grubu nepravilnu školjku; nalazi se ugalvnom na morskom dnu u priobalnim vodama.
7210,jednostavan objektno orijentisani programski jezik nezavisan od platforme koji se koristi za pisanje apleta koje klijent preuzima sa veba i koji se izvršavaju na klijentovoj mašini
15712,Biljka poreklom sa Mediterana sa dubokim korenom; ima plave cvetove i peraste listove; gaji se zbog dugačkog slatkog korena.
18064,koji se pojavljuje unutar države ili među građanima države
2196,Jedna od četiri karte iz špila na čijem je licu slika kralja.
4965,skandinavski jezik koji je zvanični jezik Danske
4138,Građevinska konstrukcija (obično zakrivljena) koja služi da premosti otvor (arhitektura).
15072,neko ko seče ravno staklo po zadatim dimenzijama
10243,gusta supa od junetine ili ovčetine sa povrćem i prekrupom od ječma
9046,Uglavnom tropska američka penjačica; neke rađaju jestivi plod.
163,Koji je u životu.
5335,providni ljubičasti varijetet kvarca;poludragi kamen
4103,zakonodavna skupština u određenim zemljama (npr. u Japanu)
4704,"sistem filozofije dominantan u srednjovekovnoj Еvropi, a zasnovan na Aristotelu i crkvenim ocima"
2349,neka od brojnih malih jestivih riba; obično se hvataju štapom i udicom i ne mogu se kupiti
8870,Osoba koja je rođena na nekom određenom mestu; osoba kojoj je to mesto zavičaj.
19129,nalog apelacionog suda kojim se zahteva od suda koji poseduje pisane (trajno zabeležene)postupke da navede dokumentaciju sa (tog) suđenja
4180,bilo koja krivica zbog koje se može podneti tužba za naknadu štete
14260,struktura koja potpuno okružuje deo tela
7541,"grupa ostrva u Atlantskom okeanu, blizu obale Senegala"
15330,Čin slaganja elemenata u posebne grupe bez obzira na red.
11313,klavijatura sa žicama koje se trzaju trzalicom
4908,Rasa ljudi svetle kože.
15992,osnovna novčana jedinica Avganistana
14849,pomorandža sa slatkom sočnom pulpom; često sa tankom korom
9742,"Jegulje koje žive u slatkoj vodi kao odrasle, ali se vraćaju u more da se mreste."
15368,napraviti ponudu; u svim vrstama pravnih dogovora
203,Mesto gde se dešava neka radnja.
5968,Biljka iz roda Valeriana koja ima? i bele ili mastilo-plave cvetove; lekovita biljka.
3099,peć na drva (nekad ugalj) koja služi za kuvanje
19050,Postupak koji primenjuju medicinski ili stomaptološki radnici.
10005,Rod zeljastih biljaka iz porodice Solanaceae koje nemaju stabljiku.
7282,"Mala, tanka riba duga oko 25cm, telo joj je prekriveno pločastim krljuštima; uglavnom živi u dubokim vodama severnog Pcifika."
15002,stanovnik Jamajke ili poreklom sa Jamajke
10636,Urezati brazdu u stub
4924,silabičko pismo kojim se zapisuju sanskrit i hindi
19269,bantu jezik kojim se govori u južnoj Somaliji
1115,reč koja označava radnju ili stanje
10787,dobijanje slike unutrašnjih organa tela.
4407,izmišljeni slon koji se pojavljuje u mnogim francuskim knjigama za decu
13805,bilo koja od raznih igara koja se igra loptom (okruglom ili ovalnom) u kojoj dve ekipe pokušavaju da upute ili pronesu ili uteraju loptu u tuđi gol
40,Sastavljati od komponenata ili delova.
5652,large American birds that characteristically catch insects on the wing
13382,Jedan od telesnih oirgana za kontrakciju.
4057,(odnosi se na zvukove i glasove); onaj koji ima nisku frekvenciju ili tonsku visinu
4157,Afričke antilope: los.
11910,končast produžetak nervne ćelije
2199,heklana ili pletena odeća koja pokriva gornji deo tela
5046,Čin verbalnog obaveštavanja.
12946,Proizvoditi cvetove.
10572,Grupa predstavnika ili delegata.
938,"Ravna prenosna površina, obično pravougaona, smišljena za igre na tabli."
233,u regularnim koracima bez prekida
16414,Drveće i druge biljke u velikom gusto pošumljenom području.
11806,mišić koji približava deo tela ka centralnoj osi
9907,Drveni duvački instrument s jednim jezičkom i ravnom cevi.
35,granu leksikologije koja proučava oblike i poreklo vlastitih imena
15886,sportska vožnja bibiklom
5642,Znanje koje je akumulirano sistematskim izučavanjem i koje je organizovano po opštim principima.
1927,Rod iz porodice Loranthaceae: 1 vrsta.
13282,prokariotske bakterije i modrozelene alge i različiti primitivni patogeni; zbog nedostatka konsenzusa kako da se podele organizmi u kola (lat. phylum) data su neformalna imena za glavnu podelu
13743,ukrašavanjem umetanjem skupocenijeg i plementijeg materijala u jednostavniju podlogu
11356,Učestvovati u nečemu.
1040,"u grčkoj mitologiji gorska nimfa, personifikacija odjeka"
14452,Od koga potičete (ali obično dalji od dede ili babe).
4054,Predstaviti kao slično.
15229,mržnja usmerena prema promenama ili prema svemu što je novo
5230,Majmun iz savane sa zelenkastosivim leđima i žutim repom.
2683,Uglavnom tropske drvenaste biljke; praktično nepoznate kao fosili ali se smatraju bliskim naslednoj liniji kritosemenjača.
8640,Tipski rod porodice Hyaenidae.
1146,rastresita zemlja bogata organskom materijom
917,Uključuje biljke cvetnice koje proizvode seme ztvoreno u ovarijumu; u nekim sistemima se smatra klasom (Angiospermae) a u drugim razred (Magnoliophyta ili Anthophyta).
9159,Federalna republika u unutrašnjosti centralne Evrope.
2203,rat između saveznika i sila osovine od 1939 do 1945
13460,Rod medljike.
1793,Jedna od dvanaest karata iz špila na čijem je licu slika.
1014,matematička notacija koja ukazuje koliko puta se neka veličina množi sama sa sobom
10972,Postati aktivan i bljuvati lavu i stene; o vulkanima.
2005,uglenixani materijal dobijen zagrevanjem uglja ili druge organske materije bez prisustva vazduha
11529,Opskrbiti nekoga opremom za posebnu namenu.
6488,opaliti ili se isprazniti
1956,"Deo nameštaja sa stolnjakom, servisom i priborom za jelo."
17031,Male sltakovodne ribe sa bodljikavima perajama iz Afrike i južne Azije.
2246,reptil koji ima par otvora u lobanji iza svakog oka
16713,ispirati usta i grlo tečnošću za ispiranje
478,proučavanje pravila za formiranje gramatičnih rečenica u jezicima
3683,Organ koji vodi sudske poslove.
160,mehanički ili električni eksplozivni uređaj ili mala količina eksploziva ; može se koristiti za iniciranje reakcije razornog eksploziva
14524,"lična sloboda od ropstva, zarobljeništva i ugnjetavanja"
9948,Čin iznošenja predloga.
5539,samleveno goveđe meso
8499,koji se odnosi na šamanizam
18333,izumrli jezik semitskog naroda koji je okupirao Kanan pre izraelskog osvajanja
10122,Materijal koji treba da se štampa; isključivo grafički materijal.
11430,dijalekt španskog kojim se govori u Meksiku
862,prekursor plazma ćelije
13086,pečena vekna od mlevenog mesa
10511,Biti od koristi ili koji pruža uslugu.
14371,štampano kolo koje može da se prikopča na računar da bi mu se uvećale mogućnosti
119,Nagon za polnom prisnošću.
2850,politika očuvanja domaćih kultura (u suprotnosti sa akulturacijom)
7330,u grčkoj mitologiji mitsko čudovište sa tri glave koje je Herkul ubio
8525,Tipski rod porodice Balaenidae: grenlandski kitovi.
1939,dijalekat italijanskog kojim se govori u Toskani (posebno u Firenci)
17898,kobasica ili mesna vekna od naseckanih parčića mesa glave i ponekad papaka i jezika teleta ili svinje
3910,koji se odnosi na asocijaciju (pridruživanje)
20,"presuda(odluka) da optuženi nije kriv, odluka o nepostojanju krivice,o oslobađanju od krivice"
6011,"plod iz loze muskatnih dinja, vrsta slatke dinje u srodstvu sa krastavcima"
17567,"Neko ko pravi modele (za šivenje, stolarske radove i sl.)"
18600,Ukloniti unutrašnji deo ili jezgro nečega.
8556,reka koja protiče kroz Njujork
12063,Zajednica ljudi ujedinjenih u odupiranju nečemu.
289,Neko nižeg ranga ili položaja ili kvaliteta.
14288,bog vetra u drevnoj mitologiji
11996,severna grupa ostrva u Malim Antilima
13431,Zimzeleno drvo sa crvenim bobicama and pljosnatim igličastim lišćem.
17432,motorna alatka za sečenje drveta
15291,bonito
10809,Reći da nekome.
17284,grana filozofije koja analizira zaključivanje
3479,Neka od mnogih penjačica iz rodova Convolvulus i Calystegia koje se uvijaju.
1408,Aromatično seme koje se koristi kao začin slično karanfiliću i cimetu; posebno za turšije i sosove.
19283,nokat na palcu
15397,oblik matematičke logike u kome istinitost može da ima kontinuum vrednosti između 0 i 1
2014,deljeni on-line dnevnik na koji ljudi mnogu dnevno da kače svoje beleške o ličnim iskustvima i hobijima
8374,Cena zaračunata za neki artikal ili uslugu.
1970,"belančevinasta materija, supstanca od koje se sastoje rožnati delovi tela"
19432,Obično udaljeno skrovište koje koriste ljudi izvan zakona.
18526,učiniti normalnim ili izazvati da bude usklađen sa normom ili standardom
8050,zamišljena linija koja spaja tačke u kojima se nešto dogodilo u isto vreme
8223,Mali krevet za bebe koji je sa strane zatvoren da beba ne bi ispala.
2512,Vodeni sisar mesožder koji ima izduženo telo specijalizovano za prlivanje udovima koji su pretvoreni u peraja.
17266,elektronski uređaj koji kontroliše koordinate kursora na ekranu; pomera se po ravnoj podlozi
5365,koji se tiče seoskih stvari
1823,Uglavnom zeljasta biljka sa upadljivim cvetom; neke se uzgajaju zbog ukrasa.
2106,Tropski i suptropski zimzeleni žbun ili malo drvo.
5741,Familija Lauraceae.
14604,kritički procieniti
8817,Veliko skoro izumrlo evropsko divlje govedo sa dugim rogovima; smatra se pretkom domaćeg goveda.
4555,ustanova ustanovljena da pruža pomoć onima kojima je potrebna
15050,u rimskoj mitologiji nevina boginja lova i mesečine; u grčkoj mitologiji joj odgovara Artemida
18616,Java aplikacija; aplikativni program koji koristi veb pregledač klijenta da obezbedi korisnički interfejs
13999,Tvorevina koja je potrebna da bi se preduzela ili obavila neka usluga.
314,"Baviti se kreativnom aktivnošću, kao slikanjem, pisanjem ili plesom."
5308,Ekler preliven čokoladom.
9556,"Odvezati i osloboditi, kao od šarke."
6265,Visoki lonac u kome se kuva kafa.
2881,"glavni grad Svazilenda, na severozapadu zemlje"
4249,stanje odsustva svakog zvuka
15049,stanovnik ili poreklom iz Angole
3355,crvena boja koja se dobija sušenjem tela insetkta košenil
5430,o spondejama ili koji je sačinjen od spondeja
4949,zaraditi na nekoj komercijalnoj ili poslovnoj transakciji; zaraditi kao platu ili dnevnicu
10237,podupirač koji se stavlja na kraj reda knjiga da bi stajale uspravno (na polici ili stolu)
18687,čin ili proces kompresije.
10401,Stražarske dužnost.
11267,Čin razmenjivanja jedne stvari za drugu.
5168,bitka u Američkom ratu za nezavisnost u kojoj je Danijel Morgan porazio Britance
16683,Široki otvor cevastog predmeta.
12806,Karte koje u igri kartama drži neki igrač u bilo koje vreme.
13668,sresti se
14326,neoplođena jaja jastoga; pocrvene prilikom spremanja; koristi se kao garnir ili za bojenje sosova
4499,Godišnje ili višegodišnje zeljaste biljke.
8061,postupanje protiv nekog drugog načina rada koji se vama ne sviđa
7506,Zeljasta planinska biljka iz porodice žabljaka sa žutim cvetovima.
7615,bivša osnovna novčana jedinica Austrije
16408,"u računarstvu, kopija datoteke ili direktorijuma na odvojenom skladišnom uređaju"
17491,književni dijalekat staroengleskog
7771,mišljenje koje se stvara prosuđujući nešto
3216,gramatički odnos između reči i imeničke sintagme koja bliže određuje značenje te reči
2542,"Primitivna riba mesožderka izduženog tela; živi u svežim vodama, rekama i jezerima Severne Amerike."
13540,Poklapa se sa redom Pholidota.
15877,publikacija koja čini deo niza ili serije
6275,"dijalekat kineskog kojim se govori u Kantonu i okolnim provincijama, kao i u Hong Kongu i drugde van Kine"
18732,"kontinentalna država jugoistočne Afrike, stekla nezavisnost 1968"
17504,preširoka odeća od materijala za peškir koja se nosi nakon kupanja ili plivanja
3195,polje koje okružuje naelektrisanu česticu
4941,koji obuhvata sve
18916,Način na koji je neko ili nešto sastavljeno.
16989,Gajena biljka kod koje se koriste samo žigovi (delovi tučka); višegodišnja biljka sa loptastom lukovicom.
16574,Čin kojim se neko ili nešto remeti; pokretati nešto.
94,Žlezda endokrinongsistema koja izlučuje horomone direktno u krvni sistem.
13666,grupa od 2 do tri sloga koji čine osnovnu jedinicu poetskog ritma
5471,novčana jedinica Tadžikistana
15056,rat između Kine i Japana (1894. i 1895) za kontrolu nad Korejskim poluostrvom; Kina je potpuno poražena kod Port Artura
4091,društvena klasa koja obuhvata one koji se bave fizičkim poslovima ili rade za plate
17045,"Biti povaljen, biti u horizontalnom položaju."
6451,dijakritički znak (dve tačke) koji se stavlja iznad vokala u nemačkom kako bi se označila promena u zvuku
7694,glavni i najveći grad Lihtenštajna
2756,Zimzeleno drveće i žbunje: mangostan.
9409,"evropski labud, često pripitomljen"
2802,delovi pesničkog dela
