,Sysnet
193,onaj koji je po moralnim kvalitetima ili izgledu nalik na anđela ili sveca
8777,nosač zvužnog zapisa u obliku diska sa neprekidnim udubljenjima; dok se diska okreće gamofonska igla ide po tim udubljenjima
13486,usoljena i sušena haringa
2296,Listopadno drvo s jestivim plodom.
10486,"porodica uralskih jezika poreklom iz Skandinavije, Mađarske, Rusije i zapadnog Sibira (pre ekspanzije slovenskih jezika na ovim prostorima)"
9674,Merni instrument za merenje uglova nebeskih tela.
1132,pridržavati se praznika ili obreda
2130,grčki bog rata; sin Zevsa i Here; u rimskoj mitologiju mu odgovara bog Mars
4174,Evropski vodeni salamandar koji živi u pećinama i ima spoljasnje stalne škrge.
4316,"(šahovska figura koja može da se pomera za više polja, paralelno sa stranama šahovske table"
4905,Grupa ptica.
16364,Rod drveća i žbunja koja ima vredno i lepo drvo.
14902,pečena pljeskavica od mlevene govedine servirana na zemički
5486,"koji se tiče Australije, njenih ljudi i kulture"
12151,Neka od mnogih paprati koje rastu na stenovitom zemljištu iz roda Asplenium.
11485,novčana jedinica Letonije
4681,"lagani kolač koji se pravi od jaja, brašna i šećera ali bez masti"
9336,srazmerno velika neuroglijalna ćelija
7396,država ili nezavisan region gde su porezi niski
2235,iranski jezik kojim se govori u Avganistanu i Pakistanu; zvanični je jezik Avganistana
991,iyučavanje literature
7444,Bilo koji od brojnih sisara sa kopitima koji su površinski slični iako ne moraju da budu taksonomski povezani.
6687,"Specijalista za korekciju deformiteta skeleta, posebno kod dece."
15137,živi na istoku Severne Amerike
7656,Dobiti ili povratiti sa uređaja za skladištenje; o informacijama u računaru.
14796,kombinacija određenog računara i određenog operativnog sistema
5855,molekulska tezina izražena u gramima
3582,indijski jezik Sinda
6038,popis stanovništva
16487,prva školska knjiga iz koje đak uči
15277,"koji služi da poveže dva, po konstrukciji ista, gramatička konstituenta"
15560,novčana jedinica Bahreina
5654,osoba koja hvata ljude ili životinje
3373,Stolica koja može da se sklopi radi lakšeg skladištenja.
10183,Češati neprestano.
422,proučavanje porekla i razvoja reči
13172,"Drvo koštunjava ploda, sa ružičastim ili belim cvetovima, gaji se u toplijim krajevima."
177,u rimskoj mitologiji boginja sreće i sretne slučajnosti; u grčkoj mitologiji joj odgovara nTiha
14256,Specijalista za urologiju.
5027,(pravo) nedozvoljeno (zabranjeno) hvatanje i odvođenje lica protiv njegove volje; nezakonito hapšenje
14458,meso od slabine govečeta
15411,pripadnik pobunjenika u Turskoj koji su se krajem XIX veka borili protiv apsolutizma Otomanskog carstva
13030,proporcija pomnožena sa 100
3353,neko koji živi u pećini
5001,Masa ili gruda čvrsto konsolidovane mineralne materije.
7093,Žena nečijeg oca u sledećem braku.
10239,bela roba u kojoj se hrana može čuvati na niskim temperaturama
4678,Pojedina zvučna jedinica jezika bez obzira na to da li je fonema nekog jezika ili nije.
14418,obavljati dužnost ili držati položaj; služiti u posebnoj funkciji
17283,"sledi pliocensku epohu i prethodi holocenskoj epohi; treća epoha neogenskog perioda ili 6. epoha kenozojske ere; trajao je od pre 1,81 miliona do pre 11.550 godina"
15776,udarni štampač u kojem je svaki znak predstavljen mustrom od tačkica koje su otisnute žičanom matricom
4386,"gramofonska ploča sa koje se čuje zvuk kada se ona okreće brzinom od 33,3 okretaja u minuti"
6098,"Veliki mravojed sa dugačkom dlakom, ima dugačak i lepljiv jezik koji zavlači u mravinjake i termitnjake; živi u istočnim delovima Južne Amerike."
12084,učtivo šta naručiti; izrazite želju za čime
1633,"Neotrovne zmije, čine oko dve trećine svih živih vrsta."
16260,upravljati vozilom ili ga kontrolisati
2111,Živi u rekama
639,"Jedan od dva priznata reda pravih bakterija; gramnegativne spiralne, loptaste ili štapičaste bakerije koje se obično pokreću omoću flagele."
7348,"grana čiste matematike koja se bavi tačkama, pravim, krivim i površima"
10160,ili se odnose na Malajsko-Polinezan ogranak austroneskih jezika
15450,tropsko drveće sa papirnim lišćem i velikim plodom.
8749,"Grupa familija više ili manje naprednog drveća, žbunja i trava koji imaju ?' sadrži 69 familija, uključujući Ericaceae, Cruciferae i Malvaceae; ponekad se klasifikuje kao superred"
10580,Kratak opis događaja (posebno biografskog).
15907,koji se odnosi na bakterije ili je izazvan bakterijama
6114,Pokrivač za glavu koji prijanja.
16071,koji se dešava ili je smešteno izvan nekih granica ili izvan neke površi
9237,Otrvovna ?spurge iz starog sveta preneta i u Ameriku; seme daje purgativno ulje.
6405,"Putovanje koje ima cilj i, obično, uključje povrata."
8436,Ribe koje se odlikuju stomačnim zdeličnim perajima: porodice Mugilidae; Atherinidae; Sphyraenidae.
441,Rod mediteranskih zeljastih biljkaka i žbunja.
1737,u anatomiji svaka struktura koja ima oblik roga
7659,"koji se odnosi na Belgiju, njene ljude i kulturu"
2073,grupa jedinjenja izvedenih iz monosaharida; složena organska jedinjenja sastavljena iz dve komponente: šećera i aglikona.
16211,podeljen ili organizovan u govorne segmente ili govorne zvuke koji se mogu izolovati 
11386,tok promena u razvoju organizma od oplođenog zigota do zrelosti kada može da se proizvede novi zigot
5131,Gomoljasta biljka južne Evrope; lukovica sa razdvaja u odvojene češnjeve jakog mirisa i ukusa.
8546,štap koji se sastoji od čelične šipke sa oštrim vrhom i koji se koristi za razbijanje blokova leda
9642,Koji predtsvlja suštinsku komponentu
3089,Kanal jetre se spaja sa cističnim kanalom (ductus Cysticus) koji polazi iz žučne kesice; ovim spajanjem nastaje glavni žučni kanal – ductus choledochus – koji odvodi žuč u doudenum.
7628,izjava ili tvrdnja sa proverenim informacijama o nečemu što se događa ili se dogodilo
16563,"Rod jednogodišnjih, dvogodišnjih ili višegodišnjih biljaka sa ?racemose cvetovima; mnoge se smatraju korovom."
181,"Doneti do destinacije, izvršiti isporuku."
12234,apstraktna podela celine u sastavne delove s ciljem izučavanja delova i odnosa među njima
7275,"glavni grad Maroka, na Atlantskoj obali"
2691,traka sušene slabine
9281,jam
11167,tanka traka (od drveta ili metala)
11278,severnoafrički geranijum sa mirisni lišćem i ružičastim cvetovima
14331,Govorni čin kojim se saopštava informacija.
7671,jedinica za dužinu koja iznosi 100 metara
13359,fileti haringe iz salamure koji su urolani ili umotani oko turšije
17224,biljna ili životinjska grupa koja ima prirodne veze
5581,Uglavnom tropska morska riba sa mesnatim usnama i snažnim zubima; obično jakih boja.
2643,glagolski oblik koji označava trajnu radnju
17323,Neko ko uzgaja vinovu lozu.
6201,srebrno bela ili siva ruda arsena (FeAsS)
14619,Seme mirođije koje se koristi za kiseljenje krastavaca i turšije.
12057,osnovna novčana jedinica Tonga
4470,sponzor koji rezerviše i postavlja javne zabave
7761,Biljka koja nalikuje travi sa nežnim plavim cvetovima.
9710,molitveno gledanje (posebno tokom večeri religijskog festivala)
5539,"tamno, zrelo pivo pravljeno u Minhenu od desetog veka; ima karakterističan ukus slada"
623,"zaslađena mešavina mleka i jaja pečena, kuvana ili zamrznuta"
11864,u grčkoj mitologiji boginja božanske odmazde i kažnjavanja
15655,Kobra koju su oristili faraoni kao simbol svoje vlasti nad životom i smrću.
10378,"belančevinasta materija, supstanca od koje se sastoje rožnati delovi tela"
16412,Detlići.
8739,"dan za odmor i moltvu: nedelja kod hrišćana, subota kod Jevreja i nekih hrišćana, petak kod muslimana"
15609,SO
10203,Kolač baba preliven sirupom koji sadrži rum.
5020,puding od rendane šargarepe
3694,Uređaj koji ubacuje svež vazduh i izbacuje prljavi.
10384,"član izborne jedinice, građanin koga u vladi zastupa zvaničnik za koga je glasao"
8369,poluga koja pokreće neki mehanizam kad se pritisne
9115,izumrli italski jezik drevne južne Italije
16430,Rod porodice Vespertilionidae.
12793,mineralna voda koja sadrži litijumske soli
4266,"obećavati nagradu nekome kao u priči o ""šargarepi na dugačkom štapu"""
6469,Obavljati funkciju.
16823,jezik na koji se prevodi tekst napisan na drugom jeziku
9603,Geometrijsko telo omeđano sa dvanaest podudranih pravilnih petougaonka.
8718,Hleb napravljen od fino mlevenog pšeničnog brašna.
9533,Ptica sa dugim krilima i slabim nožicama; veći deo vremena provodi u letu.
7977,znak (') koji služi da označi izostavljanje jednog ili više slova u reči
13665,Saxš iz roda Eriophorum;
5496,"Vreme posle izlaska sunca a pre zalaska, dok je napolju još svetlo."
12311,"Mladi domaći pevac, obično nije stariji od godine."
2483,Dati titulu.
13947,agranularni leukocit koji normalno čini četvrtinu broja belih krvnih zrnaca ali se njihovo prisustvo povećava u infekcijama.
12914,koji se odnosi na izoterme
13425,"Informacije (podaci, ideje ili opservacije) koje se mogu koristiti za izradu završnog oblika."
5876,Raspodeliti naširoko.
10375,sočivo koji uzrokuje rasjevanje paralelnog snopa svetlosnih zraka kada kroz njega prođu
15637,uspostaviti ili proveriti upotrebu čega
10195,Široko poznata ličnost.
12365,oblik koji se krivi prema unutrašnjosti
12796,posebna veličina i stil unutar jedne familije slova
5620,"fibrozno tkivo u vidu školjke koje odvaja dva glavna dela mozga, veliki mozak i mali mozak, cerebrum i cerebelum"
13469,muskogijski jezik kojim govori narod Muskogi
14266,o rečima u genitivu koja se koristi u pridevskoj funkciji
5571,Napraviti film ili fotografiju nečega.
3280,"slatko, uglavnom tamno ljubičasto voće slično kupini, nalik na dudove roda Morus"
4867,dozvoliti učešće ili dati nekom pravo da bude deo nečega
16270,Azijski luk sa tankim glavicama; koristi se kao radni zeleni luk.
16825,onaj koji je u stanju sna
3494,štampana i povezana knjiga koja sadrži književno delo većeg obima
15297,pustinjska oblast u južnoj Arizoni
7046,grana indoevropske jezičke porodice; današnji germanski jezici spadaju mahom u dve grupe: skandinavsku i zapadnogermansku
7608,"u računarstvu, kružni put na magnetnom disku po kose se upisuju podaci"
507,Ustavna monarhija na zapadnom delu ostrva Samoa u Južnom Pacifiku.
8003,majonez sa belim lukom
8539,veliki ratni brod koji nosi avione i koji ima dugačku ravnu platformu sa koja poleću avioni i na koju sleću
2775,"Šupljorogi preživar blizak kozi ali sa svojstvima antilope: planinske koze, ..."
1728,"viski destilovan iz kaše od kukuruza, slada i raži, čuvan da odstoji u ugljenisanim hrastovim bačvama"
10768,Rod mekušaca.
688,Preslica i slčne vrste.
3879,sastavljati rime
5141,čovek koji veruje u okutizam i koji verziran u okultne postupke
15390,Porodica gljiva koja pripada redu Agaricales.
11525,jedna od zabavljačica koja izvodi pokrete sa palicom
9623,Lomljivo prozirno telo sa nepravilnom atomskom strukturom.
5444,"Primitivna riba mesožderka izduženog tela; živi u svežim vodama, rekama i jezerima Severne Amerike."
16289,dugačka testenina punjena seckanim mesom ili slabim sirom pečena u sosu od paradajza
8013,grupa parazitskih bakterija koje žive u zglavkarima (krpeljima i grinjama) i koje mogu da izazovu bolesti ako se prenesu na ljude
14456,(o živim organizmima) onaj koji emituje svetlost
14769,senzacionalističko novinarstvo
7086,stanovnik Perua ili poreklom iz Perua
759,proces koji ima veze sa ljudskim jezikom
12819,mleko sa niskim sadržajem mlečne masti
14327,mineral koji se sastoji od stroncijum karbonata
3165,veliki rod višegodišnjih čupavih zeljastih biljkaka; samo neke su ukrasne; često se poklapa sa Pilosella
14623,Vodootporni mantil.
11687,"Uobičajena evropska i azijska višegodišnja biljka, obično s ružičastim cvetovima."
70,koji se odnosi na strukturu ili kretanje zemljine kore
11119,postati svetlije
14879,grana biologije koja proučava životinje
11149,organizam koji uspeva u relativno kiselim sredinama
10231,koji raste ili se pojavljuje u mnogim delovima sveta
12623,komunikacija pomoću prenetih signala
5106,Tražiti nešto.
2628,smola dobijena od biljaka
8190,Obalska ptica selica iz porodice vivaka koje okreću kamenje u potrazi za hranom.
8858,biti konkretan
10641,jedinica za dužinu u metričkom sistemu
15487,Ne izvrći koleno kad radiš ovu vežbu
2354,"ostrvska država, stekla nezavisnost 1960"
2105,Sočni kolač u kojem se nalaze izgnječene suve šljive.
3921,paprikaš koji se pravi sa usoljenom govedinom
2793,koji je klasifikovan prema različitim kriterijumima u sukcesivne nivoe ili slojeve
9395,Afričko drvo koje ima izuzetno debelo stablo i voćku koja podseća na tikvu i ima jestivo meso.
7752,Napraviti mogućnost ili obezbediti mogućnost za nešto; dozvoliti da se dostigne ili izazvati da ostane.
2581,dostupan izvor bogatstva; novi ili rezervni izvor koji se može koristiti kada je potreban
6769,Mala evropska sova.
14979,Deo zemljine površine koji se sastoji od humusa i raspadnutih stena.
9335,rutina koja može da poziva samu sebe
14681,kratko dinstani teleći kotleti preliveni Subiz sosom i jetrenom paštetom prekrivenom rendanim parmezanom i kratko pečeni
6966,"grana matematike koja se bavi infinitezimalnim računom i limesima, nizovima, redovima, integracijom i izvodima"
12841,onaj koji ima stanovnike;
4917,"Neko ko je izučio nauku o lekovima - njihovom sastavu, upotrebi i efektima."
5269,Pobeći iz zatočeništva.
2217,Mesec koji dolazi posle juna a pre avgusta u kalendaru.
10139,Lanac istih restorana.
15996,bivša osnovna novčana jedinica Obale Slonovače
2600,rožac
257,Nepravedno postupanje prema nekoj osobi ili grupi na osnovu predrasuda.
14670,vretenasta bakterijska ćelija naročito proširena u centralnom delu gde su endospore
10319,majanski jezik kojim govori narod Jukateka
11718,Ukloniti neželjene supstance iz nečega.
10533,"Smanjiti se po veličini, opsegu ili rastojanju."
5956,Prenositi nešto ili nekoga; obično na veliku udaljenost.
5932,brazilski orah
69,tražiti uz pomoć nekih natprirodnih znakova
15525,kremasti beli sos koji sadrži ren i senf
2146,Mali rod evroazijskog žbunja sa žutim cvećem i plodom poput mehura.
3261,"stavovi zasnovani na činjenici, želji, mogućnosti i sl. koje prenose glagol ili klauza"
8082,vreme koje prođe dok se odvija neki događaj
12147,koji se odnosi na particip ili koji je formiran od participa
9962,osnovna novčana jedinica Uzbekistana
665,Taksonomska grupa biljaka koja odgovara phylumu (redu) (u bilogiji).
13428,Voćna štangla koja sadrži džem od kajsija.
2250,rebroliki deo koji podupire ili ojačava životinju ili biljku
10055,Prednji deo ljudske noge između kolena i članka.
5986,mašina koja sabira brojeve
10688,"Poljske stenice, prave stenice; uključuje podred Heteroptera (prave stenice) i Homoptera (cikada, cvrčak)."
4443,Neka od mnogih tropskih aromatičnih biljaka starog sveta; godišnje ili višegodišnje trave iz roda Ocimum.
4398,"Medalja od bronze, ili koja izgleda kao da je od bronze, koja se obično daje nekome ko je treći na nekom takmičenju."
17154,osnovna novčana jedinica Gane
16935,narandžast koren; važan je izvor karotena
16564,Medicinski postupak koji uključuje zasecanje upotrebom instrumenata; obavlja se da bi se popravilo oštećenje ili zaustavila bolest živog organizma.
13656,Višegodišnje močvarne biljke sa tvrdim i sabljastim listovima.
3120,vodena površina odvojena od veće površine peščanim ili koralnim sprudom
16471,snabdeti odećom ili odenuti
5287,na ili blizu Severnog pola
14509,Danski autor poznat po svojim bajkama (1805-1875).
13618,"Ukrasna dugačka uska vrpca koju uglavnom samo muškarci nose oko vrata, ispod kragne od košuje, i vezuju je u čvor."
16235,istočna podgrupa malajsko-polinezijskih jezika
8301,podrška za prikazivanje različitih objekata
7160,ravna ploča koja kontroliše ili usmerava protok fluida ili energije
6254,Tvrd i gladak mineral izgrađen od silicijum dioksida u kristalnoj rešeci.
5746,"Postati židak ili tečan; o čvrstoj tvari, kada se zagreje."
14553,osoba nemačke nacionalnosti
6262,obično punjene i pečene
2162,Žičani instrument koji ima tipke.
5076,dugačka i često iskrivljena ljuta crvena paprika
6689,"otrovna bela materija (Pb[CH3CO]2) koja se koristi za izbeljivanje pamuka, za pravljenje emajla i lakova"
7320,ugao između upadnog zraka i prave koja je upravna na odbojnu površ u tački odbijanja
14784,Stanje tela ili telesnih funkcija.
2971,"pica sa paradajzom, sirom i feferonima"
2412,Rod iz familije Piperaceae: Veliki rod uglavnom biljaka penjačica iz tropskih predela.
2427,preobraćen od divljeg
16560,"piće napravravljeno od mešavine sastojaka (kao što su šljive, grožđice, mleko i šećer) koji mogu biti fermentisani tako da proizvedu alkohol; pravili su ga zatvorenici"
14445,"srebrnosiv metal, sastojak retkih minerala; koristi se u legurama magenezijuma i aluminijuma"
9330,Referisati se na nešto.
13757,"U nekim klasifikacijama uključuje Viscaceae: paraziti ili poluparaziti, malo drveće ili grmlje u tropskim ili umerenim predelima; za domaćina se kači pomoću?"
11987,"azijska reka, uliva se u Arapsko more, dugačka 3200km"
13398,čin kojim se nečemu smanjuje dužina
11770,kontrolni karakter koji označava pomeranje kursora ulevo
1981,najveća reka u severnom Sibiru; uliva se u Opski zaliv u Karskom moru
14120,Ukupno izbrojana veličina.
15025,iseći i sakupiti delove čega
1725,Ukupnost prošlih događaja.
9077,kartica na kojoj se podaci beleže uz pomoć ubušenja
11556,Ispit koji se polaže na kraju akademske godine ili polugođa.
4782,stanovnik Koreje ili poreklom iz Koreje
3758,"postati jedinstvena celina, integrisati se"
2977,supa koja sadrži komadiće testa u obliku slova abecede
136,osoba koja se odmara
8232,listovi bilo koje biljke iz porodice Lactuca sativa
376,iznenadna konstrikcija  šupljih organa (kao sto su krvni sudovi).
6766,Neka od raznovrsnih velikih jestivih riba i riba za lov severnih mora; obično se slei iz slane u slatku vodu kada polaže jaja.
12783,motorna testera sa finim zupcima i uskim sečivom za sečenje zaobljenih oblika
11105,koji se tiče Fidžijam negovih ljudi i kulture
4582,novčana jedinica Hondurasa
2133,"U računarstvu, 128 karaktera koji čine ASCII kodnu šemu."
9225,tkanina koja se pravi od pamučnih vlakana
2654,oblik reči koji se nalazi na početku rečničkog članka i alfabetizuje se u rečniku
2804,"(knjiga) povezana tako da je hrbat u jednoj, a strane u drugoj vrsti poveza"
10983,"beli tvrdi metal iz grupe platinskih elemenata i veoma je redak u prirodi; dobija se kao nusprodukt pri proizvodnji nikla, a koristi se kao katalizator"
12501,digitalni računar srednje veličine
5155,osoba iz vaše zemlje
15074,Geološka svojstva zemlje.
2924,Oprema za snimanje koja koristi magnetnu traku.
14326,član političke partije desnog usmerenja
4520,asocijacija država stvorena radi ekonomske i političke saradnje država jugoistočne Azije
3683,jedinica za dužinu koja iznosi jednu desetinu metra
5715,grupa ostrva u Bizmarkovom arhipelagu
10224,Trave; šaš; ?rushes.
9215,program koji se koristi u biblioteci
9190,pustiti krv.
16994,rod stomačnih bakterija
16946,zaštita za nečija stopala
16765,strog rimokatločki red koga je osnovo Sveti Bruno 1084
5399,tikva
16588,Mesnata podzemna stabljika ili koren koji ima reproduktivnu ulogu i služi kao spremište hrane.
103,"Kojim se lako upravlja, koji ustupa."
11786,član nomadskih Berbera iz Sahare
12952,mikser sa električnim pogonom koji vitla sečivima koji mešaju ili sipaju ili rastvaraju hranu
12612,"svaki pisani simbol koji predstavlja glas, slog, morfemu ili reč"
14282,štampano kolo koje može da se prikopča na računar da bi mu se uvećale mogućnosti
3301,dug vremenski period
7807,Bilo koja baštenska biljka iz roda Alyssum koja ima grozdove malih žutih i belih cvetića.
6230,Sloboda pojedinca da koristi svoja prava garantovana zakonima države.
5565,smanjenje cena namenjenih poboljšanju platnog balansa
7863,relativno dug i uzak komad nečega
3516,Drvo iz jugoistočne Azije koje ima jestiv ovalan plod sa tvrdom podljikavom kožicom.
7384,vrsta crvene jabuke
1603,Povezati ili spojiti dva ili više delova.
11979,vojna ustanova gde su stacionirane trupe
8587,Biljka iz roda Barbarea: evroazijski dragušac sa žutim cvetovima koji se gaji kao zimska salata.
14424,glavni grad Kiribatija
7245,"Veliki rod čupavih ili vunastih trava ili žbunja, prostire se uemrenim zonama istočne hemisfere (tropska Australija)."
10426,prekidač koji se koristi za selektovanje između alternativa
11256,u grčkoj mitologiji mitsko čudovište sa glavom bika i telom čoveka; ubio ga je Tezej
7568,neko ko ima master sa kakve akademske institucije
3950,marširati u znak protesta; učestvovati u demonstracijama
7826,rečna patka dugog vrata koja ima izdužena repna pera
850,"Mala zver sa crnm grivom; živi u srednjoj Africi; danju spava, a noću lovi."
261,bilo šta u skladu sa principima pravde
48,Ići ili putovati sa nekim.
319,protivno zakonu ili zakonom zabranjeno
11170,"deo Sredozemnog mora, između severozapadne Italije i Korzike"
5576,jedinica dečaka ili devojčica izviđača
6928,U nekim klasifikacijama uključuje rod Bs; bivo
6290,"u računarstvu, unutrašnja memorija velike brzine koja se koristi za privremeno skladištenje preliminarnih informacija"
825,Materijal koji se koristi za izgradnju zgrada.
792,Kolač koji se sastoji od dve lagane kore između kojih je žele smesa.
802,test dat bez prethodnog upozorenja
8683,(mineralogija) šestokraka zvezdasta figura koje se vidi u nekim kristalnim strukturama pod reflektovanim ili prenetim svetlom
16923,"grupa silikatnih minerala različitog sastava i vrlo savršene kalavosti, izgrađuju mnoge stene"
16136,"jedan od najpoznatijih mehanizama odbrane koji se sastoji od težnji i sklonosti osobe da svoje želje, impulse ili sadržaje podsvesti koji nisu prihvatljivi za sopstveni ego, projektuje na druge osobe pripisujući im slične osobine"
5963,primeniti silu tako da se izazove kretanje prema izvoru kretanja
13348,neformalni obrok koji se kuva i jede napolju
2674,severozapadni deo Crvenog mora koji se povezuje sa Sredozemnim morem preko Sueckog kanala
14395,"koji se tiče Iraka, nexgovih ljudi i kulure"
219,Listopadno ili zimzeleno drveće ili žbunje: bekovina.
2860,"Rod godišnjih zeljastih biljaka, vrlo dlakavih; od Mediterana do jugozapad Azije."
5635,pređeni put u jedinici vremena
12763,učenje koje treba da obezbedi opšte znanje i intelektualne veštine a ne zanimanje i profesionalne veštine
14822,"Neka od različitih uređaja za regulisanje dotoka tečnosti ili gasa, pritiska, temeperature, itd."
14490,vrsta predjela; posoljeni i dimljeni losos
13104,"Veća od dve visoke ptice trkačice koja je slična noju, ali ima tri prsta; živi od Brazila do Patagonije."
10403,mala alka kratkog kljuna koje ima mnogo u arktičkim predelima
9979,Grupno odbijanje da se pribegne nasilju čak i u samoodbrani.
6477,"Vrsta ječma, divlji jeyam."
11152,grana neuronauke koja izučava mozak
7733,Osnovni kapaciteti i oprema potrebni da bi zemlja ili područje funkcionisali.
9447,Imaju vrlo razvijene kožne izraslinena nosu u obliku potkovice i lista; nemaju ušnih poklopaca.
1850,šupljina u lobanji u kojoj su smeštene očne jabučice
1221,slatkovodna patka s pljosnatim kljunom
5246,Verovanje ili raspoloženje zajedničko većini ljudi: glas naroda.
4362,beli metal koji gori jarkom svetlošću; peti element po zastupljenosti u Zemljinoj kori; važna komponenta većine biljaka i životinja
9848,osnovna novčana jedinica Makaoa
9817,koji se odnosi ili je izražen pravopisom
14532,Sistem koji uključuje sve organe koji učestvuju u reprodukciji i u nastanku i iybacivanju urina.
167,Lekar specijalista u medicinskoj dijagnostici.
9451,koktel od tekile i tripl seka sa sokom od limuna i lajma
10989,što nudi osnovne podatke ili uputstvo
8417,"Trava poreklom iz južne Evrope; gaji se zbog jestive stabljike, semena i krošnje."
4884,u grčkoj mitologiji ćerka Helija i majka Arijadnina
336,zagovornik principa monarhije
1159,knjiga ili sveščica koja sadrži zadatke i prazan prostor za unošenje rešenja
13908,stanovnik Grčke ili poreklom iz Grčke
7819,Tkivo kojim se neki mekušci prihvataju za stene.
8742,Staviti u vodoravan položaj.
13423,"doživljavanje osećanja, fantazija, stavova, nagona i odbrana prema osobi u sadašnjosti koje nije adekvatno u odnosu na tu osobu već predstavlja ponavljanje reakcija prema značajnim osobama iz ranog detinjstva, preneto na osobe u sadašnjosti; podrazumeva odnos između tri osobe, subjekta, osobe iz prošlosti i osobe iz sadašnjosti na koju se prenose karakteristike osobe iz prošlosti; u terapijskoj situaciji osoba na koju se vrši prenos (transfer) je terapeut"
3282,"Jedinica informacije koja iznosi otprilike jedan milion (1,048,576) bajtova ili 1024 kilobajtova."
7667,glavna kolna kartica računara
9233,Veličina ili gabarit.
1257,Neka vodena biljka mesožderka iz roda Utricularia; lišće ime je pretvoreno u šuplje hvataljke za sitne račiće.
5499,jestive grudne žlezde životinja
13662,društvena grupa (obično pre pojave pisma)
12263,izazvati hidrataciju; dodati vodu ili ovlažiti
6987,Zaliha ili isporuka hrane.
6450,"lagani popodnevni koji se sastoji obrok od čaja, sendviča ili kolača"
17138,Neka od raznovrsnih gljiva iz roda Erysiphe Koja proizvodi praškastu skramu na površini domaćina.
8680,"osnova za poređenje, referentna vrednost u odnosu na koju se račnaju druge"
2282,Mali glodavci: dikobrazi; pacovi; miševi; veverice; ?marmots; ?beavers; ?gophers; ?voles; ?hamsters; zamorci; ?agoutis.
5558,Rod malih orhideja severne hemisfere.
9872,Dakiri bez alkohola
9100,odnosi se na usmerenje libida na osobu.
12066,Osoba koja je član ministarskog kabineta.
7172,eliminisati urin
