,Sysnet
10497,filozofski sistem koji jesam razviti Lao-tzu i Chuang-tzu koji zastupati jedonstavan i častan život i nemešanje u tok prirodan događaj 
16295,"crn vinski grožđe , poreklo iz okolina Bordo "
14192,pravni dokument koji se neki lice imenovati da upravljati imovina kada jesam izvršilac nepoznat 
13433,napraviti kontakt . 
8707,prikupiti zajedno . 
9154,Jupiterov epitet 
1541,anis 
6672,generator signal ili impusla višestruk voltaža ; obično se moći podesiti impulsni brzina 
15251,osoba koji govoriti više jezik 
2039,novčan jedinica u Sao Toma i Princip 
1635,rukovodilac koji jesam po rang odmah ispod predsednik i moći da ga zamenjivati pod odrexenim uslov . 
5935,osobina atraktivan tanak osoba 
4664,javno ispoljavanje grupni osećanje ( obično politički priroda ) . 
2068,organski pojava koji razlikovati živ organizam od neživ . 
8656,čvrsto pripijajuća odeća koji se nositi za plivanje 
15311,"lek koji kontrolisati ili ubijati neoplastične ćelija , koristiti se u hemoterapija za ubijanje kancerogen ćelija , sav imati nepoželjan nus-efekteat may include nausea and vomiting and hair loss and suppression of bon marrow function "
4270,pita u mali gutljaj . 
4726,evropski aromatičan zeljast biljka sa dlakav lišće i brojni beo cvet ; i zlišća se dobijati gorak ekstrakt koji se koristiti za lečenje i kao dodatak jelo . 
959,engleski pesnik koji jesam napisati alegoričan romansa koji veličati Elizabeta I ( @card@ ) 
6832,malo listopadan evroazijski drvo koji se gajiti zbog smeđ plod . 
9016,bodljikav jastog . 
12860,evropski praziluk koji se gajiti i koristiti kao praziluk . 
10425,novčan jedinica Japan 
4539,"evroazijski drozd srednji veličina , viđati se uglavnom zimi . "
8364,mali kocka sa jedan do šest tačka na strana ; koristiti se da stvarati nasumičan broj . 
7547,predmet pričvrstiti za jedan mesto ( posebno u domaćinstvo ) 
10653,vremenski period u tok koji se u škola držati čas . 
13885,MW 
14162,lek koji uništavati virus 
15731,oblik veoma tanak zlatan folija . 
10559,izuvijati štapičasta pokretan bakterija 
10803,velik ostrvo u Bizmarkovom arhipelag ; deo Papue nov Gvineja 
10539,supstanca koji se moći koristiti kao hrana . 
2848,nešto ne funkcionisati kako trebati 
16152,starati evropski zeljast biljka iz koji jesam nastati mnogi gajen vrsta . 
7217,mali rod peckav trava . 
16332,"država na Panamskom zemljouzu , nezavisan od @ord@ "
7621,varijacija tip ili original 
2368,"oprema koji se praviti slika , obično se koristiti crn kutija sa sočivo i film koji jesam osetljiv na svetlo . "
1356,"nemati zub , a umesto ona u gornji vilica imati dva red poprečno postavljen rožnih ploča koji jesam utvrditi za nepce . "
9090,izraz čiji značenje ne moći da se zaključiti iz značenje reč koji ga sačinjavati . 
6227,Uređaj koji reflektovati zračenje . 
7861,"radnja u koji se prodavati hrana i ličan stvar osoblje u neki institucija , škola ili kamp . "
15932,"priznati bog u prisustvo sveštenik , kao u katolisykoj vera ( ? ) "
4153,prenos duvački instrument u oblik kutija ; metalan jezičac vibrirati uz pomoć vazduh iz mešina koji kontrolisati svirač . 
7646,engleski od @ord@ do @ord@ godina 
12122,kao diktator vladati 
145,Mišić koji služiti da podignuti neki deo telo ( kao kapak ili usna ) . 
16453,rezonovanje koji voditi zaključak koji jesam uzvedeno na baza prethodan zaključak i posredan dokaz a ne na osnova direktan opservacija 
1747,katren u jampski pentametru sa shema rima abab 
8954,staza koji se sastojati od popločan površina za pešak - obično pored ulica ili kolovoz 
7243,osoba koji ispoljavati pobožnost . 
5347,izumro jezik drevan semitski narod koji jesam imati trgovački monopol u star svet 
14720,zapis napisati iznad nešto drugi 
2837,mandast tokom koji se držati odrediti pozicija 
14144,javno prikazivanje obično pisan poruka . 
12789,vrsta tropski trska 
10027,obezbediti ( obično hrana ali moći i nešto drugo ) . 
14627,"vizuelan atribut stvar koji jesam rezultat svetlo koji onaj emitovati , prenositi ili odbijati . "
1975,"vrlo otrovati alkaloid koji se vaditi iz velebilje i drugi biljka , širok zenica i kočiti lučenje žlezda . "
3600,komunikacioni sistem koji se koristiti na javan mesto sa jak ozvučenje 
1283,Tekućina ( kod kičmenjak jesam crven ) koji pumpati srce . 
13782,"pretvoriti u ugalj , spaljivanje "
16179,raširiti više u prostor i vreme 
2997,biti koji prirodan fenomen u koji jesam uključiti heija kao promena na atom ili molekul . 
14118,osnovni novčan jedinica Filipini 
16198,kompanija koji prodavati roba 
4988,proceniti dužina trajanje . 
9389,osoba koji posedovati mnogo materijalan dobro i novac 
6351,čadski jezik koji se govoriti u Čad ; imati @card@ vokal i razlika u vokalskoj dužina 
2852,hemofilija koji se javljati usled kongenitalne deficijencija ( nedostatak ) faktor XIII ; ispoljavati se gotovo isključivo kod muškarac 
5573,metalan provodnik koji se postavljati na visok tačka npr . zgrada i voditi u zemlja i tako jesam štititi od udar grom 
10244,javan srednji škola koji obično uključivati razred od @ord@ do @ord@ 
16927,softver koji se koristiti u arhitektura i inženjerstvo kao sredstvo za precizno crtanje 
561,operacija koji odvajati stavak u grupa po specifičan kriterijum 
5208,učiniti mokriti 
3971,dodati na sam kraj . 
16871,društven sistem koji manjinski grupa odvajati u separatan ustanova 
16494,deo algebra koji se baviti teorija linearan jednačina i lineranim transformacija 
8152,manifestovati nešto ili izneti na videlo . 
14294,Najjužnija tačka Zemljine osa . 
1105,deo zub koji jesam ugraditi u vilica i služiti kao potpora . 
11568,"deo Tihog okean , severoistočno od Australija "
6959,blok zemaljine kor koji jesam ograničiti rased i pomeriti tako da formirati vrh planinski područje 
3369,velik rod trnovit grmlje koji rađati bobica . 
13695,"prednji , providan i ispupčen okrugao deo beonjača "
15963,postati psihološki ili fizički naviknut ( na nešto ) . 
3579,insekt koji imati opnast prednji krilo i stražnji krilo . 
2541,"koji se ticati Senegal , njegov ljudi i kultura "
9151,"trostran troski američki orah , sa uljanim plod i tvrd smeđ ljuska . "
3875,rod iz familija Lymantriidae ; štetočina ( Lymantria značiti neki ko uništavati ) 
15017,koji jesam u takav pozocji da jesam vrh i dno obrnut ( ili unutrašnjost i spoljasnjost ) 
1697,aparat koji uklanjati vlaga 
3962,zeba kod koji jesam vrh kljuna prekrstiti kada jesam zatvoren . 
591,divalj koza iz Iran i susednih predeo . 
7560,koktel Menhetn sa Škotskim viski 
2580,animalan ( životinjski ) virus koji pripadati porodica Filoviridae . 
6922,list papir sa više kolona ; koristiti se u računovodstvo za prikupljanje podatak o finansijski stanje 
3903,"konferencija ljudi koji jesam na različit lokacija koji omogućavati korišćĚenje telekomunikacioni oprema , kao što jesam zatvoren televizija "
3005,kapa sa visok kruna - obično prekriti koža dabar ili svila 
16219,Poluvodena evroazijski višegodišna biljka sa kopljast lišće ; vrsta ljutić . 
2557,ljulj 
16874,evropski baštenski zeljast biljka čiji se lišće kroisti za salata . 
519,jedan od deo na koji se nešto prirodno deliti . 
1900,sporazumevati se preko pismo 
12807,"akronim za "" light amplification by stimulated emission of radiation "" ; optički uređaj koji proizvoditi intenzivan monohromatski zrak koherentan svetlo "
3155,uzimati učešće u društven aktivnost ; interagovati s drugi . 
9937,upijati tečnost ili gas adsorpcija ili absorpcijomtake up a liquid Or a gas either by adsorption Or by absorption 
6536,Švajcarski pisac ( roditi u Nemačka ) čiji roman i pesma odražavati njegov interesovanje za istočnjački duhovan vrednost ( @card@ ) . 
13008,biti koji od raznih kopitarskih sisara koji imati stomak podeliti na četiri ( ponekad tri ) pregradak 
6385,"morski krava , lamantin , manat "
15062,"mali noć sisara koji se hraniti kukac , živa na zemlja ili ispod zemlja . "
6017,zbirka odlomak iz književan delo 
1780,zeljast biljka i Indija koji imati aromatičan seme koji se koristiti kao začin . 
16148,glavni grad Zapadne Samoa 
8731,koji se odnositi na telur 
4305,Čina red Ginkgoales ; uključivati rod Ginkgo i izumro vrsta . 
11462,"mali tanak afrički majmun , imati dugačak zadnji ud i dug kosa oko lice . "
13617,"osoba koji se baviti izdavanje knjiga , serijski publikacija ili muzički materijal . "
16688,velik ovalan stadion sa red mesto za sedenje ; nekada arena u koji jesam se odvijati predstava i takmičenje 
755,udisati vazduh u pluća i izdisati ga. 
15087,dati na razmatranje 
12506,vrsta školjka čiji jesam telo jestivo ; postojati više stotina vrsta ostriga od koji jesam neki zaštićen vrsta 
14571,strepnja u iščekivanje šta hteti se dogoditi 
12601,novčan jedinica Estonija 
3260,( čin ) terapija lek 
9856,glodar iz porodica Geomyidae koji kop ; imati velik spoljašnji bage na obraz ; iz centralni Amerika i jugozapadni Severne replaced-dns large external cheek pouches ; of Central America and southwestern North America 
17261,tradicionalan francuski paprikaš od povrće i govedina 
3057,"vrsta pasiflore veličina jabuka koji rasti na Karibi , centralni i južnoj Amerika "
1554,rad koji se nešto nanositi 
1390,ručni kola koji se koristiti za upravljanje 
14773,wring the neck of 
116,"koji karakeriše ili koji pokazivati odbijanje , poricanje ili suprotstavljanje ; koji nemati pozitivan svojstvo . "
16856,računarski kola sa više ulaz ali samo jedan izlaz koji se aktivirati određenom kombinacija ulaz 
7325,u ran faza u razvoj koji jezik ili književnost 
801,raspodela opažen frekvencija pojavljivanje vrednost promenljiv 
9157,Godišnje i višegodišnji zeljast bilje i žbunje . 
10667,"anatomski struktura koji se koristiti kao polazni tačka u lociranje drugi anatomski struktura , kao u hirurgija ili tačka na koji moći da se izvršiti merenje "
8180,supstanca koji zaustavljati ili usporavati neki aktivnost 
7938,koji se odnositi na geologija ili se zasnivati na geologija . 
17109,pozicija ili ustrojstvo telo i njegov udovati . 
3285,"tečnost u koji jesam krčkan meso i povrće , koji se npr . korista kao osnova za sup i sos "
11656,debeo odrezak seći od goveđi pečenica 
9305,osnovni novčan jedinica Tanzanija 
6695,zaključiti rezonovanje 
8989,pretvarati se u pogled određenih osobina ili stav 
10168,emitovati fin čestica gar 
11591,"imovina koji pripadati neki osoba ili grupa , ona koji jesam oni uložiti ili koji ona po prava pripadati . "
3567,komunicirati ( sa ko ) pismen put 
6955,"mali otvoren kontejenr koji se koristiti za pića , obično sa drška . "
255,obrada podatak koji obavljati računar 
1844,vreme koji pokazivati časovnik . 
4058,"koji se ticati Čad , njegov ljudi i kultura "
10456,tipski i jedini rod porodica Tytonidae . 
660,prebaciti u svoj svojina . 
5908,osnovni novčan jedinica Rumunija 
1648,važan riba severni mora ( posebno Atlantik ) koji se loviti i koristiti ca ishrana 
9424,koktel od rum i sok od limun ili lajma sa šećer i ponekad gorak lista 
8286,"slatkovodni , mali riba iz porodica Centrarchidae , nemastan meso "
8810,zgusnut mleko dobijen isparavanje 
16338,Udaraljka koji se sastojati od trapez sa mnogo žica po koji se udarati drven batić umotan u koža . 
15900,južnokavkaski jezik koji imati @card@ milion govornik i dug književan tradicija 
14089,grupa koji kontrolisati aktivnost politički partija . 
3791,travnat zeljast biljka uglavnom iz Severne Amerika . 
7973,polagati mrest . 
16491,"zglob koji spajati stopala i potkoleničnu kost , tarsus . "
17032,( često množina ) grana elektrotehnika koji se baviti tehnologija elektronski komunikacija na daljina 
13254,hrana koji sadržati pun šećer . 
8174,biljka iz rod Corydalis sa lep lišće i ? ? cvet . 
4677,prolaz ( tunel ili cev ) kroz koji prolaziti voda ili električni žica . 
6715,morski ptica ronilice severni mora : morski papagaj 
15020,rod vrlo rasprostranjen višegodišnji zeljast biljka i neki žubnja . 
1882,stanovnik Sejšeli ili poreklo sa Sejšeli 
11316,položaj sudija 
9864,"složen oblik deoba ćelija životinjski i biljni organizam , najčešće višećelijski , pri koji se u jedro pojavljivati končast tvorevinehromosomes "
14600,jato ptica u leto . 
709,red koji se poklapati sa porodica Plantaginaceae . 
461,roditelj vaš otac ili majka . 
4818,"hartija koji upijati višak tečnost , na primer mastilo "
11727,broj koji se oduzimati od umanjenika . 
307,"onaj koji proživljavati tuga , žalost ili nezadovoljtvo ili označiti ona ili ona izazivati . "
201,"onaj koji vrediti imati , tražiti ili dostignuti "
11661,rod ptica iz red Casuariiformes . 
1481,nefinitni oblik glagol koji se u neki jezik ponašati kao njegov osnovni oblik 
7399,skup nastavnik i administrator u škola 
11002,kopno koji spajati Severnu i Južnu Amerika 
16600,jedan od dva osnovni konstituent rečenica ; predikat se sastojati od glagol i njegov dopuna 
7757,sisar kopitar koji živiti na planina Evroazija ; imati uzdignut rog sa unazad zakrivljen vrh . 
318,koji ne postojati u stvarnost . 
3111,izgubiti svaki nada 
16311,odlučujuće uticati 
16,"Onak koji jesam produktivan , svež , neobičan ; nešto što jesam prvi put smišljeno . "
13835,skup oznaka i pravilo za njihov korišćenje ( u sklad sa SGML-om ) u razvoj hipertekstualan dokument 
12414,stanje do koji dolaziti zbog uticaj majčin alkoholizam na plod tokom njegov embrionalan ( prvi @card@ mesec ) i fetalnog razvoj ( od @card@ mesec do kraj trudnoća ) ; pretpostavljati se da jesam nedostatak enzim alkoholni dehidrogeneze razlog nepravilan i poremećen metabolizam alkohol u embrionalan i fetalnoj jetra plod 
267,tuga izražen plakanje 
268,dati sloboda ; osloboditi od kazna ( kazna zatvor ) 
11125,"porodica mali , obično šareniti leptirov ; mužjak imati kratak prednji noga . "
6885,"glavni grad Mjanmara , treći po veličina "
10958,"nauka koji se baviti prikupljanje , rukovanje , skladištenje , pronalaženje i klasifikovanje zapisan informacija "
11921,u grčki mitologija Ahilov prijatelj koji jesam ubiti u trojanski rat ; taj jesam naterati Ahil da se varati da se boriti posle svađa sa Agamemnon 
14435,senzacija do koji dolaziti kada receptor ukus na jezik i u ždrelo preneti informacija o hemijski sastav rastvorljiv stimulusa . 
12837,Učiniti da opet biti svež . 
8454,rastojanj između centar i svak atčke na kružnica ili sfera 
16875,koji se odnositi ili uključivati više nacija ili država 
12259,žuto-crvena velik jabuka koji kasno zreti 
5337,"ukrasni ali otrovan žbun koji imati usko zimzelen lišće i grupa mirisan beo , ružičast ili crven cvet ; poreklo iz istočni Indija ali se gajiti svuda u toplim kraj . "
4960,božanstvo koji se obožavati u drevan Rim 
4603,koji se odnositi ili jesam oboleti od hemofilija 
1470,endoskopski pregled abdomen kroz zid stomak . 
960,elipsoidne bakterija zemljište 
3305,Tražiti nešto što vi pripadati ili jesam vaš vlasništvo ; tvrditi da jesam taj vaš prava . 
10451,vrlo rasprostraniti žbunje i drveće . 
1848,ravan ploča od metal ili staklo na koji se beležiti fotografski slika . 
575,uljast organski jedinjenje koji se ne rastvarati u voditi već u organski rastvarač ; suštinski komponenta živ čelija ( zajedno sa protein i ugljenohidratima ) . 
1577,limen muzički instrument koji imati briljantan ton ; imati uzak truba i zvono ; svirati se uz pomoć ventil . 
3499,"trava sa širok pljosnat lišće koji se gajiti u Evropa i Amerika za ispaša , sena i za lej . "
13663,administrativan jedinica u koji jesam sedište savezni vlada 
2502,"Jednogodišnja , dvogodišnji ili višegodišnji trava : ljutić , žbljaka . "
317,"bakterijski infekcija ograničiti na odrediti organ ili region , posebno onaj koji uzrokovati simptom na drugi mesto "
1219,vulkan na jugoistok Italija na obala sredozemni mora ; erupcija iz @card@ god . p.n.e. jesam unišitla Pompeja i ubiti Plinije Starijeg ; poslednji erupcija @card@ 
149,koji jesam pred erupcija ili izbacivati lav ( o vulkan ) 
8427,hleb sa aroma cimet ; često sadržati suv grožđe . 
16025,Koginitivni proces koji pretpostavljati da jesam znanje na raspolaganje i koji ga koristiti . 
12426,bantu jezik blizak povezati sa jezik zulu 
9408,grupa ostrvo zapadni od nov Gvineja u jugozapadni Tiha okean 
15906,lekar koji jesam stručan za bolest digestivan trakt . 
10373,"u neki klasifikacija smatrati se podporodicom ( Sylviinae ) porodica Muscicapidae : maslinica , ? ? "
5741,tipski i jedini rod porodica Tarsiidae . 
6223,"drvo od jova , jalše ; koristiti se za gradnja most "
13795,hrišćanse veroisipovesti koji jesam se u XVI vek odvojiti od katolicizam 
259,prijateljski narav 
12532,"mali zdepast buldog , gladak dlaka i četvrtast glava ; sladak od sav pas "
8218,koji se ticati Rim i njegov ljudi 
8186,konverzija iz jedan način kodiranje u drugi 
14755,jestiv ptičji organ 
4271,biljka koji segaji zbog jestiv mlad izdanak i sočan lišće . 
9209,velik ptica gacalice iz star svet koji obično imati belo-crno perje . 
2315,neki organizacija koji se smatrati delom velik društven grupa . 
284,"mlad ptica , posebno živin . "
5388,"mleti luk u avan , na primer . "
11489,ponoviti odlomak iz nešto 
240,postati ljut . 
12197,prilika za poseban veselje da obeležiti neki srećan događaj 
9471,zemlja koji upravljati car ili carica 
1373,meso sa vrata životinja 
1718,onaj koji odbacivati zeleniti na kraj sezona ( o biljka ) 
3465,odsustvo veza nešto prema nectem drugi . 
8063,evroazijski orah koji se ceniti zbog jestiv koštunjičavog plod i tvrd drvo ; široko jesam rasprostraniti . 
8516,Tačka ili širina u prostor . 
10923,deo južnog Tihog okean prema Antarktik 
2490,osoba stručan za simbolički logika 
10807,jedan lolojski jezik 
136,intenzivan ojađenost 
16878,stanovnik Zair ili poreklo iz Zair 
776,relative large gnawing animals ; distinguished from rodents by having two pairs of upper incisors specialized for gnawing 
4798,od neki nešto tražiti ili zahtevati . 
1265,"hemijski supstanca koji moći da se širiti municija i drugi sredstvo i da izazov smrt i obolevanje ljudi , životinja i biljka . "
17005,izraziti čestitka 
7721,bantu jezik 
9544,vojni jedinica u koji jesam stran dobrovoljac koji služiti država 
7612,zeleno kiseo voće vrsta limun 
431,"Obično aromatičan žbunje i trabe severni umeren predeo , Južne Afrika i zapadni Južne Amerika : ? ? ? ? "
14362,Događaj kada se istovremeno dešavati dva ili više stvar . 
16010,muzički događaj koji izvoditi svirač ili pevač koji ne uključivati pozorišni prikazivanje 
17106,čin koji nešto postajati širok 
11871,lider koji u politički partija kontrolisati glasanje i diktirati imenovanje 
17382,mek srebrnobeo tokisčan metal koji se koristiti u legura gvožđe ; javljati se u veiše slo\enih mineral među koji jesam patronit i vandanit 
11857,bučan zabava 
1261,prekursor leukocita koji se obično pojavljivati u koštan srž 
4718,uobičajen evropski krastav žaba . 
6647,koji odobravati ustav ili jesam u saglasnost s ustava ili funkcionisati u okvir ustava 
494,porodica severnoamerički indijanski jezik koji se govoriti na jugozapad sad 
5761,koji se odnositi na biologija ili na život i živ biće 
13583,gornji odeća koji pokrivati telo od rame nadole i nositi se napolju . 
2876,"vod koji se sastojati od šupalj , obično cilindričan , objekt koji se koristiti da držati i provoditi tečnost i gas . "
9166,osnovni novčan jedinica Turska 
4578,prostor za jedan štampan red širok kao i stubac a dubok @card@ / @card@ inč ; koristiti se kod reklamiranje . 
6578,privremeno prekinuti aktivnost pre nego što se nastaviti . 
3633,ukazati na neophodnost kakav zahvat ( u medicina ) 
14708,"vodozemac samo sa jedan , prednji para noga . Spoljašnje škrga zadrxavaju kao i Protej ceo život ; nemati očni kapak ; majušan oči se providiti kroz kožica koji ona pokrivati . "
1350,vrsta jak liker destilovati iz fermentisanog palmin vino ili fermentisane melasa 
6913,"tčin dovođenje nešto do najvećemoguće tačka , vrednost ili pozicija "
9711,izazvati da biti u radnom stanje . 
11463,izumro osko-umbrijski jezik drevan Italija na koji jesam sačuvati samo par zapis 
12697,biti koji od dva znak interpunkcija ( { ili } ) koji služiti da zagraditi deo tekst 
2906,isti izgovor za reč različit porijekla 
375,struktura sačiniti od ili koji sadržati krvni sud 
9970,glavni i velik grad Šri Lanke 
3745,spiny-finned food fishes of warm waters having well-developed teeth 
638,rod evroazijski trava kod koji se smenjivati lišće i cvasti upadljiv zvončić . 
4043,tipski rod porodica Tragulidae . 
10268,"žičan instrument koji jesam prethoditi violina , koristiti jesam se do @ord@ vek "
1576,"ponoviti pokret ud i telo pri plivanje , veslanje i sl . "
3669,koji jesam korenski tip ; koji jesam povezati sa lingvistički koren ili koji činiti isti 
11607,Lini na karta koji povezivati tačka koji imati isti brojčan vrednost neki promenljiv 
5325,strm visok obronak ili stena 
3663,HN 
5243,transmisija koji hteti pokrenuti kao odgovor transmisija od transpondera 
1052,neki ko pisati roman 
334,svetlozelen deciduous senovit drvo južne Evropa . 
8085,otpočeti poduhvat 
6910,koji se odnositi ili jesam karakterističan za Istočnu Nemačka 
2835,Godišnja biljka od Mediteran do Portugal ; imati bodljikav čašični listić . 
3482,objekt koji jesam stvoriti čovek uzet kao celina . 
6938,uglavnom tropski višegodišnji žbun koji rađati plod s mnogo seme : sladak i ljut paprika . 
15815,"naziv cifra @card@ , znak koji obeležavati broj tri "
12762,novčan jedinica Gvineja Bisao 
9894,čin odvajanje ili povlačenje 
7970,prostor oko telo koji zračiti u koji njegov elektromagnetni oscilacija moći da delovati na sličan telo koji s on jesam u kontakt 
288,grana računarstvo koji se baviti pisanje računarski program koji moći da rešavati problem kreativnocreatively 
12673,britanski pisac ( roditi u Irska ) ( @card@ ) . 
13199,oštar alat za obeležavanje površina ili za probijanje mali rupa 
12715,mesto stanovanje vojni osoblje 
13184,telo luxdi koji se baviti neki učen profesija . 
12362,ženski ovca 
13821,biti koji skup tačka koji zadovoljavati niz postulat neki vrsta . 
2236,"duboko izbrazdati žućkast braonkast tropski voće ; koristiti se sirovo kao povrće , u salata ili kad jesam potpuno zreo kao dezert "
4779,skakavac sa kratak antena . 
11957,period velik društven i politički promena u narodni republika Kina od @ord@ do @ord@ godina 
16860,"reč , sintagma ili klauza koji činiti deo velik gramatički konstrukcija "
201,"neki mali insekt , posebno ušenci , koji sisati sok iz biljka . "
9254,voden bixke mesožderka ; rod Utricularia ; Pinguicula ; Genlisea . 
15628,imati na leđa kožan nabor koji ličiti na peraja ; trbuh ona jesam brazdast ; živa u sav more . 
7020,glavni grad Eritreja 
4948,u oblik čun 
14295,serija pesma koji povezivati isti tema 
16816,figura u ravan koji činiti dva poluprečnik kružnica i pripadajući luk 
6315,izazvati da se pokrenuti udarac . 
9333,glavni i velik grad Mongolija 
16497,neki od više uglavnom tropski udav sa ? vestigal zadnji ud . 
13455,"bibliotečki katalog u oblik listić , kartica složen u poseban ormar "
4226,koji se odnositi na filozofski doktrina relativizam 
16078,električni kola koji jesam tako napraviti da uvesti proračunat kašnjenje u prenos signal 
16824,"pitati koji se praviti od pasiran bundeva , mleko , jaje i šećer . "
1127,pržiti i mlevan koren biljka cikorija koji se koristiti da zameniti kafa 
4886,Doći u nov zemlja i promeniti stalan boravak . 
15419,"koji odgovarati književnost , pre nego svakodnevan govor ili pisanje "
1732,osnovni novčan jedinica u Sao Toma i Princip 
16116,javan plesni dvorana gde se plesti uz snimljen muzika 
14061,jezik Persija ( Iran ) u biti koji od svoj drevan oblik 
11567,jedan od deo u koji jesam nešto podeliti i koji zajedno činiti celina . 
351,o ćelija ili koji se odnositi na ćelija u sporangijama gde se razvijati spor 
4368,deo telo kod čovek ili životinja ispod struka a iznad butina 
693,specijalista za onkologija . 
5213,novčan jedinica Gruzija 
12287,neki od mnogobrojan korenski biljka iz rod Chenopodium koji imati mali zelenkast cvet . 
12573,evropski kozodoj 
6917,"država u centralni Afrika , setkla nezavisnost @card@ "
1153,"republika u centralni Amerika , postati nezavisan od Španija @ord@ "
4747,podešavanje koji dovoditi do taj da se nešto dešavati ili ponavljati usaglašen 
5610,večernji služba za mrtav u rimski katolički crkva 
11982,potopiti ( ili delimično potopiti ) grepsti u reka ili duž obala 
12626,pustinjski oblast na zapad Australija 
14414,politički doktrina Makijaveli : biti koji sredstvo ( ma kako beskrupulozan ) vladar moći da koristiti vladar u cilj uspostavljanje i očuvanje svoj autokratski vlada 
9887,pokretan parac tkivo koji jesam delimično povezati s telo . 
12849,prestonica Hrvatska . 
10311,biljka iz rod Montia koji imaja jestiv ukusan lišće . 
3643,postati napeti ili napet . 
9496,"kompakt disk koji se koristiti sa računar ( a ne sa audio sistema ) ; moći se pohraniti velik količina digitalan informacija i moći ona se pristupiti , ali ona korisnik ne moći menjati "
16127,red riba koji pripadati nadredu Malacopterygii i uključivati som . 
5584,uzrokovati da nešto visiti 
12659,glavni grad Gabon 
6285,merni jedinica za temperatura . 
11905,"postaviti znak , kao duž cesta . "
3873,hermafroditski suvozemni ili voden glista čiji jesam bodljika rasporediti duž telo . 
12146,gljiva koji proizvoditi po površina obično beo naslaga organski materija . 
15210,malo bobičast voće 
13552,antivirusni protein koji proizvoditi ćelija koji jesam napasti virus ; sprečavati razmnožavanje virus 
2549,Događaj koji se ponavljati u određenim interval . 
