,Sysnet
9166,beli ili crvenkast mineral koji se sastoji od hlorida potsijuma i magnezijuma
5914,drevno carstvo koje je zauzimalo prostor oko reke Nil i kojim su vladali faraoni of Israel; centered on the Nile River and ruled by a Pharaoh; figured in many events described in the Old Testament
16772,sve što služi tome da šta razdvojenim zadrži ometanjem vida ili pristupa
14258,Zadržati za neko kasnije vreme.
19144,čin pokretanja nečega po prvi put; uvođenje nečeg novog
15084,bronhije i pluća
17130,australijsko drvo sa prijatno kiselim plodom koji podseća na tikvu
1646,dizati na treći stepen
2351,učestvovanje u igri ili sportu ili kakvoj drugoj rekreaciji
2036,staviti nešto u nešto
6422,Bilo koja pokretna imovina (posebno odevni predmeti).
4294,oprostiti nekom deo kazne na koju je osuđen
14415,zapadna podgrupa malajsko-polinezijskih jezika
17981,Azijska zimzelena voćka.
10385,Čovek koji nema nikakve titule.
1531,poslovno odelo koje se sastoji od jakne i prsluka i pantalona
19074,"lagano se pomerati, kao da visi"
13372,Arterije koje krvlju snabdevaju jetru.
18400,dvostruki sloj peritoneusa koji se drži za stražnji zid trbušne duplje i pridržava tanko crevo
11585,Rasprostranjenja niska jednogodišnja korovska biljka čija cvetna krunica liči na zvezdu.
7167,izumrli jezik Asiraca koji je smatran dijalektom akadskog
230,činjenje dobra; osećaj dobrotvornosti
13764,lirska pesma sa složenim oblikom strofa
5660,"oblik glagola koji je određen u pogledu vremena, lica, broja i načina"
16330,niz pokreta stopala koji sačinjavaju neki ples
6790,imaju na leđima kožni nabor koji liči na peraje; trbuh im je brazdast; žive u svim morima.
14545,operacija koja sledi pravila Bulove logike; operandi i rezultat operacije uvek imaju jednu od dve moguće vrednosti
13797,KZ
5279,o protozoama ili koji se odnosi na protozoe
9346,Rod otrovnih biljaka iz umerenih područja severne hemisfere sa lučnim uvećanim laticama.
7789,koji se odnosi na životinje iz klase Amphibia
4459,uzrokovati da se šta kreće duž kakve ose ili u drugom pravcu
10213,"glagol (poput ""biti"" ili ""postati"") koji povezuje subjekat s rečeničnom dopunom"
8822,čin obrađivanja korišćenih ili odbačenih materijala za upotrebu u stvaranju novih proizvoda
4327,"Lekar početnik, ili apsolvent medicine, koji radi kao lekar pod nadzorom starijih lekara."
9129,"Deo nameštaja sa stolnjakom, servisom i priborom za jelo."
6884,koji se odnosi na ili je karakterističan za pleme
1618,prikazivati se emitovanjem svetlosti kao zračenjem
6862,osnovna novčana jedinica Lesota
15228,piroplazme i patogeni stoke
4784,"koji se tiče Paname, njenih ljudi i kulture"
18936,"koji se odnosi ili primenjuje na administraciju grada, opštine ili okruga a ne na neku širu zonu"
4913,punč napravljen od Mozela i šećera i kisele vode ili šampanjca sa ukusom slatke lazarkinje
119,Biti prihvatljiv ili pristao.
18509,Deo ćelije koji sadrži DNA i RNA i odgovoran je za arst i reprodukciju.
2707,Pravedni ili zakoniti deo nečega; finansijska uključenost u nešto.
8565,nauka o zemlji koja proučava fosilne organizme i srodne ostatke
122,nadmoćan ili povoljniji položaj
8797,koji se pojavljuje unutar države ili među građanima države
16478,Mali palčić crnogoričkih šuma severne hemisfere.
18703,okrugli crveni koren koji se koristi u ishrani
17995,porodica šljuka i vivaka
11916,u grčkoj mitologiji kraljica Tebe koja se neznajući to udala za sopstvenog sina Edipa
7839,indijski jezik Sinda
5637,Rezati pilom.
13628,Poklapa se sa podkraljevstvom Parazoa: sunđeri.
15020,novčana jedinica Sudana
16139,ekranski orjentisan interaktivni program koji omogućava korisniku da na ekranu sređuje finansijske i druge numeričke podatke
2188,"knjiga ili sveska u koju se unose narudžbe kupaca, mušterija; obično u više primeraka (kopija)"
12364,Supstanca koja čini telo.
2812,Disciplina koja se bavi veštinom ili umećem primene naučnog znanja na praktične probleme.
17132,Bodljikavi jastozi.
15687,strmi visoki obronak ili stena
971,Familija gljiva koje parazitiraju uglavnom na lišću; uključuje ?powdery mildews.
398,Škola u kojoj đaci uče da plešu.
14923,legendarno stvorenje koje liči na malog starca i živi u dubinama zemlje i čuva zakopano blago
2641,tastatura za ručno unošenje karaktera koji će se videti na ekranu ili odštampati
2704,Rod paprati koji pripada porodici Dennstaedtiaceae.
19329,jedan od dva osnovna konstituenta rečenice; predikat se sastoji od glagola i njegovih dopuna
10490,uzrokovati da se šta kreće napred i nazad
19248,metoda za analiziranje ili predstavljanje statističkih podataka
5981,Tehnički aspekti funkcije nečega.
14143,šta poručivati udaranjem (npr. prstima ili palicama)
6231,Pozorišna predstava gde priču uz pratnju muzike izvode baletski igrači.
9078,Geometrijsko telo omeđano sa dvanaest podudranih pravilnih petougaonka.
3550,Postepeno se smanjivati ali ne nestajati potpuno.
7827,Tipski rod porodice Motacillidae: pliske.
7986,prostirati se u krivinama i zavojima
1360,Federalna republika u unutrašnjosti centralne Evrope.
14154,nešto ponovi iyraditi unoseći izmene
19219,glavni i najveći grad Gane
10125,Šahovska igra za dva igrača od kojih oba imaju po 12 figura: cilj je preskočiti protivničke figure i tako ih blokirati.
11232,Porodica reptila.
7872,gazirano piće sa ukusom korena sarsaparile ili sa uljem breze ili lovora
11450,pripadnik ljudi koji se živeli u Severnoj ili Južnoj Americi pre dolaska Evropljana
7757,Zona grada ili varoši.
14484,meso od slabine govečeta
8339,Drvo citrusa koje radža narandže.
18675,mehanizam koji prenosi magnetnu traku preko glava za čitanje i pisanje uređaja za slušanje s magnetne traka ili za pisanje na nju
9300,bilo koja od raznih igara koja se igra loptom (okruglom ili ovalnom) u kojoj dve ekipe pokušavaju da upute ili pronesu ili uteraju loptu u tuđi gol
8533,oblik reči koji se nalazi na početku rečničkog članka i alfabetizuje se u rečniku
9505,simptom koji se pojavljuje i postaje vidljiv
3833,koji ima ili se sastoji od deset slogova
13078,osnovna novčana jedinica Sirije
8530,GH
11055,Socijalno okupljanje gostiju ili drugara.
2779,stranica pravouglog trougla naspram pravog ugla
12344,(genetika) organizam ili ćelija koja poseduje diploidni set hromozoma od svakog roditelja
14181,Rasa ljudi svetle kože.
19132,Američki matematičar rođen u Austriji poznat po svoje dve teoreme nekompletnosti (1906-1978)
1512,Meksičko piće od fermentisanih sokova agave
7688,Tipski rod porodice Anabantidae; male ribe koje liče na grgeča.
9074,način na koji se konac uvrće ili prave čvorovi tokom vezenja
8929,filozofska učenja o biću i saznanju
15206,sijuski jezik kojim govori narod Katauba
14655,prva strana nekih knjiga koja sadrži samo naslov
10646,Praoci neke osobe.
33,formalno istupanje iz kakvog saveza ili federacije
9368,anatolski jezik
12870,Pomazanje kao deo religijskog obreda isceljivanja
6178,koktel koji se pravi od viskija i gorkog lista i šećera sa komadićima voća
18367,Pojava koja nastaje naglim oslobađanjem energije zbog lomljenja i kretanja litosfernih stenskih blokova i koja uzrokuje širenje seizmičkih talasa kroz Zemljinu koru.
8042,"u računarstvu, instrukcija koja povezuje jedan deo programa ili jedna element u listi s drugim programom ili listom"
12636,Električno pražnjenje koje putuje duž nervno vlakno.
42,na čijem se licu očitava zadovoljstvo
18547,Pozvati nekoga u kuću.
15622,put kroz koji protiče voda
19177,Drvo iz porodice breza koje raste na vlažnom tlu.
11664,Bodljikav grm sa plodom koji nalikuje šljivi.
2550,zemljišne bakterije koje pretvaraju nitrite u nitrate
2592,po legendi čarobnjak koji se predstavljao kao savetnik Kralja Artura
10902,jedna od dve cevi kojom mokraća iz jednog bubrega ide u mokraćni mehur
17262,"Staviti u nešto, kao u kutiju."
5870,stanovnik Vijetnama ili poreklom iz Vijetnama
16963,a widely distributed perennial sedge having small edible nutlike tubers
17999,Stanje služenja kao službeni i autorizovani predstavnik ili zastupnik.
11865,čin prikupljanja informacija
8059,"Kretati se brzo sopstvenim nogama, tako da je jedno stopalo uvek uvek podignuto sa zemlje."
567,komadni stoni pribor u kome se služi jelo
13662,prostor u kome važe Euklidove definicije i aksiome; metrički prostor koji je linearan i konačno-dimenzionalan
13644,Mešana hrana bilo složena na tanjiru ili promešana i poslužena sa prelivom; obično se sastoji od zeleniša ili ga sadrži.
17911,drevni jezik kojim su govorili Kasiti
18346,gambuzija
12688,uređaj koji konvertuje digitalni signal u analogni
7028,tužena strana i njen tim pravnih zastupnika
22,"Onak koji je produktivan, svež, neobičan; nešto što je prvi put smišljeno."
11305,plodovi mora u Njuburg sosu posluženi na tostu ili pirinču
11629,Najveća zemlja Južne Amerike
434,pismeni dokument koji opisuje otkrića nekog pojedinca ili grupe
10515,Dete koje je izgubilo oba roditelja.
18265,"Utisak, trag što ga, u obliku trajnih ili prolaznih promena, na protoplazmi ili na tkivu živih organizama ostavlja neki nadražaj, čulni utisak."
1903,"stanje u kome se suspenduju određena prava i slobode građana, a proglašava ga država u vanrednim okolnostima"
17620,Vodena biljka iz roda Ceratophyllum; formira podvodne mase u barama i sporim potocima.
16458,Period od 12 lunarnih meseci.
17990,želatin napravljen od ribe
1882,Rod iz familije Macropodidae: tipični predstavnici kenguri i ?wallabies.
2397,rad kojim se nešto nanosi
1767,Lampa koja radi na struju.
17543,vreme između početka i kraja vremenskog perioda
204,ispunjen divljenjem i ushićenjem
14712,"Drveće, žbunje i trave široko rasprostranjene na obe hemisfere."
17024,"koji se tiče Finske, njenih ljudi i kulture"
4036,zgrada u kojoj se nalaze svlačionice za kupače
5678,Bilo koji od 24 regiona zemljine kugle određenih geografskom širinom u kojima se koristi isto vreme.
8284,kozodoji
6928,Muzički instrument kod koga zvuk proizvodi zatvorena stub vazduh koji se pokreće disanjem.
15867,pozorište u kome se izvode opere
6647,rat u koji su uključene sve veće svetske sile
2209,herpes virus koji inficira kožu i nervni sistem
1631,Kasava koja ima dučak gomoljast koren i meke krhko stablo; koristi se za spravljanje opjnog pića i tapioke.
4268,kopija pozorišnog scenarija koju koristi šaptač
16739,Transportna linija koja koristi tramvaje.
13751,"Ptičji red: ptice koje ne lete, imaju zakržljala krila, dugačke kljunove i male oči: kivi."
908,"Mašina u kojoj ploča koja se okreće proizvodi vibracije gramofonske igle, a ove vibracije se uvećavaju akustički ili elektronski."
7124,Rod drveća i žbunja koja ima vredno i lepo drvo.
17772,Višegodišnja biljka šumskih predela koja cveta u proleće.
14917,"u računarstvu, vreme koje je potrebno da bi se glava za čitanje i pisanje pomerila do potrebne staze na disku"
201,Koji ne može da se desi ili ostvari ili s kojim se ne može rukovati.
9227,goveđi odrzak sa boka životinje
10132,lemur jugoistočne Azije
16930,"u računarstvu, datoteći server koji može da se koristi samo za tu funkciju"
6239,koji se odnosi na bakterije ili je izazvan bakterijama
4551,muskogijski jezik kojim govori narod Čiksau
3506,tvrdo belo ili žućkasto drvo od drveta iz roda Pinus
13422,južnoamerička reka od kje nastaje Rio de la Plata
16310,obavljati dužnost ili držati položaj; služiti u posebnoj funkciji
4782,"u matematici, neprazan podskup matematičke grupe"
10064,Sirovina za boje i lakmus.
8891,vrsta gramnegativnih aerobnih bakterija koja proizvodi gas i kiselinu iz šećera a ponekad učestvuje u vrenju (zakiseljavanju) mleka
605,jedan zahtev
16600,istraživanje namenjeno određivanju najefikasnijeg načina da se nešto uradi
18239,jedinica za dužinu koja iznosi jednu desetinu metra
14694,Preuzeti vođstvo ili inicijativu: učestvovati u razvoju nečega.
18630,"Obično aromatično žbunje i trabe severnih umerenih predela, Južne Afrike i zapadne Južne Amerike: ????"
2660,duž koja spaja dve tačke na kružnici i prolazi kroz njen centar
5048,(filozofija) filozofska teorija o funkcijama znakova i simbola
11711,Gladiole.
18133,"u radiologiji, organ koji prima terapeutsku dozu radioaktivne supstance."
15039,Deo Ujedinjenog Kraljevstva.
11767,ono što ima masu i zauzima prostor
758,verski praznik za Jevreje
2618,zakrivlen na spolja
4264,bilo koja osoba u oružanim snagama koja drži položaj od autoriteta ili komande
5299,"sos koji sadrži majonez začinjen biljem, senfom i kaprom; služi se npr. uz salatu i hladno meso"
6325,Pelikani; ?frigate birds; ?gannets; ?cormorants.
10023,čin dovođenja dve stvari u dodir
9679,rod tuplia
19131,Živi u šumskim predelima Južne Amerike; štrcaju na neprijatelja tečnost koja širi strašan zadah.
7579,dravidski jezik kojim se govori u jugoistočnoj Indiji
2744,Rod porodice Patellidae: običan evropski prilepak.
17993,ukloniti nekoga sa položaja ili iz službe
2503,najraniji oblik francuskog jezika; koristio se od 9. do 15. veka
16628,koji odlazi ili je bio u prošlosti
19010,osnovna novčana jedinica Butana
12129,mešavina alkoholnog pića i vode ili gaziranog pića poslužena u visokoj čaši
17394,"privatni zapisi, lični dmevmik (kao stvar)"
18015,Potrošiti rasipno.
1810,Jednogodišnja ili višegodišnja zeljasta biljka sa aromatičnim fino nazubljenim lišćem.
7485,Carski rez je operativni porođajni zahvat kod koga se porodilji otvara abdomen i materica a zatim se kroz taj rez vadi beba.
12148,jedinica koja se koristi da meri težinu
1998,Čin promene lokacije s jednog mesta na drugo.
11894,"meso malde kokoške srednje veličine, pogodno za prženje"
5632,morski pauci
14432,deo računarskog programa u kome se niz instrukcija izvršava više puta dok se ne zadovolji određeno stanje
12847,potpuni popis stvari sređen po određenom sistemu
13163,Rasa velikih ovčarskih pasa koji se koriste u policiji i kao vodiči za slepe.
150,Koji ne pokazuje dovoljno pijeteta prema Bogu.
16911,Uglavnom zeljaste biljke iz starog sveta.
3681,Paprat umerenih i tropskih podučja; u nekim klasifikacijama se smešta u porodicu Polypodiaceae a unekima u rod Asplenium.
7222,proučavanje efekata ekonomske geografije na moć države
13656,"Izabrati i slediti; o teorijama, idejama, politici, strategijama ili planovima."
17357,prirodni predmet koji liči na mašinu po strukturi i funkciji
9684,Mali sisar mesožder sa kratkim nogama i izduženim telom i vratom.
297,Zadatak koji je dodeljen osobi ili grupi.
6033,"Dlaka joj je gusta, a noge kratke i jake; na prstima prednjih udova ima kandže za kopanje; na nosu ima rožni štit; živi središnjoj Australiji."
2690,kost noge
10812,visoki uspravni megalit; pronađeni uglavnom u Engleskoj i severnoj Francuskoj
7136,"pozorišni komadi koji naglašavaju iracionalni ili nelogični aspekta života, obično da pokažu da je savremen život bez smisla"
3429,izraziti ili potvrditi klimanjem
4524,Severnoatlantska kljunata ulješura sa okruglim čelom.
9065,koplje bačeno kao oružje ili na takmičarskim terenima
10028,U nekim klasifikacionim sistemima smešta se u porodicu Polypodiaceae.
2302,"rod koji se odnosi najpre na bića ženskog roda, kao i na entitete koji su svrstani u kategoriju ženskog roda"
11522,Administrativna jedinica u vladi.
15597,"Reč, na primer zamenica, koja se koristi da bi se izbeglo ponavljanje. Referent anafore je određen njenim prethodnikom."
17019,kuhinjski pribor koji se koristi za kuvanje na pari
18816,glavni i najveći grad Venecuele
2290,osnovna novynana jedinica na Tajvanu
19457,struktura koja se koristi za odbranu
2934,čin postizanja nekog cilja ili izvršenja nekog naređenja
1676,jastozi toplih voda bez klješta; oni iz Australije i Južne Amerike obično se prodaju kao smrznuti repovi; takođe se pronalaze i na Floridi i Kaliforniji
16554,stanje nepovezanosti u pamćenju ili mašti
1978,tipski rod porodice Alcidae koga čini samo njorka
16350,Taikmičenje sa pravilima koja određuju pobednika.
5593,kompleks prteina koji kombinuje amino-kiseline s drugim supstancama
18780,venac od lovorovog lišća koje su u antičko vreme junaci nosili na glavi
15342,sendvič sa tanko sečenom piletinom
3898,rod porodice lasta Hirundinidae
8183,buba iz južne Evrope
17588,"Struktura nalik zubima kod bezkičmenjaka koja se nalazi u usnoj duplji, u probavnom kanalu ili ljušturi."
4671,jedan poseban događaj
14633,Odvojen i zaokružni objekat.
11302,porodica jezika koja uključuje eskimski i aleutski
4701,mineral koji se sastoji od skandijum itrijum silikata; izvor skandijuma
142,osećanje naklonjenosti
3015,Koji se odnosi na zakonodavstvo ili se sastoji od članova zakonodavnog tela.
2251,Aktivnost pri kojoj naprežete mišiće na razne načine da održite kondiciju.
3874,zao postupak
7950,Napraviti dostupnim ili pristupačnim.
11217,Lekovita biljka s perjastim lišćem i plavim cvetovima.
8051,Jato ptica u leto.
6789,meso riba iz slatkih voda koje se koriste u ishrani
18645,Čvrsti spoljašnji ugao zgrade; posebno onaj koji nastaje od ugaonog kamena.
5481,"u grčkoj mitologiji vodena nimfa, kći Okeana ili Nereja"
13937,izbaciti veliki deo rukopisa
9421,Familija Ranunculaceae.
10887,"Sfinkter koji okružuje anus, čmar."
16807,krilato čudovište sa glavom orla i telom lava
14796,neka protozoa koja ima providno peharasto telo sa retraktilnom stabljikom
9903,"Čini 15% populacije ćelija jetre, pripada mononuklearnom fagocitnom sistemu, a ima ulogu u  fagocitozi, prezentaciji antigena, sekreciji humoralnih medijatora (TNF, IL, prostaglandini), uklanjanju eritrocita i  deponuje gvožđe, teške metale (Hg, Sn), lipide."
171,Koji dovodi (pričinjava) fizičku neudobnost.
1279,mesto gde brodovi mogu da ukrcavaju ili iskrcavaju tovar
16723,drevni kananski jezik Hebreja koji je oživljen i uspostavljen kao zvanični jezik Izraela
972,dokument koji je sačinila i izvršila samo jedna strana (jednostrani pravni posao)
15358,Prepoznati ili uočiti razlike.
7863,"dug i debeo komad drveta, metala ili maltera itd, koji se koristi u građevinarstvu"
6258,"Jelen, irvas, los"
10352,Velika luksuzna kola; često ih vozi šofer.
9450,javno ili službeno najaviti
8440,Prestonica Hrvatske.
120,"žalovati, tugovati, ili osećati gubitak zbog nečega što je učinjeno ili nije učinjeno"
18228,ići indirektnom rutom ili bez podešenog tempa
9837,"jedna od brojnih malih ravnih, jestivih riba Atlantskog okeana sa glatkom kožom"
16449,Crkveni obred kojim se nešto čini svetim.
9942,Komercijalno najvažniji cipal.
665,"U botanici, obično podzemni organ koji nema ni pupoljke, ni lišće ni čvorove; apsorbuje vodu i mineralne soli; obično pričvršćuje biljku za zemlju."
17088,Započeti ili voditi rat.
6351,doručak koji se obično sastoji od peciva i kafe ili čaja
4926,reproduktivni organi kod žena
11542,Staviti odeću na telo.
8672,nalaze se na vlažnim mestima kao kružne želatinozne kolonije
18246,prepelica
1120,lanac maloprodajnih objekata
18877,rod porodice Perdicidae
15810,čin kojim se nešto upadljivijim nego što jeste
3421,Biljka čiji se sočni mladi izdanci kuvaju i jedu kao povrće.
8083,Potez kao u fudbalu
5334,Neka od porodica vodozemaca.
216,Vratiti se posle odbijanja.
4113,Napraviti kontakt.
2585,"Tipski rod porodice Rheidae; velike i visoke ptice trkačice Južne Amerike, slične nojevima ali manje od njih."
3133,Višećelijski organizmi ćije su ćelije manje specijalizovane nego kod Metazoa; sastoji se od samo jednog kola: Porifera.
14047,koji se tiče ili je karakterističan za Gvatemalu
17454,Telo mrtve životinje ili osobe.
18365,Kretati se sigurno ili postepeno.
11752,Mikroskopska jednoćelijska praživotinja.
5169,"svetlo, zrelo pivo sa jakim ukusom hmelja; prvi put napravljeno u češkom gradu Pilsenu"
7918,glava ljudskog bića
7026,"Objekat u kome je sedište visokog obrazovanja, uključujući upravu, smeštaj kao i prostorije za istraživanje i nastavu."
5607,vrsta bakterija koje su obično prisutne u intestinalnom (probavnom) traktu ljudi ili životinja; nekad je patogena; mogu da budu opasne po ispravnost hrane
5290,Udarati ritmično.
6828,Stanje u kome je osoba sa jednom ili više drugih osoba.
6305,Tipski rod porodice Otididae: evropska droplja.
4479,"Tvrd, sjajan plavičasto-beli multivalentan metal; otporan na koroziju."
3518,stanica koja služi kao štab za policiju u određenom okrugu (služi kao mesto odakle se policija šalje i na koje se dovode uhapšenici)
18266,onaj koji ima neuprljanu boju snežnog pokrivača
3419,Italijanski kompozitor opera (1813-1901).
18224,"Obraćanje religiozne prirode, obično za vreme verske službe."
13856,"ukinuti, čega uništenje ili opoziv uzrokovati"
4655,Nešto što se desi u datom trenutku i na datom mestu.
14719,novčana jedinica Pakistana
10144,Beli kristalni oblik natrijum hlorida koji se koristi kao začin i za konzerviranje hrane.
970,"Nemaju nosne kožne izraštaje, a usne školjke i ušni poklopci su im veliki."
7513,koji se odnosi na fonologiju
7089,krater u kome je prikupljen kosmički materijal koji je pao na zemlju
10035,ispuniti ili anulirati dug
14809,nekoliko vrsta ruma sa voćnim sokom i obično likerom od kajsije
1490,"obrtanje normalnog reda reči (kao u ""sir ja volim"")"
10546,prenos toplote ili elektriciteta ili zvuka
12570,"koji jeste ili označava brojčanu veličinu, a ne redosled"
3510,reprezentativni oblik ili obrazac
9990,veštački jezik koji se temelji što je više moguće na rečima zajedničkim za sve evropske jezike
18130,izmereno po dužini
14381,Objekat koji se sastoji od puteva i opreme koja je potrebna za prevoz putnika i roba.
3112,"Morske ribe: sabljarke, morski grgeč, brancin"
11394,Škotska lještarka.
12803,bilo koji od plodova tikve koji sazreva tokom leta; jede se dok je nezreo i pre nego što seme i kora zadebljaju
12472,Prednji deo glave čoveka od čela do brade i od uva do uva.
2915,"izbočen, ispupčen deo tela."
10600,Velike ptice gacalice iz starog sveta koje obično imaju belo-crno perje.
3941,Mali red gljiva koje pripadaju pododeljku Ascomycota i imaju zatvoren podzemni?
6885,utakmica sa palicom i loptom između dve ekipe od 9 igrača; ekipe se smenjuju pokušavajući da pomoću palice ostvare pogodak
166,Postati gori.
12972,Biljka krstašica sa debelim gomoljastim jestivim žutim korenom.
14036,paradajz punjen različitom mešavinom salate i poslužen hladan
10545,(o stranicama knjige) koji ima razrezane listove
5747,skup različitih bolesti respiratornog sistema
23,Osećanje velike sreće.
9893,dravidski jezik kojim se govori pretežno u južnoj Indiji
14238,slikovno predstavljanje i manipulacija podataka uz pomoć računara
8836,ćelija iz koje se razvija kost
7590,opaliti ili se isprazniti
4972,bledo crvena višnja sa bezbojnim ili skoro bezbojnim sokom
9562,Društvena ptica čije perje ima tamnu metalnu boju; gnezda gradi oko naseljenih mesta; široko je rsprostranjena.
5324,Opremiti nameštajem.
6554,"Gruba godišnja trava, rašireni korov; ponekad se koristi za seno i ispašu."
17862,Radnja u kojoj se prodaju cipele.
924,mali vitki galeb uskih krila i račvastog repa
7403,"ispuštai neujednačene zvuke, koji variraju u pogledu jačine i učestalosti"
9009,sat koji se nosi na zglobu ruke
9997,Glavni grad nacije.
18648,čin cepanja na dve grane
5366,odnos naspramne i nalegle stranice u pravouglom trouglu
1547,prenositi ili otkrivati informacije
912,osoba stručna za simboličku logiku
5419,imati ili sadržati određeni tekst ili oblik
14436,Iznenadno ispuštanje energije.
6478,"na primer, premazati oluke lanenim uljem"
18357,"krokodili, aligatori, kajmani, gavijali"
5223,algonkinski jezik kojim govori narod Šoni
7374,Jedan iz serije koja se periodično izdaje.
9653,engleski od 1100. do 1450. godine
797,weakening (reducing the concentration) by the addition of water or a thinner
252,Koji trpi atrofiju
217,pivo koje se prave fermentacijom melase i drugih šećera sa biljnim sokom jele (ponekad sa sladom
300,su ugljene kiseline (sadrži grupu CO3)
7155,glavni grad Bahreina
3290,dardski jezik kojim govore Kafiri u severoistočnom Avganistanu
12427,mali priručnik
9649,"masline koje se kisele zelene, a često se čiste od koštice i pune paprikom ili bademom"
5493,"Rod suvozemnih orhideja koje obično imaju jedan par širokog blještavog lišća oko sredine stabljike; ima ih u umernoj Aziji, Severnoj Americi i Evropi."
18178,Supstanca koja je u fluidnom stanju na sobnoj temperaturi i pritisku.
5512,Oblikovati duvanjem.
9902,koji se tiče Nikaragve i njenih ljudi
15192,Barska biljka Evrope i Severne Amerike koja ima svetlo žute cvetove nalik na zlaticu.
10075,koji je vezan za prilog ili koji funkcioniše kao prilog
17206,Donji deo bilo čega.
719,"dugačka, obično formalna, ženska haljina"
11478,pridružiti ili kombinovati
6547,pretvoriti se u rastvor
2049,smestiti u datoteku
13511,od ili u vezi sa osobom koja je drugoj osobi podređena
16843,Duvački instrument čiji zvuk proizvode cevi poređane u skupove i komprimovani vazduh iz mešine koji se kontroliše pomoću vekie složene klavijature.
64,"Koji nije originalan; nije produktivan, ne donosi ništa neobično niti sveže."
13968,any of several evergreen shrubs and small trees of the genus Illicium
4239,Lekar koji je specijalizovan za bolesti ušiju.
6367,dozvola za prodavanje pića i njegovo konzumiranje u objektu
14076,Zahtevati učešće ili prisustvo nečega.
5554,"sitnozrna, afanatična glinovita stena, koja se cepa u tanke pločice, najčešće sive do skoro crne boje"
14724,operacija koja se vrši istovremeno (ili u određenom intervalu) sa još jednom ili više operacija 
7296,Srediti po klasama ili kategorijama.
3422,droga koja brzo izaziva zavisnost
13689,"čin promene forme, obila ili izgleda"
14599,Nešto što se pokazuje publici.
9524,Odveni predmet koji se nosi na gornjem delu tela.
7173,grafički karakter koji se koristi u slikovnom pismu
2294,"stanovnik Šri Lanke, ili poreklom iz nje"
