,Sysnet
1008,osnovni novčan jedinica Sijera leone 
8917,Žaba koji se ukopavati ; živiti na severni polulopta ; na peta s unutrašnji strana imati čvrst rožnat prevlaka . 
2178,grana zoologija koji proučavati primati 
12815,"hirurg koji ulepšavati telo , posebno lice . "
15037,Višegodišnja zeljast biljka od Mediteran preko Indija do istočni Azija . 
17240,"skoro sasvim voden žaba , poreklo iz AQfrike , Panama i severni Južne Amerika . "
6954,koji se odnositi na ili jesam karakterističan za praistorijski egejski civilizacija 
301,divljački i prekomeran ubijanje mnogi ljudi 
6354,zajednica ljudi ili porodica koji živa zajedno i deliti sav . 
16040,Naučno analizirati . 
14932,svaki odeća koji menjati izgled kako biti sakriti identitet nosilac 
12709,insekt koji imati dva para opnast krilo i legalicu specijalizovan za ubadanje ili probadanje . 
1033,pripadnik rasa ljudi koji se živeti u Svernoj Amerika pre dolazak Evropljanin 
9409,Crno-bela morski ptica koji se hraniti ostriga . 
13406,supstanca koji moći da gora da biti obezbediti toplota ili snaga . 
1433,proizvesti deo ( npr . zgrada ) u fabrika tako da se moći lako transportovati i brzo spojiti na mesto gradnja 
15008,"u neki klasifikacija u ona se smeštati gibon , a nekad se smatrati podporodicom of Pongidae . "
12332,stav koji prirodno slediti iz već dokazan postavka 
2432,Glavni administrativan funkcioner koledž ili univerzitet . 
8686,tkanina koji se presaviti stavljati između noga a pričvrstiti se oko struka ; nositi jesam najčešće beba . 
697,vaspitač koji imati izvršan vlast u škola . 
3455,zakrivlen na spolja 
979,"slatko , posno beo meso riba sa tanak telo ; obično se služiti kao tanak filet "
15848,"glavni grad Lesoto , na severozapad zemlja "
7639,"kratkotrajan grč glasnih žica u larinksu , koji izazivati napad gušenje . "
1732,osnovni novčan jedinica u Sao Toma i Princip 
11201,Učiniti ponovo . 
13809,Upstavna višegodišnji biljka sa plav cvet poreklo iz južne Evropa . 
12961,"majonez sa ren , rendanim crn luka i čio sos ili kečap ; ponekad sa dodatak kavijar "
16519,ime koji prethoditi prezime 
5321,biti uključiti u borba . 
10707,medicinski instrument za ispitivanje larinksa 
4496,papir koji delovati zgužvati ; obično jesam u boja i koristiti se za dekoracija 
9218,shorebirds : plovers ; sandpipers ; avocets ; phalaropes ; coursers ; stoni curlews 
12584,"broj u oblik a+bi , gde jesam a i b realan broj a i jesam kvadratni koren od @card@ "
17070,biti koji od raznih tropski biljka rod Capsicum koji davati paprika 
6791,instrument koji koristiti oni koji nadgledati . 
13016,motorni alatka za sečenje drvo 
3123,rat između saveznik i sila osovina od @card@ do @card@ 
13719,"mali ptica koji se penjati i puzati uz drvo i stena , poreklo sa sverne hemisfera . "
14846,"koji se ticati svet stvar , religija ili crkva "
6416,"mali , jestiv morski puž ; kuvati se u vino ili se peći "
171,Uništiti ili oštetiti na nasilan način . 
4206,"hirurški nožić zašiljiti na oba kraj ; koristiti za mali rez , npr . kod uzimanje krv "
16981,preobratiti u hrišćanstvo 
15146,oblik koji se kriviti ili bubriti napolje 
1402,praktikovati šamanizam 
5220,rez za zatvaranje vrata ili kapija ; šipak koji moći da se spustiti ili kliznuti u žleb 
4667,pustiti u pokret ; inicirati početak . 
12620,elektromagnetski zračenje koji moći da proizvesti fotohemijske reakcija 
893,vozilo na točak koji vući jedan ili više konj . 
16901,prirodan depresija na površina zemlja često ispuniti jezero 
7980,koji se ticati Nigerija 
278,( računarstvo ) direktorijum koji jesam izlistati u neki drugi direktorijum 
6606,"organ i tkivo koji jesam uključiti u proizvodnja i sazrevanje polni ćelija i u njihov spajanje , a zatim i u razvoj podmladak . "
4857,tipski rod porodica Charadriidae : zviždovke . 
15634,mali evropski zeba koji lepo i veselo pevati dok prav gnezdo 
2616,prirodan proces koji se telo samo oporavljati 
9385,ponekad se smatrati podrodom rod bos : američki bufalo . 
8871,postaviti monarh na presto 
13873,tipski rod porodica Anabantidae ; mali riba koji ličiti na grgeč . 
3614,binarni jedinjenje ugljeni sa elemntom koji jesam jače elektropozitivan 
1288,"u matematika , funkcija koji menjati pozicija ili smer osa u koordinatni sistema "
16349,jedan od jestiv ljuskar desetonožaca 
3022,star bog ; predstavljati beskonačnost prostor koji jesam prethoditi nastanak svet 
8281,koji se odnositi na životinja iz klasa Amphibia 
250,nepravedan postupanje prema neki osoba ili grupa na osnova predrasuda . 
16412,Detlići . 
8063,evroazijski orah koji se ceniti zbog jestiv koštunjičavog plod i tvrd drvo ; široko jesam rasprostraniti . 
8136,skup sav fleksivnih oblik jedan reč 
6999,čin izmena koji uključivati suštinski promena 
14636,ER 
10072,bakterijski red ( red bakterija ) 
16319,napraviti nečiji portret . 
16567,porodica jezik koji govoriti Karibljani 
5566,hiljaditi deo amper 
7434,šošonski jezik koji govoriti Hopi 
8822,jedan od tri membrana koji obavijati mozak i moždina 
140,sposoban za korektan i validan rezonovanje 
15504,smestiti u spremište za čuvanje slog 
4738,Prestonca Bosna i Hercegovina . 
2573,vlada jedan zemlja koji činiti njen vlastit ljudi 
12112,"stranica knjiga koji sadržati naslov , ime autor i naziv izdavač "
2239,( 18th century ) a watch with a balanca wheel having a fake pendulum attached taj it 
13939,zamišljen linija koji povezivati tačka koji imati isti temperatura u dat trenutak 
14644,siv ili beo ptica močvarica sa dug vrat i noga i obično sa dug kljuna . 
9030,jezik koji govoriti narod Gvarani u Paragvaj i Bolivija 
9793,"tačka na zamišljen sfera naspram koji izgledati da se nebeski telo projektovati , a prema koji izgledati da se sunce pomerati "
7298,podizati nivo ili količina nešto . 
14615,Pražnjenje elektricitet . 
10810,"rod koji se odnositi najpre na mlad biće , kao i na objekt koji jesam svrstati ni u kategorija muški ni u kategorija ženski rod "
9495,o aktinomicetama ili koji pripadati rod Actinomycetes 
6037,posavetovati se sa svoj lokalan broker 
8243,proces u koji se deo izlaz sistema vraćati na njegov ulaz kako biti upravljati njegov naredni izlaz 
13994,"u računarstvo , deo tvrd disko koji jesam nameniti određenom operativan sistema , ili aplikacija ili on se moći pristupiti kao jedan jedinica "
8923,kratak trajanje ili razdaljina . 
2956,"Najmanja formalan litostratigrafska jedinica , koji se moći izdvojiti na osnova litoloških kriterijum ( ekvivalent u vulkanski izlivnim stena ; tečenje - "" flow "" ) . "
10156,biti koji prebivalište prastanovnik Amerika . 
9809,jak vitak pas španski poreklo sa gladak dlaka ; beo boja sa smeđ ili crn tufna . 
1995,uobičajen beo ili bezbojan mineral - kalcijum sulfat dihidrat - koji se koristiti za proizvodnja cenementa 
10456,tipski i jedini rod porodica Tytonidae . 
5053,moljac i leptir . 
6157,koji se odnositi na govorni osobina koji obuhvatati više od jedan govorni zvuk 
7931,"tikva gladak površina obično dugačak , prav vrata i sladak narandžast meso "
13104,"Veća od dva visok ptica trkačica koji jesam sličan noj , ali imati tri prst ; živiti od Brazil do Patagonije . "
10938,Višegodišnja zeljast biljka mediteranski područje . 
12801,duhovan tekst sav hrišćanski religija 
13144,"evropski senica modar boja ; imati kobaltnoplav krilo , rep i kruna na glava . "
15744,locirati specifičan region hromozom u odnos na poznat sekvenca DNK ili gen ` 
3426,AO 
6049,"imati težina ; imati važnost , nositi težina . "
14938,politika koji regulisati međunarodan odnos 
3840,modifikacija koji sužavati značenje neki element ( ' crven šešir ' imati uzak značenje nego samo ' šešir ' ) 
16908,"engleski astronom ( roditi u Nemačka ) koji jesam otkriti infracrven svetlost , i popisati zvezda i otkriti planeta Uran ( @card@ ) "
14845,"skakavac , zrikavac i ? "
136,sjediniti ili spojiti 
15895,slikar ili crtač portret . 
16493,dati nešto kao garancija 
5967,tip iz familija Čperaceae ; travnat zeljast bixka sa koren ; rasti svuda osim u vrlo hladan područje . 
16308,amino-kiselina koji jesam životinja potreban ali koji oni ne moći da sintetizovati već ona se morati dodavati kroz ishrana be supplied in the diet 
10136,"u računarstvo , program koji jesam nameniti da pružiti opšti podrška rad računar "
6532,Ići sa neki na sastanak . 
9122,"Grčki filozof koji jesam misliti da se celokupan svet sastojati od čestica vatra , voda , vazduh i zemlja ( živeti u peta vek pre Hrista ) "
96,"čadski jezik koji se govoriti u severni Nigerija , blizak jezik Haus "
2952,škamp u Njuburg sos poslužiti u krug od pirinač 
7811,merenje količina toplota 
8110,evropski vodenjak 
13345,kratak mešan pića 
8524,"listopadan drvo sa gladak kor , obično srebrnastosiv boja ; lipa . "
11533,čadski jezik koji se govoriti južno od jezero Čad 
8166,koji se odnositi na padež ablativ 
622,sistem merenje vreme 
8794,mali divalj ili polupomaća evropski šljiva sa loptast sitan plod . 
2004,mera za površina koji odgovarati kvadrat čiji jesam stranica jedan palac ( inč ) 
3937,skup element koji jesam zajednički za dva skup 
13262,indonezijski jezik koji se govoriti na java 
10551,obrok koji jesti osoblje 
12945,Godišnja ili višegodišnji zeljast biljka iz mediteranski područje . 
3679,platiti protivzakonito u zamena za naklonost ili uticaj . 
16109,meso uglavnom Pacifičke jestiv riba iz rod Sarda iz porodica Scombridae ; odnositi se na tuna ali jesam manja 
15660,slaganje u broj između reč koji pripadati isti gramatički konstrukcija ( n . pr . između pridev i imenica koji isti modifikovati ) 
13899,palica koji se koristiti za igranje kriket . 
15007,vršiti vojni služba 
1132,pridržavati se praznik ili obred 
13192,jaje kuvati u kipući voditi 
11984,neki ko praviti ili popravljati odeća . 
7443,vremenski dugo trajati . 
3967,koji se ticati li pripadati ostrvo i država Nauru 
16816,figura u ravan koji činiti dva poluprečnik kružnica i pripadajući luk 
16199,ukloniti u mali komad . 
9237,Otrvovna ? spurge iz star svet preneti i u Amerika ; seme davati purgativan ulja . 
6728,Najniži deo biti šta . 
11366,trovalentan metalan element redak zemljan grupa 
7395,kineski biljka sa palmolikim lišće i mali zelen cvet i aromatičan koren za koji se verovati da imati medicinski svojstvo 
6212,biti stanar ; privremeno boraviti . 
10009,vozilo sa točak koji jedan osoba moći da gurati ; moći da imati dva ili četiri točak . 
14631,Zona grad ili varoš . 
158,koji jesam tužan ili prizivati tuga 
6566,grana elektronika koji se baviti minijaturizacijom komponenta 
13808,broj koji se dobijati kao rezultat deljenje . 
4910,industrijski centar i zvaničan prestonica Holandija ; centar industrija za obrada dijamant ; sedište značajan berza ; poznat po kanal i muzej umetnost . 
4056,neki od mnogi ptica sa dug noga koji gacati po voditi u potraga za hrana . 
7097,osoba koji prosuđivati 
3953,testenina sličan špagetama ali tanjiti niti 
11172,pripremni školski rad koji se obavljati izvan škola ( pre sav kod kuća ) 
9772,adresa na koji neki živiti . 
2044,osnovni novčan jedinica na Bahami 
13805,istorijski doba koji imati izraziti karakteristika . 
10493,"stilski figura koji izražavati sličnost između stvar različit vrsta ( obično formirati sa "" nalik "" ili "" kao "" ) "
8848,stisnuti jedan uz drugi . 
997,biti pažljiv ili siguran da se nešto učiniti ; uveriti se u nešto 
7244,rasprostranjen paparat šuma i vriština ; korov . 
1293,privremen smeštaj u priroda za putnik ili turista . 
13073,"izgubiti jedrina , svežina , posebno zbog gubitak vlaga . "
8386,bivši legija stranac u Francuska vojska koji jesam koristiti za vojni operacija izvan Francuska 
3658,pripitomljen golub koji se uzgajati zbog sport ili hrana 
15788,rod porodica Psittacidae . 
838,jedan od para nerv koji proizilaziti iz cervikalni delo koren kičmeni stub i prolaziti niz grudni koš da inerviše dijafragma i uticati na disanje 
13682,cevast akustički uređaj ubaciti u izduvni sistem koji jesam dizajnirati da smanjiti buk 
7337,mali rod uglavnom severnoameičkih parazitski biljka . 
6160,govor mlad dete u razvoj 
14736,Privući pažnja na nešto . 
4078,"klasa žarnjaka kod koji se javljati oba morfološki oblik , polip i meduza "
15718,uglavnom voden daždenjaci . 
11143,čadski jezik koji se govoriti u Čad 
13860,compensation paid taj the family of a murdered person 
3313,američki dugorep ? blackbird sa sjajan crn perje 
10692,Komad zemlja pripremlje za neki sportski igra . 
4953,drozd koji se isticati lep pevanje 
15489,biljka koji se razmnožavati pomoću spor i koji imati vaskularan tkivo . 
10744,"kiseo ili granitan staklo ; obično taman , ali transparentan u tanak komad "
15722,dijalekt degihe koji govoriti narod Osaž 
3694,Uređaj koji ubacivati svež vazduh i izbacivati prljav . 
9351,"kop stan u planinski predeo kraj obala s dva hodnik ; jedan izlaziti na kopno , a drugi u voda . "
6489,južnoafrički loptast voće sa grub braon kor i slatko-kiselim jezgrovit meso 
9643,kondenzator imati vrednost jedan farada kada jedan kulon naelektrisanje izazov potencijalan razlika od jedan volt na on 
205,procedura koji se preuzimati da biti se doći do medicinski dijagnoza 
1355,područje u zapadni Atlantik gde jesam navodno mnogi brod misteriozno nestati 
16682,"država na severoistok Južne Amerika , postati nezavisan @ord@ "
14818,koji se odnositi na stanje brak 
2642,parac odlomiti ili odseći od nešto 
17088,veštački jezik koji se koristiti za trgovina između govornik različit jezik 
11999,rovka 
8584,star red koji poticati od ran ? eocen : šišmiš : podred Megachiroptera ( ? fruit bats ) ; podred Microchiroptera ( ? insectivorous bats ) 
10236,čin dodeljivanje subvencija 
14704,Isplaćeni novac . 
2214,kružan ili prstenast struktura 
7801,nizak višegodišnji biljka sa zvončastim mirisan cvet . 
15949,osoba koji obavljati volonterski rad . 
9663,učiniti da se gas ili para pretvoriti u tečnost 
7634,romanski jezik koji se govoriti u Italija 
17350,novčan jedinica Pakistan 
248,teritorija koji zauzimati jedan od konstitutivnih administrativan područje država . 
11328,vrsta organski jedinjenje . 
9000,statistički metoda koji davati vrednost koji se moći testirati da biti se odrediti postojati li signifikantan veza među promenljiv 
8767,dugorep nosan 
6912,grčki ep koji se pripisivati Homer koji opisivati putovanje Odiseja posle pad Troja 
11905,"postaviti znak , kao duž cesta . "
9921,dravidski jezik koji se govoriti pretežno u centralni Indija 
3894,desert napraviti od voće uvaljan u testo koji jesam najčešće od krompir 
16157,Pomoćnik koji obavljati korespondencija i činovnički rad za šef ili organizacija . 
608,rat između Severne i Južne Koreja ; Južnu Koreja jesam podržavati sad i drugi članica UN ; @card@ 
803,Čin koji se odustajati i napuštati broba ili zadatak . 
3037,neki od mnogi vrsta lasta sa pomalo razrezan repa i dug šiljast krilo ; obično se sesti u vreme Martinja . 
11274,širok opseg 
4125,skup tačka takav da za svaki par tačka postojati nenegativni realan broj koji predstavljati njihov rastojanje koji jesam simetrično i zadovoljavati trougaonu nejednakost 
8863,"sprot koji uključivati vežba koji trebati da pokazati snaga , ravnoteža i gipkost "
5872,Čin počinjanje nešto . 
10476,stoni digitalan računar za koji se obično smatrati da jesam velik mogućnost od mikroračunara 
5156,neki iz mali familija gušter koji jesam široko rasprostraniti u tomplim područje ; sav jesam bezopasan a korisni jer uništavati npr . insekt . 
11758,"Najmanji od sav miš ; živiti po livada , njiva i vrt . "
3270,KP 
4639,"Višegodišnja aromatičan zeljast biljka , rasprostraniti od Evropa do centralni Azija i Severne Amerika . "
13574,Čin usklađivanje ili podešavanje delovati neki uređaj u odnos jedan prema drugi . 
5287,na ili blizu severni pol 
15150,razvijen sistem koren . 
6783,aritmetički ili logički programski greška koji se otkrivati u vreme izvršavanje program 
6308,biljka poreklo sa Mediteran sa dubok koren ; imati plav cvet i perast list ; gajiti se zbog dugačak sladak koren . 
12932,neki od mnogi širok rasprostranjen biljka sa jestiv koren . 
5654,osoba koji hvatati ljudi ili životinja 
15230,prirodan šumeći mineralan voda 
2049,primjena biološki princip na proučavanje i projektovanje inženjerski sistema ( naročito elektronski sistema ) 
1298,Godišnja zeljast biljka čiji cvet imati samo jedan latica . 
1998,koji se odnositi na dom i porodica koji živiti u on 
2467,Komunistička država koji zauzimati velik deo teritorija Azija ; mnogoljudan država na svet 
11948,obuća za plivanje ; prednji deo poput ploča pomagati pri plivanje posebno pod voda 
16003,šerpa sa knveksnim dno za pripremanje kineski hrana 
1724,vekna francuski hleb 
11628,Tražiti i sakupljati . 
1944,sočan voće sa kor poput pilša i žućkast ili beličast meso 
8925,"GXivasti korali , gljivač . "
14046,"mineral koji se sastojati od izvodni kalijum klorida , važan ruda kalijum "
8877,konačan presuda koji jesam okončati slučaj pred sud posle iscrpljen postupak po žalba 
3692,velik slatkovodni evropski riba koji moći da narasti i do tri metar dužina 
9141,republika na ostrvo Maltau Mediteran ; steći nezavisnostod ujedinjen kraljevstvo @ord@ godina . 
13043,uto-astečki jezik koji govoriti narod Pim 
1783,grupa finski jezik koji sadržati finski i estonski 
99,"osobina onaj koji jesam konstantno , postojano "
5520,znak ili znamen koji jesam ostaviti nešto što jesam proći 
12444,@ord@ slovo grčki alfabet 
2645,glavni i velik grad republika Koreja 
1130,kamarupski jezik koji se govoriti u severoistočni Indija i zapadni Burma 
8099,zvaničan jezik Filipini ; bazirati jesam na jezik tagalog ; leksika vući iz drugi filipinski jezik 
7411,lolojski jezik 
13166,pretvoriti u krečnjak 
4586,stanovnik Austrija ili poreklo iz ona 
119,"koji se žeti , tražiti "
12360,strana neki predmet koji jesam nasuprot prednji strana . 
1741,"ASCII karakter koji označavati prelazak u nov red , tabulator ili povratak za jedan pozicija unazad ; dobijati se istovremen pritiskanje dugme Ctrl i neki drugi dugme "
16840,grana indoevropski jezik koji jesam ( suditi prema zapis i toponim ) biti široko rasprostraniti po Evropa u prehrišćanski perioda 
6940,"u računarstvo , datoteka koji sadržati tekst , i uz on možda i instrukcija za fromatiranje , korišćenje ASCII karakter , ili neki drugi priznat kodni skup "
11776,koreferencijalni odnos između povratan zamenica i njen antecedenta 
945,"sprava koji prav kopija kucan , pisan ili crtan materijal . "
688,preslica i slčne vrsta . 
15358,obožavanje đavo 
14454,pripremljen hrana za ponet 
7245,"velik rod čupav ili vunast trava ili žbunje , prostirati se uemrenim zona istočni hemisfera ( tropski Australija ) . "
10462,zaokružen podela telesni organ 
248,zabava koji držati pažnja . 
5216,glavni i velik grad Madagaskar 
7880,konjski strkalj . 
7696,menjati smer . 
9996,samur 
16623,osobina stečen kao posledica način na koji jesam biti tretirati kao dijeta 
8108,naslov podsekcija koji jesam ispisati u telo tekst 
9270,konstelacija izvan zodijak koji rotirati oko zvezda severnjak 
15123,novčan jedinica Kuvajt 
1343,igra na otvoren koji se igrati na polje određenih dimenzija 
1322,kozji rog 
12673,britanski pisac ( roditi u Irska ) ( @card@ ) . 
1266,nešto što pokrivati gornji ili donji polovina stranica 
12022,status onaj čiji roditelj jesam biti u brak 
7781,akcija ili reakcija nešto pod određenim okolnost . 
3064,mitologija star Grk 
4543,čitanje ili brz pregledanje 
2605,mesto za koji se tvrditi da postojati u verski ili književan spis 
7995,postati deo nešto ; postati član grupa ili organizacija . 
12118,tipski rod porodica Notoryctidae : činiti ga samo torbarski krtica . 
10209,naći nešto kopanje zemlja 
7701,upravljač koji se sastojati od mehanički ili elektronski uređaj koji se zatvarati ili prekidati električni kola . 
3857,dobijanje slika unutrašnji organ telo . 
13792,"usmeriti od jedan odrednica ka drugi , na primer u katalog , knjiga i lista "
15231,Korišćenje ili vežba . 
7854,tačka u pravac suprotan od sunčev apeksa ; tačka od koji se Sunčev sistem udaljavati 
15233,Čin pribavljanje nešto . 
3076,biti koji živiti ili izumreti član porodica Hominidae . 
6269,"jedinica informacija koji iznositi otprilike jedan trilion ( @card@ , @card@ , @card@ , @card@ , @card@ ) bajt ili @card@ gigabajtova . "
13362,romanopisac iz Sjedinjenih američki država koji pisati o ljudi s jug SAD-a ( @card@ ) 
15591,kratkoročno prekidanje svest i smanjenje metabolizam 
2192,toranj na čiji jesam vrći radni prostor sa staklen zid za posmatranje avion na aerodrom 
1154,rat između Kina i Japan ( @ord@ i @card@ ) za kontrola nad korejski poluostrvo ; Kina jesam potpuno poraziti kod port Artur 
13776,Neinvazivna dijagnostički procedura koji koristiti ultrazvuk za snimanje struktura mozak ; zastareo metoda 
1242,"Radijalno simetričan morski bezkičmenjaci , na primer , morski zvezda , morski krastavac i morski jež . "
699,sociološki teorija koji se zasnivati na pretpostavka da društvo dolaziti pre pojedinac 
2011,revolucija koji jesam predovdio Fidel Kastro i njegov gerila protiv korpumpiranog diktator ( @card@ ) 
15630,razmak muzički ritam . 
15487,ne izvrći koleno kad raditi ovaj vežba 
15870,mali jedinica koji služiti kao deo jezgra ili kao jezgra velik politički pokret 
17304,zauzeti teritorija osvajanje . 
9913,"Povrće iz porodica ? : kupus , brokola , karfiol , prokelj . "
3345,prostor u koji vagati Euklidove definicija i aksioma ; metrički prostor koji jesam linearan i konačno-dimenzionalan 
2936,atabaskanski jezik koji govoriti narod Navaho 
190,"na primer , o vukanima ; koji trajno jesam aktivan . "
12399,"Težak vredan metal ; sivo-bele boja , otporan na korozija ' javljati se u neki ruda nikl i bakar . "
10336,"svetlo-crveno okrugao voće sa Malaja , prijatan kiselost , prekriven mek bodlja "
12205,vozilo sa točak koji vući konj 
11004,mali vuk poreklo iz Severne Amerika . 
191,koji s ne pokretati . 
1863,novčan jedinica dominikanski republika 
10130,obala jezero 
7297,"vrsta tambura , trouglast oblik ; ruski narodni instrument . "
17311,"hmelj : tvrd višegodišnji penjačica Evropa , severni Amerika , centralni i istočni Azija , proizvoditi mlečan sok koji se koristiti za proizvodnja piva ; u neki klasifikacija uključivati se u porodica Urticaceae . "
13100,"neki biljka mesožderka iz rod Pinguicula koji imati upadljiv ružičast , žut ili beo cvet . "
2591,potpuno komiliran i sklopiti program spreman za izvršavanje na računar 
7061,lagano udariti 
5733,rod Araucaria 
843,pravougaon komad tkanina koji se koristiti za slanje signal 
754,Oruđe koji služiti za pisanje . 
15194,specijalan grupa koji jesam delegirati da razmotriti neki stvar . 
17398,tlo koji preostajati nakon rastvaranje rastvorljiv element 
8960,jezik čiji iskaz odgovarati problem korisnik 
9284,Koštana skelet glava kičmenjak . 
13389,ćelija sunđer koji posedovati bič ( flagellum ) a oko on imati ogrlica citoplazme ; onaj održavati protok voditi kroz telo 
11660,pollack 
9912,tropski američki žbun ili mali drvo sa velik palmolikim lišće i velik izdužen žut plod . 
16837,period od @card@ lunaran mesec . 
242,ukloniti neželjen supstanca iz nešto . 
731,transportovati ili poslati iz jedan mesto u drugi . 
10631,stavljanje nešto ( kao književan delo ili zakonodavni predlog ) u prihvatljiv forma 
13721,hladan godišnji doba . 
15872,prestati sa rad 
3748,o biološki izučavanje fiziologija 
16458,rat voditi između Meksiko i Amerika oko Teksas ( @card@ ) 
5817,biti podvrgnuti proces destilacija 
4831,"lantanoid , siv metalan element "
5601,unutar ili pomoću vena . 
4594,broj iz Fibonačijevog niz . 
14124,primerak tek odštampati knjiga koji se slati na uvid ( recenzija ) pisac ili urednik publikacija 
14808,"mali crv koji inficirati čovekov crevo i rektum , posebno kod deca . "
17278,mali pokretan sulfatni bakterija 
62,mali sltakovodne riba sa bodljikav peraja iz Afrika i južne Azija . 
13517,uređaj koji jesam povezati na računar i na koji se CD-ROM moći očitati 
11075,Podorica dikotiledona iz močvaran polje ; iz red Gentianales . 
5700,komad teletina 
5330,Ići nagore . 
16591,potvrditi ceremonija Bat Micva devojčica u jevrejski vera 
16449,koji jesam altajskog tip ; koji se odnositi na altajski ; koji jesam pisati altajskim 
8752,tropski američki drvo koji imati beo cvet i aromatičan bobica . 
13651,"Afrička reka , ulivati se u južni Atlantik "
3462,Opšta aktivnost koji se nešto prodavati . 
10615,"viski destilovati u Škotska , pogotovo viski izraditi od slad u kotao za viski "
10582,koji se odnositi na drevan Rim i njegov ljudi 
16547,"praviti liti , na primer vosak ili vruć metal , u kalup . "
9068,ukupnost poslovan aktivnost . 
2,nepokolebljiv verovanje u nešto bez potreba za dokaz ili nalaz 
11462,"mali tanak afrički majmun , imati dugačak zadnji ud i dug kosa oko lice . "
3742,sirće koji se praviti od sidro . 
14067,Čin priprema nešto ( kao hrana ) uz primena toplota . 
4614,preliminaran verzija pisan delo 
13983,Delimično ugljenisati biljni materija zasićen voda ; koristiti se kao goriv kada se osušiti . 
11479,jedinica za učestalost ; jedan herc imati perioda ponavljanje od jedan sekunda 
12393,malo biti ljudski oblik koji imati magičan moć 
12047,gaziran pića obogatiti ekstrakt voće Kol 
10585,dijalekt degihe koji govoriti narod Ponka 
15547,dovesti do izvršenje . 
7500,metod smanjivanje korelacionih podatak na manja broj dimenzija ili faktor 
6152,"neaktivan vulkan na Sicilija , poslednji erupcija jesam biti @card@ ; visok vulkanski planina u Evropa "
13195,izazvati otvaranje ili da nešto postati otvoreno . 
