,Sysnet
8979,"rod krupan jednogodišnji biljka poreklomiz Azija , širok rasprostranjenje u umeren područje ; u neki klasifikacija se uključivati u porodica Moraceae . "
6215,"složen crn mineral , javljati se u granitskim pegmatitima "
2313,koji se ticati ili se sastojati od atom 
14799,ući u računar 
9279,biti blizu ili se približavati 
16954,listopadan ? monoecious grmlje ili mali drveće koji imati koštuničav plod : leska ; ponekad se smeštati u podporodicu ili porodica Corylaceae . 
6656,čin ograničavanje 
15571,"velik morski vidra ; živiti u severni delo Tihog okean , imati veoma gusto tamnosmeđ krzno . "
1029,deo pečenica pored zglobni kosti 
2533,reka koji izire u Pirineji i ulivati se u Biskajski zaliv 
5308,grupa virus koji posedovati dvolančanu linearan RNK po virionu i reverznu transkriptazu ( RNK na DNK ) ( enzim koji prepisivati RNK na DNK ) 
577,beo trivalentan element 
16000,dvokrilan morski školjka koji živiti u pesak ili blato . 
14910,akt koji činiti da prethodan akt ostati bez učinak ( kao da jesam ni učiniti ) 
15948,velik okean na svet 
6719,bantu jezik koji se govoriti u centralni Tanzanija 
16539,električni prekidač koji funkcionisati pritisak na dugme 
14577,zimzelen drvo sa aromatičan lišće . 
1728,"viski destilovati iz kaša od kukuruz , slad i raž , čuvati da odstajati u ugljenisan hrastov bačva "
7755,kontejner u oblik kutija kao deo nameštaj ; napraviti tako da kliziti unutra i napolje . 
16532,velik broj ljudi skupiti s neki specifičan cilj . 
12852,ugao koji jesam suplementan unutrašnji ugao mnogougaonik 
5112,fenički dijalekt drevan Kartagina 
10262,rod mali šumski biljka . 
11201,Učiniti ponovo . 
5003,izgubiti debljina - postati tanak ili tanak 
14456,( o živ organizam ) onaj koji emitovati svetlost 
16998,"Drveće i žbunje , od Madagaskar do Australija . "
1216,jezik koji govoriti Japanac ( obično se smatrati altajskim ) 
10532,kultivisan evropski ribizla koji nositi mali jestiv crven bobica . 
10218,"koji se odnositi na ureter , mokraćni kanal "
8629,tipski rod porodica Rhinocerotidae . 
13447,rat za engleski presto ( @card@ ) između kuća Jork ( beo ruž ) i kuća Lankaster ( crven ruž ) koji jesam završiti dolazak na presto Henri VII iz porodica Tudor 
11761,kit sa kljuna ; u neki ranijim klasifikacija smeštati u porodica Physeteridae ; 
7218,Aromatično seme koji se koristiti kao začin sličan karanfilić i cimet ; posebno za turšija i sos . 
3503,hrskav kifla u oblik štap ; često se služiti uz sup . 
14055,"grubo mleti , oljušten kukuruz koji se služiti skuvati za doručak u jug sad ( nešto kao naš kačamak ) "
7241,tvrditi ili potvrditi 
8729,Lemur vitak telo iz južne Indija i Šri Lanke . 
5047,pojačati ili smanjiti intenzitet 
13738,ostanak na neki mesto 
9060,beleženje čovekov ponašanje i analiziranje psihološki karakteristika da biti se predvideti ili proceniti njegov sposobnost u određenoj sfera 
3352,mali razdaljina ( za dlaka ) 
12252,Stražnji deo ljudski ( ili žvotinjskog ) telo od vrata do kraj kičma . 
7058,( modifikator ) koji se nalaziti iza reč koji modifikovati 
8134,"oznaka koji se sastojati od znak napisan u knjiga , služiti za označavanje lokacija na polica "
6118,ljudi koji živa u velik gusto naseljen opština . 
14859,dijalekt italijanski koji se govoriti u Toskana ( posebno u Firenca ) 
14606,pravougaon komad upijajuće tkanina ( ili papir ) za sušenje ili brisanje 
12939,"koji se ticati Austrija , njen stanovnik i kultura "
15179,grupa većina ? sympetalous trava i neki drveće i žbunje uglavnom sa dva spojen ? carpels ; sadržati @card@ familija uključivati Campanulales ; Solanaceae ; Scrophulariaceae ; Labiatae ; Verbenaceae ; Rubiaceae ; Compositae ; ponekad se klasifikovati kao super red . 
11023,centralni deo točkati automobil ( ili propeler ili ventilator ) 
1050,visok jasen od Evropa do Kavkaz koji imati lišće koji jesam sjajno tamnozelen s gornji strana a bled s donji . 
5822,mali kopnen jednakonožac sa ispupčen segmentiran telo koji moći da se sklupčati u loptica 
6117,kesten ; ? chinkapins . 
8514,imati obao zmijast telo i okrugao usta koji se pripijati uz drugi riba . 
16656,pitati koji sadržati krem sa limun i šam od belance i šećer na vrh . 
11259,koji se odnositi na Alpi i stanovnik 
14150,vojni angažovanje . 
11032,imati ga u priobalan pojas severni Atlantik ili reka koji se ulivati ; odrasti ne uginuti posle polaganje jaje . 
16871,društven sistem koji manjinski grupa odvajati u separatan ustanova 
7954,nilotski jezik 
11446,iznositi tužba pred sud 
16292,"u računarstvo , vreme koji jesam potrebno da biti se glava za čitanje i pisanje pomeriti do potreban staza na disko "
11199,sistem pisanje koji se služiti uglavnom slikovan simbol ; termin jesam pre sav vezati za staroegipatsko pisma 
13565,muški valdar imperija 
4497,rod uglavnom tropski mesnat zeljast biljka ili povijuša . 
6038,popis stanovništvo 
13729,"pilula koji sadržati više vitamin , piti se kao doupna ishrana "
10237,neki od raznovrstan trava iz rod Marrubium . 
16364,rod drveće i žbunje koji imati vredan i lep drvo . 
9335,rutina koji moći da pozivati sam sebe 
13410,komercijalan važan cipal . 
7590,Dvogodišnja evroazijka biljka ; upotrebljavati se za stočan i ljudski hrana . 
1148,sladak trava ; ? pigweed 
7062,porodica altajskih jezik koji se govoriti u Mongolija i susednim oblast 
4871,mikroskop koji se sastojati od optički instrument koji uvećavati slika objekt 
584,pravni dokument u koji se izlagati čovekov želja u pogled raspodela njegov svojina kada umreti 
1356,"nemati zub , a umesto ona u gornji vilica imati dva red poprečno postavljen rožnih ploča koji jesam utvrditi za nepce . "
15097,deo odeća koji se nositi oko vrata . 
13142,osnovni novčan jedinica Angola 
1211,Arktički kit sa velik usta . 
171,griža savest kada se neki osećati kriv za prekršaj 
12534,Godišnja i višegodišnji travnat biljka umeren područje severni polulopta i Južne Amerika : ječam . 
5601,unutar ili pomoću vena . 
11204,zahtevati učešće ili prisustvo nešto . 
8488,dati dozvola . 
14798,karta za igranje koji na lice imati simbol crven romb . 
15789,elektronski prenos podatak koji jesam digitalan kodiran ( npr . za skladištenje i obrada putem računar ) 
16365,piva koji se praviti fermentacija melasa i drugi šećer sa biljni sok jela ( ponekad sa slad 
8128,Nešto u umetnički delo čiji jesam namera da postignuti odrediti efekt . 
12060,velik sladak pomorandža sa Florida sa debeo kor koji se lako ljuštiti 
7544,star primorski država ( grupa grad ) na istočni delo Sredozemlje 
15006,"Braska biljka , vrsta vragolića . "
6839,"oblikovati i sušiti testo napraviti od brašno , voditi i ponekad od jaje "
723,"redak mek naranđast mineral ( asS ) , važan ruda arsen "
5728,deo mehanički uređaj koji nešto udarati 
618,nakratko zatvoriti oči . 
4483,problemski orijentisan jezik koji zahtevati malo znanje o računar na koji hteti se izvršavati 
11934,krevetski pokrivač koji održavati toplota spavač 
10681,"Američki majmun dlakav lice , širok nozdrva , dugačak repa za prihvatanje ; živa na drveće . "
3672,supstanca koji se rastvarati u rastvarač ; komponenta rastvor koji menjati svoj stanje 
6964,tipski i jedini rod porodica Casuaridae : kazuar 
3475,odvojiti deo celina 
2366,velik prostorija za okupljanje i zabava . 
14503,glavni i velik grad San Salvador 
1985,dokaz identitet ; nešto što utvrđivati osoba ili stvar 
12638,stanovnik Eritreja ili poreklo iz Eritreja 
14236,štampan karakter 
9472,"glavni i velik grad Trinidad i Tobaga , na Trinidad "
2294,svrgavanje vlada od strana podanik . 
2317,irokeški jezik koji govoriti narod Oneida 
3465,odsustvo veza nešto prema nectem drugi . 
11755,Meksičko pića od fermentisanih sok agava 
9249,Trošiti neoprezan i lakomislen . 
1995,uobičajen beo ili bezbojan mineral - kalcijum sulfat dihidrat - koji se koristiti za proizvodnja cenementa 
15773,hemijski entitet koji primati elektron koji jesam na on preneti iz neki drugi spoj 
6984,signal koji uključivati vizuelan komunikacija 
4147,osnovni novčan jedinica Avganistan 
6998,meso srna koji se koristiti u ishrana 
7029,neki od brojni biljka iz porodica Cruciferae koji imati jestiv lišće . 
6191,"hemijski supstancija , koji se dodavati reakcionom sistema da biti ubrzati reakcija "
10456,tipski i jedini rod porodica Tytonidae . 
10360,uglavnom tropski travnat biljka ( ukljucuje žbunje i drveće ) sa ? cveće ; rod : Phytolacca ; Agdestis ; Ercilla ; Rivina ; Trichostigma 
12238,"sistem mera za dužina , težina i trajanje . "
8288,transuranski element koji nemati u priroda 
2524,koji jesam napraviti od kalaj ili sadržati kalaj 
8505,koristiti nešto zajedno ili sa neki drugi . 
9544,vojni jedinica u koji jesam stran dobrovoljac koji služiti država 
4338,biljka poreklo iz Indija ; koren jesam snažno aromatičan i gorak ukus ; upotrebljavati se u začinski mešavina . 
14997,vodopad na reka Nijagara 
14895,Čin rođenje dete 
5254,muzičar koji svirati oboa 
5264,stanovnik Portugal ili poreklo iz Portugal 
6835,tvrditi ili misliti da jesam neki odgovoran za neki delo ili čin . 
16223,zvaničan crkva Grčka ; autonoman deo pravoslavan crkva 
2579,kompleksan sistem povezan šupljina koji jesam u veza sa sluh i ravnoteža 
5571,napraviti film ili fotografija nešto . 
2601,Nešto što služiti za oblačenje . 
12521,infinitiv sa prilog između ' taj ' i glagol u engleski ( n . pr . ' taj boldly go ' ) 
2193,koji se odnositi na afrički narod koji govoriti bantoidnim jezik ili na njihov kultura 
6160,govor mlad dete u razvoj 
16485,evropski slatkovodni riba sa pljosnat telo i srerkastom krljušt ; jesam mnogo vredan za ishrana . 
16196,sport nastati u Japan iz džiu-džice 
142,familija pustinjski žbunje i drveće - uglavnom ? i ? 
10274,koji odstupati od opšti ili uobičajen poredak ili vrsta 
5892,republika u severni Evropa ; steći nezavisnost od Rusija @ord@ godina . 
10139,lanac isti restoran . 
16825,onaj koji jesam u stanje san 
5128,žitarica koji se služiti vruće 
12235,"postojati indicija da kod neki pojedinac postojati intolerancija na natrijum-glutamat što kod ona moći da izazvati osećaj obamrlost u potiljak , leđa i ruka , lupanje srce , glavobolja i osećaj slabost u rok od dva sat nakon konzumiranje hrana koji ga sadržati "
2939,nezreo leukocit koji se obično nalaziti u koštan srž 
6194,ukrašavanje umetanje skupocen i plementijeg materijal u jednostavan podloga 
5487,objekt koji služiti u vojni svrha . 
3603,federacija u severoistočni Evropa i severni Azija ; ranije Sovjetska Rusija ; od @ord@ godina nezavisan država . 
17193,protozoa sa mikroskopski izraštaj koji se šire od površina ćelija 
7080,morski zmija 
12296,indeks sav reč iz knjiga ili više knjiga dat u kontekst 
14545,bitak iz Drugog svetski rat ; decembar @ord@ fon Rundštet jesam pokrenuti snažan kontraofanziva u šuma Ardena i iznenaditi saveznik 
3166,neki od mnogi trava iz rod Thalictrum ; imati čipkast lišće i oblak mali purpuran ili žut cvet . 
5755,Društvena pripitomljen pčela koji proizvoditi med . 
16044,"slika neživ predmet , na primer voće i cveće . "
7273,Čiji jesam životan ciklus ne trajati duže od jedan godina . 
3829,problemski orijentisan jezik koji se koristiti za opisivanje zahtev koji posati postavljati operativan sistema 
8173,želatin napraviti od piletina 
178,dati oblik ili forma nešto . 
140,"nezgoda , posebno ona koji prouzrokovati povreda ili smrt . "
7678,"zaobljen posuda otvoriti na vrh , obično služiti da serviranje hrana i voće . "
16576,o eozinofilu ili koji se odnositi na eozinofil 
3639,"klasa sastaviti od osoba bez plemenit , viteški ili aristokratski rang "
459,koristiti računarski program za prevođenje izvoran kod napisan na određenom programski jezik u računarski čitljiv mašinski kod koji se moći izvršiti 
11619,specifikovan mera za količina . 
3437,papir koji jesam osetljiv na svetlo na koji se moći praviti fotografija 
16808,Mesec koji dolaziti posle oktobar a pre decembar u kalendar . 
1154,rat između Kina i Japan ( @ord@ i @card@ ) za kontrola nad korejski poluostrvo ; Kina jesam potpuno poraziti kod port Artur 
10163,izražavanje ( govor ili pisma ) vaš uverenje ili mišljenje . 
17007,obično plastičan kartica koji omogućavati vlasnik da povući novac s račun ili da platiti roba koj hteti direknto biti platiti s njegov račun 
17099,aritmetički sredina apsolutan vrednost devijacija od sredina distribucija 
16648,električni uređaj koji konvertovati jedan oblik energija u drugi 
16837,period od @card@ lunaran mesec . 
8004,"Povrće , posebno krastavčić , konzervisan sirće ili rasol . "
10386,morski pauk 
15159,osnovni novčan jedinica Indonezija 
5832,čadski jezik koji se govoriti južno od jezero Čad 
1025,"mekušac koji jesam u veza sa hobotnica i sipa , imati , kao i hobotnica , deset pipak ; meso jesam tvrd i beo ; u mnogi mediteranski jezik koristiti se italijanski termin "" calamari "" "
3540,"plod iz loz zimski dinja , zelen dinja sa bledo-zelenim do narandžast meso koji dugo ostajati svež "
12026,cikorija 
16221,konzervisati ili kandirati voće . 
15245,velik pas sa gladak beo krzno sa crn ili smeđ pega ; poreklo iz Dalmacija . 
4818,"hartija koji upijati višak tečnost , na primer mastilo "
3424,Ruski imperatorska loz koji jesam vladati od @card@ do @ord@ godina . 
9959,republika u zapadni Evropa ; velik zemlja u celost u Evropa . 
16102,novčan jedinica Sirija 
10602,komercijalan ili industrijski preduzeće i ljudi koji ga činiti . 
4427,jedinica koji imati administrativan odgovornost . 
13385,rukovodilac u poslovan preduzeće . 
254,Osećanja proživeti kada jesam neki u zadovoljan stanje . 
2390,anđeo uzeti sav zajedno 
605,"zeljast biljka i umeren severni područje iz rod Sedum ; imati mesnat lišće i revena , žut ili beo cvet . "
3093,biti zadužiti za nešto ili imati poslati sa nešto . 
11523,instrument koji zvučati pomoću jezičak od trska . 
14295,serija pesma koji povezivati isti tema 
1975,"vrlo otrovati alkaloid koji se vaditi iz velebilje i drugi biljka , širok zenica i kočiti lučenje žlezda . "
15433,toplo ili hladno mešati alkoholni pića sa umućen jaje 
4779,skakavac sa kratak antena . 
6792,"znak koji služiti da pojasniti značenje tako što razdvajati niz reč na rečenica , klauze i fraza "
16926,broj ili nizak broj koji se koristiti za identifikacija . 
5079,neki ko jesam član zakonodavne skupština 
10893,rasa ljudi svetao koža . 
111,biti koji od brojni dlakav insekt uključivati i društven i osamljen vrsta 
113,nesmanjen i nenarušen celovitost ili ukupnost . 
8408,sakupiti zajedno . 
6262,obično punjen i pečen 
16210,mleven kuvan meso ( ili povrće ) u gust beo sos ; uvaljati u prezla i pržiti u dubok ulja 
16977,prvi deo ili odeljak šta 
14491,izvoran jezik koji se sastojati od proceduralan operator koji pozivati funkcija koji trebati da se izvršiti 
10631,stavljanje nešto ( kao književan delo ili zakonodavni predlog ) u prihvatljiv forma 
8784,modulacija amplituda ( radio ) signal nosač 
16356,"esej , članak ( posebno onaj napisati kao zadatak ) "
10992,ljudi koji obavljati poseban vrsta posao . 
7740,bolest koji se prenositi sa čovek na čovek . 
9371,mleven povrće i meso umotati u palačinka i pržiti 
2512,Rečna i morski riba koji imati telo sličan zmija . 
10358,glikozid izvesti iz glukoza 
7694,Bodljivci star veto 
6634,"italijanski poslastica , spraviti od žumanjaca , šećer i sladak vino , služiti se uz keks i voće , obično hladan "
8264,komad meso sa plećka pogodan za pečenje 
13846,savezni vlada sjedinjen Država 
1817,glavanska abterija koji skladištiti električni energija 
6091,minimalan jezički jedinica koji imati sintaksički ( ili morfološki ) funkcija 
1049,"Mašin za sečenje , oblikovanje ili završan obrada metal ili drugi materijal . "
49,promena u nizak stanje ( manje poštovati ) 
5615,koji pripadati srednji klasa 
10171,komad pribor za jela koji imati drška i zaokrugliti deo koji se uzimati tečan hrana 
15057,sudski nalog koji se nalagati administrativan činovnik ( šerif ) da pozvati porotnik ( član porota ) 
7144,praviti nabor na gladak povtšini . 
4248,patuljast mediteranski jednogodišnji biljka koji se odavno gajiti zbog aromatičan seme . 
17197,Noćna ptica trkačica sa Novog Zeland koji imati dug vrat u jak noga ; jedini preživeo predstavnik redati Apterygiformes . 
6347,zadatak koji se sastojati u taj da se nešto napisati 
3751,"postati velik , širok , napredan . "
2259,u grčki mitologija zmijati sa glava zmaj ; ubiti ona jesam Apolon u Delfiju 
5841,"velik , sladak , mesnat , tropski voće sa kor sastavljen od čvrst list ; široko rasprostranjen "
14454,pripremljen hrana za ponet 
6608,republika u istočni delo Balkanskog poluostrvo u jugoistočni Evropa . 
8,"umanjiti po vrednost , karakter itd . "
5960,ja opcija koji se pojavljivati ispod stavak kada korisnik na ona kliknuti 
15013,stanovnik Kostarika ili poreklo iz ona 
10190,"o tekst , koji jesam u veza sa tekst ili koji jesam zasnovati na tekst "
393,osoba koji u kockarnica rukovoditi hazardan igra 
2114,pokazivač koji se sastojati od instrument za merenje količina padavine 
16461,morski riba koji živiti na dan u toplim voda ; imati na brada dva ? barbels . 
5282,"koji se ticati Ekvador , njegov ljudi i kultura "
2083,"mek beo vredan univalentan metal ; imati velik električni i toplotni provodivost od sav metal ; javljati se u argentitu i slobodan ; koristiti se za izrada novac , nakit , pribor za jela , fotografija . "
12908,staklast mineral koji se sastojati od natrijum aluminijum silikat i natrijum hlorid u kristalan oblik ; javljati se u mamgmatskim stena 
7472,glava ljudski biće 
8381,novčan jedinica Jordana 
2789,micati neki pribor uz stalan kružan pokret . 
267,""" slaviti vrlina svoj deca "" "
12490,Glavni javan predstavnik neki zemlja koji moći da biti i šef vlada . 
840,pribor napraviti od keramički materijal . 
1014,grupa mačka . 
12251,"znak interpunkcija ( , ) koji služiti za razdvajanje rečenični deo "
9314,"salata koji se sastojati od paradajz i inćun , garniran maslina i kapara "
2535,( genetika ) jedan od dva pravilo nasleđivanje koji jesam formulisati Gregor Mendel na osnova svoj eksperiment na biljka ; princip jesam biti ograniceni i modifikovati kasan genetički istrazivanjem 
10811,"jako tanak parac tkivo , mineral ili neki drugi supstamce koji se ispitivati pod mikroskop . "
2873,Glavna podela geološki vreme ; era se obično deliti na dva ili više perioda . 
4073,termin za jabukovač ( cider ) koji se koristiti u sad i neki deo Kanada 
11796,ravno ploveći sredstvo ( obično napraviti od trupac ili daska ) koji se moći koristiti za transport ili kao platforma za plivač . 
199,"na primer , o vukanima ; koji trajno jesam aktivan . "
15891,komercijalan organizacija koji raditi kao javan prevoznik . 
2273,odbijanje grupa ljudi da poštovati zakon jer smatrati da jesam zakon nemoralan ( npr . u znak protest protiv diskriminacija ) 
13238,počistiti metla ili kao metla 
14877,Određena tačka u vreme . 
16027,novčan jedinica Zapadne Samoa 
3572,stanovnik Burundi ili poreklo iz Burundi 
4736,Začin koji se praviti od osušen mesnat delo kapsula muskatni orah . 
2964,mali tanak kobasica 
3735,zelen mineral amfibolne grupa ; kalcijum magnezijum fero silikat 
1336,planinski lanac u Australija koji činiti južni deo velik razvodni planina 
3174,zgrada ( ili deo zgrada ) za smeštanje automobil 
3142,deo odevni predmet koji jesam prikačiti za otvor za ruka i pokrivati jesam 
7689,mrežni topologija čiji jesam komponenta povezati u petlja 
16299,Česta evropski korovska biljka . 
7404,mali marrow sličan krastavac ; obično jesam tamno zelen 
2620,neki ko davati savet o problem 
10810,"rod koji se odnositi najpre na mlad biće , kao i na objekt koji jesam svrstati ni u kategorija muški ni u kategorija ženski rod "
13159,deo severni leden okean između labrador i južnog Grenland 
12776,isturen deo kapa zahvaljujući koji jesam oči u senka 
11601,tipski rod porodica Physeteridae . 
14051,zamišljen kružan linija na površina zemlja koji spajati sevrni i južni pol seći ekvator pod prav ugao 
15569,"nastaviti postojati na neki mesto , položaj ili situacija "
1854,govedina marinirati ili kiseliti u salamura 
15850,"pileći složenac koji se spremati sa krompir , pečurka i bilje na italijanski način "
16546,Čin izgradnja akumulacija . 
16054,grafikon eksponencijalan funkcija 
3363,"kva jezik koji govoriti narod Eva u Gana , Tonga i Benin "
3970,altajski jezik koji govoriti Koreanci 
16779,kontraceptivan sredstvo 
6828,neki biljka iz rod Drosera . 
13383,suv brendi destilovati u Armanjac okrug u Francuska 
17275,neki ko praviti i prodavati vlasulja . 
3430,važan klasa rak 
8224,adrenal-korteks hormon 
10558,neki od evroazijski biljka iz rod Helleborus . 
10092,"glavni deo drama , balet ili opera "
12691,u grčki mitologija velik muzičar ; kada jesam njegov žena Euridika umreti on jesam otići u Had da jesam vratiti ali jesam uspeti 
14158,"sličan američki jastog ali manja ; pronalaziti se u voda istočni atlantski okean , sredozemni i crn mora "
6099,zaliv u Sredozemnom mora na jugozapad Turska 
916,dresiran golub koji prenositi poruka 
15984,osnovni SI jedinica za merenje električni struja 
8621,kamarupski jezik koji se govoriti u zapadni Burma i Bangladeš i na krajnji istok Indija 
12348,nauka o zemlja koji se baviti fenomen atmosfera ( posebno vremenski prilika ) 
16443,evropski ris . 
10334,bitan ran obrok koji uključivati i čaj 
299,kvalitet onaj što jesam teško otkriti ili analizirati . 
6393,"u grčki mitologija , muški Titan , sin Gej i Uran , otac Heli , Selena i Eosa "
11573,jela od pirinač sa morski plod obojen šafran 
12379,reaktor koji se sastojati od spirala od izolovan žica koji uvoditi induktivnost u kola 
15049,neki posati koji preduzeti ili se planirati . 
2148,"grmlje , nisko drveće ili drvenast loz . "
13059,odnos brojati opažanje u statistički kategorija premaukupnom broj opažanje 
2422,svaki organ koji jesam uključiti u disanje . 
5008,reč ili sintagma koji bliže određivati značenje neki drugi element 
259,Čin oštećivanje nešto ili neki . 
6310,novčan jedinica Argentina 
9537,bivši osnovni novčan jedinica Irska 
2360,biti koji organ koji jesam uključiti u seksualan reprodukcija . 
3923,ishod šta urediti putem prevara 
7352,ćelija ili jednoćelijski organizam koji posedovati flagelum ( bič ) . 
14044,"rod ptica iz porodica Sylviidae , uključivati maslinicu . "
11391,"uređaj koji smanjivati amplituda elektronski , mehanički , akustičan ili aerodinamički oscilacija "
6065,rasa čiji se pigmentacija koža razlikovati od beo rasa ( posebno crnac ) . 
12099,vrsta mali ružan sltakovodne riba ; imati bodalj nalik na rog . 
1582,"psoglav majmun iz zapadni Afrika , izgled on jesam ružan i odvratam ; brada on jesam žut , a obrazni nabor plav ; bxuška i zdnjični žulj cu replaced-dns of west Africa with red and blue muzzle and hindquarters "
11465,"neki od više sisara koji živa na drveće i sporo se kretati ; iz Južne i centralni Amerika ; visiti sa grana naopačke , hraniti se lišće i voće . "
7256,vatrenjače 
5133,Živac duž unutrašnji strana ruka i prolaziti pored lakat ; snabdevati unutrašnji mišić ruka i koža medijalne strana ruka . 
522,zimzelen drveće i žbunje : mangostan . 
12037,"reč pozajmiti iz drugi jezik ( npr . "" general "" jesam reč koji jesam u srpski stignuti iz francuski ) "
16008,vrsta granularnih leukocita čiji jesam funkcija ingestija bakterija 
15502,objekt koji jesam recipijent ili benefaktiv radnja glagol 
1736,gust sos napraviti od paradajz sa mnogi začin 
6030,bog severni vetar i severni strana svet 
16428,tipski rod porodica Alcidae koji činiti samo njorka 
7401,"u grčki mitologija gorski nimfa , personifikacija odjek "
11101,gljiva sa beo sporama koji uključivati više jestiv i otrovan vrsta . 
12614,karakter koji se koristiti da označiti neki matematički relacija ili operacija 
6182,iznenadan promena vlast obično uz upotreba sila 
3007,Smeštaj u koji neki živiti . 
12684,čiji prethodnik biti 
7419,ponavljanje isti reč ili obrazac kao retorički šema 
8259,mirovan sporazum koji jesam okončati Tridesetogodišnji rat @card@ 
521,mekan srebrnkast metal iz grupa redak zemlja bey stabilan iyotopa ; pronaći u radioaktivan oblik kao fisioni proizvod uranijum 
13110,igra u koji dva taj prebacivati lopta preko visok mreža udarati jesam ruka . 
16276,Ružičasto vino koji se praviti od crven / crn grožđe komee kožica uklanjati tek pošto jesam fermentacija početi . 
15468,planeta koji imati kompaktan stenovit površina kao zemlja ; činiti ona prvi četiri planeta Sunčev sistema . 
14985,biti šta što uzročni doprinositi rezultat . 
10822,paleontologija mikrofosila 
17128,alga zelen boja ; blizak jesam vaskularan biljka ; kompleksan grupa alga . 
4310,radni sat ili dan tokom kalendarski nedelja 
17143,dlakav braon voćka u oblik jaje blago kiseo zelen meso 
199,Čin okončanje nečiji zaposlenje . 
5901,deo nameštaj koji jesam namenjen sedenje . 
10571,Zabeležiti pismeno ; uneti u registar . 
114,ne pridržavanje moralan princip . 
2489,salata od seckan tunjevina iz konzerva 
1440,mali tropski gušter ; živiti na drveće ; hraniti se isključivo insekt ; menjati boja koža . 
17337,tropski drvo iz južne Azija čiji jesam drvo tvrd i jako taman . 
5647,samohodno vozilo koji se kretati po šina 
8242,prenos informacija širok publika 
1017,"grana fizika koji proučavati svojstvo materijal u čvrst stanje : električni provodljivost u kristal poluprovodnik i metal , superprovodljivost ; fotoprovodljivost "
6616,potpun izborni pobeda 
1494,matematički notacija koji koristiti @card@ različit karakter ( reći cifra od @card@ do @card@ ) 
