,Sysnet
1976,"metod koji se koristiti u rendgenologija , prosvetljavanje telo ili neki delo telo putem x-zraka i njihov pojava na specijalan ( fluroscentnom ) ekran . ovaj metod jesam važan da biti se moći uočiti pokret organ . "
3162,novčan jedinica Češka 
14921,tvrd staklast mineral koji se sastojati od oksid magnezijum i aluminjuma ; javljati se u raznim boja i koristiti za nakit 
7739,alkoholni pića aromatizovano gorak trava i korenje . 
6766,neki od raznovrstan velik jestiv riba i riba za lov severni morati ; obično se slei iz slana u sladak voda kada polagati jaje . 
17374,koji se odnositi na fonema određenog jezik 
1748,"jedan od četiri podklasa i nadreda Monocotyledones ; sastojati se od oko @card@ vrsta u @card@ familija drveće , žbun , suvozemni biljka i nekoliko plutahjućih voden biljka , uključujuje : Palmae ; Araceae ; Pandanaceae : and Lemnaceae . "
15511,novčan jedinica u velik Britanija 
3832,velik evropski puh 
4146,"mera za dužina , jednak @card@ metar "
5712,prilagoditi se nov ili izmenjen uslov . 
16761,mali šupljina ispuniti tećnošću u citoplazmi ćelija . 
4921,koji izražavati posedovanje 
14282,štampan kola koji moći da se prikopčati na računar da biti on se uvećati mogućnost 
6871,malo drvo poreklo sa istok SAD-a sa duguljast list i mesnat voće 
1465,"grub godišnji trava , raširen korov ; ponekad se koristiti za sena i ispaša . "
209,"imati želja , čežnja ili velik apetit za nešto . "
2063,koji imati oblik parabola 
2568,"žut trivalentan metal , redak lantanoid "
8939,hijena . 
9520,negativno naelektrisati jon 
3960,"orhideja penjačica koji s ne geaji kao ukrasni biljka , rađati plod nalik mahuna . "
9103,putovati unazad 
6887,algonkinski jezik narod Ilinois i Majami 
13621,nit napraviti od pamučan vlakno 
4110,oslonac koji jesam deo svaki struktura ili zgrada . 
2665,glavni grad ujedinjen arapski emirat i jedan od emirat 
14990,uzeti uzorak nešto . 
5168,"riba nezgrapan telo iz severni Atlantik , teško plivati i zato se zadržati na dan . "
800,kaput napavljen od krzno . 
16506,izraz ili izgovor koji jesam karakterističan za odrediti lokalitet 
799,Francuski liker sa ukus pomorandža 
13675,vrsta pasulj koji se jesti pre nego što sazreti . 
10630,"Ruski pisac , uvesti realizam u ruski literatura ( @card@ ) . "
12678,uglavnom lišaj koji rasti na morski stena . 
13780,neki biljka iz rod Xeranthemum poreklo iz južne Evropa . 
9977,neki od mnogi trava iz rod Eragrostis ; korisnesu posebno za ispaša i za prevencija erozija . 
1832,( lingvistika ) naglasak ili promena u naglasak koji služiti za razlikovanje reč u tonalni jezik 
16670,( jevrejski ) lagan obrok ili užina 
217,"( politika ) obezbeđivati usluga , ugovor i pozicija u zamjenu za politički podrška "
14448,gastropode koji imati ? ? ? 
17132,Peščana zona koji se spuštati do voda morati ili jezero . 
2215,jedan mali lukovica koji moći da se odvojiti od cee lukovica beo luka . 
849,"tanak muva sa dug noga ; potsećati na komarac , ali ne ujedati . "
2411,glavni i velik grad Gan 
9830,stanje imovina da jesam u ruka primalac . 
997,biti pažljiv ili siguran da se nešto učiniti ; uveriti se u nešto 
3949,poseban način oralan izražavanje 
17239,"sulfid bakar i gvožđe , CuFeS2 , tetragonalan mineral , najčešće se javljati u jedar masa ; boja mesingan i zlatnožut , tvrdoća @card@ ; najrasrostranjenija bakaran ruda . "
2378,koji imati više ugao 
6034,prevlaka između Finskog zaliv i jezero Ladoga koji povezivati Finska i Rusija 
10852,"koji jesam u sklad sa fiksiran redosled , procedura ili princip . "
16551,stanje u koji jesam nešto važno ili preko potrebno . 
16678,pomoć neki stvar ili politika ili interes 
3717,dete koji pohađati škola . 
8596,"ihvatiti i protresti nečiji ruka , kod upoznavanje ili kao potvrda neki dogovor "
5855,molekulski tezina izražen u gram 
2156,stanovnik Kina ili proeklom iz ona 
2160,vijoglavke 
2067,tvrdo jako i trajno žutosmeđ drvo tik ; otporan na insekt i krivljenje ; koristiti se za izrada nameštaj i u brodogradnja . 
5014,"Domaće morski prase , skoro bez repa , snažan telo ; česyo se čuvati kao kućni ljubimac a koristiti se i u eksperiment . "
14835,mek meso u predeo krsta sa oba strana kičmeni stub 
13805,istorijski doba koji imati izraziti karakteristika . 
6974,koji se odnositi na koštunica . 
12236,velik rod misrisnih trava iz star svet . 
15833,administrativan jedinica u vlada ili privreda . 
12300,ostrvski republika na ostrvo Island ; postati nezavisan od Danska @ord@ godina . 
6951,pripadnik narod južne Afrika koji živa u Svazilend i okolni teritorija 
4191,prava jela . 
4858,sos jak ukus koji se spravljati od seme gorčica 
6242,organizacija podzemlje . 
216,"jako osećanje , usmeren prema neki stvaran ili navodni muka . "
5717,konzsitentnost kompaktan čvrst telo 
15534,"francuski specijalitet , krema ili puding od mlijeka i jaje koji se peti u pećnica "
9295,metla napraviti od grančica povezan na dugačak ručka 
400,Pčele . 
4855,"država na sever Evropa , činiti jesam teritorija poluostrvo Jitland i mnogi ostrvo između Baltičkog morati i severni leden mora "
9701,tkivo koji činiti spoljašnji omotač neki organ ili sistema kod biljka ili životinja 
190,neki trepljasta protozoa u oblik truba koji jesam član rod Stentor 
9157,Godišnje i višegodišnji zeljast bilje i žbunje . 
476,ukupnost uslov u nepsorednom okruženje . 
12,Ladolež ; ? bindweed ; ? sweet potato ; biljka koji imati cvet u oblik truba i penjati se i uvijati . 
12501,digitalan računar srednji veličina 
2341,"deo severni leden okean , severno od Island "
1555,poklapati se sa red Psittaciformes . 
11144,svaki od velik kornjača kod koji jesam ud pretvoriti u peraja . 
10651,drven ili metalan štap na koji se stavljati uzica i mamac i koji služiti za pecanje 
12164,"srediti nešto , reći dug . "
148,koji se tič princip dobra i zlo ; koji se uklapati u standard ponašanje i karakter koji jesam zasnovati na ovaj princip . 
2507,električni provodnik koji predstavljati zajednički veza među više kola 
10061,vladar i njegov savetnik koji predstavljati vladajući klasa u država 
15553,zabeležiti pokret u ples pomoću sistema znak 
5751,"kancelarija u koji se obrađivati vesta za novina , novinski agencija , televizija ili radio stanica . "
12535,Bizamko goveče 
10570,industrijski biljka penjačica čiji se osušiti plod upoterbljavaju u pivarstvo . 
2108,rat u koji jesam uključiti sav velik svetski sila 
16214,vreme koji jesam potrebno da zemlja napraviti jedan krug oko sunce ; mera se izmeđe dva prolećni ravnodnevica 
11785,stanovnik Mali ili poreklo s Mali 
14351,svetlo žut grožđe bez seme koji se koristiti za grožđice i vino 
14891,prirodan otac ili majka 
10725,odrezak bez koska od goveđi pečenica 
2520,"opšti naziv za piva koji jesam dobiti sa vrh pri fermentacija pšenica ; obično jesam veoma svetao , mutan i penušav "
9038,biti koji jedinjenje ugljenik i neki drugi element ili radikal . 
12100,"Puževi , puž balavac i njihov srodnik . "
11578,Polučvrsta masa koagulisanaih crven i beo krvni zrnce . 
10799,pevati treperav glas . 
11890,odbacivanje čin zabrana 
11145,star poznat gmizavac & amp ; gt ; kornjača i izumro vrsta . 
923,izumro istočnonemački jezik star Got ; jedini sačvani zapis jesam prevod biblija biskup Vulfile iz @ord@ vek 
15547,dovesti do izvršenje . 
748,strana koji se viditi ili koji prvi dolaziti . 
11836,dodatak na đon sportski obuća koji se sastojati od trvdog šiljak 
4994,Uzvratna grupni akcija . 
16006,južnomaeričko pića nalik čaj od južnoamerički biljka 
1152,Otić s neki mesto . 
17046,samo pasji riba . 
13231,jela od mleven meso prekriven pir krompir 
1912,sav toplokrvan kičmenjak čiji jesam koža manje-više pokriti dlaka ; mladunac se rađati živiti ( izuzev mali klasa monotrema ) i hraniti se mleko . 
14427,"pica sa paradajz , sir i inćun "
10147,manipulisati vozilo unutar prostor za parking . 
229,deo pantalone koji pokrivati noga . 
15077,zvonara 
13306,piletina krčkati u čorba sa luka i paprika i potom pomešati sa kiseo pavlaka 
15404,onaj koji odbijati da govoriti ili komunicirati kada se taj od on očekivati ; 
5425,zapis serija događaj koji činiti život neki osoba . 
14673,pustinja na jug Izrael 
8956,Uciniti debeo ili punačak . 
4105,"lpromatranje , ispitivanje trbušni duplja radi ispitivanje uzrok bolest "
8716,"španski pisac koji jesam ostati upamtiti po delo "" Don Kihot "" u koji na satiričan način govoriti o viteštvo ; ovaj delo jesam značajno uticati na razvoj roman ( @card@ ) "
6438,"kremasti sos sa sir sa dodatak crn luka , žumanaca i rendanog sir "
11813,koji se ticati ili koji proizvoditi ili koji jesam izazvati statički elektricitet 
5883,napraviti zapis ; predstaviti u stalan oblik . 
10859,broj jednak ili velik od biti koji drugi brojati u dat skup ( matematika ) . 
9647,"organ u ran faza razvoj , osnov za dalek razvoj . "
4596,koktel koji se praviti od vodke i sok od pomorandža 
5705,koji se odnositi ili jesam sadržati u arhiva 
9070,taman rum iz Gvajana 
15200,slojevit struktura . 
6513,Štuka severni hemisfera . 
11353,kratak kritički prikaz 
15164,tanak oštar instrument koji se koristiti za uzimanje 
14803,krevetac za beba u oblik kutija s drška u koji beba moći da spavati dok se nositi . 
6660,neki ko predavati francuski jezik . 
7042,delikatan evropski zeljast biljka sa sivkast lišće i klasijem purpuran cvet ; nekad se koristiti kao lekovit trava . . 
399,"smatrati se osnovni odbrana , pri koji se ispoljavati suprotan osećanje ili impuls od onaj prvobitan ; osećanje i reakcija koji proizilaziti iz reaktivan formacija često jesam prekomeran , uporan , nesrazmeran situacija i okolnost ; osoba se ponašati potpuno suprotno od onaj kako biti zaista želeti , a da taj jesam ni svestan "
10553,tesan ženski odeća 
11002,kopno koji spajati Severnu i Južnu Amerika 
6320,u grčki mitologija boginja plodnost koji se kasnije povezivati sa Persefona kao boginja podzeman svet i zaštitnica veštica 
8275,gomila u pokret . 
4439,nem smena generacija ; faza meduza jesam potpuno preskočen ; korali i morski anemona . 
13396,"prekinuti emitovanje , npr . o radio-stanicama "
9200,Glavni grad nacija . 
4434,krajnji spoljašnji ili udaljen region ili tačka . 
7082,"bivalentan nemetal bez boja , ukus i miris , ne gora ; u vazduh ga imati @card@ procent . "
16823,jezik na koji se prevoditi tekst napisan na drugi jezik 
9632,radnik koji zauzimati ili on jesam na raspolaganje kancelarija . 
15264,srednji region telo artropoda odnosno zglavkar između glava i trbuh 
314,proces promena u nizak stanje . 
14967,"Veći žičan instrument , manjiti od kontrabas ; držati se između koleno ; ton on odgovarati čovečji glas ; solistički instrument . "
5604,od pre @card@ milion do @card@ milion godina ; konodonti i ostracodi i alga i morski trava 
4808,vinov loz beo sladak grožđe 
1120,sistem versifikacija 
16235,istočni podgrupa malajsko-polinezijskih jezik 
2546,stanovnik Ekvador ili poreklo iz Ekvador 
6663,zaliv između kalifornijski poluostrvo i Meksiko 
3808,Kamila sa jedan grb iz vruć pustinja severni Afrika u jugozapadni Azija . 
14813,mreža u koji se hvatati riba i koji se potpom izvlačiti iz voda 
256,koji jesam nezavisan . 
10856,mali poluvodeni daždevnjak . 
6478,posada brod koji uključivati oficir . 
13628,velik rod uglavnom afrički i australijski zeljast biljka i žbunje ; smilje ; u neki klasifikacija uključivati rod Ozothamnus . 
1059,"Žena koji jesam poveriti čuvanje dete , posebno u privatan kuća . "
12239,institucija oformiti da biti se baviti posao . 
4301,u srednjovekovan legenda nevesta kralj Kornvala koji se zaljubiti u kraljev nećaka Tristan pošto jesam greškom popiti ljubavan napitak i ostati večno zaljubiti 
15201,udariti noga 
9692,jesetra kašikara 
11328,vrsta organski jedinjenje . 
10613,"velik heterogen grupa RNK virus koji jesam podeliti u grupa na osnova vrsta viriona ; otkriti ( izolovati ) iz artropoda ( zglavkar ) , slepiti miš i glodar ; većina ona se razmnožavati unutar ćelija artropoda ; oni jesam povezati sa epidemiološki koncept transmisija između vertebrata ( kičmenjak ) kao domaćin i artropoda ( zglavkar ) kao vektor ( prenosilac ) ( komarac , krlja ( pregalja ) , mušica peskar , mušica itd . ) i hraniti se krv ; oni mogi izazvati blag groznica , hepatitis , hemoragični groznica , i encephalitis . "
9853,tekući traka koji u fabrika prenositi roba i deo 
5023,objekt uvesti predlog 
10416,koji se odnositi na parlament ili imati priroda parlament . 
5097,"dati novac , obično u zamena za roba ili usluga . "
5655,šastanski jezik koji govoriti narod Šasta 
675,učenik koji živiti u škola u tok ceo semestar 
2096,Uključuje familija lišaj . 
11327,dehitratizirana kafa od koji se napitak spremati dodavanje vreo voda 
8483,"glavni grad demokratski republika Kongo , ne reći Kongo , preko put Brazavil "
12383,ritmički grupa od šest stih u strofa 
17370,informacija poznat samo poseban grupa . 
2551,providan ljubičast varijetet kvarc ; poludrag kamen 
3312,igra koji se igrati sa karta . 
5622,koji jesam u veza sa glagol ili koji jesam formirati od glagol 
1927,neki ko verovati da kakav elitan grupa trebati da prisvojiti vlast 
2382,beo hranljiv tečnost koji proizvoditi sisara a koji se koristiti u ishrana ljudi . 
14058,velik neprekinut parac kopno . 
12512,"koristiti se u ranijim klasifikacija : sastojati se od raznovrstan skup organizam koji ne cvetati i nemati seme : alga , bakterija , glixve , lišaj . "
61,osećaj spontano dobar rapoloženja 
4637,aparat koji obavljati neki kućni posao . 
12257,pretvoriti se u žele 
14816,srednjovekovan komad koji predstavljati epizoda iz život svetac ili mućenika 
11984,neki ko praviti ili popravljati odeća . 
13842,krvni grupa čiji crven krvni zrnce nositi antigen B . 
3442,divalj magarac iz Afrika . 
14687,deo uvo koji se viditi spolja 
1756,energija koji se dobijati od vetar ( npr . od vetrenjača ) 
17196,provodni kanal ili cev prekriven epitelni ćelija koji prenositi izlučevine i drugi supstanca . 
702,beo ili siv mineral koji se sastojati od litijum-aluminumovog fosfati ; izvor litijum 
8420,stanovnik Niger ili poreklo iz Niger 
11379,"dimenzija koji ići kroz presek objekt , nasuprot dužina i širina . "
2208,Optički instrument koji se sastojati od para sočivo koji služiti za korekcija vida . 
813,pisan akt koji se nalagati da se zatvorenik dovesti pred sud . 
5332,"desiti se , dešavati se , događati se "
13481,metoda za analiziranje ili predstavljanje statistički podatak 
3396,putovanje na svet mesto . 
13883,"koristiti um ili nečiji sposobnost da rezonovati da biti se zaključivati , odlučivati , ili dolaziti da rešenje i sudovati . "
1446,osnovni novčan jedinica Svazilend 
6782,deo južnog Atlantik oko Antarktik 
10412,rod tuplia 
15301,"metal sličan gvožđe , sivobeo boja , tvrd i krt "
4619,četvrtast komad platno koji se koristiti za brisanje oči ili nos ili kao dodatak komplet 
4069,biti koji gljiva iz familija Boletaceae . 
15412,Voće koji jesam očuvan kuvanje sa sećerom . 
12886,koji odgovarati ili operisati sa frekvencija širok pojas 
4824,vrsta reč koji imati funkcija predikat rečenica 
5585,sloj mijelina koji omotavati živčan tkivo 
16041,uhvatiti ; i metaforički . 
5741,tipski i jedini rod porodica Tarsiidae . 
14438,anatolski jezik 
5590,merni instrument koji imati niz oznaka u pravilan razmak ; koristiti se za merenje . 
10760,neučestvovanje u spor ili rat 
13014,"u računarstvo , računar koji jesam povezati na računarski mreža "
14105,"u matematika , broj koji jednak ili manjiti od svaki brojati iz dat skup "
2630,žaba primalja 
6936,"gledati , tumačiti i izgovarati naglas nešto što jesam napisati ili odštampati . "
16624,raketa koji predvideti da iz vazduh ( avion ) gađati drugi avion 
2867,balkanski republika u jugoistočni Evropa . 
4466,rod gljiva sa crn tačka kod koji se klobuk raspadati u mastivalju tečnost pri sazrevanje ; ponekad se svrstavati u sopstven porodica Coprinaceae . 
13666,"u računarstvo , sistem koji postavljati granica izmeđe računarski mreža "
11625,"oblik zamenica ili glagol koji se ne označavati ni govornik ni adresant , već neki treći osoba posredno uključiti u interakcija "
1220,"komentar ili instrukcija , obično dodtai uz nešto "
457,Godišnja ili višegodišnji zeljast biljka : broćika . 
9094,zimzelen drvo . 
4313,Obično mali hleb okrugao oblik koji se moze otvoriti poput džep . 
13515,tuja 
2809,manja uloga u umetnički delo 
11663,pustinjski područje u centralni Australija 
7587,jedtivi plod bundeva ; jesti se kao povrće 
11109,postati namočiti 
8014,rod jastrebov koji uključivati eja 
4799,obožavanje svetac 
9739,rod bičarskin protocista 
581,neki žbun ili zeljast biljka iz rod Artemisia sa aromatičan zelen ili sivkast krošnja . 
2198,neki od mnogi višegodišnji zeljast biljka sa upadljiv svetnima glavica živ boja ; iz rod Chrysanthemum ; Argyranthemum ; Dendranthema ; Tanacetum ; široko rasprostraniti . 
288,"smear with blood , as In a hunting initiation rit , where the faca of a person is smeared with the blood of the kill "
2819,Posteljični sisar koji imati kopitati sa parni broj funkcionalan prst na svaki noga . 
6807,koštan izraštaj razviti blizu gornji kraj femura za koji jesam zakačen mišić 
11458,"velik debeo postava napuniti elastičan materijal , često sadržati feder ; koristiti se kao krevet , ili deo krevet . "
7804,mali soko iz star svet koji kružiti u vazduh nasuprot vetar . 
208,"koji ne tražiti , ne iziskivati specijalan nutricione potreba "
15681,"za životinja , potpuno razviti . "
174,Not standard ; Not accepted as a model of excellence 
7087,imati kretanje crevo 
1970,Čin dodavanje spoljašnji ukras na nešto . 
2505,nežan i sočan unutrašnji deo cvet artičoka koji jesam potpuno zreti 
8509,Uobičajena jarebica u Evropa . 
3536,pljosnat crv koji parazitirati u jetra i ? biti ducts domaći životinja i ljudi . 
13044,"Severnoamerička godišnji biljka , obično sa žut ili narandžast cvet ; rasti pretežno na vlažan , kiseo zemljište . "
5072,ručni alat za ušrafljivanje vijak ( imati vrh koji se uklapati u glava vijak ) 
17258,biljka koji se upotrebljavati u narodni medicina . 
6386,koji jesam samo jedan boja 
7892,"kratak pantalone do koleno , obično živ boja "
14404,žutosmeđ mineral koji jesam izvor redak element 
8205,neki od velik orao koji se hraniti riba 
14270,mahunarka iz rod Pisum sa mali beo cvet i dugačak zelen mahuna koji sadržati jestiv zrno . 
3470,oprema koji se koristiti za igranje golf 
15244,odnos između jedinica koji se izražavati disjunktnost njihov značenje 
3678,potez kao u fudbal 
16622,zmija . 
16234,biti takav koji se na odrediti način ponašati kada se on rukovati 
13167,oblik zamenica ili glagol koji se označavati osoba koji se obraćati ( adresant ) u dat diskurs 
5074,biti koji riba iz klasa Osteichthyes . 
505,"idealizovan slika neki ličnost , obično roditelj koji se formirati u detinjstvo . "
10579,biti koji supstancija koji organizm prerađivati da biti dobiti energija i graditi telesni tkivo . 
220,"onaj koji se moći ukazati poverenje , u koji se moći pouzdati "
1139,tipski rod porodica Ceratodontidae : izumro rod dvodihalica . 
5226,disfemizam za piva ( pogotovo vrsta koji dosta peniti ) 
223,mali srebrn riba hladan voda ; migrirati između slan i sladak voda 
959,engleski pesnik koji jesam napisati alegoričan romansa koji veličati Elizabeta I ( @card@ ) 
2289,nešto sto jesam napisati ponovo 
16936,evropski vrba sa sjajan kožast lišće . 
8642,Čin promena količina ili veličina nešto . 
2418,proizvoditi buk 
9729,koji služiti ili jesam namenjen istražiavnju ili otkrivanje 
15682,polje nauka koji obrada komunikacija i kontrola 
10574,ločina 
13347,"rastvor u koji se nalaziti čestica neki tvrditi materija , koji se ne rastvarati u drugi tečnost "
10821,neki ko jesam obučiti u šumarstvo . 
14376,osoba koji jesam roditi na neki određenom mesto ; osoba koji jesam taj mesto zavičaj . 
42,elektronski tekst koji jesam sačuvati i koristiti se u oblik digitalan slika 
1294,parazitski bičari u probavni ( gastrointestinalni ) ili urogenitalnom trakt kičmenjak i beskičmenjak kao i kod ljudi 
2024,dati nešto politički karakter . 
12849,prestonica Hrvatska . 
11140,"biti koji od raznovrstan , uglavnom hladnokrvan voden kičmenjak , koji imati krljuštati i disati na škrga . "
10255,porodica koji činiti sisara . 
7008,učiniti nesrećan 
1076,provoditi vreme u zatvor ili radnom logor . 
67,sklonost obavljanje dobrovoljan ili dobrotvoran posao 
12462,plod voćka sa koštica . 
7632,sup sa von ton knedla 
8775,"velik rod gljiva sa čvrst stabljika i beo sporama ; klobuk moći biti raznih boja ; namaju mlečan sok , po taj se razlikovati od rod Lactarius . "
15971,stanovnik Slovačka ili poreklo iz Slovačka 
16645,"reka u Italija , ulivati se u jadranski mora "
3298,posetilac koji domaćin iskazivati gostoprimstvo . 
57,Oosba koji imati i baviti se neki specijalan zanimanje . 
1916,"velik rod tropski drveće , žbunje i penjačica koji uključivati drvo smokva . "
6232,ispupčenje koji se koristiti za ojačavanje ili za pričvršćivanje za drugi objekt 
13249,električni uređaj koji moći da prekinuti strujni kola ako jesam preopterećen 
12467,skup vrednost nezavisan promenljiv za koji jesam funkcija definisati 
11777,vojni lice koji jesam po rang nizak od oficir . 
472,donji površina pećina ili jezero itd . 
9771,grupa umetnik koji se slagati o neki opšti princip . 
759,proces koji imati veza sa ljudski jezik 
7909,"čin smišljanje nešto , npr . pravljenje skica , nacrt ili plan "
8332,"glavni grad Sudan , na ušće Belog i plav Nil "
12436,drvo iz star svet srednji veličina sa gladak siv kor i lišće nalik ? koji postajati žut narandžast ujesen . 
3092,"meso jestiv kopnen puž , obično se servirati u ljuska , s umak od rastopljen maslac i beo luka "
13426,profesija koji se izučavati na medicinski fakultet ili sličan ustanova a u cilj lečenje i sprečavanje bolest 
2457,deo telo insekt koji nositi krilo i noga . 
657,dobričica 
1487,ko . 
13434,zapadnoafrički jezik koji govoriti narod Volof u Senegal ; srodan jesam jezik ful 
8019,jednostavan objektni orijentisan programski jezik nezavisan od platforma koji se koristiti za pisanje aplet koji klijent preuzimati sa veb i koji se izvršavati na klijentovoj mašina 
1429,nešto što obezbeđivati pristup 
6142,fermentisano i često penušav pića koji se praviti od sok kruška ; po ukus sličan jak cideru 
4539,"evroazijski drozd srednji veličina , viđati se uglavnom zimi . "
13377,biti koji pokretan imovina ( posebno odevni predmet ) . 
3117,medijum koji širiti pokretan slika . 
11677,koji se odnositi na Juda koji govoriti romanski jezik 
8307,suknen moljac . 
14001,Mafin koji sadržati mekinje . 
243,"osobina onaj na šta se moći osloniti , što jesam pouzdano "
3999,Klateća ili klizajuća pregrada koji zatvarati ulaz u sob ili zgrada . 
12926,pripradnik ( budistički ) narod koji živiti oko reka Mekong u Laos i Tajland i govoriti laoški jezik 
5207,Unutrašnja donji horizontalan površina sob ili hodnik . 
4590,sprava koji se kačiti na nešto da biti ga držati na mesto . 
3234,Istočnoindijske godišnji trava ; izvor seme sezam ili ulja . 
14161,Najduži deo kanal za varenje u koji se zavšava varenje . 
6234,malo primitivan sklonište koji se koristiti za život 
7075,injekcija koji se ubrizgavati u ( pod ) koža 
14048,element koji imati atomski broj velik od @card@ ( što jesam atomski broj uranijum ) ; sav jesam radioaktivan 
125,"mlad kobila , ženski ždrebe . "
13471,rod uglavnom zeljast biljka koji imati karakterističan ? fetid miris . 
749,neki ko dekorisati . 
3943,rod porodica Bothidae 
4675,obožavanje riba 
10390,turkijski jezik koji govoriti Turčin 
10471,"zgrada sa staklen zid i krov , za uzgoj i pokazivanje biljka pod kontrolisan uslov . "
6713,Oštar prolazan talas u normalan električni stanje ( ili niz takav prolazan ) ( elektronika ) . 
6260,običan evropski šumski muharica sa sivo-smeđim perje 
4,osećanje seksualan ljubav 
3418,štuka ; ? ? 
6218,"rasti na Mediteran , pldovoi jesam velik i naboran , miris i ukus podsećati na limun , ali imati malo sok , zato on se kor koristiti za kandiranje . "
865,izlistak program ili tehnički priručnik koji opisivati rad i korišćenje program 
8397,koliko jesam nešto na raspolaganje . 
4374,Povlačenje iz aktivnost grupa . 
5096,"Noćni sisar jugoistočni Azija i Filipini koji živiti na drvo ; nalikovati lemuru , imati kožan nabor na oba strana od vrata do repa koji se koristiti za dug skok . "
14750,sušen mesto na način severnoamerički Indijanac 
15724,izričito odobravanje šta 
15803,bantu jezik narod Čeva koji živiti u istočni centralni Afrika 
11583,"biljka prvobitno uzgajati , ali sada divljati "
7351,"dodavati detalj uz neki izveštaj ili ideja ; pojašnjavati značenje nešto na učen način , obično u pisan oblik . "
4623,pribor za kuvanje koji se sastojati od širok metalan posuda . 
719,"koji predstavljati ili odražavati izvornik , po koji jesam ostati sličan stvar oblikovati "
5185,"rafinisan beo šećer oblikovati u kocka , pogodan za služenje "
13683,gavke 
2297,koji se odnositi ili jesam karakterističan za grana protestanske crkva koji se držati učenje Martina Luter 
5125,evroazijski aromatičan trava sa mnogo žutozelen cvet ; lekovit biljka ; naturalizovati u severni Amerika . 
207,Čin koji se činiti neki dobro delo . 
10066,neki od više torbar travojeda Australija i nov Gvineja koji imati velik i snažan zadnji noga i dugačak i debeo rep. 
771,sredstvo za ubeđivanje ili argumentacija . 
