,Sysnet
220,Osećaj koji se doživljava u očekivanju nekog određenog bola ili opsasnosti i obično ga prati želja da se pobegne.
4214,Biljka krstašica sa debelim gomoljastim jestivim žutim korenom.
2046,bodlja na harpunu ili streli
13288,jedan apački jezik
623,"zaslađena mešavina mleka i jaja pečena, kuvana ili zamrznuta"
9853,tekuća traka koja u fabrici prenosi robu i delove
10974,"u grčkoj mitologiji sedam kćeri Atlasa, polusestre Plejada; one su hranile bebu Dionisa pa ih je Zevs za nagradu stavio među zvezde"
12305,(računarstvo) prostor na disku potreban za informacije koje nisu podaci (koristi se za lokaciju i vremenski raspored)
17109,Pozicija ili ustrojstvo tela i njegovih udova.
9554,vreme dodeljeno na rasporedu ili redu događanja
14044,"Rod ptica iz porodice Sylviidae, uključuje maslinicu."
8363,list koji je predviđen za otcepljivanje iz publikacije
11136,dugme kojim se aktivira računarski miš
11194,Analgetički lek; koristi se i kao antipiretik; Bajer je marka tableta aspirina.
335,Formalna organizacija ljudi.
5637,stanovnik ili poreklom iz Alžira
50,Popuštati lako ili sposoban za nešto.
15686,"suglasnik koji se izgovara tako što se u nekom trenutku zaustavi protok vazduha, da bi se potom iznenada oslobodio"
4282,osoba koja je imala neku poziciju koju više nema
12021,Luka u zalivu Riga koja je prestonica i najveći grad Letonije.
5929,smatra se da izaziva dijareju kod ljudi
6365,degiha dijalekat kojim govori narod Kanza
11695,reka koja protiče kroz Njujork
11758,"Najmanji od svih miševa; živi po livadama, njivama i vrtovima."
10570,Industrijska biljka penjačica čiji se osušeni plodovi upoterbljavaju u pivarstvu.
6339,tumačiti nešto na određeni način; preneti određeno značenje ili utisak
13329,Distribuirati.
10628,čovek koji istovremeno ima više žena
16920,(odnosi se na zvukove ili glasove); proizvodi visok ton
5662,polagan prolazak tečnosti kroz neki filter
5278,onaj koji emituje svetlost nakon izlaganja zračenju iz spoljnog izvora
2825,tipski rod porodice Sylviidae: grmuše
1366,Iznos za koji se plata poveća.
2394,a fungus of the family Hydnaceae
15764,osnovna novčana jedinica Slovačke
17245,komercijalna delatnost kupovine i uvoza robe iz koje inostrane zemlje
12154,"Ograđen prostor za životinje, živinu ili stoku."
9719,Parče mesa odsečeno od mesnatog dela životinje ili velike ribe
2133,"U računarstvu, 128 karaktera koji čine ASCII kodnu šemu."
15674,"najveće more koje je okruženo kopnom; nalazi se unutar Evrope, Afrike i Azije"
9468,"reke koja teče iz jezera Iri u jezero Ontario, predstavlja granixu između SAD-a i Kanade"
8049,Period koji se provede u spavanju.
2879,onaj koji pravi apstrakte ili sažima informacije
8702,"Mek, vlažni deo voćke."
12636,tačka kompasa na sredini između istoka i jugoistoka
10581,"Telo kljunara je obraslo gustom dlakom, a rep im je vodoravno spljošten; kljun im je širok i sličan pačjem; na prstima imaju kandže; a između prstiju plovne kožice."
365,zaštitna obloga za mehanički deo
9461,Godišnja zeljasta biljka iz južne Evrope i istočne Azije koja ima belo cveće i aromatično seme; koristi se za lečenje i kuvanje.
13573,nemasno meso ribe koja se nalazi na pacifičkoj obali SAD
6698,novčana jedinica Šri Lanke
7255,sportska vožnja bibiklom
17225,količina dobijena sabiranjem
17084,Mašina koja obično stoji ispred banaka koja korisnicima koji imaju odgovarajuću karticu izdaje gotovinu.
12838,"Vazdušasta, zaslađena mešavina od jaja sa ukusom limuna posuta šećerom u prahu; služi se sa džemom, vinom ili voćnim sosom."
8899,Evroazijska višegodišnja lukovičasta zeljasta biljka.
651,Neka od brojnih niskih zimzelenih biljaka iz roda Armeria koji imaju okrugle glavice rižičastog ili belog cveća.
17061,Biti prodavan za određenu cenu ili na određeni način.
16485,Evropska slatkovodna riba sa pljosnatim telom i srerkastom krljušti; nije mnogo vredna za ishranu.
6495,"Visoki komad nameštaja koji obezbeđuje prostor za smeštanje odeće; ima vrata, šipke ili kuke za kačenje odeće."
7664,"organizam koji nastao od genetički različitih roditelja; posebno se odnosi na biljke i životinje nastale od različitih varijeteta, sorti ili vrsta"
3655,kolekcija kxiga koju čine sveti hebrejski rukopisikoji beleže njihovu istoriju izabranih ljudi; prva polovina hrišćanske Biblije
3355,Jestiva lukovica crnog luka; kod mladog se jedu i zeleni listovi.
14527,"Organ koji ima nervne završetke (u koži, oku, uvu, nosu ili ustima) koji odgovaraju na stimulaciju."
13218,"u računarstvu, registar koji se koristi za određivanje adrese operanda"
16141,Neki od mnogobrojnih leptira blede boje koji imaju tri para dobro razvijenih nogu.
7999,"uređaj sa eksplozivom koji izgara malom brzinom plamenom u boji, može se koristiti za osvetljavanje kakvog područja ili za slanje signala itd."
7400,ćelija sa jedrom u koštanoj srži iz koje se razvijaju crvena krvna zrnca
1697,aparat koji uklanja vlagu
4574,KE
4844,koji se odnosi na ili je određen sociologijom
5759,opasna distribucija u svim pravcima
15744,locirati specifičan region hromozoma u odnosu na poznate sekvence DNK ili gena`
13659,zagovornik principa humanizma
8477,sakrivanje identiteta nečega izmenom njegovog izgleda
15501,metalna traka sa krajevima savijenim pod pravim uglom; koristi se za spajanje građevinskog materijala
14919,Veliki? evroazijski medved.
387,"Suvi sadržala semena, ili struktura koja sadrži spore, recimo mahovine."
7926,"Gaji se od preistorijskog vremena, za pašu i zbog zrna."
3663,HN
9945,Republika u centralnoj Evropi; invazijom Nemačke na Poljsku 1939. godine počeo je Drugi svetski rat.
8051,"Bilo koja od raznovrsnih biljaka iz rod Coronilla koja ima roze, purpurne ili žute cvetove u pomoćnim glavama ili klobucima sa dugim šiljcima."
8500,poređati nešto kao nisku
543,"Napoleon je porazio Ruse u rovovskoj bici kod Borodina 1812, ali je nepopravljivo oslabio svoju armiju"
4918,Plan s kojim se nešto aktivno čini.
2848,nešto ne funkcioniše kako treba
8201,particip kojim se izražava završena radnja
13227,(pravo) prenos vlasništva činom predaje predmeta
11493,"male, masne ribe; obično su konzervirane"
3967,koji se tiče li pripada ostrvu i državi Nauru
4436,Osoba koja za koju se smatra da potiče od nekog pretka ili rase.
15869,Događaj koji označava jedinstvenu ili značajnu istorijsku promenu ili na kome se zasniva dalji razvoj.
3159,Veliki kit sa velikom šupljinom u glavi u kojoj se nalazi ulje.
14420,"biljka sa tankim, belim stabljikama koje nose tamno-zelene listove i formiraju zdužene glavice"
132,"Koga karakeriše ili koji pokazuje odbijanje, poricanje ili suprotstavljanje; koji nema pozitivna svojstva."
293,Ljudski čin stvaranja.
16932,"Kružni mišić, zatvara ili otvara cevaste organe, npr. analni sfinkter."
9748,porodica podreda Hystricomorpha.
6741,Zeljasta biljka čije se lišće upotrebljava kao salata.
6333,Reč koja je opštija od date reči.
13689,ledeno alkoholno piće koje se pravi od belog vina i voćnog soka
8933,indoevropski jezik kojim govore Albanci
113,Ne pridržavanje moralnim principima.
12115,"Bilo koji od malih kratkorepih glodara severne hemisfere koji imaju meko sivo krzno u gornjem delu, a belo u donjem, velike uši i rep s bogatim krznom; neki od njih domaćini za krpelje, izazivače lajmske bolesti."
5059,zaštitnik zakona
15020,Rod vrlo rasprostranjenih višegodišnjih zeljastih biljaka i nekog žubnja.
15653,kaša napravljena od istanjenog ovsa
8865,svako političko usmerenje koje se zalaže za kompromis u cilkju izbegavanja konflikta
232,Imati poverenje ili veru u nekoga.
10862,Nametnut i prikupljen novčani iznos.
4568,smatrati (se) sličnim nekome
10619,Nuklearno oružje kod koga se ogromna energija oslobađa nuklearnom fisijom.
8675,Mali evropski smeđi ljiljak.
3203,Lečiti ili oporaviti se.
3716,Čin pružanja odobravanja i podrške.
5025,"Dijagnostička tehnika koja koristi infracrvene zrake za snimanje različitih delova tela, naročito za protok krvi i detekciju tumora. Dobija se snimak koji se naziva termogram."
2701,mehanički uređaj koji ima zabadajući ili potiskujući pokret
16231,Mala smeđe-siva ptica poreklom iz Evrope.
7174,bilo koje bestelesno natprirodno biće koje ljudska bića mogu videti (ili čuti)
5708,"u elektronici, projektovanje sistema koje duplira komponente da bi se obezbedile alternative u slučaju otkaza neke od njih"
4499,jumanski jezik kojim govori narod Juma
9986,droga koja brzo izaziva zavisnost
3660,naučno proučavanje nervnog sistema
11939,grupa jezika koji potiču od latinskog
9824,novčana jedinica Albanije
10912,Obrazac tkanja ili struktura tkanine.
2730,jumanski jezik kojim govori narod Kokopa
2467,Komunistička država koja zauzima veliki deo teritorije Azije; najmnogoljudnija država na svetu
3164,Pomeranje kroz prostor koje menja lokaciju nečega.
11961,Mala pita bez gornje kore koja sadrži voće.
1893,dramski rad namenjen glumcima za izvedbu na sceni
7291,cifra u broju za koju se pouzdano zna da je tačna
13204,Skup stvari (pešaka ili vozila ili poruka) koje dolaze i odlaze sa određenog mesta.
8400,mera za površinu koja iznosi 100 metara kvadratnih - površina kvadrata čija je stranica dužine 10 metara
16148,glavni grad Zapadne Samoe
409,Ukuvano zgnječeno voće.
13818,unositi zarazne klice ili njihove produkte u živo tkivo radi dijagnoze ili posticanja imuniteta
16324,pesnik koji piše sonete
14263,neutralan alfabetski karakter (nekada su bili u donjem delu slovoslagačevog sanduka sa slovima)
11937,genitalije muške ribe kremaste teksture koje se koriste u ishrani; u mnogim kuhinjama služi se pržena
9717,čiji naslednik biti
13150,rotaciona platforma sa šinama; koristi se za automobile i vagone
17024,Moć upravljanja ili određivanja.
10675,grana indoiranske jezičke porodice
14463,Oblikovati materijal (kao što je kamen ili drvo) rezbarenjem nožem.
14672,"lako se puže uz glatku stenu pražeći po pukatoinama insekte, stanarica srednje i južne Evropeca"
7329,Izneti na pokazivanje.
5697,proširenje izgrađeno na kosom krovu u koji se smešta uspravan prozor
2019,koji se odnosi na drevne aramejske jezike
15300,zajednički naziv za novine i časopise
16,Fiksirani dan kada je otvorena javna pijaca.
8475,Mala vekna ili zemička mekog hleba.
2158,Kopnena masa koju grade kontinenti Evrope i Azije.
2744,"Primitivni ?pouched sisari, ima ih uglavnom u Australiji i Americi."
2937,paprikaš sa piletinom
5544,grupa od 2 do tri sloga koji čine osnovnu jedinicu poetskog ritma
8290,jezik australijskih starosedelaca
9561,bilo koje jedinjenje rastopivo u vodi koje može da postane lakmus plavo i koje raeguje na kiselinu i stvara so i vodu
8502,koji je u vezi sa gramatikom
17389,Mesto za sakupljanje i prikazivanje predmeta koji imaju naučnu ili istorijsku ili umetničku vrednost.
10510,stanovnik Mozambika ili poreklom iz Mozambika
14988,prednja strana mesnatog dela
17304,Zauzeti teritoriju osvajanjem.
1497,malo parče čokolade kupastog oblika koje se jede u jednom zalogaju
12671,"u računarstvu, vreme koje protekne od trenutka kada sistem zatraix podatke do trenutka kada uređaj isporuči podatke"
17028,uzvično retorično sredstvo
11160,Tropske biljke
4026,Poklapa se sa rodom Tarsius: aveti
8823,osobina onoga što je permeabilno (npr. u procesu osmoze)
1747,katren u jampskom pentametru sa shemom rime abab
195,Stanje ili uslov u kome je neko nevin za određen zločin ili uvredu.
2238,rod jestivih pečuraka: smrčak
15133,glavni i najveći grad Antigve i Barbude; na ostrvu Antigva
14446,Utvrđena ceremonija koju propisuje vera.
3880,Kinesko drvo.
15632,novčana jedinica Čilea
7391,elektronska oprema koja obezbeđuje vizuelne slike pomoću promenljivih električnih veličina
0,jabuka koja rano sazreva popularna u severoistočnoj Americi; najčešće se jede sirova ali je pogodna i za sos od jabuka
200,proglasiti krivim (utvrditi krivicu)
16054,grafikon eksponencijalne funkcije
6170,Listopadno kinesko drvo sa lepezastim lišćem i mesnatim žutim semenjem; skoro isključivo se gaji kao ukrasno ulično drvo.
162,koji je klonuo duhom
4370,Ministar koji je zadužen za državne finansije.
6105,"u računarstvu, sićušan elektromagnetni kalem i metalna šipka koji se koriste za čitanje i pisanje magnetnih obarazaca na disk"
13178,lešnjikare
7641,Republika koja uključuje 26 od 32 okruga koji čine Irsko ostrvo; stekla nezavisnost od Ujedinjenog Kraljevstva 1921. godine.
10484,Pokretni torbar nalik pacovu; živi u Australiji i suednim ostrvimal hrani se insektima i biljkama.
11801,"Mala boca u kojoj je lek, posebno ako je sterilna i zapečaćena i koristi se za injekcije/"
7645,Drvo koje rađa jestiv koštunjav plod.
5238,"glavni i najveći grad Libana, na Sredozemlju"
9176,mešavina sirćeta ili vina i ulja sa raznim začinima u koju se natapa meso ili riba pre kuvanja
7683,zelena salata sa hrskavim talasastim listovima svetlo-zelene boje koji su gusto raspoređeni formirajući rozetu
16536,Kolač koji sadrži puno putera.
160,osoba čija je svetost izuzetna
3956,Ženka lava
11610,"država na zapadu centralne Afrike, stekla nezavisnost 1960"
8967,Dati prvenstvo kandidatu ili meri ili odluci.
14559,Preneti informaciju.
12764,skup od tri literarna ili dramska dela koje povezuje predmet ili tema
9913,"Povrće iz porodice ?: kupus, brokoli, karfiol, prokelj."
1108,"Uspravna godišnja biljka, često se gaji za salatu, bere se kad je mlada."
13511,prva strana nekih knjiga koja sadrži samo naslov
16666,porodica istočnoafričkih jezika kojim govore nilotski narodi od juga Sahare do Kenije i Tanzanije
15911,Koji je prema spoljašnjoj strani ili dalje od sredine.
264,komunicirati pismenim putem
14101,Velika i impozantna kuća.
9843,"koštani lavirint okružuje unutrašnje uvo a u  njemu se nalazi membranozni lavirint, organ ektodermalnog porekle, u kome se završava akustični ili vestibularni deo osmog živca."
697,vaspitač koji ima izvršnu vlast u školi.
13305,Neka od raznovrsnih velik zmija neotrovnica koje ubijaju plen lomeći ga u utrobi.
504,period od sedam uzastopnih dana koji počinje u nedelju
5316,jestive žlezde životinja
9024,orglica koja nastaje kada se mali prstenovi navežu jedna na drugu
15130,Osoba koja se upisuje ili je upisana na neki obrazovni kurs ili u školu.
7561,"u grčkoj mitologiji, titanka, majka Helija, Selene i Eosa"
2543,statistički proces u kome određene nasumične varijable zavise od promenljivog parametra (koji je obično vreme)
5314,"Izlaziti, o nebeskim telima."
12580,"Vreme fizičkog formiranja i razjoa Zemlje, posebno pre nastanka čoveka."
3360,"grafički simbol koji se sastoji od dva slova ili više njih (obično je reč o inicijalima), a štampa na kancelarijskom materijalu ili veze na odeći"
2122,podloga koja se sastoji od horizontalne površine za držanje predmeta
1819,Prisilno potčinjenje kontroli drugih.
4943,komad mesa koji je odsečen od glavnog dela
14194,pisac scenarija
9246,nake od gljiva iz pododeljka Basidiomycota koju čine klobuk na kraju drške koja raste iz podzemnog micelijuma
8071,Veličina koju može da primi kontejner (posuda).
3676,Neka riblja porodica.
5837,ljudi iz Irske ili poreklom iz Irske
8553,veličina izražena brojem
15781,specijalna šerpa za pečenje
12601,novčana jedinica Estonije
11012,potomak roditelja različitih rasa (naročito belih i indijskih roditelja)
9817,koji se odnosi ili je izražen pravopisom
4562,Materija koju proizvode biljke ili koja raste na način biljaka.
10313,"U anatomiji, bilo koja šuplja cilindrična telesna struktura."
1171,Pregrada koja ima paralelne ili izukrštane šipke koje sprečavaju prolaz ali propuštaju vazduh.
17228,"odvojiva brava koja ima šarnir sa šarkama koji se može provući kroz alke u lancu, posle čega se zatvara"
8749,"Grupa familija više ili manje naprednog drveća, žbunja i trava koji imaju ?' sadrži 69 familija, uključujući Ericaceae, Cruciferae i Malvaceae; ponekad se klasifikuje kao superred"
10414,konsonant za čiju je artikulaciju potrebno pokretanje usana
14660,Prednja strana broda ili letalice.
13468,Udarački instrument sastavljen od drvenih pločica u koje se udara drvenim čekićima; na njemu se izvode hromatski tonovi koji imaju drvenu boju i u orkestru daju interesantne efekte.
1450,Dvogodišnja ili višegodišnja trava severne hemisfere; ima?
15219,objašnjenje čovekovog poznavanja maternjeg jezika
11684,Porodica ptica iz reda Falconiformes.
15238,između ranog ili kasnog vremenskog perioda
300,Kome nedostaje lepota ili šarm.
16888,"označiti kakvim simbolom, formulom itd."
2635,čin ili proces kompresije.
3767,jedan od dva dugačka korena koji se kuva i koristi u ishrani; vrsta starinskog povrća koje se u velikoj meri uzgajalo od 16. do početka prošlog veka
13099,Oružje za masovno uništavanje čija eksplozivna snaga potiče od nuklearne reakcije.
10881,alatka koja se koristi za rezanje ili sečenje
14900,"Jedinstveni, nepodeljeni prirodni entitet koji se javlja u sastavu nečeg drugog."
12831,U nekim klasifikacijama smatra se rodom podporodice Lutrinae.
4682,"deo nakita koji se sastoji od alke od plemenitog metala, često i sa dragim kamenjem, koji se nosi na prstu"
14176,"lipovo drvo, kao građa i gorivo"
9489,Rod koji pokriva familiju Phalacrocoracidae.
6242,Organizacija podzemlja.
11179,"koji se se odnose na strukturu ili je izazvano strukturom, posebno političkom ili ekonomskom strukturom"
15228,Neka od mnogih slatkovodnih riba familije Čprinidae.
10612,Staviti na razmatranje ili diskusiju.
1837,Ostrvska država u južnom Atlantiku; stekla nezavisnost od Portugalije 1975. godine.
1034,zelena salata sa mekanim listovima koji nisu gusto raspoređeni; lako se kida
16720,gušterasto četvornogo telo završava serepom koji je duži od trupa i bočno spljošten; rep im služi pri plivanju i kao oružje u borbi; telo im je prekriveno cvrstim rožnatim pločicama koje na leđima pojačane koštanima pločama.
382,meso repa jastoga
2297,koji se odnosi ili je karakterističan za granu protestanske crkve koja se drži učenja Martina Lutera
9601,struktura koja nalikuje kesi kod životinja
15148,bar u kome su služi suši
11834,teorija u psilogiji po kojoj su asocijacije osnovni princip mentalnih aktivnosti
13781,školski zadatak koji učenik ispunjava da bi zadovoljio zahteve nastavnika
8549,Mesto bliže kraju neke zone.
9084,koji ima tu funkciju da izvršava planove ili naređenja
2740,meso fazana; najčešće dinstan
1711,koren neke od biljaka iz porodice slačica
2353,KR
6835,Tvrditi ili misliti da je neko odgovoran za neko delo ili čin.
5401,Biljka jugoistočne Azije sa sivkastim lišćem i belim ili crvenkastim cvetovima; izvor opijuma.
539,Biljka koja se upotrebljava u narodnom lekarstvu.
54,Posebno solistično izvođenje muzike ili plesa.
1130,kamarupski jezik kojim se govori u severoistočnoj Indiji i zapadnoj Burmi
16700,Uglavnom tropska američka penjačica; neke rađaju jestivi plod.
15018,"ostrvska država u centralnom Pacifiku, malo ispod ekvadora"
8352,Početi raditi ili funkcionisati.
7053,stilizovana figura 4 ruke ili noge koje se šire od centra
3453,kajsije koje se čuvaju tako što se osuše
13395,lastavice i bregunice.
1983,most koji je namenjen pešacima
12360,Strana nekog predmeta koja je nasuprot prednjoj strani.
17157,novčana jedinica Somalije
9187,"Tipski rod porodice Rheidae; velike i visoke ptice trkačice Južne Amerike, slične nojevima ali manje od njih."
12264,zečevi i kunići
245,Neki cenjeni atribut ili kvalitet.
701,koji se odnosi ili koji je obavijen književnom maštom
12668,sastavni deo legura koji se dobija kada se atomi elementa ugrade u kristale metala
10055,Prednji deo ljudske noge između kolena i članka.
17188,velika afrička antilopa sa gugačkim skoro uspravnim rogovima
10740,"Zelena biljka koja ima vaskularni sistem: paprati, gimnospermi i angiospermi."
9254,Vodene bixke mesožderke; rodovi Utricularia; Pinguicula; Genlisea.
13653,Dvogodišnji grm poreklom iz Evrope i zapadne Azije kojia grubo lišće u obliku jezika i tamne cvetove crveno-ljubičaste.
15561,"koji se tiče Džibutija, njegovih ljudi i kulture"
157,Ućiniti da se neko oseti opuštenim.
7227,tortilja čips preliven sirom i ljutom paprikom i pečen
6132,pustinja između Nila i Crvenog mora
9100,odnosi se na usmerenje libida na osobu.
4981,učiniti žrtvu od nečega u religijskim ritualima
7251,koji tek što nije zaspao
3430,najvažnija klasa rakova
12557,Uski komad zemlje koji prodire u vodenu masu.
2514,Kombinovati u jedno.
3918,mekan srebrnobeo tetravalentan radioaktivni metal; izotop 232 se koristi kao izvor u nuklearnim reaktorima
8985,"koji se tiče jemena, njegovih ljudi i kulture"
4276,Nosorozi.
9015,"Poseban crtež ili vidljivi predmet koji predstavlja osobinu, tip, grupu itd."
10468,presavijeni papir koji može da se koristi za neprekinuto štampanje koje kontroliše računar
10524,"o komediji, koji se odnosi na komediju ili je karakterističan za komediju"
8008,"Trava sa dugačkim cilindričnim klasjem, gaji se na severu SAD i u Evropi zbog sena."
14459,dodatak jelu za poboljšanje ukusa
12081,Kretanje koje telo samo pokreće.
16157,Pomoćnik koji obavlja korespondenciju i činovnički rad za šefa ili organizaciju.
12605,Čin ubeđivanja (ili pokušaj ubeđivanja).
15699,član ruske manjinske liberalne grupe koja je yastupala postupne reforme i suprotstavljala se boljševicima pre i za vreme Ruske revolucije
786,"Bumbari, ??"
7207,glavni Grad Novog Zelanda
1713,Pojava pri kojoj se talasi svetlosti ili drugog zračenja ograničavaju u smeru vibracija.
6504,stanovnik Mauricijusa ili poreklom sa Mauricijusa
9271,jedan kačinski jezik
9477,Paprat iz roda Botrychium.
5707,koji jako nadražuje organe ukusa i mirisa
17335,glavni grad Kambodže
4830,Stanje redovnog ili ispravnog poretka.
16859,mrežna topologija kod koje su komponente mreže povezane na busnu šinu
9348,operacija koja sledi pravila Bulove logike; operandi i rezultat operacije uvek imaju jednu od dve moguće vrednosti
14050,farma vinove loze gde se proizvodi grožđe
9272,grana tai jezika
15548,komunikacioni sistem za komunikaciju na daljinu
4431,"Duvački instrument sličan orguljama, proizvodi tonove pomoću mehova koje svirač stavlja u pokret nogama ili mehanički; umesto orguljskiih cevi ima metalne jezičke."
11838,"Aromatične lukovice, koriste se kao začin."
5651,kljunari
14225,"metafora koja se javlja tako često da je dobila novo značenje izraza (npr. ""on je zmija"" može jednom biti metafora, ali posle godina upotrebe to izumire i postaje novo značenje reči ""zmija"")"
6526,"Lasice, samur"
6617,Grupa ljudi koji su povezani nekom zajedničkom vezom ili zanimanjem i posmatraju se kao celina.
11785,stanovnik Malija ili poreklom s Malija
14256,Specijalista za urologiju.
6780,"u računarstvu, pad glave za čitanje i pisanje tvrdog diska (obično kada dođe do kontakta glave s površinom magnetnog diska)"
9762,Potpuno izdiderencirana strukturna ili funkcionalna jedinica kod životinja koja je specijalizovana za neku određenu funkciju.
16955,bilo koji viski napravljen od kisele smeše
11895,Carski rez je operativni porođajni zahvat kod koga se porodilji otvara abdomen i materica a zatim se kroz taj rez vadi beba.
6842,Jednobožački sistem verovanja i obreda koji se zasniva na Starom zavetu i na Isusovim učenjima koja su uključena u Novi zavet i koji ističe ulogu Isusa kao spasioca.
7421,koji se odnosi na reči
15752,programski jezik kojm se zapisuju algoritmi
7942,koji se odnosi ili je karakteristično za Dansku ili Dance
11267,koji se tiče ili se odnosi na kriminologiju
2642,parče odlomljeno ili odsečeno od nečega
5240,Kičmenjak koji živi stalno ili uglavnom u vodi.
13044,"Severnoamerička godišnja biljka, obično sa žutim ili narandžastim cvetovima; raste pretežno na vlažnom, kiselom zemljištu."
1335,"Srebrni meki metal iz alkalne grupe; ima ga mnogo u prirodi u jedinjenjima, posebno u slanoj vodi; gori žutim plamenom i reaguje burno sa vodom; ima ga u morskoj vodi i u mineralu halitu."
16247,Oblikovati duvanjem.
16333,Reći ponovo ili imitirati.
17099,aritmetička sredina apsolutnih vrednosti devijacija od sredine distribucije
15012,Koristiti se jezikom.
14428,(stih) imati metrički sistem zasnovan na relativnoj dužini slogova
619,muskogijski jezik kojim govori narod Koasati
13801,pomoćno sredstvo koje se sastoji od kožne trake
11925,Balzamovano i osušeno telo zamotano za pokop (kao u Starom Egiptu)
12602,čin dekompozicije neke supstance u elemente iz kojih se sastoji
14754,ostvro južno od Malajskih ostrva
2603,Računarski hardver koji čita i zapisuje informacije uskladištene na magnetskom ili optičkom disku
11457,neka strana u sportskom odeljku novina
10495,Stajni ekstremitet donjeg uda kod kičmenjaka.
14320,koji pripada Demokratskoj stranci ili se na nju odnosi
7932,Drvo koje ima jestivi plod.
4232,"Vizuelni pregled želuca pomoću gastroskopa koji se ubacuje kroz jednjak,ezofagus."
9875,koji je bio izložene vazduhu
1582,"Psoglavi majmun iz zapadne Afrike, izgled mu je ružan i odvratam; brada mu je žuta, a obrazni nabori plavi; bxuška i zdnjični žuljevi cu crveni.baboon of west Africa with red and blue muzzle and hindquarters"
13807,žuti ovalni plod sočne i kislele unutrašnjosti
7284,Ukloniti (artikal) iz izvora.
15456,Događaj koji se sastoji od početka nečega.
5951,grupa ostrva koja pripadaju Karibima
16177,meso sa slabine jagnjeta
13269,Pokušaj da se nešto dobije.
2222,osnovna novčana jedinica Turkmenistana
11450,"koji se odnosi na komunikacione mreže u kojima širina kanala može da se deli i koristi istovremeno za simultane signale: glas, podaci, video"
13212,Abnormalno ili fiziološki neuravnoteženo stanje tela.
4527,"Oblik zrnaste hrane, kuva se celo ili se melje."
6657,dravidski jezik kojim se govori u jugoistočnoj Indiji
13581,postupati prema nekome drugačije zbog njegovog pola ili rase
