,Sysnet
5308,"stvorenje iz tevtonske mitologije, obično predstavljeno kako bljuje vatru i ima reptilsko telo, a ponekad i krila"
12881,Napisani ili odštampani simbol.
10725,dužina ili tip vremenske aktivnosti označene glagolom
54,"Nezgoda, posebno ona koja prouzrokuje povredu ili smrt."
8195,Manić
8435,sličnost oblika
1565,Vladin biro posvećen obavljanju neke specifične funkcije.
4226,osnovna novčana jedinica u Liberiji
12406,"u novijim klafikacijama, koegzistiraju sa cilijatama: sitni organizmi koji se nalaze u otpadnim organskim rastvorima"
10118,par šina po kojima se kreću vozovi
2485,pritisak koji ostvaruje atmosfera
1939,Ruska imperatorska loza koja je vladala od 1613 do 1917. godine.
10947,sok od grejpfruta
12805,deo gramatike koji se bavi kombinovanjem prostih reči u složene
16356,optička aberacija kod koje slika ima obojene rese
7848,Osoba koja gradi brodove.
16917,biti nasuprot nečem drugom.
14513,bilo koje nebesko telo (osim kometa ili satelita) koje se okreće oko sunca u sunčevom sistemu
12658,čin traženja pomoći od koga
14798,raketa koja ima sistem navođenja koji je usmerava prema cilju koji emituje infracrveno zračenje (kao mlazni motor)
10248,Pripadnik jedne od porodica malih buba koje se hrane biljkama i njihovim plodovima; posebno su poznati žitni žišci.
1674,Koristi se u nekim klasifikacionim sistemima; Passeriformes koje imaju relativno jedostavan vokalni organ i ne mogu dobro da pevaju: vikačice.
10418,"Odpremno sredstvo za putnike, poštu ili teret."
607,cevozubac
10568,beli metal koji gori jarkom svetlošću; peti element po zastupljenosti u Zemljinoj kori; važna komponenta većine biljaka i životinja
12695,kreolski jezik kojim govori većina Haićana; zasniva se na francuskom i raznim afričkim jezicima
2916,Tipski rod porodice Menyanthaceae; jedna vrsta grčica
6133,Kolač koji sadži suvo grožđe.
13801,organizacija podataka u skladu sa specifikacijama slaganja (obično za računarsku obradu)
6858,European kinglet with a black-bordered yellow crown patch
12830,"fleksija imenica, prideva i zamenica u indoevropskim jezicima"
1110,rod uglavnom drvenastih relativno primitivnih dikotiledonih biljaka cvetnicaers often unisexual and often borne in catkins
15644,neka od sistema jedinica za merenje elektriciteta i magnetizma
3349,grupa ljudi koji se bave zajedničkom delatnošću
16910,metal retke grupe - lantanoid; koristoi se u laserima
17330,"Učiniti stabilnim, dovesti u ravnotežu, sprečiti kolebanje."
19302,Aromatična višegodišnja biljka iz jugoistočne Rusije.
7212,pružiti duhovni uvid (u religiji)
81,podsticati nekog da počini zločin ili neko krivično delo
8960,najmanje prokariote koje mogu da se bespolno razmnožavaju; nedostaje im ćelijski zid i mogu preživeti bez kiseonika; mogu izazvati pneumoniju (upalu pluća) i infekcije urinarnog trakta
3051,izazvano lekrevim rečima ili terapijom (koristi se posebno za komplikacije koje nastaju kao posledica lečenja)
5201,o strukturi koja ima više nivoa
17793,zapaljiv bezbojni gasoviti alken; dobija iz petrola i prirodnog gasa i koristi se za paroizvođnju mnogih hemikalija; nekad se koristio i kao anestetik
186,"arhipelag u Južnom Tihom okeanu, sastoji se od Južnog i Severnog ostrva i manjih ostrva"
14552,skup jednačina dve ili više promenljivih za koje postoje vrednosti koje zadovoljavaju sve jednačine istovremeno
12128,rukom pisan tekst koji liči na štampani tekst???
9397,"zamenica (kao 'koji' ili 'čiji') kojom se odnosna rečenica uvodi u imeničku sintagmu, pri čemu upućuje na centar te sintagme"
2180,osoba koja duguje pokornost toj naciji
184,Koji narušava principe dobra i zla.
5373,stanovnik Irske ili poreklom iz Irske
5276,Broj elemenata u matematičkom skupu; određuje veličinu ali ne i redosled.
8711,Deo organa najbliži njegovoj tački ležišta (biologija).
7207,"u grčkoj mitologiji gorska nimfa, personifikacija odjeka"
261,ispoljavanje rastuženosti
2679,podesiti razmake između reči
16616,neke  strukture tela koje podsećaju  na konopac
15371,izlaz računara u štampanom obliku
4357,beli galeb sa crnim leđima i krilima
3967,Palica koja se koristi za igranje kriketa.
11554,"u elektronici, projektovanje sistema koje duplira komponente da bi se obezbedile alternative u slučaju otkaza neke od njih"
4997,Napraviti kopiju s namerom da se neko prevari.
16875,zagovornik principa monarhije
4322,"Smeđesivi miš, rasprostranjen po celom svetu; kućna napast."
1442,kružna ili prstenasta struktura
8451,Par paralelnih šina po kijima se kreće vozilo na točkovima.
18822,biti deo čega
11068,Lekar koji je stručna za bolesti digestivnog trakta.
10622,suvo lagano crveno vino vočnog ukusa koje se pije nekoliko meseci pošto je napravljeno; iz francuske oblasti Beaujolais
11409,šerpa sa knveksnim dnom za pripremanje kineske hrane
8356,Koji ima neravnomernu boju.
5640,novčana jedinica koja je deo (obično stoti) osnovne novčane jedinice
17665,rod bakterija
14,Zabava koja drži pažnju.
5864,Vladajuća grupa kraljevine.
5717,Britanski državnik i lider za vreme Drugog svetskog rata; dobio Nobelovu nagradu za literaturu 1953. godine (1874-1965).
3104,"Takmičiti se u trci, kao u atletici"
10356,algonkinski jezik kojim govore narodi Nantikok i Konoj
405,Paun Indije i Cejlona.
6177,metar koji u taksiju registruje cenu (na osnovu dužine vožnje)
6372,stanje duboke obuzetosti
6404,Merni instrument koji se sastoji od staklene tube sa podeocima koja služi za merenje ili prenos precizne kolčine tećnosti tako što se tečnost usisava u cev.
2279,kapljica čistog solnog i slanog rastvora iz lakrimalnih žlezda
13771,štampač koji predtavlja izlazni uređaj račnara; koji odjednom štampa ceo red znakova
3061,Industrijski pogon koji se sastoji od zgrada sa sredstvima za proizvodnju.
12157,Kontejner u obliku kutije kao deo nameštaja; napravljen tako da klizi unutra i napolje.
13452,"Velika ptica teškog tela, može brz da leti; smešta se među ptice gacalice, ali nastanjuje i travnate stepe."
2099,Tamno ulje koje se sastoji od hidrokarbonata.
1663,Familija koja se sastoji samo od orda Trapa; u nekim se klasifikacijama smatra podfamilijom familije Onagraceae.
472,"tanke goveđe trake (ili pileće ili svinjske) kuvane kratko na stolu zajedno sa lukom, zelenišem i soja sosom"
1682,Jedan od telesnih oirgana za kontrakciju.
19429,ćelija koja je deo malignog tumora
13288,Popraviti ili snabdeti zakrpom.
1208,geološki rased u kome je gornja strana naizgled potisnuta nagore kompresijom
6291,Napitak koji se spravlja potapanjem čajnih listova u vodu.
18698,grana biologije koja proučava životinje
154,koji je sklon ljubavi ili ispoljavanju ljubavi
15225,trop koji podrazumeva neslaganje onoga što se očekuje i što se dešava
17814,"Rod jednogodišnjih, dvogodišnjih ili višegodišnjih biljaka sa ?racemose cvetovima; mnoge se smatraju korovom."
12588,grana biologije koja se bavi strukturom životinja i biljaka
1130,redak tvrd žutozeleni mineral koji se sastoji od berilijum aluminata u kristalnom obliku; koristi se kao dragulj
1173,Imati proslavu.
15500,kolekcija i izučavanje poštanskih maraka
14544,Tanka i veoma izdužena supstanca.
17165,koji se tiče ili koji pripada sadašnjem vremenu
258,meteorologija ukupnog opsega atmosfere - posebno gornjeg sloja
5846,Vremenski period u toku koga se u školi drže časovi.
5414,koji izražava posedovanje
3528,Stanje povezanosti u memoriji ili mašti.
16583,Životni princip ili pokretačka snaga unutar živih stvari.
126,točak koji se okreće direktnim delovanjem vode - jednostavna turbina
13296,Kupusar iz starog sveta.
18175,Prostor u kome je obezbeđen život ljudima.
13338,"Upotrebljava se za začinjavanje peciva, keksa i kolača o za spravljanje alkoholonih pića."
3577,unija država koja promoviše slobodnu trgovinu i zajedničke carinske tarife za zemlje koje nisu članice
217,uzrokovati probadanje
11868,Prestonica i najveći grad Bugarske smešten u zapadnoj Bugarskoj.
7424,bivša osnovna novčana jedinica Austrije
7900,Smanjiti po opsegu zadržavajući suštinske elemente.
1573,"Neki od raznih vrsta listopadnog drveta, sivkasto-zelenkaste kore, belog drveta, s lišćem nalik peru; upotrebljava se u obrtu, zanatstvu, industriji."
2215,Tipski rod porodice Notoryctidae: čini ga samo torbarska krtica.
16174,red u podklasi Telosporidia
10350,Bojne gljive iz razdela Eumycota.
1132,koji upućuje na sebe
6135,ostrvska država u Atlantskom okeanu blizu obala Senegala
14855,koji se odnosi na filozofsku doktrinu mehanicizma
12273,koji je uvezen iz koje druge oblasti i koji istrajava i bez kultivacije
13174,autokratija u kojoj vlada monarh koji nasleđuje vlast
16169,Najstariji poznati gmizavci&amp;gt; kornjače i izumrle vrste.
11440,Čin borbe; bilo kakvo nadmetanje ili sukob.
2227,test dat bez prethodnog upozorenja
9614,vrsta morske ribe koja ispušta karateristične zvuke
15038,mali ručni alat sa ručkom i ravnim metalnim nožem ; koji se koriste za zagrabljanje ili širenje maltera ili sličnih materijala
15427,koji se odnosi na naučnu antropologiju
5452,"Jugoslovenski državnik koji je vodio organizovao otpor protiv nemačke okupacije u II svetskom ratu, a posle rata bio predsednik komunističke države (1892-1980)."
1746,država na zapadu SAD-a na Tihom okeanu; trća po veličini država u SAD-u u kojoj su zemljotresi česti
12403,staviti nešto natrag na mesto kojem pripada
4381,u anatomiji svaka struktura koja ima oblik roga
2905,Zadnji deo cipele ili čizme kojim se dodiruje tlo.
7535,produžiti rok da se šta plati
354,Eterična zapaljiva smeša hidrokarbona (heksana i heptana i oktana itd.) dobijena od petroleja; koristi se uglavnom kao gorivo za motore sa unutrašnjim sagorevanjem.
7496,"Uhvatiti, odgristi ili otrgnuti pomoću zuba ili kao zubima."
5804,Ptica is strog sveta; poznate kao pevačice.
5943,Učiniti labavim ili labavijim.
3302,stanovnik Nigerije ili poreklom iz Nigerije
8118,"Ponašati se osiono, raditi naglo, bez dozvole."
929,Neka od mnogih vrsta lasti sa pomalo razrezanim repom i dugim šiljastim krilima; obično se sele u vreme Martinja.
4514,biti student; pratiti studije; biti upisan na kakav fakultet radi studija
18308,"odstupanje od normalnog ili uobičajenog poretka, oblika ili pravila"
18635,Tipski rod porodice Plantaginaceae; veliki rasporostranjeni rod uglavnom niskih zeljastih biljaka.
18306,poliedar sa poligonom u osnovi i trougaonim stranama sa zajedniÄkim vrhom
16136,Velika evropska topola.
4783,imati dva supružnika u isto vreme
15883,supa koja je tog dana na meniju
16137,kućni aparat koji se koristi za pripremu hrane
15078,Politička jedinica koju stvaraju prethodno nezavisni ljudi ili organizacije.
18594,arhipelag dugačak 130 milji severozapadno od Škotske
321,Ukupna vrednost imovine za oporezivanje.
7618,vertikali prolaz koji obezbeđuje put kroz kojim se dim od vatre oslobađa kroz zid ili krov zgrade
8397,Učiniti fizički kontakt sa nečim.
18845,Umetnik koji je privržen ekspresionizmu.
1010,tai jezik budista koji žive u dolini reke Mekong u Tajlandu i Laosu
18967,Losos i pastrmka.
2871,Suprug nečijeg roditelja u sledećem braku.
12424,Koji se odnosi na milenijum ili na period od 1000 godina.
3787,čin stavljanja nečega u pisani oblik
13828,Vod koji poseća na most ali prenosi vodu preko ravnice.
14954,postaviti monarha na presto
5277,Organska pojava truljenja.
14838,lingvistički proces transpozicije zvukova ili slogova unutar jedne ili više reči unutar rečenice
17823,Ribe koje dišu škrgama i ribljim mehurom.
13183,Drugo ime koje se u nekim klasifikacijama koristi za porodicu Mimosaceae.
10757,(filozofija) doktrina prema kojoj je život vitalni princip koji se razlikuje od fizike i hemije
9028,Ples kao deo društvenog okupljanja.
874,(Grčka mitologija) Titan kog je Zevs prisilio da nosi nebo na ramenima
2378,Piti velike količine alkoholnih pića; biti alkoholičar.
5571,Uređaj koji ubacuje svež vazduh i izbacuje prljavi.
3471,naučnik koji proučava rast i gustinu populacije i njihovu vitalnu statistiku
10580,Deo tankog creva između želuca i jejunuma.
8568,Bilo koja penjačica iz porodice Cucurbitaceae koja rađa plod sa debelom korom.
2545,uska prevlaka između Korintskog zaliva i Saronskog zaliva; kanal preseva prevlaku tako da je moguća plovidba izmeđe dva zaliva
2082,Govorni čin kojim se nešto traži.
5022,Svojstvo zvuka.
18155,akumulirana zemlja i kamenje koje donose glečeri
2289,trvdro aromatično drvo od drveta kedra;posebno se koristi drvo crvene boje za nameštaj
9922,deo mreže koja povezuje druge mreže
7443,posed čije vlasništvo se promeni ili istekne
278,"koji ne traži, ne iziskuje specijalne nutricione potrebe"
5121,delovi perifernog nervnog sistema koji polaze od odgovarajućih jedara u moždanom stablu; čovek ima 12 parova takvih nerava
17215,politička teorija koja se zalaže za autoritarno hijerarhijsko vladanje (suprotno od demokratije)
3191,"isečen jastog pomešan sa Mornej sosom, vraćen u ljušturu, prekriven rendanim sirom i zapečen"
2380,Učiniti predlog; objaviti plan za nešto.
3370,mali list papira
2177,električni uređaj koji generiše digitalnu reprezentaciju slike koja je ulazni podatak za računar
743,računarski program koji prevodi instrkcije višeg programskog jezika u mašinski jezik
11017,"bog vina, plodnosti i drame; grčko ime za rimskog boga Bahusa"
370,dijagram koji pokazuje veze između komponenata sistema (posebno eletronskih sistema)
11987,orglica koja nastaje kada se mali prstenovi navežu jedna na drugu
10167,Bilo koje prebivalište prastanovnika Amerike.
73,koji izaziva osećanje užasa
6168,Otkopčati dugmad na nečemu
13412,Divlja kratkorepa planinska ovca sa Korizke i Sardinije.
6876,Stanje u kme je nešto prisutno.
10799,Koji se odnosi na aktivnost ili posao za koji je neko obučen.
6625,Rod iz familije Engraulidae.
9189,paket više stvari poveznaih zajedno radi nošenja ili skladištenja
11652,meso mlade domaće ovce koje se koristi u ishrani
13,Koga se tič principi dobra i zla; koji se uklapa u standarde ponašanja i karaktera koji su zasnovani na ovim principima.
8040,Beskičmenjak koji ima meko nesegmentirano telo koje je obično zatvoreno u oklop.
16188,Specifikovana mera za količinu.
10060,"Način na koji se nešto izražava (u jezici, umetnosti ili muzici) a što ej karakteristično za određenu osobu, grupu ljudi ili period."
1779,gramatički odnos koji stvara prelazan glagol
2881,ponavljati (npr. melodiju)
12800,"Rogati preživar koji podseća na vola; npr, azijski bivo."
7826,Lekar koji je specijalista za fiziologiju i patologiju kože.
6003,Porodica lišajeva.
8312,Rupa u zemlji načinjena kopanjem.
15473,stanovnik Grčke ili poreklom iz Grčke
12783,traka prevučena lepkom
914,Preslica; poklapa se sa porodicom Equisetaceae.
5873,koji zajednici pripada ili u kome zajednica učestvuje; javni
12562,pohađati religijske službe
12390,Jednostavna mašina za podizanje predmeta; sastoji se od ravne površine koja pravi kosi ugao sa horizontalom.
6830,Medvedi i izumrle srodne vrste.
18866,"Drvo iz roda Catalpa s velikim srcastim listovima na dugim peteljkama, s belim zvonolikim cvetovima i s uskim tobolčastim plodovima u obliku cigare."
3205,Bela hranljiva tečnost koju proizvode sisari a koja se koristi u ishrani ljudi.
12491,Brašno koje se dobija od pšenice.
1,stanje opuštenosti i neosećanja bola
5712,računovodstvo koje procenjuje i kontroliše inventar
7603,Prostorija opremljena mogućnostima za pranje ruku i vršenje nužde
17492,vlada lokalne oblasti
6644,"blood found in the veins; ""except in the pulmonary vein venous blood is rich in carbon dioxide and poor in oxygen"""
7709,Čin moljenja za božansku zaštitu
10009,postaviti pitanje nekome i očekivati odgovor
1831,rat između Severne i Južne Koreje; Južnu Koreju su podržavale SAD i druge članice UN; 1950-1953
15770,Blizak prijatelj koji učestvuje sa drugarima u njihovim aktivnostima.
19258,o bakteriofazima ili koji se odnosi na bakteriofage
9291,koktel koji se pravi od vodke i soka od pomorandže
1008,čin vraćanja aktivnosti i značaja nečemu
8712,Kognitivni proces razmišljanja o onome što ćete raditi kada se nešto dogodi.
2865,"velika šuplja drvena figura konja u kojoj su bili sakriveni grčki vojnici, koju su Grci ostavili ispred Troje u Trojanskom ratu"
7672,fazan živih boja sa krestom koji živi u zapadnoj i centralnoj Aziji
17025,peskarica
6574,Skrivenosemenjača koja na klici ima samo jednu supku.
2263,izazivač Lajmske bolesti; prenosi ga prvenstveno krpelj iz roda Ixodes
412,čin nastanjivanja na nekom mestu (iznajmljivanjem ili drugačije0
11754,koji se odnosi na anjone
379,Otvor ili rupa koja vodi u telesnu šupljinu.
14503,osnovna novčana jedinica Gvineje Bisao
8234,u grčkoj mitologiji reke koja teče kroz Had preko koje je Heron prevozio duše umrlih
17628,kuhinjski aparat koji služi za pečenje ili grilovanje hrane
5037,Dikotiledonske vodene biljke.
2398,U nekim klasifikacijama smatra se podporodicom porodice Loranthaceae.
11382,"država u polinezijskom arhipelagu u južnom Pacifiku, stekla nezavisnost 1970"
3626,"pretvoriti u ugalj, spaljivanjem"
3785,Francuski kompozitor impresionista (1875-1937).
8070,stanovnik Kipra ili poreklom sa Kipra
6693,konačni detaljan rukopis za pravljenje filma ili TV programa
17776,razraditi razvijanjem muzičke ideje i razrađivanjem ritmičkih i harmonijskih promena u temi
11715,Novac napravljen od zlata.
15995,Osušeno i preparirano na dimu od drva (obično se koristi za meso i ribu).
2527,jesetra
7145,Leptiri čije gusenice predu čahure pomoću žlezda u usnoj duplji.
15092,zadnji deo tela kičmenjaka ili gornja odnosno  spoljašnja površina organa.
18911,Lekar specijalista u medicinskoj dijagnostici.
9730,čovek čija je visina ispod proseka
4787,"Očev ili majčin brat, tetkin muž."
13426,osobina onoga što je povezano ili stepen nečega što je povezano
15580,država na Skandinavijskom poluostrvu
5489,Rod trava ili žbunja penjačica ili puzačica:ladolež.
292,kantonsko jelo od piletine i proprženog povrća
14122,koji se tiče ostrva ili države Mauricijusa i njenih ljudi
11255,koristi se kao eksploziv i za veštačka đubriva
153,Koji ne postoji u stvarnosti.
15574,"Bogat kolač, obično pokriven kremom, voćem ili orasima; poreklom iz Austrije."
12367,Obuća obično sa drvenim đonom.
17277,osnovna novyana jedinica mnogih zemalja; 1 franak je jednak 100 santima
10223,stanovnik Gvineje ili poreklom iz Gvineje
3294,rat vođen između Meksika i Amerike oko Teksasa (1846-1848)
9398,osoba kojoj nedostaje tehnička obuka
5532,kaša napravljena od istanjenog ovsa
17788,svirati kakav duvački instrument
5535,kongenitalna tendencija ka nekontrolisanom krvarenju; obično se ispoljava kod muškaraca i prenosi se sa majke na sina
2091,Tvrdokrilci iz rod Calosoma.
19217,Provodni kanal ili cev prekriven epitelnim ćelijama koji prenosi izlučevine i druge supstance.
716,Jedna od dve vrste (tipova) ćelija (eritrociti i leukociti) a ponekad obuhvata i krvne pločice (trombociti).
206,Sastavljati od komponenata ili delova.
590,Telo luxdi koji se bave nekom učenom profesijom.
86,veoma odbojan
4877,prednji deo kopita
9607,(filozofija) doktrina da znanje proizlazi iz iskustva
2101,nešto što se govori
6091,Vrteti se ili uzrokovati da se nešto vrti.
8380,Relacija po kojoj se određuje bilo koji položaj u odnosu na bilo koji drugi.
13342,biti znak ili indikacija čega
13324,Dvogodišnja ili višegodišnja trava severne hemisfere; ima?
2564,Događaj svršetka nečega.
11288,koji se odnosi na jezik koji nastaje iz kontakta druga dva jezika i nosi obeležja oba ta jezika
12043,Medijum koji širi štampane stvari.
5662,Mašina koja štampa.
4367,Proći pored nekog vozila većom brzinom u istom smeru.
7202,gornji dom kongresa Sjedinjenih Država
18117,"Duvački instrument sličan orguljama, proizvodi tonove pomoću mehova koje svirač stavlja u pokret nogama ili mehanički; umesto orguljskiih cevi ima metalne jezičke."
13817,SV - na pacifičkoj obali
4447,dijalekat jezika degiha kojim govori narod Omaha
10082,upotreba ideograma u pisanju
6707,službeni poziv za inspekciju ili nadzor
4093,nešto što pokriva gornju ili donju polovinu stranice
9255,Ispoljiti odgovor ili reakciju na nešto.
16646,Deo tela koji se spolja vidi.
11780,Pravi se tako što se punjenje uvije u deo testa.
694,"reka u jugozapadnoj Aziji, uliva se u Persijski zaliv"
6304,luka u kojoj su smešteni carinici da bi nadgledali ulaz i izlaz putnika i robe
552,koji se tiče ili koji pripada žlezdama sa unutrašnjim lučenjem
4396,izračunati promet dugovne i potražne strane računa
17233,osnovna novčana jedinica Meksika
4018,kamenjari
12485,"država na severoistočnoj obali Centralne Amerike, na Karipskom more, bivša britanska kolonija"
6820,Bilo šta sa okruglim ili ovalnim oblikom (koji čini konopac ili gajtan itd.) što je zatvoreno ili gotovo zatvoreno.
2141,"mineral koji se sastoji od litijum-aluminijumovog silikata, izvor litijuma"
2749,jedinica za zapreminu u metričkom sistemu
3987,koji se odnosi na megnetizam proizveden električnom strujom
6738,Velikog intenziteta ili snage.
13393,"gazirano, bezalkoholno piće sa ukusom đumbira"
4660,skup protokola (uključujući TCP) za prenos podataka sa jednog mrežnog uređaja na drugi razvijen za internet u 1970-im 
15498,male biljne vaši mekog tela
7829,rekreativni objekat koji uključuje bazen za vodene sportove
17675,veliki crveni paradajz čvrstog mesnatog sadržaja
9934,Ministar u vladi koji je zadužen za odnse sa spoljnim svetom.
12860,radno mesto za pranje i peglanje odeće
15214,Koji traje tri sezone ili više.
13270,Privremeno zadržavanje podataka u procesoru dok se nad njima obavljaju računske ili logičke operacije (računarstvo).
17627,Tipski rod porodice Sciaenidae: grb.
6277,u grčkoj mitlogiji titanka koja je bila boginja pravde
8562,iskreno moliti ili tražiti nešto
15180,Granična linija koju pravi ograda.
175,Veliko bogatstvo.
16852,Veliki rod ukrasnik biljaka cvetnica; uključujeneke biljke koje se često smeštaju u rod Coleus.
6718,Iznos za koji prihod nekog poslovanja premašuje troškove izrade.
2041,mlečni prtein koji se koristi za izradu plastični masa
8137,Kako dugo nešto postoji.
6290,Uzdizanje osobe do statusa Boga.
19336,Voćna štangla koja sadrži džem od kajsija.
17065,konverzija analognih informacija u digitalne
16584,Arktički jelen sa velikim rogovima kod oba pola.
6696,Morževi i izumrle vrste.
6857,početni deo organa za disanje
16624,"Sedeti i putovati na leđima životinje, obično kontrolišući njene pokrete."
18099,osnovna novčana jedinica Irana
9011,Evropski kos iz stenovitih područja; mužjak ima crno perje sa belom trakom oko vrata.
6780,pričvrščivaač za zatvaranje vrata ili prozora
8404,Dugačak plod nalik na mahunu; seme se koristi kao začin.
6392,žlezda u kuži koja izlučuje znoj
14294,šećer koji se proizvodi od šećerne trske i služi kao zaslađivač
18746,(najčešće u pluralu) donji veš koji nose žene
6525,"kontrolisati funkciju, proces ili stvaranje pomoću računara"
8313,Dan računat od ponoći do ponoći.
15840,Slatkovodna riba sa izduženim čeljustima; peca se kao izvor hrane.
10472,karakteristično funkcionisanje nečega
11919,Ravna površina sa obe strane čela.
11640,novčana jedinica Kuvajta
18551,Pas koji je treniran da ide s lovcima koji love divljač poškama.
8903,ukrasiti bojama
11071,Stopalo kičmenjaka koji nije ljudsko biće.
6528,u grčkoj mitologiji pohlepni frigijski kralj kome je Dionis dao moć da sve što dodirne pretvori u zlato
11163,glavni grad Sirije
9921,Prodavati nešto ilegalno.
9796,stanovnik Perua ili poreklom iz Perua
19196,ime koje je se privremeno koristi
13934,svinjski obor
12632,jedinica za merenje atmosferskog pritiska
1065,"okluzivni konstant artikulisan oslobađanjem pritiska na glotisu, kao pri iznenadnom početku vokala"
6549,francuski pisac koji je oličenje prosvetiteljstva XVIII veka (1694-1778)
674,"Mala okrugla buba, jarkih boja sa tačkicama koja se obično hrani lisnim vašima i drugim napastima."
3469,alatka koja se koristi za rezanje ili sečenje
2230,seckano meso jastoga u mleku ili pavlaci
1732,"Razmenjivati misli, pričati sa nekim."
1393,čitanje površno ili nasumično
5093,Koji pripada ili se odnosi na naciju ili državu
18892,Ustavna monarhija koja zauzima Japanski arhipelag; svetski lider u elektronskoj i automobilskoj proizvodnji i brodogradnji.
19198,"glavni grad Malija, na reci Niger"
12001,Velika rasprostranjena porodica uglavnom višegodišnjih biljaka i penjačica: prstac; gaje se kao ukrasne biljke.
9059,Prostor za kretanje.
6758,Radnja promene nečega.
13981,the terminal section of the alimentary canal; from the sigmoid flexure to the anus
17714,Veliki tropski pausci:tarantule.
5069,kvadratna matrica čija determinanta nije nula
19270,Grupa brodova sličnog tipa.
11785,"parče govedine, najčešće ispečeno"
19309,u anatomiji brazda ili kanal na telesnoj  strukturi ili delu tela.
10715,osoba nemačke nacionalnosti
17082,Široko rasprostranjeno zimzeleno žbunje i drveće.
14702,supa od piletine
19426,obred ili niz obreda propisanih za javno veroispovedanje
5427,beli čovek pripadnik kavkaske rase
10370,"tanka,, prozračna hartija koja obično služi za brisanje"
11563,pirinač sa sirovom ribom umotan u morsku travu
16840,"jestivo meso mekušaca koji imaju lepezastu ljusku; služe se kuvane, poširane, u salati ili u krem sosu"
7348,Krajnji spoljašnji ili najudaljeniji region ili tačka.
11417,sessile marine coelenterates including solitary and colonial polyps; the medusoid phase is entirely suppressed
7408,alkoholno piće koje se pravi od aromatičnog korenja kava grma
18376,bilo koji činjenični nalaz koji pomaže da se ustanovi istinitost nečega
4742,bilo koje jedinjenje rastopivo u vodi koje može da postane lakmus plavo i koje raeguje na kiselinu i stvara so i vodu
