,Sysnet
16196,sport nastao u Japanu iz džiu-džice
142,Familija pustinjskog žbunja i drveća - uglavnom? i?
10274,koji odstupa od opšteg ili uobičajenog poretka ili vrste
5892,Republika u severnoj Evropi; stekla nezavisnost od Rusije 1917. godine.
10139,Lanac istih restorana.
16825,onaj koji je u stanju sna
5128,žitarice koje se služe vruće
12235,"postoje indicije da kod nekih pojedinaca postoji intolerancija na natrijum-glutamat što kod njih može da izazove osećaj obamrlosti u potiljku, leđima i rukama, lupanje srca, glavobolju i osećaj slabosti u roku od dva sata nakon konzumiranja hrane koja ga sadrži"
2939,nezreo leukocit koji se obično nalazi u koštanoj srži
6194,ukrašavanjem umetanjem skupocenijeg i plementijeg materijala u jednostavniju podlogu
5487,Objekat koji služi u vojne svrhe.
3603,Federacija u severoistočnoj Evropi i severnoj Aziji; ranije Sovjetska Rusija; od 1991. godine nezavisna država.
17193,protozoa sa mikroskopskim izraštajima koji se šire od površine ćelije
7080,morske zmije
12296,indeks svih reči iz knjige ili više knjiga datih u kontekstu
14545,bitka iz Drugog svetskog rata; decembra 1944. fon Rundštet je pokrenuo snažnu kontraofanzivu u šumama Ardena i iznenadio saveznike
3166,Neka od mnogih trava iz roda Thalictrum; imaju čipkasto lišće i oblake malih purpurnih ili žutih cvetova.
5755,Društvena pripitomljena pčela koja proizvodi med.
16044,"Slika neživih predmeta, na primer voća i cveća."
7273,Čiji je životni ciklus ne traje duže od jedne godine.
3829,problemski orijentisan jezik koji se koristi za opisivanje zahteva koje posao postavlja operativnom sistemu
8173,želatin napravljen od piletine
178,Dati oblik ili formu nečemu.
140,"Nezgoda, posebno ona koja prouzrokuje povredu ili smrt."
7678,"zaobljena posuda otvorena na vrhu, obično služi da serviranje hrane i voća."
16576,o eozinofilu ili koji se odnosi na eozinofil
3639,"klasa sastavljena od osoba bez plemenitog, viteškog ili aristokratskog ranga"
459,koristiti računarski program za prevođenje izvornog koda napisanog na određenom programskom jeziku u računarski čitljiv mašinski kod koji se može izvršiti
11619,Specifikovana mera za količinu.
3437,Papir koji je osetljiv na svetlo na kome se mogu praviti fotografije
16808,Mesec koji dolazi posle oktobra a pre decembra u kalendaru.
1154,rat između Kine i Japana (1894. i 1895) za kontrolu nad Korejskim poluostrvom; Kina je potpuno poražena kod Port Artura
10163,izražavanje (govorom ili pismom) vaših uverenja ili mišljenja.
17007,obično plastična kartica koja omogućava vlasniku da povuče novac s računa ili da plati robu koj će direknto biti plaćena s njegovog računa
17099,aritmetička sredina apsolutnih vrednosti devijacija od sredine distribucije
16648,električni uređaj koji konvertuje jedan oblik energije u drugi
16837,Period od 12 lunarnih meseci.
8004,"Povrće, posebno krastavčići, konzervisani sirćetom ili rasolom."
10386,morski pauci
15159,osnovna novčana jedinica Indonezije
5832,čadski jezik kojim se govori južno od jezera Čad
1025,"mekušac koji je u vezi sa hobotnicom i sipom, ima, kao i hobotnica, deset pipaka; meso je tvrdo i belo; u mnogim mediteranskim jezicima koristi se italijanski termin ""calamari"""
3540,"plod iz loze zimskih dinja, zelena dinja sa bledo-zelenim do narandžastim mesom koja dugo ostaje sveža"
12026,Cikorija
16221,Konzervisano ili kandirano voće.
15245,Veliki pas sa glatkim belim krznom sa crnim ili smeđim pegama; poreklom iz Dalmacije.
4818,"hartija koja upija višak tečnosti, na primer mastilo"
3424,Ruska imperatorska loza koja je vladala od 1613 do 1917. godine.
9959,Republika u zapadnoj Evropi; najveća zemlja u celosti u Evropi.
16102,novčana jedinica Sirije
10602,Komercijalno ili industrijsko preduzeće i ljudi koji ga čine.
4427,Jedinica koja ima administrativne odgovornosti.
13385,Rukovodilac u poslovnom preduzeću.
254,Osećanja proživljena kada je neko u zadovoljnom stanju.
2390,anđela uzeti svi zajedno
605,"Zeljasta biljka i umerenih severnih područja iz roda Sedum; ima mesnato lišće i revene, žute ili bele cvetove."
3093,Biti zadužen za nešto ili imati posla sa nečim.
11523,Instrument koji zvuči pomoću jezičaka od trske.
14295,serija pesama koje povezuje ista tema
1975,"Vrlo otrovan alkaloid koji se vadi iz velebilja i drugih biljaka, širi zenicu i koči lučenje žlezda."
15433,toplo ili hladno mešano alkoholno piće sa umućenim jajima
4779,Skakavac sa kratkim antenama.
6792,"znaci koji služe da pojasne značenje tako što razdvajaju niz reči na rečenice, klauze i fraze"
16926,Broj ili niska brojeva koja se koristi za identifikaciju.
5079,neko ko je član zakonodavne skupštine
10893,Rasa ljudi svetle kože.
111,bilo koji od brojnih dlakavih insekata uključujući i društvene i osamljene vrste
113,Nesmanjena i nenarušena celovitost ili ukupnost.
8408,Sakupiti zajedno.
6262,obično punjene i pečene
16210,mleveno kuvano meso (ili povrće) u gustom belom sosu; uvaljano u prezle i prženo u dubokom ulju
16977,prvi deo ili odeljak čega
14491,izvorni jezik koji se sastoji od proceduralnih operatora koji pozivaju funkcije koje treba da se izvrše
10631,stavljanje nečega (kao književno delo ili zakonodavni predlog) u prihvatljivu formu
8784,modulacija amplitude (radio) signala nosača
16356,"esej, članak (posebno onaj napisan kao zadatak)"
10992,Ljudi koji obavljaju posebnu vrstu posla.
7740,Bolest koja se prenosi sa čoveka na čoveka.
9371,mleveno povrće i meso umotano u palačinku i prženo
2512,Rečna i morska riba koja ima telo slično zmiji.
10358,glikozid izveden iz glukoze
7694,Bodljivci starog veta
6634,"italijanska poslastica, spravljena od žumanjaca, šećera i slatkog vina, služi se uz keks i voće, obično hladna"
8264,komad mesa sa plećke pogodan za pečenje
13846,savezna vlada Sjedinjenih Država
1817,glavanska abterija koja skladišti električnu energiju
6091,minimalna jezička jedinica koja ima sintaksičku (ili morfološku) funkciju
1049,"Mašina za sečenje, oblikovanje ili završnu obradu metala ili drugih materijala."
49,promena u niže stanje (manje poštovano)
5615,koji pripada srednjoj klasi
10171,komad pribora za jelo koji ima dršku i zaokrugljen deo kojim se uzima tečna hrana
15057,sudski nalog kojim se nalaže administrativnom činovniku (šerifu) da pozove porotnike (članove porote)
7144,Praviti nabore na glatkoj povtšini.
4248,Patuljasta mediteranska jednogodišnja biljka koja se odavno gaji zbog aromatičnog semena.
17197,Noćna ptica trkačica sa Novog Zelanda koja ima dugi vrat u jake noge; jedini preživeli predstavnik reda Apterygiformes.
6347,zadatak koji se sastoji u tome da se nešto napiše
3751,"Postati veći, širi, napredniji."
2259,u grčkoj mitologiji zmija sa glavom zmaja; ubio ju je Apolon u Delfiju
5841,"veliko, slatko, mesnato, tropsko voće sa korom sastavljenom od čvrstih listova; široko rasprostranjeno"
14454,pripremljena hrana za poneti
6608,Republika u istočnom delu Balkanskog poluostrva u jugoistočnoj Evropi.
8,"Umanjiti po vrednosti, karakteru itd."
5960,meni opcija koji se pojavljuje ispod stavke kada korisnik na nju klikne
15013,stanovnik Kostarike ili poreklom iz nje
10190,"o tekstu, koji je u vezi sa tekstom ili koji je zasnovan na tekstu"
393,osoba koja u kockarnicama rukovodi hazardnim igrama
2114,pokazivač koji se sastoji od instrumenta za merenje količine padavina
16461,Morska riba koja živi na dnu u toplim vodama; ima na bradi dva ?barbels.
5282,"koji se tiče Ekvadora, njegovih ljudi i kulture"
2083,"Meki beli vredan univalentan metal; ima najveću električnu i toplotnu provodivost od svih metala; javlja se u argentitu i slobodan; koristi se za izradu novca, nakita, pribora za jelo, fotografija."
12908,staklasti mineral koji se sastoji od natrijum aluminijum silikata i natrijum hlorida u kristalnom obliku; javlja se u mamgmatskim stenama
7472,glava ljudskog bića
8381,novčana jedinica Jordana
2789,Micati neki pribor uz stalne kružne pokrete.
267,"""slaviti vrline svoje dece"""
12490,Glavni javni predstavnik neke zemlje koji može da bude i šef vlade.
840,Pribor napravljen od keramičkog materijala.
1014,Grupa mačaka.
12251,"znak interpunkcije (,) koji služi za razdvajanje rečeničnih delova"
9314,"salata koja se sastoji od paradajza i inćuna, garnirana maslinama i kaparom"
2535,(genetika) jedan od dva pravila nasleđivanja koje je formulisao Gregor Mendel na osnovu svojih eksperimenta na biljkama; principi su bili ograniceni i modifikovani kasnijim genetičkim istrazivanjem
10811,"Jako tanko parče tkiva, minerala ili neke druge supstamce koje se ispituje pod mikroskopom."
2873,Glavna podela geološkog vremena; era se obično deli na dva ili više perioda.
4073,termin za jabukovač (cider) koji se koristi u SAD i nekim delovima Kanade
11796,Ravno ploveće sredstvo (obično napravljeno od trupaca ili dasaka) koje se može koristiti za transport ili kao platforma za plivače.
199,"Na primer, o vukanima; koji trajno nije aktivan."
15891,Komercijalna organizacija koja radi kao javni prevoznik.
2273,odbijanje grupe ljudi da poštuje zakon jer smatra da je zakon nemoralan (npr. u znak protesta protiv diskriminacije)
13238,počistiti metlom ili kao metlom
14877,Određena tačka u vremenu.
16027,novčana jedinica Zapadne Samoe
3572,stanovnik Burundija ili poreklom iz Burundija
4736,Začin koji se pravi od osušenog mesnatog dela kapsule muskatnog oraha.
2964,mala tanka kobasica
3735,zeleni mineral amfibolne grupe; kalcijum magnezijum fero silikat
1336,planinski lanac u australiji koji čini južni deo Velikih razvodnih planina
3174,zgrada (ili deo zgrade) za smeštanje automobila
3142,deo odevnog predmeta koji je prikačen za otvor za ruku i pokriva je
7689,mrežna topologija čije su komponente povezane u petlju
16299,Česta evropska korovska biljka.
7404,mala marrow slična krastavcu; obično je tamno zelena
2620,neko ko daje savete o problemima
10810,"rod koji se odnosi najpre na mlada bića, kao i na objekte koji nisu svrstani ni u kategoriju muškog ni u kategoriju ženskog roda"
13159,deo Severnog ledenog okeana između Labradora i južnog Grenlanda
12776,istureni deo kape zahvaljujući kome su oči u senci
11601,Tipski rod porodice Physeteridae.
14051,zamišljena kružna linija na površini Zemlje koja spaja sevrni i južni pol sekući ekvator pod pravim uglom
15569,"nastaviti postojati na nekom mestu, položaju ili situaciji"
1854,govedina marinirana ili kiseljena u salamuri
15850,"pileći složenac koji se sprema sa krompirima, pečurkama i biljem na italijanski način"
16546,Čin izgradnje akumulacije.
16054,grafikon eksponencijalne funkcije
3363,"kva jezik kojim govori narod Eve u Gani, Tongu i Beninu"
3970,altajski jezik kojim govore Koreanci
16779,kontraceptivno sredstvo
6828,Neka biljka iz roda Drosera.
13383,suv brendi destilovan u Armanjac okrugu u Francuskoj
17275,Neko ko pravi i prodaje vlasulje.
3430,najvažnija klasa rakova
8224,adrenal-korteks hormon
10558,Neka od evroazijskih biljaka iz roda Helleborus.
10092,"glavni deo drame, baleta ili opere"
12691,u grčkoj mitologiji veliki muzičar; kada je njegova žena Euridika umrla on je otišao u Had da je vrati ali nije uspeo
14158,"sličan američkom jastogu ali manji; pronalazi se u vodama istočnog Atlantskog okeana, Sredozemnog i Crnog mora"
6099,zaliv u Sredozemnom moru na jugozapadu Turske
916,dresirani golub koji prenosi poruke
15984,osnovna SI jedinica za merenje električnu struju
8621,kamarupski jezici kojima se govori u zapadnoj Burmi i Bangladešu i na krajnjem istoku Indije
12348,nauka o zemlji koja se bavi fenomenom atmosfere (posebno vremenskih prilika)
16443,Evropski ris.
10334,bitan rani obrok koji uključuje i čaj
299,Kvalitet onoga što je teško otkriti ili analizirati.
6393,"u grčkoj mitologiji, muški Titan, sin Geje i Urana, Otac Helija, Selene i Eosa"
11573,jelo od pirinča sa morskim plodovima obojeno šafranom
12379,reaktor koji se sastoji od spirale od izolovane žice koja uvodi induktivnost u kolo
15049,Neki posao koji preduzet ili se planira.
2148,"Grmlje, nisko drveće ili drvenasta loza."
13059,odnos broja opažanja u statističkoj kategoriji premaukupnom broju opažanja
2422,Svaki organ koji je uključen u disanje.
5008,reč ili sintagma koja bliže određuje značenje nekog drugog elementa
259,Čin oštećivanja nečega ili nekoga.
6310,novčana jedinica Argentine
9537,bivša osnovna novčana jedinica Irske
2360,Bilo koji organ koji je uključen u seksualnu reprodukciju.
3923,ishod čega urediti putem prevare
7352,ćelija ili jednoćelijski organizam koji poseduje flagelum (bič).
14044,"Rod ptica iz porodice Sylviidae, uključuje maslinicu."
11391,"uređaj koji smanjuje amplitudu elektronskih, mehaničkih, akustičnih ili aerodinamičkih oscilacija"
6065,Rasa čija se pigmentacija kože razlikuje od bele rase (posebno Crnci).
12099,Vrsta male ružne sltakovodne ribe; ima bodlje nalik na rogove.
1582,"Psoglavi majmun iz zapadne Afrike, izgled mu je ružan i odvratam; brada mu je žuta, a obrazni nabori plavi; bxuška i zdnjični žuljevi cu crveni.baboon of west Africa with red and blue muzzle and hindquarters"
11465,"Neki od više sisara koje žive na drveću i sporo se kreću; iz Južne i Centralne Amerike; vise sa grana naopačke, hrane se lišćem i voćem."
7256,vatrenjače
5133,Živac  duž unutrašnje strane ruke i prolazi pored lakta; snabdeva unutrašnje mišiće ruku i kožu medijalne strane ruke.
522,Zimzeleno drveće i žbunje: mangostan.
12037,"reč pozajmljena iz drugog jezika (npr. ""general"" je reč koja je u srpski stigla iz francuskog)"
16008,vrsta granularnih leukocita čija je funkcija ingestija bakterija
15502,objekat koji je recipijent ili benefaktiv radnje glagola
1736,gust sos napravljen od paradajza sa mnogim začinima
6030,bog severnog vetra i severne strane sveta
16428,tipski rod porodice Alcidae koga čini samo njorka
7401,"u grčkoj mitologiji gorska nimfa, personifikacija odjeka"
11101,Gljive sa belim sporama koje uključuju više jestivih i otrovnih vrsta.
12614,karakter koji se koristi da označi neku matematičku relaciju ili operaciju
6182,iznenadna promena vlasti obično uz upotrebu sile
3007,Smeštaj u kome neko živi.
12684,čiji prethodnik biti
7419,ponavljanje iste reči ili obrasca kao retoričke šeme
8259,mirovni sporazum kojim je okončan Tridesetogodišnji rat 1648
521,mekan srebrnkast metal iz grupe retke zemlje bey stabilnog iyotopa; pronađen u radioaktivnom obliku kao fisioni proizvod uranijuma
13110,Igra u kojoj dva tima prebacuju loptu preko visoke mreže udarajući je rukama.
16276,Ružičasto vino koje se pravi od crvenog/crnog grožđa komee kožica uklanja tek pošto je fermentacija počela.
15468,Planeta koja ima kompaktnu stenovitu površinu kao Zemlja; čine ih prve četiri planete Sunčevog sistema.
14985,Bilo šta što uzročno doprinosi rezultatu.
10822,paleontologija mikrofosila
17128,Alge zelene boje; bliske su vaskularnim biljkama; najkompleksnija grupa algi.
4310,radni sati ili dani tokom kalendarske nedelje
17143,dlakava braon voćka u obliku jajeta blago kiselog zelenog mesa
199,Čin okončanja nečijeg zaposlenja.
5901,Deo nameštaja koji je namenjen sedenju.
10571,Zabeležiti pismeno; uneti u registar.
114,Ne pridržavanje moralnim principima.
2489,salata od seckane tunjevine iz konzerve
1440,Mali tropski gušter; živi na drveću; hrani se isključivo insektima; menja boju kože.
17337,Tropsko drvo iz južne Azije čije je drvo tvrdo i jako tamno.
5647,samohodno vozilo koje se kreće po šinama
8242,prenos informacija širokoj publici
1017,"grana fizike koja proučava svojstva materijala u čvrstom stanju: električna provodljivost u kristalima poluprovodnika i metala, superprovodljivost; fotoprovodljivost"
6616,potpuna izborna pobeda
1494,matematička notacija koja koristi 8 različitih karaktera (recimo cifre od 0 do 7)
174,Stanje u kome je neko u savezu.
1209,mesto bogosluženja koje ima svoj oltar
7908,biti u ravnoteži
13667,skup protestantskih grup
2431,"italijanski desert koji se sastoji od slojeva biskvita potpoljenog u  kafu, brendi ili liker, sira maskarpone i čokoladnih mrvica na vrhu"
14683,"Poreklom iz Južne Amerike, gaje se u mnogim oblicima."
11948,obuća za plivanje; prednji deo poput ploče pomaže pri plivanju posebno pod vodom
14654,Jedna informacija izvedena merenjem ili istraživanjem.
437,jedna od 16 belih i 16 crnih figura kojima se igra šah
17151,"u logici, iskaz koji je uvek tačan"
7148,Žestoka bitka koja se vodi prsa u prsa između trupa koje su na određenoj poziciji u zadato vreme i na zadatom mestu.
16492,grupa virusa koja izaziva različite bolesti uključujući meningitis i blaga respiratorna oboljenja i dijareju kod novorođenčadi
4475,dobija se mlevenjem durum brašna i koristi za izradu testenine
6216,Relativna brzina napretka ili promene.
36,koji ima urođenu sklonost prema dobroti
2021,lista u kojoj se je stavka za uklanjanje iz liste uvek ona koja je na vrhu i poslednja umetnuta (LIFO)
12097,punč napravljen od vina klaret i brendija sa sokom od limuna i šećerom i ponekad višnjom ili Kurasaom i svežim voćem
633,"(klasična mitologija) mitsko biće koje je pola čoveka, a pola konja"
14533,obeležiti tačkicama
13703,Neka od grubih korovskih trava sa dugačkim korenom koja u lišću ima kiseline.
548,nekadašnji tribunal Rimske katoličke crkve (1232-1820) stovren da otkrije i spreči heretičko ponašanje
2923,"Ukloniti kiseonik iz nečega, u hemiji."
14435,Senzacija do koje dolazi kada receptori ukusa na jeziku i u ždrelu prenesu informaciju o hemijskom sastavu rastvorljivog stimulusa.
630,Morski puž iz podreda Nudibranchia bez kućice i često sa telom lepe boje.
3223,Udarački instrument koji je sličan ksilofonu samo ima metalne pločice i pločice koje rotiraju i rezonatre koji proizvode vibrirajući zvuk.
15799,salata čija su osnova makarone
1214,Majmuni iz novog sveta: kapucin; douroucouli; howler monkey; saki; spider monkey; squirrel monkey; titi; uakari; woolly monkey; marmoset; tamarin
6199,učestvovati u pobuni; odreći se bivše lojalnosti
8001,Visok šaš iz doline Nila koji daje vlakno koje se kroz istoriju koristilo za razne namene.
6949,verski praznik koji pada u razne dane u različitim godinama
5936,vrlo nestabilan radioaktivni element - najteži od svih halogenih elemenata; produkt raspadanja uranijuma i torijuma
7772,"polaze iz kičmene moždine (ili u nju ulaze) i glavni su nosioci somatskog  nervnog sistema; ima ih 31 par; jedan spinalni živac je funkcionalno uglavnom mešovit, što znači da sadrži aferentna i eferentna vlakna; Motorna (eferentna) vlakna polaze iz prednjeg roga kičmene moždine, aferentna vlakna ulaze ukrštena preko spinalne ganglije u zadnji rog kičmene moždine"
10452,koji se tiče ili se nalazi u Australaziji
3764,Oblikovati metale kalupom.
8353,"crne, morske školjke koje se obično kuvaju u vinu"
10283,infuzija od sušenog ili svežeg cveća ili lišća biljaka; za razliku od čaja biljke stoje dugo u hladnoj vodi
14966,verovanje u vladu koja se koristi božanskim vođstvom
5204,Prestonica i najveći grad Grčke; dobio ime po boginji Atini (zaštitnici).
12403,Velika crna ptica sa pravim kljunom i dugačkim repom.
4525,grana indoevropskih jezika čiji je predstavnik latinski
16493,dati nešto kao garanciju
3008,anatolski jezik
10861,Komitet koji nadgleda.
2180,Neki od raznovrsnih ?decidous žbunova iz roda Ribes koji rađa bobice.
5654,osoba koja hvata ljude ili životinje
13939,zamišljena linija koja povezuje tačke koje imaju istu temperaturu u datom trenutku
4049,javni službenik ovlašćen da odlučuje o pitanjima koja se iznose pred sud
12470,Lenjivac koji ima tri dugačka prsta na svakoj prednjoj nozi.
9168,elektro-inženjer iz SAD-a osnivač teorije informacija (1916-2001)
3573,Gavez.
9125,"Rod više ili manje narednih dvosemenjača, drveća, grmlja ili trava."
12840,fotografija događaja koji zavređuju pažnju medija
13789,tri deteta rođena zajedno iz jedne trudnoće (u srpskom nema naziva za jedno mladunče/dete iz ove trojke)
9274,porodica protocista iz reda Coccidia
11701,Rod familije Tuberaceae: gljive čija su tela tiplično ?truffles
9988,oprema koja se koristi za spasavanje putnika u hitnim slučajevima
13315,Sovjetski pesnik; lider ruskog futurizma (1893-1930).
176,Čičkovac.
8271,pečeno jelo koje se sastoji od slojeva kora za lazanje sa sosom od sira i mesa ili povrća
11336,Jednogodišnja evroazijska biljka sa mekim bodljikavim lišćem i zrakastim žutim glavama cvetova.
8027,Jednogodišnja ili višegodišnja zeljasta biljka sa aromatičnim fino nazubljenim lišćem.
4299,Višegodišnja ili dvogodišnja trava koja se gaji zbog lepog obično plavog cveta.
5745,Evropska višegodišnja zeljasta biljka sa grozdovima belih cvetova.
15299,"Istopiti se, polomiti ili na drugi način postati neupotrebljiv; o sijalicama i osiguračima"
16101,"Biti distingtivno svojstvo, osobina ili crta; ponekad u veoma pozitivnom smislu."
1303,u rimskoj mitologiji kraljica olimpijskih bogova i zaštitnica braka; Jupiterova žena i sestra;; u grčkoj mitologiji joj odgovara Hera
283,Koji je saglasan sa principima i metodama koje se koriste u nauci.
10923,deo južnog Tihog okeana prema Antarktiku
12286,reka u jugozapadnoj Engleskoj
4531,kardinalna tačka kompasa koja je na 180 stepeni
5123,"koji se tiče Kazahstana, njegovih ljudi i Kulture"
14497,ivični alat koji ima dve ukrštene oštrice
11307,Tipski rod porodice Gavialidae.
11930,Spojen ili vezan.
6798,uređaj nalik na praćku koji se koristi u raznim primitivnim društvima za izbacivanje strelica ili kopalja
16175,Testo sa kremastim punjenjem sa ukusom badema.
13616,Životinja koja proizvodi ženske polne ćelije koje mogu da oplode muške polne ćelije.
15597,bantu jezik blizak jeziku zulu
3584,Kancelarija i funkcija predsednika.
16550,Kitovi sa kljunom
16822,Voće sa žutim mesom; slično krem (custard) jabukama
10151,glavni i najveći grad na Kubi
9010,bilo koji agent ili predstavnik federalne agencije ili biroa
12745,Dugački teški morski talas koji ide prema obali.
4133,"pozdravljati na neki propisani način (titulom, imenom)"
5873,tipski rod Procellariidae
13374,"u matematici, greška u računa do koje dolazi zbog skraćivanja numeričkog izračunavanja pre nego što je račun završen"
5411,program koji se koristi za pregled HTML dokumenata
2687,pisano objašnjenje ili osvrt ili ilustracija koja se dodaje knjizi ili drugom pisanom materijalu
8651,Neka od mnogih biljaka iz roda Tagetes koje se gaje zbog njihovog uapdljivog žutog ili narandžastog cveća.
680,Uspostaviti koloniju (za zemlje u razvoju).
6753,"biljka sa razgranatim, nepotpuno razvijenim cvastima uglavnom tamno-zelene boje"
2339,mašina koja pretvara mehaničku energiju u električnu pomoću elektromagnetne indukcije
6419,semantički odnos koji se nalazi između dela i celine
9708,neko ko učestvuje u javnom izražavanju grupnih osećanja
2225,jedanaesti mesec Francuskog republikanskog kalendara (od 19. jula do 17. avgusta)
3541,Zimzeleni žbun sa kožastim lišćem.
16373,utvrđen broj stihova koji formira jedinicu pesme
10675,grana indoiranske jezičke porodice
14722,odašiljač koji isteruje tečnost u vidu finog spreja po pritisku dugmeta
11181,slika osobe ili prizora u štampanom ili providnom obliku; snimljena kamerom na fotoosetljivom materijalu
6043,toalet kakav je nastao u engleskoj
7935,"elektromagnet, npr. n magnetofonu, koji konvertuje električne varijacije u magnetne koje se mogu uskladištiti na neku površinu i kasnije pronaći"
12783,motorna testera sa finim zupcima i uskim sečivom za sečenje zaobljenih oblika
10324,deo osnovne novčane jedinice (obično stoti deo franka) u više zemalja
3049,Neko stvoreno muzičko delo.
10808,"Instrument sa žicama, trougaonog oblika, udexen u Ces-duru; pomoću 7 pedala raspoređenih na dnu instrumenta, skala može da postane hromatska."
15514,"Mali ili minijaturni arahnidi koji često zagađuju životinje, biljke ili hranu."
1981,najveća reka u severnom Sibiru; uliva se u Opski zaliv u Karskom moru
14702,crteži i fotografije u okviru knjige
6033,Brod koji je na raspolaganju državi za vođenje rata.
4281,elektrohemijska ćelija koja generiše elektromotornu snagu pomoću ireverzibilne konverzije hemijske u električnu energiju; ne može da se puni
246,Koji nije potreban.
6426,"vrsta degeneracije jedra ćelije u kojoj u jedru nastaju promene, a hromatin se polako zgusne tako da jedro liči na grudvicu homogenog izgleda"
13372,Neka od mnogobrojnih ptica pevačica sa kratkim i jakim kljunom koji je prilagođen za razbijanje semena.
7300,Mafin koji se pravi od kukuruznog brašna.
4252,Koji se odnosi na psihologiju ili je određen psihologijom.
12510,Čvrsti spoljašnji ugao zgrade; posebno onaj koji nastaje od ugaonog kamena.
10887,dvogodišnji evroazijski beli čupavi čkalj
14989,porodica severnoameričkih indijanskih jezika kojima se govori u jugoistočnom delu SAD
13065,grozničnica
15764,osnovna novčana jedinica Slovačke
2254,"koji se tiče Paname, njenih ljudi i kulture"
6662,glavni grad Zelenortske republike
8141,koji se odnosi na sociolingvistiku
14148,slatka tamno ljubičasta šljiva
4731,muzičar koji sivra klarinet
3215,"dominantni i zvanični jezik Etiopije; semitski jezik na koji je kušitski, sa kojim je narod Amhara bio u bliskom kontaktu, izvršio veliki uticaj"
12654,Hleb koji sadrži fino mleveni crni luk.
12209,proces u reprodukciji i rastu kod koga se ćelija deli i nastaju nove ćelije
14341,zlatan italijanski liker začinjen biljem
13427,roba koja se sastoji od računarskog programa koji se nudi na prodaju
14080,prava linija koja prolazi kroz neko telo ili sliku i koja zadovoljava određene uslove.
2111,Živi u rekama
16860,"reč, sintagma ili klauza koji čine deo veće gramatičke konstrukcije"
1007,zamenjivanje imena naslovom (titulom?)
