,Sysnet
2455,čelični ručni alat koji ima male oštre zubiće na nekom delu svoje površine i služi za glačanje drveta ili metala
172,kod koji se sastoji od niske od 8 binarnih cifara pomoću kojih se predstavljaju karakteri
250,Nesmanjena i nenarušena celovitost ili ukupnost.
2787,služba na koju je u feudalizmu vazal obavezan prema svom senioru
8218,Snažan pokret pesnicom ili oružjem.
1079,Čin gnječenja.
16616,zagušiti muljem
19118,"Nekoliko mišića koji izazivaju druge povezane struktura kako bi postali zategnuti, napeti ili čvrsti."
12601,naći mesto za nešto što bi poslužilo kao skladište
14035,zakrivlen na spolja
12739,Tačka u kojoj se tri površi sreću ili presecaju.
17622,reaktor koji se sastoji od spirale od izolovane žice koja uvodi induktivnost u kolo
5039,Bilo koji lek koji uništava bakterije ili sprečava njihov rast.
13516,stanovnik Gambije ili poreklom iz Gambije
14440,bilo koji od raznih organa za kretanje ili naslanjanje kod beskičmenjaka
3,postojan u naklonosti ili odanosti
5602,Grupa parnih brodova koji prevoze za istog vlasnika.
19003,aktivnost usmerena ka postizanju određenog čulnog rezultata
4679,procesi i funkcije organizma.
13504,"koji predstavlja ili odražava izvornik, po kom su ostale slične stvari oblikovane"
5815,jedan od dva korena spinalnog nerva koji prolazi dorzalno u kičmenoj moždini i sastoji se od senzornih vlakana
8615,Organ čula vida.
10819,Tanke zmije koje se brzo kreću.
4692,zaslađena kafa u koju je dodat irski viski i šlag
14222,tehnička škola koja sprovodi nastavu u mnogim industrijskim veštinama i primenjenim naukama
12759,koji ima određenu i visoko organizovanu strukturu
1511,"ukrašavanje materijala figurama, bojama ili drugim šarama"
10711,doktrina koju prihvataju sledbenici enke filozofije
7358,novčana jedinica Urugvaja
10361,simptom koji se ogleda u izbijanju crvenila na koži
19267,Postati ukočen ili krut.
71,Red rasprostranjen po celoj zemlji zemaljskih ptica koje imaju malu glavu i kratke noge sa četiri prsta bez opni.
36,Učiniti da se nešto podeli ili odvoji.
16120,Učiniti poravnatim.
673,ugaono rastojanje između linija koje spajaju Zemljino središte sa posmatračem i sa posmatranim nebeskim telom
4621,proces u kom se primenjuje psihoanalitička teorija.
13145,azijski hram ; obično piramidalni toranj sa krovom koji je zakrivljen prema gore
10903,stanovnik ostrva Samoa ili poreklom sa ostrva Samoa
15211,Krv struji kroz cirkulatorni sistem.
14842,vodom natopljeno tlo; mekana vlažna zemlja
8660,vrste kobasica ili mesnih vekni koje su sečene i servirane hladne
15151,pokušavati da se spreči otkrivanje (posebno od strane policije)
10296,vodena ptica iz roda Gallinula rezlikuju se od liske po tome što liče na domaću kokoš
15750,"Dodirnuti, dotaći, očešati."
15881,"Bobičav plod crvene ili crne boje, oporog ukusa, koristi se uglavnom za dzemove i želee."
4397,odbiti ulazak ili članstvo
4411,"prolaz kroz ili ispod nečega, obično pod zemljom (posebno za vozove ili automobile)"
4768,bilo koja biljka koja istiskuje gajene biljke
11865,Čin teranja.
7578,tekst koji je otkucan ili ištampan na papiru
87,Osećati snažnu antipatiju i odbojnost prema nekome.
11261,Nedostatak darežljivosti; nesklonost da se da novac.
12931,znak (`) koji se stavlja iznad vokala kako bi označio naročit način njegovog izgovora
2131,manometar za merenje krvnog pritiska
7627,Iznos koji se plaća pre nego što se zaradi.
12009,grubo zrnasta stena sastavljena od oštrih fragmenata utisnutih u glinu ili pesak
10848,Duže opštenje (često interaktivno) koje se bavi nekom određenom temom.
10932,Otići po nešto i doneti ga.
13326,"Idealizovana slika neke ličnosti, obično roditelja koja se formira u detinjstvu."
12332,pronalazač iz SAD-a koji je izumeo sistem za zapis alfanumeričkih podataka na bušene karitce (1869-1929)
9538,izraziti ili potvrditi klimanjem
12118,Zbiti se.
6778,u grčkoj mitologiji Muza pevanja i duhovnog plesa
8132,"Veličina nečega u određenom pravcu (pre svega, dužina, širina ili visina)."
1784,svaka supstanca (kao toksin i enzim) koja podstiče proizvodnju antitela.
5240,tisa
7268,Napraviti kopiju.
594,polomiti ili skinuti pečat sa nečega
14011,Biljka koja segaji zbog jestivih mladih izdanaka i sočnog lišća.
18509,Samo jedna vrsta; usparvna azijska trava sa velikim cvetovima.
1876,"Papagaj sa krestom iz Australije, beo ili živih boja; često se gaji u kavezu."
11887,Vlakno nastalo od istoimene biljke od koga se prave konopci ili sagovi.
4295,Spomenak
13488,vlada lokalne oblasti
19011,"meko, mesnato jastuče koje se nalazi na donjoj površini stopala životinja ili ljudskog prsta"
9284,"koji se tiče Norveške, njenih ljudi i kulture"
18015,gazirano piće sa ukusom korena sarsaparile ili sa uljem breze ili lovora
7814,morska riba iz istoimene familije; ova riba je tradicionalno jelo na celom Mediteranu i potiče iz hladnih mora severnog Atlantika
17752,Beli leptir čiji se larva hrani na kupusu.
18663,Neka od više biljaka iz roda Mirabilis čiji se cvetovi otvaraju kasno popodne.
9956,Tipski rod porodice Ardeidae: čaplje.
2980,uzrokovati da šta prođe
3434,jedinica za merenje atmosferskog pritiska
2959,Rod biljaka.
18840,Dodir usnama.
4163,igla sa kukom na kraju - koristi se za heklanje
16554,putovanje preko (kopnene ili morske površi) avionom
16625,Evroazijski golub sa belom prugom oko vrata.
3987,koktel napravljen od džina ili vodke i soka od limuna
6408,južnokavkaski jezik koji ima 3 miliona govornika i dugu književnu tradiciju
15627,Promeniti se iz gasovitog u tečno stanje
15753,grupa ljudi koja živi po pravilima vere
6232,"španski pisac koji je ostao upamćen po delu ""Don Kihot"" u kome na satiričan način govori o viteštvu; ovo delo je značajno uticalo na razvoj romana (1547-1616)"
8564,Traka svetlosti koja dolazi iz jednog izvora.
9310,deo gramatike koji se bavi kombinovanjem prostih reči u složene
11205,"žuti mineral (As2S3) koji se javlja zajednoi sa realgarom, ruda arsena"
14569,Progresivno ometanje koje se prenosi bez pomeranja samog sredstva (fizika).
10806,sistem povezanih mera
17893,Biljka sa pacifičkih ostrva; gaji se zbog jestivog korena u umerenim područjima i kao ukras zbog velikog sjajnog lišća.
4558,svečani čin valdaočevog ustoličenja
5364,"porodica proteina koji se nalaze u krvi, mleku, mišićima i biljnom semenu"
10288,Neko (posebno dete) ko uči od nastavnika.
290,Osećanje zabrinutosti.
1491,Odevni predmet koji pada od struka; nose ga uglavnom žene.
7650,Rastaviti se u deliće.
7367,Broj koji predstavlja veličinu za koju se predpostavlja da ima fiksnu vrednost u određenom matematičkom kontekstu.
7270,Pridati značenje nečemu.
7165,snabdeti odećom ili odenuti
15220,"bantu jezik kojim govori narod Kongo koji živi u tropskim šumama Zaira, Konga i Angole"
14857,podgrupa altajskih jezika
16793,"ljubičasto tropsko voće koje raste u Brazilu, oblika grožđa sa debelom korom"
11273,Trošiti neoprezno i lakomisleno.
18848,Čin upravljanja; sprovođenje vlasti.
13112,pas srednjeg rasta specijalno uzgajan za potrebe lova na lisice
8758,slikane strukture na scenskoj podlozi koje imaju za cilj da predstave određeni lokalitet
269,"neraspoznatljiv, nejasnih obrisa"
4902,indijski jezik kojim govori većina stanovnika Pendzaba u severoistočnoj Indiji
12411,rod bakterija
58,Koji nije u skladu sa metodama ili principima nauke.
155,osobina prefinjene uglađenosti i dobrog ukusa
1659,Medijum koji širi pokretne slike.
252,"Zadovoljno stanje sreće, zdravlja i prosperiteta."
537,vrsta malog goluba
3928,testenina u obliku kratkih tuba sa dijagonalno sečenim krajevima; glatka testenina koja se najčešće koristi za pripremanje različitih vrsta supa
406,Čin smanjivanja ili redukovanja nečega.
17262,"Velika vrba iz Evrope, Azije ili severne Afrike, ima sivkasto lišće i sivkastu koru."
3103,koji se odnosi na kombinacije i uređenje elemenata u skupove
17817,"Neki od više jestivih morskih ljuskara iz porodica Homaridae, Nephropsidae i Palinuridae."
2101,suvozemne kornjače
14668,vrsta školjki čije je telo jestivo; postoji više stotina vrsta ostriga od kojih su neke zaštićene vrste
5146,kanonske molitve koje svakodnevno izgovaraju sveštenici (u rimokatoličkoj crkvi)
221,Učiniti lepšim.
10936,Tipski rod porodice Culicidae: rasprostranjen rod komaraca koji se odlikuju time što im je telo paralelno sa površinom na kojoj stoje.
1187,Evropska trava sa sastavljenim lišćem i belim cvetovima.
424,bilo koji od dva znaka interpunkcije ({ ili }) koji služe da zagrade deo teksta
10204,Čin korišćenja.
5774,"Stanje nečega što je zajedno, ujedinjeno ili povezano."
11303,država kojom upravlja sultan
1724,novinar angažovan da pribavlja nove priče za novine ili za objavljivanje putem medija
13281,Nivo postojanja ili razvoja.
263,Profesor najvišeg ranga.
16842,Putanja po kome se nešto kreće ili na kojoj je prostrto.
11666,Ukupna vrednost imovine za oporezivanje.
11756,Pokretni gornji deo nekog kontejnera koji ga zatvara i otvara; može biti na šarkama ili ne.
19437,ivažna jestiva riba; nalazi se u ogromnim jatima u severnom Atlantiku
108,deo Euharistije u kojoj se hleb i vino prinose Bogu
17740,deo pečenice između ravne kosti i dela mesa koji se koristi za porterhaus biftek
13828,Udisati vazduh u pluća i izdisati ga.
9013,onaj koji je kompetentan u mnogim oblastima i sposoban da se lako prebacuje sa jedne teme na drugu;
10013,"Korozivni nemetal, teška crvenomrka tečnost zagušljivog mirisa, pripada halogenim elementima; nalazi se u morskoj vodi."
455,Rod iz familije Felidae: prave mačke i većina divljih mačaka.
3663,govornička figura u kojoj je namerno poremećen red rečenoičnih delova
18255,čin intervenisanja (kako bi se posredovalo u sporu)
4841,"stenoviti rt koji pripada Čileu, najjužniji vrh Južne Amerike, južno od Ognjene Zemlje"
2865,"Porodica velikih ptica nalik noju, uključuje kazuara."
7895,neki ples koji parovi izvode u balskoj dvorani
9009,Ptica koja živi u barama i jezerima.
17950,Zmije.
9640,Slika realizovana na površini zida.
4572,Rod žbunja i drveća iz porodice Rosaceae koji imaju perasto lišće.
5150,Zrak mesečeve svetlosti.
16216,naelektrisani atom ili grupa atoma; jonsko naelektrisanje potiče od gubitka ili dobitka elektrona
4940,"korpus pravila, regulative, naloga i odluka koje donose administrativne agencije vlade"
6073,Skup pravila koja nameće autoritet.
65,Onaj koji nije običan; nije konevencionalan ili konformist.
6690,Velika porodica dikotiledonskih biljki iz reda Rosales; imaju naizmenično poređane neparno poređane listove.
3394,"Kancelarija u kojoj se obrađuju vesti za novine, novinsku agenciju, televiziju ili radio stanicu."
4840,tanka ploča ili sloj nekog tkiva
11695,Rod familije Ursidae: mrki medved; u nekim klasifikacijama rod Ursus uključuje sve medvede.
3657,voće (pogotovo breskve) čije je meso čvrsto obavijeno oko koštice
7685,turkijski jezik kojim govore Čuvaši
1802,vezano za prideve; koji se stavlja ispred imenica koje modifikuje
13537,Nemački kompozitor instrumentalne muzike (posebno simfonijske i kamerne muzike); nastavio je da komponuje i pošto je ogluveo (1770-1827).
13369,Alge zelene boje ili bezbojne; slobodno se kroću u morskoj ili slatkoj vodi.
5717,podići visinu tona (muzičke note)
19150,"o komediji, koji se odnosi na komediju ili je karakterističan za komediju"
13078,Ljudi koji žive u jednoj zemlji.
731,status onoga čiji roditelji nisu bili u braku
2958,"reč koja modifikuje nešto drugo, a ne imenicu"
5603,Vrsta plućnog tkiva koje se sastoji od alveola a nalaze se na  kraju disajnih puteva. To su mehuri vazduha gde se obavlja razmena gasova. Svaka alveola je okružena kapilarima koji dovode krv zasićenu ugljen dioksidom a odvode krv zasićenu kiseonikom. Zid alveola i membrane kapilara su tanke tako da gasovi lako prelaze iz krvi i u krv čistom difuzijom.
17326,riba s kostima iz podklase Teleostei
13563,padati u kapima
4931,"Naljutiti, posebno nevažnim uzrocima."
113,bilo koji predmet tople osećajnosti ili odanosti
12886,Materijal napravljen od celulozne pulpe koja se dobija uglavnom od drveta ili nekih trava.
12645,komadni stoni pribor u kome se služi jelo
17958,svrake
2495,nastati; kakvu formu ili oblik preuzeti
14839,o čemu propise ukinuti
4737,kartica ili značka koja se koristi da bi se njezin nosilac mogao identifikovati
7935,Razmena dobara za dogovorenu sumu novca.
15933,Nešto što se dogodi.
18742,koji se odnosi na Sloveniju njene ljude i kulturu
2301,žuta Pipin jabuka sa karakterističnim ukusom
11963,Promena sa jednog mesta ili stanja ili stepena u drugo.
6043,utvrđeni sistem simbola koji se koristi za zapisivanje nečega
8696,"Biljka koja rađa veoma ljut izdužen, najčešće crveni, plod."
7874,put ka ulazu ili izlazu
19017,čelik čije karakteristike su određene dodavanjem drugih elemenata osim uglja
1244,Osnova na kojoj se nešto temelji.
3420,Stena koja je nastala hlađenjem i stvrdnjavanjem magme.
17033,osoba nemačke nacionalnosti
1742,Autoritativna uputa ili naređenje da se nešto uradi.
12314,"čadski jezik kojim se govori u severnoj Nigeriji, blizak jeziku hausa"
2345,u grčkoj mitologiji nimfa koja se pretvorila u lovorovo drvo da bi pobegla od zaljubljenog Apolona
3606,Kretati se u velikom broju.
8642,Napraviti film ili fotografiju nečega.
2463,biti podvrgnut promeni ili razvoju
375,"duhovit, satiričan stih koji obuhvata dve rimovane strofe i pominje poznate ličnosti"
3390,žitarice koje se služe vruće
15286,Prijatelji su se rastali posle zabave.
13728,otvoren ispust u zidu u podnožju dimnjaka gde se može paliti vatra
6874,pomorska bitka koja se odigrala 1805. kod jugozapadne obale Španije; Engleska pod komandom admirala Nelsona je porazila Francusku i Špansku flotu
14934,znak interpunkcije koji se koristi kada u tekstu treba naznačiti da je neka reč izostavljena
11637,bilo koje od malih tela koja putuju svemirom oko Sunca
10723,Koji se dešava na početku nekog vremenskog perioda ili sleda događaja ili koji se dešava pre nekog uobičajenog ili očekivanog vremena.
5541,"koji se tiče bivše države Jugoslovije, njenih ljudi i kulture"
4758,gvozdeni ili kožni klinčić na đonu kopačke
9898,"drvenasta penjačica, obično tropskih predela"
322,Slaba sposobnost da se razume iskustvo ili profitira iz njega.
10116,revolucija protiv carske vlasti koja je dovela do abdikacije cara Nikolaja II i do stvaranja provremene vlade marta 1917
865,"u računarstvu, program koji prevodi i izvršava iskaze izvronog jezika red po red"
10145,"Gledati, tumačiti i izgovarati naglas nešto što je napisano ili odštampano."
5077,napustiti ili zameniti nečim drugim
14992,Čin stvaranja nečega pomoću mišljenja.
18899,"forma stiha sa šemom rime: qbq bcn cdc, itd."
10522,"Suvo seme koje se dobija iz žitnih trava: pšenica, raž, itd."
7606,Izazvati da se pokrene udarcem.
18346,isključivanje iz crkve ili iz religijske zajednice
8108,Ljudi u društvu posmatranom kao sistem koji je organizovan po karakterističnom obrascu odnosa.
18382,Neko ko se prvi nečega doseti ili nešto napravi.
8069,"koji se odnosi na Belgiju, njene ljude i kulturu"
15591,Zmija otrovnica sa rožnim prstenovima na raju repa koji zveče pri kretanju.
9652,Najprimitivnije ?teleost ribe; sve imaju meke kosti: losos; pastrmka; haringa; ?shad; sardina; inćun;bela riba; ?smelts; ?tarpon.
10566,"psihoterapija koja se fokusira na akutne kritične situacije (depresivne epizode, pokušaji samoubistva ili predoziranje) sa ciljem da se osoba vrati na nivo funkcionisanja pre krize"
9187,u grčkoj mitologiji drevni bog sunca; putovao je kočijom preko nebeskog svoda svakog dana; u rimskoj mitologiji mu odgovara bog Sol
9068,kapljica čistog solnog i slanog rastvora iz lakrimalnih žlezda
10916,Biljka penjačica iz roda Vanilaima mesnato lišće i velike voštane vrlo mirisne cvetove.
13130,logički element koji obavlja pargovnu operaciju
10100,Odrasla muška osoba (nasuprot ženi).
3643,označiti kao kakvim znakom
11061,desert napravljen od voća uvaljanog u testo koje je najčešće od krompira
12694,a genus of coelenterates
11253,Pozvati kao gosta.
13625,zgrada vlade u kojoj su smeštene administrativne kancelarije gradske vlade
1154,spreman za borbu
11694,"Poluparazitska zimzelena biljka, grm sa kožastim, debelim listićima, zelenožućkastim."
6448,"sadrži pileće, drugo meso ili sir pored povrća i zeleniša"
2954,dodati nekoj reči prefiks
4803,Akt učestvovanja u Euharistiji
5175,korišćenje računara za prevođenje s jednog jezika na drugi
15112,Grlica
1182,"(računarstvo) programska aplikacija koja se može sastojati od nekoliko koraka, ali predstavlja jedinstvenu logičku celinu"
6903,onaj koji emituje svetlost nakon izlaganja zračenju iz spoljnog izvora
19121,naoblačiti se
7705,Norveški autor epohe realizma koji je pisao komade na društvene i političke teme (1828-1906).
626,"učestvuje u izgradnji ćelijskog skeleta, odnosno mikrofilamenata"
1747,liker sa ukusom semena kima ili kimina
14428,Prekinuti nečije zaposlenje.
2306,Zatvoreno oklopno vojno vozilo; ima top i kreće se na gusenicama.
6170,"okrugli objekat koji se u igrama udara, baca ili šutira"
16309,koji se odnosi na parametre
196,not standard; not accepted as a model of excellence
14901,u grčkoj mitologiji Muza komedije i pastoralnog pevanja
4825,Drveni ili metalni potporanj koji je čvrsto postavljen u uspravni položaj.
14694,"prostor odvojen za rad, npr. u kancelariji"
2195,"programski jezik višeg nivoa koji se koristio za matematičke i naučne primene; naziv potiče od"" formula translation"""
1497,jumanski jezik kojim govori narod Kokopa
5075,novčana jedinica Iraka
19235,Otvor ili rupa koja vodi u telesnu šupljinu.
11826,kome kakav zadatak ili odgovornost za kakav posao poveriti 
10846,odnosi se na društva kojima nedostaje kapital za industrijalizaciju
13299,"bavljenje ribolovom ne kao zanimanjem nego kao zabavom, sportom"
12499,Kuhinjski pribor za okretanje sa uskom pokretnom oštricom.
9402,Neko severnoameričko drvo ili žbun sa upadljivim belim cvetovimai jestivim plavo-crnim ili ružičastim voćem.
5722,tropska azijska biljka od koje se pravi krotonovo ulje
12351,"Zeljasta biljka i umerenih severnih područja iz roda Sedum; ima mesnato lišće i revene, žute ili bele cvetove."
6117,finski jezik kojim govore Mordvini
9248,skup dirki na muzičkom instrumentu
652,bantu jezik od velikog književnog značaja u jugoistočnoj Africi
1906,red podklase Telosporidia
11976,Nešto što je stvoreno slaganjem nekoliko stvari koje tvore jedinstvenu celinu.
4267,Podudara se sa familijom Punicaceae.
1322,Telo koje čine članovi organizacije ili grupe.
16135,velika crna ptica neletač Australije i Nove Gvineje koja ima rožnatu krestu na glavi.
15469,"mesto koje je otvoreno do kasno noću i koji pruža zabavu (npr. pevače ili plesače), kao i ples, hranu i piće"
1259,"O industriji, koji se odnosi na industriju ili iz nje proističe."
5660,"noćna ptica širokog kljuna, lovi insekte"
12141,osnivač Rima; njega i njegovog brata Rema je othranila vučica pošto su ih roditelji (Mars i Rej Silvije) odmah po rođenju pustili niz Tibar;kasnije je ubio brata Rema zbog svađe oko izgradnje rima
2031,"Ribe, vodozemci, gmizavci, ptice i sisari."
15512,grana germanskih jezika
13891,mirisna istočnoazijska grmolika biljka iz roda usnatica
992,srednjovekovni provincijski dijalekat francuskog kojim se govorilo u centralnoj i severnoj Francuskoj
188,Postati stabilan ili stabilniji.
3458,Rod dikotiledona iz porodice Rosaceae.
16085,sir istopljen sa pivom i poslužen na tostu
1627,Malo zimzeleno evropsko drvo koje rađa skarletne bobice sa mnogo semenki koje su jestive ali blage.
9177,koji se odnosi na ili pripadaja ili karakteriše visoko društvo
1571,Neki od raznovrsnih ?decidous žbunova iz roda Ribes koji rađa bobice.
17858,deo istočnog Jonskog mora između centralne Grčke i Peloponeza
9499,"parčići hleba umočeni u jaja i mleko i prženi; prelivaju se šećerom, voćem ili sirupom"
13617,(računarstvo) operacije čitanja ili pisanja uskladištenih informacija
94,naneti nekome nepravdu
17041,široko rasprostranjeni lišajevi
9505,nediferencirana embrionalna ćelija
10456,"čestica za koju važi Boze-Ajnštajnova statistika, ali za koje na važi Paulijeva princip isključenja"
270,istorijsko područje na severozapadu Indije i severu Pakistana
4677,"Velika ptica-ronilac sa ćubom, jede ribu, ima tanak izvijen kljun."
18361,"glagolsko vreme kojim se označava radnja, stanje ili zbivanje koji se vrše u vreme kada se o njima govori"
5323,govoriti nerazumljivo u religijskoj ekstazi
2368,riba masnog crvenog mesa koja se nalazi u priobalnom Pacifiku i rekama
2268,"Male ptice koje se penju i pužu uz drvo i stene, poreklom sa sverne hemisfere."
14805,koščato meso ribe koja liči na haringu; obično se hvata tokom migracije u slatke vode radi mrešćenja
14829,Neka od različitih biljaka iz roda Syringa koja ima velike grozdove obično mirisnog cveća.
5752,Osoba čije je zanimanje da šije i popravlja odešu.
9762,"okov koji se sastoji od metalne petlje koja se može zaključati oko zgloba, obično se koristi u parovima"
5883,katalog koji u alfabetskom poretku sadrži popis pretplatnika i njihove telefonske brojeve
4089,koji se odnosi na kamen ili je od njega sastavljen
12147,užasno morsko čudovište koje simbolizuje zlo u Starom zavetu
3495,Neka od mnogih biljkaka koje cvetaju uglavnom ujesen iz roda Aster i maju cvetove u obliku margarete.
8291,Višegodišnja biljka sa kržljavim listovima (uski i nazubljeni); korovska biljka koja se upotrebljava u medicini.
1945,Nadmetanje (stvarno ili figurativno) za narodnu podršku.
8578,Nefikcionalna proza koja čini nezavisan deo publikacije.
10197,most čiju konstrukciju drže lanci na oba kraja mosta
6454,centralno i najveće ostrvo Japana
17796,višak telesne težine
7242,novčana jedinica Mozambika
11400,sistemi koji se koriste za transmitovanje poruka na razdaljinu elektronskim putem
9188,Mali evroazijski jelen.
12018,ispeći na roštilju
4309,koji se odnosi na megnetizam proizveden električnom strujom
4345,gornja površina sobe
18815,kamarupski jezici kojima se govori u državi Asam u severoistočnoj Indiji
2017,školski zadatak koji učenik ispunjava da bi zadovoljio zahteve nastavnika
2003,Biti u pokretu zbog neke struje vazduha ili vode.
16824,neko ko u spoljnoj politici oružanom sukobu pretpostavlja pregovore
10656,morske protozoe
13303,krvna grupa čija crvena krvna zrnca nemaju Rh faktor.
6349,Mašina koja obrađuje materijal melvenjem ili razbijanjem.
2341,"pohađati akademske kurseve, ne prihodujući bodove"
8408,"Jedna od dve porodice velikih vodenih sisara-travojeda, bez zadnjix udova, sa prednjim udovima nalik perajima."
17053,"burbon, šećer i menta preko mrvljenog leda"
18017,"žuto sivi medved iz Sirije, ugrožena vrsta"
1758,Broj predstavljen u notaciji sa pokretnim zarezom.
18235,voda koja se kondenzovala na hladnoj površini preko noći od vodene pare u vazduhu
7591,štamparska ploča koja se koristi u procesu graviranja
11009,hemijsko jedinjenje koje postoji u oblicima koji imaju različit raspored atoma ali istu molekularnu težinu
12990,"Veliki rod biljaka koje rastu u vlažnim šumama, jarkovima i uz vodu: šaš."
11148,Polaznik koji se upisao u neku obarzovnu instituciju.
42,"Neka od varijeteta vrežaste biljke čiji plod ima koru u režnjevima, jestivo mirisno meso."
9695,Grupa ljudi koji zajedno žive u kampu.
6200,delovati kasnije nego što je planirano
8701,jede se kao kaša od kukuruznog brašna ili kao mlečna kaša
320,Male ptice pevačica koje liče na ševe.
1140,Staviti u pokret.
6395,Deo prirodnog objekta.
12724,povećanje gustine nečega
9979,informacija koja podržava statistiku procenu budućih događaja
6591,stanica koja služi kao štab za policiju u određenom okrugu (služi kao mesto odakle se policija šalje i na koje se dovode uhapšenici)
17418,koji se odnosi na ili se bavi estetikom
771,Irvas ili sob.
575,Dete koje je ženskog pola.
11894,"u grčkoj mitologiji jedna od Plejada, ćerka Atlasa i Plijone"
11350,gorionik koji meša vazduh i gas kako bi proizveo vrlo vrući plamen
18817,grupa vulkanskih i koralnih ostrva u centralnom delu Tihog okeana
12790,Deo mleka koji sadrži masnoću.
5999,brod koji pogoni jedna ili više parnih mašina
18922,any of several evergreen shrubs and small trees of the genus Illicium
6845,Veliko zimzeleno drvo toplih područja iz čijeg se aromatičnog stabla dobija kamfor.
1720,kadoanski jezik kojim govori narod Arikara
5148,"Uobičajeni evroazijski ljiljak; danju miruje po napuštenim prostorijama, dockan izlazi u lov; svađa se sa drugim ljiljcima."
14494,grana biologije koja proučava gljive i bolesti koje one izazivaju
4759,Škola koja podučava studente sa udaljenim mestom stanovana putem pošte.
1933,električni prekidač koji funkcioniše pritiskom na dugme
12109,racers
16754,Vremenski period proveden u vojnoj službi.
8333,kartica na kojoj se podaci beleže uz pomoć ubušenja
3756,javna zgrada za kockanje i zabavu
2105,any of various trees of the genera Eucalyptus or Liquidambar or Nyssa that are sources of gum
2432,Razred koji se poklapa sa porodicom Juglandaceae.
2832,"Mehanizam pomoću koga se nečim upravlja, posebno motor vozila."
1670,Germanski karakter koji vodi poreklo od runa
44,nejasno i neprijatno osećanje koje se ima u iščekivanju nekog lošeg ishoda
4025,glas nevidljivog komentatora u filmu ili televizijskom programu
15470,teritorija kojom upravlja knez
8182,Odnos nečega prema nečem drugom.
16743,koji je povezan ilipripada ili se koristi u mornarici.
19046,Ne ostvariti ni profit ni gubitak.
12100,(filozofija) doktrina da znanje proizlazi iz iskustva
8156,(filozofija) filozofska teorija prema kojoj smo mi sami samo ono za šta znamo da postoji
17812,"napeta avanturistička priča, pozorišni komad ili film"
